{
  "filename": "26_alco_36px.png",
  "status": "success",
  "description": {
    "detailed_description": "This font is a playful and whimsical collection of hand-drawn icons depicting various alcoholic beverages. Each icon is rendered with a loose, expressive line, capturing the casual charm of a hand-sketched design. The varying levels of detail and the use of both filled and outlined forms create a sense of visual interest and informality. The font's overall character is lighthearted and inviting, suggesting a relaxed and enjoyable social setting. The icons are well-suited for use in menus, signage, and promotional materials related to bars, restaurants, and events. The font's informal style evokes a sense of community and shared experience, making it ideal for conveying a friendly and approachable atmosphere. The hand-drawn nature of the icons adds a personal touch, suggesting a handcrafted quality and a connection to the human element of the experience.",
    "technical_characteristics": [
      "Hand-drawn style",
      "Varying levels of detail",
      "Combination of filled and outlined forms",
      "Expressive linework",
      "Informal and playful proportions"
    ],
    "personality_traits": [
      "Whimsical",
      "Playful",
      "Informal",
      "Inviting",
      "Lighthearted"
    ],
    "practical_contexts": [
      "Bar and restaurant menus",
      "Event signage",
      "Promotional materials",
      "Social media graphics",
      "Web design elements"
    ],
    "cultural_intuition": [
      "Evokes a sense of community and shared experience",
      "Suggests a relaxed and enjoyable social setting",
      "Conveys a friendly and approachable atmosphere",
      "Reflects a contemporary trend towards hand-drawn aesthetics",
      "Captures the spirit of casual dining and entertainment"
    ],
    "search_keywords": [
      "Hand-drawn",
      "Icons",
      "Alcohol",
      "Beverages",
      "Bar",
      "Restaurant",
      "Menu",
      "Signage",
      "Promotional",
      "Event",
      "Social media",
      "Web design",
      "Whimsical",
      "Playful",
      "Informal",
      "Inviting",
      "Lighthearted",
      "Casual",
      "Community",
      "Experience",
      "Friendly",
      "Approachable",
      "Handcrafted"
    ]
  }
}