{
  "filename": "32768_no_36px.png",
  "status": "success",
  "description": {
    "detailed_description": "This font is a playful exploration of handwritten script, characterized by its fluid, rounded forms and expressive letterforms. The construction is primarily organic, with each letter flowing seamlessly into the next, creating a sense of continuous movement. The generous curves and rounded terminals contribute to a friendly and approachable aesthetic, while the uneven baseline and varying letter heights add a touch of whimsy. The font's overall character is lighthearted and informal, suggesting a sense of personal expression and creativity. It evokes a nostalgic feeling, reminiscent of childhood scribbles and handwritten notes, yet its contemporary execution makes it feel fresh and relevant. While its organic nature might limit its legibility in smaller sizes or dense text blocks, it excels in display applications, particularly for headlines, logos, and branding elements where its playful personality can shine. Its cultural associations range from the carefree spirit of childhood to the DIY aesthetic of contemporary digital culture, making it a versatile choice for projects seeking a touch of personality and charm.",
    "technical_characteristics": [
      "Organic construction",
      "Rounded terminals",
      "Uneven baseline",
      "Varying letter heights",
      "Generous curves",
      "Fluid letterforms",
      "Expressive character",
      "Handwritten aesthetic"
    ],
    "personality_traits": [
      "Playful",
      "Whimsical",
      "Informal",
      "Friendly",
      "Approachable",
      "Expressive",
      "Nostalgic",
      "Creative",
      "Charming"
    ],
    "practical_contexts": [
      "Display typography",
      "Headlines",
      "Logos",
      "Branding elements",
      "Social media graphics",
      "Children's books",
      "Handwritten-style designs"
    ],
    "cultural_intuition": [
      "Childhood scribbles",
      "Handwritten notes",
      "DIY aesthetic",
      "Contemporary digital culture",
      "Nostalgic charm",
      "Personal expression"
    ],
    "search_keywords": [
      "Handwritten",
      "Script",
      "Playful",
      "Whimsical",
      "Informal",
      "Rounded",
      "Organic",
      "Display",
      "Headline",
      "Logo",
      "Branding",
      "Social media",
      "Children's",
      "Nostalgic",
      "Creative",
      "Charming",
      "Digital",
      "DIY",
      "Contemporary"
    ]
  }
}