{
  "filename": "5_zlash_36px.png",
  "status": "success",
  "description": {
    "detailed_description": "This font is a bold statement of angularity, built on a foundation of sharp, geometric shapes. Each letterform is constructed from a series of angled lines, creating a distinct and dynamic visual impact. The extreme slant of the letters, combined with the bold weight, adds a sense of speed and energy. The overall effect is one of aggressive modernity, reminiscent of cyberpunk aesthetics and futuristic design. While the sharp angles and bold weight might seem intimidating at first glance, the font's open counters and consistent stroke width ensure good legibility, making it suitable for headlines, logos, and other applications where a strong visual presence is desired. The font's bold, angular character evokes a sense of power and authority, making it ideal for projects that require a commanding presence. Its futuristic aesthetic suggests a connection to technology, innovation, and the cutting edge of design.",
    "technical_characteristics": [
      "Geometric construction",
      "Extreme slant",
      "Bold weight",
      "Sharp angles",
      "Open counters",
      "Consistent stroke width"
    ],
    "personality_traits": [
      "Aggressive",
      "Modern",
      "Dynamic",
      "Powerful",
      "Authoritative",
      "Futuristic",
      "Energetic"
    ],
    "practical_contexts": [
      "Headlines",
      "Logos",
      "Posters",
      "Gaming",
      "Science fiction"
    ],
    "cultural_intuition": [
      "Cyberpunk aesthetics",
      "Futuristic design",
      "Technological innovation",
      "Urban energy",
      "Modernity"
    ],
    "search_keywords": [
      "Geometric",
      "Slant",
      "Bold",
      "Angular",
      "Sharp",
      "Open counters",
      "Consistent stroke",
      "Aggressive",
      "Modern",
      "Dynamic",
      "Powerful",
      "Authoritative",
      "Futuristic",
      "Energetic",
      "Headlines",
      "Logos",
      "Posters",
      "Gaming",
      "Science fiction",
      "Cyberpunk",
      "Technology",
      "Innovation",
      "Urban",
      "Modernity"
    ]
  }
}