{
  "filename": "99%_occupy_36px.png",
  "status": "success",
  "description": {
    "detailed_description": "99% Occupy is a bold, expressive typeface that draws inspiration from hand-drawn lettering styles. Its organic forms and irregular strokes create a sense of immediacy and personality. The font's construction is characterized by a combination of geometric and calligraphic elements, resulting in a unique blend of structure and fluidity. The letterforms are generally rounded, with pronounced curves and angled terminals, contributing to a dynamic and energetic feel. The overall character of the font is playful and approachable, suggesting a sense of fun and informality. Its contemporary relevance lies in its ability to capture the spirit of digital culture, where hand-drawn aesthetics are often celebrated. 99% Occupy is well-suited for branding projects, social media graphics, and other applications where a casual and engaging tone is desired. Its bold weight and expressive nature make it particularly effective for headlines and short bursts of text, adding a touch of personality and visual interest.",
    "technical_characteristics": [
      "Bold weight",
      "Organic forms",
      "Irregular strokes",
      "Rounded letterforms",
      "Pronounced curves",
      "Angled terminals",
      "Geometric and calligraphic elements",
      "High x-height",
      "Open counters"
    ],
    "personality_traits": [
      "Playful",
      "Approachable",
      "Energetic",
      "Expressive",
      "Casual",
      "Informal",
      "Bold",
      "Dynamic",
      "Hand-drawn",
      "Unconventional"
    ],
    "practical_contexts": [
      "Branding projects",
      "Social media graphics",
      "Headlines",
      "Short bursts of text",
      "Display typography",
      "Casual signage",
      "Digital interfaces"
    ],
    "cultural_intuition": [
      "Contemporary digital culture",
      "Hand-drawn aesthetics",
      "Street art",
      "Urban culture",
      "Informal communication"
    ],
    "search_keywords": [
      "Bold",
      "Hand-drawn",
      "Expressive",
      "Playful",
      "Casual",
      "Organic",
      "Geometric",
      "Calligraphic",
      "Rounded",
      "Angled",
      "High x-height",
      "Open counters",
      "Branding",
      "Social media",
      "Headlines",
      "Display",
      "Digital",
      "Street art",
      "Urban",
      "Contemporary"
    ]
  }
}