{
  "filename": "a_adulsa_script_36px.png",
  "status": "success",
  "description": {
    "detailed_description": "The font's flowing curves and dynamic angles create a sense of movement and energy, reminiscent of classic calligraphic scripts. The generous x-height and open counters ensure strong legibility, even at smaller sizes, while the playful swashes and ligatures add a touch of personality. The overall effect is one of warmth and approachability, making it suitable for a wide range of applications, from branding and packaging to social media and website design. The font's contemporary relevance lies in its ability to convey a sense of authenticity and human connection, while its cultural associations evoke a sense of nostalgia and charm, reminiscent of vintage signage and handwritten notes. The font's technical foundation is rooted in traditional calligraphy, but it has been carefully adapted for digital use, with a focus on smooth curves and consistent stroke weights. The font's performance characteristics are excellent, with a high degree of legibility and a pleasing visual flow.",
    "technical_characteristics": [
      "flowing curves",
      "dynamic angles",
      "generous x-height",
      "open counters",
      "playful swashes",
      "ligatures",
      "consistent stroke weights"
    ],
    "personality_traits": [
      "energetic",
      "approachable",
      "warm",
      "charming",
      "authentic",
      "nostalgic",
      "playful"
    ],
    "practical_contexts": [
      "branding",
      "packaging",
      "social media",
      "website design",
      "handwritten notes"
    ],
    "cultural_intuition": [
      "vintage signage",
      "handwritten notes",
      "authenticity",
      "human connection",
      "nostalgia"
    ],
    "search_keywords": [
      "script font",
      "calligraphy",
      "flowing",
      "dynamic",
      "legible",
      "playful",
      "swashes",
      "ligatures",
      "branding",
      "packaging",
      "social media",
      "website design",
      "vintage",
      "nostalgic",
      "authentic",
      "human connection",
      "contemporary",
      "digital"
    ]
  }
}