{
  "filename": "a_agressive_winter_36px.png",
  "status": "success",
  "description": {
    "detailed_description": "Aggressive Winter is a display typeface that embodies a raw, hand-drawn aesthetic. Its construction is characterized by bold, uneven strokes with a distinct texture reminiscent of a brush or marker. The letterforms are generally geometric, with sharp angles and pronounced serifs, but they are infused with a sense of organic irregularity. This combination creates a dynamic tension between controlled structure and expressive freedom. The font's high x-height and open counters ensure legibility even at large sizes, making it suitable for headlines and branding elements. Its bold, assertive character evokes a sense of grit and authenticity, suggesting a connection to street art, punk rock, or independent design. While its rough edges might not be ideal for extended body text, Aggressive Winter excels in capturing attention and conveying a rebellious spirit. It's a font that speaks to a generation that values authenticity and individuality, finding beauty in the imperfections of hand-crafted expression.",
    "technical_characteristics": [
      "Hand-drawn aesthetic",
      "Uneven strokes",
      "Geometric construction",
      "Sharp angles",
      "Pronounced serifs",
      "High x-height",
      "Open counters"
    ],
    "personality_traits": [
      "Bold",
      "Assertive",
      "Gritty",
      "Authentic",
      "Rebellious",
      "Expressive",
      "Unconventional"
    ],
    "practical_contexts": [
      "Headlines",
      "Branding elements",
      "Posters",
      "Logos",
      "Street art"
    ],
    "cultural_intuition": [
      "Street art",
      "Punk rock",
      "Independent design",
      "Rebellious spirit",
      "Authenticity"
    ],
    "search_keywords": [
      "Display typeface",
      "Hand-drawn",
      "Geometric",
      "Sharp angles",
      "High x-height",
      "Open counters",
      "Bold",
      "Assertive",
      "Gritty",
      "Authentic",
      "Rebellious",
      "Street art",
      "Punk rock",
      "Independent design",
      "Headlines",
      "Branding",
      "Posters",
      "Logos"
    ]
  }
}