{
  "filename": "a_aja_males_36px.png",
  "status": "success",
  "description": {
    "detailed_description": "Aja Males is a bold, playful display font that draws inspiration from hand-drawn lettering styles. Its rounded, irregular forms and exaggerated strokes create a sense of energy and informality. The font's construction is characterized by a combination of geometric and organic elements, resulting in a unique visual language that is both playful and legible. The letterforms are designed with a focus on visual impact, featuring large x-heights and open counters that ensure readability even at smaller sizes. The font's overall character is friendly and approachable, with a touch of irreverence. It evokes a sense of fun and creativity, making it suitable for projects that require a bold and expressive visual identity. Aja Males is particularly effective for headlines, logos, and other graphic elements where its playful personality can shine. However, its irregular forms and bold weight may limit its use in extended body text, especially at smaller sizes. The font's cultural associations are rooted in contemporary street art and graphic design trends, suggesting a youthful and energetic aesthetic. It embodies a sense of individuality and creative expression, making it a popular choice for projects that aim to capture a sense of authenticity and originality.",
    "technical_characteristics": [
      "Rounded, irregular letterforms",
      "Exaggerated strokes",
      "Large x-height",
      "Open counters",
      "Geometric and organic construction",
      "Bold weight",
      "Variable stroke widths"
    ],
    "personality_traits": [
      "Playful",
      "Energetic",
      "Informal",
      "Bold",
      "Expressive",
      "Friendly",
      "Approachable"
    ],
    "practical_contexts": [
      "Headlines",
      "Logos",
      "Posters",
      "Graphic elements",
      "Social media graphics"
    ],
    "cultural_intuition": [
      "Street art",
      "Contemporary graphic design",
      "Youthful energy",
      "Creative expression",
      "Individuality"
    ],
    "search_keywords": [
      "Display font",
      "Hand-drawn",
      "Playful",
      "Bold",
      "Irregular",
      "Rounded",
      "Geometric",
      "Organic",
      "Large x-height",
      "Open counters",
      "Street art",
      "Graphic design",
      "Youthful",
      "Energetic",
      "Creative",
      "Headlines",
      "Logos",
      "Posters",
      "Social media"
    ]
  }
}