{
  "filename": "a_ampun_bang_36px.png",
  "status": "success",
  "description": {
    "detailed_description": "A-mpun Bang is a display typeface that embodies a playful, almost cartoonish energy. Its rounded, bulbous forms are reminiscent of hand-drawn lettering, with exaggerated curves and uneven strokes. The font's construction is decidedly organic, with each letterform feeling like a unique, slightly wobbly shape. This irregularity adds to its charm, creating a sense of whimsy and informality. The bold weight and generous x-height ensure strong legibility, even at larger sizes, making it ideal for headlines, posters, and other attention-grabbing applications. While its playful nature might seem at odds with traditional typographic principles, A-mpun Bang's bold personality and distinct character make it a powerful tool for conveying a sense of fun and energy. Its cultural associations lean towards contemporary pop culture, evoking the playful spirit of comic books, cartoons, and street art. This makes it a perfect choice for projects that aim to capture a youthful, irreverent vibe.",
    "technical_characteristics": [
      "Rounded, bulbous forms",
      "Exaggerated curves",
      "Uneven strokes",
      "Organic construction",
      "Bold weight",
      "Generous x-height"
    ],
    "personality_traits": [
      "Playful",
      "Whimsical",
      "Informal",
      "Bold",
      "Energetic",
      "Cartoonish",
      "Irreverent"
    ],
    "practical_contexts": [
      "Headlines",
      "Posters",
      "Logos",
      "Packaging",
      "Digital interfaces"
    ],
    "cultural_intuition": [
      "Comic book lettering",
      "Cartoon typography",
      "Street art",
      "Contemporary pop culture",
      "Youthful energy"
    ],
    "search_keywords": [
      "Display typeface",
      "Rounded forms",
      "Bold weight",
      "Generous x-height",
      "Organic construction",
      "Playful",
      "Whimsical",
      "Informal",
      "Energetic",
      "Cartoonish",
      "Irreverent",
      "Comic book",
      "Cartoon",
      "Street art",
      "Pop culture",
      "Headlines",
      "Posters",
      "Logos",
      "Packaging",
      "Digital interfaces"
    ]
  }
}