{
  "filename": "a_amazing_mother_36px.png",
  "status": "success",
  "description": {
    "detailed_description": "\u201cAmazing Mother\u201d is a flowing script typeface that embodies a charmingly informal aesthetic. Its organic curves and fluid strokes evoke a sense of handwritten elegance, reminiscent of calligraphy. The font\u2019s generous x-height and open counters ensure good legibility, even at smaller sizes, while the subtle variations in stroke weight add a touch of visual interest. The overall character is playful and approachable, suggesting a friendly and inviting tone. Its contemporary relevance lies in its versatility, making it suitable for a wide range of applications, from branding and packaging to social media graphics and handwritten notes. The font\u2019s cultural associations lean towards a sense of warmth and authenticity, evoking a feeling of personal connection and handcrafted charm. Its informal nature makes it ideal for projects that require a touch of whimsy and personality, while its legibility ensures that it remains effective for conveying information.",
    "technical_characteristics": [
      "Organic curves",
      "Fluid strokes",
      "Generous x-height",
      "Open counters",
      "Subtle stroke weight variations"
    ],
    "personality_traits": [
      "Playful",
      "Approachable",
      "Informal",
      "Elegant",
      "Handwritten"
    ],
    "practical_contexts": [
      "Branding and packaging",
      "Social media graphics",
      "Handwritten notes",
      "Invitations and cards",
      "Website headers"
    ],
    "cultural_intuition": [
      "Warmth and authenticity",
      "Personal connection",
      "Handcrafted charm",
      "Informal and friendly",
      "Contemporary and approachable"
    ],
    "search_keywords": [
      "Script",
      "Handwritten",
      "Calligraphy",
      "Organic",
      "Fluid",
      "Playful",
      "Approachable",
      "Informal",
      "Elegant",
      "Legible",
      "Versatile",
      "Branding",
      "Packaging",
      "Social media",
      "Handwritten notes",
      "Invitations",
      "Cards",
      "Website headers",
      "Warmth",
      "Authenticity",
      "Personal connection",
      "Handcrafted",
      "Charming",
      "Whimsical",
      "Friendly",
      "Contemporary"
    ]
  }
}