{
  "filename": "a_andai_kata_36px.png",
  "status": "success",
  "description": {
    "detailed_description": "This font embodies a playful yet sophisticated handwritten aesthetic. Its flowing strokes and organic forms evoke a sense of spontaneity and personal expression, while the consistent letterforms and balanced proportions ensure readability. The font's generous x-height and open counters contribute to its legibility, even at smaller sizes. The subtle variations in stroke weight and the occasional flourishes add a touch of personality and visual interest. This font is ideal for adding a touch of warmth and authenticity to branding, packaging, or social media content. Its casual yet refined character makes it suitable for a wide range of applications, from handwritten notes to digital signage. The font's cultural resonance lies in its connection to the contemporary trend of embracing authenticity and individuality, while its technical foundation ensures its practical application in various contexts.",
    "technical_characteristics": [
      "Handwritten style",
      "Organic forms",
      "Flowing strokes",
      "Consistent letterforms",
      "Balanced proportions",
      "Generous x-height",
      "Open counters",
      "Subtle stroke weight variations",
      "Occasional flourishes"
    ],
    "personality_traits": [
      "Playful",
      "Sophisticated",
      "Spontaneous",
      "Personal",
      "Warm",
      "Authentic",
      "Casual",
      "Refined"
    ],
    "practical_contexts": [
      "Branding",
      "Packaging",
      "Social media",
      "Handwritten notes",
      "Digital signage"
    ],
    "cultural_intuition": [
      "Contemporary trend of authenticity",
      "Individuality",
      "Personal expression"
    ],
    "search_keywords": [
      "Handwritten",
      "Script",
      "Playful",
      "Sophisticated",
      "Organic",
      "Flowing",
      "Legible",
      "Branding",
      "Packaging",
      "Social media",
      "Digital signage",
      "Casual",
      "Refined",
      "Authentic",
      "Individuality",
      "Personal expression",
      "Contemporary",
      "Trend",
      "Authenticity"
    ]
  }
}