{
  "filename": "a_anak_cute_36px.png",
  "status": "success",
  "description": {
    "detailed_description": "This font, with its playful, hand-drawn aesthetic, embodies a sense of youthful energy and casual charm. The irregular letterforms, characterized by uneven strokes and expressive curves, evoke the spontaneity of handwritten notes. The generous x-height and open counters ensure legibility, even in smaller sizes, while the slightly rounded terminals soften the overall impression. This combination of informality and readability makes it ideal for projects that require a friendly and approachable tone, such as social media graphics, children's books, or branding for creative businesses. The font's inherent dynamism and playful nature resonate with contemporary digital culture, suggesting a sense of authenticity and personal expression. It evokes a sense of nostalgia for handwritten communication, while simultaneously embracing the immediacy of digital platforms.",
    "technical_characteristics": [
      "Hand-drawn aesthetic",
      "Irregular letterforms",
      "Uneven strokes",
      "Expressive curves",
      "Generous x-height",
      "Open counters",
      "Slightly rounded terminals"
    ],
    "personality_traits": [
      "Playful",
      "Youthful",
      "Casual",
      "Friendly",
      "Approachable",
      "Dynamic",
      "Expressive"
    ],
    "practical_contexts": [
      "Social media graphics",
      "Children's books",
      "Branding for creative businesses",
      "Handwritten-style typography",
      "Casual digital communication"
    ],
    "cultural_intuition": [
      "Nostalgia for handwritten communication",
      "Contemporary digital culture",
      "Authenticity",
      "Personal expression",
      "Playful energy"
    ],
    "search_keywords": [
      "Hand-drawn",
      "Playful",
      "Casual",
      "Youthful",
      "Friendly",
      "Expressive",
      "Irregular",
      "Uneven strokes",
      "Open counters",
      "Rounded terminals",
      "Social media",
      "Children's book",
      "Branding",
      "Digital communication",
      "Nostalgia",
      "Authenticity"
    ]
  }
}