{
  "filename": "a_antara_distance_36px.png",
  "status": "success",
  "description": {
    "detailed_description": "This script font, with its flowing curves and elegant flourishes, embodies a classic sense of sophistication. The letterforms are carefully constructed, with a balance of organic curves and sharp angles that create a sense of both fluidity and structure. The generous x-height and open counters ensure excellent legibility, even at smaller sizes. The font's overall character is both playful and refined, suggesting a sense of whimsy without sacrificing professionalism. Its historical influences are evident in the graceful curves and calligraphic flourishes, reminiscent of traditional script fonts. However, the font's contemporary relevance is undeniable, with its clean lines and modern proportions making it suitable for a wide range of applications, from branding and packaging to website design and social media graphics. The font's cultural associations are diverse, ranging from vintage charm to modern elegance, making it a versatile choice for projects that require a touch of personality and sophistication.",
    "technical_characteristics": [
      "flowing curves",
      "elegant flourishes",
      "organic curves",
      "sharp angles",
      "generous x-height",
      "open counters",
      "consistent stroke weight",
      "balanced ascenders and descenders"
    ],
    "personality_traits": [
      "sophisticated",
      "playful",
      "refined",
      "whimsical",
      "elegant",
      "graceful",
      "modern",
      "versatile"
    ],
    "practical_contexts": [
      "branding and packaging",
      "website design",
      "social media graphics",
      "invitations and stationery",
      "editorial design"
    ],
    "cultural_intuition": [
      "vintage charm",
      "modern elegance",
      "classic sophistication",
      "contemporary flair",
      "timeless appeal"
    ],
    "search_keywords": [
      "script font",
      "cursive font",
      "flowing",
      "elegant",
      "sophisticated",
      "playful",
      "refined",
      "whimsical",
      "graceful",
      "modern",
      "versatile",
      "branding",
      "packaging",
      "website design",
      "social media",
      "invitations",
      "stationery",
      "editorial design",
      "vintage",
      "classic",
      "contemporary"
    ]
  }
}