{
  "filename": "a_apollo_36px.png",
  "status": "success",
  "description": {
    "detailed_description": "A Apollo is a bold, expressive script font that captures the energy of handwritten lettering. Its flowing strokes and dynamic curves create a sense of movement and personality. The font's construction is based on a combination of calligraphic principles and contemporary digital techniques, resulting in a unique blend of traditional and modern aesthetics. The generous x-height and open counters ensure good legibility, even at smaller sizes, while the irregular baseline adds a touch of informality. The font's overall character is playful and energetic, suggesting a sense of fun and spontaneity. It evokes the spirit of hand-drawn signage and vintage posters, while also feeling fresh and contemporary. A Apollo is well-suited for branding, headlines, and display applications where a strong visual impact is desired. Its versatility allows it to be used in a wide range of contexts, from casual social media posts to more formal marketing materials.",
    "technical_characteristics": [
      "flowing strokes",
      "dynamic curves",
      "generous x-height",
      "open counters",
      "irregular baseline",
      "bold weight",
      "consistent stroke width"
    ],
    "personality_traits": [
      "expressive",
      "energetic",
      "playful",
      "spontaneous",
      "informal",
      "handwritten",
      "vintage-inspired"
    ],
    "practical_contexts": [
      "branding",
      "headlines",
      "display typography",
      "social media graphics",
      "posters",
      "packaging"
    ],
    "cultural_intuition": [
      "evokes the spirit of hand-drawn signage",
      "suggests a vintage aesthetic",
      "feels fresh and contemporary",
      "captures the energy of handwritten lettering"
    ],
    "search_keywords": [
      "script font",
      "handwritten",
      "bold",
      "expressive",
      "energetic",
      "playful",
      "vintage",
      "contemporary",
      "branding",
      "headlines",
      "display typography",
      "social media",
      "posters",
      "packaging",
      "calligraphy",
      "digital lettering",
      "flowing strokes",
      "dynamic curves",
      "generous x-height",
      "open counters",
      "irregular baseline"
    ]
  }
}