{
  "filename": "a_ape_mount_36px.png",
  "status": "success",
  "description": {
    "detailed_description": "A Ape Mount is a display typeface that captures the energy of hand-drawn lettering with a distinct digital edge. Its construction is based on a combination of calligraphic strokes and geometric shapes, resulting in a unique blend of organic and structured forms. The font's bold weight and exaggerated letterforms create a strong visual impact, while the uneven stroke widths and rough edges add a sense of spontaneity and authenticity. The high x-height and open counters ensure good legibility, even at smaller sizes. The font's overall character is bold, playful, and slightly rebellious, evoking a sense of street art and urban culture. It's a versatile typeface that can be used for a wide range of applications, from eye-catching headlines and logos to edgy posters and social media graphics. Its bold personality and contemporary aesthetic make it a perfect choice for projects that require a strong visual presence and a touch of irreverence.",
    "technical_characteristics": [
      "Calligraphic stroke inspiration",
      "Geometric construction",
      "Uneven stroke widths",
      "Rough edges",
      "High x-height",
      "Open counters",
      "Bold weight",
      "Exaggerated letterforms"
    ],
    "personality_traits": [
      "Bold",
      "Playful",
      "Rebellious",
      "Spontaneous",
      "Authentic",
      "Energetic",
      "Urban",
      "Street art inspired",
      "Contemporary"
    ],
    "practical_contexts": [
      "Headlines",
      "Logos",
      "Posters",
      "Social media graphics",
      "Packaging",
      "Streetwear",
      "Digital art",
      "Large-scale displays"
    ],
    "cultural_intuition": [
      "Street art and urban culture",
      "Contemporary design",
      "Digital art and culture",
      "Rebellious spirit",
      "Youthful energy"
    ],
    "search_keywords": [
      "Display typeface",
      "Hand-drawn",
      "Calligraphic",
      "Geometric",
      "Bold",
      "Playful",
      "Rebellious",
      "Street art",
      "Urban",
      "Contemporary",
      "Digital",
      "Headlines",
      "Logos",
      "Posters",
      "Social media",
      "Packaging",
      "Streetwear",
      "Large-scale",
      "High x-height",
      "Open counters",
      "Uneven stroke widths",
      "Rough edges",
      "Exaggerated letterforms"
    ]
  }
}