{
  "filename": "a_simple_life_36px.png",
  "status": "success",
  "description": {
    "detailed_description": "A Simple Life is a handwritten script font that captures the essence of casual, everyday writing. Its flowing strokes and organic forms create a sense of warmth and familiarity, reminiscent of personal notes or handwritten letters. The font's construction is characterized by a combination of rounded and angled strokes, resulting in a visually appealing balance between fluidity and structure. The letterforms are generally consistent in their proportions, with a moderate x-height and open counters that contribute to its legibility. The font's distinctive features include the slightly angled ascenders and descenders, which add a touch of dynamism to the overall composition. The overall execution is clean and consistent, with a smooth and even line weight that enhances its readability. A Simple Life's personality is approachable and friendly, conveying a sense of authenticity and informality. It evokes a nostalgic feeling, reminiscent of handwritten notes and personal correspondence. The font's contemporary relevance lies in its ability to add a touch of human touch to digital designs, creating a sense of warmth and connection. It is particularly well-suited for projects that require a casual and approachable tone, such as branding for small businesses, social media graphics, or personal projects. A Simple Life's cultural associations are rooted in the tradition of handwritten communication, evoking a sense of intimacy and personal connection. It can be seen as a modern interpretation of classic script fonts, capturing the essence of handwritten expression in a digital format.",
    "technical_characteristics": [
      "Handwritten style",
      "Rounded and angled strokes",
      "Moderate x-height",
      "Open counters",
      "Consistent line weight",
      "Slightly angled ascenders and descenders"
    ],
    "personality_traits": [
      "Approachable",
      "Friendly",
      "Nostalgic",
      "Authentic",
      "Informal"
    ],
    "practical_contexts": [
      "Branding for small businesses",
      "Social media graphics",
      "Personal projects",
      "Handwritten-style typography",
      "Casual and approachable designs"
    ],
    "cultural_intuition": [
      "Evokes handwritten communication",
      "Modern interpretation of classic script fonts",
      "Captures the essence of handwritten expression",
      "Conveys a sense of intimacy and personal connection",
      "Adds a touch of human touch to digital designs"
    ],
    "search_keywords": [
      "Handwritten script",
      "Casual",
      "Friendly",
      "Nostalgic",
      "Authentic",
      "Informal",
      "Branding",
      "Social media",
      "Personal projects",
      "Typography",
      "Digital design",
      "Script font",
      "Rounded strokes",
      "Angled strokes",
      "Moderate x-height",
      "Open counters",
      "Consistent line weight",
      "Angled ascenders",
      "Angled descenders",
      "Approachable",
      "Warm",
      "Intimate",
      "Human touch"
    ]
  }
}