{
  "filename": "a_sumpah_masih_muda_36px.png",
  "status": "success",
  "description": {
    "detailed_description": "This script font, with its flowing strokes and expressive flourishes, embodies a sense of playful elegance. The letterforms are constructed with a clear understanding of traditional calligraphy, evident in the consistent weight distribution and graceful transitions between thick and thin strokes. The ascenders and descenders are elongated, adding to the font's dynamic and expressive character. While the overall impression is one of fluidity and movement, the font maintains a level of legibility through its well-defined letterforms and consistent baseline. This balance between expressiveness and readability makes it suitable for a variety of applications, from handwritten notes and invitations to branding elements and website headers. The font's playful nature evokes a sense of warmth and approachability, making it ideal for projects that require a touch of personality and charm. Its contemporary relevance lies in its ability to bridge the gap between traditional calligraphy and modern digital design, offering a unique blend of classic elegance and contemporary flair.",
    "technical_characteristics": [
      "flowing strokes",
      "expressive flourishes",
      "consistent weight distribution",
      "graceful transitions",
      "elongated ascenders and descenders",
      "well-defined letterforms",
      "consistent baseline"
    ],
    "personality_traits": [
      "playfully elegant",
      "expressive",
      "dynamic",
      "approachable",
      "charming",
      "handwritten",
      "contemporary"
    ],
    "practical_contexts": [
      "handwritten notes",
      "invitations",
      "branding elements",
      "website headers",
      "social media graphics"
    ],
    "cultural_intuition": [
      "evokes a sense of warmth and approachability",
      "blends traditional calligraphy with modern digital design",
      "suggests a playful and creative spirit",
      "ideal for projects that require a touch of personality"
    ],
    "search_keywords": [
      "script font",
      "flowing strokes",
      "expressive flourishes",
      "handwritten",
      "playful",
      "elegant",
      "approachable",
      "charming",
      "contemporary",
      "branding",
      "website",
      "social media",
      "invitations",
      "notes",
      "calligraphy",
      "digital design"
    ]
  }
}