{
  "filename": "abantu_36px.png",
  "status": "success",
  "description": {
    "detailed_description": "This font is a playful exploration of the human face, rendered in a bold, expressive style. Each letterform is a stylized portrait, with exaggerated features and a distinct sense of personality. The construction is primarily geometric, with rounded corners and simplified forms, creating a sense of both whimsy and clarity. The high x-height and open counters ensure strong legibility, even at small sizes. The font's overall character is energetic and engaging, with a touch of retro charm. It evokes a sense of fun and optimism, reminiscent of vintage cartoons and comic book illustrations. This font is well-suited for headlines, branding elements, and playful digital interfaces, where its unique personality can add a touch of humor and visual interest. It's particularly effective in situations where a sense of approachability and lightheartedness is desired.",
    "technical_characteristics": [
      "Geometric construction",
      "Rounded corners",
      "Simplified forms",
      "High x-height",
      "Open counters",
      "Exaggerated features",
      "Stylized portraits"
    ],
    "personality_traits": [
      "Playful",
      "Energetic",
      "Whimsical",
      "Expressive",
      "Engaging",
      "Retro",
      "Optimistic"
    ],
    "practical_contexts": [
      "Headlines",
      "Branding elements",
      "Digital interfaces",
      "Playful designs",
      "Small-scale typography"
    ],
    "cultural_intuition": [
      "Vintage cartoons",
      "Comic book illustrations",
      "Retro aesthetics",
      "Modern playful design",
      "Approachable and lighthearted"
    ],
    "search_keywords": [
      "Geometric",
      "Rounded",
      "Simplified",
      "High x-height",
      "Open counters",
      "Exaggerated",
      "Stylized",
      "Playful",
      "Energetic",
      "Whimsical",
      "Expressive",
      "Engaging",
      "Retro",
      "Optimistic",
      "Headlines",
      "Branding",
      "Digital",
      "Interfaces",
      "Cartoons",
      "Comics",
      "Modern",
      "Approachable",
      "Lighthearted"
    ]
  }
}