{
  "filename": "abdomentality_36px.png",
  "status": "success",
  "description": {
    "detailed_description": "Abdomentality is a playful display font that embraces a hand-drawn aesthetic with a touch of whimsy. Its irregular letterforms, characterized by rounded corners and exaggerated curves, create a sense of spontaneity and energy. The font's bold strokes and generous x-height ensure strong legibility, even at smaller sizes. While the overall design is informal, the consistent weight and balanced proportions lend a sense of order and control. This balance between playful irregularity and controlled structure makes Abdomentality suitable for a variety of applications, from eye-catching headlines to quirky branding elements. Its hand-drawn quality evokes a sense of personal expression and authenticity, making it ideal for projects that seek to convey a friendly and approachable tone. The font's playful nature and bold presence suggest a connection to contemporary digital culture, where hand-drawn aesthetics and expressive typography are increasingly popular.",
    "technical_characteristics": [
      "Hand-drawn aesthetic",
      "Irregular letterforms",
      "Rounded corners",
      "Exaggerated curves",
      "Bold strokes",
      "Generous x-height",
      "Consistent weight",
      "Balanced proportions"
    ],
    "personality_traits": [
      "Playful",
      "Whimsical",
      "Spontaneous",
      "Energetic",
      "Informal",
      "Friendly",
      "Approachable",
      "Expressive",
      "Authentic"
    ],
    "practical_contexts": [
      "Headlines",
      "Branding elements",
      "Posters",
      "Social media graphics",
      "Children's books"
    ],
    "cultural_intuition": [
      "Contemporary digital culture",
      "Hand-drawn aesthetics",
      "Expressive typography",
      "Personal expression",
      "Authenticity"
    ],
    "search_keywords": [
      "Hand-drawn",
      "Playful",
      "Display font",
      "Whimsical",
      "Bold",
      "Informal",
      "Friendly",
      "Expressive",
      "Authentic",
      "Headlines",
      "Branding",
      "Posters",
      "Social media",
      "Children's books",
      "Digital culture",
      "Typography",
      "Graphic design"
    ]
  }
}