{
  "filename": "aberration_36px.png",
  "status": "success",
  "description": {
    "detailed_description": "Aberration (36A) is a display typeface that embodies a playful, almost rebellious spirit. Its construction is decidedly hand-drawn, with each letterform exhibiting a unique, almost exaggerated slant and a dynamic, almost calligraphic stroke variation. The font's high x-height and open counters contribute to its legibility, even at larger sizes, while the exaggerated angles and sharp terminals add a sense of energy and movement. This combination of technical features creates a font that is both visually striking and surprisingly readable, making it suitable for headlines, logos, and other applications where a bold, expressive statement is desired. The font's overall character is one of youthful exuberance and a touch of irreverence, reminiscent of street art and graffiti. It evokes a sense of freedom and creativity, suggesting a playful and unconventional approach to design. While its hand-drawn nature might limit its use in extended body text, Aberration (36A) excels in capturing attention and conveying a sense of individuality. Its cultural associations lean towards contemporary street culture and digital art, making it a fitting choice for projects that aim to communicate a sense of authenticity and rebellious spirit.",
    "technical_characteristics": [
      "Hand-drawn construction",
      "High x-height",
      "Open counters",
      "Exaggerated slant",
      "Dynamic stroke variation",
      "Sharp terminals",
      "Angular letterforms"
    ],
    "personality_traits": [
      "Playful",
      "Rebellious",
      "Energetic",
      "Expressive",
      "Unconventional",
      "Youthful",
      "Bold"
    ],
    "practical_contexts": [
      "Headlines",
      "Logos",
      "Posters",
      "Social media graphics",
      "Street art"
    ],
    "cultural_intuition": [
      "Street art and graffiti",
      "Contemporary digital art",
      "Youth culture",
      "Rebellious spirit",
      "Unconventional design"
    ],
    "search_keywords": [
      "Hand-drawn",
      "Display typeface",
      "High x-height",
      "Open counters",
      "Exaggerated slant",
      "Sharp terminals",
      "Angular letterforms",
      "Playful",
      "Rebellious",
      "Energetic",
      "Expressive",
      "Unconventional",
      "Youthful",
      "Bold",
      "Headlines",
      "Logos",
      "Posters",
      "Social media graphics",
      "Street art",
      "Contemporary",
      "Digital art",
      "Graffiti",
      "Street culture"
    ]
  }
}