{
  "filename": "abrila_36px.png",
  "status": "success",
  "description": {
    "detailed_description": "Abrila is a playful yet legible script font that blends a classic calligraphic feel with a contemporary edge. Its flowing strokes and generous curves create a sense of movement and energy, while the consistent weight and well-defined letterforms ensure readability even at smaller sizes. The font's italic angle is moderate, adding a touch of dynamism without sacrificing legibility. The rounded terminals and open counters contribute to its friendly and approachable character, making it suitable for a wide range of applications. Abrila's versatility allows it to be used for everything from handwritten notes and social media posts to branding elements and website headers, adding a touch of personality and warmth to any project. Its playful nature evokes a sense of fun and creativity, while its legibility ensures that it remains professional and effective.",
    "technical_characteristics": [
      "flowing strokes",
      "generous curves",
      "consistent weight",
      "well-defined letterforms",
      "rounded terminals",
      "open counters",
      "moderate italic angle"
    ],
    "personality_traits": [
      "playful",
      "legible",
      "dynamic",
      "friendly",
      "approachable",
      "versatile",
      "warm"
    ],
    "practical_contexts": [
      "handwritten notes",
      "social media posts",
      "branding elements",
      "website headers",
      "display typography"
    ],
    "cultural_intuition": [
      "evokes a sense of fun and creativity",
      "suggests a handwritten aesthetic",
      "captures a contemporary spirit",
      "feels approachable and inviting",
      "adds a touch of personality"
    ],
    "search_keywords": [
      "script font",
      "playful",
      "legible",
      "flowing",
      "curves",
      "rounded terminals",
      "open counters",
      "italic",
      "versatile",
      "handwritten",
      "social media",
      "branding",
      "website",
      "display",
      "contemporary",
      "approachable",
      "fun",
      "creative"
    ]
  }
}