{
  "filename": "across_the_stars_36px.png",
  "status": "success",
  "description": {
    "detailed_description": "Font Across The Stars is a geometric sans-serif typeface that embodies a futuristic aesthetic. Its construction is based on precise angles and curves, creating a clean and modern look. The letterforms are composed of simple, linear strokes with minimal ornamentation, resulting in a highly legible and adaptable design. The font's high x-height and open counters contribute to its readability, even at small sizes. The overall character of the font is both futuristic and approachable, with a hint of playful energy. Its geometric construction evokes a sense of order and precision, while the slightly rounded terminals soften the edges and create a more inviting feel. The font's contemporary relevance is evident in its use of clean lines and minimalist design, making it suitable for a wide range of digital applications, from website design to mobile interfaces. Its cultural associations lean towards science fiction and cyberpunk aesthetics, suggesting a world of advanced technology and innovation. The font's technical limitations are minimal, as its simple construction allows for easy scaling and adaptation to different media. Its performance characteristics are excellent, with high legibility and a clean, crisp appearance.",
    "technical_characteristics": [
      "Geometric construction",
      "Linear strokes",
      "High x-height",
      "Open counters",
      "Rounded terminals",
      "Minimal ornamentation",
      "Consistent stroke weight"
    ],
    "personality_traits": [
      "Futuristic",
      "Modern",
      "Clean",
      "Legible",
      "Approachable",
      "Playful",
      "Precise",
      "Minimalist",
      "Adaptable"
    ],
    "practical_contexts": [
      "Website design",
      "Mobile interfaces",
      "Branding",
      "Headlines",
      "Display typography"
    ],
    "cultural_intuition": [
      "Science fiction",
      "Cyberpunk",
      "Futuristic technology",
      "Innovation",
      "Modernity"
    ],
    "search_keywords": [
      "Geometric sans-serif",
      "Futuristic font",
      "Modern typeface",
      "Clean design",
      "Minimalist typography",
      "High x-height",
      "Open counters",
      "Rounded terminals",
      "Legible font",
      "Adaptable typeface",
      "Website design",
      "Mobile interface",
      "Branding",
      "Headlines",
      "Display font",
      "Science fiction",
      "Cyberpunk",
      "Technology",
      "Innovation",
      "Modernity"
    ]
  }
}