{
  "filename": "admiral_cat_36px.png",
  "status": "success",
  "description": {
    "detailed_description": "Admiral is a script typeface that blends classic calligraphic influences with a contemporary, playful energy. Its flowing strokes and generous curves evoke the elegance of traditional handwriting, but the bold weight and slightly exaggerated forms give it a modern edge. The font's construction is characterized by a combination of smooth, organic curves and sharp, angular transitions, creating a dynamic and visually engaging rhythm. The high x-height and open counters ensure excellent legibility, even at smaller sizes, making it suitable for both display and body text applications. The overall character of Admiral is both friendly and confident, suggesting a sense of approachability and sophistication. Its playful nature makes it ideal for branding projects that require a touch of personality, while its versatility allows it to be used effectively in a wide range of contexts, from website headers to packaging designs. The font's cultural resonance lies in its ability to evoke a sense of nostalgia for handwritten communication while simultaneously embracing the dynamism of contemporary design.",
    "technical_characteristics": [
      "flowing strokes",
      "generous curves",
      "bold weight",
      "high x-height",
      "open counters",
      "sharp angular transitions",
      "smooth organic curves"
    ],
    "personality_traits": [
      "playful",
      "confident",
      "approachable",
      "sophisticated",
      "dynamic",
      "visually engaging",
      "versatile"
    ],
    "practical_contexts": [
      "branding projects",
      "website headers",
      "packaging designs",
      "display text",
      "body text"
    ],
    "cultural_intuition": [
      "nostalgia for handwritten communication",
      "contemporary design aesthetic",
      "playful energy",
      "approachable personality",
      "sophisticated style"
    ],
    "search_keywords": [
      "script typeface",
      "calligraphic",
      "flowing strokes",
      "generous curves",
      "bold weight",
      "high x-height",
      "open counters",
      "sharp transitions",
      "smooth curves",
      "playful",
      "confident",
      "approachable",
      "sophisticated",
      "dynamic",
      "versatile",
      "branding",
      "website headers",
      "packaging",
      "display text",
      "body text",
      "nostalgia",
      "contemporary design",
      "handwritten communication"
    ]
  }
}