{
  "filename": "agafont_36px.png",
  "status": "success",
  "description": {
    "detailed_description": "Agafont is a playful display typeface that blends organic curves with a sense of geometric structure. Its rounded forms and exaggerated proportions create a whimsical feel, reminiscent of 1960s cartoon graphics. The font's construction is characterized by smooth, flowing lines and open counters, contributing to its friendly and approachable personality. While the overall design is informal, the consistent weight and clear articulation of letterforms ensure readability, making it suitable for headlines, logos, and playful branding elements. The font's bold presence and vibrant energy evoke a sense of fun and optimism, making it ideal for projects that aim to capture a lighthearted and engaging tone.",
    "technical_characteristics": [
      "Rounded letterforms",
      "Exaggerated proportions",
      "Open counters",
      "Consistent weight",
      "Smooth curves"
    ],
    "personality_traits": [
      "Playful",
      "Whimsical",
      "Friendly",
      "Approachable",
      "Bold"
    ],
    "practical_contexts": [
      "Headlines",
      "Logos",
      "Branding elements",
      "Posters",
      "Children's books"
    ],
    "cultural_intuition": [
      "1960s cartoon graphics",
      "Retro-inspired design",
      "Fun and optimism",
      "Lighthearted and engaging",
      "Informal and approachable"
    ],
    "search_keywords": [
      "Display typeface",
      "Rounded",
      "Organic",
      "Geometric",
      "Playful",
      "Whimsical",
      "Bold",
      "Headlines",
      "Logos",
      "Branding",
      "Retro",
      "Cartoon",
      "Fun",
      "Optimism",
      "Informal",
      "Approachable",
      "Children's",
      "Posters",
      "Graphic design"
    ]
  }
}