{
  "filename": "ageng_sans_36px.png",
  "status": "success",
  "description": {
    "detailed_description": "Ageng Sans is a playful yet legible sans-serif typeface that draws inspiration from both classic and contemporary design trends. Its rounded letterforms and slightly angled strokes create a sense of casual energy, while the consistent x-height and open counters ensure readability even at smaller sizes. The font's overall construction is based on a geometric framework, evident in the clean lines and balanced proportions, but it's softened by subtle humanist details like the rounded terminals and slightly uneven stroke weights. This combination of geometric structure and organic touches gives Ageng Sans a unique personality that feels both modern and approachable. Its versatility makes it suitable for a wide range of applications, from branding and website design to editorial layouts and social media graphics. The font's playful nature evokes a sense of youthful optimism and creativity, while its clear legibility ensures that it can be used effectively in both digital and print environments. Ageng Sans is a contemporary typeface that captures the spirit of casual yet sophisticated design, making it a perfect choice for projects that require a balance of personality and professionalism.",
    "technical_characteristics": [
      "Rounded letterforms",
      "Slightly angled strokes",
      "Consistent x-height",
      "Open counters",
      "Geometric construction",
      "Subtle humanist details",
      "Rounded terminals",
      "Uneven stroke weights"
    ],
    "personality_traits": [
      "Playful",
      "Legible",
      "Casual",
      "Energetic",
      "Modern",
      "Approachable",
      "Versatile",
      "Youthful",
      "Optimistic",
      "Creative"
    ],
    "practical_contexts": [
      "Branding",
      "Website design",
      "Editorial layouts",
      "Social media graphics",
      "Digital and print applications"
    ],
    "cultural_intuition": [
      "Evokes a sense of youthful optimism",
      "Captures the spirit of casual yet sophisticated design",
      "Reflects contemporary design trends",
      "Suggests a playful and creative approach",
      "Appeals to a wide audience"
    ],
    "search_keywords": [
      "Sans-serif",
      "Rounded",
      "Angled",
      "Legible",
      "Playful",
      "Casual",
      "Modern",
      "Geometric",
      "Humanist",
      "Versatile",
      "Branding",
      "Website",
      "Editorial",
      "Social media",
      "Digital",
      "Print",
      "Optimistic",
      "Creative",
      "Contemporary",
      "Approachable"
    ]
  }
}