{
  "filename": "aishiteru_lover_36px.png",
  "status": "success",
  "description": {
    "detailed_description": "Aishiteru Lover is a flowing script typeface that captures the essence of elegant handwriting. Its graceful curves and delicate flourishes evoke a sense of romanticism and charm. The font's construction is based on traditional calligraphy principles, with each letterform carefully crafted to create a harmonious and visually appealing flow. The ascenders and descenders are well-balanced, ensuring readability even in smaller sizes. The font's overall character is both feminine and sophisticated, with a touch of whimsy. It's ideal for adding a touch of elegance to wedding invitations, greeting cards, and other special occasions. The font's delicate nature makes it well-suited for use in digital media, such as social media graphics and website headers, where its subtle charm can enhance the overall aesthetic. Aishiteru Lover evokes a sense of timeless beauty and romantic nostalgia, making it a versatile choice for projects that require a touch of elegance and sophistication.",
    "technical_characteristics": [
      "flowing script",
      "calligraphic construction",
      "graceful curves",
      "delicate flourishes",
      "balanced ascenders and descenders"
    ],
    "personality_traits": [
      "romantic",
      "charming",
      "feminine",
      "sophisticated",
      "whimsical"
    ],
    "practical_contexts": [
      "wedding invitations",
      "greeting cards",
      "special occasions",
      "social media graphics",
      "website headers"
    ],
    "cultural_intuition": [
      "evokes a sense of timeless beauty",
      "romantic nostalgia",
      "suggests elegance and sophistication"
    ],
    "search_keywords": [
      "script",
      "calligraphy",
      "flowing",
      "graceful",
      "delicate",
      "romantic",
      "charming",
      "feminine",
      "sophisticated",
      "whimsical",
      "wedding",
      "greeting card",
      "special occasion",
      "social media",
      "website",
      "elegant",
      "nostalgia",
      "beauty"
    ]
  }
}