{
  "filename": "al_seana_36px.png",
  "status": "success",
  "description": {
    "detailed_description": "AI Seana is a charming script font that captures the essence of casual handwritten typography. Its flowing strokes and irregular letterforms create a sense of natural, unforced expression. The font's generous x-height and open counters ensure good legibility, even at smaller sizes, while the playful variations in letterforms add a touch of personality. The overall effect is one of warmth and approachability, making it ideal for projects that require a friendly and informal tone. AI Seana's casual aesthetic evokes a sense of personal connection, reminiscent of handwritten notes or heartfelt messages. It's a versatile font that can be used for a wide range of applications, from social media graphics and website headers to invitations and personal stationery. However, its informal nature might not be suitable for formal documents or corporate branding.",
    "technical_characteristics": [
      "flowing strokes",
      "irregular letterforms",
      "generous x-height",
      "open counters",
      "playful variations",
      "casual aesthetic"
    ],
    "personality_traits": [
      "charming",
      "natural",
      "unforced",
      "friendly",
      "informal",
      "approachable",
      "personal",
      "heartfelt"
    ],
    "practical_contexts": [
      "social media graphics",
      "website headers",
      "invitations",
      "personal stationery",
      "casual branding"
    ],
    "cultural_intuition": [
      "handwritten notes",
      "personal messages",
      "informal communication",
      "contemporary design",
      "digital-native aesthetic"
    ],
    "search_keywords": [
      "script font",
      "handwritten",
      "casual",
      "flowing",
      "irregular",
      "legible",
      "playful",
      "warm",
      "approachable",
      "personal",
      "social media",
      "website",
      "invitation",
      "stationery",
      "informal",
      "contemporary",
      "digital"
    ]
  }
}