{
  "filename": "alain_perso_36px.png",
  "status": "success",
  "description": {
    "detailed_description": "Alaim Perso is a handwritten script font that captures the casual, expressive nature of personal writing. Its flowing strokes and irregular letterforms create a sense of spontaneity and authenticity. The font's construction is based on a loose, organic approach, with varying stroke weights and angles that mimic the natural variations of handwriting. This results in a visually dynamic and engaging typeface, where each letter feels unique and full of character. The font's personality is playful and approachable, suggesting a sense of warmth and informality. It evokes a sense of personal connection and intimacy, making it ideal for projects that require a friendly and relatable tone. While the font's irregular nature makes it less suitable for large blocks of text, it excels in headlines, logos, and short-form content where its expressive qualities can shine. Its cultural associations lean towards contemporary digital culture, where handwritten aesthetics are often used to convey authenticity and personality. Alaim Perso is a versatile font that can be used to add a touch of personality and warmth to a wide range of projects.",
    "technical_characteristics": [
      "Handwritten style",
      "Irregular letterforms",
      "Varying stroke weights",
      "Organic construction",
      "Loose letter spacing"
    ],
    "personality_traits": [
      "Playful",
      "Approachable",
      "Expressive",
      "Authentic",
      "Casual"
    ],
    "practical_contexts": [
      "Headlines",
      "Logos",
      "Short-form content",
      "Social media graphics",
      "Personal branding"
    ],
    "cultural_intuition": [
      "Contemporary digital culture",
      "Authenticity",
      "Personal expression",
      "Informal communication",
      "Handwritten aesthetics"
    ],
    "search_keywords": [
      "Handwritten",
      "Script",
      "Casual",
      "Playful",
      "Expressive",
      "Authentic",
      "Informal",
      "Personal",
      "Digital",
      "Contemporary",
      "Logo",
      "Headline",
      "Social media",
      "Branding",
      "Typography",
      "Font",
      "Typeface"
    ]
  }
}