{
  "filename": "alamain_36px.png",
  "status": "success",
  "description": {
    "detailed_description": "Alamain is a flowing script typeface that captures the essence of elegant handwritten calligraphy. Its graceful curves and fluid strokes create a sense of effortless movement, reminiscent of a skilled penman's hand. The font's generous x-height and open counters ensure excellent legibility, even at smaller sizes, making it suitable for both display and body text applications. The subtle variations in stroke weight add a touch of personality, while the consistent slant and gentle curves maintain a sense of harmony. Alamain's overall character is both sophisticated and approachable, evoking a sense of warmth and charm. Its historical influences are evident in the classic calligraphic forms, while its contemporary relevance lies in its versatility and adaptability to modern design trends. The font's cultural associations range from vintage signage and handwritten notes to contemporary branding and digital interfaces, suggesting a timeless appeal that transcends specific eras. Alamain's practical applications are diverse, encompassing everything from website headers and logos to book covers and invitations. Its performance characteristics are excellent, with smooth rendering and consistent legibility across various media and resolutions.",
    "technical_characteristics": [
      "flowing script",
      "generous x-height",
      "open counters",
      "subtle stroke weight variations",
      "consistent slant",
      "gentle curves",
      "calligraphic forms"
    ],
    "personality_traits": [
      "elegant",
      "graceful",
      "effortless",
      "sophisticated",
      "approachable",
      "warm",
      "charming",
      "versatile",
      "adaptable"
    ],
    "practical_contexts": [
      "website headers",
      "logos",
      "book covers",
      "invitations",
      "display text",
      "body text"
    ],
    "cultural_intuition": [
      "vintage signage",
      "handwritten notes",
      "contemporary branding",
      "digital interfaces",
      "timeless appeal"
    ],
    "search_keywords": [
      "script",
      "calligraphy",
      "handwritten",
      "flowing",
      "elegant",
      "graceful",
      "legible",
      "versatile",
      "display",
      "body",
      "sophisticated",
      "approachable",
      "warm",
      "charming",
      "vintage",
      "modern",
      "branding",
      "digital",
      "website",
      "logo",
      "book",
      "invitation"
    ]
  }
}