{
  "filename": "alice_36px.png",
  "status": "success",
  "description": {
    "detailed_description": "Alice is a font that embodies a futuristic aesthetic, built upon a foundation of geometric construction and sharp, angular forms. Each letter is composed of a series of parallel lines, creating a sense of depth and dimensionality. The consistent use of straight lines and right angles gives the font a clean, precise look, reminiscent of early computer graphics or the sleek lines of science fiction vehicles. The bold, almost mechanical nature of the font is further emphasized by the subtle beveling effect applied to each letter, adding a sense of weight and solidity. This effect, while subtle, adds a layer of visual interest and reinforces the font's futuristic feel. Alice's high x-height and open counters ensure strong legibility, even at smaller sizes, making it suitable for both display and body text applications. The font's bold, futuristic character makes it ideal for projects that require a sense of energy, innovation, and technological advancement. It could be used effectively for branding, headlines, posters, and digital interfaces, particularly those related to technology, gaming, or science fiction. The font's strong visual presence and clear, legible forms make it a powerful tool for conveying a sense of modernity and progress.",
    "technical_characteristics": [
      "Geometric construction",
      "Sharp, angular forms",
      "Parallel lines",
      "Consistent use of straight lines and right angles",
      "Subtle beveling effect",
      "High x-height",
      "Open counters"
    ],
    "personality_traits": [
      "Futuristic",
      "Bold",
      "Mechanical",
      "Clean",
      "Precise",
      "Energetic",
      "Innovative",
      "Modern",
      "Progressive"
    ],
    "practical_contexts": [
      "Headlines",
      "Posters",
      "Branding",
      "Digital interfaces",
      "Technology-related projects",
      "Gaming",
      "Science fiction"
    ],
    "cultural_intuition": [
      "Early computer graphics",
      "Science fiction aesthetics",
      "Technological advancement",
      "Modernity",
      "Progress"
    ],
    "search_keywords": [
      "Geometric",
      "Angular",
      "Futuristic",
      "Bold",
      "Mechanical",
      "Clean",
      "Precise",
      "High x-height",
      "Open counters",
      "Legible",
      "Display font",
      "Body text",
      "Branding",
      "Headlines",
      "Posters",
      "Digital interfaces",
      "Technology",
      "Gaming",
      "Science fiction",
      "Modern",
      "Progressive"
    ]
  }
}