{
  "filename": "alien_lines_36px.png",
  "status": "success",
  "description": {
    "detailed_description": "This font, with its circular forms and geometric construction, evokes a sense of futuristic technology. The consistent use of curves and rounded terminals creates a smooth, flowing aesthetic, while the open counters and generous x-height ensure excellent legibility even at small sizes. The font's bold, confident character is further emphasized by the strong, consistent stroke weight and the absence of serifs. This combination of technical precision and visual dynamism makes it ideal for digital interfaces, branding, and futuristic-themed projects. The font's futuristic aesthetic, reminiscent of science fiction imagery, suggests a world of innovation and possibility, while its clean, modern design feels both timeless and cutting-edge.",
    "technical_characteristics": [
      "circular forms",
      "geometric construction",
      "rounded terminals",
      "open counters",
      "consistent stroke weight",
      "generous x-height",
      "absence of serifs"
    ],
    "personality_traits": [
      "futuristic",
      "technological",
      "dynamic",
      "confident",
      "modern",
      "clean",
      "bold"
    ],
    "practical_contexts": [
      "digital interfaces",
      "branding",
      "futuristic-themed projects",
      "headings",
      "logos"
    ],
    "cultural_intuition": [
      "science fiction",
      "innovation",
      "technology",
      "modernity",
      "futurism"
    ],
    "search_keywords": [
      "circular",
      "geometric",
      "rounded",
      "open counters",
      "consistent stroke weight",
      "x-height",
      "serifless",
      "futuristic",
      "technological",
      "dynamic",
      "confident",
      "modern",
      "clean",
      "bold",
      "digital",
      "branding",
      "interface",
      "heading",
      "logo",
      "science fiction",
      "innovation",
      "technology",
      "futurism"
    ]
  }
}