{
  "filename": "allcaps_36px.png",
  "status": "success",
  "description": {
    "detailed_description": "This font embodies a bold, expressive energy, drawing inspiration from both classic brush lettering and contemporary street art. Its thick strokes and dramatic angles create a sense of dynamism and immediacy, while the irregular letterforms and playful flourishes add a touch of personality. The font's construction is clearly influenced by hand-drawn techniques, with visible brushstrokes and uneven lines adding a sense of authenticity. The high x-height and open counters ensure strong legibility, even at smaller sizes, making it suitable for headlines, logos, and short-form text. Its bold character and playful energy make it ideal for projects that require a strong visual impact and a sense of individuality. The font's cultural associations range from vintage signage and hand-painted posters to contemporary street art and graffiti, evoking a sense of urban grit and creative expression.",
    "technical_characteristics": [
      "thick strokes",
      "dramatic angles",
      "irregular letterforms",
      "playful flourishes",
      "high x-height",
      "open counters",
      "visible brushstrokes",
      "uneven lines"
    ],
    "personality_traits": [
      "bold",
      "expressive",
      "dynamic",
      "immediate",
      "playful",
      "authentic",
      "individualistic",
      "urban",
      "gritty",
      "creative"
    ],
    "practical_contexts": [
      "headlines",
      "logos",
      "short-form text",
      "posters",
      "signage",
      "packaging",
      "social media graphics",
      "street art"
    ],
    "cultural_intuition": [
      "vintage signage",
      "hand-painted posters",
      "street art",
      "graffiti",
      "urban culture",
      "creative expression",
      "individuality"
    ],
    "search_keywords": [
      "brush script",
      "hand-drawn",
      "bold",
      "expressive",
      "dynamic",
      "playful",
      "urban",
      "graffiti",
      "street art",
      "vintage",
      "signage",
      "poster",
      "headline",
      "logo",
      "packaging",
      "social media",
      "graphics",
      "display font",
      "casual",
      "authentic",
      "individualistic",
      "high x-height",
      "open counters",
      "thick strokes",
      "dramatic angles",
      "irregular letterforms",
      "flourishes",
      "uneven lines"
    ]
  }
}