{
  "filename": "allen_36px.png",
  "status": "success",
  "description": {
    "detailed_description": "Allen is a script font that captures the casual charm of handwritten text. Its flowing strokes and irregular letterforms evoke a sense of spontaneity and personal expression. The font's construction is based on a combination of organic curves and sharp angles, creating a dynamic and visually engaging rhythm. The varying stroke weights and subtle calligraphic flourishes add depth and character to the letters, while the generous x-height and open counters ensure good legibility even at smaller sizes. Allen's playful personality makes it ideal for projects that require a touch of informality and warmth, such as branding for creative businesses, social media graphics, or handwritten notes. Its versatility allows it to be used in both digital and print applications, adding a personal touch to a wide range of projects. The font's cultural resonance lies in its connection to the tradition of handwritten communication, evoking a sense of authenticity and human connection. Its contemporary relevance stems from its ability to convey a sense of individuality and creativity, aligning with the values of modern digital culture.",
    "technical_characteristics": [
      "Organic curves and sharp angles",
      "Varying stroke weights",
      "Calligraphic flourishes",
      "Generous x-height",
      "Open counters"
    ],
    "personality_traits": [
      "Playful",
      "Casual",
      "Spontaneous",
      "Warm",
      "Authentic"
    ],
    "practical_contexts": [
      "Branding for creative businesses",
      "Social media graphics",
      "Handwritten notes",
      "Digital and print applications",
      "Small to medium text sizes"
    ],
    "cultural_intuition": [
      "Handwritten communication",
      "Personal expression",
      "Authenticity",
      "Individuality",
      "Creativity"
    ],
    "search_keywords": [
      "Script font",
      "Handwritten",
      "Casual",
      "Playful",
      "Organic",
      "Calligraphic",
      "Generous x-height",
      "Open counters",
      "Branding",
      "Social media",
      "Digital",
      "Print",
      "Authenticity",
      "Individuality",
      "Creativity"
    ]
  }
}