{
  "filename": "allora_36px.png",
  "status": "success",
  "description": {
    "detailed_description": "This font, with its bold, rounded forms and playful 3D effect, embodies a retro-futuristic aesthetic. The letters are constructed with a distinct geometric base, evident in the sharp angles and consistent curves. Each character features a double outline, creating a sense of depth and dimension. The subtle gradient within the outline adds a touch of realism, further enhancing the 3D illusion. This playful design evokes a sense of fun and energy, reminiscent of 1970s sci-fi and arcade games. The font's bold presence and playful nature make it ideal for eye-catching headlines, branding for retro-inspired products, or playful digital interfaces. However, its strong personality might limit its use in more formal contexts, and its intricate details could become illegible at smaller sizes.",
    "technical_characteristics": [
      "Geometric construction",
      "Rounded terminals",
      "Double outline",
      "3D effect",
      "Gradient fill"
    ],
    "personality_traits": [
      "Playful",
      "Bold",
      "Retro-futuristic",
      "Energetic",
      "Eye-catching"
    ],
    "practical_contexts": [
      "Headlines",
      "Branding for retro-inspired products",
      "Digital interfaces",
      "Game design",
      "Posters"
    ],
    "cultural_intuition": [
      "1970s sci-fi",
      "Arcade games",
      "Retro-futurism",
      "Digital nostalgia",
      "Playful energy"
    ],
    "search_keywords": [
      "Geometric",
      "Rounded",
      "3D",
      "Bold",
      "Retro",
      "Futuristic",
      "Playful",
      "Energetic",
      "Headline",
      "Branding",
      "Digital",
      "Game",
      "Poster",
      "Nostalgia",
      "Arcade",
      "Sci-fi",
      "Fun",
      "Eye-catching"
    ]
  }
}