{
  "filename": "almonte_snow_36px.png",
  "status": "success",
  "description": {
    "detailed_description": "Almonte Snow is a display typeface that captures the essence of winter with its playful, dripping-snow effect. The font's construction is based on a bold, sans-serif structure, with each letterform featuring a distinctive 'snowcap' detail at the top. This detail, achieved through a combination of negative space and subtle curves, adds a whimsical touch to the otherwise geometric forms. The overall effect is one of playful boldness, with a hint of whimsy that evokes a sense of wintery fun. The font's high x-height and open counters ensure strong legibility, even at smaller sizes, making it suitable for headlines, logos, and other display applications. Its playful nature makes it ideal for projects that require a touch of whimsy and a connection to the winter season. The font's bold, confident character suggests a sense of fun and adventure, while the dripping snow effect adds a touch of whimsy and playfulness. This combination makes it perfect for projects that require a unique and memorable visual identity, such as holiday branding, children's books, or playful social media graphics.",
    "technical_characteristics": [
      "Bold sans-serif structure",
      "High x-height",
      "Open counters",
      "Distinctive 'snowcap' detail",
      "Geometric construction",
      "Subtle curves",
      "Negative space"
    ],
    "personality_traits": [
      "Playfully bold",
      "Whimsical",
      "Bold and confident",
      "Fun and adventurous",
      "Unique and memorable",
      "Wintery",
      "Playful"
    ],
    "practical_contexts": [
      "Headlines",
      "Logos",
      "Display applications",
      "Holiday branding",
      "Children's books",
      "Social media graphics"
    ],
    "cultural_intuition": [
      "Evokes a sense of wintery fun",
      "Suggests a playful and adventurous spirit",
      "Connects to the holiday season",
      "Appeals to a sense of nostalgia",
      "Reflects a contemporary trend towards playful and whimsical design"
    ],
    "search_keywords": [
      "Display typeface",
      "Sans-serif",
      "Bold",
      "Playful",
      "Whimsical",
      "Winter",
      "Snow",
      "Holiday",
      "Children's",
      "Fun",
      "Adventure",
      "Unique",
      "Memorable",
      "High x-height",
      "Open counters",
      "Geometric",
      "Curves",
      "Negative space",
      "Headlines",
      "Logos",
      "Branding",
      "Social media",
      "Graphics"
    ]
  }
}