{
  "filename": "alpha_clouds_36px.png",
  "status": "success",
  "description": {
    "detailed_description": "Alpha Clouds is a playful display font that captures the whimsical nature of clouds with its unique, organic letterforms. Each character is constructed with a series of irregular, rounded shapes that evoke the soft, fluffy texture of clouds. The font's high x-height and open counters ensure good legibility, even at larger sizes, while the irregular outlines and uneven spacing contribute to its whimsical character. The font's overall mood is lighthearted and carefree, suggesting a sense of fun and adventure. Its design evokes a sense of childhood nostalgia, reminiscent of hand-drawn illustrations and cartoon characters. Alpha Clouds is well-suited for headlines, logos, and other display applications where a playful and eye-catching aesthetic is desired. Its unique character makes it ideal for projects that require a touch of whimsy and personality, such as children's books, branding for playful businesses, or social media graphics.",
    "technical_characteristics": [
      "Organic construction",
      "Irregular outlines",
      "Rounded shapes",
      "High x-height",
      "Open counters",
      "Uneven spacing",
      "Variable stroke weight"
    ],
    "personality_traits": [
      "Playful",
      "Whimsical",
      "Carefree",
      "Nostalgic",
      "Hand-drawn",
      "Cartoonish",
      "Eye-catching"
    ],
    "practical_contexts": [
      "Headlines",
      "Logos",
      "Display typography",
      "Children's books",
      "Branding for playful businesses",
      "Social media graphics"
    ],
    "cultural_intuition": [
      "Evokes childhood nostalgia",
      "Suggests a sense of fun and adventure",
      "Reminiscent of hand-drawn illustrations",
      "Captures the whimsical nature of clouds",
      "Reflects a contemporary trend towards playful and expressive typography"
    ],
    "search_keywords": [
      "Display font",
      "Organic",
      "Playful",
      "Whimsical",
      "Nostalgic",
      "Cartoonish",
      "Hand-drawn",
      "Clouds",
      "Headlines",
      "Logos",
      "Branding",
      "Children's books",
      "Social media",
      "Graphic design",
      "Typography",
      "Font",
      "Typeface"
    ]
  }
}