{
  "filename": "alphashapes_stars_3_36px.png",
  "status": "success",
  "description": {
    "detailed_description": "This font's defining characteristic is its bold, playful use of a starburst shape as the letterform container. Each letter is rendered in a simple, sans-serif style, with a high x-height and open counters that ensure strong legibility, even at small sizes. The starburst shape, with its sharp points and radiating lines, adds a dynamic and energetic feel, while the consistent white space within each letterform maintains a sense of clarity and order. This combination of playful geometry and legible structure makes the font suitable for a wide range of applications, from playful headlines and branding to digital interfaces and signage. The font's bold, graphic nature evokes a sense of fun and energy, reminiscent of vintage carnival signage or retro video game graphics. It suggests a playful and approachable personality, while still maintaining a sense of professionalism and clarity.",
    "technical_characteristics": [
      "Starburst letterform container",
      "Sans-serif style",
      "High x-height",
      "Open counters",
      "Consistent white space",
      "Sharp points",
      "Radiating lines",
      "Bold weight"
    ],
    "personality_traits": [
      "Playful",
      "Energetic",
      "Bold",
      "Graphic",
      "Approachable",
      "Clear",
      "Professional",
      "Dynamic",
      "Retro"
    ],
    "practical_contexts": [
      "Headlines",
      "Branding",
      "Digital interfaces",
      "Signage",
      "Display typography"
    ],
    "cultural_intuition": [
      "Vintage carnival signage",
      "Retro video game graphics",
      "Modern playful design",
      "Fun and energetic",
      "Approachable and friendly"
    ],
    "search_keywords": [
      "Starburst",
      "Sans-serif",
      "Bold",
      "Playful",
      "Graphic",
      "Legible",
      "High x-height",
      "Open counters",
      "Retro",
      "Vintage",
      "Carnival",
      "Video game",
      "Modern",
      "Fun",
      "Energetic",
      "Display",
      "Headline",
      "Branding",
      "Digital",
      "Interface",
      "Signage"
    ]
  }
}