{
  "filename": "amerika_pro_36px.png",
  "status": "success",
  "description": {
    "detailed_description": "Amerikana Pro is a serif typeface that blends classic proportions with a contemporary sensibility. Its construction is rooted in traditional serif design principles, featuring a moderate x-height, balanced stroke weights, and well-defined serifs. However, the font's personality is infused with a subtle playfulness, evident in the slightly rounded terminals and the gentle curves of the lowercase letters. This combination creates a typeface that feels both familiar and fresh, suitable for a wide range of applications. Its legibility is enhanced by the open counters and clear letterforms, making it effective for both print and digital media. The overall character of Amerikana Pro evokes a sense of warmth and approachability, suggesting a balance between tradition and modernity. It's a versatile typeface that can be used for everything from branding and editorial design to website interfaces and mobile applications, offering a timeless elegance with a touch of contemporary flair.",
    "technical_characteristics": [
      "moderate x-height",
      "balanced stroke weights",
      "well-defined serifs",
      "slightly rounded terminals",
      "gentle curves in lowercase letters",
      "open counters",
      "clear letterforms"
    ],
    "personality_traits": [
      "timeless elegance",
      "subtle playfulness",
      "approachable",
      "versatile",
      "warm",
      "familiar yet fresh",
      "modern yet classic"
    ],
    "practical_contexts": [
      "branding and editorial design",
      "website interfaces",
      "mobile applications",
      "print media",
      "digital media"
    ],
    "cultural_intuition": [
      "evokes a sense of warmth and approachability",
      "suggests a balance between tradition and modernity",
      "reflects a contemporary design sensibility",
      "feels both familiar and fresh"
    ],
    "search_keywords": [
      "serif typeface",
      "classic proportions",
      "contemporary sensibility",
      "moderate x-height",
      "balanced stroke weights",
      "well-defined serifs",
      "rounded terminals",
      "gentle curves",
      "open counters",
      "clear letterforms",
      "legible",
      "versatile",
      "branding",
      "editorial design",
      "website interfaces",
      "mobile applications",
      "print media",
      "digital media",
      "timeless elegance",
      "approachable",
      "modern",
      "traditional"
    ]
  }
}