{
  "filename": "ammys_handwriting_36px.png",
  "status": "success",
  "description": {
    "detailed_description": "Ammys Handwriting is a script font that captures the casual charm of handwritten text. Its flowing strokes and natural variations in letterforms create a sense of authenticity and warmth. The font's construction is based on a combination of calligraphic principles and digital refinement, resulting in a balance of organic fluidity and controlled legibility. The generous x-height and open counters ensure readability even at smaller sizes, while the subtle variations in stroke weight add visual interest. The font's overall character is friendly and approachable, evoking a sense of personal connection and informal communication. It's well-suited for branding projects that emphasize warmth and authenticity, as well as for digital applications like social media graphics and website headers. The font's cultural resonance lies in its ability to evoke a sense of nostalgia for handwritten notes and personal correspondence, while its contemporary relevance stems from its adaptability to modern digital platforms.",
    "technical_characteristics": [
      "flowing strokes",
      "natural variations",
      "generous x-height",
      "open counters",
      "subtle stroke weight variations",
      "calligraphic influences",
      "digital refinement"
    ],
    "personality_traits": [
      "friendly",
      "approachable",
      "authentic",
      "casual",
      "warm",
      "informal",
      "legible"
    ],
    "practical_contexts": [
      "branding projects",
      "social media graphics",
      "website headers",
      "personal correspondence",
      "digital applications"
    ],
    "cultural_intuition": [
      "nostalgia for handwritten notes",
      "personal connection",
      "informal communication",
      "contemporary digital relevance",
      "authenticity"
    ],
    "search_keywords": [
      "script font",
      "handwritten",
      "flowing",
      "casual",
      "authentic",
      "warm",
      "legible",
      "friendly",
      "approachable",
      "branding",
      "social media",
      "website",
      "digital",
      "nostalgia",
      "personal",
      "informal",
      "contemporary"
    ]
  }
}