{
  "filename": "amsterdrum_grotesk_36px.png",
  "status": "success",
  "description": {
    "detailed_description": "Amsterdam Grotesk (36px) is a sans-serif typeface that blends geometric construction with subtle humanist details. Its bold, chunky strokes and sharp terminals create a strong visual presence, while the slightly rounded corners and open counters add a touch of approachability. The font's high x-height and generous spacing ensure excellent legibility, even at smaller sizes. This combination of boldness and readability makes it suitable for a wide range of applications, from headlines and branding to digital interfaces and editorial design. The font's overall character is confident and modern, with a hint of playfulness that adds a touch of personality. It evokes a sense of energy and dynamism, suggesting a forward-thinking and innovative approach. Its contemporary relevance is undeniable, reflecting the current trend towards bold, expressive typography in digital design.",
    "technical_characteristics": [
      "Geometric construction",
      "Bold, chunky strokes",
      "Sharp terminals",
      "Slightly rounded corners",
      "Open counters",
      "High x-height",
      "Generous spacing"
    ],
    "personality_traits": [
      "Confident",
      "Modern",
      "Playful",
      "Energetic",
      "Dynamic",
      "Innovative",
      "Expressive"
    ],
    "practical_contexts": [
      "Headlines",
      "Branding",
      "Digital interfaces",
      "Editorial design",
      "Large-scale signage"
    ],
    "cultural_intuition": [
      "Reflects contemporary design trends",
      "Evokes a sense of energy and dynamism",
      "Suggests a forward-thinking approach",
      "Appeals to a modern audience"
    ],
    "search_keywords": [
      "Sans-serif",
      "Geometric",
      "Bold",
      "Chunky",
      "Sharp",
      "Rounded",
      "Open counters",
      "High x-height",
      "Generous spacing",
      "Legible",
      "Modern",
      "Playful",
      "Energetic",
      "Dynamic",
      "Innovative",
      "Expressive",
      "Headlines",
      "Branding",
      "Digital",
      "Editorial",
      "Signage"
    ]
  }
}