{
  "filename": "analgesics_36px.png",
  "status": "success",
  "description": {
    "detailed_description": "Analgesic is a playful script font that captures the energy of hand-drawn lettering. Its irregular, bouncy strokes and exaggerated curves create a sense of movement and whimsy. The font's generous x-height and open counters ensure good legibility, even at smaller sizes. While the overall construction is loose and organic, there's a deliberate balance in the letterforms, preventing them from becoming overly chaotic. This balance allows Analgesic to be used for a variety of purposes, from casual branding to playful headlines. The font's informal character evokes a sense of warmth and approachability, making it ideal for projects that require a friendly and engaging tone. Its playful nature also makes it well-suited for children's books, social media graphics, and other projects that require a touch of whimsy.",
    "technical_characteristics": [
      "Irregular, bouncy strokes",
      "Exaggerated curves",
      "Generous x-height",
      "Open counters",
      "Loose and organic construction",
      "Deliberate balance in letterforms"
    ],
    "personality_traits": [
      "Playful",
      "Whimsical",
      "Informal",
      "Friendly",
      "Engaging"
    ],
    "practical_contexts": [
      "Casual branding",
      "Playful headlines",
      "Children's books",
      "Social media graphics",
      "Projects requiring a friendly tone"
    ],
    "cultural_intuition": [
      "Evokes a sense of warmth and approachability",
      "Suggests a playful and lighthearted mood",
      "Reflects the trend of hand-drawn typography in contemporary design"
    ],
    "search_keywords": [
      "Script font",
      "Hand-drawn",
      "Playful",
      "Whimsical",
      "Informal",
      "Casual",
      "Friendly",
      "Engaging",
      "Generous x-height",
      "Open counters",
      "Bouncy strokes",
      "Exaggerated curves",
      "Loose construction",
      "Deliberate balance",
      "Children's book",
      "Social media",
      "Branding",
      "Headlines"
    ]
  }
}