{
  "filename": "anark_36px.png",
  "status": "success",
  "description": {
    "detailed_description": "Anark is a display typeface that embodies raw energy and rebellious spirit. Its construction is based on a series of jagged, angular strokes, creating a highly irregular and unpredictable visual. The letterforms are often fragmented, with sharp, pointed terminals and uneven widths. This deliberate imperfection gives the font a sense of urgency and chaos, reminiscent of graffiti or street art. The high x-height and open counters ensure legibility, even in its chaotic form. Anark's personality is bold and confrontational, pushing boundaries and challenging traditional notions of typography. It evokes a sense of rebellion, anarchy, and underground culture. Its intended applications are primarily for display purposes, where its striking visual impact can be maximized. It's ideal for headlines, posters, and branding projects that require a strong, edgy aesthetic. However, its highly stylized nature limits its use in extended text, as its irregular forms can make it difficult to read in large blocks. Anark's cultural resonance lies in its connection to street art, punk rock, and other subcultures that embrace nonconformity and visual disruption. It captures the spirit of rebellion and individuality, making it a powerful tool for expressing a bold and unconventional message.",
    "technical_characteristics": [
      "jagged, angular strokes",
      "irregular letterforms",
      "sharp, pointed terminals",
      "uneven widths",
      "high x-height",
      "open counters"
    ],
    "personality_traits": [
      "rebellious",
      "confrontational",
      "bold",
      "energetic",
      "chaotic",
      "unconventional",
      "edgy",
      "raw",
      "unpredictable"
    ],
    "practical_contexts": [
      "display headlines",
      "posters",
      "branding",
      "street art",
      "punk rock"
    ],
    "cultural_intuition": [
      "street art",
      "punk rock",
      "underground culture",
      "rebellion",
      "nonconformity"
    ],
    "search_keywords": [
      "display typeface",
      "jagged",
      "angular",
      "irregular",
      "sharp",
      "pointed",
      "high x-height",
      "open counters",
      "rebellious",
      "confrontational",
      "bold",
      "energetic",
      "chaotic",
      "unconventional",
      "edgy",
      "raw",
      "unpredictable",
      "street art",
      "punk rock",
      "underground culture",
      "rebellion",
      "nonconformity",
      "headlines",
      "posters",
      "branding"
    ]
  }
}