{
  "filename": "ancient_god_36px.png",
  "status": "success",
  "description": {
    "detailed_description": "Ancient God is a bold, geometric sans-serif font that draws inspiration from both classic and contemporary design. Its construction is based on a grid system, resulting in sharp, angular letterforms with a distinct mechanical feel. The font's high x-height and open counters ensure strong legibility, even at small sizes. The bold weight and consistent stroke width contribute to its commanding presence, while the slightly rounded terminals add a touch of approachability, preventing it from feeling overly harsh. This balance between geometric precision and subtle humanization gives Ancient God a unique personality, making it suitable for a wide range of applications. Its bold, assertive character makes it ideal for headlines, logos, and branding projects that require a strong visual impact. It can also be used effectively in digital interfaces, particularly for mobile applications where its legibility at smaller sizes is crucial. The font's bold, angular forms evoke a sense of power and authority, reminiscent of futuristic technology and cyberpunk aesthetics. Its strong presence and clear legibility make it a powerful tool for conveying messages of strength, innovation, and progress.",
    "technical_characteristics": [
      "Geometric construction",
      "High x-height",
      "Open counters",
      "Bold weight",
      "Consistent stroke width",
      "Slightly rounded terminals",
      "Angular letterforms"
    ],
    "personality_traits": [
      "Bold and assertive",
      "Geometrically precise",
      "Mechanically inspired",
      "Visually commanding",
      "Approachable",
      "Powerful",
      "Futuristic"
    ],
    "practical_contexts": [
      "Headlines",
      "Logos",
      "Branding",
      "Digital interfaces",
      "Mobile applications"
    ],
    "cultural_intuition": [
      "Futuristic technology",
      "Cyberpunk aesthetics",
      "Modern design",
      "Power and authority",
      "Innovation and progress"
    ],
    "search_keywords": [
      "Geometric sans-serif",
      "Bold font",
      "High x-height",
      "Open counters",
      "Angular letterforms",
      "Rounded terminals",
      "Futuristic",
      "Cyberpunk",
      "Headlines",
      "Logos",
      "Branding",
      "Digital interfaces",
      "Mobile applications",
      "Power",
      "Authority",
      "Innovation",
      "Progress",
      "Modern",
      "Mechanical",
      "Strong",
      "Assertive",
      "Legible"
    ]
  }
}