{
  "filename": "anderson_36px.png",
  "status": "success",
  "description": {
    "detailed_description": "Anderson is a stencil-inspired typeface that captures the bold, graphic aesthetic of hand-cut lettering. Its construction is defined by clean, geometric shapes with sharp, angular terminals, creating a strong, assertive presence. The letterforms are designed with a consistent stroke weight, resulting in a highly legible and impactful visual. The overall character of Anderson is confident and direct, evoking a sense of authority and strength. Its historical roots lie in the utilitarian nature of stencil lettering, often used for signage and branding. However, Anderson's contemporary relevance lies in its ability to convey a sense of urban grit and authenticity, making it suitable for projects that require a bold and impactful visual. The font's practical applications range from large-scale signage and branding to digital interfaces and editorial design. Its bold, graphic nature makes it effective for headlines, titles, and short bursts of text, while its legibility ensures readability even at smaller sizes. However, its strong, angular forms may not be ideal for extended body copy, especially at smaller point sizes. Anderson's cultural resonance lies in its association with street art, urban culture, and a DIY aesthetic. It evokes a sense of rebellion and individuality, making it a popular choice for projects that aim to convey a sense of authenticity and raw energy.",
    "technical_characteristics": [
      "Stencil-inspired construction",
      "Geometric shapes",
      "Sharp, angular terminals",
      "Consistent stroke weight",
      "High x-height",
      "Open counters",
      "Bold weight"
    ],
    "personality_traits": [
      "Bold and assertive",
      "Confident and direct",
      "Graphic and impactful",
      "Urban and gritty",
      "Authentic and raw",
      "Street-inspired",
      "Modern and edgy"
    ],
    "practical_contexts": [
      "Large-scale signage",
      "Branding and logos",
      "Headlines and titles",
      "Short bursts of text",
      "Digital interfaces",
      "Editorial design"
    ],
    "cultural_intuition": [
      "Street art and urban culture",
      "DIY aesthetic",
      "Rebellion and individuality",
      "Modern design trends",
      "Authenticity and raw energy"
    ],
    "search_keywords": [
      "stencil",
      "geometric",
      "bold",
      "graphic",
      "urban",
      "street art",
      "modern",
      "edgy",
      "impactful",
      "legible",
      "high x-height",
      "open counters",
      "sharp terminals",
      "consistent stroke weight",
      "signage",
      "branding",
      "headlines",
      "titles",
      "digital",
      "editorial",
      "authenticity",
      "raw energy",
      "DIY",
      "rebellion",
      "individuality"
    ]
  }
}