{
  "filename": "anillos_36px.png",
  "status": "success",
  "description": {
    "detailed_description": "Amillos is a display typeface characterized by its bold, geometric construction and playful, almost cartoonish details. The letters are built from simple, rounded shapes with sharp corners, creating a strong visual impact. The generous x-height and open counters ensure good legibility, even at large sizes. The font's playful nature is further emphasized by the exaggerated curves and angles, particularly in the lowercase letters and numerals. The overall effect is one of friendly confidence, suggesting a brand that is both bold and approachable. Amillos is well-suited for headlines, logos, and other applications where a strong visual presence is desired. Its playful nature makes it ideal for children's products, entertainment branding, and other contexts where a sense of fun and energy is important. The font's bold, geometric construction evokes a sense of modernism, while its playful details add a touch of whimsy. This combination makes Amillos a versatile typeface that can be used to create a wide range of visual effects.",
    "technical_characteristics": [
      "Geometric construction",
      "Rounded shapes with sharp corners",
      "Generous x-height",
      "Open counters",
      "Exaggerated curves and angles",
      "Bold weight",
      "Playful details"
    ],
    "personality_traits": [
      "Bold and approachable",
      "Friendly and confident",
      "Playful and energetic",
      "Modern and whimsical",
      "Visually impactful"
    ],
    "practical_contexts": [
      "Headlines",
      "Logos",
      "Children's products",
      "Entertainment branding",
      "Large-scale signage"
    ],
    "cultural_intuition": [
      "Evokes a sense of modernism",
      "Suggests a playful and fun brand",
      "Appeals to a wide audience",
      "Can be used to create a sense of excitement and energy"
    ],
    "search_keywords": [
      "Geometric sans-serif",
      "Display typeface",
      "Bold",
      "Playful",
      "Whimsical",
      "Modern",
      "Friendly",
      "Confident",
      "Headlines",
      "Logos",
      "Children's products",
      "Entertainment branding",
      "Large-scale signage",
      "Visual impact",
      "Legibility",
      "Exaggerated curves",
      "Sharp corners",
      "Open counters",
      "Generous x-height"
    ]
  }
}