{
  "filename": "anime_inept_36px.png",
  "status": "success",
  "description": {
    "detailed_description": "Anime Inert (36px) is a hand-drawn typeface that embodies a playful, almost childlike energy. Its irregular letterforms, characterized by rounded corners and exaggerated strokes, evoke the spontaneity of freehand drawing. The font's generous x-height and open counters contribute to its legibility, even at smaller sizes, while the inconsistent stroke weights add a sense of whimsy. This combination of technical clarity and expressive design makes it suitable for a range of applications, from casual branding and social media graphics to playful illustrations and children's books. The font's cultural associations lean towards contemporary internet culture, referencing the aesthetic of anime and manga, while also tapping into a broader sense of youthful exuberance and creative freedom.",
    "technical_characteristics": [
      "Hand-drawn aesthetic",
      "Irregular letterforms",
      "Rounded corners",
      "Exaggerated strokes",
      "Inconsistent stroke weights",
      "Generous x-height",
      "Open counters"
    ],
    "personality_traits": [
      "Playful",
      "Whimsical",
      "Spontaneous",
      "Childlike",
      "Energetic",
      "Expressive",
      "Casual"
    ],
    "practical_contexts": [
      "Casual branding",
      "Social media graphics",
      "Playful illustrations",
      "Children's books",
      "Headlines and titles",
      "Short text blocks"
    ],
    "cultural_intuition": [
      "Anime and manga aesthetic",
      "Contemporary internet culture",
      "Youthful exuberance",
      "Creative freedom",
      "Informal communication"
    ],
    "search_keywords": [
      "Hand-drawn",
      "Playful",
      "Whimsical",
      "Casual",
      "Anime",
      "Manga",
      "Children's",
      "Informal",
      "Social media",
      "Branding",
      "Illustration",
      "Graphic design",
      "Typography",
      "Font",
      "Typeface"
    ]
  }
}