{
  "filename": "annoyed_teenager_36px.png",
  "status": "success",
  "description": {
    "detailed_description": "\u201cAnnoyed Teenager\u201d is a script font that captures the raw energy of handwritten text, mimicking the casual, sometimes messy, style of a teenager's scrawl. The font's construction is intentionally loose, with inconsistent letterforms and varying stroke weights that contribute to its authentic, unpolished aesthetic. The ascenders and descenders are exaggerated, adding to the font's dynamic and expressive character. While the overall impression is playful and informal, the font maintains a degree of legibility, making it suitable for short bursts of text or headlines where a youthful, energetic vibe is desired. The font's cultural resonance lies in its ability to evoke a sense of rebellion and individuality, reminiscent of the teenage years when self-expression is paramount. It's a font that speaks to the digital generation, where authenticity and personal style are highly valued.  While its informal nature makes it less suitable for large blocks of text, it excels in digital contexts like social media graphics, website headers, or even informal branding where a touch of irreverence is desired.",
    "technical_characteristics": [
      "Inconsistent letterforms",
      "Varying stroke weights",
      "Exaggerated ascenders and descenders",
      "Loose construction",
      "Informal character",
      "Handwritten aesthetic"
    ],
    "personality_traits": [
      "Playful",
      "Energetic",
      "Informal",
      "Rebellious",
      "Individualistic",
      "Youthful",
      "Authentic",
      "Unpolished"
    ],
    "practical_contexts": [
      "Social media graphics",
      "Website headers",
      "Short bursts of text",
      "Headlines",
      "Informal branding"
    ],
    "cultural_intuition": [
      "Digital generation",
      "Self-expression",
      "Rebellion",
      "Individuality",
      "Youth culture"
    ],
    "search_keywords": [
      "Script font",
      "Handwritten",
      "Informal",
      "Playful",
      "Energetic",
      "Teenager",
      "Youthful",
      "Rebellious",
      "Digital",
      "Social media",
      "Website",
      "Branding",
      "Headline",
      "Graphic design",
      "Typography",
      "Font"
    ]
  }
}