{
  "filename": "antarctica_36px.png",
  "status": "success",
  "description": {
    "detailed_description": "Antarctica is a display typeface that embodies a bold, geometric aesthetic with a touch of retro charm. Its construction is based on strong, angular forms with a distinct three-dimensional effect achieved through multiple outlines and subtle shading. The letterforms are characterized by a consistent width, with a high x-height and open counters that contribute to its legibility even at large sizes. The terminals are sharp and angular, adding to the font's assertive personality. The overall effect is a confident and commanding presence, reminiscent of vintage signage and bold graphic design from the mid-20th century. While its geometric structure lends itself to a sense of order and clarity, the subtle shading and slight variations in letterform construction add a touch of playfulness and visual interest. Antarctica is ideally suited for headlines, logos, and branding applications where a strong visual impact is desired. Its retro aesthetic evokes a sense of nostalgia and vintage appeal, making it a suitable choice for projects that aim to capture a classic, yet modern, feel. The font's bold presence and distinct character make it a powerful tool for creating memorable visual experiences.",
    "technical_characteristics": [
      "Geometric construction",
      "Multiple outlines",
      "Three-dimensional effect",
      "High x-height",
      "Open counters",
      "Sharp terminals",
      "Consistent letter width"
    ],
    "personality_traits": [
      "Bold",
      "Geometric",
      "Retro",
      "Confident",
      "Commanding",
      "Playful",
      "Nostalgic",
      "Modern",
      "Vintage"
    ],
    "practical_contexts": [
      "Headlines",
      "Logos",
      "Branding",
      "Signage",
      "Graphic design",
      "Large-scale displays"
    ],
    "cultural_intuition": [
      "Mid-century design",
      "Vintage signage",
      "Retro futurism",
      "Modern classic",
      "Bold graphic design"
    ],
    "search_keywords": [
      "Geometric",
      "Display",
      "Bold",
      "Retro",
      "Vintage",
      "Three-dimensional",
      "High x-height",
      "Open counters",
      "Sharp terminals",
      "Headlines",
      "Logos",
      "Branding",
      "Signage",
      "Graphic design",
      "Mid-century",
      "Nostalgia",
      "Modern classic",
      "Assertive",
      "Commanding",
      "Playful",
      "Large-scale",
      "Concise",
      "Impactful"
    ]
  }
}