{
  "filename": "antherton_cloister_36px.png",
  "status": "success",
  "description": {
    "detailed_description": "Antherton Cloister is a display typeface that blends playful flourishes with a sense of classic elegance. Its construction is based on a combination of geometric and calligraphic principles, resulting in a unique visual language. The letters are characterized by their rounded forms, intricate details, and a consistent use of contrasting strokes. The ascenders and descenders are extended, adding to the font's whimsical character. The overall effect is one of playful sophistication, with a touch of vintage charm. While the font's intricate details make it ideal for headlines and decorative elements, its legibility is somewhat compromised at smaller sizes. Its playful nature makes it suitable for projects that require a touch of whimsy and personality, such as branding for children's products, invitations, or packaging. The font's intricate details and vintage aesthetic evoke a sense of nostalgia and craftsmanship, suggesting a connection to traditional printing techniques and a celebration of the art of typography.",
    "technical_characteristics": [
      "Rounded letterforms",
      "Intricate details",
      "Contrasting strokes",
      "Extended ascenders and descenders",
      "Geometric and calligraphic construction"
    ],
    "personality_traits": [
      "Playful",
      "Sophisticated",
      "Whimsical",
      "Elegant",
      "Vintage"
    ],
    "practical_contexts": [
      "Headlines",
      "Decorative elements",
      "Branding for children's products",
      "Invitations",
      "Packaging"
    ],
    "cultural_intuition": [
      "Nostalgia",
      "Craftsmanship",
      "Traditional printing techniques",
      "Celebration of typography",
      "Vintage aesthetic"
    ],
    "search_keywords": [
      "display typeface",
      "rounded letterforms",
      "intricate details",
      "contrasting strokes",
      "extended ascenders",
      "descenders",
      "geometric construction",
      "calligraphic principles",
      "playful",
      "sophisticated",
      "whimsical",
      "elegant",
      "vintage",
      "headlines",
      "decorative elements",
      "children's products",
      "branding",
      "invitations",
      "packaging",
      "nostalgia",
      "craftsmanship",
      "traditional printing",
      "typography",
      "vintage aesthetic"
    ]
  }
}