{
  "filename": "anti_folk_36px.png",
  "status": "success",
  "description": {
    "detailed_description": "Anti Folk is a display typeface that embraces a playful, almost chaotic aesthetic. Its construction is based on a series of geometric shapes, with each letterform built from a combination of squares, rectangles, and triangles. This geometric foundation gives the font a strong, almost mechanical feel, but it's tempered by the irregular, hand-drawn quality of the outlines. The letters are often slightly skewed or distorted, adding a sense of energy and unpredictability. The font's high x-height and open counters ensure good legibility, even at smaller sizes, while the bold strokes and sharp terminals create a sense of impact. Anti Folk's personality is both playful and assertive, suggesting a sense of irreverence and a willingness to break the rules. It evokes a sense of DIY culture and underground art, with a touch of retro nostalgia. The font's bold, graphic style makes it ideal for headlines, posters, and other attention-grabbing applications. It's particularly well-suited for projects that require a sense of energy, individuality, and a touch of rebellion.",
    "technical_characteristics": [
      "Geometric construction",
      "High x-height",
      "Open counters",
      "Bold strokes",
      "Sharp terminals",
      "Irregular outlines",
      "Distorted letterforms"
    ],
    "personality_traits": [
      "Playful",
      "Assertive",
      "Irreverent",
      "Energetic",
      "Unpredictable",
      "Graphic",
      "Bold"
    ],
    "practical_contexts": [
      "Headlines",
      "Posters",
      "Logos",
      "Packaging",
      "Digital interfaces"
    ],
    "cultural_intuition": [
      "DIY culture",
      "Underground art",
      "Retro nostalgia",
      "Street art",
      "Punk rock"
    ],
    "search_keywords": [
      "Geometric",
      "Display",
      "Bold",
      "High x-height",
      "Open counters",
      "Sharp terminals",
      "Irregular",
      "Distorted",
      "Playful",
      "Assertive",
      "Energetic",
      "Graphic",
      "DIY",
      "Underground",
      "Retro",
      "Nostalgia",
      "Headlines",
      "Posters",
      "Logos",
      "Packaging",
      "Digital",
      "Street art",
      "Punk rock"
    ]
  }
}