{
  "filename": "antraxja_goth_1938_36px.png",
  "status": "success",
  "description": {
    "detailed_description": "Antraxja Goth is a blackletter typeface that embodies a classic gothic aesthetic with a contemporary twist. Its construction is rooted in traditional blackletter forms, featuring sharp, angular strokes and intricate details like serifs and flourishes. The letterforms are tightly spaced, creating a sense of density and formality. However, the font's overall character is softened by subtle humanist touches, such as slightly rounded terminals and a less extreme contrast between thick and thin strokes. This balance between traditional and modern elements gives Antraxja Goth a unique personality, making it both visually striking and approachable. The font's bold, confident presence makes it suitable for headlines, logos, and branding projects that require a strong visual impact. Its intricate details and historical references also lend themselves to projects with a vintage or gothic aesthetic. However, its legibility is somewhat compromised at smaller sizes due to the intricate details and tight spacing, making it less suitable for body text or extended reading. Antraxja Goth evokes a sense of history and tradition, while also suggesting a contemporary edge. Its bold, confident presence is reminiscent of medieval manuscripts and gothic architecture, but its subtle humanist touches and overall readability make it feel relevant to modern design sensibilities.",
    "technical_characteristics": [
      "Blackletter construction",
      "Sharp, angular strokes",
      "Intricate serifs and flourishes",
      "Tight letter spacing",
      "Subtly rounded terminals",
      "Moderate contrast between thick and thin strokes",
      "High x-height"
    ],
    "personality_traits": [
      "Bold and confident",
      "Visually striking",
      "Approachable",
      "Formal",
      "Traditional",
      "Modern",
      "Intricate"
    ],
    "practical_contexts": [
      "Headlines",
      "Logos",
      "Branding",
      "Display typography",
      "Vintage-inspired designs",
      "Gothic-themed projects"
    ],
    "cultural_intuition": [
      "Medieval manuscripts",
      "Gothic architecture",
      "Historical tradition",
      "Contemporary design sensibilities",
      "Strong visual impact"
    ],
    "search_keywords": [
      "Blackletter",
      "Gothic",
      "Serif",
      "Display",
      "Headline",
      "Logo",
      "Branding",
      "Vintage",
      "Traditional",
      "Modern",
      "Formal",
      "Intricate",
      "Bold",
      "Confident",
      "Approachable",
      "Legibility",
      "Tight spacing",
      "High x-height",
      "Humanist",
      "Rounded terminals",
      "Medieval",
      "Architecture",
      "History",
      "Contemporary",
      "Design",
      "Visual impact"
    ]
  }
}