{
  "filename": "anttashalam_36px.png",
  "status": "success",
  "description": {
    "detailed_description": "Anttashaalam is a playful script font that balances a casual, handwritten aesthetic with a degree of formal structure. The letterforms are characterized by flowing curves and rounded terminals, creating a sense of movement and energy. While the overall style is informal, the consistent stroke weights and well-defined letterforms lend a touch of sophistication. The font's generous x-height and open counters ensure good legibility, even at smaller sizes. This combination of playful energy and controlled structure makes Anttashaalam suitable for a wide range of applications, from branding and packaging to social media graphics and website design. Its friendly and approachable personality evokes a sense of warmth and approachability, making it ideal for projects that aim to connect with audiences on a personal level. The font's contemporary relevance lies in its ability to capture the spirit of handwritten communication in a digital age, while its cultural associations hint at a sense of creativity and individuality.",
    "technical_characteristics": [
      "flowing curves",
      "rounded terminals",
      "consistent stroke weights",
      "generous x-height",
      "open counters"
    ],
    "personality_traits": [
      "playful",
      "casual",
      "approachable",
      "friendly",
      "energetic"
    ],
    "practical_contexts": [
      "branding and packaging",
      "social media graphics",
      "website design",
      "handwritten-style typography",
      "casual and informal communication"
    ],
    "cultural_intuition": [
      "evokes a sense of warmth and approachability",
      "captures the spirit of handwritten communication",
      "suggests creativity and individuality",
      "contemporary digital aesthetic",
      "casual and friendly tone"
    ],
    "search_keywords": [
      "script font",
      "handwritten",
      "playful",
      "casual",
      "approachable",
      "friendly",
      "energetic",
      "flowing curves",
      "rounded terminals",
      "consistent stroke weights",
      "generous x-height",
      "open counters",
      "branding",
      "packaging",
      "social media",
      "website design",
      "digital",
      "contemporary",
      "individuality",
      "creative"
    ]
  }
}