{
  "filename": "apd_36px.png",
  "status": "success",
  "description": {
    "detailed_description": "This font, with its playful yet legible script style, embodies a contemporary approach to handwritten typography. The letterforms are characterized by a combination of organic curves and slightly angular strokes, creating a dynamic and engaging visual rhythm. The generous x-height and open counters ensure readability even at smaller sizes, making it suitable for both digital and print applications. The font's overall character is friendly and approachable, with a hint of whimsy that adds personality to any project. Its casual yet refined aesthetic evokes a sense of authenticity and warmth, making it ideal for branding, social media graphics, and editorial design. The font's versatility allows it to seamlessly blend with modern design trends while retaining a timeless appeal.",
    "technical_characteristics": [
      "Handwritten style",
      "Organic curves",
      "Slightly angular strokes",
      "Generous x-height",
      "Open counters",
      "Consistent stroke weight",
      "Varied letterforms"
    ],
    "personality_traits": [
      "Playful",
      "Legible",
      "Friendly",
      "Approachable",
      "Whimsical",
      "Casual",
      "Refined"
    ],
    "practical_contexts": [
      "Branding",
      "Social media graphics",
      "Editorial design",
      "Web design",
      "Packaging",
      "Handwritten notes"
    ],
    "cultural_intuition": [
      "Modern handwritten aesthetic",
      "Authenticity and warmth",
      "Casual yet refined",
      "Digital-native design",
      "Contemporary design trends"
    ],
    "search_keywords": [
      "Handwritten",
      "Script",
      "Playful",
      "Legible",
      "Friendly",
      "Casual",
      "Refined",
      "Modern",
      "Contemporary",
      "Branding",
      "Social media",
      "Editorial",
      "Web design",
      "Packaging",
      "Digital",
      "Print",
      "Typography",
      "Font",
      "Typeface"
    ]
  }
}