{
  "filename": "arab_dances_36px.png",
  "status": "success",
  "description": {
    "detailed_description": "Arab Dances is a calligraphic script font that blends traditional Arabic letterforms with a playful, contemporary twist. The characters are constructed with a fluid, expressive stroke, featuring generous curves and dramatic flourishes. The overall impression is one of movement and energy, reminiscent of traditional Arabic calligraphy but with a modern, almost whimsical feel. The font's high x-height and open counters ensure good legibility, even at smaller sizes, making it suitable for both display and body text applications. Its playful nature makes it ideal for branding, packaging, and digital interfaces that require a touch of personality and visual interest. The font's cultural associations with Arabic calligraphy and its contemporary, almost whimsical feel make it a unique and versatile choice for projects that seek to evoke a sense of tradition and modernity.",
    "technical_characteristics": [
      "Calligraphic construction",
      "Fluid, expressive stroke",
      "Generous curves",
      "Dramatic flourishes",
      "High x-height",
      "Open counters"
    ],
    "personality_traits": [
      "Playful",
      "Whimsical",
      "Energetic",
      "Expressive",
      "Modern",
      "Traditional",
      "Fluid"
    ],
    "practical_contexts": [
      "Branding",
      "Packaging",
      "Digital interfaces",
      "Display text",
      "Body text"
    ],
    "cultural_intuition": [
      "Arabic calligraphy",
      "Modern interpretation of tradition",
      "Playful and energetic",
      "Contemporary design aesthetic"
    ],
    "search_keywords": [
      "Calligraphic",
      "Script",
      "Arabic",
      "Playful",
      "Whimsical",
      "Energetic",
      "Modern",
      "Traditional",
      "Display",
      "Body text",
      "Branding",
      "Packaging",
      "Digital",
      "High x-height",
      "Open counters",
      "Fluid",
      "Expressive",
      "Flourishes",
      "Curves"
    ]
  }
}