{
  "filename": "arabolical_36px.png",
  "status": "success",
  "description": {
    "detailed_description": "Arabolical is a playful and expressive script font that draws inspiration from both Arabic calligraphy and informal handwriting. Its organic forms are characterized by bold strokes, sweeping curves, and dramatic flourishes, creating a sense of dynamic energy and movement. The font's construction is based on a combination of geometric and calligraphic principles, resulting in a unique blend of structure and spontaneity. The letterforms are intentionally irregular, with varying widths and heights, adding to the font's hand-drawn aesthetic. While the overall impression is one of casual informality, the font's bold strokes and confident curves also convey a sense of strength and personality. Arabolical is well-suited for headlines, logos, and other applications where a bold and expressive visual impact is desired. Its playful nature makes it ideal for branding projects targeting younger audiences or conveying a sense of fun and energy. However, its irregular forms and large x-height may limit its legibility in smaller sizes or extended text blocks.",
    "technical_characteristics": [
      "Organic forms",
      "Bold strokes",
      "Sweeping curves",
      "Dramatic flourishes",
      "Irregular letterforms",
      "Varying widths and heights",
      "Large x-height",
      "Open counters"
    ],
    "personality_traits": [
      "Playful",
      "Expressive",
      "Dynamic",
      "Energetic",
      "Bold",
      "Confident",
      "Casual",
      "Informal",
      "Hand-drawn"
    ],
    "practical_contexts": [
      "Headlines",
      "Logos",
      "Branding",
      "Posters",
      "Social media graphics",
      "Short text blocks"
    ],
    "cultural_intuition": [
      "Arabic calligraphy",
      "Informal handwriting",
      "Street art",
      "Urban culture",
      "Modern design"
    ],
    "search_keywords": [
      "Arabolical",
      "script font",
      "handwritten",
      "playful",
      "expressive",
      "bold",
      "dynamic",
      "organic",
      "calligraphy",
      "Arabic",
      "informal",
      "casual",
      "street art",
      "urban",
      "modern",
      "headlines",
      "logos",
      "branding",
      "posters",
      "social media",
      "graphics",
      "large x-height",
      "open counters",
      "irregular letterforms",
      "sweeping curves",
      "dramatic flourishes"
    ]
  }
}