{
  "filename": "architext_36px.png",
  "status": "success",
  "description": {
    "detailed_description": "Architect is a sans-serif typeface that embodies a clean, geometric aesthetic with a touch of humanist warmth. Its construction is based on precise angles and straight lines, creating a sense of order and clarity. The letterforms are carefully balanced, with a consistent stroke weight and open counters that ensure excellent legibility. While the overall impression is modern and minimalist, subtle curves in the terminals and a slight variation in stroke thickness add a touch of approachability, preventing the font from feeling overly cold or sterile. This balance between geometric precision and humanist detail makes Architect suitable for a wide range of applications, from corporate branding and website design to editorial layouts and digital interfaces. Its clean lines and strong legibility make it ideal for large-scale displays and small-scale text, while its subtle warmth allows it to convey a sense of professionalism without feeling overly formal. Architect's geometric construction and clean lines evoke a sense of efficiency and modernity, reminiscent of the architectural style of the mid-20th century. Its subtle humanist details, however, add a touch of approachability and warmth, making it feel less sterile and more inviting than purely geometric typefaces. This combination of technical precision and human touch makes Architect a versatile and engaging typeface that can be used to create a wide range of visual experiences.",
    "technical_characteristics": [
      "Geometric construction",
      "Consistent stroke weight",
      "Open counters",
      "Slightly rounded terminals",
      "Slight variation in stroke thickness",
      "High x-height"
    ],
    "personality_traits": [
      "Clean and geometric",
      "Modern and minimalist",
      "Professional and efficient",
      "Approachable and inviting",
      "Versatile and engaging"
    ],
    "practical_contexts": [
      "Corporate branding",
      "Website design",
      "Editorial layouts",
      "Digital interfaces",
      "Large-scale displays",
      "Small-scale text"
    ],
    "cultural_intuition": [
      "Mid-century modernism",
      "Digital-native design",
      "Professionalism and efficiency",
      "Approachability and warmth",
      "Versatility and adaptability"
    ],
    "search_keywords": [
      "sans-serif",
      "geometric",
      "minimalist",
      "modern",
      "clean",
      "legible",
      "professional",
      "versatile",
      "corporate",
      "website",
      "editorial",
      "digital",
      "display",
      "text",
      "mid-century",
      "architecture",
      "humanist",
      "approachable",
      "warmth",
      "efficiency",
      "adaptable"
    ]
  }
}