{
  "filename": "archierotick_36px.png",
  "status": "success",
  "description": {
    "detailed_description": "This font is a bold statement of deconstruction and playful chaos. Each letter is a fragmented, irregular shape, seemingly torn from a larger surface. The jagged edges and uneven lines create a sense of urgency and immediacy, while the rough, textured surfaces add a gritty, almost tactile quality. The font's irregular spacing and inconsistent letter heights further contribute to its chaotic energy, evoking a sense of spontaneity and raw expression. While the font's legibility is compromised at smaller sizes, its impact is undeniable at larger scales, making it ideal for headlines, posters, and other bold visual statements. The font's raw, unpolished aesthetic speaks to a contemporary fascination with imperfection and the beauty of the handmade, while its chaotic energy resonates with the fast-paced, unpredictable nature of modern life.",
    "technical_characteristics": [
      "fragmented letterforms",
      "jagged edges",
      "uneven lines",
      "rough textures",
      "irregular spacing",
      "inconsistent letter heights"
    ],
    "personality_traits": [
      "chaotic",
      "urgent",
      "spontaneous",
      "raw",
      "unpolished",
      "gritty",
      "bold",
      "energetic",
      "imperfect",
      "handmade"
    ],
    "practical_contexts": [
      "headlines",
      "posters",
      "bold visual statements",
      "large-scale displays",
      "graphic design",
      "street art",
      "punk rock aesthetics"
    ],
    "cultural_intuition": [
      "contemporary fascination with imperfection",
      "beauty of the handmade",
      "fast-paced, unpredictable nature of modern life",
      "punk rock and DIY culture",
      "urban street art"
    ],
    "search_keywords": [
      "deconstructed",
      "fragmented",
      "jagged",
      "rough",
      "textured",
      "irregular",
      "chaotic",
      "urgent",
      "spontaneous",
      "raw",
      "unpolished",
      "gritty",
      "bold",
      "energetic",
      "imperfect",
      "handmade",
      "headlines",
      "posters",
      "large-scale",
      "graphic design",
      "street art",
      "punk rock",
      "DIY",
      "urban",
      "contemporary",
      "modern",
      "chaos",
      "urgency",
      "spontaneity",
      "imperfection"
    ]
  }
}