{
  "filename": "archeologicaps_36px.png",
  "status": "success",
  "description": {
    "detailed_description": "Archeologicaps, designed by Manfred Klein, is a captivating display typeface that blends classical Roman letterforms with a distinct architectural sensibility. Its geometric construction, evident in the precise angles and consistent stroke widths, evokes the grandeur of ancient structures. The high x-height and open counters ensure strong legibility, even at large sizes, making it ideal for impactful headlines and branding elements. The subtle humanist details, such as the slightly rounded terminals and the gentle curves in the lowercase letters, add a touch of warmth and approachability, preventing the font from feeling overly austere. This balance between geometric precision and humanist warmth creates a unique personality that is both authoritative and inviting. Archeologicaps is particularly effective in applications that require a sense of history, tradition, and sophistication, such as museum signage, historical publications, and luxury branding. Its bold presence and architectural references evoke a sense of timelessness and grandeur, while its subtle humanist details ensure a sense of accessibility and approachability. The font's cultural resonance lies in its connection to classical architecture and the enduring legacy of ancient civilizations, suggesting a sense of permanence and enduring value.",
    "technical_characteristics": [
      "Geometric construction",
      "High x-height",
      "Open counters",
      "Consistent stroke widths",
      "Slightly rounded terminals",
      "Humanist details",
      "Bold weight"
    ],
    "personality_traits": [
      "Authoritative",
      "Inviting",
      "Sophisticated",
      "Timeless",
      "Grand",
      "Accessible",
      "Durable"
    ],
    "practical_contexts": [
      "Headlines",
      "Branding elements",
      "Museum signage",
      "Historical publications",
      "Luxury branding"
    ],
    "cultural_intuition": [
      "Classical architecture",
      "Ancient civilizations",
      "Enduring legacy",
      "Permanence",
      "Sophistication"
    ],
    "search_keywords": [
      "Geometric sans-serif",
      "Display typeface",
      "High x-height",
      "Open counters",
      "Bold weight",
      "Architectural",
      "Classical",
      "Roman",
      "Humanist",
      "Sophisticated",
      "Timeless",
      "Grand",
      "Authoritative",
      "Accessible",
      "Durable",
      "Museum",
      "Historical",
      "Luxury",
      "Branding",
      "Signage",
      "Publications"
    ]
  }
}