{
  "filename": "ardies_36px.png",
  "status": "success",
  "description": {
    "detailed_description": "Ardies is a playful script font that captures the energy of hand-drawn lettering. Its rounded forms and bouncy curves create a sense of movement and whimsy, reminiscent of vintage comic book lettering or handwritten notes. The font's irregular baseline and varying stroke weights add to its casual charm, while the generous x-height and open counters ensure good legibility even at smaller sizes. Ardies is well-suited for headlines, logos, and packaging designs where a touch of personality and visual interest is desired. Its informal character makes it ideal for projects targeting younger audiences or conveying a sense of fun and approachability. The font's bold strokes and playful curves evoke a sense of childlike wonder and nostalgia, suggesting a connection to a simpler, more carefree time.",
    "technical_characteristics": [
      "Rounded forms",
      "Bouncy curves",
      "Irregular baseline",
      "Varying stroke weights",
      "Generous x-height",
      "Open counters"
    ],
    "personality_traits": [
      "Playful",
      "Whimsical",
      "Casual",
      "Informal",
      "Energetic"
    ],
    "practical_contexts": [
      "Headlines",
      "Logos",
      "Packaging designs",
      "Social media graphics",
      "Children's books"
    ],
    "cultural_intuition": [
      "Vintage comic book lettering",
      "Handwritten notes",
      "Childlike wonder",
      "Nostalgia",
      "Fun and approachability"
    ],
    "search_keywords": [
      "Script font",
      "Playful font",
      "Handwritten font",
      "Comic font",
      "Casual font",
      "Rounded forms",
      "Bouncy curves",
      "Irregular baseline",
      "Varying stroke weights",
      "Generous x-height",
      "Open counters",
      "Headlines",
      "Logos",
      "Packaging",
      "Social media",
      "Children's books",
      "Vintage",
      "Nostalgia",
      "Fun",
      "Approachable"
    ]
  }
}