{
  "filename": "argor_biw_scaqh_36px.png",
  "status": "success",
  "description": {
    "detailed_description": "Argor Black Scratch is a bold, highly stylized blackletter font that draws heavily from medieval scriptural styles. Its thick strokes and sharp angles create a dramatic and imposing presence, while the intricate flourishes and extended serifs add a sense of ornate detail. The font's construction is based on traditional blackletter principles, with a strong emphasis on verticality and a pronounced contrast between thick and thin strokes. The letterforms are tightly packed, with minimal spacing between characters, contributing to its dense and visually impactful appearance. This font's personality is undeniably dramatic and assertive, evoking a sense of history and tradition. It carries a strong gothic aesthetic, suggesting themes of power, mystery, and perhaps even a touch of darkness. While its historical roots are clear, Argor Black Scratch also possesses a contemporary edge, making it suitable for projects that require a bold and striking visual statement. Its bold presence and intricate details make it ideal for headlines, logos, and other graphic elements where a strong visual impact is desired. However, its intricate details and tight spacing may limit its legibility in smaller sizes or for extended blocks of text. Despite its historical origins, Argor Black Scratch feels surprisingly modern, perhaps due to its bold and graphic nature. It evokes a sense of rebellion and individuality, suggesting a connection to contemporary subcultures that embrace gothic aesthetics and a sense of counter-culture.",
    "technical_characteristics": [
      "Blackletter construction",
      "High contrast between thick and thin strokes",
      "Intricate flourishes and extended serifs",
      "Tight letter spacing",
      "Bold weight",
      "Sharp angles",
      "Vertical emphasis"
    ],
    "personality_traits": [
      "Dramatic",
      "Assertive",
      "Ornate",
      "Gothic",
      "Powerful",
      "Mysterious",
      "Rebellious",
      "Individualistic",
      "Bold",
      "Graphic"
    ],
    "practical_contexts": [
      "Headlines",
      "Logos",
      "Graphic elements",
      "Posters",
      "Packaging",
      "Titles",
      "Short text blocks"
    ],
    "cultural_intuition": [
      "Medieval scriptural styles",
      "Gothic aesthetics",
      "Counter-culture",
      "Rebellion",
      "Individuality",
      "Power",
      "Mystery"
    ],
    "search_keywords": [
      "Blackletter",
      "Gothic",
      "Medieval",
      "Scriptural",
      "Bold",
      "Scratch",
      "Argor",
      "Ornate",
      "Flourishes",
      "Serifs",
      "Dramatic",
      "Assertive",
      "Powerful",
      "Mysterious",
      "Rebellious",
      "Individualistic",
      "Headlines",
      "Logos",
      "Graphic elements",
      "Posters",
      "Packaging",
      "Titles",
      "Counter-culture",
      "History",
      "Tradition",
      "Contemporary",
      "Modern",
      "Typography",
      "Font",
      "Typeface"
    ]
  }
}