{
  "filename": "ariana_violeta_36px.png",
  "status": "success",
  "description": {
    "detailed_description": "Ariana Violeta is a flowing script typeface that captures the essence of elegant handwriting. Its fluid strokes and graceful curves create a sense of effortless movement, reminiscent of a calligrapher's pen gliding across the page. The font's generous x-height and open counters ensure excellent legibility, even at smaller sizes, making it suitable for both display and body text applications. The subtle variations in stroke weight and the gentle, rounded terminals add a touch of warmth and personality, preventing the font from feeling overly formal or stiff. Ariana Violeta's design evokes a sense of classic charm and timeless sophistication, making it ideal for projects that require a touch of elegance and refinement. Its versatility allows it to be used for a wide range of applications, from wedding invitations and branding materials to website headers and social media graphics.",
    "technical_characteristics": [
      "flowing script style",
      "generous x-height",
      "open counters",
      "subtle stroke weight variations",
      "rounded terminals",
      "graceful curves",
      "fluid strokes"
    ],
    "personality_traits": [
      "elegant",
      "effortless",
      "graceful",
      "warm",
      "sophisticated",
      "classic",
      "refined"
    ],
    "practical_contexts": [
      "wedding invitations",
      "branding materials",
      "website headers",
      "social media graphics",
      "display text",
      "body text"
    ],
    "cultural_intuition": [
      "evokes a sense of classic charm",
      "suggests timeless sophistication",
      "reminiscent of elegant handwriting",
      "captures the essence of a calligrapher's art",
      "ideal for projects that require a touch of refinement"
    ],
    "search_keywords": [
      "script typeface",
      "flowing script",
      "elegant handwriting",
      "calligraphy",
      "generous x-height",
      "open counters",
      "legibility",
      "display text",
      "body text",
      "wedding invitations",
      "branding",
      "website headers",
      "social media",
      "classic charm",
      "timeless sophistication",
      "refined",
      "versatile"
    ]
  }
}