{
  "filename": "arigato_36px.png",
  "status": "success",
  "description": {
    "detailed_description": "Arigatto is a playful script font that captures the energy of handwritten lettering. Its rounded forms and fluid strokes create a sense of movement and informality, while the bold weight and consistent stroke width ensure legibility. The font's organic construction, with its uneven letterforms and subtle variations in stroke thickness, adds a touch of personality and authenticity. The generous x-height and open counters contribute to its readability, making it suitable for both display and body text applications. Arigatto's casual charm and expressive nature make it ideal for branding projects, social media graphics, and informal communications, evoking a sense of warmth and approachability. Its contemporary feel and versatility allow it to seamlessly integrate into modern design trends, while its handwritten aesthetic adds a touch of human connection.",
    "technical_characteristics": [
      "Rounded forms",
      "Fluid strokes",
      "Uneven letterforms",
      "Bold weight",
      "Consistent stroke width",
      "Generous x-height",
      "Open counters",
      "Organic construction"
    ],
    "personality_traits": [
      "Playful",
      "Informal",
      "Expressive",
      "Casual",
      "Authentic",
      "Warm",
      "Approachable",
      "Versatile"
    ],
    "practical_contexts": [
      "Branding projects",
      "Social media graphics",
      "Informal communications",
      "Display text",
      "Body text"
    ],
    "cultural_intuition": [
      "Modern design trends",
      "Handwritten aesthetic",
      "Human connection",
      "Casual communication",
      "Digital-native design"
    ],
    "search_keywords": [
      "Script font",
      "Handwritten font",
      "Playful font",
      "Informal font",
      "Rounded forms",
      "Fluid strokes",
      "Bold weight",
      "Generous x-height",
      "Open counters",
      "Branding",
      "Social media",
      "Digital design",
      "Casual communication",
      "Modern design",
      "Handwritten aesthetic"
    ]
  }
}