{
  "filename": "arkham_36px.png",
  "status": "success",
  "description": {
    "detailed_description": "Arkham is a blackletter typeface that blends traditional gothic forms with a contemporary sensibility. Its construction is rooted in classic blackletter anatomy, featuring sharp, angular strokes and pronounced serifs. However, the overall proportions are more balanced and less compressed than many traditional blackletters, resulting in a more legible and less intimidating aesthetic. The ascenders and descenders are well-defined, creating a strong vertical rhythm, while the open counters and generous x-height enhance readability. The font's distinctive features include the elongated, pointed terminals, the dramatic swashes on letters like 'f' and 'g', and the subtle variations in stroke weight that add visual interest. The overall execution is clean and precise, with a high level of detail and craftsmanship evident in the subtle curves and angles. Arkham's personality is both bold and refined, evoking a sense of mystery and intrigue. It draws inspiration from historical blackletter styles, particularly those associated with medieval manuscripts and gothic architecture. However, its contemporary proportions and balanced structure make it feel less archaic and more adaptable to modern design contexts. Arkham's cultural associations range from the gothic and macabre to the literary and scholarly. It can evoke images of ancient texts, dark fantasy worlds, or even the world of classic horror literature. In practical terms, Arkham is well-suited for display applications, particularly in titles, headings, and branding elements. Its strong visual presence and distinctive character make it ideal for projects that require a touch of drama and intrigue. However, its intricate details and bold forms may limit its effectiveness in smaller sizes or for extended body text. Arkham's performance characteristics are best suited for large-scale applications where its intricate details can be appreciated. It is less effective in small sizes or for extended reading, as its sharp angles and complex forms can strain the eye.",
    "technical_characteristics": [
      "Blackletter construction",
      "Sharp, angular strokes",
      "Pronounced serifs",
      "Balanced proportions",
      "Open counters",
      "High x-height",
      "Elongated, pointed terminals",
      "Dramatic swashes",
      "Variations in stroke weight"
    ],
    "personality_traits": [
      "Bold and refined",
      "Mysterious and intriguing",
      "Dramatic and expressive",
      "Legible and approachable",
      "Historically inspired",
      "Contemporary sensibility"
    ],
    "practical_contexts": [
      "Display typography",
      "Titles and headings",
      "Branding elements",
      "Logos and icons",
      "Limited body text"
    ],
    "cultural_intuition": [
      "Gothic and macabre",
      "Literary and scholarly",
      "Medieval manuscripts",
      "Gothic architecture",
      "Dark fantasy worlds"
    ],
    "search_keywords": [
      "Blackletter",
      "Gothic",
      "Display",
      "Serif",
      "Bold",
      "Intriguing",
      "Legible",
      "Medieval",
      "Contemporary",
      "Fantasy",
      "Horror",
      "Title",
      "Heading",
      "Branding",
      "Logo",
      "Icon"
    ]
  }
}