{
  "filename": "armata_36px.png",
  "status": "success",
  "description": {
    "detailed_description": "Armata is a sans-serif typeface that blends a geometric foundation with subtle humanist touches, resulting in a font that is both modern and approachable. Its construction is primarily geometric, with clean lines and consistent stroke weights, giving it a sense of order and clarity. However, the slightly rounded terminals and the subtle curves in the lowercase letters, particularly in the 'a' and 'g', add a touch of warmth and personality. This balance between geometric precision and humanist detail creates a font that is both legible and engaging. The high x-height and open counters ensure readability even at small sizes, making it suitable for digital interfaces and body text. The overall character of Armata is confident and contemporary, with a hint of playfulness. It evokes a sense of professionalism without feeling overly formal, making it suitable for a wide range of applications, from branding and marketing materials to website design and mobile apps. The font's cultural resonance lies in its ability to bridge the gap between traditional typographic principles and contemporary design trends. It feels both familiar and fresh, reflecting the evolving landscape of digital communication.",
    "technical_characteristics": [
      "Geometric construction",
      "Consistent stroke weights",
      "High x-height",
      "Open counters",
      "Slightly rounded terminals",
      "Subtle curves in lowercase letters"
    ],
    "personality_traits": [
      "Confidently geometric",
      "Subtly humanist",
      "Approachable and friendly",
      "Modern and contemporary",
      "Legible and engaging"
    ],
    "practical_contexts": [
      "Digital interfaces",
      "Website design",
      "Mobile apps",
      "Branding and marketing materials",
      "Body text"
    ],
    "cultural_intuition": [
      "Evokes a sense of professionalism",
      "Reflects the evolving landscape of digital communication",
      "Feels both familiar and fresh",
      "Bridges the gap between traditional and contemporary design"
    ],
    "search_keywords": [
      "sans-serif",
      "geometric",
      "humanist",
      "legible",
      "approachable",
      "modern",
      "contemporary",
      "digital",
      "interface",
      "website",
      "mobile",
      "branding",
      "marketing",
      "body text",
      "high x-height",
      "open counters",
      "rounded terminals",
      "curves",
      "confident",
      "playful",
      "professional",
      "familiar",
      "fresh"
    ]
  }
}