{
  "filename": "art_class_36px.png",
  "status": "success",
  "description": {
    "detailed_description": "Art Class (360px) is a handwritten script font that captures the casual, expressive energy of a student's notebook. Its organic forms and uneven strokes create a sense of immediacy and authenticity, reminiscent of a quick sketch or a personal note. The font's generous x-height and open counters ensure legibility, even at smaller sizes, while the playful variations in letterforms add a touch of personality. The font's overall character is both approachable and engaging, making it suitable for projects that require a friendly and informal tone. Its versatility allows it to be used for a wide range of applications, from social media graphics and website headers to handwritten notes and personal branding. The font's cultural resonance lies in its connection to the DIY aesthetic and the value of authenticity in contemporary design. It evokes a sense of creativity and individuality, reflecting the spirit of self-expression that is prevalent in digital culture.",
    "technical_characteristics": [
      "Handwritten style",
      "Organic forms",
      "Uneven strokes",
      "Generous x-height",
      "Open counters",
      "Playful variations in letterforms"
    ],
    "personality_traits": [
      "Casual and expressive",
      "Approachable and engaging",
      "Informal and friendly",
      "Authentic and genuine",
      "Creative and individualistic"
    ],
    "practical_contexts": [
      "Social media graphics",
      "Website headers",
      "Handwritten notes",
      "Personal branding",
      "Informal publications"
    ],
    "cultural_intuition": [
      "DIY aesthetic",
      "Authenticity in design",
      "Self-expression in digital culture",
      "Creativity and individuality",
      "Casual and approachable communication"
    ],
    "search_keywords": [
      "handwritten",
      "script",
      "casual",
      "expressive",
      "organic",
      "authentic",
      "approachable",
      "engaging",
      "informal",
      "friendly",
      "legible",
      "versatile",
      "social media",
      "website",
      "branding",
      "DIY",
      "digital culture",
      "self-expression",
      "creative",
      "individualistic"
    ]
  }
}