{
  "filename": "asdafdasg_36px.png",
  "status": "success",
  "description": {
    "detailed_description": "This font, with its flowing curves and playful letterforms, embodies a casual, handwritten aesthetic. The irregular baseline and varying stroke weights create a sense of natural, spontaneous writing. The rounded terminals and open counters contribute to its friendly, approachable character. While the overall impression is informal, the font maintains a degree of legibility, making it suitable for short text blocks or headings. Its casual charm evokes a sense of personal connection, making it ideal for branding projects that emphasize authenticity and warmth. The font's versatility extends to digital applications, where it can add a touch of personality to social media graphics, website headers, or even handwritten-style notes.",
    "technical_characteristics": [
      "Handwritten style",
      "Irregular baseline",
      "Varying stroke weights",
      "Rounded terminals",
      "Open counters",
      "Casual letterforms"
    ],
    "personality_traits": [
      "Playful",
      "Casual",
      "Friendly",
      "Approachable",
      "Authentic",
      "Warm",
      "Informal",
      "Spontaneous"
    ],
    "practical_contexts": [
      "Social media graphics",
      "Website headers",
      "Handwritten-style notes",
      "Branding projects",
      "Short text blocks",
      "Headings"
    ],
    "cultural_intuition": [
      "Evokes a sense of personal connection",
      "Suggests authenticity and warmth",
      "Reflects a casual, modern aesthetic",
      "Connects to the trend of handwritten typography"
    ],
    "search_keywords": [
      "Handwritten",
      "Script",
      "Casual",
      "Playful",
      "Informal",
      "Friendly",
      "Warm",
      "Authentic",
      "Social media",
      "Website",
      "Branding",
      "Typography",
      "Font",
      "Type",
      "Design",
      "Digital",
      "Modern",
      "Trend",
      "Legibility",
      "Versatility"
    ]
  }
}