{
  "filename": "aspargo_36px.png",
  "status": "success",
  "description": {
    "detailed_description": "Aspargo is a handwritten script font that captures the casual charm of everyday writing. Its irregular letterforms, with their varying stroke weights and playful curves, evoke the spontaneity of penmanship. The font's generous x-height and open counters ensure good legibility, even at smaller sizes, making it suitable for both display and body text. The slightly angled ascenders and descenders add a dynamic feel, while the rounded terminals soften the overall impression. Aspargo's informal character makes it ideal for projects that require a friendly and approachable tone, such as branding for creative businesses, social media graphics, or handwritten notes. Its casual aesthetic evokes a sense of authenticity and personal connection, reflecting the growing trend towards handwritten typography in digital spaces.",
    "technical_characteristics": [
      "Handwritten style",
      "Irregular letterforms",
      "Varying stroke weights",
      "Generous x-height",
      "Open counters",
      "Rounded terminals",
      "Angled ascenders and descenders"
    ],
    "personality_traits": [
      "Casual and playful",
      "Spontaneous and energetic",
      "Friendly and approachable",
      "Authentic and personal",
      "Informal and relaxed"
    ],
    "practical_contexts": [
      "Branding for creative businesses",
      "Social media graphics",
      "Handwritten notes",
      "Display text in digital and print media",
      "Body text for informal publications"
    ],
    "cultural_intuition": [
      "Reflects the trend towards handwritten typography in digital spaces",
      "Evokes a sense of authenticity and personal connection",
      "Captures the casual charm of everyday writing",
      "Suggests a sense of creativity and individuality",
      "Connects with the growing appreciation for handcrafted aesthetics"
    ],
    "search_keywords": [
      "handwritten",
      "script",
      "casual",
      "playful",
      "informal",
      "friendly",
      "approachable",
      "authentic",
      "personal",
      "legible",
      "display",
      "body text",
      "branding",
      "social media",
      "digital",
      "print",
      "creative",
      "handcrafted",
      "everyday writing",
      "spontaneity",
      "irregular",
      "varying stroke weights",
      "generous x-height",
      "open counters",
      "rounded terminals",
      "angled ascenders",
      "descenders"
    ]
  }
}