{
  "filename": "asphyxiate_36px.png",
  "status": "success",
  "description": {
    "detailed_description": "Asphyxiate is a script font that captures the essence of handwritten text with a touch of playful irregularity. Its flowing strokes and organic curves evoke a sense of casual intimacy, while the consistent weight and clear letterforms ensure readability. The font's construction is based on a combination of calligraphic principles and digital refinement, resulting in a balance between natural variation and controlled legibility. The slightly angled ascenders and descenders add a dynamic feel, while the open counters and generous x-height contribute to its overall readability. Asphyxiate's personality is both approachable and expressive, making it suitable for a wide range of applications, from personal branding and social media to editorial design and packaging. Its casual yet refined aesthetic evokes a sense of authenticity and warmth, suggesting a connection to the human touch. The font's contemporary relevance lies in its ability to bridge the gap between digital and handwritten communication, offering a unique blend of personality and legibility.",
    "technical_characteristics": [
      "Organic curves",
      "Flowing strokes",
      "Consistent weight",
      "Open counters",
      "Generous x-height",
      "Slightly angled ascenders and descenders",
      "Calligraphic influences",
      "Digital refinement"
    ],
    "personality_traits": [
      "Playfully irregular",
      "Approachable",
      "Expressive",
      "Casual",
      "Intimate",
      "Authentic",
      "Warm",
      "Refined"
    ],
    "practical_contexts": [
      "Personal branding",
      "Social media",
      "Editorial design",
      "Packaging",
      "Handwritten-style typography",
      "Casual communication"
    ],
    "cultural_intuition": [
      "Evokes a sense of authenticity",
      "Suggests a connection to the human touch",
      "Reflects the casual nature of contemporary communication",
      "Captures the spirit of handwritten expression",
      "Blends traditional calligraphy with digital aesthetics"
    ],
    "search_keywords": [
      "Script font",
      "Handwritten",
      "Casual",
      "Playful",
      "Organic",
      "Flowing",
      "Readable",
      "Intimate",
      "Authentic",
      "Warm",
      "Contemporary",
      "Digital",
      "Branding",
      "Social media",
      "Editorial",
      "Packaging",
      "Calligraphy",
      "Digital refinement"
    ]
  }
}