{
  "filename": "assperiments_36px.png",
  "status": "success",
  "description": {
    "detailed_description": "This script font exhibits a playful yet refined character, drawing inspiration from both traditional calligraphy and contemporary digital aesthetics. Its flowing strokes and organic curves create a sense of movement and energy, while the carefully balanced proportions and consistent weight ensure legibility even at smaller sizes. The font's distinctive features include the exaggerated ascenders and descenders, which add visual interest and emphasize the handwritten quality. The subtle variations in stroke thickness and the occasional flourishes further enhance the hand-drawn feel, creating a sense of personality and warmth. While the font's overall impression is one of whimsy and charm, its technical execution is precise and professional, making it suitable for a wide range of applications, from branding and packaging to website design and social media graphics. The font's cultural resonance lies in its ability to evoke both a sense of nostalgia for traditional penmanship and a contemporary appreciation for handcrafted design. It suggests a playful and approachable personality, making it ideal for projects that require a touch of personality and warmth.",
    "technical_characteristics": [
      "flowing strokes",
      "organic curves",
      "exaggerated ascenders and descenders",
      "consistent weight",
      "subtle variations in stroke thickness",
      "occasional flourishes"
    ],
    "personality_traits": [
      "playful",
      "refined",
      "whimsical",
      "approachable",
      "handwritten",
      "energetic",
      "charming"
    ],
    "practical_contexts": [
      "branding and packaging",
      "website design",
      "social media graphics",
      "handwritten notes and invitations",
      "short text blocks"
    ],
    "cultural_intuition": [
      "evokes traditional calligraphy",
      "suggests handcrafted design",
      "contemporary digital aesthetic",
      "nostalgia for penmanship",
      "playful and approachable personality"
    ],
    "search_keywords": [
      "script font",
      "handwritten",
      "playful",
      "refined",
      "flowing",
      "organic",
      "exaggerated ascenders",
      "consistent weight",
      "subtle variations",
      "flourishes",
      "branding",
      "packaging",
      "website design",
      "social media",
      "handwritten notes",
      "invitations",
      "short text",
      "calligraphy",
      "digital aesthetic",
      "nostalgia",
      "approachable",
      "personality",
      "warmth"
    ]
  }
}