{
  "filename": "astrohead_36px.png",
  "status": "success",
  "description": {
    "detailed_description": "Astrohead px is a geometric sans-serif typeface that embodies a distinct blend of futuristic and retro aesthetics. Its construction is based on a grid system, resulting in sharp, angular letterforms with consistent proportions. The font features a high x-height and open counters, contributing to its strong legibility, even at small sizes. The terminals are slightly rounded, adding a touch of approachability and softening the overall geometric feel. This balance between sharp angles and subtle curves creates a unique character, evoking a sense of both technological advancement and classic design principles. Astrohead px is well-suited for digital interfaces, branding, and editorial design, particularly in contexts where a futuristic or retro-futuristic aesthetic is desired. Its bold, confident presence makes it ideal for headlines, titles, and branding elements, while its legibility ensures readability in body text. The font's cultural associations range from the sleek, minimalist design of the 1980s to the futuristic visions of cyberpunk literature and film. It evokes a sense of technological innovation, progress, and a touch of retro nostalgia, making it a versatile choice for projects that aim to capture a specific era or evoke a sense of futuristic possibility.",
    "technical_characteristics": [
      "Geometric construction",
      "High x-height",
      "Open counters",
      "Sharp angles",
      "Slightly rounded terminals",
      "Consistent proportions"
    ],
    "personality_traits": [
      "Futuristic",
      "Retro",
      "Bold",
      "Confident",
      "Modern",
      "Sleek",
      "Minimalist"
    ],
    "practical_contexts": [
      "Digital interfaces",
      "Branding",
      "Editorial design",
      "Headlines",
      "Titles",
      "Branding elements",
      "Body text"
    ],
    "cultural_intuition": [
      "1980s design aesthetic",
      "Cyberpunk",
      "Futuristic",
      "Technological innovation",
      "Retro nostalgia"
    ],
    "search_keywords": [
      "Geometric sans-serif",
      "High x-height",
      "Open counters",
      "Sharp angles",
      "Rounded terminals",
      "Futuristic",
      "Retro",
      "Digital interface",
      "Branding",
      "Editorial design",
      "Headlines",
      "Titles",
      "Body text",
      "Cyberpunk",
      "Minimalist",
      "1980s",
      "Technological",
      "Nostalgia"
    ]
  }
}