{
  "filename": "at_sign_36px.png",
  "status": "success",
  "description": {
    "detailed_description": "This font's playful personality is built on a foundation of rounded, hand-drawn letterforms. Each character is defined by a consistent, slightly irregular outline, creating a sense of casual charm. The generous curves and open counters contribute to a friendly, approachable feel, while the slight variations in stroke weight add a touch of hand-crafted authenticity. The font's overall character is reminiscent of a child's handwriting, evoking a sense of innocence and whimsy. This makes it ideal for projects that require a lighthearted and informal tone, such as children's books, playful branding, or social media graphics. However, its casual nature might not be suitable for formal documents or high-end design projects. The font's cultural resonance lies in its connection to the DIY aesthetic and the resurgence of hand-drawn typography, reflecting a contemporary appreciation for authenticity and personal expression.",
    "technical_characteristics": [
      "Rounded letterforms",
      "Irregular outlines",
      "Open counters",
      "Consistent stroke weight",
      "Slight variations in stroke weight"
    ],
    "personality_traits": [
      "Playful",
      "Whimsical",
      "Casual",
      "Friendly",
      "Approachable"
    ],
    "practical_contexts": [
      "Children's books",
      "Playful branding",
      "Social media graphics",
      "Informal signage",
      "Hand-drawn illustrations"
    ],
    "cultural_intuition": [
      "DIY aesthetic",
      "Hand-drawn typography",
      "Authenticity",
      "Personal expression",
      "Nostalgia for childhood"
    ],
    "search_keywords": [
      "Rounded",
      "Hand-drawn",
      "Playful",
      "Casual",
      "Whimsical",
      "Informal",
      "Children's",
      "Branding",
      "Social media",
      "DIY",
      "Authentic",
      "Nostalgic",
      "Script",
      "Display",
      "Handwritten"
    ]
  }
}