{
  "filename": "attic_36px.png",
  "status": "success",
  "description": {
    "detailed_description": "Attic is a display typeface that embodies a playful, retro-futuristic aesthetic. Its bold, geometric forms are constructed from simple, rounded shapes, creating a sense of both whimsy and solidity. The font's high x-height and open counters ensure strong legibility, even at large sizes, while the rounded terminals and slightly condensed proportions add a touch of approachability. This combination of bold geometry and subtle humanism makes Attic suitable for a range of applications, from eye-catching headlines and logos to playful branding and digital interfaces. Its retro-inspired design evokes a sense of nostalgia for the optimistic futurism of the 1960s and 70s, while its bold, graphic nature feels distinctly contemporary. Attic's playful personality and strong visual impact make it a perfect choice for projects that seek to stand out and communicate a sense of fun and energy.",
    "technical_characteristics": [
      "Geometric construction",
      "Rounded terminals",
      "High x-height",
      "Open counters",
      "Condensed proportions"
    ],
    "personality_traits": [
      "Playful",
      "Bold",
      "Retro-futuristic",
      "Whimsical",
      "Solid",
      "Approachable",
      "Graphic"
    ],
    "practical_contexts": [
      "Headlines",
      "Logos",
      "Branding",
      "Digital interfaces",
      "Large-scale displays"
    ],
    "cultural_intuition": [
      "Evokes 1960s and 70s futurism",
      "Suggests a sense of optimism and playfulness",
      "Feels distinctly contemporary",
      "Connects to a retro-inspired aesthetic",
      "Appeals to a modern audience"
    ],
    "search_keywords": [
      "Geometric",
      "Rounded",
      "Display",
      "Retro",
      "Futuristic",
      "Bold",
      "Playful",
      "Whimsical",
      "Solid",
      "Approachable",
      "Graphic",
      "Headlines",
      "Logos",
      "Branding",
      "Digital",
      "Interfaces",
      "Large-scale",
      "Nostalgia",
      "Optimism",
      "Contemporary",
      "Fun",
      "Energy"
    ]
  }
}