{
  "filename": "audience_36px.png",
  "status": "success",
  "description": {
    "detailed_description": "This font's bold, geometric construction evokes a sense of retrofuturism, reminiscent of 1980s sci-fi aesthetics. The letters are built with sharp, angular strokes, creating a strong, almost mechanical feel. The exaggerated x-height and open counters ensure excellent legibility, even at small sizes. The slight beveling on each letter adds a touch of dimensionality, further enhancing its visual impact. This font's personality is both confident and playful, suggesting a sense of energy and innovation. It's well-suited for headlines, logos, and digital interfaces where a bold, attention-grabbing presence is desired. The font's retro-futuristic aesthetic evokes a sense of optimism and technological advancement, making it ideal for projects that aim to capture a sense of the future. ",
    "technical_characteristics": [
      "Geometric construction",
      "Exaggerated x-height",
      "Open counters",
      "Sharp, angular strokes",
      "Beveled edges"
    ],
    "personality_traits": [
      "Bold",
      "Geometric",
      "Confident",
      "Playful",
      "Energetic",
      "Innovative",
      "Retro-futuristic"
    ],
    "practical_contexts": [
      "Headlines",
      "Logos",
      "Digital interfaces",
      "Posters",
      "Gaming"
    ],
    "cultural_intuition": [
      "1980s sci-fi aesthetics",
      "Technological advancement",
      "Optimism",
      "Futuristic design",
      "Digital culture"
    ],
    "search_keywords": [
      "Geometric",
      "Bold",
      "Retro",
      "Futuristic",
      "Sci-fi",
      "Exaggerated x-height",
      "Open counters",
      "Sharp strokes",
      "Beveled edges",
      "Headlines",
      "Logos",
      "Digital",
      "Interface",
      "Poster",
      "Gaming",
      "Modern",
      "Energetic",
      "Playful",
      "Confident",
      "Innovative"
    ]
  }
}