{
  "filename": "autery_36px.png",
  "status": "success",
  "description": {
    "detailed_description": "This script font embodies a graceful, flowing aesthetic, reminiscent of elegant handwritten calligraphy. Its organic forms are characterized by smooth curves and subtle variations in stroke weight, creating a sense of natural movement. The ascenders and descenders are elongated, adding to the overall sense of fluidity and elegance. The font's generous x-height and open counters ensure good legibility, even at smaller sizes. While the overall impression is one of refined sophistication, the font's playful flourishes and subtle variations in letterforms add a touch of whimsy and personality. This balance makes it suitable for a wide range of applications, from wedding invitations and greeting cards to branding and website design. Its inherent charm and timeless appeal evoke a sense of warmth and personal connection, making it ideal for projects that require a touch of handcrafted authenticity.",
    "technical_characteristics": [
      "Organic forms",
      "Smooth curves",
      "Varying stroke weight",
      "Elongated ascenders and descenders",
      "Generous x-height",
      "Open counters",
      "Playful flourishes"
    ],
    "personality_traits": [
      "Graceful",
      "Flowing",
      "Elegant",
      "Whimsical",
      "Sophisticated",
      "Warm",
      "Personal"
    ],
    "practical_contexts": [
      "Wedding invitations",
      "Greeting cards",
      "Branding",
      "Website design",
      "Social media graphics"
    ],
    "cultural_intuition": [
      "Handwritten calligraphy",
      "Vintage charm",
      "Romantic sensibility",
      "Modern elegance",
      "Personal touch"
    ],
    "search_keywords": [
      "Script font",
      "Calligraphy",
      "Handwritten",
      "Elegant",
      "Graceful",
      "Flowing",
      "Organic",
      "Playful",
      "Sophisticated",
      "Warm",
      "Personal",
      "Wedding",
      "Invitation",
      "Greeting card",
      "Branding",
      "Website",
      "Social media",
      "Vintage",
      "Romantic",
      "Modern"
    ]
  }
}