{
  "filename": "averia_36px.png",
  "status": "success",
  "description": {
    "detailed_description": "Averia is a serif typeface that blends classic proportions with a contemporary sensibility. Its construction is rooted in traditional serif anatomy, with clear distinctions between thick and thin strokes, well-defined serifs, and a consistent baseline. However, the font's character is infused with a subtle playfulness, evident in the slightly rounded terminals and the gentle curves of the lowercase letters. This balance between structure and fluidity creates a typeface that is both legible and engaging. The high x-height and open counters ensure readability even at small sizes, making it suitable for both print and digital applications. Its versatility extends to a range of projects, from branding and editorial design to web interfaces and mobile apps. Averia's overall impression is one of approachability and warmth, suggesting a friendly and inviting tone. It evokes a sense of modernism without sacrificing the timeless elegance of traditional serif design, making it a suitable choice for projects that require a balance of sophistication and accessibility.",
    "technical_characteristics": [
      "traditional serif anatomy",
      "high x-height",
      "open counters",
      "slightly rounded terminals",
      "gentle curves in lowercase",
      "consistent baseline",
      "clear distinction between thick and thin strokes"
    ],
    "personality_traits": [
      "approachable",
      "warm",
      "friendly",
      "inviting",
      "legible",
      "engaging",
      "versatile",
      "modern",
      "elegant",
      "timeless"
    ],
    "practical_contexts": [
      "branding",
      "editorial design",
      "web interfaces",
      "mobile apps",
      "print",
      "digital"
    ],
    "cultural_intuition": [
      "evokes a sense of modernism",
      "blends classic and contemporary design",
      "suggests a friendly and inviting tone",
      "suitable for projects that require a balance of sophistication and accessibility"
    ],
    "search_keywords": [
      "serif",
      "traditional",
      "modern",
      "legible",
      "versatile",
      "approachable",
      "warm",
      "friendly",
      "inviting",
      "branding",
      "editorial",
      "web",
      "mobile",
      "print",
      "digital",
      "high x-height",
      "open counters",
      "rounded terminals",
      "gentle curves",
      "consistent baseline",
      "thick and thin strokes",
      "classic",
      "contemporary",
      "playful",
      "elegant",
      "sophisticated",
      "accessible"
    ]
  }
}