{
  "filename": "awkward_36px.png",
  "status": "success",
  "description": {
    "detailed_description": "Awkward is a playful script font that captures the essence of casual handwritten typography. Its organic forms and inconsistent stroke weights create a sense of spontaneity and informality. The font's generous x-height and open counters ensure good legibility, even at smaller sizes. While the overall construction is loose and free-flowing, there's a subtle underlying structure that gives the font a sense of balance and control. This balance between freedom and structure makes Awkward suitable for a wide range of applications, from casual social media posts to more formal branding elements. The font's playful nature evokes a sense of youthful energy and creativity, making it ideal for projects that require a touch of personality and charm. Its contemporary feel suggests a connection to digital culture, where handwritten aesthetics are often embraced for their authenticity and personal touch.",
    "technical_characteristics": [
      "Organic forms",
      "Inconsistent stroke weights",
      "Generous x-height",
      "Open counters",
      "Subtle underlying structure"
    ],
    "personality_traits": [
      "Playful",
      "Spontaneous",
      "Informal",
      "Youthful",
      "Creative"
    ],
    "practical_contexts": [
      "Social media posts",
      "Branding elements",
      "Headlines",
      "Short text blocks",
      "Casual signage"
    ],
    "cultural_intuition": [
      "Handwritten aesthetic",
      "Digital culture",
      "Authenticity",
      "Personal touch",
      "Youthful energy"
    ],
    "search_keywords": [
      "Script font",
      "Handwritten font",
      "Playful font",
      "Informal font",
      "Casual font",
      "Organic font",
      "Generous x-height",
      "Open counters",
      "Social media",
      "Branding",
      "Digital culture",
      "Youthful",
      "Creative",
      "Authentic",
      "Personal"
    ]
  }
}