{
  "filename": "b_movie_dings_36px.png",
  "status": "success",
  "description": {
    "detailed_description": "This font, with its bold, geometric construction and sharp, angular terminals, exudes a raw, unpolished energy. The letterforms are tightly packed, with minimal spacing, creating a sense of urgency and intensity. The overall effect is one of grit and immediacy, reminiscent of vintage punk rock posters and underground zines. The font's lack of serifs and its consistent stroke weight contribute to its bold, assertive character, while the slightly condensed proportions add to its aggressive feel. This font is not for the faint of heart; it demands attention and speaks to a rebellious spirit. Its practical applications lie in creating impactful visuals for punk rock bands, underground publications, and edgy streetwear brands. It's ideal for headlines, logos, and short bursts of text, where its raw energy can be fully unleashed. The font's cultural resonance lies in its connection to the DIY aesthetic of punk rock and its association with rebellion and counterculture. It evokes a sense of underground movements, raw expression, and a rejection of mainstream norms.",
    "technical_characteristics": [
      "Geometric construction",
      "Sharp, angular terminals",
      "Tight letter spacing",
      "Consistent stroke weight",
      "Condensed proportions",
      "Lack of serifs"
    ],
    "personality_traits": [
      "Bold",
      "Assertive",
      "Raw",
      "Unpolished",
      "Gritty",
      "Immediate",
      "Rebellious",
      "Energetic"
    ],
    "practical_contexts": [
      "Punk rock posters",
      "Underground zines",
      "Streetwear branding",
      "Headlines",
      "Logos",
      "Short bursts of text"
    ],
    "cultural_intuition": [
      "Punk rock aesthetic",
      "Underground movements",
      "Rebellion and counterculture",
      "Raw expression",
      "DIY culture"
    ],
    "search_keywords": [
      "Geometric sans-serif",
      "Bold",
      "Angular",
      "Condensed",
      "Punk",
      "Underground",
      "Rebellious",
      "Gritty",
      "Energetic",
      "Streetwear",
      "Headline",
      "Logo",
      "Zine",
      "Poster",
      "DIY",
      "Counterculture",
      "Raw",
      "Unpolished",
      "Immediate",
      "Aggressive",
      "Impactful"
    ]
  }
}