{
  "filename": "backsplatter_36px.png",
  "status": "success",
  "description": {
    "detailed_description": "BackSplatter is a display typeface that embraces a playful, almost cartoonish aesthetic. Its bold, chunky forms are built with exaggerated curves and sharp angles, creating a sense of dynamic energy. The letterforms are heavily distressed, with jagged edges and uneven strokes that evoke a sense of hand-drawn spontaneity. This deliberate imperfection adds a touch of grit and authenticity, contrasting with the overall playful nature of the design. The font's high x-height and open counters ensure good legibility, even at smaller sizes, making it suitable for headlines and short bursts of text. While its bold personality might seem best suited for informal contexts, BackSplatter's inherent legibility and playful energy make it surprisingly versatile. It can add a touch of whimsy to branding, packaging, or even digital interfaces, particularly when used in conjunction with more refined typefaces. The font's cultural resonance lies in its connection to street art and graffiti, evoking a sense of rebellious creativity and urban energy. It's a typeface that speaks to a generation that embraces individuality and non-conformity, making it a perfect choice for projects that want to stand out from the crowd.",
    "technical_characteristics": [
      "distressed letterforms",
      "exaggerated curves",
      "sharp angles",
      "uneven strokes",
      "high x-height",
      "open counters"
    ],
    "personality_traits": [
      "playful",
      "bold",
      "energetic",
      "spontaneous",
      "gritty",
      "authentic",
      "whimsical"
    ],
    "practical_contexts": [
      "headlines",
      "short bursts of text",
      "branding",
      "packaging",
      "digital interfaces"
    ],
    "cultural_intuition": [
      "street art",
      "graffiti",
      "rebellious creativity",
      "urban energy",
      "individuality",
      "non-conformity"
    ],
    "search_keywords": [
      "display typeface",
      "cartoon",
      "distressed",
      "bold",
      "chunky",
      "playful",
      "energetic",
      "graffiti",
      "street art",
      "urban",
      "headlines",
      "branding",
      "packaging",
      "digital",
      "whimsical",
      "authentic",
      "spontaneous",
      "legible",
      "versatile",
      "high x-height",
      "open counters"
    ]
  }
}