{
  "filename": "bad_germans_36px.png",
  "status": "success",
  "description": {
    "detailed_description": "This font, with its bold, blocky forms and exaggerated 3D effect, exudes a strong, almost aggressive personality. The geometric construction, evident in the sharp angles and consistent proportions, creates a sense of order and precision. The heavy weight and thick strokes contribute to a sense of power and authority, while the exaggerated depth of the 3D effect adds a touch of theatricality. The font's bold presence makes it ideal for headlines, posters, and branding where a strong visual impact is desired. However, its heavy weight and complex structure might limit its use in smaller sizes or for extended text. The font's bold, almost menacing character evokes a sense of power and control, reminiscent of industrial design and urban environments. It suggests a sense of strength and resilience, perhaps even a touch of rebellion, making it suitable for projects that demand a bold and assertive presence.",
    "technical_characteristics": [
      "Geometric construction",
      "Heavy weight",
      "Exaggerated 3D effect",
      "Thick strokes",
      "Sharp angles",
      "Consistent proportions"
    ],
    "personality_traits": [
      "Bold",
      "Aggressive",
      "Powerful",
      "Authoritative",
      "Theatrical",
      "Industrial",
      "Urban",
      "Rebellious"
    ],
    "practical_contexts": [
      "Headlines",
      "Posters",
      "Branding",
      "Large-scale signage",
      "Graphic design"
    ],
    "cultural_intuition": [
      "Industrial design",
      "Urban environments",
      "Power and control",
      "Strength and resilience",
      "Rebellion"
    ],
    "search_keywords": [
      "Geometric",
      "Bold",
      "3D",
      "Heavy",
      "Blocky",
      "Industrial",
      "Urban",
      "Aggressive",
      "Powerful",
      "Authoritative",
      "Theatrical",
      "Headlines",
      "Posters",
      "Branding",
      "Signage",
      "Graphic design",
      "Rebellious",
      "Strength",
      "Resilience"
    ]
  }
}