{
  "filename": "ballada_36px.png",
  "status": "success",
  "description": {
    "detailed_description": "Ballad is a script font that captures the essence of handwritten calligraphy with a contemporary twist. Its flowing strokes and organic forms evoke a sense of warmth and personality, while its carefully balanced proportions and consistent letterforms ensure legibility. The font's distinctive features include its generous x-height, which provides ample space for the flowing strokes, and its slightly rounded terminals, which soften the overall impression. The subtle variations in stroke weight add a touch of dynamism and visual interest, while the overall construction maintains a sense of coherence and consistency. Ballad's design personality is both playful and sophisticated, suggesting a balance between casual charm and refined elegance. It draws inspiration from traditional calligraphy styles, but its contemporary execution and versatility make it suitable for a wide range of applications. Ballad's flowing forms and organic character make it ideal for branding, packaging, and editorial design, particularly for projects that require a touch of personality and warmth. Its legibility and versatility also make it suitable for digital applications, such as website design and social media graphics. The font's cultural resonance lies in its ability to evoke a sense of authenticity and human connection, reminiscent of handwritten notes and personal expressions. Its contemporary relevance stems from its ability to blend traditional aesthetics with modern sensibilities, making it a versatile tool for designers seeking to create engaging and memorable visuals.",
    "technical_characteristics": [
      "flowing strokes",
      "organic forms",
      "generous x-height",
      "rounded terminals",
      "subtle stroke weight variations",
      "consistent letterforms",
      "balanced proportions"
    ],
    "personality_traits": [
      "playful",
      "sophisticated",
      "warm",
      "elegant",
      "dynamic",
      "authentic",
      "human",
      "versatile"
    ],
    "practical_contexts": [
      "branding",
      "packaging",
      "editorial design",
      "website design",
      "social media graphics"
    ],
    "cultural_intuition": [
      "handwritten calligraphy",
      "personal expression",
      "authenticity",
      "contemporary design",
      "versatility"
    ],
    "search_keywords": [
      "script font",
      "handwritten",
      "calligraphy",
      "flowing",
      "organic",
      "generous x-height",
      "rounded terminals",
      "stroke weight variations",
      "balanced proportions",
      "playful",
      "sophisticated",
      "warm",
      "elegant",
      "dynamic",
      "authentic",
      "human",
      "versatile",
      "branding",
      "packaging",
      "editorial design",
      "website design",
      "social media graphics",
      "contemporary",
      "traditional"
    ]
  }
}