{
  "filename": "balonez_fantasia_36px.png",
  "status": "success",
  "description": {
    "detailed_description": "Balonez Fantasia is a playful and expressive display typeface that draws inspiration from both retro and contemporary design trends. Its rounded, bulbous forms and exaggerated curves create a sense of whimsy and fun, while the subtle 3D effect adds depth and dimension. The font's construction is based on a geometric framework, with each letterform carefully crafted to maintain a consistent visual rhythm. The generous x-height and open counters ensure strong legibility, even at smaller sizes. The overall effect is one of friendly approachability, making it ideal for branding, headlines, and playful digital interfaces. While its retro aesthetic evokes a sense of nostalgia, the font's bold and confident character feels distinctly modern, suggesting a playful and optimistic outlook. Its versatility allows it to be used in a wide range of applications, from eye-catching logos to quirky social media graphics.",
    "technical_characteristics": [
      "Rounded, bulbous forms",
      "Exaggerated curves",
      "3D effect",
      "Geometric construction",
      "Generous x-height",
      "Open counters"
    ],
    "personality_traits": [
      "Playful",
      "Expressive",
      "Whimsical",
      "Fun",
      "Bold",
      "Confident",
      "Friendly",
      "Approachable"
    ],
    "practical_contexts": [
      "Branding",
      "Headlines",
      "Digital interfaces",
      "Social media graphics",
      "Playful signage"
    ],
    "cultural_intuition": [
      "Evokes retro design trends",
      "Suggests a playful and optimistic outlook",
      "Feels distinctly modern",
      "Combines nostalgia with contemporary flair"
    ],
    "search_keywords": [
      "Display typeface",
      "Rounded",
      "Bulbous",
      "3D effect",
      "Geometric",
      "Playful",
      "Expressive",
      "Whimsical",
      "Fun",
      "Bold",
      "Confident",
      "Friendly",
      "Approachable",
      "Branding",
      "Headlines",
      "Digital interfaces",
      "Social media graphics",
      "Retro",
      "Modern",
      "Nostalgia",
      "Optimistic"
    ]
  }
}