{
  "filename": "bambu_36px.png",
  "status": "success",
  "description": {
    "detailed_description": "Bambu is a script typeface that captures the casual charm of handwritten lettering. Its flowing strokes and organic curves evoke a sense of spontaneity and warmth, while its consistent letterforms ensure readability. The font's generous x-height and open counters contribute to its legibility, even at smaller sizes. The subtle variations in stroke weight add a touch of personality, creating a sense of movement and rhythm. Bambu's overall character is friendly and approachable, making it suitable for a wide range of applications, from personal branding to social media graphics. Its playful nature and informal tone make it ideal for projects that require a touch of whimsy and authenticity. The font's cultural resonance lies in its connection to the handwritten aesthetic, which has become increasingly popular in the digital age. Bambu's ability to evoke a sense of personal expression and authenticity makes it a versatile tool for designers seeking to create engaging and relatable visuals.",
    "technical_characteristics": [
      "flowing strokes",
      "organic curves",
      "consistent letterforms",
      "generous x-height",
      "open counters",
      "subtle variations in stroke weight"
    ],
    "personality_traits": [
      "spontaneous",
      "warm",
      "friendly",
      "approachable",
      "playful",
      "informal",
      "authentic"
    ],
    "practical_contexts": [
      "personal branding",
      "social media graphics",
      "handwritten notes",
      "invitations",
      "packaging"
    ],
    "cultural_intuition": [
      "evokes a sense of personal expression",
      "captures the casual charm of handwritten lettering",
      "reflects the growing popularity of handwritten aesthetics in the digital age",
      "suggests a sense of authenticity and warmth"
    ],
    "search_keywords": [
      "script typeface",
      "handwritten font",
      "casual",
      "friendly",
      "approachable",
      "playful",
      "informal",
      "authentic",
      "legible",
      "versatile",
      "personal branding",
      "social media",
      "handwritten notes",
      "invitations",
      "packaging",
      "digital age",
      "handwritten aesthetics"
    ]
  }
}