{
  "filename": "bananananananana_36px.png",
  "status": "success",
  "description": {
    "detailed_description": "Banana Nana is a playful display font that embraces a hand-drawn aesthetic. Its rounded forms and irregular letterforms evoke a sense of childlike charm, reminiscent of early childhood scribbles. The font's construction is loose and organic, with varying stroke weights and inconsistent letter spacing, adding to its whimsical character. While the font's technical execution is intentionally imperfect, it maintains a sense of balance and readability, making it suitable for short headlines and playful branding elements. The font's overall personality is lighthearted and approachable, suggesting a sense of fun and creativity. Its cultural associations lean towards childhood nostalgia and the playful spirit of DIY design. Banana Nana is best suited for projects that require a touch of whimsy and a sense of personality, such as children's books, playful branding, or social media graphics. However, its irregular letterforms and inconsistent spacing may limit its use in large blocks of text or formal settings.",
    "technical_characteristics": [
      "Hand-drawn aesthetic",
      "Rounded forms",
      "Irregular letterforms",
      "Varying stroke weights",
      "Inconsistent letter spacing"
    ],
    "personality_traits": [
      "Playful",
      "Whimsical",
      "Childlike",
      "Approachable",
      "Creative"
    ],
    "practical_contexts": [
      "Children's books",
      "Playful branding",
      "Social media graphics",
      "Short headlines",
      "Decorative elements"
    ],
    "cultural_intuition": [
      "Childhood nostalgia",
      "DIY design",
      "Playful spirit",
      "Informal communication",
      "Creative expression"
    ],
    "search_keywords": [
      "Hand-drawn",
      "Display font",
      "Playful",
      "Whimsical",
      "Childlike",
      "Rounded",
      "Irregular",
      "Organic",
      "Nostalgia",
      "DIY",
      "Branding",
      "Children's book",
      "Social media",
      "Headline",
      "Decorative"
    ]
  }
}