{
  "filename": "barbeque_jr_36px.png",
  "status": "success",
  "description": {
    "detailed_description": "Barbeque Jr. is a display typeface that embodies a playful yet menacing aesthetic. Its exaggerated, jagged letterforms, reminiscent of medieval script or gothic architecture, create a sense of both whimsy and unease. The font's construction is characterized by sharp angles, dramatic curves, and a consistent use of thick strokes, resulting in a bold and assertive presence. The high x-height and open counters ensure legibility, even at smaller sizes, while the exaggerated ascenders and descenders add to the font's dramatic flair. The overall effect is a font that is both eye-catching and unsettling, capable of conveying a range of emotions from playful mischief to dark humor. While its bold and dramatic nature makes it suitable for headlines, logos, and short bursts of text, its unconventional design might not be ideal for extended reading. Barbeque Jr. evokes a sense of vintage horror, reminiscent of classic monster movies or gothic literature, while also possessing a contemporary edge that speaks to the current fascination with the macabre and the unexpected. Its unique character makes it a powerful tool for designers seeking to create a visually striking and emotionally charged experience.",
    "technical_characteristics": [
      "jagged letterforms",
      "exaggerated strokes",
      "high x-height",
      "open counters",
      "dramatic ascenders and descenders"
    ],
    "personality_traits": [
      "playful yet menacing",
      "whimsical and unsettling",
      "bold and assertive",
      "eye-catching and dramatic",
      "unconventional and unique"
    ],
    "practical_contexts": [
      "headlines",
      "logos",
      "short bursts of text",
      "posters",
      "packaging"
    ],
    "cultural_intuition": [
      "vintage horror",
      "gothic literature",
      "classic monster movies",
      "contemporary fascination with the macabre",
      "dark humor"
    ],
    "search_keywords": [
      "display typeface",
      "jagged",
      "medieval script",
      "gothic architecture",
      "bold",
      "assertive",
      "high x-height",
      "open counters",
      "dramatic",
      "vintage horror",
      "gothic",
      "macabre",
      "dark humor",
      "headlines",
      "logos",
      "posters",
      "packaging",
      "unconventional",
      "unique",
      "eye-catching",
      "playful",
      "menacing"
    ]
  }
}