{
  "filename": "baron_kuffner_36px.png",
  "status": "success",
  "description": {
    "detailed_description": "Baron Kuffner is a display typeface that embodies a raw, industrial aesthetic. Its bold, chunky letterforms are built with a distinct geometric foundation, featuring sharp angles and pronounced serifs. The overall construction is reminiscent of vintage metal signage, with a heavy, almost brutalist feel. The font's character is further amplified by the inclusion of distressed textures, simulating the wear and tear of time and use. This deliberate imperfection adds a layer of grit and authenticity, making it feel both edgy and nostalgic. While its bold nature makes it ideal for headlines and branding elements, its legibility is somewhat compromised at smaller sizes due to the heavy weight and intricate details. The font's cultural resonance lies in its connection to urban environments, industrial design, and the DIY aesthetic. It evokes a sense of rebellion and authenticity, often associated with underground culture and street art. Its bold, in-your-face personality makes it a powerful tool for conveying a message of strength, defiance, and individuality.",
    "technical_characteristics": [
      "Geometric construction",
      "Heavy weight",
      "Sharp angles",
      "Pronounced serifs",
      "Distressed textures",
      "High contrast",
      "Wide letter spacing"
    ],
    "personality_traits": [
      "Bold",
      "Industrial",
      "Gritty",
      "Nostalgic",
      "Edgy",
      "Rebellious",
      "Authentic",
      "Powerful",
      "In-your-face"
    ],
    "practical_contexts": [
      "Headlines",
      "Branding",
      "Posters",
      "Logos",
      "Street art",
      "Urban design",
      "Music and entertainment"
    ],
    "cultural_intuition": [
      "Urban environments",
      "Industrial design",
      "DIY aesthetic",
      "Underground culture",
      "Street art",
      "Rebellion",
      "Authenticity"
    ],
    "search_keywords": [
      "Display typeface",
      "Geometric",
      "Heavy weight",
      "Sharp angles",
      "Distressed",
      "Industrial",
      "Urban",
      "Gritty",
      "Nostalgic",
      "Edgy",
      "Rebellious",
      "Authentic",
      "Headlines",
      "Branding",
      "Posters",
      "Logos",
      "Street art",
      "Music",
      "Entertainment"
    ]
  }
}