{
  "filename": "bat_men_g_36px.png",
  "status": "success",
  "description": {
    "detailed_description": "Bat Men G is a bold, blackletter typeface that draws inspiration from medieval script and gothic architecture. Its angular strokes and sharp serifs create a sense of dramatic intensity, while the exaggerated ascenders and descenders add a touch of grandeur. The font's construction is based on a combination of geometric and organic forms, resulting in a unique visual language that is both familiar and unexpected. The letterforms are carefully crafted to ensure legibility, even at small sizes, making it suitable for a variety of applications. The font's bold and dramatic character makes it ideal for headlines, logos, and other display uses, while its gothic influences lend it a sense of mystery and intrigue. Bat Men G is a versatile typeface that can be used to create a wide range of visual effects, from classic and traditional to modern and edgy.",
    "technical_characteristics": [
      "Blackletter style",
      "Angular strokes",
      "Sharp serifs",
      "Exaggerated ascenders and descenders",
      "Geometric and organic construction",
      "High contrast",
      "Bold weight"
    ],
    "personality_traits": [
      "Dramatic",
      "Intense",
      "Grand",
      "Mysterious",
      "Intriguing",
      "Bold",
      "Edgy"
    ],
    "practical_contexts": [
      "Headlines",
      "Logos",
      "Posters",
      "Packaging",
      "Display typography"
    ],
    "cultural_intuition": [
      "Medieval script",
      "Gothic architecture",
      "Dark fantasy",
      "Horror",
      "Superhero comics"
    ],
    "search_keywords": [
      "Blackletter",
      "Gothic",
      "Bold",
      "Dramatic",
      "Intense",
      "Medieval",
      "Horror",
      "Fantasy",
      "Superhero",
      "Headline",
      "Logo",
      "Display",
      "Typography",
      "Font",
      "Typeface",
      "Angular",
      "Sharp",
      "Serifs",
      "Ascenders",
      "Descenders",
      "Geometric",
      "Organic",
      "High contrast",
      "Legibility",
      "Versatile"
    ]
  }
}