{
  "filename": "battlecry_36px.png",
  "status": "success",
  "description": {
    "detailed_description": "This font, with its geometric construction and sharp, angular terminals, embodies a distinct sense of modernism. The letterforms are built upon a grid system, resulting in a clean, precise aesthetic. The consistent stroke weight and lack of serifs contribute to a sense of clarity and efficiency. The overall effect is one of starkness and simplicity, reminiscent of early digital interfaces and the minimalist design trends of the 1980s. While the font's technical precision makes it suitable for display purposes, its lack of warmth and organic elements might limit its use in longer text blocks. However, its bold, assertive character makes it ideal for headlines, logos, and branding elements that require a strong visual impact. The font's cultural resonance lies in its connection to the rise of technology and the digital age, evoking a sense of innovation and progress.",
    "technical_characteristics": [
      "Geometric construction",
      "Sharp, angular terminals",
      "Consistent stroke weight",
      "Lack of serifs",
      "High x-height",
      "Open counters",
      "Monospaced"
    ],
    "personality_traits": [
      "Modernist",
      "Clean",
      "Precise",
      "Stark",
      "Simple",
      "Bold",
      "Assertive",
      "Efficient",
      "Technical",
      "Minimalist"
    ],
    "practical_contexts": [
      "Headlines",
      "Logos",
      "Branding",
      "Display typography",
      "Digital interfaces",
      "Technical documentation",
      "Short text blocks"
    ],
    "cultural_intuition": [
      "Digital age",
      "Technological advancement",
      "Minimalist design",
      "1980s aesthetic",
      "Modernism",
      "Innovation",
      "Progress"
    ],
    "search_keywords": [
      "Geometric",
      "Sans-serif",
      "Modern",
      "Minimalist",
      "Sharp",
      "Angular",
      "Clean",
      "Bold",
      "Technical",
      "Digital",
      "Display",
      "Headline",
      "Logo",
      "Branding",
      "Interface",
      "Monospaced",
      "Retro",
      "80s",
      "Futuristic",
      "Progress",
      "Innovation"
    ]
  }
}