{
  "filename": "bd_equipment_36px.png",
  "status": "success",
  "description": {
    "detailed_description": "BD Equipment is a geometric sans-serif typeface characterized by its stark, angular forms and bold, confident presence. The letters are constructed with precise, almost mechanical precision, featuring sharp corners and minimal curves. The x-height is relatively high, contributing to its strong legibility, while the open counters enhance its clarity, even at smaller sizes. The font's overall character is assertive and modern, evoking a sense of industrial strength and technological advancement. Its roots lie in the geometric sans-serif tradition, drawing inspiration from early 20th-century typefaces like Futura and Kabel. However, BD Equipment's bold strokes and sharp angles give it a distinctly contemporary edge, making it a perfect fit for projects that demand a strong visual impact. Its bold, assertive nature makes it ideal for headlines, branding, and digital interfaces, particularly in contexts where a sense of power and innovation is desired. The font's sharp angles and geometric construction lend it a futuristic feel, suggesting a connection to the world of technology and design. It evokes a sense of order and precision, aligning with the values of efficiency and progress often associated with contemporary culture.",
    "technical_characteristics": [
      "Geometric construction",
      "Sharp corners",
      "High x-height",
      "Open counters",
      "Bold strokes",
      "Minimal curves",
      "Consistent stroke weight"
    ],
    "personality_traits": [
      "Assertive",
      "Modern",
      "Industrial",
      "Technological",
      "Bold",
      "Confident",
      "Geometric",
      "Precise",
      "Powerful",
      "Innovative"
    ],
    "practical_contexts": [
      "Headlines",
      "Branding",
      "Digital interfaces",
      "Posters",
      "Product packaging",
      "Large-scale signage"
    ],
    "cultural_intuition": [
      "Industrial design",
      "Technological advancement",
      "Modernity",
      "Futurism",
      "Urban environments",
      "Contemporary culture"
    ],
    "search_keywords": [
      "Geometric sans-serif",
      "Bold",
      "Sharp corners",
      "High x-height",
      "Open counters",
      "Industrial",
      "Technological",
      "Modern",
      "Futuristic",
      "Headlines",
      "Branding",
      "Digital",
      "Signage",
      "Posters",
      "Packaging",
      "Contemporary",
      "Urban",
      "Assertive",
      "Powerful",
      "Innovative",
      "Precision",
      "Efficiency",
      "Progress"
    ]
  }
}