{
  "filename": "beachclub_36px.png",
  "status": "success",
  "description": {
    "detailed_description": "Beachclub is a display typeface that embodies a playful, almost chaotic energy. Its construction is based on a combination of geometric and organic elements, resulting in a unique visual language. The letters are built from thick, jagged strokes that create a sense of roughness and immediacy. The sharp angles and uneven edges contribute to the font's bold and assertive character. The overall effect is one of a hand-drawn, almost graffiti-like aesthetic, suggesting a sense of spontaneity and rebellion. Despite its rough appearance, Beachclub maintains a surprising level of legibility, thanks to its generous x-height and open counters. This makes it suitable for headlines, logos, and other applications where a strong visual impact is desired. The font's inherent energy and rebellious spirit make it particularly well-suited for projects related to youth culture, street art, and alternative music. It evokes a sense of underground creativity and a disregard for conventional design norms.",
    "technical_characteristics": [
      "jagged strokes",
      "geometric construction",
      "uneven edges",
      "sharp angles",
      "generous x-height",
      "open counters"
    ],
    "personality_traits": [
      "bold",
      "assertive",
      "spontaneous",
      "rebellious",
      "energetic",
      "playful",
      "rough",
      "hand-drawn",
      "graffiti-like"
    ],
    "practical_contexts": [
      "headlines",
      "logos",
      "posters",
      "street art",
      "youth culture",
      "alternative music"
    ],
    "cultural_intuition": [
      "underground creativity",
      "rebellion against convention",
      "street art aesthetic",
      "youth culture expression",
      "digital-native design"
    ],
    "search_keywords": [
      "display typeface",
      "jagged",
      "geometric",
      "organic",
      "rough",
      "bold",
      "assertive",
      "spontaneous",
      "rebellious",
      "energetic",
      "playful",
      "hand-drawn",
      "graffiti",
      "headlines",
      "logos",
      "posters",
      "street art",
      "youth culture",
      "alternative music",
      "underground",
      "digital-native",
      "rebellion",
      "convention"
    ]
  }
}