{
  "filename": "beach_type_36px.png",
  "status": "success",
  "description": {
    "detailed_description": "Beach Type is a playful display font that embraces a hand-drawn aesthetic. Its irregular letterforms, with their exaggerated curves and uneven strokes, evoke the carefree spirit of a beach vacation. The font's construction is decidedly organic, with each letter seemingly sketched with a loose, expressive hand. This informality is further emphasized by the inconsistent letter heights and varying stroke weights, creating a sense of spontaneity and whimsy. While the font's technical execution is intentionally rough, it maintains a clear legibility, making it suitable for headlines, logos, and playful branding elements. The overall character of Beach Type is undeniably fun and lighthearted, suggesting a sense of adventure and carefree enjoyment. Its cultural associations lean towards a nostalgic, retro aesthetic, reminiscent of vintage beach posters and hand-drawn signage. While its technical limitations might restrict its use in large blocks of text, its unique personality makes it ideal for adding a touch of whimsy and personality to projects that require a playful and approachable tone.",
    "technical_characteristics": [
      "Hand-drawn aesthetic",
      "Irregular letterforms",
      "Exaggerated curves",
      "Uneven strokes",
      "Inconsistent letter heights",
      "Varying stroke weights",
      "Organic construction",
      "Rough execution",
      "Clear legibility"
    ],
    "personality_traits": [
      "Playful",
      "Whimsical",
      "Carefree",
      "Spontaneous",
      "Fun",
      "Lighthearted",
      "Nostalgic",
      "Retro",
      "Hand-drawn",
      "Expressive"
    ],
    "practical_contexts": [
      "Headlines",
      "Logos",
      "Branding elements",
      "Playful signage",
      "Short bursts of text"
    ],
    "cultural_intuition": [
      "Vintage beach posters",
      "Hand-drawn signage",
      "Retro aesthetic",
      "Summertime fun",
      "Carefree spirit"
    ],
    "search_keywords": [
      "Beach Type",
      "Hand-drawn",
      "Display font",
      "Playful",
      "Whimsical",
      "Nostalgic",
      "Retro",
      "Summer",
      "Vacation",
      "Fun",
      "Lighthearted",
      "Branding",
      "Logo",
      "Headline",
      "Signage",
      "Cartoon",
      "Informal",
      "Expressive",
      "Organic",
      "Irregular",
      "Uneven",
      "Inconsistent",
      "Rough",
      "Legible",
      "Display",
      "Type",
      "Font"
    ]
  }
}