{
  "filename": "beans_2_36px.png",
  "status": "success",
  "description": {
    "detailed_description": "Font Beans is a playful and expressive display typeface that draws inspiration from retro cartoon aesthetics and 1970s graphic design. Its rounded, bulbous letterforms are constructed with a distinct three-dimensional effect, achieved through a combination of bold outlines and subtle inner details. This creates a sense of depth and volume, adding a whimsical touch to the overall design. The font's generous x-height and open counters ensure good legibility, even at larger sizes, making it suitable for headlines, logos, and eye-catching signage. The playful nature of Font Beans is further emphasized by the inclusion of decorative elements, such as the small circles and dots that adorn the letterforms, adding a touch of whimsy and personality. This font evokes a sense of nostalgia and fun, reminiscent of classic cartoons and vintage video games. Its bold and expressive nature makes it ideal for projects that require a playful and attention-grabbing aesthetic, particularly in the realm of branding, entertainment, and children's products.",
    "technical_characteristics": [
      "Rounded letterforms",
      "Three-dimensional effect",
      "Bold outlines",
      "Subtle inner details",
      "Generous x-height",
      "Open counters",
      "Decorative elements"
    ],
    "personality_traits": [
      "Playful",
      "Expressive",
      "Whimsical",
      "Nostalgic",
      "Fun",
      "Bold",
      "Attention-grabbing"
    ],
    "practical_contexts": [
      "Headlines",
      "Logos",
      "Signage",
      "Branding",
      "Entertainment",
      "Children's products"
    ],
    "cultural_intuition": [
      "Retro cartoon aesthetics",
      "1970s graphic design",
      "Classic cartoons",
      "Vintage video games"
    ],
    "search_keywords": [
      "Display typeface",
      "Rounded",
      "Bulbous",
      "Three-dimensional",
      "Bold",
      "Playful",
      "Whimsical",
      "Nostalgic",
      "Fun",
      "Retro",
      "Cartoon",
      "1970s",
      "Graphic design",
      "Headlines",
      "Logos",
      "Signage",
      "Branding",
      "Entertainment",
      "Children's products"
    ]
  }
}