{
  "filename": "bean_36px.png",
  "status": "success",
  "description": {
    "detailed_description": "Bean is a playful script font that captures the essence of casual handwritten typography. Its organic forms and irregular letterforms create a sense of spontaneity and authenticity. The font's generous x-height and open counters ensure good legibility, even at smaller sizes. The slightly rounded terminals and flowing strokes add a touch of warmth and approachability, making it suitable for a wide range of applications. Bean's informal character evokes a sense of personal connection and authenticity, making it ideal for projects that require a friendly and approachable tone. Its versatility allows it to be used for everything from handwritten notes and social media posts to branding and packaging, adding a touch of personality and charm to any design.",
    "technical_characteristics": [
      "Organic letterforms",
      "Irregular stroke weights",
      "Generous x-height",
      "Open counters",
      "Slightly rounded terminals"
    ],
    "personality_traits": [
      "Playful",
      "Spontaneous",
      "Authentic",
      "Friendly",
      "Approachable"
    ],
    "practical_contexts": [
      "Handwritten notes",
      "Social media posts",
      "Branding",
      "Packaging",
      "Digital interfaces"
    ],
    "cultural_intuition": [
      "Evokes a sense of personal connection",
      "Suggests authenticity and informality",
      "Reflects the casual aesthetic of contemporary digital culture",
      "Captures the spirit of handwritten communication"
    ],
    "search_keywords": [
      "Script font",
      "Handwritten",
      "Playful",
      "Casual",
      "Organic",
      "Informal",
      "Authentic",
      "Friendly",
      "Approachable",
      "Legible",
      "Versatile",
      "Branding",
      "Packaging",
      "Digital",
      "Social media",
      "Handwritten notes"
    ]
  }
}