{
  "filename": "beard_man_36px.png",
  "status": "success",
  "description": {
    "detailed_description": "This font is a playful and whimsical interpretation of a classic serif typeface. Its distinctive feature is the replacement of traditional serifs with stylized faces, each with unique expressions and details. The faces are rendered with a slightly cartoonish quality, adding a touch of humor and personality to the otherwise traditional letterforms. The overall construction is based on a geometric framework, with consistent proportions and well-defined curves, ensuring readability even with the unconventional serifs. The font's playful nature makes it ideal for branding projects that require a touch of whimsy and personality, particularly in children's books, packaging, and digital illustrations. The font's cultural resonance lies in its ability to evoke a sense of childhood nostalgia and playful imagination, reminiscent of classic cartoon characters and whimsical illustrations. It's a font that invites interaction and engagement, making it perfect for projects that aim to capture a sense of fun and lightheartedness.",
    "technical_characteristics": [
      "Stylized serif faces",
      "Geometric construction",
      "Consistent proportions",
      "Well-defined curves",
      "Playful character",
      "Cartoonish rendering",
      "High x-height"
    ],
    "personality_traits": [
      "Playful",
      "Whimsical",
      "Nostalgic",
      "Imaginative",
      "Humorous",
      "Charming",
      "Friendly"
    ],
    "practical_contexts": [
      "Children's books",
      "Packaging design",
      "Digital illustrations",
      "Branding projects",
      "Website headers"
    ],
    "cultural_intuition": [
      "Childhood nostalgia",
      "Playful imagination",
      "Cartoon characters",
      "Whimsical illustrations",
      "Lightheartedness"
    ],
    "search_keywords": [
      "serif",
      "playful",
      "whimsical",
      "cartoon",
      "faces",
      "nostalgic",
      "children's",
      "branding",
      "packaging",
      "digital",
      "illustration",
      "geometric",
      "proportions",
      "curves",
      "readable",
      "high x-height",
      "friendly",
      "charming",
      "humorous",
      "imaginative"
    ]
  }
}