{
  "filename": "beautify_script_36px.png",
  "status": "success",
  "description": {
    "detailed_description": "This script font, reminiscent of elegant handwriting, features flowing strokes with varying thicknesses, creating a sense of natural rhythm. The ascenders and descenders are gracefully extended, adding to the overall sense of movement and expressiveness. The letterforms are designed with a subtle, almost playful, irregularity, giving the font a charming, handcrafted feel. While the overall impression is one of casual elegance, the font's legibility remains strong due to its clear, open counters and well-defined letterforms. This makes it suitable for a variety of applications, from handwritten notes and personal branding to invitations and website headers, where a touch of personality and warmth is desired. The font's inherent charm evokes a sense of nostalgia, reminiscent of vintage postcards and handwritten letters, while its contemporary design ensures its relevance in modern digital contexts.",
    "technical_characteristics": [
      "flowing strokes",
      "varying stroke thickness",
      "extended ascenders and descenders",
      "irregular letterforms",
      "open counters",
      "well-defined letterforms"
    ],
    "personality_traits": [
      "elegant",
      "expressive",
      "playful",
      "handcrafted",
      "charming",
      "casual",
      "warm"
    ],
    "practical_contexts": [
      "handwritten notes",
      "personal branding",
      "invitations",
      "website headers",
      "social media graphics"
    ],
    "cultural_intuition": [
      "nostalgia",
      "vintage charm",
      "handwritten authenticity",
      "modern expressiveness",
      "digital-friendly"
    ],
    "search_keywords": [
      "script font",
      "handwritten",
      "flowing",
      "elegant",
      "casual",
      "playful",
      "nostalgia",
      "vintage",
      "modern",
      "digital",
      "legible",
      "expressive",
      "personal branding",
      "invitations",
      "website headers",
      "social media"
    ]
  }
}