{
  "filename": "bee-la_36px.png",
  "status": "success",
  "description": {
    "detailed_description": "Bee-la is a playful script font that captures the essence of handwritten informality. Its flowing strokes and irregular letterforms evoke a sense of spontaneity and warmth, reminiscent of casual note-taking or personal correspondence. The font's construction is based on a combination of organic curves and sharp angles, creating a dynamic and visually engaging rhythm. The generous x-height and open counters ensure good legibility, even at smaller sizes, making it suitable for both display and body text applications. The font's overall character is friendly and approachable, with a touch of whimsy that adds a playful element to any design. Its contemporary relevance lies in its ability to convey authenticity and personality, aligning with the current trend towards more human-centered design. Bee-la's cultural associations range from vintage charm to modern digital aesthetics, making it a versatile choice for projects that require a touch of personality and warmth.",
    "technical_characteristics": [
      "flowing strokes",
      "irregular letterforms",
      "generous x-height",
      "open counters",
      "combination of organic curves and sharp angles",
      "dynamic rhythm",
      "handwritten aesthetic"
    ],
    "personality_traits": [
      "playful",
      "spontaneous",
      "warm",
      "friendly",
      "approachable",
      "whimsical",
      "casual",
      "informal",
      "authentic",
      "personal"
    ],
    "practical_contexts": [
      "display typography",
      "body text",
      "logos and branding",
      "social media graphics",
      "packaging design"
    ],
    "cultural_intuition": [
      "vintage charm",
      "modern digital aesthetics",
      "handwritten informality",
      "personal correspondence",
      "casual note-taking"
    ],
    "search_keywords": [
      "script font",
      "handwritten",
      "playful",
      "informal",
      "casual",
      "friendly",
      "approachable",
      "whimsical",
      "vintage",
      "modern",
      "digital",
      "display",
      "body text",
      "logo",
      "branding",
      "social media",
      "packaging",
      "authentic",
      "personality",
      "warmth",
      "generous x-height",
      "open counters",
      "flowing strokes",
      "irregular letterforms",
      "dynamic rhythm",
      "organic curves",
      "sharp angles"
    ]
  }
}