{
  "filename": "behind_lines_36px.png",
  "status": "success",
  "description": {
    "detailed_description": "This script font, with its flowing lines and delicate curves, evokes a sense of handwritten charm. The letterforms are constructed with a clear understanding of traditional calligraphy, featuring graceful ascenders and descenders, and a consistent stroke weight that creates a sense of rhythm. The overall impression is one of warmth and approachability, with a touch of whimsy. The font's generous x-height and open counters ensure good legibility, even at smaller sizes, making it suitable for both digital and print applications. Its playful nature makes it ideal for branding, packaging, and social media graphics, where it can add a touch of personality and charm. The font's cultural associations are rooted in the tradition of handwritten script, evoking a sense of personal connection and authenticity. It suggests a modern take on classic calligraphy, blending traditional elegance with a contemporary sensibility.",
    "technical_characteristics": [
      "flowing script style",
      "consistent stroke weight",
      "graceful ascenders and descenders",
      "generous x-height",
      "open counters",
      "delicate curves",
      "handwritten aesthetic"
    ],
    "personality_traits": [
      "playful",
      "approachable",
      "charming",
      "warm",
      "elegant",
      "whimsical",
      "handwritten"
    ],
    "practical_contexts": [
      "branding",
      "packaging",
      "social media graphics",
      "invitations",
      "greeting cards",
      "digital signage"
    ],
    "cultural_intuition": [
      "evokes handwritten charm",
      "suggests personal connection",
      "modern take on classic calligraphy",
      "contemporary sensibility",
      "sense of authenticity"
    ],
    "search_keywords": [
      "script font",
      "handwritten",
      "calligraphy",
      "flowing",
      "delicate",
      "graceful",
      "generous x-height",
      "open counters",
      "playful",
      "approachable",
      "charming",
      "elegant",
      "whimsical",
      "branding",
      "packaging",
      "social media",
      "invitations",
      "greeting cards",
      "digital signage",
      "modern",
      "authentic",
      "personal",
      "contemporary"
    ]
  }
}