{
  "filename": "berger_36px.png",
  "status": "success",
  "description": {
    "detailed_description": "Font Berger PX is a bold and playful display typeface that utilizes a unique multi-layered construction. Each letterform is composed of multiple parallel strokes, creating a striking three-dimensional effect. This layered structure adds a sense of depth and dynamism, while the consistent stroke weight and geometric proportions maintain a sense of order and clarity. The font's overall character is playful and energetic, reminiscent of vintage signage and retrofuturistic design. Its bold presence and playful nature make it ideal for headlines, logos, and eye-catching graphics, particularly in digital contexts where its layered structure can be effectively animated. The font's retro aesthetic evokes a sense of nostalgia and fun, while its contemporary digital application suggests a playful and engaging personality.",
    "technical_characteristics": [
      "Multi-layered construction",
      "Parallel strokes",
      "Consistent stroke weight",
      "Geometric proportions",
      "Bold weight",
      "Open counters",
      "High x-height"
    ],
    "personality_traits": [
      "Bold and playful",
      "Energetic and dynamic",
      "Retrofuturistic",
      "Nostalgic",
      "Fun and engaging",
      "Eye-catching",
      "Modern and digital"
    ],
    "practical_contexts": [
      "Headlines",
      "Logos",
      "Graphics",
      "Digital interfaces",
      "Animated typography"
    ],
    "cultural_intuition": [
      "Vintage signage",
      "Retrofuturistic design",
      "Nostalgia and fun",
      "Modern digital culture",
      "Playful and engaging"
    ],
    "search_keywords": [
      "display typeface",
      "multi-layered",
      "parallel strokes",
      "geometric",
      "bold",
      "playful",
      "retro",
      "futuristic",
      "nostalgic",
      "digital",
      "animated",
      "headlines",
      "logos",
      "graphics",
      "signage",
      "eye-catching",
      "modern",
      "contemporary"
    ]
  }
}