{
  "filename": "berner_basisschrift_36px.png",
  "status": "success",
  "description": {
    "detailed_description": "Berner Basissschrift is a charming script typeface that blends classic calligraphic influences with a contemporary sensibility. Its flowing strokes and graceful curves evoke a sense of elegance and sophistication, while its slightly informal character adds a touch of warmth and approachability. The font's construction is based on traditional penmanship, with subtle variations in stroke weight and delicate transitions between curves and straight lines. This attention to detail creates a sense of fluidity and naturalness, making the typeface feel both elegant and organic. The generous x-height and open counters ensure excellent legibility, even at smaller sizes, making it suitable for a wide range of applications, from branding and packaging to editorial design and web interfaces. The font's overall character is both playful and sophisticated, suggesting a brand that is both approachable and refined. Its cultural associations range from vintage advertising and classic literature to modern social media and digital design, making it a versatile choice for projects that require a touch of timeless charm.",
    "technical_characteristics": [
      "flowing strokes",
      "graceful curves",
      "subtle variations in stroke weight",
      "delicate transitions",
      "generous x-height",
      "open counters"
    ],
    "personality_traits": [
      "elegant",
      "sophisticated",
      "approachable",
      "playful",
      "organic",
      "refined",
      "versatile"
    ],
    "practical_contexts": [
      "branding",
      "packaging",
      "editorial design",
      "web interfaces",
      "social media"
    ],
    "cultural_intuition": [
      "vintage advertising",
      "classic literature",
      "modern social media",
      "digital design",
      "timeless charm"
    ],
    "search_keywords": [
      "script typeface",
      "calligraphic",
      "flowing strokes",
      "graceful curves",
      "elegant",
      "sophisticated",
      "approachable",
      "playful",
      "organic",
      "refined",
      "versatile",
      "branding",
      "packaging",
      "editorial design",
      "web interfaces",
      "social media",
      "vintage advertising",
      "classic literature",
      "modern social media",
      "digital design",
      "timeless charm"
    ]
  }
}