{
  "filename": "berry_rotunda_36px.png",
  "status": "success",
  "description": {
    "detailed_description": "Berry Rotunda is a blackletter typeface that embodies the spirit of medieval calligraphy while offering a contemporary twist. Its construction is rooted in traditional gothic forms, featuring sharp angles, pronounced serifs, and intricate flourishes. The ascenders and descenders are elongated, creating a sense of verticality and grandeur. The letterforms are tightly spaced, adding to the sense of density and formality. However, the font's overall character is softened by subtle humanist details, such as the slightly rounded terminals and the gentle curves in the lowercase letters. This balance between sharp and rounded elements creates a unique visual tension, making the font both authoritative and approachable. Berry Rotunda's bold strokes and dramatic contrasts make it ideal for headlines, logos, and display applications, where it can command attention and convey a sense of history and tradition. Its intricate details and decorative elements also lend themselves well to branding and packaging design, adding a touch of elegance and sophistication. While its historical roots are undeniable, Berry Rotunda's contemporary relevance lies in its ability to evoke a sense of nostalgia and authenticity while remaining visually engaging and versatile. It can be used to create a sense of timelessness and sophistication, adding a touch of classic charm to modern designs.",
    "technical_characteristics": [
      "Blackletter construction",
      "Sharp angles and serifs",
      "Intricate flourishes",
      "Elongated ascenders and descenders",
      "Tight letter spacing",
      "Bold strokes",
      "Dramatic contrasts",
      "Subtly rounded terminals",
      "Gentle curves in lowercase letters"
    ],
    "personality_traits": [
      "Authoritative",
      "Approachable",
      "Elegant",
      "Sophisticated",
      "Nostalgic",
      "Authentic",
      "Timeless",
      "Grand",
      "Formal",
      "Decorative"
    ],
    "practical_contexts": [
      "Headlines",
      "Logos",
      "Display applications",
      "Branding",
      "Packaging design"
    ],
    "cultural_intuition": [
      "Medieval calligraphy",
      "Gothic architecture",
      "Historical tradition",
      "Nostalgia",
      "Classic charm"
    ],
    "search_keywords": [
      "Blackletter",
      "Gothic",
      "Medieval",
      "Calligraphy",
      "Serif",
      "Flourish",
      "Bold",
      "Contrast",
      "Headline",
      "Logo",
      "Display",
      "Branding",
      "Packaging",
      "Elegant",
      "Sophisticated",
      "Nostalgia",
      "Authentic",
      "Timeless",
      "Grand",
      "Formal",
      "Decorative",
      "Traditional",
      "Contemporary",
      "Versatile"
    ]
  }
}