{
  "filename": "bichochos_type_36px.png",
  "status": "success",
  "description": {
    "detailed_description": "This font, with its playful, hand-drawn aesthetic, evokes a sense of childlike wonder and casual charm. The letters are constructed with a loose, expressive stroke, reminiscent of a child's scribbles, yet with a clear intentionality in their form. The uneven line weights and slightly wobbly curves add to the whimsical feel, while the generous x-height and open counters ensure good legibility, even in smaller sizes. The font's personality is undeniably friendly and approachable, suggesting a sense of fun and lightheartedness. It's ideal for projects that require a touch of whimsy, such as children's books, playful branding, or social media graphics. However, its casual nature might not be suitable for formal or professional contexts. The font's cultural resonance lies in its connection to the art of doodling and the nostalgic feeling of childhood creativity. It taps into a universal human experience, making it relatable across cultures and generations.",
    "technical_characteristics": [
      "Hand-drawn aesthetic",
      "Uneven line weights",
      "Loose, expressive stroke",
      "Generous x-height",
      "Open counters",
      "Slightly wobbly curves"
    ],
    "personality_traits": [
      "Playful",
      "Whimsical",
      "Friendly",
      "Approachable",
      "Casual",
      "Lighthearted",
      "Nostalgic"
    ],
    "practical_contexts": [
      "Children's books",
      "Playful branding",
      "Social media graphics",
      "Informal signage",
      "Casual invitations"
    ],
    "cultural_intuition": [
      "Evokes childlike wonder",
      "Connects to the art of doodling",
      "Suggests a sense of creativity",
      "Taps into nostalgic feelings",
      "Relatable across cultures and generations"
    ],
    "search_keywords": [
      "Hand-drawn",
      "Playful",
      "Whimsical",
      "Casual",
      "Friendly",
      "Nostalgic",
      "Children's",
      "Branding",
      "Social media",
      "Informal",
      "Doodling",
      "Scribble",
      "Cartoon",
      "Fun",
      "Lighthearted"
    ]
  }
}