{
  "filename": "bienchen_sas_36px.png",
  "status": "success",
  "description": {
    "detailed_description": "Bichen is a charming script font that captures the essence of handwritten elegance. Its flowing strokes and graceful curves evoke a sense of personal touch, reminiscent of traditional calligraphy. The font's construction is characterized by a consistent, slightly angled baseline, creating a sense of dynamic movement. The letterforms are carefully balanced, with a moderate x-height and open counters that ensure good legibility even at smaller sizes. The terminals are subtly rounded, adding a touch of warmth and approachability to the overall aesthetic. Bichen's design personality is both playful and sophisticated, suggesting a balance between informality and refinement. It draws inspiration from classic script fonts, but with a contemporary twist that makes it feel fresh and engaging. The font's versatility makes it suitable for a wide range of applications, from handwritten notes and personal branding to website headers and social media graphics. Its inherent charm and readability make it particularly effective for conveying a sense of authenticity and warmth, while its subtle elegance adds a touch of sophistication to any project.",
    "technical_characteristics": [
      "consistent baseline angle",
      "moderate x-height",
      "open counters",
      "subtly rounded terminals",
      "flowing strokes",
      "graceful curves",
      "balanced letterforms"
    ],
    "personality_traits": [
      "playful",
      "sophisticated",
      "elegant",
      "charming",
      "authentic",
      "warm",
      "readable"
    ],
    "practical_contexts": [
      "handwritten notes",
      "personal branding",
      "website headers",
      "social media graphics",
      "invitations and stationery"
    ],
    "cultural_intuition": [
      "evokes a sense of personal touch",
      "reminiscent of traditional calligraphy",
      "suggests a balance between informality and refinement",
      "captures the essence of handwritten elegance"
    ],
    "search_keywords": [
      "script font",
      "handwritten",
      "elegant",
      "flowing",
      "graceful",
      "readable",
      "versatile",
      "personal branding",
      "website headers",
      "social media",
      "invitations",
      "stationery",
      "calligraphy",
      "authentic",
      "warm",
      "sophisticated",
      "contemporary",
      "classic",
      "playful"
    ]
  }
}