{
  "filename": "billy_scriptian_36px.png",
  "status": "success",
  "description": {
    "detailed_description": "Billy Scriptian is a flowing script typeface that captures the essence of traditional calligraphy while maintaining a contemporary feel. Its fluid strokes and graceful curves are reminiscent of handwritten script, but the font's overall structure is carefully balanced and legible. The ascenders and descenders are well-proportioned, ensuring readability even at smaller sizes. The font's distinctive feature is its use of subtle variations in stroke weight, adding a touch of dynamism and personality to the letterforms. This subtle variation, combined with the font's overall fluidity, creates a sense of movement and energy. Billy Scriptian is well-suited for a variety of applications, from elegant invitations and branding to website headers and social media graphics. Its versatility stems from its ability to convey both a sense of sophistication and approachability, making it a strong choice for projects that require a touch of personality and charm. The font's cultural resonance lies in its connection to the long tradition of handwritten script, evoking a sense of authenticity and craftsmanship. However, its contemporary design elements, such as the balanced structure and legible forms, ensure that it feels fresh and relevant for modern audiences.",
    "technical_characteristics": [
      "Fluid strokes",
      "Graceful curves",
      "Subtle stroke weight variations",
      "Balanced structure",
      "Legible forms",
      "Well-proportioned ascenders and descenders"
    ],
    "personality_traits": [
      "Elegant",
      "Fluid",
      "Dynamic",
      "Approachable",
      "Sophisticated",
      "Charming",
      "Authentic"
    ],
    "practical_contexts": [
      "Invitations",
      "Branding",
      "Website headers",
      "Social media graphics",
      "Display typography"
    ],
    "cultural_intuition": [
      "Handwritten script",
      "Traditional calligraphy",
      "Modern design",
      "Authenticity",
      "Craftsmanship"
    ],
    "search_keywords": [
      "Script",
      "Calligraphy",
      "Handwritten",
      "Fluid",
      "Elegant",
      "Sophisticated",
      "Charming",
      "Legible",
      "Display",
      "Branding",
      "Invitation",
      "Website",
      "Social media",
      "Modern",
      "Traditional",
      "Authentic"
    ]
  }
}