{
  "filename": "black_roses_36px.png",
  "status": "success",
  "description": {
    "detailed_description": "Black Roses is a decorative script font that embodies a whimsical and romantic aesthetic. Its flowing, calligraphic strokes are adorned with intricate flourishes and delicate details, reminiscent of Victorian-era embellishments. The font's construction is based on a combination of organic curves and sharp angles, creating a dynamic and visually engaging interplay. The high x-height and open counters ensure good legibility, even at smaller sizes, while the exaggerated ascenders and descenders add to its dramatic flair. Black Roses is a font that exudes charm and elegance, making it ideal for projects that require a touch of vintage sophistication. Its playful nature makes it suitable for invitations, greeting cards, and other celebratory materials, while its intricate details lend themselves well to branding and packaging designs. However, its ornate style may not be appropriate for large blocks of text or applications requiring high readability.",
    "technical_characteristics": [
      "Calligraphic construction",
      "Intricate flourishes",
      "High x-height",
      "Open counters",
      "Exaggerated ascenders and descenders"
    ],
    "personality_traits": [
      "Whimsical",
      "Romantic",
      "Elegant",
      "Playful",
      "Sophisticated"
    ],
    "practical_contexts": [
      "Invitations",
      "Greeting cards",
      "Branding",
      "Packaging",
      "Decorative titles"
    ],
    "cultural_intuition": [
      "Victorian-era aesthetics",
      "Romantic sensibility",
      "Nostalgic charm",
      "Celebratory mood",
      "Vintage sophistication"
    ],
    "search_keywords": [
      "Black Roses",
      "Script font",
      "Decorative",
      "Calligraphic",
      "Flourishes",
      "Whimsical",
      "Romantic",
      "Elegant",
      "Vintage",
      "Sophisticated",
      "Invitation",
      "Greeting card",
      "Branding",
      "Packaging",
      "Decorative title",
      "High x-height",
      "Open counters",
      "Exaggerated ascenders",
      "Descenders"
    ]
  }
}