{
  "filename": "blackbook_one_36px.png",
  "status": "success",
  "description": {
    "detailed_description": "This font is a bold expression of urban energy, drawing heavily from the visual language of graffiti art. Its construction is entirely freehand, with each letterform exhibiting a dynamic, almost chaotic, flow. The strokes are thick and confident, often overlapping and creating intricate negative spaces. This lack of strict geometric structure contributes to the font's raw, unpolished aesthetic, evoking a sense of spontaneity and rebellion. The exaggerated angles and sharp terminals further amplify this rebellious spirit, while the occasional flourishes and embellishments add a touch of playful personality. While the font's legibility can be challenging at smaller sizes, its impact is undeniable at larger scales, making it ideal for headlines, posters, and street art applications. It embodies the raw energy and creative expression of urban culture, capturing the spirit of individuality and self-expression that defines street art. The font's bold, unbridled character resonates with a younger audience, particularly those who identify with the countercultural spirit of urban art.",
    "technical_characteristics": [
      "Freehand construction",
      "Dynamic, flowing strokes",
      "Overlapping letterforms",
      "Exaggerated angles",
      "Sharp terminals",
      "Intricate negative spaces",
      "Thick, confident strokes",
      "Occasional flourishes and embellishments"
    ],
    "personality_traits": [
      "Bold",
      "Energetic",
      "Rebellious",
      "Spontaneous",
      "Unpolished",
      "Playful",
      "Raw",
      "Unconventional",
      "Expressive"
    ],
    "practical_contexts": [
      "Headlines",
      "Posters",
      "Street art",
      "Urban design",
      "Graphic design",
      "Branding for youth-oriented products"
    ],
    "cultural_intuition": [
      "Urban culture",
      "Graffiti art",
      "Counterculture",
      "Rebellion",
      "Individuality",
      "Self-expression",
      "Youth culture"
    ],
    "search_keywords": [
      "graffiti",
      "street art",
      "urban",
      "bold",
      "energetic",
      "rebellious",
      "spontaneous",
      "unpolished",
      "playful",
      "raw",
      "unconventional",
      "expressive",
      "freehand",
      "dynamic",
      "overlapping",
      "exaggerated",
      "sharp",
      "thick",
      "flourishes",
      "headlines",
      "posters",
      "branding",
      "youth",
      "counterculture",
      "individuality",
      "self-expression"
    ]
  }
}