{
  "filename": "black_fire_36px.png",
  "status": "success",
  "description": {
    "detailed_description": "Black Fire is a display typeface that embraces a playful, almost chaotic energy. Its construction is based on a combination of geometric and organic forms, resulting in a unique visual language. The letters are characterized by sharp angles and jagged edges, creating a sense of movement and dynamism. The overall effect is one of a font that is both bold and whimsical, with a strong sense of personality. The font's irregular letterforms and uneven spacing contribute to its distinctive character, making it ideal for eye-catching headlines, logos, and branding elements. While its unconventional nature might limit its use in large blocks of text, Black Fire excels in grabbing attention and conveying a sense of excitement or rebellion. Its visual impact evokes a sense of vintage Americana, reminiscent of hand-painted signs and bold graphic design from the mid-20th century. This nostalgic quality, combined with its contemporary edge, makes Black Fire a versatile tool for designers seeking to create a unique and memorable visual identity.",
    "technical_characteristics": [
      "jagged edges",
      "sharp angles",
      "irregular letterforms",
      "uneven spacing",
      "geometric and organic construction"
    ],
    "personality_traits": [
      "bold",
      "whimsical",
      "dynamic",
      "unconventional",
      "eye-catching"
    ],
    "practical_contexts": [
      "headlines",
      "logos",
      "branding elements",
      "short bursts of text",
      "digital and print media"
    ],
    "cultural_intuition": [
      "vintage Americana",
      "mid-20th century graphic design",
      "hand-painted signs",
      "rebellious spirit",
      "playful energy"
    ],
    "search_keywords": [
      "display typeface",
      "jagged",
      "sharp angles",
      "irregular",
      "uneven spacing",
      "geometric",
      "organic",
      "bold",
      "whimsical",
      "dynamic",
      "eye-catching",
      "headlines",
      "logos",
      "branding",
      "vintage",
      "Americana",
      "rebellious",
      "playful",
      "hand-painted",
      "graphic design",
      "mid-century",
      "nostalgic",
      "contemporary"
    ]
  }
}