{
  "filename": "black_carrot_36px.png",
  "status": "success",
  "description": {
    "detailed_description": "Black Carrot is a bold, playful display font that draws inspiration from vintage cartoon lettering and retro signage. Its rounded, bulbous forms are reminiscent of hand-drawn characters, creating a sense of whimsy and approachability. The font's construction is characterized by exaggerated curves and rounded terminals, giving it a friendly and inviting feel. The generous x-height and open counters ensure strong legibility, even at large sizes, making it ideal for headlines, logos, and eye-catching signage. The font's playful nature is further enhanced by its slightly uneven baseline and the subtle variations in letterforms, adding a touch of personality and charm. Black Carrot's retro aesthetic evokes a sense of nostalgia and fun, making it perfect for projects that aim to capture a playful and lighthearted mood. Its bold presence and playful character make it suitable for a wide range of applications, from branding and packaging to posters and social media graphics.",
    "technical_characteristics": [
      "Rounded, bulbous forms",
      "Exaggerated curves",
      "Rounded terminals",
      "Generous x-height",
      "Open counters",
      "Slightly uneven baseline",
      "Variations in letterforms"
    ],
    "personality_traits": [
      "Playful",
      "Whimsical",
      "Approachable",
      "Friendly",
      "Inviting",
      "Bold",
      "Retro"
    ],
    "practical_contexts": [
      "Headlines",
      "Logos",
      "Signage",
      "Posters",
      "Social media graphics",
      "Branding",
      "Packaging"
    ],
    "cultural_intuition": [
      "Vintage cartoon lettering",
      "Retro signage",
      "Nostalgia",
      "Fun",
      "Lightheartedness"
    ],
    "search_keywords": [
      "Display font",
      "Bold",
      "Playful",
      "Rounded",
      "Bulbous",
      "Cartoon",
      "Retro",
      "Vintage",
      "Whimsical",
      "Approachable",
      "Friendly",
      "Inviting",
      "Legible",
      "Headlines",
      "Logos",
      "Signage",
      "Posters",
      "Social media",
      "Branding",
      "Packaging",
      "Nostalgia",
      "Fun",
      "Lighthearted"
    ]
  }
}