{
  "filename": "blackwood_castle_36px.png",
  "status": "success",
  "description": {
    "detailed_description": "Blackwood Castle is a bold, blackletter typeface that draws inspiration from medieval script, but with a contemporary twist. Its thick strokes and sharp angles create a strong, imposing presence, reminiscent of gothic architecture and illuminated manuscripts. The font's distinctive features include its exaggerated serifs, which extend beyond the letterforms, and its dramatic, almost calligraphic flourishes, particularly in the lowercase letters. The overall effect is one of power and authority, yet with a touch of whimsy and playfulness. The font's high x-height and open counters ensure good legibility, even at smaller sizes, making it suitable for both display and body text. Its bold character and historical references make it ideal for projects that require a strong visual impact, such as branding, packaging, and editorial design. However, its intricate details and bold weight may limit its use in smaller sizes or for extended reading.",
    "technical_characteristics": [
      "Blackletter construction",
      "Exaggerated serifs",
      "Sharp angles",
      "High x-height",
      "Open counters",
      "Dramatic flourishes",
      "Bold weight"
    ],
    "personality_traits": [
      "Imposing",
      "Authoritative",
      "Whimsical",
      "Playful",
      "Bold",
      "Dramatic",
      "Intricate"
    ],
    "practical_contexts": [
      "Display typography",
      "Branding",
      "Packaging",
      "Editorial design",
      "Headlines",
      "Titles",
      "Short text blocks"
    ],
    "cultural_intuition": [
      "Medieval script",
      "Gothic architecture",
      "Illuminated manuscripts",
      "Historical grandeur",
      "Modern interpretation of a classic style"
    ],
    "search_keywords": [
      "Blackletter",
      "Gothic",
      "Medieval",
      "Bold",
      "Serif",
      "Display",
      "Branding",
      "Packaging",
      "Editorial",
      "Headlines",
      "Titles",
      "Intricate",
      "Dramatic",
      "Whimsical",
      "Authoritative",
      "Power",
      "Legibility",
      "High x-height",
      "Open counters",
      "Contemporary",
      "Classic",
      "Historical"
    ]
  }
}