{
  "filename": "blackboard_ultra_36px.png",
  "status": "success",
  "description": {
    "detailed_description": "Blackboard Ultra is a script font that captures the casual charm of handwritten text. Its flowing strokes and organic curves evoke the feeling of a personal note, while its consistent weight and clear letterforms ensure readability. The font's generous x-height and open counters contribute to its legibility, even at smaller sizes. The slightly rounded terminals and subtle variations in stroke thickness add a touch of warmth and personality. Blackboard Ultra's playful nature makes it ideal for projects that require a friendly and approachable tone, such as invitations, branding for creative businesses, or social media graphics. Its handwritten aesthetic evokes a sense of authenticity and personal connection, making it suitable for projects that aim to convey a sense of warmth and informality. The font's versatility allows it to be used in a variety of contexts, from handwritten-style logos to playful social media posts.",
    "technical_characteristics": [
      "flowing strokes",
      "organic curves",
      "consistent weight",
      "generous x-height",
      "open counters",
      "slightly rounded terminals",
      "subtle variations in stroke thickness"
    ],
    "personality_traits": [
      "casual",
      "playful",
      "approachable",
      "friendly",
      "authentic",
      "personal",
      "informal"
    ],
    "practical_contexts": [
      "invitations",
      "branding for creative businesses",
      "social media graphics",
      "handwritten-style logos",
      "playful social media posts"
    ],
    "cultural_intuition": [
      "evokes the feeling of a personal note",
      "suggests a sense of warmth and informality",
      "captures the casual charm of handwritten text"
    ],
    "search_keywords": [
      "script font",
      "handwritten font",
      "casual font",
      "playful font",
      "approachable font",
      "friendly font",
      "authentic font",
      "personal font",
      "informal font",
      "legible font",
      "versatile font",
      "invitations",
      "branding",
      "social media",
      "logos",
      "graphics",
      "handwritten style",
      "personal note",
      "warmth",
      "informality"
    ]
  }
}