{
  "filename": "blank_36px.png",
  "status": "success",
  "description": {
    "detailed_description": "Blank 3bpx is a sans-serif typeface that embodies a stark, geometric aesthetic. Its construction is based on a grid system, resulting in characters with sharp corners and consistent proportions. The letterforms are highly simplified, with minimal curves and a focus on straight lines. This creates a sense of clarity and precision, reminiscent of early digital typography. The font's high x-height and open counters contribute to its legibility, making it suitable for both large-scale displays and smaller text sizes. The overall character of Blank 3bpx is one of starkness and simplicity, conveying a sense of modernity and efficiency. It evokes a sense of digital minimalism, reminiscent of early computer interfaces and the rise of technology in the late 20th century. Its clean lines and geometric structure suggest a sense of order and control, making it ideal for projects that require a strong visual identity and a sense of authority. While its simplicity might be perceived as austere by some, it also offers a sense of timeless elegance, making it suitable for a wide range of applications, from branding and web design to editorial and signage.",
    "technical_characteristics": [
      "Geometric construction",
      "High x-height",
      "Open counters",
      "Sharp corners",
      "Minimal curves",
      "Consistent proportions",
      "Simplified letterforms"
    ],
    "personality_traits": [
      "Stark",
      "Geometric",
      "Modern",
      "Efficient",
      "Minimalist",
      "Clean",
      "Authoritative"
    ],
    "practical_contexts": [
      "Branding",
      "Web design",
      "Editorial design",
      "Signage",
      "Large-scale displays",
      "Small text sizes"
    ],
    "cultural_intuition": [
      "Digital minimalism",
      "Early computer interfaces",
      "Late 20th-century technology",
      "Modernity",
      "Efficiency"
    ],
    "search_keywords": [
      "Sans-serif",
      "Geometric",
      "Minimalist",
      "Digital",
      "Modern",
      "Clean",
      "High x-height",
      "Open counters",
      "Sharp corners",
      "Branding",
      "Web design",
      "Editorial",
      "Signage",
      "Display",
      "Text",
      "Interface",
      "Technology",
      "Efficiency",
      "Authority",
      "Timeless",
      "Elegant"
    ]
  }
}