{
  "filename": "blockss_36px.png",
  "status": "success",
  "description": {
    "detailed_description": "8Lockss is a bold, expressive script font that captures the energy of hand-drawn lettering. Its irregular, angular strokes and exaggerated letterforms create a sense of dynamism and playfulness. The font's construction is based on a combination of geometric and organic elements, resulting in a unique and visually engaging style. The sharp angles and uneven line weights contribute to its edgy and slightly rebellious character, while the overall flow and rhythm of the letters maintain a sense of readability. 8Lockss is well-suited for headlines, logos, and other display applications where its bold personality can make a statement. Its informal and energetic nature makes it ideal for projects that require a touch of irreverence and a sense of youthful energy. The font's cultural associations range from street art and graffiti to contemporary digital design, reflecting its ability to bridge the gap between traditional and modern aesthetics.",
    "technical_characteristics": [
      "irregular, angular strokes",
      "exaggerated letterforms",
      "sharp angles",
      "uneven line weights",
      "geometric and organic construction"
    ],
    "personality_traits": [
      "bold and expressive",
      "dynamic and playful",
      "edgy and rebellious",
      "informal and energetic",
      "youthful and irreverent"
    ],
    "practical_contexts": [
      "headlines",
      "logos",
      "display applications",
      "street art and graffiti",
      "digital design"
    ],
    "cultural_intuition": [
      "street art and graffiti",
      "contemporary digital design",
      "youth culture",
      "rebellious spirit",
      "urban energy"
    ],
    "search_keywords": [
      "script font",
      "bold",
      "expressive",
      "hand-drawn",
      "irregular",
      "angular",
      "exaggerated",
      "geometric",
      "organic",
      "sharp angles",
      "uneven line weights",
      "dynamic",
      "playful",
      "edgy",
      "rebellious",
      "informal",
      "energetic",
      "youthful",
      "headlines",
      "logos",
      "display",
      "street art",
      "graffiti",
      "digital design",
      "urban",
      "contemporary"
    ]
  }
}