{
  "filename": "block_code_36px.png",
  "status": "success",
  "description": {
    "detailed_description": "Block Code (3Bpx) is a sans-serif typeface that embodies a stark, geometric aesthetic. Its construction is based on a grid system, resulting in characters with sharp corners and consistent stroke widths. The letterforms are highly legible, with open counters and a generous x-height, making them easily readable even at small sizes. The font's bold weight and monospaced nature contribute to its assertive and commanding presence. This design evokes a sense of digital technology, reminiscent of early computer interfaces and programming languages. Its clean lines and lack of ornamentation suggest efficiency and precision, making it suitable for projects that require a modern, technical feel. Block Code's bold character and strong legibility make it ideal for headlines, branding elements, and digital interfaces, particularly in contexts where a sense of authority and technological sophistication is desired.",
    "technical_characteristics": [
      "Geometric construction",
      "Monospaced",
      "Consistent stroke widths",
      "Sharp corners",
      "High x-height",
      "Open counters",
      "Bold weight"
    ],
    "personality_traits": [
      "Assertive",
      "Commanding",
      "Modern",
      "Technical",
      "Efficient",
      "Precise",
      "Authoritative"
    ],
    "practical_contexts": [
      "Headlines",
      "Branding elements",
      "Digital interfaces",
      "Programming environments",
      "Technical documentation"
    ],
    "cultural_intuition": [
      "Digital technology",
      "Early computer interfaces",
      "Programming languages",
      "Modernism",
      "Futurism"
    ],
    "search_keywords": [
      "sans-serif",
      "geometric",
      "monospaced",
      "bold",
      "high x-height",
      "open counters",
      "sharp corners",
      "digital",
      "technology",
      "programming",
      "modern",
      "technical",
      "futuristic",
      "headlines",
      "branding",
      "interface",
      "code",
      "computer",
      "programming language",
      "futurism",
      "modernism"
    ]
  }
}