{
  "filename": "block_face_36px.png",
  "status": "success",
  "description": {
    "detailed_description": "Block Face (BFPX) is a geometric sans-serif typeface that embodies a bold, industrial aesthetic. Its construction is strictly geometric, with each letterform built from a series of sharp, angular lines and right angles. This creates a sense of rigidity and strength, reminiscent of architectural structures or industrial machinery. The font's high x-height and open counters ensure excellent legibility, even at small sizes, making it suitable for both display and body text applications. The bold, confident character of Block Face evokes a sense of power and authority, making it ideal for projects that require a strong visual presence. Its sharp, angular forms and lack of ornamentation suggest a sense of efficiency and functionality, aligning it with contemporary design trends that prioritize clarity and minimalism. While its geometric construction might seem austere, the font's bold weight and slightly rounded terminals add a touch of approachability, preventing it from feeling overly cold or sterile. Block Face is a versatile typeface that can be used for a wide range of projects, from branding and signage to editorial design and digital interfaces. Its bold, industrial aesthetic makes it particularly well-suited for projects that require a strong visual impact and a sense of modern, urban energy.",
    "technical_characteristics": [
      "Geometric construction",
      "Sharp, angular lines",
      "Right angles",
      "High x-height",
      "Open counters",
      "Bold weight",
      "Slightly rounded terminals"
    ],
    "personality_traits": [
      "Bold",
      "Confident",
      "Industrial",
      "Geometric",
      "Modern",
      "Efficient",
      "Functional"
    ],
    "practical_contexts": [
      "Branding and signage",
      "Editorial design",
      "Digital interfaces",
      "Display typography",
      "Body text"
    ],
    "cultural_intuition": [
      "Evokes a sense of power and authority",
      "Suggests a modern, urban energy",
      "Reflects contemporary design trends that prioritize clarity and minimalism",
      "Reminiscent of architectural structures or industrial machinery"
    ],
    "search_keywords": [
      "Geometric sans-serif",
      "Block Face",
      "BFPX",
      "Industrial",
      "Bold",
      "Modern",
      "Urban",
      "High x-height",
      "Open counters",
      "Sharp angles",
      "Right angles",
      "Rounded terminals",
      "Branding",
      "Signage",
      "Editorial design",
      "Digital interfaces",
      "Display typography",
      "Body text",
      "Minimalism",
      "Clarity",
      "Power",
      "Authority",
      "Efficiency",
      "Functionality"
    ]
  }
}