{
  "filename": "blokletters_36px.png",
  "status": "success",
  "description": {
    "detailed_description": "Blokletters is a playful script font that blends a casual, handwritten aesthetic with a touch of retro charm. Its rounded forms and bouncy curves create a sense of lightheartedness and approachability, while the slightly condensed letterforms and consistent stroke weight lend a touch of professionalism. The font's generous x-height and open counters ensure excellent legibility, even at smaller sizes, making it suitable for both display and body text applications. The overall effect is a font that feels both friendly and confident, capable of adding a touch of personality to a wide range of projects. Its retro-inspired design evokes a sense of nostalgia and fun, reminiscent of vintage signage and playful illustrations. Blokletters is a versatile font that can be used to create a range of moods, from whimsical and playful to bold and confident, making it a great choice for branding, packaging, editorial design, and digital interfaces.",
    "technical_characteristics": [
      "rounded forms",
      "bouncy curves",
      "condensed letterforms",
      "consistent stroke weight",
      "generous x-height",
      "open counters"
    ],
    "personality_traits": [
      "playful",
      "approachable",
      "lighthearted",
      "confident",
      "retro-inspired"
    ],
    "practical_contexts": [
      "branding",
      "packaging",
      "editorial design",
      "digital interfaces",
      "display and body text"
    ],
    "cultural_intuition": [
      "evokes a sense of nostalgia",
      "reminiscent of vintage signage",
      "suggests a playful and fun personality",
      "captures a sense of retro charm",
      "feels both modern and timeless"
    ],
    "search_keywords": [
      "script font",
      "rounded forms",
      "bouncy curves",
      "condensed letterforms",
      "consistent stroke weight",
      "generous x-height",
      "open counters",
      "playful",
      "approachable",
      "lighthearted",
      "confident",
      "retro-inspired",
      "vintage",
      "nostalgia",
      "fun",
      "branding",
      "packaging",
      "editorial design",
      "digital interfaces",
      "display text",
      "body text"
    ]
  }
}