{
  "filename": "blokus_36px.png",
  "status": "success",
  "description": {
    "detailed_description": "This font, with its stark, pixelated forms, embodies a distinct retro-futuristic aesthetic. The geometric construction, evident in the square-shaped characters and consistent stroke widths, evokes a sense of order and precision. The sharp terminals and lack of serifs contribute to a clean, uncluttered appearance, reminiscent of early digital displays. The font's bold, confident presence suggests a sense of power and authority, while its pixelated nature adds a playful, almost nostalgic touch. This combination makes it ideal for projects that require a strong visual impact, particularly in digital contexts, such as game interfaces, website headers, or branding for tech-focused companies. The font's retro feel evokes a sense of nostalgia for the early days of computing, while its bold, geometric forms suggest a sense of progress and innovation.",
    "technical_characteristics": [
      "Geometric construction",
      "Square-shaped characters",
      "Consistent stroke widths",
      "Sharp terminals",
      "Lack of serifs",
      "Pixelated forms",
      "Monospaced"
    ],
    "personality_traits": [
      "Bold",
      "Confident",
      "Retro-futuristic",
      "Nostalgic",
      "Playful",
      "Clean",
      "Uncluttered",
      "Powerful",
      "Authoritative"
    ],
    "practical_contexts": [
      "Game interfaces",
      "Website headers",
      "Branding for tech companies",
      "Digital signage",
      "Retro-themed projects"
    ],
    "cultural_intuition": [
      "Evokes early digital displays",
      "Suggests a sense of progress and innovation",
      "Nostalgia for the early days of computing",
      "Contemporary relevance in retro-inspired design",
      "Fits within the aesthetic of cyberpunk and sci-fi"
    ],
    "search_keywords": [
      "Geometric",
      "Pixelated",
      "Retro",
      "Futuristic",
      "Monospaced",
      "Bold",
      "Sharp",
      "Clean",
      "Digital",
      "Game",
      "Website",
      "Branding",
      "Tech",
      "Nostalgia",
      "Cyberpunk",
      "Sci-fi"
    ]
  }
}