{
  "filename": "blurrr_letters_36px.png",
  "status": "success",
  "description": {
    "detailed_description": "Blurr Letters is a display typeface that embraces a playful, almost cartoonish aesthetic. Its bold, chunky forms are built with a combination of geometric and organic elements, resulting in a unique visual language. The letters are characterized by their rounded corners, exaggerated curves, and irregular outlines, creating a sense of movement and energy. This playful approach is further emphasized by the inclusion of decorative elements like the swash on the lowercase 'g' and the stylized ampersand. While the font's overall appearance is whimsical, it maintains a degree of legibility due to its generous x-height and open counters. This makes it suitable for headlines, logos, and other applications where a bold statement is desired. Blurr Letters evokes a sense of fun and nostalgia, reminiscent of vintage comic books and playful signage. Its bold, expressive nature makes it ideal for projects that require a touch of whimsy and a strong visual impact.",
    "technical_characteristics": [
      "Rounded corners",
      "Exaggerated curves",
      "Irregular outlines",
      "Generous x-height",
      "Open counters",
      "Decorative elements",
      "Bold weight"
    ],
    "personality_traits": [
      "Playful",
      "Whimsical",
      "Energetic",
      "Bold",
      "Expressive",
      "Nostalgic",
      "Fun"
    ],
    "practical_contexts": [
      "Headlines",
      "Logos",
      "Posters",
      "Packaging",
      "Digital interfaces"
    ],
    "cultural_intuition": [
      "Vintage comic books",
      "Playful signage",
      "Retro design",
      "Pop culture",
      "Nostalgia"
    ],
    "search_keywords": [
      "display typeface",
      "bold",
      "rounded corners",
      "exaggerated curves",
      "irregular outlines",
      "generous x-height",
      "open counters",
      "decorative elements",
      "playful",
      "whimsical",
      "energetic",
      "nostalgic",
      "fun",
      "headlines",
      "logos",
      "posters",
      "packaging",
      "digital interfaces",
      "vintage comic books",
      "playful signage",
      "retro design",
      "pop culture"
    ]
  }
}