{
  "filename": "bobo_36px.png",
  "status": "success",
  "description": {
    "detailed_description": "Bobo is a playful and expressive script font that captures the energy of handwritten text. Its irregular letterforms, with their varying stroke widths and organic curves, evoke a sense of spontaneity and personality. The font's generous x-height and open counters ensure good legibility, even at smaller sizes. The overall effect is one of casual charm, making it ideal for projects that require a friendly and approachable tone. While Bobo's hand-drawn aesthetic might seem informal, its carefully crafted letterforms and consistent baseline ensure a level of professionalism that makes it suitable for a range of applications, from branding and packaging to social media graphics and website design. The font's cultural resonance lies in its ability to evoke a sense of authenticity and human connection, reminiscent of personal notes and handwritten messages. This makes it particularly well-suited for projects that aim to convey warmth and genuineness.",
    "technical_characteristics": [
      "Irregular letterforms",
      "Varying stroke widths",
      "Organic curves",
      "Generous x-height",
      "Open counters",
      "Consistent baseline"
    ],
    "personality_traits": [
      "Playful",
      "Expressive",
      "Spontaneous",
      "Casual",
      "Charming",
      "Approachable",
      "Authentic"
    ],
    "practical_contexts": [
      "Branding and packaging",
      "Social media graphics",
      "Website design",
      "Handwritten notes",
      "Personal messages"
    ],
    "cultural_intuition": [
      "Evokes a sense of authenticity",
      "Reminiscent of personal notes",
      "Conveys warmth and genuineness",
      "Reflects a casual and approachable tone",
      "Captures the energy of handwritten text"
    ],
    "search_keywords": [
      "Script font",
      "Handwritten",
      "Playful",
      "Expressive",
      "Casual",
      "Charming",
      "Approachable",
      "Authentic",
      "Branding",
      "Packaging",
      "Social media",
      "Website design",
      "Handwritten notes",
      "Personal messages",
      "Irregular letterforms",
      "Varying stroke widths",
      "Organic curves",
      "Generous x-height",
      "Open counters",
      "Consistent baseline"
    ]
  }
}