{
  "filename": "bodoque_36px.png",
  "status": "success",
  "description": {
    "detailed_description": "Bodoque is a geometric sans-serif typeface that draws inspiration from the bold, blocky aesthetics of early video games and 1980s computer graphics. Its construction is based on a grid system, resulting in a clean, precise, and highly legible typeface. Each letterform is composed of simple, geometric shapes, with sharp corners and minimal curves. The overall effect is one of starkness and clarity, reminiscent of the pixelated graphics of the era. The font's high x-height and open counters further enhance its legibility, making it suitable for both large-scale display applications and smaller text sizes. Bodoque's bold, playful personality makes it ideal for projects that require a retro-futuristic or tech-inspired aesthetic. It can be used to create eye-catching headlines, logos, and branding elements, as well as for digital interfaces, game design, and other projects that embrace a playful, nostalgic feel. The font's cultural associations with the early days of computing and video games make it a powerful tool for evoking a sense of nostalgia and playful experimentation.",
    "technical_characteristics": [
      "Geometric construction",
      "Sharp corners",
      "High x-height",
      "Open counters",
      "Consistent stroke weight",
      "Monospaced",
      "Limited character set"
    ],
    "personality_traits": [
      "Bold",
      "Playful",
      "Nostalgic",
      "Retro-futuristic",
      "Tech-inspired",
      "Clear",
      "Precise",
      "Legible"
    ],
    "practical_contexts": [
      "Headlines",
      "Logos",
      "Branding",
      "Digital interfaces",
      "Game design",
      "Posters",
      "Packaging"
    ],
    "cultural_intuition": [
      "Early video games",
      "1980s computer graphics",
      "Pixel art",
      "Retro-futurism",
      "Nostalgia for the digital age"
    ],
    "search_keywords": [
      "Geometric sans-serif",
      "Bodoque",
      "Retro",
      "Pixel",
      "Video game",
      "Tech",
      "Nostalgia",
      "Display font",
      "Headline font",
      "Bold",
      "Playful",
      "Legible",
      "Monospaced",
      "Limited character set",
      "Digital",
      "Interface",
      "Game design",
      "Branding",
      "Logo",
      "Poster",
      "Packaging"
    ]
  }
}