{
  "filename": "bodonitown_36px.png",
  "status": "success",
  "description": {
    "detailed_description": "BodoniTown is a contemporary serif typeface that blends classic elegance with a touch of modern playfulness. Its construction is rooted in the geometric principles of Bodoni, evident in the sharp, contrasting strokes and the consistent, almost mechanical, letterforms. However, the font deviates from its namesake with subtle humanist details, such as slightly rounded terminals and a slightly less extreme contrast between thick and thin strokes. This subtle humanization softens the starkness of the geometric structure, making the font feel more approachable and less formal. The high x-height and open counters ensure strong legibility, even at smaller sizes, making it suitable for both print and digital applications. Its clean lines and balanced proportions lend themselves well to branding, editorial design, and web interfaces, while the subtle playfulness adds a touch of personality to otherwise straightforward designs. BodoniTown evokes a sense of modern sophistication, suggesting a balance between tradition and innovation, a quality that resonates with contemporary design sensibilities.",
    "technical_characteristics": [
      "Geometric construction",
      "High x-height",
      "Open counters",
      "Sharp, contrasting strokes",
      "Slightly rounded terminals",
      "Subtle humanist details",
      "Balanced proportions"
    ],
    "personality_traits": [
      "Classically elegant",
      "Modernly playful",
      "Approachable",
      "Sophisticated",
      "Clean",
      "Balanced",
      "Versatile"
    ],
    "practical_contexts": [
      "Branding",
      "Editorial design",
      "Web interfaces",
      "Print publications",
      "Digital signage"
    ],
    "cultural_intuition": [
      "Evokes a sense of modern sophistication",
      "Suggests a balance between tradition and innovation",
      "Resembles the clean lines of contemporary design",
      "Reflects a desire for both clarity and personality",
      "Connects to a cultural appreciation for both classic and modern aesthetics"
    ],
    "search_keywords": [
      "Bodoni",
      "serif",
      "geometric",
      "humanist",
      "high x-height",
      "open counters",
      "sharp strokes",
      "rounded terminals",
      "balanced proportions",
      "legible",
      "versatile",
      "modern",
      "sophisticated",
      "playful",
      "branding",
      "editorial",
      "web",
      "print",
      "digital"
    ]
  }
}