{
  "filename": "bold_handwriting_36px.png",
  "status": "success",
  "description": {
    "detailed_description": "Bold Handwriting (36px) is a playful script font that captures the energy of handwritten text. Its irregular letterforms, with their exaggerated strokes and rounded terminals, evoke a sense of spontaneity and informality. The font's generous x-height and open counters ensure good legibility, even at smaller sizes. While the overall construction is loose and organic, there's a deliberate balance in the proportions and relationships between letters, creating a sense of rhythm and flow. This balance, combined with the font's inherent friendliness, makes it suitable for a wide range of applications, from casual branding and social media graphics to children's books and playful packaging. The font's cultural associations lean towards a sense of youthful energy and creative expression, reminiscent of hand-drawn posters and personal notes. It evokes a sense of authenticity and connection, suggesting a human touch in a digital world.",
    "technical_characteristics": [
      "Irregular letterforms",
      "Exaggerated strokes",
      "Rounded terminals",
      "Generous x-height",
      "Open counters",
      "Loose and organic construction",
      "Balanced proportions"
    ],
    "personality_traits": [
      "Playful",
      "Spontaneous",
      "Informal",
      "Friendly",
      "Energetic",
      "Authentic",
      "Handwritten"
    ],
    "practical_contexts": [
      "Casual branding",
      "Social media graphics",
      "Children's books",
      "Playful packaging",
      "Hand-drawn posters"
    ],
    "cultural_intuition": [
      "Youthful energy",
      "Creative expression",
      "Authenticity",
      "Connection",
      "Human touch"
    ],
    "search_keywords": [
      "Script font",
      "Handwritten font",
      "Playful font",
      "Informal font",
      "Casual font",
      "Energetic font",
      "Bold font",
      "Rounded terminals",
      "Open counters",
      "Generous x-height",
      "Branding",
      "Social media",
      "Children's books",
      "Packaging",
      "Posters"
    ]
  }
}