{
  "filename": "bonte_divine_36px.png",
  "status": "success",
  "description": {
    "detailed_description": "Bonte Divine is a playful yet refined serif typeface that blends classic design principles with a touch of whimsy. Its construction is rooted in traditional serif anatomy, with clear strokes, well-defined serifs, and a balanced x-height. However, the font's personality is injected through subtle flourishes and decorative elements, particularly in the lowercase letters. The 'g' and 'j' feature elegant swashes, while the 's' and 'f' have delicate, almost calligraphic terminals. These details add a touch of elegance and sophistication, while maintaining a sense of approachability. The font's overall character is one of playful sophistication, making it suitable for a range of applications, from branding and editorial design to packaging and web design. Its legibility is strong, particularly at larger sizes, making it ideal for headlines and display typography. However, its decorative elements might be less effective in smaller sizes or for extended body text. Bonte Divine evokes a sense of vintage charm, reminiscent of early 20th-century typography, but with a modern twist. Its playful nature suggests a sense of fun and creativity, while its refined details lend an air of sophistication and elegance. This combination makes it a versatile choice for projects that require a touch of personality and charm.",
    "technical_characteristics": [
      "traditional serif anatomy",
      "balanced x-height",
      "clear strokes",
      "well-defined serifs",
      "decorative flourishes",
      "elegant swashes",
      "calligraphic terminals"
    ],
    "personality_traits": [
      "playful sophistication",
      "vintage charm",
      "refined elegance",
      "approachable",
      "creative",
      "sophisticated",
      "whimsical"
    ],
    "practical_contexts": [
      "headlines",
      "display typography",
      "branding",
      "editorial design",
      "packaging",
      "web design"
    ],
    "cultural_intuition": [
      "evokes early 20th-century typography",
      "suggests a sense of fun and creativity",
      "lends an air of sophistication and elegance"
    ],
    "search_keywords": [
      "serif",
      "playful",
      "refined",
      "decorative",
      "flourishes",
      "swashes",
      "calligraphic",
      "vintage",
      "elegant",
      "sophisticated",
      "approachable",
      "legible",
      "headlines",
      "display",
      "branding",
      "editorial",
      "packaging",
      "web",
      "modern",
      "classic",
      "traditional",
      "balanced",
      "x-height",
      "clear",
      "well-defined"
    ]
  }
}