{
  "filename": "boogaloo_36px.png",
  "status": "success",
  "description": {
    "detailed_description": "This font exhibits a bold, expressive character, drawing inspiration from both vintage graffiti and contemporary digital aesthetics. Its thick strokes and exaggerated letterforms create a sense of energy and immediacy, while the irregular outlines and subtle distortions add a touch of playful imperfection. The font's high x-height and open counters ensure strong legibility, even at smaller sizes, making it suitable for headlines, logos, and digital interfaces where visual impact is paramount. The font's rough edges and uneven spacing evoke a sense of urban grit and rebellious spirit, suggesting a connection to street art and underground culture. Its contemporary relevance lies in its ability to capture the raw energy and individuality of digital expression, making it a compelling choice for projects seeking a bold and unconventional aesthetic.",
    "technical_characteristics": [
      "thick strokes",
      "exaggerated letterforms",
      "irregular outlines",
      "distorted shapes",
      "high x-height",
      "open counters",
      "uneven spacing"
    ],
    "personality_traits": [
      "bold",
      "expressive",
      "energetic",
      "immediacy",
      "playful",
      "rebellious",
      "unconventional"
    ],
    "practical_contexts": [
      "headlines",
      "logos",
      "digital interfaces",
      "streetwear designs",
      "graphic novels"
    ],
    "cultural_intuition": [
      "urban grit",
      "underground culture",
      "digital expression",
      "rebellious spirit",
      "contemporary art"
    ],
    "search_keywords": [
      "graffiti font",
      "street art font",
      "bold font",
      "digital font",
      "expressive font",
      "high x-height",
      "open counters",
      "irregular outlines",
      "distorted shapes",
      "uneven spacing",
      "urban",
      "rebellious",
      "contemporary",
      "digital",
      "playful"
    ]
  }
}