{
  "filename": "bookworm_36px.png",
  "status": "success",
  "description": {
    "detailed_description": "Bookworm is a playful script font that balances a casual, handwritten aesthetic with a degree of legibility. Its flowing curves and rounded terminals create a sense of movement and informality, while the consistent stroke weight and well-defined letterforms ensure readability. The font's overall character is friendly and approachable, suggesting a sense of warmth and personality. It draws inspiration from traditional cursive writing styles, but with a contemporary twist that feels both nostalgic and modern. Bookworm is well-suited for branding projects, social media graphics, and editorial design, particularly where a touch of whimsy and personality is desired. Its casual nature makes it ideal for headlines, logos, and short-form text, while its legibility allows for longer passages in smaller sizes. The font's cultural resonance lies in its ability to evoke a sense of handwritten authenticity, reminiscent of personal notes and heartfelt messages. It captures the spirit of digital communication while retaining a sense of human connection.",
    "technical_characteristics": [
      "flowing curves",
      "rounded terminals",
      "consistent stroke weight",
      "well-defined letterforms",
      "open counters",
      "moderate x-height",
      "consistent baseline"
    ],
    "personality_traits": [
      "playful",
      "approachable",
      "friendly",
      "casual",
      "whimsical",
      "handwritten",
      "nostalgic",
      "modern"
    ],
    "practical_contexts": [
      "branding projects",
      "social media graphics",
      "editorial design",
      "headlines",
      "logos",
      "short-form text"
    ],
    "cultural_intuition": [
      "handwritten authenticity",
      "personal notes",
      "heartfelt messages",
      "digital communication",
      "human connection"
    ],
    "search_keywords": [
      "script font",
      "handwritten",
      "playful",
      "casual",
      "friendly",
      "approachable",
      "legible",
      "branding",
      "social media",
      "editorial",
      "headlines",
      "logos",
      "nostalgic",
      "modern",
      "cursive",
      "flowing",
      "rounded",
      "consistent",
      "open counters",
      "moderate x-height",
      "baseline"
    ]
  }
}