{
  "filename": "boron_36px.png",
  "status": "success",
  "description": {
    "detailed_description": "Boron is a geometric sans-serif typeface with a distinct, almost pixelated aesthetic. Its construction is based on a grid system, resulting in sharp, angular letterforms with consistent proportions. The terminals are often truncated, creating a sense of abruptness and a slightly unfinished feel. This deliberate imperfection adds a touch of grit and a sense of digital authenticity. The font's overall character is bold and assertive, with a strong presence that evokes a sense of futuristic technology. It draws inspiration from early computer graphics and the visual language of cyberpunk, with its sharp edges and bold forms suggesting a world of advanced technology and digital landscapes. Boron's practical applications lie in digital interfaces, branding for tech companies, and graphic design projects that require a strong, futuristic aesthetic. Its bold weight and clear legibility make it suitable for headlines, titles, and short text blocks, while its unique character adds a distinctive visual element to any design. The font's cultural resonance lies in its connection to the cyberpunk genre, with its sharp angles and bold forms evoking a sense of dystopian urban environments and advanced technology. It also taps into the contemporary fascination with retrofuturism, referencing the aesthetics of early computer graphics and the visual language of the digital age.",
    "technical_characteristics": [
      "Geometric construction",
      "Sharp, angular letterforms",
      "Truncated terminals",
      "Consistent proportions",
      "Bold weight"
    ],
    "personality_traits": [
      "Bold and assertive",
      "Futuristic and technological",
      "Gritty and raw",
      "Digital and authentic",
      "Distinctive and memorable"
    ],
    "practical_contexts": [
      "Digital interfaces",
      "Tech company branding",
      "Headlines and titles",
      "Short text blocks",
      "Graphic design projects with a futuristic aesthetic"
    ],
    "cultural_intuition": [
      "Cyberpunk aesthetic",
      "Retrofuturism",
      "Digital age",
      "Early computer graphics",
      "Dystopian urban environments"
    ],
    "search_keywords": [
      "Geometric sans-serif",
      "Bold",
      "Futuristic",
      "Digital",
      "Tech",
      "Cyberpunk",
      "Retrofuturism",
      "Pixelated",
      "Sharp",
      "Angular",
      "Truncated terminals",
      "Consistent proportions",
      "Interface",
      "Branding",
      "Headlines",
      "Titles",
      "Graphic design",
      "Distinctive",
      "Memorable",
      "Early computer graphics",
      "Dystopian",
      "Urban",
      "Technology"
    ]
  }
}