{
  "filename": "bosk_36px.png",
  "status": "success",
  "description": {
    "detailed_description": "Bosk is a playful script font that captures the energy of handwritten lettering. Its flowing curves and organic shapes create a sense of movement and informality, while the bold weight and consistent stroke width ensure legibility. The font's generous x-height and open counters contribute to its readability, even at smaller sizes. The slightly rounded terminals and subtle variations in letterforms add a touch of personality and warmth, making it feel approachable and friendly. Bosk's casual charm makes it ideal for branding projects that require a touch of whimsy, such as children's products, social media graphics, or handwritten notes. Its versatility extends to digital applications, where it can be used for headlines, logos, or even body text in smaller sizes. The font's playful nature evokes a sense of joy and spontaneity, reminiscent of handwritten notes and personal expressions. It suggests a connection to creativity and individuality, making it a fitting choice for projects that aim to convey a sense of authenticity and warmth.",
    "technical_characteristics": [
      "Organic shapes",
      "Flowing curves",
      "Bold weight",
      "Consistent stroke width",
      "Generous x-height",
      "Open counters",
      "Rounded terminals",
      "Variations in letterforms"
    ],
    "personality_traits": [
      "Playful",
      "Informal",
      "Approachable",
      "Friendly",
      "Whimsical",
      "Casual",
      "Warm",
      "Authentic"
    ],
    "practical_contexts": [
      "Children's products",
      "Social media graphics",
      "Handwritten notes",
      "Branding projects",
      "Headlines",
      "Logos",
      "Body text (smaller sizes)"
    ],
    "cultural_intuition": [
      "Handwritten notes",
      "Personal expressions",
      "Creativity",
      "Individuality",
      "Authenticity",
      "Warmth"
    ],
    "search_keywords": [
      "Script font",
      "Handwritten",
      "Playful",
      "Casual",
      "Bold",
      "Organic",
      "Flowing",
      "Whimsical",
      "Friendly",
      "Approachable",
      "Branding",
      "Social media",
      "Children's products",
      "Headlines",
      "Logos",
      "Body text",
      "Digital",
      "Graphic design",
      "Typography",
      "Font"
    ]
  }
}