{
  "filename": "bottenbreker_t.v._36px.png",
  "status": "success",
  "description": {
    "detailed_description": "Bottenbreker TV is a display typeface that embodies a playful, almost rebellious spirit. Its bold, hand-drawn aesthetic is achieved through exaggerated strokes, uneven letterforms, and a dynamic baseline. The font's construction is decidedly organic, with each letter seemingly drawn with a single, confident stroke. This creates a sense of immediacy and energy, reminiscent of hand-painted signage or graffiti. The exaggerated ascenders and descenders, along with the generous x-height, contribute to its bold presence and ensure legibility even at large sizes. While the overall impression is playful, the font's confident execution and consistent weight suggest a level of professionalism, making it suitable for a range of applications. Bottenbreker TV evokes a sense of youthful rebellion and creative expression, aligning with contemporary trends in graphic design that embrace hand-drawn aesthetics and a sense of authenticity. Its bold character and playful energy make it ideal for headlines, branding elements, and projects that require a strong visual impact.",
    "technical_characteristics": [
      "Hand-drawn aesthetic",
      "Exaggerated strokes",
      "Uneven letterforms",
      "Dynamic baseline",
      "Organic construction",
      "Bold weight",
      "Generous x-height",
      "Exaggerated ascenders and descenders"
    ],
    "personality_traits": [
      "Playful",
      "Rebellious",
      "Energetic",
      "Bold",
      "Confident",
      "Hand-drawn",
      "Organic",
      "Immediacy",
      "Authentic"
    ],
    "practical_contexts": [
      "Headlines",
      "Branding elements",
      "Posters",
      "Social media graphics",
      "Digital signage"
    ],
    "cultural_intuition": [
      "Street art and graffiti",
      "Hand-painted signage",
      "Youthful rebellion",
      "Creative expression",
      "Contemporary graphic design trends"
    ],
    "search_keywords": [
      "Display typeface",
      "Hand-drawn",
      "Bold",
      "Playful",
      "Rebellious",
      "Energetic",
      "Organic",
      "Immediacy",
      "Authentic",
      "Headlines",
      "Branding",
      "Posters",
      "Social media",
      "Digital signage",
      "Street art",
      "Graffiti",
      "Youthful",
      "Creative",
      "Contemporary"
    ]
  }
}