{
  "filename": "botterill_signature_36px.png",
  "status": "success",
  "description": {
    "detailed_description": "Butterwill Signature is a calligraphic script font that captures the elegance and fluidity of traditional penmanship. Its flowing strokes and graceful curves are reminiscent of handwritten letters, creating a sense of warmth and personality. The font's construction is based on a combination of organic and geometric principles, resulting in a balanced and harmonious aesthetic. The ascenders and descenders are well-proportioned, ensuring legibility even at smaller sizes. The font's distinctive features include its delicate hairline strokes, subtle variations in letterforms, and the use of ligatures to enhance its natural flow. The overall effect is one of sophistication and charm, making it suitable for a wide range of applications, from wedding invitations and branding to website headers and social media graphics. The font's cultural associations evoke a sense of classic elegance and timeless beauty, reminiscent of vintage stationery and handwritten correspondence. Its contemporary relevance lies in its ability to add a touch of personality and authenticity to digital designs, while still maintaining a sense of professionalism and sophistication.",
    "technical_characteristics": [
      "Calligraphic construction",
      "Flowing strokes",
      "Graceful curves",
      "Delicate hairline strokes",
      "Subtle variations in letterforms",
      "Ligatures",
      "Well-proportioned ascenders and descenders"
    ],
    "personality_traits": [
      "Elegant",
      "Fluid",
      "Warm",
      "Sophisticated",
      "Charming",
      "Timeless",
      "Authentic"
    ],
    "practical_contexts": [
      "Wedding invitations",
      "Branding",
      "Website headers",
      "Social media graphics",
      "Handwritten-style typography"
    ],
    "cultural_intuition": [
      "Vintage stationery",
      "Handwritten correspondence",
      "Classic elegance",
      "Timeless beauty",
      "Personal touch"
    ],
    "search_keywords": [
      "Calligraphic",
      "Script",
      "Handwritten",
      "Elegant",
      "Fluid",
      "Graceful",
      "Sophisticated",
      "Charming",
      "Vintage",
      "Timeless",
      "Wedding",
      "Branding",
      "Website",
      "Social media",
      "Typography",
      "Font",
      "Butterwill Signature"
    ]
  }
}