{
  "filename": "bou_western_36px.png",
  "status": "success",
  "description": {
    "detailed_description": "Bou Western is a display typeface that embodies a classic Western aesthetic with a contemporary twist. Its construction is rooted in geometric principles, evident in the consistent stroke widths and sharp terminals. The letterforms are bold and confident, with a strong x-height that ensures legibility even at large sizes. The overall design is clean and uncluttered, with a slight humanist touch in the rounded terminals and subtle curves in some letters, like the 'S' and 'C'. This balance between geometric precision and organic detail creates a font that is both visually striking and approachable. The font's bold weight and strong presence make it ideal for headlines, logos, and branding elements, particularly in contexts that evoke a sense of adventure, ruggedness, or Americana. Its clean lines and contemporary feel also make it suitable for digital applications, such as website headers or mobile app interfaces. Bou Western's bold character and historical references evoke a sense of nostalgia for the American West, while its contemporary design ensures its relevance in modern visual culture.",
    "technical_characteristics": [
      "Geometric construction",
      "Consistent stroke widths",
      "Sharp terminals",
      "Strong x-height",
      "Open counters",
      "Bold weight",
      "Slight humanist details"
    ],
    "personality_traits": [
      "Bold and confident",
      "Clean and uncluttered",
      "Visually striking",
      "Approachable",
      "Rugged",
      "Nostalgic",
      "Contemporary"
    ],
    "practical_contexts": [
      "Headlines",
      "Logos",
      "Branding elements",
      "Website headers",
      "Mobile app interfaces"
    ],
    "cultural_intuition": [
      "American West",
      "Adventure",
      "Ruggedness",
      "Americana",
      "Nostalgia",
      "Modern visual culture"
    ],
    "search_keywords": [
      "display typeface",
      "western font",
      "geometric construction",
      "bold weight",
      "strong x-height",
      "sharp terminals",
      "open counters",
      "humanist details",
      "headlines",
      "logos",
      "branding",
      "website headers",
      "mobile app interfaces",
      "americana",
      "nostalgia",
      "contemporary design",
      "rugged",
      "adventure"
    ]
  }
}