{
  "filename": "boxpot_36px.png",
  "status": "success",
  "description": {
    "detailed_description": "Boxpot is a display typeface that embodies a playful, almost chaotic energy. Its construction is based on a combination of geometric and organic forms, resulting in a unique visual language. The letters are heavily distorted, with sharp angles and jagged edges, creating a sense of movement and dynamism. This distortion is further emphasized by the uneven spacing and inconsistent letterforms, adding to the overall sense of irregularity. Despite its unconventional appearance, Boxpot maintains a degree of legibility, thanks to its bold weight and clear stroke contrast. The font's personality is bold and attention-grabbing, with a distinct grunge aesthetic that evokes a sense of rebellion and unconventionality. It draws inspiration from street art and graffiti, reflecting a contemporary urban culture. Boxpot is best suited for headlines, logos, and short bursts of text, where its bold character can make a strong visual impact. Its unconventional nature makes it ideal for projects that require a unique and edgy aesthetic, particularly in the realm of street culture, music, and youth-oriented brands.",
    "technical_characteristics": [
      "distorted letterforms",
      "jagged edges",
      "uneven spacing",
      "bold weight",
      "high contrast"
    ],
    "personality_traits": [
      "bold",
      "playful",
      "chaotic",
      "rebellious",
      "unconventional"
    ],
    "practical_contexts": [
      "headlines",
      "logos",
      "short bursts of text",
      "street art",
      "music"
    ],
    "cultural_intuition": [
      "urban culture",
      "street art",
      "graffiti",
      "youth culture",
      "rebellion"
    ],
    "search_keywords": [
      "display typeface",
      "distorted",
      "jagged",
      "uneven spacing",
      "bold",
      "grunge",
      "street art",
      "graffiti",
      "rebellious",
      "unconventional",
      "headlines",
      "logos",
      "short text",
      "urban",
      "youth",
      "music"
    ]
  }
}