{
  "filename": "bpshc_36px.png",
  "status": "success",
  "description": {
    "detailed_description": "BPSMC is a display typeface that embodies a playful yet slightly menacing aesthetic. Its exaggerated letterforms, characterized by dripping, jagged edges, and sharp angles, create a sense of both whimsy and unease. The font's construction is largely freehand, with inconsistent stroke weights and a dynamic, almost chaotic flow. This lack of strict geometric precision contributes to its hand-drawn, almost graffiti-like character. Despite its unconventional nature, BPSMC maintains a surprising level of legibility, particularly in larger sizes. The open counters and distinct letter shapes ensure readability, even with the exaggerated features. This makes it suitable for eye-catching headlines, posters, and branding elements where a bold, attention-grabbing presence is desired. However, its unconventional nature might limit its use in extended text blocks or smaller sizes. The font's cultural associations lean towards contemporary subcultures, evoking a sense of rebellion, youthfulness, and a touch of darkness. It resonates with the aesthetics of street art, graphic design, and digital culture, particularly in contexts where a sense of playfulness and a hint of danger are desired.",
    "technical_characteristics": [
      "Exaggerated letterforms",
      "Dripping, jagged edges",
      "Sharp angles",
      "Inconsistent stroke weights",
      "Dynamic, almost chaotic flow",
      "Open counters",
      "Distinct letter shapes"
    ],
    "personality_traits": [
      "Playful",
      "Menacing",
      "Whimsical",
      "Unconventional",
      "Bold",
      "Attention-grabbing",
      "Rebellious",
      "Youthful"
    ],
    "practical_contexts": [
      "Headlines",
      "Posters",
      "Branding elements",
      "Digital graphics",
      "Street art"
    ],
    "cultural_intuition": [
      "Contemporary subcultures",
      "Street art",
      "Graphic design",
      "Digital culture",
      "Rebellion",
      "Youthfulness",
      "Darkness"
    ],
    "search_keywords": [
      "Display typeface",
      "Hand-drawn",
      "Graffiti",
      "Exaggerated",
      "Dripping",
      "Jagged",
      "Sharp",
      "Open counters",
      "Distinct",
      "Bold",
      "Attention-grabbing",
      "Playful",
      "Menacing",
      "Whimsical",
      "Unconventional",
      "Rebellious",
      "Youthful",
      "Dark",
      "Street art",
      "Graphic design",
      "Digital culture",
      "Headlines",
      "Posters",
      "Branding",
      "Digital graphics"
    ]
  }
}