{
  "filename": "bradley_gratis_36px.png",
  "status": "success",
  "description": {
    "detailed_description": "Bradley Gratis is a bold, blackletter font that draws inspiration from traditional Gothic scripts while incorporating modern design sensibilities. Its construction is based on a strong, geometric framework, evident in the consistent width of the strokes and the sharp angles of the letterforms. The font features a high x-height and open counters, contributing to its excellent legibility even at smaller sizes. The distinctive features include the dramatic ascenders and descenders, the pointed terminals, and the subtle variations in stroke weight that add visual interest. The overall character of the font is confident and authoritative, with a touch of playful energy. It evokes a sense of history and tradition, but with a contemporary edge that makes it feel relevant for modern design projects. The font's bold presence and strong legibility make it suitable for headlines, branding elements, and display typography. It can also be used effectively for smaller text sizes, particularly in digital applications where its sharp angles and clear forms translate well to screen displays. The font's cultural associations range from medieval manuscripts and gothic architecture to contemporary street art and graphic design. It evokes a sense of mystery and intrigue, while also suggesting a sense of rebellion and individuality.",
    "technical_characteristics": [
      "Geometric construction",
      "High x-height",
      "Open counters",
      "Sharp terminals",
      "Consistent stroke width",
      "Dramatic ascenders and descenders",
      "Subtle variations in stroke weight"
    ],
    "personality_traits": [
      "Confident",
      "Authoritative",
      "Playful",
      "Bold",
      "Energetic",
      "Traditional",
      "Modern",
      "Intriguing",
      "Rebellious",
      "Individualistic"
    ],
    "practical_contexts": [
      "Headlines",
      "Branding elements",
      "Display typography",
      "Digital interfaces",
      "Small text sizes"
    ],
    "cultural_intuition": [
      "Medieval manuscripts",
      "Gothic architecture",
      "Street art",
      "Graphic design",
      "Mystery",
      "Intrigue",
      "Rebellion",
      "Individuality"
    ],
    "search_keywords": [
      "Blackletter",
      "Gothic",
      "Bold",
      "Geometric",
      "High x-height",
      "Open counters",
      "Sharp terminals",
      "Legible",
      "Display",
      "Headline",
      "Branding",
      "Digital",
      "Street art",
      "Modern",
      "Traditional",
      "Authoritative",
      "Playful",
      "Intriguing",
      "Rebellious",
      "Individualistic"
    ]
  }
}