{
  "filename": "bread_36px.png",
  "status": "success",
  "description": {
    "detailed_description": "This font is a bold statement of angularity and ruggedness, built on a foundation of geometric construction with a distinct, almost pixelated, aesthetic. The letterforms are characterized by sharp corners, abrupt transitions, and a consistent, almost mechanical, thickness throughout. This creates a sense of solidity and strength, reminiscent of early digital graphics or even the blocky forms of retro video games. The font's personality is assertive and unapologetically bold, conveying a sense of power and defiance. It's a font that demands attention, making it ideal for headlines, branding, and other applications where a strong visual impact is desired. However, its lack of fine detail and limited character set might limit its use in extended text or more delicate designs. Despite its digital origins, the font's raw, almost primitive aesthetic evokes a sense of rebellion and counter-culture, suggesting a connection to underground art movements or the DIY spirit of punk rock.",
    "technical_characteristics": [
      "Geometric construction",
      "Sharp corners and angles",
      "Consistent stroke weight",
      "Pixelated or blocky appearance",
      "Limited character set",
      "Bold weight"
    ],
    "personality_traits": [
      "Assertive",
      "Unapologetically bold",
      "Powerful",
      "Defiant",
      "Raw",
      "Primitive",
      "Rebellious",
      "Counter-culture",
      "DIY"
    ],
    "practical_contexts": [
      "Headlines",
      "Branding",
      "Posters",
      "Logos",
      "Short text displays",
      "Digital interfaces"
    ],
    "cultural_intuition": [
      "Early digital graphics",
      "Retro video games",
      "Underground art movements",
      "Punk rock",
      "Counter-culture",
      "DIY aesthetic"
    ],
    "search_keywords": [
      "Geometric",
      "Angular",
      "Bold",
      "Pixelated",
      "Blocky",
      "Retro",
      "Digital",
      "Punk",
      "Counter-culture",
      "DIY",
      "Headlines",
      "Branding",
      "Logos",
      "Posters",
      "Strong",
      "Assertive",
      "Defiant",
      "Raw",
      "Primitive",
      "Rebellious",
      "Limited character set",
      "Heavy",
      "Thick",
      "Sharp",
      "Abrupt",
      "Consistent",
      "Mechanical",
      "Solid",
      "Powerful",
      "Unapologetic"
    ]
  }
}