{
  "filename": "brewsky_36px.png",
  "status": "success",
  "description": {
    "detailed_description": "Brewsky is a display typeface that embraces a playful, almost cartoonish aesthetic. Its defining characteristic is the double-outline construction, which gives it a bold, almost three-dimensional appearance. The letterforms are rounded and slightly exaggerated, with a distinct lack of serifs, contributing to its friendly and approachable feel. The overall design evokes a sense of fun and whimsy, reminiscent of vintage cartoon graphics or playful signage. While the double outline adds visual weight, the rounded forms and generous spacing maintain a sense of lightness and readability. Brewsky's playful nature makes it ideal for headlines, logos, and branding projects that require a touch of personality and visual impact. It's particularly well-suited for children's products, entertainment, and projects that aim to capture a sense of lightheartedness and joy.",
    "technical_characteristics": [
      "Double-outline construction",
      "Rounded letterforms",
      "Lack of serifs",
      "Generous spacing",
      "Exaggerated proportions"
    ],
    "personality_traits": [
      "Playful",
      "Whimsical",
      "Friendly",
      "Approachable",
      "Bold",
      "Lighthearted",
      "Fun"
    ],
    "practical_contexts": [
      "Headlines",
      "Logos",
      "Branding",
      "Children's products",
      "Entertainment"
    ],
    "cultural_intuition": [
      "Vintage cartoon graphics",
      "Playful signage",
      "Retro aesthetic",
      "Nostalgic charm",
      "Modern take on classic design"
    ],
    "search_keywords": [
      "Display typeface",
      "Double outline",
      "Rounded letters",
      "Sans serif",
      "Playful",
      "Whimsical",
      "Bold",
      "Friendly",
      "Headlines",
      "Logos",
      "Branding",
      "Children's",
      "Entertainment",
      "Retro",
      "Nostalgic",
      "Cartoon",
      "Signage"
    ]
  }
}