{
  "filename": "broken_life_36px.png",
  "status": "success",
  "description": {
    "detailed_description": "This font, with its playful, almost childlike forms, embodies a sense of whimsy and unconventionality. The letterforms are characterized by their rounded shapes, often with exaggerated curves and irregular outlines. This irregularity, while adding to the font's charm, also presents challenges in terms of legibility, particularly at smaller sizes. The font's overall construction is organic and free-flowing, with a distinct lack of geometric precision. This lack of structure contributes to its informal and friendly personality, making it suitable for projects that require a lighthearted and approachable tone. The font's bold strokes and generous letter spacing ensure readability in larger sizes, making it ideal for headlines, logos, and playful branding elements. However, its unconventional nature might not be suitable for extended body text or formal applications. The font's cultural resonance lies in its connection to hand-drawn lettering and the DIY aesthetic, evoking a sense of creativity and individuality. It suggests a playful and approachable personality, reminiscent of children's drawings and homemade signs, adding a touch of warmth and authenticity to any project.",
    "technical_characteristics": [
      "Rounded letterforms",
      "Irregular outlines",
      "Organic construction",
      "Bold strokes",
      "Generous letter spacing"
    ],
    "personality_traits": [
      "Playful",
      "Whimsical",
      "Unconventional",
      "Informal",
      "Friendly"
    ],
    "practical_contexts": [
      "Headlines",
      "Logos",
      "Branding elements",
      "Playful designs",
      "Large-scale applications"
    ],
    "cultural_intuition": [
      "Hand-drawn lettering",
      "DIY aesthetic",
      "Children's drawings",
      "Homemade signs",
      "Creative expression"
    ],
    "search_keywords": [
      "Rounded",
      "Playful",
      "Informal",
      "Hand-drawn",
      "Whimsical",
      "Unconventional",
      "Bold",
      "Organic",
      "Childlike",
      "DIY",
      "Headline",
      "Logo",
      "Branding",
      "Large-scale",
      "Creative",
      "Authentic",
      "Approachable",
      "Friendly",
      "Irregular",
      "Generous spacing"
    ]
  }
}