{
  "filename": "broken_chalk_36px.png",
  "status": "success",
  "description": {
    "detailed_description": "This font embodies a playful, hand-drawn aesthetic, achieved through its distinctive construction and unique character set. Each letterform is built with a series of parallel lines, creating a textured, almost scribbled effect. This technique, reminiscent of pencil sketching, imbues the font with a sense of immediacy and informality. The overall proportions are slightly condensed, adding to the casual feel. The inclusion of smiley faces and a hockey stick as glyphs further reinforces the lighthearted and whimsical nature of the design. While the font's technical execution is straightforward, its charm lies in its deliberate imperfections, reflecting the spontaneity of hand-drawn lettering. This makes it ideal for projects that require a friendly and approachable tone, such as children's books, social media graphics, or informal branding. The font's cultural resonance lies in its connection to the DIY aesthetic, evoking a sense of personal expression and creative freedom. It taps into the contemporary trend of embracing imperfection and authenticity, making it a fitting choice for projects that celebrate individuality and a sense of fun.",
    "technical_characteristics": [
      "Hand-drawn aesthetic",
      "Parallel line construction",
      "Textured appearance",
      "Slightly condensed proportions",
      "Informal letterforms",
      "Unique glyph set (smiley faces, hockey stick)",
      "Deliberate imperfections"
    ],
    "personality_traits": [
      "Playful",
      "Whimsical",
      "Friendly",
      "Approachable",
      "Informal",
      "Spontaneous",
      "Authentic"
    ],
    "practical_contexts": [
      "Children's books",
      "Social media graphics",
      "Informal branding",
      "Hand-lettered designs",
      "Casual typography"
    ],
    "cultural_intuition": [
      "DIY aesthetic",
      "Personal expression",
      "Creative freedom",
      "Embrace of imperfection",
      "Authenticity"
    ],
    "search_keywords": [
      "Hand-drawn",
      "Sketchy",
      "Informal",
      "Playful",
      "Whimsical",
      "Friendly",
      "Casual",
      "Textured",
      "Parallel lines",
      "Unique glyphs",
      "Smiley faces",
      "Hockey stick",
      "DIY",
      "Authentic",
      "Children's book",
      "Social media",
      "Branding",
      "Hand-lettering"
    ]
  }
}