{
  "filename": "broken_15_36px.png",
  "status": "success",
  "description": {
    "detailed_description": "Font Broken 15 (36px) by Misprinted Type is a bold, playful display typeface that draws inspiration from the imperfections of vintage printing. Its chunky, irregular letterforms are reminiscent of misaligned type, with uneven spacing and slightly distorted characters. The font's bold weight and high x-height ensure strong legibility, even at large sizes, while the jagged edges and uneven strokes add a sense of energy and unpredictability. This combination of technical precision and intentional imperfection creates a unique visual identity that is both eye-catching and approachable. The font's playful nature makes it ideal for headlines, logos, and other graphic elements that require a strong visual impact. Its vintage aesthetic evokes a sense of nostalgia and authenticity, while its bold and confident character suggests a sense of fun and irreverence. The font's versatility allows it to be used in a variety of contexts, from retro-inspired designs to modern, edgy projects.",
    "technical_characteristics": [
      "Bold weight",
      "High x-height",
      "Irregular letterforms",
      "Uneven spacing",
      "Distorted characters",
      "Jagged edges",
      "Uneven strokes"
    ],
    "personality_traits": [
      "Bold",
      "Playful",
      "Energetic",
      "Unpredictable",
      "Nostalgic",
      "Authentic",
      "Fun",
      "Irreverent"
    ],
    "practical_contexts": [
      "Headlines",
      "Logos",
      "Graphic elements",
      "Posters",
      "T-shirt designs",
      "Social media graphics"
    ],
    "cultural_intuition": [
      "Vintage printing",
      "Retro aesthetic",
      "Nostalgia",
      "Authenticity",
      "Modern edge",
      "Street art",
      "Urban culture"
    ],
    "search_keywords": [
      "Broken 15",
      "Misprinted Type",
      "Display typeface",
      "Bold",
      "Playful",
      "Vintage",
      "Retro",
      "Nostalgic",
      "Irregular",
      "Distorted",
      "Jagged",
      "Uneven",
      "Headlines",
      "Logos",
      "Graphic elements",
      "Posters",
      "T-shirt designs",
      "Social media graphics",
      "Street art",
      "Urban culture"
    ]
  }
}