{
  "filename": "bruised_36px.png",
  "status": "success",
  "description": {
    "detailed_description": "This font, with its stark, angular forms and jagged edges, embodies a raw, unrefined aesthetic. The letterforms are constructed with a series of sharp, intersecting lines, creating a sense of immediacy and urgency. The lack of traditional curves and rounded terminals adds to the font's edgy character, while the uneven spacing between letters contributes to a sense of chaos and unpredictability. This raw, unpolished aesthetic evokes a sense of rebellion and nonconformity, suggesting a connection to underground culture and street art. The font's bold, assertive presence makes it suitable for headlines, posters, and other graphic elements where a strong visual impact is desired. However, its lack of legibility at smaller sizes limits its use in body text or extended reading. The font's raw energy and rebellious spirit make it a powerful tool for conveying a sense of defiance and individuality.",
    "technical_characteristics": [
      "angular letterforms",
      "jagged edges",
      "sharp, intersecting lines",
      "uneven spacing",
      "lack of traditional curves",
      "minimal stroke variation"
    ],
    "personality_traits": [
      "raw",
      "unrefined",
      "edgy",
      "rebellious",
      "nonconformist",
      "bold",
      "assertive",
      "unpredictable"
    ],
    "practical_contexts": [
      "headlines",
      "posters",
      "graphic elements",
      "short bursts of text",
      "large-scale displays"
    ],
    "cultural_intuition": [
      "underground culture",
      "street art",
      "punk rock",
      "graffiti",
      "rebellion"
    ],
    "search_keywords": [
      "angular",
      "jagged",
      "sharp",
      "intersecting lines",
      "uneven spacing",
      "raw",
      "unrefined",
      "edgy",
      "rebellious",
      "nonconformist",
      "bold",
      "assertive",
      "unpredictable",
      "underground",
      "street art",
      "punk",
      "graffiti",
      "headlines",
      "posters",
      "graphic elements",
      "large-scale displays"
    ]
  }
}