{
  "filename": "bruss_36px.png",
  "status": "success",
  "description": {
    "detailed_description": "Brusss is a playful script font that captures the energy of hand-drawn lettering. Its organic curves and expressive strokes evoke a sense of spontaneity and personality. The font's construction is based on a combination of calligraphic principles and brush-stroke techniques, resulting in a dynamic and visually engaging typeface. The varying weights and angles of the strokes create a sense of rhythm and movement, while the generous x-height and open counters ensure good legibility even at smaller sizes. Brusss is ideal for adding a touch of personality to branding, packaging, and digital interfaces. Its casual yet confident character makes it suitable for a wide range of applications, from playful headlines to informal body text. The font's cultural associations range from vintage comic book lettering to contemporary street art, reflecting its ability to bridge the gap between traditional and modern aesthetics.",
    "technical_characteristics": [
      "Organic curves",
      "Expressive strokes",
      "Varying weights",
      "Generous x-height",
      "Open counters",
      "Brush-stroke techniques",
      "Calligraphic principles"
    ],
    "personality_traits": [
      "Playful",
      "Spontaneous",
      "Expressive",
      "Dynamic",
      "Casual",
      "Confident",
      "Visually engaging"
    ],
    "practical_contexts": [
      "Branding",
      "Packaging",
      "Digital interfaces",
      "Headlines",
      "Body text",
      "Informal communication"
    ],
    "cultural_intuition": [
      "Vintage comic book lettering",
      "Contemporary street art",
      "Hand-drawn aesthetic",
      "Informal communication",
      "Playful personality"
    ],
    "search_keywords": [
      "Script font",
      "Brush font",
      "Hand-drawn",
      "Playful",
      "Expressive",
      "Organic",
      "Casual",
      "Confident",
      "Branding",
      "Packaging",
      "Digital",
      "Headlines",
      "Body text",
      "Comic book",
      "Street art",
      "Vintage",
      "Modern",
      "Informal",
      "Legible",
      "Dynamic",
      "Energetic"
    ]
  }
}