{
  "filename": "bub_36px.png",
  "status": "success",
  "description": {
    "detailed_description": "Bub PX is a playful display typeface that embodies the spirit of 1960s pop culture. Its rounded, bulbous forms are reminiscent of cartoon characters and psychedelic graphics, creating a sense of lighthearted fun and retro charm. The font's construction is based on simple geometric shapes, with each letterform built from circles, ovals, and arcs. This approach results in a bold, graphic aesthetic that is both eye-catching and easily legible, even at large sizes. The generous curves and open counters contribute to a friendly and approachable feel, while the consistent weight and lack of serifs lend a sense of modernity. Bub PX is ideal for headlines, logos, and playful branding projects that seek to evoke a sense of nostalgia and optimism. Its bold, graphic nature makes it particularly well-suited for digital applications, where it can add a touch of personality to websites, social media graphics, and mobile interfaces. The font's playful character and retro aesthetic make it a perfect choice for projects that aim to capture the spirit of a bygone era, while its versatility allows it to be used in a variety of contemporary contexts.",
    "technical_characteristics": [
      "Geometric construction",
      "Rounded letterforms",
      "Bulbous shapes",
      "Open counters",
      "Consistent weight",
      "Lack of serifs",
      "Bold stroke",
      "High x-height"
    ],
    "personality_traits": [
      "Playful",
      "Fun",
      "Retro",
      "Bold",
      "Graphic",
      "Friendly",
      "Approachable",
      "Modern",
      "Optimistic"
    ],
    "practical_contexts": [
      "Headlines",
      "Logos",
      "Branding",
      "Digital interfaces",
      "Social media graphics",
      "Mobile apps",
      "Posters",
      "Packaging"
    ],
    "cultural_intuition": [
      "1960s pop culture",
      "Psychedelic art",
      "Cartoon characters",
      "Nostalgia",
      "Optimism",
      "Modern design",
      "Digital culture"
    ],
    "search_keywords": [
      "Bub PX",
      "Display typeface",
      "Rounded",
      "Bulbous",
      "Geometric",
      "Bold",
      "Graphic",
      "Playful",
      "Fun",
      "Retro",
      "Nostalgia",
      "Optimism",
      "Modern",
      "Digital",
      "Headlines",
      "Logos",
      "Branding",
      "Social media",
      "Mobile",
      "Posters",
      "Packaging"
    ]
  }
}