{
  "filename": "bubblefont_36px.png",
  "status": "success",
  "description": {
    "detailed_description": "Bubblefont is a playful and whimsical display typeface characterized by its rounded forms and distinctive, almost cartoonish, outline. Each letter is constructed with a series of small, rounded bumps that create a visually engaging texture. The font's generous x-height and open counters ensure good legibility, even at larger sizes. The overall effect is one of lightheartedness and fun, making it ideal for projects that require a touch of whimsy. While the font's design is reminiscent of early digital graphics and 1980s cartoon aesthetics, its bold and playful nature makes it feel surprisingly contemporary. Bubblefont is best suited for headlines, logos, and other display applications where its unique character can shine. Its playful nature makes it a good choice for children's books, branding for playful products, or even adding a touch of whimsy to digital interfaces.",
    "technical_characteristics": [
      "Rounded letterforms",
      "Distinctive outline with small bumps",
      "Generous x-height",
      "Open counters",
      "Bold weight"
    ],
    "personality_traits": [
      "Playful",
      "Whimsical",
      "Lighthearted",
      "Fun",
      "Bold"
    ],
    "practical_contexts": [
      "Headlines",
      "Logos",
      "Display applications",
      "Children's books",
      "Playful branding"
    ],
    "cultural_intuition": [
      "Reminiscent of early digital graphics",
      "Evokes 1980s cartoon aesthetics",
      "Feels surprisingly contemporary",
      "Suggests a playful and fun personality",
      "Appeals to a wide range of audiences"
    ],
    "search_keywords": [
      "Bubblefont",
      "Display typeface",
      "Rounded letters",
      "Whimsical",
      "Playful",
      "Cartoonish",
      "Bold",
      "Fun",
      "Headlines",
      "Logos",
      "Children's books",
      "Branding",
      "Digital graphics",
      "1980s aesthetics",
      "Contemporary",
      "Unique",
      "Distinctive",
      "Outline",
      "Bumps",
      "Generous x-height",
      "Open counters",
      "Legibility",
      "Lighthearted",
      "Whimsy"
    ]
  }
}