{
  "filename": "bubble_comics_36px.png",
  "status": "success",
  "description": {
    "detailed_description": "Bubble Comics PX is a display typeface that embodies the playful energy of classic comic book lettering. Its bold, rounded forms and exaggerated 3D extrusion create a sense of dynamic movement and visual impact. The font's construction is based on a simple geometric structure, with rounded corners and smooth curves that give it a friendly and approachable feel. The exaggerated letterforms and generous spacing contribute to its strong legibility, even at large sizes. The 3D effect adds depth and dimension, enhancing its visual appeal and creating a sense of playful energy. This font is ideal for headlines, logos, and other graphic elements where a bold and eye-catching statement is desired. Its retro-inspired aesthetic evokes a sense of nostalgia and fun, making it perfect for projects that aim to capture the spirit of classic comic books and pop culture. The font's playful nature and bold presence make it a powerful tool for creating engaging and memorable visual experiences.",
    "technical_characteristics": [
      "Geometric construction",
      "Rounded corners",
      "Exaggerated letterforms",
      "3D extrusion",
      "Generous spacing"
    ],
    "personality_traits": [
      "Playful",
      "Bold",
      "Dynamic",
      "Retro",
      "Fun"
    ],
    "practical_contexts": [
      "Headlines",
      "Logos",
      "Posters",
      "Graphic elements",
      "Comic book covers"
    ],
    "cultural_intuition": [
      "Classic comic book lettering",
      "Pop culture nostalgia",
      "Retro aesthetic",
      "Playful energy",
      "Visual impact"
    ],
    "search_keywords": [
      "Bubble Comics PX",
      "Display typeface",
      "Comic book lettering",
      "Bold",
      "Rounded",
      "3D",
      "Extruded",
      "Geometric",
      "Playful",
      "Retro",
      "Nostalgia",
      "Fun",
      "Headlines",
      "Logos",
      "Posters",
      "Graphic elements",
      "Comic book covers",
      "Visual impact",
      "Dynamic",
      "Eye-catching"
    ]
  }
}