{
  "filename": "bubbled_36px.png",
  "status": "success",
  "description": {
    "detailed_description": "Bubbbled is a playful and expressive script font that draws inspiration from hand-lettering and cartoon aesthetics. Its rounded forms and exaggerated curves create a sense of movement and energy, while the bold weight and consistent stroke width ensure strong legibility. The font's construction is based on simple geometric shapes, with each letterform carefully crafted to maintain a consistent visual rhythm. The rounded terminals and open counters contribute to its friendly and approachable character, making it suitable for a wide range of applications, from children's books and branding to social media graphics and website design. Bubbbled's playful nature evokes a sense of fun and lightheartedness, reminiscent of vintage cartoons and comic book lettering. Its bold and expressive style suggests a sense of energy and excitement, making it ideal for projects that require a touch of whimsy and personality.",
    "technical_characteristics": [
      "rounded forms",
      "exaggerated curves",
      "bold weight",
      "consistent stroke width",
      "open counters",
      "geometric construction"
    ],
    "personality_traits": [
      "playful",
      "expressive",
      "friendly",
      "approachable",
      "energetic",
      "whimsical",
      "bold"
    ],
    "practical_contexts": [
      "children's books",
      "branding",
      "social media graphics",
      "website design",
      "display typography"
    ],
    "cultural_intuition": [
      "vintage cartoons",
      "comic book lettering",
      "hand-lettering",
      "pop culture",
      "playful design"
    ],
    "search_keywords": [
      "rounded",
      "script",
      "bold",
      "playful",
      "expressive",
      "hand-lettering",
      "cartoon",
      "whimsical",
      "energetic",
      "friendly",
      "approachable",
      "legible",
      "display",
      "branding",
      "children's",
      "social media",
      "website",
      "vintage",
      "comic book",
      "pop culture"
    ]
  }
}