{
  "filename": "bubble_writing_36px.png",
  "status": "success",
  "description": {
    "detailed_description": "Bubble Writing (36px) is a playful script font that captures the essence of handwritten lettering. Its rounded forms and bouncy curves create a sense of lightheartedness and informality. The font's irregular baseline and varying letter heights contribute to its hand-drawn aesthetic, while the bold weight and generous x-height ensure good legibility even at smaller sizes. The font's overall character is friendly and approachable, making it suitable for projects that require a touch of whimsy and personality. Its casual nature makes it ideal for children's books, greeting cards, social media graphics, and informal branding. However, its playful nature might not be appropriate for formal documents or corporate communications. Bubble Writing (36px) evokes a sense of childhood nostalgia and carefree fun, reminiscent of handwritten notes and playful doodles. Its contemporary relevance lies in its ability to convey authenticity and personality in a digital world.",
    "technical_characteristics": [
      "Rounded forms",
      "Bouncy curves",
      "Irregular baseline",
      "Varying letter heights",
      "Bold weight",
      "Generous x-height",
      "Hand-drawn aesthetic"
    ],
    "personality_traits": [
      "Playful",
      "Lighthearted",
      "Informal",
      "Friendly",
      "Approachable",
      "Whimsical",
      "Casual",
      "Nostalgic",
      "Fun"
    ],
    "practical_contexts": [
      "Children's books",
      "Greeting cards",
      "Social media graphics",
      "Informal branding",
      "Handwritten notes",
      "Playful doodles"
    ],
    "cultural_intuition": [
      "Childhood nostalgia",
      "Carefree fun",
      "Authenticity",
      "Personality",
      "Digital world"
    ],
    "search_keywords": [
      "Bubble Writing",
      "Script font",
      "Handwritten",
      "Playful",
      "Informal",
      "Casual",
      "Friendly",
      "Whimsical",
      "Nostalgic",
      "Fun",
      "Children's books",
      "Greeting cards",
      "Social media",
      "Branding",
      "Handwritten notes",
      "Doodles",
      "Digital",
      "Contemporary",
      "Authenticity",
      "Personality"
    ]
  }
}