{
  "filename": "bunaken_underwater_36px.png",
  "status": "success",
  "description": {
    "detailed_description": "Buaken Underwater is a playful display typeface that embraces a cartoonish aesthetic. Its rounded forms and exaggerated proportions create a sense of whimsy and lightheartedness. The font's construction is characterized by bold strokes and generous curves, giving it a bouncy and energetic feel. The letterforms are often asymmetrical, with uneven weights and playful distortions, adding to the overall sense of fun. While the font's technical execution is not overly refined, it contributes to its charming and informal character. Buaken Underwater is well-suited for headlines, logos, and other applications where a playful and attention-grabbing visual is desired. Its bold and expressive nature makes it ideal for children's books, branding for playful products, or even social media graphics. The font's cultural associations lean towards a sense of nostalgia and childhood innocence, evoking memories of classic cartoon characters and playful illustrations.",
    "technical_characteristics": [
      "Rounded forms",
      "Exaggerated proportions",
      "Bold strokes",
      "Generous curves",
      "Asymmetrical letterforms",
      "Uneven weights",
      "Playful distortions"
    ],
    "personality_traits": [
      "Playful",
      "Whimsical",
      "Lighthearted",
      "Energetic",
      "Bouncy",
      "Informal",
      "Charming"
    ],
    "practical_contexts": [
      "Headlines",
      "Logos",
      "Children's books",
      "Playful branding",
      "Social media graphics"
    ],
    "cultural_intuition": [
      "Nostalgia",
      "Childhood innocence",
      "Classic cartoon characters",
      "Playful illustrations"
    ],
    "search_keywords": [
      "Cartoon font",
      "Playful typeface",
      "Display font",
      "Rounded letters",
      "Bold strokes",
      "Whimsical design",
      "Children's book font",
      "Brand identity",
      "Social media graphics",
      "Nostalgic",
      "Fun",
      "Energetic",
      "Informal",
      "Charming",
      "Bouncy",
      "Exaggerated",
      "Asymmetrical",
      "Distorted",
      "Underwater",
      "Buaken"
    ]
  }
}