{
  "filename": "burvetica_nc_36px.png",
  "status": "success",
  "description": {
    "detailed_description": "Burvetica NC is a playful sans-serif font that blends geometric construction with a touch of cartoonish charm. Its bold strokes and rounded terminals create a friendly and approachable feel, while the consistent x-height and open counters ensure strong legibility even at small sizes. The font's playful nature is further emphasized by the exaggerated curves in letters like 'C' and 'S', and the slightly condensed proportions add a sense of energy and dynamism. While its cartoonish elements make it suitable for children's books and playful branding, its strong legibility and versatility also make it appropriate for digital interfaces and headlines. Burvetica NC evokes a sense of lighthearted fun and contemporary energy, suggesting a brand that is both approachable and engaging.",
    "technical_characteristics": [
      "Geometric construction",
      "Rounded terminals",
      "Bold strokes",
      "Consistent x-height",
      "Open counters",
      "Slightly condensed proportions",
      "Exaggerated curves in certain letters"
    ],
    "personality_traits": [
      "Playful",
      "Approachable",
      "Friendly",
      "Energetic",
      "Dynamic",
      "Bold",
      "Legible"
    ],
    "practical_contexts": [
      "Children's books",
      "Playful branding",
      "Digital interfaces",
      "Headlines",
      "Short text blocks"
    ],
    "cultural_intuition": [
      "Evokes a sense of lighthearted fun",
      "Suggests a contemporary and energetic brand",
      "Reflects a playful and approachable aesthetic",
      "Appeals to a wide audience",
      "Connects with a sense of youthful optimism"
    ],
    "search_keywords": [
      "Sans-serif",
      "Geometric",
      "Rounded",
      "Bold",
      "Playful",
      "Cartoon",
      "Friendly",
      "Approachable",
      "Legible",
      "Energetic",
      "Dynamic",
      "Children's book",
      "Branding",
      "Digital interface",
      "Headline",
      "Contemporary",
      "Optimistic",
      "Fun",
      "Engaging"
    ]
  }
}