{
  "filename": "cabaletta_36px.png",
  "status": "success",
  "description": {
    "detailed_description": "Cabaletta is a bold and dramatic display typeface that draws inspiration from Gothic and Celtic lettering styles. Its thick strokes and sharp angles create a sense of power and authority, while the intricate flourishes and extended serifs add a touch of elegance and sophistication. The font's high x-height and open counters ensure strong legibility, even at large sizes, making it suitable for headlines, logos, and other prominent text elements. The font's strong verticality and pronounced serifs create a sense of grandeur and formality, evoking a sense of history and tradition. While its origins lie in medieval script, Cabaletta's bold and confident character makes it feel contemporary and relevant for modern design projects. Its striking appearance and strong personality make it a powerful tool for conveying a sense of strength, tradition, and authority.",
    "technical_characteristics": [
      "High x-height",
      "Sharp angles",
      "Extended serifs",
      "Thick strokes",
      "Intricate flourishes",
      "Open counters",
      "Strong verticality"
    ],
    "personality_traits": [
      "Bold",
      "Dramatic",
      "Powerful",
      "Authoritative",
      "Elegant",
      "Sophisticated",
      "Grand",
      "Formal",
      "Traditional",
      "Contemporary"
    ],
    "practical_contexts": [
      "Headlines",
      "Logos",
      "Posters",
      "Branding",
      "Titles",
      "Large-scale signage"
    ],
    "cultural_intuition": [
      "Medieval script",
      "Gothic architecture",
      "Celtic art",
      "Historical grandeur",
      "Modern design"
    ],
    "search_keywords": [
      "Gothic",
      "Celtic",
      "Display",
      "Bold",
      "Dramatic",
      "Serif",
      "High x-height",
      "Open counters",
      "Intricate",
      "Flourishes",
      "Powerful",
      "Authoritative",
      "Elegant",
      "Sophisticated",
      "Grand",
      "Formal",
      "Traditional",
      "Contemporary",
      "Headlines",
      "Logos",
      "Posters",
      "Branding",
      "Titles",
      "Large-scale signage"
    ]
  }
}