{
  "filename": "cactus_sandwich_36px.png",
  "status": "success",
  "description": {
    "detailed_description": "Cactus Sandwich is a playful display font that draws inspiration from hand-drawn lettering and vintage signage. Its rounded forms and exaggerated curves create a sense of whimsy and informality, while the bold outlines add a touch of retro charm. The font's construction is characterized by a combination of geometric and organic elements, resulting in a unique visual language that is both playful and legible. The generous x-height and open counters ensure readability even at smaller sizes, making it suitable for headlines, logos, and other display applications. The font's overall character is friendly and approachable, evoking a sense of nostalgia and lightheartedness. Its cultural associations range from classic American diner signage to contemporary hand-lettered designs, making it a versatile choice for projects that require a touch of personality and whimsy.",
    "technical_characteristics": [
      "Rounded forms",
      "Exaggerated curves",
      "Bold outlines",
      "Geometric and organic construction",
      "Generous x-height",
      "Open counters"
    ],
    "personality_traits": [
      "Playful",
      "Whimsical",
      "Informal",
      "Retro",
      "Friendly",
      "Approachable",
      "Nostalgic",
      "Lighthearted"
    ],
    "practical_contexts": [
      "Headlines",
      "Logos",
      "Posters",
      "Social media graphics",
      "Packaging"
    ],
    "cultural_intuition": [
      "American diner signage",
      "Vintage advertising",
      "Hand-lettered designs",
      "Contemporary graphic design",
      "Nostalgia"
    ],
    "search_keywords": [
      "Display font",
      "Hand-drawn",
      "Vintage",
      "Rounded",
      "Curves",
      "Bold outlines",
      "Geometric",
      "Organic",
      "Playful",
      "Whimsical",
      "Informal",
      "Retro",
      "Friendly",
      "Approachable",
      "Nostalgic",
      "Lighthearted",
      "Headlines",
      "Logos",
      "Posters",
      "Social media",
      "Packaging",
      "American diner",
      "Vintage advertising",
      "Hand-lettered",
      "Contemporary design"
    ]
  }
}