{
  "filename": "calculus_sans_36px.png",
  "status": "success",
  "description": {
    "detailed_description": "Calculus Sans is a playful sans-serif font that blends a casual, handwritten aesthetic with a touch of geometric structure. The rounded letterforms and slightly irregular stroke widths create a sense of informality and approachability, while the consistent x-height and open counters ensure good legibility. The font's overall character is friendly and approachable, suggesting a sense of warmth and personality. It draws inspiration from the hand-lettered styles of the 1960s and 70s, but with a contemporary twist that feels fresh and modern. This makes it suitable for a wide range of applications, from branding and packaging to social media graphics and website design. Its casual yet legible nature makes it ideal for headlines, logos, and short-form text, particularly in digital environments where its playful personality can shine. The font's overall impression is one of optimism and approachability, suggesting a brand or message that is both fun and engaging.",
    "technical_characteristics": [
      "Rounded letterforms",
      "Slightly irregular stroke widths",
      "Consistent x-height",
      "Open counters",
      "Casual, handwritten aesthetic",
      "Geometric structure",
      "Playful character"
    ],
    "personality_traits": [
      "Playful",
      "Approachable",
      "Friendly",
      "Casual",
      "Warm",
      "Optimistic",
      "Engaging"
    ],
    "practical_contexts": [
      "Branding and packaging",
      "Social media graphics",
      "Website design",
      "Headlines",
      "Logos",
      "Short-form text"
    ],
    "cultural_intuition": [
      "Evokes a sense of nostalgia for the 1960s and 70s",
      "Feels fresh and modern",
      "Suggests a brand or message that is both fun and engaging",
      "Appeals to a younger, digitally-native audience"
    ],
    "search_keywords": [
      "Sans-serif",
      "Handwritten",
      "Playful",
      "Casual",
      "Friendly",
      "Approachable",
      "Legible",
      "Modern",
      "Digital",
      "Branding",
      "Packaging",
      "Social media",
      "Website design",
      "Headlines",
      "Logos",
      "Short-form text",
      "Nostalgia",
      "Optimistic",
      "Engaging"
    ]
  }
}