{
  "filename": "caligrafia_divina_36px.png",
  "status": "success",
  "description": {
    "detailed_description": "This font is a captivating blend of intricate detail and whimsical charm. Each glyph is a miniature work of art, featuring delicate flourishes, swirling lines, and intricate patterns that evoke a sense of both elegance and playfulness. The font's construction is based on a combination of organic and geometric elements, creating a harmonious balance between flowing curves and precise angles. The overall effect is one of intricate beauty and delicate artistry, reminiscent of the ornate designs found in medieval manuscripts and Renaissance art. The font's playful nature makes it ideal for adding a touch of whimsy to branding, packaging, or editorial design, while its intricate details lend themselves well to decorative applications such as invitations, certificates, or even tattoos. The font's cultural resonance lies in its connection to historical traditions of craftsmanship and artistry, while its contemporary relevance stems from its ability to add a touch of personality and charm to modern design projects.",
    "technical_characteristics": [
      "Intricate detail",
      "Organic and geometric construction",
      "Delicate flourishes",
      "Swirling lines",
      "Intricate patterns"
    ],
    "personality_traits": [
      "Whimsical",
      "Elegant",
      "Playful",
      "Intricate",
      "Artisanal"
    ],
    "practical_contexts": [
      "Branding",
      "Packaging",
      "Editorial design",
      "Decorative applications",
      "Invitations"
    ],
    "cultural_intuition": [
      "Medieval manuscripts",
      "Renaissance art",
      "Craftsmanship",
      "Artistry",
      "Whimsical charm"
    ],
    "search_keywords": [
      "Ornate",
      "Flourishes",
      "Swirls",
      "Intricate",
      "Decorative",
      "Whimsical",
      "Elegant",
      "Playful",
      "Medieval",
      "Renaissance",
      "Art Deco",
      "Vintage",
      "Hand-drawn",
      "Calligraphy",
      "Script",
      "Display",
      "Branding",
      "Packaging",
      "Editorial",
      "Invitation",
      "Certificate",
      "Tattoo"
    ]
  }
}