{
  "filename": "calliope_fun_36px.png",
  "status": "success",
  "description": {
    "detailed_description": "Calliope Fun 36px is a display typeface that captures the essence of playful, handwritten script. Its irregular letterforms, characterized by uneven strokes and exaggerated curves, evoke the spontaneity of a child's scribbles. The font's construction is intentionally loose, with varying letter heights and inconsistent spacing, contributing to its whimsical charm. While the overall impression is lighthearted and informal, the font's bold strokes and distinct letter shapes ensure readability, making it suitable for headlines, logos, and playful branding. The font's cultural resonance lies in its nostalgic appeal, reminiscent of childhood memories and the carefree spirit of creative expression. Its contemporary relevance stems from its ability to inject a dose of personality and authenticity into digital design, particularly in projects targeting younger audiences or emphasizing a sense of fun and individuality.",
    "technical_characteristics": [
      "Handwritten style",
      "Irregular letterforms",
      "Uneven strokes",
      "Exaggerated curves",
      "Varying letter heights",
      "Inconsistent spacing",
      "Bold strokes",
      "Distinct letter shapes"
    ],
    "personality_traits": [
      "Playful",
      "Whimsical",
      "Spontaneous",
      "Informal",
      "Lighthearted",
      "Nostalgic",
      "Authentic",
      "Individualistic"
    ],
    "practical_contexts": [
      "Headlines",
      "Logos",
      "Branding",
      "Social media graphics",
      "Children's books",
      "Playful packaging"
    ],
    "cultural_intuition": [
      "Childhood memories",
      "Creative expression",
      "Nostalgia",
      "Fun and individuality",
      "Digital-native design"
    ],
    "search_keywords": [
      "Handwritten",
      "Script",
      "Display",
      "Playful",
      "Whimsical",
      "Informal",
      "Nostalgic",
      "Authentic",
      "Headlines",
      "Logos",
      "Branding",
      "Social media",
      "Children's",
      "Packaging",
      "Digital",
      "Contemporary",
      "Fun",
      "Individuality"
    ]
  }
}