{
  "filename": "candy_stripe_36px.png",
  "status": "success",
  "description": {
    "detailed_description": "Candy Stripe is a playful and eye-catching display font that utilizes a bold, striped pattern to create a sense of movement and energy. The rounded letterforms and generous curves contribute to its friendly and approachable character, while the striped pattern adds a touch of whimsy and retro charm. The font's construction is simple yet effective, with each letterform built from a series of parallel lines that create a consistent visual rhythm. The striped pattern is applied consistently across all characters, ensuring a cohesive and recognizable style. While the font's bold design makes it ideal for headlines and short bursts of text, its playful nature also lends itself to branding elements, packaging design, and even children's illustrations. The striped pattern evokes a sense of nostalgia, reminiscent of vintage candy wrappers and carnival signage, adding a layer of playful nostalgia to any design. Candy Stripe's bold and playful personality makes it a fun and engaging choice for projects that require a touch of whimsy and retro charm.",
    "technical_characteristics": [
      "Striped pattern",
      "Rounded letterforms",
      "Generous curves",
      "Consistent stroke width",
      "Simple construction"
    ],
    "personality_traits": [
      "Playful",
      "Whimsical",
      "Retro",
      "Bold",
      "Friendly"
    ],
    "practical_contexts": [
      "Headlines",
      "Short bursts of text",
      "Branding elements",
      "Packaging design",
      "Children's illustrations"
    ],
    "cultural_intuition": [
      "Nostalgia",
      "Vintage candy wrappers",
      "Carnival signage",
      "Retro design",
      "Playful energy"
    ],
    "search_keywords": [
      "Candy Stripe",
      "Display font",
      "Striped pattern",
      "Rounded letterforms",
      "Playful",
      "Whimsical",
      "Retro",
      "Bold",
      "Friendly",
      "Nostalgia",
      "Vintage",
      "Carnival",
      "Headlines",
      "Branding",
      "Packaging",
      "Children's illustrations"
    ]
  }
}