{
  "filename": "captain_podd_36px.png",
  "status": "success",
  "description": {
    "detailed_description": "This font, with its geometric construction and sharp, angular forms, embodies a distinct futuristic aesthetic. The letterforms are built from a series of straight lines and right angles, creating a sense of precision and order. The consistent stroke weight and open counters contribute to its strong legibility, even at small sizes. The overall effect is one of starkness and modernity, reminiscent of early computer interfaces and science fiction imagery. While the font's bold, geometric nature might seem austere at first glance, the subtle curves in certain letters, like the 'a' and 'g', introduce a touch of humanity, preventing it from feeling overly cold or robotic. This balance makes it suitable for a range of applications, from tech-focused branding and website design to futuristic-themed projects and graphic novels. Its clean lines and bold presence make it particularly effective for headlines and titles, while its legibility ensures readability even in smaller sizes for body text. The font's cultural resonance lies in its association with the cyberpunk aesthetic, evoking a sense of technological advancement and urban dystopia. It captures the spirit of a future where technology and society are intertwined, creating a visual language that is both familiar and intriguing.",
    "technical_characteristics": [
      "Geometric construction",
      "Sharp, angular terminals",
      "Consistent stroke weight",
      "Open counters",
      "High x-height",
      "Monospaced",
      "Limited character set"
    ],
    "personality_traits": [
      "Futuristic",
      "Modern",
      "Bold",
      "Geometric",
      "Stark",
      "Clean",
      "Precise"
    ],
    "practical_contexts": [
      "Tech-focused branding",
      "Website design",
      "Futuristic-themed projects",
      "Graphic novels",
      "Headlines and titles"
    ],
    "cultural_intuition": [
      "Cyberpunk aesthetic",
      "Technological advancement",
      "Urban dystopia",
      "Early computer interfaces",
      "Science fiction imagery"
    ],
    "search_keywords": [
      "Geometric",
      "Futuristic",
      "Sharp",
      "Angular",
      "Monospaced",
      "Tech",
      "Science fiction",
      "Cyberpunk",
      "Modern",
      "Bold",
      "Clean",
      "Legible",
      "Headline",
      "Title",
      "Branding",
      "Website",
      "Graphic design",
      "Digital",
      "Interface"
    ]
  }
}