{
  "filename": "caracura_36px.png",
  "status": "success",
  "description": {
    "detailed_description": "This font, with its dripping, distorted letterforms, is a bold statement of rebellious energy. The characters are constructed with a clear sense of organic flow, each stroke seemingly melting and dripping downwards. This creates a sense of movement and chaos, reminiscent of graffiti or dripping paint. The exaggerated proportions, with tall ascenders and deep descenders, further emphasize the dynamic nature of the design. While the overall impression is one of wild abandon, the font maintains a degree of legibility, thanks to its clear stroke weights and well-defined shapes. This makes it suitable for eye-catching headlines, posters, or branding that demands a strong visual impact. The font's cultural associations lean towards punk rock, street art, and underground culture, evoking a sense of rebellion and nonconformity. It's a font that speaks to those who embrace the unconventional and the raw.",
    "technical_characteristics": [
      "Distorted letterforms",
      "Dripping effect",
      "Exaggerated proportions",
      "Organic flow",
      "Clear stroke weights"
    ],
    "personality_traits": [
      "Rebellious",
      "Energetic",
      "Chaotic",
      "Dynamic",
      "Unconventional"
    ],
    "practical_contexts": [
      "Headlines",
      "Posters",
      "Branding",
      "Streetwear",
      "Music"
    ],
    "cultural_intuition": [
      "Punk rock",
      "Street art",
      "Underground culture",
      "Rebellion",
      "Nonconformity"
    ],
    "search_keywords": [
      "Distorted",
      "Dripping",
      "Graffiti",
      "Punk",
      "Streetwear",
      "Rebellious",
      "Energetic",
      "Chaotic",
      "Dynamic",
      "Unconventional",
      "Headlines",
      "Posters",
      "Branding",
      "Music",
      "Underground",
      "Nonconformity",
      "Organic",
      "Flow",
      "Exaggerated",
      "Bold",
      "Impact",
      "Visual",
      "Statement"
    ]
  }
}