{
  "filename": "cc_robo_36px.png",
  "status": "success",
  "description": {
    "detailed_description": "OC Robo [36px] is a geometric sans-serif typeface characterized by its clean lines, sharp corners, and consistent stroke widths. The font's construction is based on a grid system, resulting in a highly structured and balanced appearance. The letterforms are composed of simple, geometric shapes, with minimal curves or embellishments. This minimalist approach creates a sense of clarity and efficiency, while the sharp corners add a touch of boldness and edge. The font's high x-height and open counters contribute to its excellent legibility, making it suitable for a wide range of applications, from headlines and branding to website copy and user interfaces. The overall character of OC Robo [36px] is modern, confident, and slightly futuristic, evoking a sense of technological advancement and innovation. Its clean lines and sharp corners suggest a sense of precision and order, while its minimalist design conveys a sense of efficiency and simplicity. The font's contemporary relevance is evident in its use in digital interfaces, branding, and graphic design, where its clean lines and sharp corners complement the aesthetic of modern technology. The font's cultural associations are rooted in the minimalist design movement, which emphasizes simplicity, functionality, and clarity. Its geometric construction and sharp corners are reminiscent of the Bauhaus style, while its overall character reflects the values of modernism, such as efficiency, functionality, and progress.",
    "technical_characteristics": [
      "Geometric construction",
      "Consistent stroke widths",
      "Sharp corners",
      "High x-height",
      "Open counters"
    ],
    "personality_traits": [
      "Modern",
      "Confident",
      "Futuristic",
      "Clean",
      "Efficient",
      "Bold",
      "Minimalist",
      "Structured",
      "Balanced"
    ],
    "practical_contexts": [
      "Headlines",
      "Branding",
      "Website copy",
      "User interfaces",
      "Digital signage"
    ],
    "cultural_intuition": [
      "Minimalist design movement",
      "Bauhaus style",
      "Modernism",
      "Technological advancement",
      "Innovation"
    ],
    "search_keywords": [
      "Geometric sans-serif",
      "Clean lines",
      "Sharp corners",
      "High x-height",
      "Open counters",
      "Modern",
      "Confident",
      "Futuristic",
      "Minimalist",
      "Digital",
      "Branding",
      "Website",
      "Interface",
      "Headlines",
      "Signage",
      "Bauhaus",
      "Modernism",
      "Technology",
      "Innovation"
    ]
  }
}