{
  "filename": "ceicillia_36px.png",
  "status": "success",
  "description": {
    "detailed_description": "This script font exudes a classic charm with its flowing curves and bold strokes. The characters are constructed with a strong sense of rhythm, each letter gracefully transitioning into the next. The generous x-height and open counters ensure excellent legibility, even at smaller sizes. The font's personality is both playful and sophisticated, reminiscent of vintage signage and handwritten notes. Its bold strokes and dramatic flourishes lend a sense of grandeur, while the overall fluidity evokes a sense of warmth and approachability. This font is well-suited for branding, packaging, and editorial design, particularly for projects that require a touch of vintage elegance. Its versatility allows it to be used in both large display sizes and smaller text blocks, adding a touch of personality to any design. The font's cultural resonance lies in its connection to the golden age of advertising and the enduring appeal of handwritten script. It evokes a sense of nostalgia and authenticity, while also feeling fresh and contemporary.",
    "technical_characteristics": [
      "flowing curves",
      "bold strokes",
      "generous x-height",
      "open counters",
      "dramatic flourishes",
      "consistent stroke weight",
      "smooth transitions"
    ],
    "personality_traits": [
      "playful",
      "sophisticated",
      "elegant",
      "grand",
      "approachable",
      "vintage",
      "handwritten"
    ],
    "practical_contexts": [
      "branding",
      "packaging",
      "editorial design",
      "display typography",
      "small text blocks"
    ],
    "cultural_intuition": [
      "vintage advertising",
      "handwritten script",
      "nostalgia",
      "authenticity",
      "contemporary charm"
    ],
    "search_keywords": [
      "script font",
      "flowing curves",
      "bold strokes",
      "vintage",
      "elegant",
      "handwritten",
      "playful",
      "sophisticated",
      "legible",
      "display typography",
      "branding",
      "packaging",
      "editorial design",
      "nostalgia",
      "authenticity",
      "contemporary"
    ]
  }
}