{
  "filename": "centre_claws_36px.png",
  "status": "success",
  "description": {
    "detailed_description": "Centre Claws is a display typeface that embodies a playful retro aesthetic with a strong technical foundation. Its defining characteristic is the bold, slanted stroke, achieved through a unique construction where each letterform is essentially a series of parallel lines. This creates a distinctive visual impact, reminiscent of vintage signage and graphic design. The font's generous x-height and open counters ensure legibility even at large sizes, making it ideal for headlines and branding elements. The slightly rounded terminals add a touch of approachability, softening the otherwise sharp geometric forms. This balance between boldness and approachability makes Centre Claws suitable for a range of applications, from retro-inspired branding to contemporary digital interfaces. Its playful nature evokes a sense of nostalgia and fun, while its technical precision ensures a professional and polished look. The font's cultural resonance lies in its connection to the mid-century design era, a time of bold experimentation and graphic innovation.",
    "technical_characteristics": [
      "Parallel line construction",
      "Slanted stroke",
      "Generous x-height",
      "Open counters",
      "Rounded terminals",
      "Geometric forms",
      "Bold weight"
    ],
    "personality_traits": [
      "Playful",
      "Retro",
      "Bold",
      "Approachable",
      "Distinctive",
      "Nostalgic",
      "Fun",
      "Professional",
      "Polished"
    ],
    "practical_contexts": [
      "Headlines",
      "Branding",
      "Logos",
      "Posters",
      "Digital interfaces",
      "Large-scale signage"
    ],
    "cultural_intuition": [
      "Mid-century design",
      "Vintage signage",
      "Graphic design",
      "Nostalgia",
      "Fun",
      "Playfulness"
    ],
    "search_keywords": [
      "Centre Claws",
      "Display typeface",
      "Retro",
      "Vintage",
      "Bold",
      "Slanted",
      "Parallel lines",
      "Geometric",
      "Playful",
      "Nostalgic",
      "Fun",
      "Professional",
      "Headlines",
      "Branding",
      "Logos",
      "Posters",
      "Digital interfaces",
      "Large-scale signage"
    ]
  }
}