{
  "filename": "chalk_clouds_36px.png",
  "status": "success",
  "description": {
    "detailed_description": "Chalk Clouds is a playful script font that captures the charm of handwritten lettering with a touch of vintage flair. Its flowing curves and exaggerated swashes evoke a sense of casual elegance, reminiscent of classic signage and handwritten notes. The font's generous x-height and open counters ensure strong legibility, even at smaller sizes, making it suitable for both display and body text applications. The slightly rounded terminals and subtle variations in stroke weight add a touch of warmth and personality, while the overall construction maintains a sense of balance and consistency. Chalk Clouds' nostalgic feel makes it ideal for projects that require a touch of whimsy and authenticity, such as branding for cafes, boutiques, or creative agencies. Its versatility allows it to be used in a variety of contexts, from handwritten-style logos to playful social media graphics, adding a touch of personality and charm to any design.",
    "technical_characteristics": [
      "flowing curves",
      "exaggerated swashes",
      "generous x-height",
      "open counters",
      "rounded terminals",
      "variable stroke weight",
      "consistent construction"
    ],
    "personality_traits": [
      "playful",
      "casual",
      "elegant",
      "nostalgic",
      "whimsical",
      "authentic",
      "versatile"
    ],
    "practical_contexts": [
      "branding for cafes, boutiques, or creative agencies",
      "handwritten-style logos",
      "playful social media graphics",
      "display text",
      "body text"
    ],
    "cultural_intuition": [
      "evokes classic signage and handwritten notes",
      "suggests a vintage aesthetic",
      "captures the charm of handwritten lettering",
      "ideal for projects that require a touch of whimsy and authenticity"
    ],
    "search_keywords": [
      "script font",
      "handwritten",
      "vintage",
      "playful",
      "elegant",
      "nostalgic",
      "whimsical",
      "authentic",
      "versatile",
      "display text",
      "body text",
      "branding",
      "logos",
      "social media graphics",
      "cafe",
      "boutique",
      "creative agency"
    ]
  }
}