{
  "filename": "charlotte_36px.png",
  "status": "success",
  "description": {
    "detailed_description": "Charlotte is a playful and expressive font that captures the essence of hand-drawn lettering. Its irregular letterforms, with their uneven strokes and slightly wobbly lines, create a sense of spontaneity and authenticity. The font's generous x-height and open counters ensure good legibility, even at smaller sizes, while the rounded terminals and playful glyphs add a touch of whimsy. The overall effect is one of casual charm and approachable personality, making it ideal for projects that require a friendly and informal tone. Charlotte's hand-drawn aesthetic evokes a sense of nostalgia and childhood innocence, reminiscent of handwritten notes and personalized doodles. Its versatility allows it to be used for a wide range of applications, from social media graphics and website headers to packaging designs and children's books. However, its informal nature might not be suitable for formal or corporate settings.",
    "technical_characteristics": [
      "Hand-drawn aesthetic",
      "Irregular letterforms",
      "Uneven strokes",
      "Rounded terminals",
      "Open counters",
      "Generous x-height",
      "Playful glyphs"
    ],
    "personality_traits": [
      "Playful",
      "Expressive",
      "Spontaneous",
      "Authentic",
      "Whimsical",
      "Casual",
      "Approachable"
    ],
    "practical_contexts": [
      "Social media graphics",
      "Website headers",
      "Packaging designs",
      "Children's books",
      "Informal branding"
    ],
    "cultural_intuition": [
      "Nostalgia",
      "Childhood innocence",
      "Handwritten notes",
      "Personalized doodles",
      "Informal communication"
    ],
    "search_keywords": [
      "Hand-drawn",
      "Playful",
      "Expressive",
      "Casual",
      "Whimsical",
      "Informal",
      "Script",
      "Doodle",
      "Nostalgia",
      "Children's",
      "Social media",
      "Website",
      "Packaging",
      "Branding",
      "Typography",
      "Font",
      "Letterforms",
      "Glyph",
      "Character",
      "Design"
    ]
  }
}