{
  "filename": "charnel_house_36px.png",
  "status": "success",
  "description": {
    "detailed_description": "This font is a bold statement of gothic and industrial aesthetics, built upon a foundation of sharp angles and intricate details. The letterforms are constructed with a strong emphasis on geometric shapes, particularly circles and triangles, creating a sense of rigid structure and mechanical precision. The overall character is aggressive and imposing, with sharp terminals and heavy strokes that convey a sense of power and dominance. The font's design is heavily influenced by the visual language of heavy metal music and biker culture, drawing inspiration from imagery like skulls, gears, and flames. This makes it particularly relevant for projects that seek to evoke a sense of rebellion, danger, and raw energy. While the font's bold nature makes it suitable for large-scale headlines and branding elements, its intricate details can be challenging to read at smaller sizes. It's best suited for applications where impact and visual intensity are paramount, such as album covers, posters, and merchandise for bands or motorcycle clubs.",
    "technical_characteristics": [
      "Geometric construction",
      "Sharp terminals",
      "Heavy strokes",
      "Intricate details",
      "High contrast",
      "Large x-height",
      "Open counters"
    ],
    "personality_traits": [
      "Aggressive",
      "Imposing",
      "Powerful",
      "Dominant",
      "Rebellious",
      "Dangerous",
      "Raw"
    ],
    "practical_contexts": [
      "Headlines",
      "Branding",
      "Posters",
      "Album covers",
      "Merchandise",
      "Large-scale displays"
    ],
    "cultural_intuition": [
      "Heavy metal music",
      "Biker culture",
      "Gothic aesthetics",
      "Industrial design",
      "Rebellion and counterculture"
    ],
    "search_keywords": [
      "Gothic",
      "Industrial",
      "Heavy metal",
      "Biker",
      "Skull",
      "Gear",
      "Flame",
      "Aggressive",
      "Imposing",
      "Bold",
      "Sharp",
      "Intricate",
      "High contrast",
      "Large x-height",
      "Open counters",
      "Headlines",
      "Branding",
      "Posters",
      "Album covers",
      "Merchandise",
      "Rebellion",
      "Counterculture",
      "Dark",
      "Powerful",
      "Dominant",
      "Dangerous",
      "Raw"
    ]
  }
}