{
  "filename": "chase's_sketch_36px.png",
  "status": "success",
  "description": {
    "detailed_description": "Chase's Sketch is a display typeface that captures the essence of hand-drawn lettering with a playful, slightly chaotic energy. Its irregular stroke widths and uneven letterforms create a sense of immediacy and personality, reminiscent of a quick sketch or a handwritten note. The font's construction is based on a combination of geometric and organic forms, with rounded terminals and open counters that contribute to its friendly and approachable feel. While the overall design is casual, the font's consistent baseline and well-defined letterforms ensure readability, making it suitable for headlines, logos, and short text blocks. The font's inherent imperfection adds a touch of whimsy and authenticity, making it ideal for projects that seek a unique and expressive visual identity. Its cultural associations range from vintage signage and hand-drawn posters to contemporary digital art and social media graphics, reflecting its versatility and adaptability across various creative contexts.",
    "technical_characteristics": [
      "Irregular stroke widths",
      "Uneven letterforms",
      "Rounded terminals",
      "Open counters",
      "Geometric and organic construction",
      "Consistent baseline",
      "Well-defined letterforms"
    ],
    "personality_traits": [
      "Playful",
      "Chaotic",
      "Immediacy",
      "Friendly",
      "Approachable",
      "Whimsical",
      "Authentic",
      "Expressive"
    ],
    "practical_contexts": [
      "Headlines",
      "Logos",
      "Short text blocks",
      "Social media graphics",
      "Digital art",
      "Vintage-inspired designs"
    ],
    "cultural_intuition": [
      "Handwritten note",
      "Quick sketch",
      "Vintage signage",
      "Hand-drawn posters",
      "Contemporary digital art"
    ],
    "search_keywords": [
      "Display typeface",
      "Hand-drawn",
      "Sketch",
      "Playful",
      "Chaotic",
      "Irregular",
      "Rounded terminals",
      "Open counters",
      "Geometric",
      "Organic",
      "Consistent baseline",
      "Well-defined",
      "Headlines",
      "Logos",
      "Short text",
      "Social media",
      "Digital art",
      "Vintage",
      "Hand-drawn posters",
      "Contemporary"
    ]
  }
}