{
  "filename": "childrens_darlings_36px.png",
  "status": "success",
  "description": {
    "detailed_description": "This font is a whimsical collection of illustrative glyphs, each representing a distinct animal or object. The hand-drawn style is evident in the uneven line weights and organic shapes, creating a sense of playful informality. The glyphs are designed with a focus on silhouette and simplified forms, making them easily recognizable even at small sizes. While the overall aesthetic is charming and nostalgic, the font's lack of consistent letterforms and limited character set restricts its practical applications. It's best suited for decorative purposes, adding a touch of whimsy to children's books, greeting cards, or playful branding elements. The font evokes a sense of childhood wonder and storytelling, reminiscent of vintage picture books and folk art. Its simplicity and charm make it a delightful choice for projects seeking a touch of handcrafted authenticity.",
    "technical_characteristics": [
      "Hand-drawn style",
      "Uneven line weights",
      "Simplified forms",
      "Silhouette-based design",
      "Limited character set",
      "Illustrative glyphs"
    ],
    "personality_traits": [
      "Playful",
      "Whimsical",
      "Nostalgic",
      "Charming",
      "Handcrafted"
    ],
    "practical_contexts": [
      "Children's books",
      "Greeting cards",
      "Decorative elements",
      "Playful branding",
      "Small-scale applications"
    ],
    "cultural_intuition": [
      "Childhood wonder",
      "Vintage picture books",
      "Folk art",
      "Storytelling",
      "Handcrafted authenticity"
    ],
    "search_keywords": [
      "Hand-drawn",
      "Illustrative",
      "Whimsical",
      "Nostalgic",
      "Children's font",
      "Decorative",
      "Playful",
      "Vintage",
      "Folk art",
      "Limited character set",
      "Silhouette",
      "Simplified forms",
      "Greeting card font",
      "Branding font",
      "Small-scale typography"
    ]
  }
}