{
  "filename": "chinese_zodiac_36px.png",
  "status": "success",
  "description": {
    "detailed_description": "This font, with its bold, blocky forms and intricate decorative elements, evokes a sense of vintage charm and playful whimsy. The letters are constructed with a strong geometric foundation, featuring sharp corners and defined edges, reminiscent of Art Deco typography. However, the addition of decorative flourishes and subtle curves softens the overall impression, adding a touch of personality and warmth. The heavy weight and generous x-height contribute to a sense of grandeur and presence, while the intricate details, such as the patterned outlines and internal embellishments, create a sense of depth and texture. This font is well-suited for display purposes, particularly in headlines and titles, where its bold presence and decorative elements can command attention. It would also be effective in branding applications, adding a touch of vintage flair and playful personality to logos and marketing materials. The font's cultural associations lean towards a nostalgic aesthetic, reminiscent of classic movie posters, vintage signage, and early 20th-century design trends. It evokes a sense of timelessness and charm, suggesting a connection to a bygone era while remaining relevant in contemporary design contexts.",
    "technical_characteristics": [
      "Geometric construction",
      "Heavy weight",
      "High x-height",
      "Sharp corners",
      "Intricate decorative elements",
      "Patterned outlines",
      "Internal embellishments"
    ],
    "personality_traits": [
      "Bold and playful",
      "Vintage charm",
      "Nostalgic aesthetic",
      "Grand and present",
      "Whimsical and decorative",
      "Timeless and charming",
      "Sophisticated yet approachable"
    ],
    "practical_contexts": [
      "Headlines and titles",
      "Branding applications",
      "Logos and marketing materials",
      "Display typography",
      "Vintage-inspired designs"
    ],
    "cultural_intuition": [
      "Art Deco influence",
      "Classic movie posters",
      "Vintage signage",
      "Early 20th-century design trends",
      "Nostalgic and timeless"
    ],
    "search_keywords": [
      "Geometric",
      "Heavy",
      "High x-height",
      "Sharp corners",
      "Decorative",
      "Patterned",
      "Embellishments",
      "Vintage",
      "Nostalgic",
      "Whimsical",
      "Bold",
      "Playful",
      "Charming",
      "Timeless",
      "Display",
      "Branding",
      "Headlines",
      "Titles",
      "Logos",
      "Marketing",
      "Art Deco"
    ]
  }
}