{
  "filename": "chloe_36px.png",
  "status": "success",
  "description": {
    "detailed_description": "Chloe is a playful script font that combines a hand-drawn aesthetic with a sense of controlled structure. The letters are characterized by rounded forms, exaggerated curves, and a consistent stroke weight that gives the font a sense of unity. The overall effect is one of casual charm, reminiscent of handwritten notes or playful signage. The font's construction is evident in the slight irregularities of the letterforms, adding to its hand-crafted feel. The generous x-height and open counters ensure good legibility, making it suitable for headlines and short text blocks. Chloe's playful nature makes it ideal for projects that require a touch of whimsy, such as children's books, branding for creative businesses, or social media graphics. Its hand-drawn quality evokes a sense of warmth and personality, making it a good choice for projects that aim to connect with an audience on an emotional level.",
    "technical_characteristics": [
      "Hand-drawn aesthetic",
      "Rounded forms",
      "Exaggerated curves",
      "Consistent stroke weight",
      "Generous x-height",
      "Open counters"
    ],
    "personality_traits": [
      "Playful",
      "Whimsical",
      "Casual",
      "Charming",
      "Hand-crafted"
    ],
    "practical_contexts": [
      "Headlines",
      "Short text blocks",
      "Children's books",
      "Branding for creative businesses",
      "Social media graphics"
    ],
    "cultural_intuition": [
      "Evokes a sense of warmth and personality",
      "Suggests a playful and approachable tone",
      "Connects with an audience on an emotional level"
    ],
    "search_keywords": [
      "Script font",
      "Hand-drawn",
      "Playful",
      "Whimsical",
      "Casual",
      "Charming",
      "Rounded forms",
      "Exaggerated curves",
      "Consistent stroke weight",
      "Generous x-height",
      "Open counters",
      "Headlines",
      "Short text blocks",
      "Children's books",
      "Branding",
      "Social media",
      "Warmth",
      "Personality",
      "Emotional connection"
    ]
  }
}