{
  "filename": "chocolate_box_36px.png",
  "status": "success",
  "description": {
    "detailed_description": "Chocolate Box is a charming script font that blends classic calligraphic flourishes with a playful, almost whimsical touch. Its flowing strokes and graceful curves evoke a sense of elegance and sophistication, while the slightly exaggerated swashes and playful ligatures add a touch of personality. The font's construction is based on traditional penmanship techniques, with subtle variations in stroke weight and delicate transitions between curves and straight lines. This attention to detail creates a sense of handcrafted quality, making it ideal for projects that require a touch of warmth and charm. While its elegant nature makes it suitable for formal invitations and branding, its playful elements also lend themselves well to whimsical illustrations, packaging designs, and even social media graphics. The font's overall character evokes a sense of nostalgia, reminiscent of vintage signage and handwritten letters, while its contemporary relevance lies in its ability to add a touch of personality and charm to modern designs.",
    "technical_characteristics": [
      "flowing script style",
      "graceful curves",
      "exaggerated swashes",
      "delicate stroke transitions",
      "traditional penmanship construction"
    ],
    "personality_traits": [
      "charming and playful",
      "elegant and sophisticated",
      "handcrafted quality",
      "nostalgic and vintage",
      "whimsical and expressive"
    ],
    "practical_contexts": [
      "formal invitations and branding",
      "whimsical illustrations",
      "packaging designs",
      "social media graphics",
      "handwritten-style typography"
    ],
    "cultural_intuition": [
      "evokes a sense of nostalgia",
      "reminiscent of vintage signage",
      "suggests a handcrafted aesthetic",
      "captures a playful and charming spirit",
      "adds a touch of personality to modern designs"
    ],
    "search_keywords": [
      "script font",
      "calligraphic",
      "flowing",
      "graceful",
      "swashes",
      "ligatures",
      "vintage",
      "nostalgic",
      "charming",
      "playful",
      "elegant",
      "sophisticated",
      "handcrafted",
      "whimsical",
      "expressive",
      "formal",
      "invitations",
      "branding",
      "illustrations",
      "packaging",
      "social media",
      "typography",
      "design"
    ]
  }
}