{
  "filename": "chubb_36px.png",
  "status": "success",
  "description": {
    "detailed_description": "This font is a playful exploration of inflated letterforms, reminiscent of cartoon lettering or hand-drawn signage. Each character is built with a distinct rounded outline, creating a sense of bouncy, almost three-dimensional volume. The exaggerated curves and generous spacing contribute to a lighthearted and approachable feel, while the consistent stroke weight and clean outlines maintain a sense of clarity and legibility. The font's bold personality makes it ideal for eye-catching headlines, playful branding, or adding a touch of whimsy to digital interfaces. Its exaggerated forms and playful nature evoke a sense of childhood nostalgia, reminiscent of comic books or Saturday morning cartoons. However, its clean execution and clear legibility ensure it remains versatile for a range of applications, from playful branding to eye-catching headlines.",
    "technical_characteristics": [
      "Inflated letterforms",
      "Rounded outlines",
      "Exaggerated curves",
      "Generous spacing",
      "Consistent stroke weight",
      "Clean outlines"
    ],
    "personality_traits": [
      "Playful",
      "Whimsical",
      "Approachable",
      "Bold",
      "Lighthearted",
      "Nostalgic",
      "Fun",
      "Energetic"
    ],
    "practical_contexts": [
      "Headlines",
      "Branding",
      "Digital interfaces",
      "Children's products",
      "Entertainment"
    ],
    "cultural_intuition": [
      "Cartoon lettering",
      "Hand-drawn signage",
      "Childhood nostalgia",
      "Comic book aesthetics",
      "Saturday morning cartoons"
    ],
    "search_keywords": [
      "Inflated",
      "Rounded",
      "Cartoon",
      "Playful",
      "Whimsical",
      "Bold",
      "Nostalgic",
      "Fun",
      "Headlines",
      "Branding",
      "Digital",
      "Children's",
      "Entertainment",
      "Comic",
      "Hand-drawn",
      "Signage"
    ]
  }
}