{
  "filename": "chyld_36px.png",
  "status": "success",
  "description": {
    "detailed_description": "This font is a playful and whimsical display typeface that uses simple linework and charming illustrations to create a sense of childlike wonder. The characters are constructed with a mix of geometric and organic shapes, resulting in a unique and engaging visual style. The font's overall character is lighthearted and friendly, with a touch of nostalgia. The illustrations, which depict children engaged in everyday activities, evoke a sense of innocence and joy. The font's historical influences are evident in its use of simple linework and cartoonish style, reminiscent of early 20th-century children's illustrations. However, the font's contemporary relevance is undeniable, as it taps into the current trend of using playful and expressive typography in digital design. The font's cultural associations are strong, as it evokes a sense of childhood and family, making it ideal for projects that target a young audience or aim to create a warm and inviting atmosphere. The font's intended applications are primarily for display purposes, such as headlines, logos, and branding elements. Its playful nature makes it well-suited for children's books, websites, and packaging. However, its technical limitations include a lack of lowercase characters and limited character set, making it less suitable for extended body text. Despite these limitations, the font's unique character and charming illustrations make it a valuable tool for designers seeking to add a touch of whimsy and personality to their projects.",
    "technical_characteristics": [
      "Simple linework",
      "Geometric and organic shapes",
      "Cartoonish style",
      "Limited character set",
      "No lowercase characters",
      "Display typeface"
    ],
    "personality_traits": [
      "Playful",
      "Whimsical",
      "Lighthearted",
      "Friendly",
      "Nostalgic"
    ],
    "practical_contexts": [
      "Headlines",
      "Logos",
      "Branding elements",
      "Children's books",
      "Websites",
      "Packaging"
    ],
    "cultural_intuition": [
      "Childhood",
      "Family",
      "Innocence",
      "Joy",
      "Nostalgia"
    ],
    "search_keywords": [
      "Display typeface",
      "Whimsical font",
      "Cartoon font",
      "Children's font",
      "Playful font",
      "Nostalgic font",
      "Simple linework",
      "Geometric shapes",
      "Organic shapes",
      "Limited character set",
      "Display typography",
      "Branding",
      "Children's books",
      "Websites",
      "Packaging",
      "Childhood",
      "Family",
      "Innocence",
      "Joy",
      "Nostalgia"
    ]
  }
}