{
  "filename": "circles_and_sticks_36px.png",
  "status": "success",
  "description": {
    "detailed_description": "Circles and Sticks (36px) is a sans-serif typeface that embodies a playful yet refined aesthetic. Its geometric construction, evident in the circular terminals and consistent stroke widths, provides a sense of order and clarity. The font's high x-height and open counters contribute to its excellent legibility, making it suitable for both print and digital applications. The subtle curves in the letterforms, particularly in the lowercase 'a' and 'g', add a touch of warmth and approachability, preventing the font from feeling overly rigid or cold. This balance between geometric precision and organic detail creates a personality that is both modern and timeless, suggesting a sense of playful sophistication. Circles and Sticks (36px) is well-suited for branding, editorial design, and user interfaces, where its clean lines and approachable character can enhance visual communication. The font's contemporary feel, reminiscent of mid-century modern design, evokes a sense of optimism and innovation, making it a versatile choice for projects seeking a fresh and engaging visual identity.",
    "technical_characteristics": [
      "Geometric construction",
      "High x-height",
      "Open counters",
      "Consistent stroke widths",
      "Circular terminals",
      "Subtle curves in letterforms"
    ],
    "personality_traits": [
      "Playful yet refined",
      "Modern and timeless",
      "Approachable",
      "Sophisticated",
      "Clean and engaging"
    ],
    "practical_contexts": [
      "Branding",
      "Editorial design",
      "User interfaces",
      "Print and digital applications",
      "Large and small sizes"
    ],
    "cultural_intuition": [
      "Mid-century modern design",
      "Optimism and innovation",
      "Playful sophistication",
      "Contemporary aesthetic",
      "Digital-native design"
    ],
    "search_keywords": [
      "Geometric sans-serif",
      "High x-height",
      "Open counters",
      "Circular terminals",
      "Playful",
      "Refined",
      "Modern",
      "Timeless",
      "Approachable",
      "Sophisticated",
      "Branding",
      "Editorial design",
      "User interface",
      "Print",
      "Digital",
      "Mid-century modern",
      "Optimism",
      "Innovation",
      "Contemporary",
      "Digital-native"
    ]
  }
}