{
  "filename": "cirkus_36px.png",
  "status": "success",
  "description": {
    "detailed_description": "Circus is a playful script font that balances a classic calligraphic feel with a contemporary digital aesthetic. Its flowing strokes and rounded terminals evoke a sense of whimsy and charm, while its clean construction and consistent weight ensure readability. The font's generous x-height and open counters contribute to its legibility, making it suitable for both display and body text applications. The subtle variations in stroke thickness add a touch of personality, while the overall structure remains balanced and harmonious. Circus's playful nature makes it ideal for branding, packaging, and digital interfaces that require a touch of whimsy and personality. Its vintage-inspired charm evokes a sense of nostalgia and fun, while its contemporary design ensures it remains relevant in today's digital landscape.",
    "technical_characteristics": [
      "flowing script style",
      "rounded terminals",
      "consistent weight",
      "generous x-height",
      "open counters",
      "subtle stroke variations"
    ],
    "personality_traits": [
      "playful",
      "whimsical",
      "charming",
      "readable",
      "vintage-inspired",
      "contemporary"
    ],
    "practical_contexts": [
      "branding",
      "packaging",
      "digital interfaces",
      "display text",
      "body text"
    ],
    "cultural_intuition": [
      "evokes a sense of nostalgia",
      "suggests a fun and playful atmosphere",
      "reflects a contemporary design sensibility"
    ],
    "search_keywords": [
      "script font",
      "playful",
      "whimsical",
      "vintage",
      "contemporary",
      "readable",
      "display",
      "body text",
      "branding",
      "packaging",
      "digital",
      "interface",
      "nostalgia",
      "fun",
      "charm",
      "rounded terminals",
      "generous x-height",
      "open counters",
      "stroke variations",
      "consistent weight",
      "calligraphic",
      "digital aesthetic"
    ]
  }
}