{
  "filename": "cirrus_wisp_36px.png",
  "status": "success",
  "description": {
    "detailed_description": "Cirrus Wisp is a playful script font that captures the essence of handwritten lettering with a touch of contemporary flair. Its organic forms, characterized by flowing strokes and expressive curves, create a sense of movement and energy. The font's irregular baseline and varying letter heights contribute to its natural, hand-drawn aesthetic. While the overall impression is casual and approachable, the font maintains a level of legibility through its clear letterforms and consistent stroke weights. This balance makes it suitable for a wide range of applications, from handwritten notes and social media posts to branding elements and website designs. The font's whimsical nature evokes a sense of warmth and personality, making it ideal for projects that require a touch of charm and authenticity.",
    "technical_characteristics": [
      "Organic forms",
      "Flowing strokes",
      "Expressive curves",
      "Irregular baseline",
      "Varying letter heights",
      "Consistent stroke weights",
      "Clear letterforms"
    ],
    "personality_traits": [
      "Playful",
      "Whimsical",
      "Handwritten",
      "Approachable",
      "Casual",
      "Energetic",
      "Authentic"
    ],
    "practical_contexts": [
      "Handwritten notes",
      "Social media posts",
      "Branding elements",
      "Website designs",
      "Logos and signage"
    ],
    "cultural_intuition": [
      "Evokes a sense of warmth and personality",
      "Suggests a casual and approachable tone",
      "Reflects the trend of handwritten aesthetics in contemporary design",
      "Captures the spirit of authenticity and individuality"
    ],
    "search_keywords": [
      "Script font",
      "Handwritten",
      "Playful",
      "Organic",
      "Flowing",
      "Expressive",
      "Casual",
      "Approachable",
      "Legible",
      "Authentic",
      "Branding",
      "Social media",
      "Website design",
      "Logo",
      "Signage",
      "Hand lettering",
      "Contemporary",
      "Whimsical",
      "Energetic"
    ]
  }
}