{
  "filename": "clarks_summit_36px.png",
  "status": "success",
  "description": {
    "detailed_description": "Clarks Summit PX by Skyhaven Fonts is a playful yet legible script font that captures the essence of casual handwritten typography. Its organic forms, characterized by flowing strokes and subtle variations in weight, create a sense of natural movement and informality. The font's generous x-height and open counters ensure readability even at smaller sizes, making it suitable for both display and body text applications. The slightly irregular baseline and occasional flourishes add a touch of whimsy, while the overall consistency of the letterforms maintains a sense of order and control. This balance between playful informality and controlled legibility makes Clarks Summit PX ideal for projects that require a friendly and approachable tone, such as branding for creative businesses, social media graphics, or handwritten-style invitations. The font's contemporary aesthetic, reminiscent of modern calligraphy and digital brush lettering, resonates with the current trend towards authentic and expressive typography.",
    "technical_characteristics": [
      "Organic forms",
      "Flowing strokes",
      "Variable stroke weight",
      "Generous x-height",
      "Open counters",
      "Slightly irregular baseline",
      "Occasional flourishes"
    ],
    "personality_traits": [
      "Playful",
      "Legible",
      "Casual",
      "Whimsical",
      "Friendly",
      "Approachable",
      "Expressive"
    ],
    "practical_contexts": [
      "Branding for creative businesses",
      "Social media graphics",
      "Handwritten-style invitations",
      "Display text",
      "Body text"
    ],
    "cultural_intuition": [
      "Modern calligraphy",
      "Digital brush lettering",
      "Authentic typography",
      "Expressive design",
      "Contemporary aesthetic"
    ],
    "search_keywords": [
      "Script font",
      "Handwritten font",
      "Playful font",
      "Legible font",
      "Casual font",
      "Whimsical font",
      "Friendly font",
      "Approachable font",
      "Expressive font",
      "Modern calligraphy",
      "Digital brush lettering",
      "Branding",
      "Social media",
      "Invitations",
      "Display text",
      "Body text",
      "Creative businesses",
      "Contemporary design"
    ]
  }
}