{
  "filename": "classic_sketches_36px.png",
  "status": "success",
  "description": {
    "detailed_description": "This font, crafted with a playful yet meticulous hand, presents a unique blend of whimsical charm and graphic clarity. Each character is a miniature illustration, featuring intricate details and a sense of movement. The font's construction is organic, with flowing lines and rounded forms that evoke a sense of warmth and approachability. The characters are carefully balanced, with a consistent weight and a subtle sense of rhythm. The font's overall character is playful and lighthearted, yet it retains a sense of sophistication through its meticulous execution. The font's historical influences are evident in its hand-drawn aesthetic, reminiscent of vintage illustrations and children's books. However, its contemporary relevance is undeniable, with its playful nature and graphic clarity making it ideal for modern digital applications. The font's cultural associations are diverse, ranging from the whimsical charm of vintage cartoons to the playful spirit of contemporary graphic design. Its versatility allows it to be used in a wide range of contexts, from children's books and branding to social media and web design.",
    "technical_characteristics": [
      "Hand-drawn aesthetic",
      "Organic construction",
      "Rounded forms",
      "Intricate details",
      "Consistent weight",
      "Subtle rhythm",
      "Playful character",
      "Graphic clarity"
    ],
    "personality_traits": [
      "Whimsical",
      "Playful",
      "Lighthearted",
      "Approachable",
      "Sophisticated",
      "Charming",
      "Warm",
      "Graphic",
      "Clear"
    ],
    "practical_contexts": [
      "Children's books",
      "Branding",
      "Social media",
      "Web design",
      "Packaging",
      "Illustration",
      "Display typography"
    ],
    "cultural_intuition": [
      "Vintage cartoons",
      "Children's books",
      "Contemporary graphic design",
      "Playful spirit",
      "Whimsical charm"
    ],
    "search_keywords": [
      "Hand-drawn",
      "Organic",
      "Rounded",
      "Intricate",
      "Playful",
      "Whimsical",
      "Charming",
      "Graphic",
      "Clear",
      "Vintage",
      "Contemporary",
      "Children's",
      "Branding",
      "Social media",
      "Web design",
      "Illustration",
      "Display",
      "Typography"
    ]
  }
}