{
  "filename": "claudio_the_cat_36px.png",
  "status": "success",
  "description": {
    "detailed_description": "This font exhibits a playful and expressive character, achieved through a combination of organic forms and deliberate imperfections. The letterforms are constructed with a loose, hand-drawn aesthetic, featuring rounded corners, uneven strokes, and a slight wobble in the baseline. This intentional irregularity creates a sense of warmth and personality, reminiscent of handwritten notes or sketches. The generous x-height and open counters ensure good legibility, even at smaller sizes, making it suitable for both display and body text applications. The font's overall mood is lighthearted and approachable, suggesting a sense of creativity and individuality. It would be well-suited for projects that aim to convey a friendly and informal tone, such as branding for small businesses, social media graphics, or playful editorial designs. The font's cultural resonance lies in its connection to contemporary trends of authenticity and hand-crafted aesthetics, reflecting a desire for genuine expression in a digital world.",
    "technical_characteristics": [
      "Hand-drawn aesthetic",
      "Rounded corners",
      "Uneven strokes",
      "Wobbly baseline",
      "Generous x-height",
      "Open counters"
    ],
    "personality_traits": [
      "Playful",
      "Expressive",
      "Warm",
      "Approachable",
      "Creative",
      "Individualistic",
      "Informal"
    ],
    "practical_contexts": [
      "Branding for small businesses",
      "Social media graphics",
      "Playful editorial designs",
      "Handwritten notes",
      "Sketch-like illustrations"
    ],
    "cultural_intuition": [
      "Authenticity",
      "Hand-crafted aesthetics",
      "Genuine expression",
      "Contemporary design trends",
      "Digital-native design"
    ],
    "search_keywords": [
      "Hand-drawn",
      "Playful",
      "Expressive",
      "Informal",
      "Rounded",
      "Organic",
      "Wobbly",
      "Generous x-height",
      "Open counters",
      "Legible",
      "Display font",
      "Body text",
      "Branding",
      "Social media",
      "Editorial",
      "Authenticity",
      "Hand-crafted",
      "Contemporary",
      "Digital"
    ]
  }
}