{
  "filename": "clouds_mix_36px.png",
  "status": "success",
  "description": {
    "detailed_description": "This font's stark geometric construction, with its perfectly square forms and sharp corners, immediately evokes a sense of order and precision. The uniform stroke weight and lack of any embellishment contribute to a clean, uncluttered aesthetic. The x-height is relatively high, ensuring strong legibility even at small sizes. The open counters and consistent spacing between letters further enhance readability, making it suitable for both print and digital applications. While the overall impression is one of starkness and simplicity, the font's bold, confident presence suggests a sense of authority and power. It's a font that commands attention, making it ideal for headlines, branding, and other applications where a strong visual impact is desired. Its minimalist design and lack of stylistic flourishes make it a versatile choice for a wide range of projects, from corporate identity to contemporary design.",
    "technical_characteristics": [
      "Geometric construction",
      "Square forms",
      "Sharp corners",
      "Uniform stroke weight",
      "High x-height",
      "Open counters",
      "Consistent spacing"
    ],
    "personality_traits": [
      "Stark",
      "Clean",
      "Uncluttered",
      "Bold",
      "Confident",
      "Authoritative",
      "Powerful"
    ],
    "practical_contexts": [
      "Headlines",
      "Branding",
      "Logos",
      "Digital interfaces",
      "Large-scale signage"
    ],
    "cultural_intuition": [
      "Modernist design",
      "Minimalist aesthetic",
      "Digital-native style",
      "Sense of authority",
      "Evokes a sense of order and precision"
    ],
    "search_keywords": [
      "Geometric",
      "Square",
      "Sharp",
      "Uniform",
      "High x-height",
      "Open counters",
      "Consistent spacing",
      "Bold",
      "Confident",
      "Authoritative",
      "Powerful",
      "Minimalist",
      "Modernist",
      "Digital",
      "Branding",
      "Headlines",
      "Signage"
    ]
  }
}