{
  "filename": "coco_hand_36px.png",
  "status": "success",
  "description": {
    "detailed_description": "Coco Hand (36px) is a script font that captures the essence of casual handwritten typography. Its flowing strokes and natural variations in letterforms create a sense of authenticity and immediacy. The font's organic construction, with its subtle curves and angled connections, evokes a sense of personal expression. The x-height is relatively high, ensuring good legibility even at smaller sizes. The open counters and generous spacing between letters contribute to its readability, making it suitable for both short and long blocks of text. The font's overall character is friendly and approachable, suggesting a sense of warmth and informality. It's reminiscent of handwritten notes or personal correspondence, conveying a sense of intimacy and authenticity. Coco Hand (36px) is well-suited for projects that require a touch of personality and a sense of human connection. It can be used for branding, social media graphics, invitations, and other applications where a casual and approachable aesthetic is desired. The font's cultural resonance lies in its ability to evoke a sense of nostalgia for handwritten communication, while its contemporary relevance stems from its ability to convey authenticity and personality in a digital world.",
    "technical_characteristics": [
      "Organic construction",
      "Flowing strokes",
      "Natural variations in letterforms",
      "High x-height",
      "Open counters",
      "Generous spacing",
      "Subtle curves",
      "Angled connections"
    ],
    "personality_traits": [
      "Casual",
      "Authentic",
      "Friendly",
      "Approachable",
      "Intimate",
      "Warm",
      "Informal",
      "Expressive",
      "Personal"
    ],
    "practical_contexts": [
      "Branding",
      "Social media graphics",
      "Invitations",
      "Personal correspondence",
      "Short blocks of text",
      "Long blocks of text"
    ],
    "cultural_intuition": [
      "Nostalgia for handwritten communication",
      "Authenticity in a digital world",
      "Personal expression",
      "Intimacy and connection",
      "Casual and approachable aesthetic"
    ],
    "search_keywords": [
      "script font",
      "handwritten font",
      "casual font",
      "friendly font",
      "approachable font",
      "organic font",
      "flowing font",
      "high x-height",
      "open counters",
      "generous spacing",
      "branding",
      "social media",
      "invitations",
      "personal correspondence",
      "nostalgia",
      "authenticity",
      "digital",
      "expression",
      "intimacy",
      "connection"
    ]
  }
}