{
  "filename": "coffee_&_curry_shop_g_36px.png",
  "status": "success",
  "description": {
    "detailed_description": "This font, with its rounded, almost cartoonish letterforms, embodies a playful and approachable aesthetic. The generous curves and open counters create a sense of warmth and friendliness, while the bold weight adds a touch of confidence. The construction is primarily geometric, with each letterform built from simple, recognizable shapes, but the slight variations in stroke thickness and the subtle curves in the terminals add a touch of humanism. This balance between geometric precision and organic detail makes the font feel both modern and timeless. Its legibility is excellent, even at smaller sizes, making it suitable for a wide range of applications, from headlines and logos to packaging and signage. The font's overall character evokes a sense of fun and optimism, making it ideal for projects that aim to engage and connect with audiences on an emotional level. It's a font that feels both familiar and fresh, capable of adding a touch of personality to any design.",
    "technical_characteristics": [
      "Rounded letterforms",
      "Open counters",
      "Bold weight",
      "Geometric construction",
      "Slight variations in stroke thickness",
      "Subtle curves in terminals"
    ],
    "personality_traits": [
      "Playful",
      "Approachable",
      "Warm",
      "Friendly",
      "Confident",
      "Modern",
      "Timeless"
    ],
    "practical_contexts": [
      "Headlines",
      "Logos",
      "Packaging",
      "Signage",
      "Display typography"
    ],
    "cultural_intuition": [
      "Evokes a sense of fun and optimism",
      "Feels both familiar and fresh",
      "Suggests a playful and approachable brand personality"
    ],
    "search_keywords": [
      "Rounded",
      "Bold",
      "Geometric",
      "Playful",
      "Friendly",
      "Approachable",
      "Modern",
      "Timeless",
      "Legible",
      "Headlines",
      "Logos",
      "Packaging",
      "Signage",
      "Display",
      "Cartoonish",
      "Optimistic",
      "Fun",
      "Warm",
      "Friendly",
      "Confident",
      "Approachable",
      "Modern",
      "Timeless",
      "Legible",
      "Headlines",
      "Logos",
      "Packaging",
      "Signage",
      "Display"
    ]
  }
}