{
  "filename": "coire_36px.png",
  "status": "success",
  "description": {
    "detailed_description": "This font embodies a casual, handwritten aesthetic with a touch of playful energy. Its flowing strokes and irregular letterforms evoke the spontaneity of personal writing, while the consistent baseline and overall legibility suggest a degree of intentional design. The font's character is further enhanced by the subtle variations in stroke weight, creating a sense of natural rhythm and movement. While the overall impression is relaxed and informal, the font's clear structure and well-defined forms ensure readability even in smaller sizes. This makes it suitable for a range of applications, from casual social media posts to branding for creative businesses seeking a friendly and approachable tone. The font's cultural resonance lies in its connection to the handwritten note, a symbol of personal connection and authenticity, while its contemporary relevance is evident in its use across digital platforms, where it adds a touch of human warmth to otherwise sterile interfaces.",
    "technical_characteristics": [
      "Handwritten style",
      "Variable stroke weight",
      "Flowing strokes",
      "Irregular letterforms",
      "Consistent baseline",
      "Open counters",
      "Well-defined forms"
    ],
    "personality_traits": [
      "Casual",
      "Playful",
      "Spontaneous",
      "Friendly",
      "Approachable",
      "Informal",
      "Authentic"
    ],
    "practical_contexts": [
      "Social media posts",
      "Branding for creative businesses",
      "Website headers",
      "Short text blocks",
      "Casual signage"
    ],
    "cultural_intuition": [
      "Handwritten note",
      "Personal connection",
      "Authenticity",
      "Digital warmth",
      "Human touch"
    ],
    "search_keywords": [
      "Handwritten",
      "Script",
      "Casual",
      "Playful",
      "Informal",
      "Friendly",
      "Approachable",
      "Social media",
      "Branding",
      "Website",
      "Digital",
      "Authentic",
      "Note",
      "Connection",
      "Warmth",
      "Legible",
      "Readable",
      "Flowing",
      "Irregular",
      "Variable stroke weight",
      "Open counters",
      "Well-defined forms",
      "Consistent baseline"
    ]
  }
}