{
  "filename": "comic_dandy_36px.png",
  "status": "success",
  "description": {
    "detailed_description": "Comic Bandy FX is a display typeface that embodies a playful, almost cartoonish energy. Its bold, blocky letterforms are built with a distinct geometric construction, featuring sharp angles and abrupt transitions. The font's high x-height and open counters contribute to its strong legibility, even at smaller sizes. The overall effect is one of confident, almost aggressive energy, reminiscent of vintage comic book lettering. This bold personality makes it ideal for headlines, logos, and other applications where a strong visual impact is desired. While its geometric construction suggests a sense of order and structure, the playful angles and exaggerated forms inject a sense of whimsy and irreverence. This duality makes it suitable for a wide range of projects, from children's books to edgy branding campaigns. The font's bold, graphic nature also lends itself well to digital applications, particularly in web design and mobile interfaces.",
    "technical_characteristics": [
      "Geometric construction",
      "Sharp angles",
      "Abrupt transitions",
      "High x-height",
      "Open counters",
      "Bold weight",
      "Blocky letterforms"
    ],
    "personality_traits": [
      "Playful",
      "Bold",
      "Energetic",
      "Whimsical",
      "Confident",
      "Aggressive",
      "Graphic"
    ],
    "practical_contexts": [
      "Headlines",
      "Logos",
      "Posters",
      "Children's books",
      "Branding",
      "Web design",
      "Mobile interfaces"
    ],
    "cultural_intuition": [
      "Vintage comic book lettering",
      "Pop art aesthetic",
      "Retrofuturism",
      "Digital-native design",
      "Playful and irreverent"
    ],
    "search_keywords": [
      "Geometric",
      "Display",
      "Bold",
      "Blocky",
      "Sharp",
      "High x-height",
      "Open counters",
      "Comic book",
      "Cartoon",
      "Playful",
      "Energetic",
      "Whimsical",
      "Retro",
      "Digital",
      "Web",
      "Mobile",
      "Branding",
      "Headline",
      "Logo",
      "Poster"
    ]
  }
}