{
  "filename": "comic_shark_36px.png",
  "status": "success",
  "description": {
    "detailed_description": "Comic Shark is a display typeface that embodies the playful energy of classic comic book lettering. Its bold, rounded forms and exaggerated curves create a sense of dynamic movement, reminiscent of the iconic lettering styles of the Golden Age of comics. The font's construction is characterized by a combination of geometric and organic elements, with rounded corners and exaggerated curves giving it a playful and approachable feel. The high x-height and open counters ensure strong legibility, even at smaller sizes, making it suitable for headlines and short bursts of text. The font's exaggerated letterforms and bold weight create a sense of excitement and energy, making it ideal for projects that require a fun and engaging visual style. Its playful nature and bold presence make it a perfect choice for branding, packaging, and digital interfaces that aim to capture a sense of youthful energy and irreverence. The font's cultural associations with comic books and pop culture make it a powerful tool for evoking nostalgia and a sense of playful fun.",
    "technical_characteristics": [
      "Rounded corners",
      "Exaggerated curves",
      "High x-height",
      "Open counters",
      "Bold weight",
      "Geometric construction",
      "Organic elements"
    ],
    "personality_traits": [
      "Playful",
      "Energetic",
      "Bold",
      "Approachable",
      "Dynamic",
      "Fun",
      "Irreverent"
    ],
    "practical_contexts": [
      "Headlines",
      "Short bursts of text",
      "Branding",
      "Packaging",
      "Digital interfaces"
    ],
    "cultural_intuition": [
      "Golden Age of comics",
      "Pop culture",
      "Nostalgia",
      "Playful fun",
      "Youthful energy"
    ],
    "search_keywords": [
      "Comic book",
      "Display typeface",
      "Rounded corners",
      "Exaggerated curves",
      "High x-height",
      "Open counters",
      "Bold weight",
      "Geometric construction",
      "Organic elements",
      "Playful",
      "Energetic",
      "Fun",
      "Irreverent",
      "Headlines",
      "Branding",
      "Packaging",
      "Digital interfaces",
      "Nostalgia",
      "Pop culture"
    ]
  }
}