{
  "filename": "concrete_wall_36px.png",
  "status": "success",
  "description": {
    "detailed_description": "Concrete Wall is a display typeface that embodies a playful yet robust aesthetic. Its bold, chunky letterforms are reminiscent of hand-painted signage, with a distinct, almost eroded quality. The rounded corners and slightly uneven stroke widths contribute to a sense of casualness and informality, while the overall structure remains strong and legible. The font's generous x-height and open counters ensure readability even at large sizes, making it suitable for headlines and branding elements. The playful nature of the font suggests a sense of fun and approachability, while its bold presence conveys confidence and strength. Concrete Wall's unique character makes it ideal for projects that require a touch of personality and a nod to vintage aesthetics, particularly in the realm of street art, branding, and graphic design.",
    "technical_characteristics": [
      "Bold, chunky letterforms",
      "Rounded corners",
      "Uneven stroke widths",
      "Generous x-height",
      "Open counters",
      "Distinctive, almost eroded quality"
    ],
    "personality_traits": [
      "Playful",
      "Robust",
      "Casual",
      "Informal",
      "Confident",
      "Approachable",
      "Strong",
      "Legible"
    ],
    "practical_contexts": [
      "Headlines",
      "Branding elements",
      "Posters",
      "Signage",
      "Street art"
    ],
    "cultural_intuition": [
      "Evokes vintage signage and street art aesthetics",
      "Suggests a sense of fun and approachability",
      "Conveys a sense of confidence and strength",
      "Reflects a contemporary appreciation for hand-crafted aesthetics"
    ],
    "search_keywords": [
      "display typeface",
      "bold",
      "chunky",
      "rounded corners",
      "uneven stroke widths",
      "eroded",
      "generous x-height",
      "open counters",
      "legible",
      "playful",
      "robust",
      "casual",
      "informal",
      "confident",
      "approachable",
      "street art",
      "signage",
      "branding",
      "vintage",
      "hand-crafted",
      "contemporary"
    ]
  }
}