{
  "filename": "conviva_36px.png",
  "status": "success",
  "description": {
    "detailed_description": "Convivx is a playful and energetic script font that captures the essence of hand-drawn lettering. Its irregular letterforms, with their varying stroke widths and expressive curves, evoke a sense of spontaneity and individuality. The font's loose construction, characterized by inconsistent baseline alignment and occasional overlaps, further enhances its casual and informal feel. While the overall impression is one of carefree energy, Convivx maintains a degree of legibility through its clear letter shapes and generous counter spaces. This balance makes it suitable for a range of applications, from casual social media posts to eye-catching headlines and branding elements. The font's inherent dynamism and youthful energy resonate with contemporary digital culture, suggesting a sense of creativity and authenticity.",
    "technical_characteristics": [
      "Irregular letterforms",
      "Varying stroke widths",
      "Expressive curves",
      "Loose construction",
      "Inconsistent baseline alignment",
      "Occasional overlaps",
      "Clear letter shapes",
      "Generous counter spaces"
    ],
    "personality_traits": [
      "Playful",
      "Energetic",
      "Spontaneous",
      "Individualistic",
      "Casual",
      "Informal",
      "Dynamic",
      "Youthful"
    ],
    "practical_contexts": [
      "Social media posts",
      "Headlines",
      "Branding elements",
      "Casual signage",
      "Digital illustrations"
    ],
    "cultural_intuition": [
      "Hand-drawn aesthetic",
      "Contemporary digital culture",
      "Creative expression",
      "Authenticity",
      "Youthful energy"
    ],
    "search_keywords": [
      "Script font",
      "Hand-drawn",
      "Playful",
      "Energetic",
      "Casual",
      "Informal",
      "Digital",
      "Social media",
      "Branding",
      "Headline",
      "Illustration",
      "Graphic design",
      "Typography",
      "Lettering",
      "Convivx"
    ]
  }
}