{
  "filename": "cosmic_bats_36px.png",
  "status": "success",
  "description": {
    "detailed_description": "Cosmic Bats Gothic is a bold and angular typeface that draws inspiration from medieval blackletter styles, but with a distinctly modern edge. Its sharp, pointed serifs and dramatic ascenders and descenders create a sense of intensity and power, while the overall construction is geometric and precise, lending a sense of order and control. The font's high x-height and open counters ensure strong legibility, even at small sizes, making it suitable for both display and body text applications. The font's bold character and dramatic forms make it ideal for projects that require a strong visual impact, such as branding, posters, and headlines. However, its sharp angles and aggressive forms may not be suitable for all applications, particularly those requiring a more delicate or refined aesthetic. The font's cultural associations are complex, drawing on both historical and contemporary influences. Its blackletter roots evoke a sense of tradition and authority, while its sharp, angular forms suggest a more modern, edgy sensibility. This combination of historical and contemporary elements makes Cosmic Bats Gothic a versatile typeface that can be used to create a wide range of visual effects.",
    "technical_characteristics": [
      "Geometric construction",
      "Sharp, pointed serifs",
      "High x-height",
      "Open counters",
      "Dramatic ascenders and descenders",
      "Bold weight",
      "Angular forms"
    ],
    "personality_traits": [
      "Intense",
      "Powerful",
      "Bold",
      "Dramatic",
      "Geometric",
      "Modern",
      "Edgy"
    ],
    "practical_contexts": [
      "Branding",
      "Posters",
      "Headlines",
      "Display text",
      "Body text (in limited applications)"
    ],
    "cultural_intuition": [
      "Medieval blackletter influence",
      "Modern, edgy sensibility",
      "Gothic aesthetic",
      "Power and authority",
      "Intrigue and mystery"
    ],
    "search_keywords": [
      "Blackletter",
      "Gothic",
      "Bold",
      "Angular",
      "Geometric",
      "Sharp",
      "Pointed",
      "High x-height",
      "Open counters",
      "Dramatic",
      "Intense",
      "Powerful",
      "Modern",
      "Edgy",
      "Branding",
      "Posters",
      "Headlines",
      "Display",
      "Body text",
      "Intrigue",
      "Mystery",
      "Authority",
      "Tradition"
    ]
  }
}