{
  "filename": "cracked_johnnie_36px.png",
  "status": "success",
  "description": {
    "detailed_description": "Cracked Johnnie is a bold, expressive script font that captures the energy of hand-drawn lettering. Its irregular, gestural strokes and exaggerated letterforms create a sense of immediacy and authenticity. The font's construction is based on a loose, organic approach, with varying stroke weights and uneven letter spacing. This deliberate imperfection adds to its raw, unpolished character. The font's personality is both playful and rebellious, suggesting a sense of youthful energy and a disregard for traditional typographic rules. It's ideal for projects that require a bold, attention-grabbing aesthetic, such as branding for streetwear, music, or edgy lifestyle products. The font's cultural associations lean towards contemporary street art and DIY aesthetics, evoking a sense of underground creativity and counterculture. However, its versatility allows it to be used in a variety of contexts, from casual social media posts to more formal graphic design applications, as long as the overall tone remains energetic and informal.",
    "technical_characteristics": [
      "Irregular stroke weights",
      "Exaggerated letterforms",
      "Uneven letter spacing",
      "Organic construction",
      "Gestural strokes"
    ],
    "personality_traits": [
      "Bold and expressive",
      "Playful and rebellious",
      "Energetic and informal",
      "Raw and unpolished",
      "Authentic and immediate"
    ],
    "practical_contexts": [
      "Streetwear branding",
      "Music and entertainment",
      "Social media graphics",
      "Edgy lifestyle products",
      "Casual and informal designs"
    ],
    "cultural_intuition": [
      "Contemporary street art",
      "DIY aesthetics",
      "Underground creativity",
      "Counterculture",
      "Youthful energy"
    ],
    "search_keywords": [
      "script font",
      "hand-drawn",
      "bold",
      "expressive",
      "irregular",
      "gestural",
      "streetwear",
      "music",
      "lifestyle",
      "underground",
      "DIY",
      "counterculture",
      "youthful",
      "energetic",
      "informal",
      "casual",
      "graphic design",
      "branding",
      "social media",
      "display font",
      "title font",
      "headline font",
      "graffiti",
      "urban",
      "rebellious",
      "authentic",
      "raw",
      "unpolished",
      "imperfect",
      "organic",
      "loose",
      "handwritten",
      "sketchy",
      "grunge",
      "punk",
      "alternative",
      "modern",
      "contemporary"
    ]
  }
}