{
  "filename": "craftylover_36px.png",
  "status": "success",
  "description": {
    "detailed_description": "Craftylover (36px) is a script font that embodies a charmingly casual aesthetic. Its flowing strokes and organic forms evoke the spontaneity of handwritten calligraphy, while its consistent letterforms and well-defined curves ensure legibility. The font's generous x-height and open counters contribute to its readability, even at smaller sizes. The subtle variations in stroke weight add a touch of visual interest, creating a sense of movement and dynamism. Craftylover's overall character is playful and approachable, suggesting a friendly and informal tone. Its historical influences are evident in its calligraphic origins, drawing inspiration from traditional script styles. However, its contemporary relevance lies in its versatility, making it suitable for a wide range of applications, from social media graphics to branding and packaging. The font's cultural associations are rooted in its connection to handwritten communication, evoking a sense of authenticity and personal touch. Its playful nature makes it ideal for projects that require a lighthearted and engaging feel, while its legibility ensures that it can be used effectively in both digital and print media.",
    "technical_characteristics": [
      "Calligraphic construction",
      "Organic forms",
      "Generous x-height",
      "Open counters",
      "Variable stroke weight",
      "Consistent letterforms",
      "Well-defined curves"
    ],
    "personality_traits": [
      "Playful",
      "Approachable",
      "Casual",
      "Friendly",
      "Informal",
      "Dynamic",
      "Charming"
    ],
    "practical_contexts": [
      "Social media graphics",
      "Branding",
      "Packaging",
      "Invitations",
      "Website headers"
    ],
    "cultural_intuition": [
      "Handwritten communication",
      "Authenticity",
      "Personal touch",
      "Modern calligraphy",
      "Informal design"
    ],
    "search_keywords": [
      "Script font",
      "Calligraphy",
      "Handwritten",
      "Casual",
      "Playful",
      "Approachable",
      "Friendly",
      "Informal",
      "Dynamic",
      "Legible",
      "Versatile",
      "Social media",
      "Branding",
      "Packaging",
      "Invitations",
      "Website headers",
      "Modern",
      "Contemporary",
      "Authentic",
      "Personal touch"
    ]
  }
}