{
  "filename": "crappy_clothing_36px.png",
  "status": "success",
  "description": {
    "detailed_description": "This font, aptly named \"Crappy Clothing\", embodies a raw, unrefined aesthetic. Its construction is decidedly hand-drawn, with each letterform exhibiting a distinct, almost chaotic, stroke variation. The irregular line weights and jagged terminals create a sense of immediacy and spontaneity, reminiscent of a quick sketch or a hastily scribbled note. This lack of precision, however, doesn't detract from its legibility, as the overall form of each letter remains clear and recognizable. The font's personality is undeniably edgy and rebellious, with a grunge-inspired vibe that speaks to a countercultural spirit. It evokes a sense of DIY punk rock, with its rough edges and unpolished charm. While its intended application is likely for display purposes, particularly in the realm of streetwear and alternative fashion, its bold and expressive nature could also find a place in digital contexts, such as website headers or social media graphics. The font's cultural resonance lies in its connection to subcultures that embrace authenticity and individuality, suggesting a rejection of polished perfection in favor of raw expression.",
    "technical_characteristics": [
      "Hand-drawn construction",
      "Irregular line weights",
      "Jagged terminals",
      "Open counters",
      "Variable stroke widths"
    ],
    "personality_traits": [
      "Raw and unrefined",
      "Edgy and rebellious",
      "Grunge-inspired",
      "DIY aesthetic",
      "Bold and expressive"
    ],
    "practical_contexts": [
      "Streetwear and alternative fashion",
      "Display typography",
      "Website headers",
      "Social media graphics",
      "Limited-use text"
    ],
    "cultural_intuition": [
      "Countercultural spirit",
      "Punk rock aesthetic",
      "DIY ethos",
      "Authenticity and individuality",
      "Rejection of polished perfection"
    ],
    "search_keywords": [
      "Hand-drawn",
      "Grunge",
      "Punk",
      "Streetwear",
      "Display",
      "Alternative",
      "Rebellious",
      "Raw",
      "Unrefined",
      "Chaotic",
      "Spontaneous",
      "Edgy",
      "Bold",
      "Expressive",
      "DIY",
      "Counterculture",
      "Authenticity",
      "Individuality"
    ]
  }
}