{
  "filename": "crash_scene_36px.png",
  "status": "success",
  "description": {
    "detailed_description": "Font Crash Scene PX by Omen Type is a bold, angular display typeface that draws inspiration from both classic sci-fi aesthetics and contemporary digital culture. Its construction is based on a geometric framework, with each letterform meticulously crafted to create a sense of sharp, futuristic energy. The extreme slant and exaggerated angles give the font a dynamic, almost kinetic feel, while the heavy weight and consistent stroke width ensure strong legibility even at small sizes. This combination of technical precision and expressive design makes Font Crash Scene PX ideal for headlines, logos, and other applications where a powerful visual impact is desired. The font's bold, angular forms evoke a sense of futuristic technology and cyberpunk aesthetics, while its sharp, clean lines suggest a sense of order and control. This duality makes it suitable for a wide range of projects, from edgy gaming interfaces to high-impact branding campaigns. However, its strong personality and limited character set may limit its use in extended body copy or more traditional design contexts.",
    "technical_characteristics": [
      "Geometric construction",
      "Extreme slant",
      "Exaggerated angles",
      "Heavy weight",
      "Consistent stroke width",
      "Sharp terminals",
      "Open counters"
    ],
    "personality_traits": [
      "Bold",
      "Angular",
      "Dynamic",
      "Kinetic",
      "Futuristic",
      "Edgy",
      "Powerful",
      "High-impact",
      "Modern",
      "Digital",
      "Cyberpunk"
    ],
    "practical_contexts": [
      "Headlines",
      "Logos",
      "Posters",
      "Gaming interfaces",
      "Branding campaigns",
      "Short text displays"
    ],
    "cultural_intuition": [
      "Sci-fi aesthetics",
      "Cyberpunk culture",
      "Futuristic technology",
      "Digital design",
      "Modern urban environments"
    ],
    "search_keywords": [
      "Geometric",
      "Slant",
      "Angular",
      "Bold",
      "Heavy",
      "Display",
      "Headline",
      "Logo",
      "Sci-fi",
      "Cyberpunk",
      "Futuristic",
      "Modern",
      "Digital",
      "Gaming",
      "Branding",
      "Poster",
      "Techno",
      "Tech",
      "Interface",
      "Urban",
      "Streetwear",
      "Graphic",
      "Design",
      "Typography",
      "Font"
    ]
  }
}