{
  "filename": "crazy_smile_36px.png",
  "status": "success",
  "description": {
    "detailed_description": "This font is a playful exploration of expressive typography, using simple, hand-drawn elements to create a range of emotive faces. The construction is loose and organic, with varying stroke weights and inconsistent letterforms that contribute to its whimsical character. The overall mood is lighthearted and approachable, evoking a sense of childlike wonder and spontaneous creativity. While the font's technical limitations make it unsuitable for extended text, its unique personality makes it ideal for short messages, social media graphics, and playful branding. The font's cultural resonance lies in its connection to contemporary digital communication, where emojis and expressive imagery are commonplace. It captures the spirit of online interaction, where humor and personality are valued above formal precision.",
    "technical_characteristics": [
      "Hand-drawn style",
      "Variable stroke weights",
      "Inconsistent letterforms",
      "Open counters",
      "Expressive glyphs"
    ],
    "personality_traits": [
      "Playful",
      "Whimsical",
      "Spontaneous",
      "Approachable",
      "Emotive"
    ],
    "practical_contexts": [
      "Short messages",
      "Social media graphics",
      "Playful branding",
      "Children's books",
      "Informal communication"
    ],
    "cultural_intuition": [
      "Contemporary digital communication",
      "Emoji culture",
      "Online interaction",
      "Spontaneous expression",
      "Childlike wonder"
    ],
    "search_keywords": [
      "Hand-drawn",
      "Expressive",
      "Playful",
      "Whimsical",
      "Emotive",
      "Informal",
      "Social media",
      "Emoji",
      "Digital",
      "Contemporary",
      "Graphic design",
      "Branding",
      "Children's",
      "Typography",
      "Font"
    ]
  }
}