{
  "filename": "creamy_love_36px.png",
  "status": "success",
  "description": {
    "detailed_description": "This script font embodies a playful yet sophisticated aesthetic, drawing inspiration from both traditional calligraphy and contemporary hand-lettering trends. Its flowing strokes and organic forms create a sense of movement and energy, while the carefully balanced proportions and consistent letterforms ensure readability. The font's distinctive features include its generous x-height, which enhances legibility, and its subtly rounded terminals, which add a touch of warmth and approachability. The overall effect is a font that feels both casual and elegant, making it suitable for a wide range of applications, from branding and packaging to social media graphics and website design. Its versatility stems from its ability to convey a sense of personality and charm without sacrificing professionalism. The font's cultural resonance lies in its ability to evoke a sense of handcrafted authenticity, reminiscent of handwritten notes and personalized messages. This connection to human touch adds a layer of warmth and intimacy to any design project, making it ideal for brands seeking to establish a connection with their audience on a personal level.",
    "technical_characteristics": [
      "flowing strokes",
      "organic forms",
      "generous x-height",
      "subtly rounded terminals",
      "consistent letterforms",
      "balanced proportions",
      "consistent weight"
    ],
    "personality_traits": [
      "playful",
      "sophisticated",
      "energetic",
      "approachable",
      "casual",
      "elegant",
      "versatile",
      "authentic"
    ],
    "practical_contexts": [
      "branding",
      "packaging",
      "social media graphics",
      "website design",
      "handwritten notes",
      "personalized messages",
      "invitations",
      "greeting cards"
    ],
    "cultural_intuition": [
      "handcrafted authenticity",
      "personal touch",
      "contemporary hand-lettering",
      "traditional calligraphy",
      "modern design aesthetic"
    ],
    "search_keywords": [
      "script font",
      "handwritten",
      "flowing",
      "organic",
      "playful",
      "sophisticated",
      "legible",
      "versatile",
      "branding",
      "packaging",
      "social media",
      "website design",
      "authentic",
      "modern",
      "casual",
      "elegant",
      "hand-lettering",
      "calligraphy",
      "contemporary",
      "traditional"
    ]
  }
}