{
  "filename": "crime_scene_36px.png",
  "status": "success",
  "description": {
    "detailed_description": "Crime Scene is a display typeface that embodies a raw, distressed aesthetic. Its bold, chunky letterforms are heavily stylized with jagged edges and rough textures, creating a sense of urgency and chaos. The font's construction is based on a geometric foundation, with sharp angles and consistent stroke widths, but the deliberate imperfections and distressed details inject a sense of grit and realism. The high x-height and open counters ensure legibility even at smaller sizes, while the exaggerated serifs and dramatic swashes add a touch of theatricality. Crime Scene's personality is undeniably bold and edgy, evoking a sense of danger and intrigue. It's a font that demands attention, suggesting a narrative of crime, mystery, or rebellion. Its practical applications lie in creating impactful headlines, branding for edgy products, or adding a gritty touch to graphic design projects. The font's distressed nature makes it particularly effective for creating a sense of urgency or danger, while its bold character lends itself to eye-catching displays. However, its heavy weight and intricate details may limit its use in smaller sizes or for extended text blocks. Crime Scene's cultural resonance lies in its association with urban street art, punk rock aesthetics, and the visual language of crime thrillers. It evokes a sense of rebellion and nonconformity, tapping into a contemporary fascination with the dark and the edgy.",
    "technical_characteristics": [
      "Geometric construction",
      "Heavy weight",
      "Jagged edges",
      "Distressed textures",
      "High x-height",
      "Open counters",
      "Exaggerated serifs",
      "Dramatic swashes"
    ],
    "personality_traits": [
      "Bold",
      "Edgy",
      "Gritty",
      "Urgent",
      "Intriguing",
      "Theatrical",
      "Rebellious",
      "Nonconformist"
    ],
    "practical_contexts": [
      "Headlines",
      "Branding",
      "Graphic design",
      "Posters",
      "Promotional materials"
    ],
    "cultural_intuition": [
      "Urban street art",
      "Punk rock aesthetics",
      "Crime thrillers",
      "Rebellion",
      "Nonconformity"
    ],
    "search_keywords": [
      "Display typeface",
      "Distressed",
      "Geometric",
      "Heavy weight",
      "Jagged edges",
      "Rough textures",
      "High x-height",
      "Open counters",
      "Exaggerated serifs",
      "Dramatic swashes",
      "Bold",
      "Edgy",
      "Gritty",
      "Urgent",
      "Intriguing",
      "Theatrical",
      "Rebellious",
      "Nonconformist",
      "Headlines",
      "Branding",
      "Graphic design",
      "Posters",
      "Promotional materials",
      "Urban street art",
      "Punk rock",
      "Crime thriller"
    ]
  }
}