{
  "filename": "crossed_hearts_36px.png",
  "status": "success",
  "description": {
    "detailed_description": "Crossed Hearts is a display typeface that embodies a playful yet confident spirit. Its geometric construction, evident in the sharp angles and consistent stroke widths, creates a sense of order and clarity. The bold, three-dimensional effect, achieved through a double outline and subtle shadow, adds a dynamic and eye-catching dimension. This combination of geometric precision and playful dimensionality gives the font a unique character, balancing a sense of retro nostalgia with a modern, almost futuristic edge. The font's legibility is enhanced by its open counters and generous x-height, making it suitable for headlines and branding elements where impact and readability are paramount. While its bold nature makes it ideal for large-scale applications, it can also be used effectively in smaller sizes for digital interfaces, adding a touch of personality and visual interest. Crossed Hearts evokes a sense of playful energy and retro charm, reminiscent of 1980s arcade games and futuristic sci-fi aesthetics. Its bold, graphic nature suggests a sense of fun and adventure, making it a perfect choice for projects that aim to capture a sense of excitement and dynamism.",
    "technical_characteristics": [
      "Geometric construction",
      "Bold, three-dimensional effect",
      "Double outline",
      "Subtle shadow",
      "Open counters",
      "Generous x-height",
      "Consistent stroke widths",
      "Sharp angles"
    ],
    "personality_traits": [
      "Playful",
      "Confident",
      "Dynamic",
      "Retro",
      "Futuristic",
      "Bold",
      "Graphic",
      "Energetic",
      "Adventurous"
    ],
    "practical_contexts": [
      "Headlines",
      "Branding elements",
      "Large-scale displays",
      "Digital interfaces",
      "Game design"
    ],
    "cultural_intuition": [
      "1980s arcade games",
      "Futuristic sci-fi aesthetics",
      "Retro charm",
      "Modern digital culture",
      "Playful energy"
    ],
    "search_keywords": [
      "Geometric",
      "Display",
      "3D",
      "Bold",
      "Retro",
      "Futuristic",
      "Playful",
      "Confident",
      "Dynamic",
      "Graphic",
      "Headlines",
      "Branding",
      "Digital",
      "Game",
      "Arcade",
      "Sci-fi",
      "Modern",
      "Nostalgia",
      "Energy",
      "Adventure"
    ]
  }
}