{
  "filename": "crying_star_36px.png",
  "status": "success",
  "description": {
    "detailed_description": "This font, with its jagged, almost pixelated forms, evokes a sense of digital distortion and glitch aesthetics. The letterforms are constructed with sharp angles and irregular outlines, creating a sense of fragmentation and disruption. The overall character is bold and assertive, with a strong presence that suggests a rebellious or edgy attitude. The font's irregular construction and bold weight make it suitable for headlines and short bursts of text, adding a sense of energy and disruption to any design. It's particularly effective in digital contexts, where its pixelated nature aligns with the visual language of digital interfaces and online culture. The font's cultural resonance lies in its connection to the aesthetics of cyberpunk and glitch art, reflecting a fascination with the imperfections and glitches of digital technology. It suggests a world where technology is not always smooth and predictable, but rather chaotic and unpredictable, mirroring the anxieties and excitement of the digital age.",
    "technical_characteristics": [
      "jagged outlines",
      "irregular letterforms",
      "sharp angles",
      "pixelated appearance",
      "bold weight"
    ],
    "personality_traits": [
      "bold",
      "assertive",
      "edgy",
      "rebellious",
      "disruptive",
      "energetic",
      "chaotic",
      "unpredictable"
    ],
    "practical_contexts": [
      "headlines",
      "short bursts of text",
      "digital interfaces",
      "online graphics",
      "gaming"
    ],
    "cultural_intuition": [
      "cyberpunk aesthetics",
      "glitch art",
      "digital distortion",
      "rebellious spirit",
      "digital age anxieties"
    ],
    "search_keywords": [
      "jagged",
      "pixelated",
      "distorted",
      "glitch",
      "bold",
      "assertive",
      "edgy",
      "rebellious",
      "disruptive",
      "headline",
      "digital",
      "interface",
      "online",
      "cyberpunk",
      "glitch art",
      "digital distortion",
      "rebellious spirit",
      "digital age"
    ]
  }
}