{
  "filename": "csenge_36px.png",
  "status": "success",
  "description": {
    "detailed_description": "This font is a captivating blend of ancient symbolism and modern digital aesthetics. Its construction is rooted in the angularity of runes, with each letterform meticulously crafted to evoke a sense of power and mystery. The sharp, pointed terminals and bold strokes create a strong visual presence, while the consistent width of the characters ensures readability even at smaller sizes. The font's design personality is both commanding and intriguing, suggesting a connection to ancient traditions while remaining relevant to contemporary design trends. Its bold, angular forms lend themselves well to headlines, logos, and branding projects that require a strong visual impact. The font's cultural resonance lies in its connection to Norse mythology and ancient symbolism, evoking a sense of history and tradition. However, its clean lines and digital-friendly construction make it equally suitable for modern web design and digital interfaces, adding a touch of mystique and intrigue to contemporary projects.",
    "technical_characteristics": [
      "Angular letterforms",
      "Sharp, pointed terminals",
      "Bold strokes",
      "Consistent character width",
      "High x-height",
      "Open counters",
      "Geometric construction"
    ],
    "personality_traits": [
      "Commanding",
      "Intriguing",
      "Mysterious",
      "Powerful",
      "Bold",
      "Modern",
      "Digital-friendly"
    ],
    "practical_contexts": [
      "Headlines",
      "Logos",
      "Branding",
      "Web design",
      "Digital interfaces"
    ],
    "cultural_intuition": [
      "Norse mythology",
      "Ancient symbolism",
      "History and tradition",
      "Modern design trends",
      "Digital culture"
    ],
    "search_keywords": [
      "Runic",
      "Angular",
      "Geometric",
      "Bold",
      "Sharp",
      "High x-height",
      "Open counters",
      "Modern",
      "Digital",
      "Web design",
      "Branding",
      "Logo",
      "Headline",
      "Mystical",
      "Intriguing",
      "Powerful",
      "Ancient",
      "Norse",
      "Symbolism",
      "Tradition",
      "Contemporary"
    ]
  }
}