{
  "filename": "cupidon_36px.png",
  "status": "success",
  "description": {
    "detailed_description": "This font, with its playful, hand-drawn aesthetic, features a bold, rounded outline that gives it a distinct, almost cartoonish charm. The letters are constructed with a consistent, slightly exaggerated curvature, creating a sense of movement and energy. The generous spacing between letters and words enhances readability, while the playful flourishes and arrows add a whimsical touch. This font's personality is undeniably fun and approachable, reminiscent of children's illustrations and vintage signage. Its bold, graphic nature makes it ideal for headlines, logos, and playful branding, particularly in digital contexts where its vibrant energy can be fully appreciated. The font's playful nature evokes a sense of childlike wonder and nostalgia, suggesting a connection to simpler times and carefree creativity.",
    "technical_characteristics": [
      "Rounded outline",
      "Consistent curvature",
      "Exaggerated proportions",
      "Generous letter spacing",
      "Playful flourishes and arrows"
    ],
    "personality_traits": [
      "Playful",
      "Whimsical",
      "Approachable",
      "Bold",
      "Energetic"
    ],
    "practical_contexts": [
      "Headlines",
      "Logos",
      "Branding",
      "Digital interfaces",
      "Children's publications"
    ],
    "cultural_intuition": [
      "Nostalgia for simpler times",
      "Childlike wonder",
      "Vintage signage",
      "Modern digital culture",
      "Playful branding"
    ],
    "search_keywords": [
      "Rounded",
      "Outline",
      "Curvature",
      "Exaggerated",
      "Playful",
      "Whimsical",
      "Bold",
      "Energetic",
      "Hand-drawn",
      "Cartoonish",
      "Headlines",
      "Logos",
      "Branding",
      "Digital",
      "Vintage",
      "Nostalgia",
      "Children's",
      "Fun",
      "Approachable"
    ]
  }
}