{
  "filename": "curled_serif_36px.png",
  "status": "success",
  "description": {
    "detailed_description": "This font, with its pronounced serifs and intricate flourishes, embodies a classic, almost medieval aesthetic. The letterforms are constructed with a strong emphasis on verticality, creating a sense of formality and grandeur. The serifs, often ending in sharp points or delicate curls, add a touch of elegance and sophistication. The overall effect is one of refined craftsmanship, reminiscent of illuminated manuscripts or engraved lettering. While the font's design is rooted in historical traditions, it retains a timeless quality that feels both familiar and intriguing. Its bold strokes and decorative elements make it suitable for headlines, titles, and branding projects that require a touch of vintage charm. However, its intricate details might limit its readability in smaller sizes or for extended text blocks.",
    "technical_characteristics": [
      "pronounced serifs",
      "intricate flourishes",
      "vertical emphasis",
      "sharp points",
      "delicate curls",
      "bold strokes",
      "decorative elements",
      "high contrast",
      "open counters"
    ],
    "personality_traits": [
      "classic",
      "formal",
      "grand",
      "elegant",
      "sophisticated",
      "refined",
      "intriguing",
      "vintage",
      "decorative"
    ],
    "practical_contexts": [
      "headlines",
      "titles",
      "branding",
      "logos",
      "short text blocks"
    ],
    "cultural_intuition": [
      "medieval aesthetic",
      "illuminated manuscripts",
      "engraved lettering",
      "historical charm",
      "timeless elegance"
    ],
    "search_keywords": [
      "serif",
      "flourish",
      "decorative",
      "classic",
      "formal",
      "vintage",
      "medieval",
      "manuscript",
      "engraved",
      "elegant",
      "sophisticated",
      "refined",
      "bold",
      "high contrast",
      "headline",
      "title",
      "branding",
      "logo",
      "short text",
      "display font",
      "historical",
      "timeless"
    ]
  }
}