{
  "filename": "cursive_36px.png",
  "status": "success",
  "description": {
    "detailed_description": "This font, reminiscent of casual handwritten script, exhibits a playful yet legible character. Its flowing strokes and rounded forms create a sense of informality and warmth, while the consistent letterforms ensure readability. The ascenders and descenders are well-balanced, contributing to a harmonious visual rhythm. The font's organic nature is further emphasized by the subtle variations in stroke thickness and the occasional flourishes, adding a touch of personality. This font is ideal for projects that require a friendly and approachable tone, such as invitations, social media graphics, or branding for creative businesses. Its casual charm evokes a sense of personal connection, making it suitable for conveying warmth and authenticity.",
    "technical_characteristics": [
      "flowing strokes",
      "rounded forms",
      "consistent letterforms",
      "balanced ascenders and descenders",
      "subtle variations in stroke thickness",
      "occasional flourishes"
    ],
    "personality_traits": [
      "playful",
      "legible",
      "informal",
      "warm",
      "approachable",
      "friendly",
      "authentic"
    ],
    "practical_contexts": [
      "invitations",
      "social media graphics",
      "branding for creative businesses",
      "personal projects",
      "handwritten-style typography"
    ],
    "cultural_intuition": [
      "evokes a sense of personal connection",
      "suggests a casual and friendly atmosphere",
      "reminiscent of handwritten notes",
      "captures the spirit of modern digital communication",
      "reflects a trend towards authenticity and individuality"
    ],
    "search_keywords": [
      "handwritten",
      "script",
      "casual",
      "playful",
      "legible",
      "rounded",
      "flowing",
      "informal",
      "warm",
      "friendly",
      "approachable",
      "authentic",
      "invitations",
      "social media",
      "branding",
      "creative",
      "personal",
      "digital",
      "communication",
      "modern",
      "trend",
      "individuality"
    ]
  }
}