{
  "filename": "cuttie_36px.png",
  "status": "success",
  "description": {
    "detailed_description": "Cutie is a playful script font that captures the essence of handwritten text with a touch of digital polish. Its flowing strokes and organic curves create a sense of movement and energy, while the consistent weight and well-defined letterforms ensure readability. The font's slightly condensed character spacing adds a touch of intimacy, making it ideal for personal notes, social media posts, and branding projects that seek a friendly and approachable tone. The font's overall character evokes a sense of warmth and informality, reminiscent of handwritten notes and personal messages. It's a versatile choice for projects that require a touch of personality and a connection to the human touch, while still maintaining a level of professionalism.",
    "technical_characteristics": [
      "flowing strokes",
      "organic curves",
      "consistent weight",
      "well-defined letterforms",
      "slightly condensed character spacing"
    ],
    "personality_traits": [
      "playful",
      "energetic",
      "friendly",
      "approachable",
      "informal"
    ],
    "practical_contexts": [
      "personal notes",
      "social media posts",
      "branding projects",
      "short text blocks",
      "digital interfaces"
    ],
    "cultural_intuition": [
      "evokes a sense of warmth and informality",
      "reminiscent of handwritten notes",
      "suggests a personal touch",
      "captures the spirit of digital communication",
      "ideal for projects seeking a friendly and approachable tone"
    ],
    "search_keywords": [
      "script font",
      "handwritten",
      "playful",
      "energetic",
      "friendly",
      "approachable",
      "informal",
      "personal notes",
      "social media",
      "branding",
      "digital",
      "versatile",
      "readable",
      "flowing",
      "organic",
      "consistent weight",
      "well-defined",
      "condensed",
      "intimate",
      "warmth",
      "human touch",
      "digital communication"
    ]
  }
}