{
  "filename": "cuxhaven_times_36px.png",
  "status": "success",
  "description": {
    "detailed_description": "This font, reminiscent of traditional blackletter styles, exhibits a bold and dramatic character. Its thick strokes and sharp angles create a sense of power and authority, while the intricate flourishes and extended ascenders and descenders add a touch of elegance and sophistication. The overall design is highly decorative, with a strong emphasis on visual impact. The font's construction is based on a combination of geometric and organic elements, resulting in a unique and visually striking aesthetic. The letterforms are carefully crafted, with a strong emphasis on balance and proportion. The font's bold and dramatic character makes it suitable for a variety of applications, including headlines, logos, and branding materials. It can also be used for decorative purposes, such as in invitations, certificates, and other formal documents. However, its intricate details and large size may make it less suitable for body text or small-scale applications. The font's historical roots in medieval calligraphy and printing evoke a sense of tradition and craftsmanship, while its bold and dramatic character suggests a modern and confident approach. It is a versatile font that can be used to create a variety of visual effects, from classic and elegant to bold and dramatic.",
    "technical_characteristics": [
      "thick strokes",
      "sharp angles",
      "extended ascenders and descenders",
      "intricate flourishes",
      "geometric and organic construction"
    ],
    "personality_traits": [
      "bold",
      "dramatic",
      "elegant",
      "sophisticated",
      "powerful",
      "authoritative",
      "decorative",
      "traditional",
      "confident"
    ],
    "practical_contexts": [
      "headlines",
      "logos",
      "branding materials",
      "invitations",
      "certificates",
      "formal documents"
    ],
    "cultural_intuition": [
      "medieval calligraphy",
      "traditional printing",
      "historical craftsmanship",
      "modern design",
      "confident approach"
    ],
    "search_keywords": [
      "blackletter",
      "gothic",
      "decorative",
      "bold",
      "dramatic",
      "elegant",
      "sophisticated",
      "powerful",
      "authoritative",
      "traditional",
      "modern",
      "confident",
      "headlines",
      "logos",
      "branding",
      "invitations",
      "certificates",
      "formal documents",
      "flourishes",
      "extended ascenders",
      "descenders",
      "geometric",
      "organic",
      "construction"
    ]
  }
}