{
  "filename": "cyberpunk_is_not_dead_36px.png",
  "status": "success",
  "description": {
    "detailed_description": "Cyberpunk is Not Dead (36px) is a bold, geometric sans-serif font that embodies the spirit of its namesake. Its construction is based on a grid system, resulting in clean, sharp lines and consistent proportions. The letterforms are composed of simple, rectangular shapes with minimal curves, creating a sense of starkness and efficiency. The font's high x-height and open counters ensure strong legibility, even at small sizes. The bold weight and consistent stroke width contribute to its assertive and confident character. The font's design evokes a sense of futuristic technology, reminiscent of early computer interfaces and cyberpunk aesthetics. Its sharp angles and bold forms suggest a world of advanced technology and urban grit. The font's practical applications include headlines, branding, and digital interfaces, where its strong presence and clear legibility make it ideal for conveying a sense of power and innovation. Its bold, futuristic aesthetic makes it particularly well-suited for projects related to technology, gaming, and science fiction.",
    "technical_characteristics": [
      "geometric construction",
      "high x-height",
      "open counters",
      "bold weight",
      "consistent stroke width",
      "sharp angles",
      "minimal curves",
      "rectangular shapes"
    ],
    "personality_traits": [
      "bold",
      "assertive",
      "confident",
      "futuristic",
      "technological",
      "urban",
      "gritty",
      "efficient",
      "powerful",
      "innovative"
    ],
    "practical_contexts": [
      "headlines",
      "branding",
      "digital interfaces",
      "gaming",
      "science fiction"
    ],
    "cultural_intuition": [
      "cyberpunk aesthetics",
      "early computer interfaces",
      "futuristic technology",
      "urban grit",
      "sense of power and innovation"
    ],
    "search_keywords": [
      "geometric sans-serif",
      "bold font",
      "high x-height",
      "open counters",
      "sharp angles",
      "futuristic",
      "technological",
      "cyberpunk",
      "gaming",
      "science fiction",
      "headlines",
      "branding",
      "digital interfaces",
      "urban",
      "gritty",
      "powerful",
      "innovative",
      "retro",
      "modern",
      "clean",
      "efficient",
      "legible"
    ]
  }
}