{
  "filename": "dacian_donarium_36px.png",
  "status": "success",
  "description": {
    "detailed_description": "Dacian Donarium is a display typeface that draws inspiration from ancient Roman inscriptions, blending classical structure with a touch of playful whimsy. Its geometric construction is evident in the consistent proportions and sharp angles of the letterforms, particularly in the uppercase characters. The serifs, while present, are subtly rounded, adding a touch of approachability to the otherwise rigid forms. This balance between geometric precision and organic detail creates a unique visual tension, making the font feel both authoritative and approachable. The font's high x-height and open counters ensure strong legibility, even at smaller sizes, making it suitable for headlines, logos, and branding elements. Its distinctive character, reminiscent of ancient stone carvings, lends itself to projects that require a touch of historical authenticity or a sense of timeless elegance. The font's playful nature, evident in the slightly exaggerated curves and the unique glyphs for punctuation marks, adds a touch of personality to any design, making it suitable for projects that require a touch of whimsy or a sense of playful sophistication.",
    "technical_characteristics": [
      "Geometric construction",
      "High x-height",
      "Open counters",
      "Subtly rounded serifs",
      "Distinctive glyphs for punctuation",
      "Consistent proportions",
      "Sharp angles"
    ],
    "personality_traits": [
      "Authoritative",
      "Approachable",
      "Playful",
      "Sophisticated",
      "Timeless",
      "Elegant",
      "Distinctive",
      "Unique"
    ],
    "practical_contexts": [
      "Headlines",
      "Logos",
      "Branding elements",
      "Display typography",
      "Short text blocks"
    ],
    "cultural_intuition": [
      "Evokes ancient Roman inscriptions",
      "Suggests a sense of history and tradition",
      "Conveys a sense of timeless elegance",
      "Adds a touch of playful sophistication",
      "Suitable for projects that require a touch of whimsy"
    ],
    "search_keywords": [
      "Geometric",
      "Display",
      "Serif",
      "Roman",
      "Inscription",
      "High x-height",
      "Open counters",
      "Distinctive glyphs",
      "Playful",
      "Sophisticated",
      "Timeless",
      "Elegant",
      "Headlines",
      "Logos",
      "Branding",
      "Authenticity",
      "Whimsy"
    ]
  }
}