{
  "filename": "dagon_gothic_36px.png",
  "status": "success",
  "description": {
    "detailed_description": "Dagon Gothic is a display typeface that blends elements of blackletter and gothic styles, resulting in a unique and striking visual identity. Its construction is characterized by bold, angular strokes with pronounced serifs, creating a sense of weight and presence. The letterforms are highly stylized, with intricate details and flourishes that add to their visual complexity. The overall effect is one of power and mystery, reminiscent of ancient scripts and medieval manuscripts. While the font's bold nature makes it suitable for headlines and large-scale applications, its intricate details can be challenging to read at smaller sizes. Its strong visual impact makes it ideal for branding, posters, and other projects where a dramatic and attention-grabbing aesthetic is desired. The font's dark and mysterious character evokes a sense of the unknown, suggesting themes of power, magic, and the supernatural. It can be seen as a contemporary interpretation of traditional gothic styles, infused with a modern sensibility.",
    "technical_characteristics": [
      "Bold, angular strokes",
      "Pronounced serifs",
      "Intricate details and flourishes",
      "High contrast between thick and thin strokes",
      "Highly stylized letterforms"
    ],
    "personality_traits": [
      "Powerful and mysterious",
      "Dramatic and attention-grabbing",
      "Intricate and detailed",
      "Dark and gothic",
      "Modern interpretation of traditional styles"
    ],
    "practical_contexts": [
      "Headlines and large-scale applications",
      "Branding and identity design",
      "Posters and promotional materials",
      "Game design and fantasy-themed projects",
      "Limited use in body text due to legibility concerns"
    ],
    "cultural_intuition": [
      "Evokes a sense of the unknown",
      "Suggests themes of power, magic, and the supernatural",
      "Reminiscent of ancient scripts and medieval manuscripts",
      "Contemporary interpretation of traditional gothic styles",
      "Appeals to a modern audience with a taste for the dramatic"
    ],
    "search_keywords": [
      "Blackletter",
      "Gothic",
      "Display typeface",
      "Bold",
      "Angular",
      "Intricate",
      "Stylized",
      "Powerful",
      "Mysterious",
      "Dramatic",
      "Attention-grabbing",
      "Branding",
      "Posters",
      "Game design",
      "Fantasy",
      "Headlines",
      "Large-scale",
      "Legibility",
      "Modern",
      "Traditional",
      "Ancient",
      "Medieval",
      "Supernatural",
      "Magic",
      "Power"
    ]
  }
}