{
  "filename": "dami_was_here_36px.png",
  "status": "success",
  "description": {
    "detailed_description": "Dami Was Here is a playful, handwritten script font that captures the energy of casual, expressive writing. Its irregular letterforms and fluid strokes evoke the spontaneity of a quick note or a personal message. The font's generous x-height and open counters ensure good legibility, even at smaller sizes, while the varying stroke weights and occasional flourishes add visual interest. The overall effect is one of warmth and approachability, making it ideal for projects that require a friendly and informal tone. The font's casual nature makes it well-suited for social media graphics, personal branding, and informal invitations, while its legibility and versatility allow it to be used for short text blocks and headlines. The font's hand-drawn aesthetic evokes a sense of authenticity and personal connection, suggesting a sense of immediacy and informality. It's a font that feels like a conversation, inviting the viewer to engage with the message on a personal level.",
    "technical_characteristics": [
      "Handwritten style",
      "Irregular letterforms",
      "Fluid strokes",
      "Varying stroke weights",
      "Generous x-height",
      "Open counters",
      "Occasional flourishes"
    ],
    "personality_traits": [
      "Playful",
      "Expressive",
      "Casual",
      "Friendly",
      "Informal",
      "Warm",
      "Approachable",
      "Authentic",
      "Personal"
    ],
    "practical_contexts": [
      "Social media graphics",
      "Personal branding",
      "Informal invitations",
      "Short text blocks",
      "Headlines"
    ],
    "cultural_intuition": [
      "Evokes a sense of immediacy and informality",
      "Suggests a personal connection",
      "Feels like a conversation",
      "Captures the spirit of casual communication"
    ],
    "search_keywords": [
      "Handwritten",
      "Script",
      "Playful",
      "Casual",
      "Informal",
      "Friendly",
      "Expressive",
      "Social media",
      "Personal branding",
      "Invitation",
      "Headline",
      "Short text",
      "Authentic",
      "Personal",
      "Conversation",
      "Immediacy",
      "Informality"
    ]
  }
}