{
  "filename": "dancing_vampyrish_36px.png",
  "status": "success",
  "description": {
    "detailed_description": "Dancing Vampyris is a display typeface that blends classic serif construction with playful, almost whimsical details. The letters are tightly fitted within a grid, creating a sense of order and precision. The serifs are sharp and angular, reminiscent of traditional blackletter styles, but they are softened by subtle curves and flourishes. These flourishes, often resembling bats or other gothic imagery, add a touch of whimsy and personality to the otherwise strict design. The overall effect is a font that is both elegant and playful, suitable for projects that require a touch of gothic flair without being overly serious. The font's high x-height and open counters ensure good legibility, even at smaller sizes, making it suitable for both print and digital applications. Its bold, confident character makes it ideal for headlines, logos, and other branding elements, while its playful details add a touch of personality to invitations, posters, and other creative projects. The font's gothic influences evoke a sense of mystery and intrigue, while its playful details suggest a sense of fun and lightheartedness. This combination makes it a versatile choice for a wide range of projects, from traditional to contemporary.",
    "technical_characteristics": [
      "tightly fitted grid",
      "sharp, angular serifs",
      "subtle curves and flourishes",
      "high x-height",
      "open counters",
      "bold weight",
      "consistent stroke width"
    ],
    "personality_traits": [
      "elegant and playful",
      "gothic flair",
      "whimsical",
      "confident",
      "bold",
      "intriguing",
      "lighthearted"
    ],
    "practical_contexts": [
      "headlines",
      "logos",
      "branding elements",
      "invitations",
      "posters",
      "creative projects"
    ],
    "cultural_intuition": [
      "gothic influences",
      "mystery and intrigue",
      "whimsical charm",
      "contemporary design",
      "playful personality"
    ],
    "search_keywords": [
      "display typeface",
      "serif font",
      "blackletter",
      "gothic",
      "whimsical",
      "playful",
      "elegant",
      "bold",
      "high x-height",
      "open counters",
      "tightly fitted",
      "sharp serifs",
      "flourishes",
      "headlines",
      "logos",
      "branding",
      "invitations",
      "posters",
      "creative projects",
      "mystery",
      "intrigue",
      "contemporary",
      "fun",
      "lighthearted"
    ]
  }
}