{
  "filename": "danhand_36px.png",
  "status": "success",
  "description": {
    "detailed_description": "This font, with its playful, handwritten aesthetic, embodies a casual and approachable personality. The irregular letterforms, characterized by rounded corners and varying stroke widths, create a sense of spontaneity and warmth. The generous x-height and open counters ensure legibility, even at smaller sizes, making it suitable for both digital and print applications. The font's overall character evokes a sense of personal expression and authenticity, reminiscent of handwritten notes or informal sketches. Its informal nature makes it ideal for projects that require a friendly and engaging tone, such as branding for creative businesses, social media graphics, or playful editorial designs. The font's cultural resonance lies in its connection to the contemporary trend of embracing handwritten aesthetics, reflecting a desire for authenticity and personal connection in a digital world.",
    "technical_characteristics": [
      "Handwritten style",
      "Irregular letterforms",
      "Rounded corners",
      "Varying stroke widths",
      "Generous x-height",
      "Open counters"
    ],
    "personality_traits": [
      "Playful",
      "Approachable",
      "Spontaneous",
      "Warm",
      "Authentic",
      "Informal",
      "Friendly",
      "Engaging"
    ],
    "practical_contexts": [
      "Branding for creative businesses",
      "Social media graphics",
      "Playful editorial designs",
      "Handwritten notes",
      "Informal sketches"
    ],
    "cultural_intuition": [
      "Contemporary trend of embracing handwritten aesthetics",
      "Desire for authenticity and personal connection",
      "Reflects a digital world",
      "Informal and friendly communication"
    ],
    "search_keywords": [
      "Handwritten",
      "Playful",
      "Casual",
      "Approachable",
      "Informal",
      "Friendly",
      "Engaging",
      "Authentic",
      "Warm",
      "Legible",
      "Digital",
      "Print",
      "Branding",
      "Social media",
      "Editorial",
      "Creative",
      "Sketch",
      "Note",
      "Contemporary",
      "Trend"
    ]
  }
}