{
  "filename": "dans_hands_36px.png",
  "status": "success",
  "description": {
    "detailed_description": "Dans Hands is a handwritten font that captures the immediacy and informality of a quick sketch. Its irregular letterforms, varying stroke weights, and expressive flourishes evoke the feeling of a personal note or a hastily scribbled message. The font's construction is decidedly organic, with each letterform seemingly drawn with a single, fluid stroke. This creates a sense of spontaneity and authenticity, reminiscent of traditional calligraphy. While the font's technical execution is intentionally rough and uneven, it maintains a clear legibility, particularly at larger sizes. This makes it suitable for headlines, branding elements, or casual digital content where a personal touch is desired. The font's cultural associations lean towards youth culture, street art, and DIY aesthetics, suggesting a sense of rebellion and individuality. It evokes a sense of authenticity and raw expression, making it a compelling choice for projects that aim to communicate a sense of immediacy and personal connection.",
    "technical_characteristics": [
      "Handwritten style",
      "Irregular letterforms",
      "Varying stroke weights",
      "Expressive flourishes",
      "Organic construction",
      "Single-stroke aesthetic",
      "Rough and uneven execution",
      "Clear legibility at larger sizes"
    ],
    "personality_traits": [
      "Spontaneous",
      "Authentic",
      "Informal",
      "Expressive",
      "Energetic",
      "Rebellious",
      "Individualistic"
    ],
    "practical_contexts": [
      "Headlines",
      "Branding elements",
      "Casual digital content",
      "Social media graphics",
      "Personal projects"
    ],
    "cultural_intuition": [
      "Youth culture",
      "Street art",
      "DIY aesthetics",
      "Rebellion",
      "Individuality",
      "Authenticity",
      "Raw expression"
    ],
    "search_keywords": [
      "Handwritten",
      "Script",
      "Informal",
      "Expressive",
      "Rough",
      "Organic",
      "Spontaneous",
      "Authentic",
      "Youthful",
      "Street art",
      "DIY",
      "Rebellious",
      "Individualistic",
      "Casual",
      "Headlines",
      "Branding",
      "Social media",
      "Digital",
      "Personal",
      "Note",
      "Sketch",
      "Calligraphy"
    ]
  }
}