{
  "filename": "darixmaq_36px.png",
  "status": "success",
  "description": {
    "detailed_description": "This font's defining characteristic is its bold, extruded form, creating a playful, almost cartoonish effect. The letters are constructed with rounded corners and smooth curves, giving them a friendly, approachable feel. The generous stroke weight and consistent thickness throughout the glyphs contribute to a sense of solidity and stability. The slight variation in letter spacing adds a touch of dynamism, preventing the text from feeling overly rigid. While the overall design leans towards a playful aesthetic, the clean lines and consistent proportions ensure readability, making it suitable for a range of applications, from playful headlines to eye-catching branding. The font's bold, playful nature evokes a sense of fun and energy, reminiscent of classic cartoon characters and vintage signage. It suggests a sense of nostalgia and a playful approach to design, making it ideal for projects that aim to capture a sense of lightheartedness and whimsy.",
    "technical_characteristics": [
      "Extruded form",
      "Rounded corners",
      "Smooth curves",
      "Generous stroke weight",
      "Consistent thickness",
      "Slight variation in letter spacing"
    ],
    "personality_traits": [
      "Playful",
      "Bold",
      "Friendly",
      "Approachable",
      "Solid",
      "Stable",
      "Dynamic"
    ],
    "practical_contexts": [
      "Headlines",
      "Branding",
      "Posters",
      "Packaging",
      "Digital interfaces"
    ],
    "cultural_intuition": [
      "Nostalgia",
      "Vintage signage",
      "Cartoon characters",
      "Playful design",
      "Lightheartedness",
      "Whimsy"
    ],
    "search_keywords": [
      "Extruded",
      "Rounded",
      "Bold",
      "Playful",
      "Cartoon",
      "Friendly",
      "Nostalgia",
      "Vintage",
      "Headlines",
      "Branding",
      "Posters",
      "Packaging",
      "Digital",
      "Fun",
      "Energy",
      "Whimsical",
      "Cartoonish",
      "Retro",
      "Graphic",
      "Display"
    ]
  }
}