{
  "filename": "dark_flame_36px.png",
  "status": "success",
  "description": {
    "detailed_description": "Font Park Flame is a bold and dramatic display typeface that draws inspiration from gothic script and blackletter styles, but with a contemporary twist. Its exaggerated strokes and sharp angles create a sense of energy and intensity, while the irregular letterforms and flowing curves add a touch of whimsy and unpredictability. The font's construction is highly organic, with each letterform appearing to be drawn with a single, fluid stroke. This gives it a hand-drawn quality that feels both authentic and expressive. The font's high x-height and open counters ensure good legibility, even at small sizes, making it suitable for headlines, logos, and other display applications. However, its intricate details and complex letterforms may make it less suitable for extended body text. The font's overall character is both playful and menacing, suggesting a sense of mystery and intrigue. It evokes a sense of the supernatural, with its sharp angles and jagged edges reminiscent of claws and fangs. This makes it ideal for projects that require a dark and edgy aesthetic, such as horror films, fantasy novels, or heavy metal album covers. However, its playful nature also makes it suitable for more lighthearted applications, such as children's books or comic books, where its whimsical character can be used to create a sense of fun and excitement.",
    "technical_characteristics": [
      "Organic construction",
      "Exaggerated strokes",
      "Sharp angles",
      "Irregular letterforms",
      "Flowing curves",
      "High x-height",
      "Open counters"
    ],
    "personality_traits": [
      "Bold",
      "Dramatic",
      "Energetic",
      "Intense",
      "Whimsical",
      "Unpredictable",
      "Playful",
      "Menacing",
      "Mysterious",
      "Intriguing"
    ],
    "practical_contexts": [
      "Headlines",
      "Logos",
      "Display applications",
      "Horror films",
      "Fantasy novels",
      "Heavy metal album covers",
      "Children's books",
      "Comic books"
    ],
    "cultural_intuition": [
      "Gothic script",
      "Blackletter",
      "Supernatural",
      "Mystery",
      "Intrigue",
      "Dark and edgy",
      "Whimsical",
      "Fun",
      "Excitement"
    ],
    "search_keywords": [
      "Gothic",
      "Blackletter",
      "Display",
      "Bold",
      "Dramatic",
      "Energetic",
      "Intense",
      "Whimsical",
      "Unpredictable",
      "Hand-drawn",
      "Organic",
      "High x-height",
      "Open counters",
      "Legible",
      "Headlines",
      "Logos",
      "Horror",
      "Fantasy",
      "Heavy metal",
      "Children's",
      "Comic",
      "Supernatural",
      "Mystery",
      "Intrigue",
      "Dark",
      "Edgy",
      "Playful",
      "Fun",
      "Excitement"
    ]
  }
}