{
  "filename": "dasbougie_36px.png",
  "status": "success",
  "description": {
    "detailed_description": "DasBougie is a playful and expressive font that captures the energy of hand-drawn lettering. Its irregular letterforms, with their varying stroke widths and bouncy curves, create a sense of spontaneity and personality. The font's generous x-height and open counters ensure good legibility, even at smaller sizes, while the exaggerated ascenders and descenders add a touch of whimsy. The overall effect is one of casual charm and approachable friendliness, making it ideal for projects that require a touch of personality and a sense of human connection. DasBougie's informal character makes it well-suited for branding, social media graphics, and playful editorial designs, particularly when paired with vibrant colors and dynamic layouts. Its hand-drawn aesthetic evokes a sense of authenticity and warmth, suggesting a personal touch and a connection to the human element in design.",
    "technical_characteristics": [
      "Irregular letterforms",
      "Varying stroke widths",
      "Bouncy curves",
      "Generous x-height",
      "Open counters",
      "Exaggerated ascenders and descenders",
      "Informal character"
    ],
    "personality_traits": [
      "Playful",
      "Expressive",
      "Spontaneous",
      "Casual",
      "Charming",
      "Approachable",
      "Friendly"
    ],
    "practical_contexts": [
      "Branding",
      "Social media graphics",
      "Playful editorial designs",
      "Headlines",
      "Short text blocks"
    ],
    "cultural_intuition": [
      "Evokes a sense of authenticity and warmth",
      "Suggests a personal touch",
      "Connects to the human element in design",
      "Reflects the trend of hand-drawn typography",
      "Appeals to a younger, more casual audience"
    ],
    "search_keywords": [
      "Hand-drawn",
      "Playful",
      "Expressive",
      "Casual",
      "Charming",
      "Friendly",
      "Informal",
      "Legible",
      "Generous x-height",
      "Open counters",
      "Branding",
      "Social media",
      "Editorial design",
      "Headlines",
      "Short text",
      "Authentic",
      "Warm",
      "Personal touch",
      "Human element",
      "Trend",
      "Younger audience"
    ]
  }
}