{
  "filename": "davey_hand_36px.png",
  "status": "success",
  "description": {
    "detailed_description": "Davey Hand is a playful script font that captures the essence of casual handwritten text. Its irregular letterforms and expressive strokes evoke a sense of spontaneity and personal touch. The font's construction is based on a loose, organic structure, with varying letter heights and widths that contribute to its informal character. The rounded terminals and flowing curves create a sense of warmth and approachability, while the occasional slight slant adds a touch of dynamism. Davey Hand's versatility makes it suitable for a range of applications, from informal social media posts and handwritten notes to playful branding and packaging designs. Its casual yet legible nature allows it to convey a sense of authenticity and personality, making it ideal for projects that require a friendly and approachable tone. The font's cultural resonance lies in its connection to the handwritten aesthetic, evoking a sense of nostalgia and personal connection. It taps into the contemporary trend of embracing authenticity and individuality, reflecting the desire for genuine and relatable communication.",
    "technical_characteristics": [
      "Irregular letterforms",
      "Expressive strokes",
      "Varying letter heights and widths",
      "Rounded terminals",
      "Flowing curves",
      "Slight slant",
      "Organic structure"
    ],
    "personality_traits": [
      "Playful",
      "Spontaneous",
      "Informal",
      "Warm",
      "Approachable",
      "Authentic",
      "Personal",
      "Dynamic"
    ],
    "practical_contexts": [
      "Social media posts",
      "Handwritten notes",
      "Playful branding",
      "Packaging designs",
      "Informal signage"
    ],
    "cultural_intuition": [
      "Handwritten aesthetic",
      "Nostalgia",
      "Personal connection",
      "Authenticity",
      "Individuality"
    ],
    "search_keywords": [
      "Script font",
      "Handwritten",
      "Playful",
      "Casual",
      "Informal",
      "Rounded terminals",
      "Flowing curves",
      "Irregular letterforms",
      "Expressive strokes",
      "Social media",
      "Branding",
      "Packaging",
      "Handwritten notes",
      "Nostalgia",
      "Authenticity",
      "Personal touch",
      "Dynamic",
      "Approachable",
      "Friendly"
    ]
  }
}