{
  "filename": "dcc_sharp_distress_black_36px.png",
  "status": "success",
  "description": {
    "detailed_description": "DCC Sharp Distress Black is a bold, sans-serif typeface that combines a geometric construction with a heavily distressed aesthetic. The letters are built with sharp, angular forms, creating a strong and assertive presence. The distressed texture, achieved through the application of a grunge-style overlay, adds a layer of grit and authenticity. This combination of geometric precision and distressed texture creates a unique visual tension, making the font both modern and vintage. The high x-height and open counters ensure strong legibility, even at smaller sizes, while the distressed texture adds a touch of visual interest. This font is well-suited for headlines, branding, and other applications where a bold and impactful statement is desired. Its distressed texture evokes a sense of rebellion and authenticity, making it ideal for projects that aim to convey a raw and edgy aesthetic. The font's contemporary relevance lies in its ability to capture the spirit of urban culture and the DIY aesthetic, while its historical influences can be traced back to the grunge and punk movements of the 1990s.",
    "technical_characteristics": [
      "Geometric construction",
      "Distressed texture",
      "High x-height",
      "Open counters",
      "Sharp terminals",
      "Bold weight"
    ],
    "personality_traits": [
      "Bold and assertive",
      "Gritty and authentic",
      "Modern and vintage",
      "Rebellious and edgy",
      "Raw and impactful",
      "Visually interesting",
      "Strong and confident"
    ],
    "practical_contexts": [
      "Headlines",
      "Branding",
      "Posters",
      "Logos",
      "Web design",
      "Graphic design"
    ],
    "cultural_intuition": [
      "Urban culture",
      "DIY aesthetic",
      "Grunge and punk movements",
      "Rebellion and authenticity",
      "Modern and vintage"
    ],
    "search_keywords": [
      "sans-serif",
      "geometric",
      "distressed",
      "grunge",
      "bold",
      "high x-height",
      "open counters",
      "sharp terminals",
      "headlines",
      "branding",
      "posters",
      "logos",
      "web design",
      "graphic design",
      "urban culture",
      "DIY",
      "rebellion",
      "authenticity",
      "modern",
      "vintage"
    ]
  }
}