{
  "filename": "dcc_dreamer_36px.png",
  "status": "success",
  "description": {
    "detailed_description": "DCC Dreamer is a playful display typeface that embraces a bold, cartoonish aesthetic. Its rounded, exaggerated forms and uneven letterforms create a sense of whimsy and energy. The font's construction is characterized by a combination of geometric and organic elements, with rounded corners and curves juxtaposed with sharp angles and irregular shapes. This blend of styles contributes to its playful personality, making it ideal for eye-catching headlines, logos, and branding projects that require a touch of fun and personality. The font's bold weight and large x-height ensure strong legibility, even at smaller sizes, while its uneven letterforms add a unique visual interest. The font's overall character is reminiscent of vintage cartoon graphics and comic book lettering, evoking a sense of nostalgia and lightheartedness. Its contemporary relevance lies in its ability to inject a dose of personality and playfulness into digital design, particularly in areas like social media graphics, web design, and mobile applications. The font's cultural associations range from classic cartoon characters to modern internet memes, making it a versatile choice for projects that aim to connect with a wide audience.",
    "technical_characteristics": [
      "Rounded corners and curves",
      "Sharp angles and irregular shapes",
      "Uneven letterforms",
      "Bold weight",
      "Large x-height",
      "Open counters",
      "Geometric and organic construction"
    ],
    "personality_traits": [
      "Playful",
      "Whimsical",
      "Energetic",
      "Bold",
      "Cartoonish",
      "Nostalgic",
      "Lighthearted"
    ],
    "practical_contexts": [
      "Headlines",
      "Logos",
      "Branding",
      "Social media graphics",
      "Web design",
      "Mobile applications"
    ],
    "cultural_intuition": [
      "Vintage cartoon graphics",
      "Comic book lettering",
      "Modern internet memes",
      "Nostalgia",
      "Lightheartedness"
    ],
    "search_keywords": [
      "Display typeface",
      "Cartoon font",
      "Playful font",
      "Bold font",
      "Whimsical font",
      "Rounded corners",
      "Uneven letterforms",
      "Large x-height",
      "Open counters",
      "Geometric construction",
      "Organic construction",
      "Nostalgia",
      "Lightheartedness",
      "Headlines",
      "Logos",
      "Branding",
      "Social media",
      "Web design",
      "Mobile apps"
    ]
  }
}