{
  "filename": "dcc_anatolia_strong_36px.png",
  "status": "success",
  "description": {
    "detailed_description": "DCC Anatolia Strong is a display typeface that embodies a playful, energetic spirit. Its bold, hand-drawn aesthetic is achieved through exaggerated letterforms with rounded corners and irregular strokes. The font's construction is characterized by a high x-height and generous counters, contributing to its strong legibility even at large sizes. The irregular stroke weights and playful curves create a sense of movement and dynamism, reminiscent of hand-lettering or comic book art. This font is well-suited for headlines, branding elements, and playful digital interfaces, where its bold personality and informal charm can add a touch of whimsy and energy. Its hand-drawn quality evokes a sense of authenticity and human connection, making it ideal for projects that seek to convey a friendly and approachable tone.",
    "technical_characteristics": [
      "High x-height",
      "Rounded corners",
      "Irregular stroke weights",
      "Exaggerated letterforms",
      "Generous counters"
    ],
    "personality_traits": [
      "Playful",
      "Energetic",
      "Bold",
      "Informal",
      "Whimsical"
    ],
    "practical_contexts": [
      "Headlines",
      "Branding elements",
      "Digital interfaces",
      "Playful designs",
      "Large-scale displays"
    ],
    "cultural_intuition": [
      "Hand-lettering",
      "Comic book art",
      "Informal communication",
      "Modern design",
      "Digital culture"
    ],
    "search_keywords": [
      "Display typeface",
      "Hand-drawn",
      "Bold",
      "Playful",
      "Energetic",
      "Informal",
      "Whimsical",
      "Headlines",
      "Branding",
      "Digital interfaces",
      "Large-scale",
      "Comic book",
      "Hand-lettering",
      "Modern design",
      "Digital culture"
    ]
  }
}