{
  "filename": "dcc_marker_quick_36px.png",
  "status": "success",
  "description": {
    "detailed_description": "DCC Marker Quick is a playful script font that captures the energy of hand-drawn lettering. Its irregular, slightly wobbly strokes evoke the immediacy of a marker pen, creating a sense of spontaneity and informality. The font's generous x-height and open counters ensure good legibility, even at smaller sizes, while the rounded terminals and playful swashes add a touch of whimsy. This combination of legibility and personality makes it suitable for a wide range of applications, from casual branding and social media graphics to children's books and playful packaging. The font's hand-drawn aesthetic evokes a sense of warmth and approachability, suggesting a friendly and approachable brand personality. It also carries a nostalgic feel, reminiscent of handwritten notes and childhood doodles, adding a touch of charm and authenticity to any design.",
    "technical_characteristics": [
      "Irregular stroke weights",
      "Rounded terminals",
      "Open counters",
      "Generous x-height",
      "Playful swashes"
    ],
    "personality_traits": [
      "Playful",
      "Spontaneous",
      "Informal",
      "Whimsical",
      "Approachable",
      "Nostalgic",
      "Friendly",
      "Charming"
    ],
    "practical_contexts": [
      "Casual branding",
      "Social media graphics",
      "Children's books",
      "Playful packaging",
      "Handwritten notes",
      "Doodles"
    ],
    "cultural_intuition": [
      "Evokes a sense of childhood",
      "Suggests a friendly and approachable brand personality",
      "Carries a nostalgic feel",
      "Reminiscent of handwritten notes and doodles"
    ],
    "search_keywords": [
      "Script font",
      "Hand-drawn",
      "Marker pen",
      "Playful",
      "Informal",
      "Whimsical",
      "Nostalgic",
      "Friendly",
      "Approachable",
      "Casual branding",
      "Social media graphics",
      "Children's books",
      "Playful packaging",
      "Handwritten notes",
      "Doodles",
      "Legible",
      "Open counters",
      "Rounded terminals",
      "Generous x-height",
      "Irregular stroke weights"
    ]
  }
}