{
  "filename": "dcc_anatolia_classic_36px.png",
  "status": "success",
  "description": {
    "detailed_description": "DCC Anatolia Classic is a playful script font that captures the essence of handwritten text with a touch of whimsy. Its flowing strokes and irregular letterforms create a sense of spontaneity and informality, reminiscent of a child's handwriting. The font's construction is characterized by its uneven line weights, varying letter heights, and exaggerated curves, adding to its charmingly imperfect aesthetic. While the font's overall structure is organic and free-flowing, it maintains a degree of legibility through its clear letterforms and consistent baseline. The font's personality is both friendly and energetic, making it suitable for projects that require a lighthearted and approachable tone. Its casual nature makes it ideal for branding, packaging, and social media graphics, particularly for products or services targeting a younger audience. The font's cultural associations evoke a sense of nostalgia and childhood innocence, reminiscent of handwritten notes and personalized messages. Its contemporary relevance lies in its ability to convey authenticity and human connection in a digital world.",
    "technical_characteristics": [
      "Handwritten style",
      "Uneven line weights",
      "Varying letter heights",
      "Exaggerated curves",
      "Open counters",
      "Organic construction",
      "Consistent baseline"
    ],
    "personality_traits": [
      "Playful",
      "Whimsical",
      "Spontaneous",
      "Informal",
      "Friendly",
      "Energetic",
      "Approachable",
      "Charmingly imperfect"
    ],
    "practical_contexts": [
      "Branding for children's products",
      "Packaging for playful products",
      "Social media graphics",
      "Handwritten-style typography",
      "Casual signage"
    ],
    "cultural_intuition": [
      "Nostalgia for childhood",
      "Handwritten notes and messages",
      "Authenticity and human connection",
      "Digital-native design",
      "Playful and lighthearted communication"
    ],
    "search_keywords": [
      "Handwritten",
      "Script",
      "Playful",
      "Whimsical",
      "Informal",
      "Casual",
      "Friendly",
      "Energetic",
      "Children's",
      "Branding",
      "Packaging",
      "Social media",
      "Nostalgia",
      "Authenticity",
      "Digital",
      "Contemporary",
      "Legible",
      "Organic",
      "Uneven",
      "Varying",
      "Exaggerated",
      "Open counters",
      "Consistent baseline"
    ]
  }
}