{
  "filename": "dcc_stained_aliens_36px.png",
  "status": "success",
  "description": {
    "detailed_description": "DCC Stained Aliens is a display typeface that blends a retro-futuristic aesthetic with a playful, almost cartoonish edge. Its construction is based on a geometric framework, evident in the sharp angles and consistent proportions of the letterforms. However, the font deviates from strict geometric purity with subtle curves and rounded terminals, adding a touch of approachability and warmth. This balance between geometric precision and organic detail creates a unique visual tension, making the font both striking and inviting. The high x-height and open counters ensure strong legibility, even at smaller sizes, while the bold strokes and distinctive letterforms lend a sense of dynamism and energy. The font's overall character is playful and optimistic, reminiscent of 1950s sci-fi illustrations and vintage video game graphics. It evokes a sense of wonder and adventure, suggesting a world of possibilities and boundless imagination.  DCC Stained Aliens is well-suited for headlines, logos, and branding projects that require a bold and eye-catching visual presence. Its playful nature makes it ideal for children's books, games, and entertainment-related projects. However, its retro-futuristic aesthetic also lends itself to more sophisticated applications, such as technology-focused brands or projects with a vintage sci-fi theme.",
    "technical_characteristics": [
      "Geometric construction",
      "High x-height",
      "Open counters",
      "Bold strokes",
      "Rounded terminals",
      "Distinctive letterforms",
      "Consistent proportions"
    ],
    "personality_traits": [
      "Playful",
      "Optimistic",
      "Bold",
      "Energetic",
      "Retro-futuristic",
      "Striking",
      "Inviting"
    ],
    "practical_contexts": [
      "Headlines",
      "Logos",
      "Branding",
      "Children's books",
      "Games",
      "Entertainment",
      "Technology-focused brands",
      "Vintage sci-fi projects"
    ],
    "cultural_intuition": [
      "1950s sci-fi illustrations",
      "Vintage video game graphics",
      "Sense of wonder and adventure",
      "Boundless imagination",
      "Retro-futuristic aesthetic"
    ],
    "search_keywords": [
      "Geometric",
      "Display",
      "Playful",
      "Retro",
      "Futuristic",
      "Bold",
      "High x-height",
      "Open counters",
      "Rounded terminals",
      "Distinctive",
      "Headline",
      "Logo",
      "Branding",
      "Children's",
      "Games",
      "Entertainment",
      "Technology",
      "Vintage",
      "Sci-fi"
    ]
  }
}