{
  "filename": "dear_old_dad_36px.png",
  "status": "success",
  "description": {
    "detailed_description": "Dear Old Dad is a playful yet legible script font that blends classic calligraphic influences with a contemporary, approachable feel. Its flowing strokes and generous curves create a sense of warmth and familiarity, while the consistent weight and well-defined letterforms ensure readability even at smaller sizes. The font's slightly condensed proportions and moderate italic angle contribute to its natural flow and organic rhythm, making it ideal for headlines, logos, and branding elements where a touch of personality is desired. The font's versatility extends to digital applications, where its smooth curves and consistent weight translate well to screen displays. While its overall character evokes a sense of nostalgia and handwritten charm, Dear Old Dad's modern execution and balanced proportions ensure it remains relevant and engaging in contemporary design contexts.",
    "technical_characteristics": [
      "flowing strokes",
      "generous curves",
      "consistent weight",
      "well-defined letterforms",
      "slightly condensed proportions",
      "moderate italic angle"
    ],
    "personality_traits": [
      "playful yet legible",
      "warm and familiar",
      "approachable",
      "natural flow",
      "organic rhythm",
      "nostalgic",
      "handwritten charm",
      "modern execution",
      "balanced proportions"
    ],
    "practical_contexts": [
      "headlines",
      "logos",
      "branding elements",
      "digital applications",
      "social media graphics"
    ],
    "cultural_intuition": [
      "evokes a sense of nostalgia",
      "suggests handwritten charm",
      "reflects a contemporary appreciation for authenticity",
      "captures the spirit of casual yet stylish design",
      "fits seamlessly into a range of modern design aesthetics"
    ],
    "search_keywords": [
      "script font",
      "playful",
      "legible",
      "calligraphic",
      "contemporary",
      "approachable",
      "flowing strokes",
      "generous curves",
      "consistent weight",
      "well-defined letterforms",
      "slightly condensed",
      "moderate italic",
      "headlines",
      "logos",
      "branding",
      "digital applications",
      "social media",
      "nostalgia",
      "handwritten",
      "authenticity",
      "casual",
      "stylish"
    ]
  }
}