{
  "filename": "deco_mon_type_36px.png",
  "status": "success",
  "description": {
    "detailed_description": "This font, with its distinct Art Deco influences, presents a striking balance between geometric precision and subtle humanist details. The uppercase letters exhibit a strong verticality, with a high x-height and open counters that contribute to excellent legibility, even at smaller sizes. The lowercase letters, however, display a more playful character, with rounded terminals and delicate curves that soften the overall impression. This interplay between geometric structure and organic detail creates a unique personality, one that is both sophisticated and approachable. The font's versatility is further enhanced by its well-designed numerals and punctuation, which seamlessly integrate with the letterforms, making it suitable for a wide range of applications, from elegant branding to contemporary digital interfaces. The overall effect is one of refined elegance, reminiscent of the glamour and optimism of the Art Deco era, yet with a modern sensibility that feels fresh and relevant for today's design landscape.",
    "technical_characteristics": [
      "high x-height",
      "open counters",
      "geometric construction",
      "rounded terminals",
      "delicate curves",
      "strong verticality",
      "well-designed numerals and punctuation"
    ],
    "personality_traits": [
      "sophisticated",
      "approachable",
      "elegant",
      "refined",
      "playful",
      "modern",
      "versatile"
    ],
    "practical_contexts": [
      "branding",
      "logos",
      "editorial design",
      "web design",
      "digital interfaces"
    ],
    "cultural_intuition": [
      "Art Deco era",
      "glamour and optimism",
      "modern sensibility",
      "contemporary design",
      "refined elegance"
    ],
    "search_keywords": [
      "Art Deco",
      "geometric sans-serif",
      "high x-height",
      "open counters",
      "rounded terminals",
      "delicate curves",
      "legible",
      "versatile",
      "branding",
      "logos",
      "editorial design",
      "web design",
      "digital interfaces",
      "sophisticated",
      "approachable",
      "elegant",
      "refined",
      "playful",
      "modern",
      "contemporary"
    ]
  }
}