{
  "filename": "dept_charge_36px.png",
  "status": "success",
  "description": {
    "detailed_description": "This font embodies a playful, retro aesthetic with its rounded, bulbous letterforms. The construction is primarily geometric, with each letter built from simple curves and arcs, creating a sense of playful energy. The generous curves and rounded terminals contribute to a friendly, approachable feel, while the bold weight and consistent stroke width ensure strong legibility. The font's overall character is reminiscent of 1960s and 70s design trends, evoking a sense of optimism and nostalgia. Its bold, playful nature makes it ideal for headlines, branding, and playful digital interfaces, particularly in large sizes where its rounded forms can be appreciated. The font's retro charm and bold presence suggest a sense of fun and carefree energy, making it a perfect choice for projects that aim to capture a sense of vintage cool.",
    "technical_characteristics": [
      "Geometric construction",
      "Rounded terminals",
      "Bold weight",
      "Consistent stroke width",
      "Generous curves",
      "Open counters",
      "High x-height"
    ],
    "personality_traits": [
      "Playful",
      "Retro",
      "Bold",
      "Friendly",
      "Approachable",
      "Nostalgic",
      "Energetic"
    ],
    "practical_contexts": [
      "Headlines",
      "Branding",
      "Digital interfaces",
      "Large-scale displays",
      "Playful designs"
    ],
    "cultural_intuition": [
      "1960s and 70s design",
      "Pop culture",
      "Optimism",
      "Nostalgia",
      "Fun and carefree energy"
    ],
    "search_keywords": [
      "Geometric",
      "Rounded",
      "Bold",
      "Retro",
      "Playful",
      "Nostalgic",
      "Headlines",
      "Branding",
      "Digital",
      "Large-scale",
      "Optimistic",
      "Fun",
      "Carefree",
      "Vintage",
      "Cool"
    ]
  }
}