{
  "filename": "desyrel_36px.png",
  "status": "success",
  "description": {
    "detailed_description": "Desyrel is a handwritten script font that captures the casual, expressive nature of everyday writing. Its flowing strokes and irregular letterforms create a sense of spontaneity and authenticity. The font's construction is based on a combination of calligraphic principles and digital manipulation, resulting in a unique blend of organic and geometric elements. The letters are generally rounded and open, with a high x-height that ensures good legibility even at small sizes. The font's distinctive features include its playful use of ligatures, its subtle variations in stroke weight, and its overall sense of movement. Desyrel's personality is both approachable and sophisticated, making it suitable for a wide range of applications. It can be used to add a touch of personality to branding, packaging, or website design, or to create a sense of warmth and intimacy in editorial or personal projects. The font's versatility is further enhanced by its inclusion of a variety of stylistic alternates and ligatures, allowing designers to customize its appearance to suit their specific needs. Desyrel's cultural resonance lies in its ability to evoke a sense of nostalgia and familiarity, while also feeling fresh and contemporary. It is a font that speaks to the human touch and the power of handwritten communication, making it a perfect choice for projects that seek to connect with audiences on an emotional level.",
    "technical_characteristics": [
      "Handwritten style",
      "Flowing strokes",
      "Irregular letterforms",
      "High x-height",
      "Open counters",
      "Rounded terminals",
      "Variable stroke weight",
      "Ligatures"
    ],
    "personality_traits": [
      "Casual",
      "Expressive",
      "Spontaneous",
      "Authentic",
      "Approachable",
      "Sophisticated",
      "Playful",
      "Warm",
      "Intimate"
    ],
    "practical_contexts": [
      "Branding",
      "Packaging",
      "Website design",
      "Editorial",
      "Personal projects",
      "Social media graphics",
      "Handwritten notes"
    ],
    "cultural_intuition": [
      "Nostalgia",
      "Familiarity",
      "Human touch",
      "Handwritten communication",
      "Modern",
      "Contemporary"
    ],
    "search_keywords": [
      "Handwritten",
      "Script",
      "Casual",
      "Expressive",
      "Playful",
      "Authentic",
      "Approachable",
      "Sophisticated",
      "Warm",
      "Intimate",
      "Branding",
      "Packaging",
      "Website",
      "Editorial",
      "Personal",
      "Social media",
      "Ligatures",
      "Alternates",
      "Nostalgia",
      "Modern",
      "Contemporary"
    ]
  }
}