{
  "filename": "determined_36px.png",
  "status": "success",
  "description": {
    "detailed_description": "Determined is a sans-serif typeface that embodies a confident and assertive personality. Its geometric construction, with sharp corners and clean lines, creates a sense of precision and order. The bold weight and consistent stroke width contribute to its strong presence, while the subtle textural details, reminiscent of a hand-drawn quality, add a touch of warmth and character. The font's high x-height and open counters ensure excellent legibility, making it suitable for both large-scale displays and smaller text sizes. Its bold and assertive nature makes it ideal for headlines, branding elements, and applications where a strong visual impact is desired. However, its geometric construction and lack of stylistic variations might limit its use in longer blocks of text, where a more nuanced and readable typeface might be preferred. Determined's overall aesthetic evokes a sense of modernism and industrial design, suggesting a connection to the early 20th century and the rise of technology. Its bold and confident character resonates with contemporary trends in design, where clarity and impact are highly valued.",
    "technical_characteristics": [
      "Geometric construction",
      "Sharp corners",
      "Consistent stroke width",
      "High x-height",
      "Open counters",
      "Textural details",
      "Bold weight"
    ],
    "personality_traits": [
      "Confident",
      "Assertive",
      "Modern",
      "Industrial",
      "Bold",
      "Legible",
      "Characterful"
    ],
    "practical_contexts": [
      "Headlines",
      "Branding elements",
      "Large-scale displays",
      "Digital interfaces",
      "Short text blocks"
    ],
    "cultural_intuition": [
      "Modernism",
      "Industrial design",
      "Early 20th century",
      "Contemporary design trends",
      "Clarity and impact"
    ],
    "search_keywords": [
      "Geometric sans-serif",
      "Bold typeface",
      "High x-height",
      "Open counters",
      "Sharp corners",
      "Textural details",
      "Modern design",
      "Industrial design",
      "Headlines",
      "Branding",
      "Digital display",
      "Legibility",
      "Assertive",
      "Confident",
      "Strong presence"
    ]
  }
}