{
  "filename": "dhizar_36px.png",
  "status": "success",
  "description": {
    "detailed_description": "Dhizar is a playful script font that blends a casual, handwritten aesthetic with a touch of formality. Its rounded letterforms and flowing curves create a sense of movement and energy, while the consistent stroke weight and well-defined terminals ensure legibility. The font's overall character is friendly and approachable, suggesting a sense of warmth and approachability. It draws inspiration from classic script fonts, but with a contemporary twist, incorporating subtle details like the slightly angled ascenders and descenders that add a touch of dynamism. Dhizar's versatility makes it suitable for a wide range of applications, from branding and packaging to social media graphics and website design. Its casual yet refined nature makes it ideal for projects that require a touch of personality and charm, while its legibility ensures readability even in smaller sizes. The font's playful nature evokes a sense of fun and creativity, suggesting a brand or project that is approachable and engaging. Its contemporary feel aligns with current trends in digital design, making it a versatile choice for modern projects.",
    "technical_characteristics": [
      "Rounded letterforms",
      "Flowing curves",
      "Consistent stroke weight",
      "Well-defined terminals",
      "Slightly angled ascenders and descenders"
    ],
    "personality_traits": [
      "Playful",
      "Friendly",
      "Approachable",
      "Casual",
      "Refined"
    ],
    "practical_contexts": [
      "Branding and packaging",
      "Social media graphics",
      "Website design",
      "Handwritten-style typography",
      "Casual and informal communication"
    ],
    "cultural_intuition": [
      "Evokes a sense of fun and creativity",
      "Suggests a brand or project that is approachable and engaging",
      "Aligns with current trends in digital design",
      "Reflects a modern and playful aesthetic",
      "Appeals to a wide audience"
    ],
    "search_keywords": [
      "Script font",
      "Handwritten",
      "Playful",
      "Casual",
      "Rounded",
      "Flowing",
      "Friendly",
      "Approachable",
      "Branding",
      "Packaging",
      "Social media",
      "Website design",
      "Digital design",
      "Modern",
      "Contemporary",
      "Legible",
      "Versatile"
    ]
  }
}