{
  "filename": "dicis_handwrite_36px.png",
  "status": "success",
  "description": {
    "detailed_description": "Dicis Handwrite is a playful script font that captures the energy of handwritten text. Its irregular letterforms and varying stroke weights create a sense of spontaneity and authenticity. The font's organic nature is evident in the flowing curves and angled strokes, reminiscent of a quick, expressive hand. While the overall impression is casual, the font maintains a degree of legibility through its clear letterforms and consistent baseline. This balance makes it suitable for a range of applications, from informal social media posts to more formal branding elements, adding a touch of personality and warmth. The font's contemporary feel evokes a sense of immediacy and connection, aligning with the digital age's emphasis on authenticity and personal expression.",
    "technical_characteristics": [
      "Irregular letterforms",
      "Varying stroke weights",
      "Flowing curves",
      "Angled strokes",
      "Consistent baseline",
      "Open counters",
      "Organic construction"
    ],
    "personality_traits": [
      "Playful",
      "Spontaneous",
      "Authentic",
      "Casual",
      "Warm",
      "Expressive",
      "Legible"
    ],
    "practical_contexts": [
      "Social media posts",
      "Branding elements",
      "Headlines",
      "Short text blocks",
      "Informal signage"
    ],
    "cultural_intuition": [
      "Evokes a sense of immediacy and connection",
      "Reflects the digital age's emphasis on authenticity",
      "Captures the spirit of personal expression",
      "Suggests a casual and approachable tone"
    ],
    "search_keywords": [
      "Script font",
      "Handwritten",
      "Playful",
      "Casual",
      "Authentic",
      "Legible",
      "Organic",
      "Contemporary",
      "Social media",
      "Branding",
      "Headlines",
      "Informal",
      "Expressive",
      "Digital",
      "Authenticity",
      "Personal expression"
    ]
  }
}