{
  "filename": "dilate_36px.png",
  "status": "success",
  "description": {
    "detailed_description": "This font is a whimsical exploration of calligraphic flourishes, drawing inspiration from both traditional script and contemporary digital art. Each letterform is a unique composition of flowing curves and delicate strokes, creating a sense of playful energy and organic movement. The font's construction is highly organic, with each letterform seemingly drawn in a single, continuous line. This creates a sense of fluidity and spontaneity, while also contributing to its distinctive character. The font's high x-height and open counters ensure good legibility, even at smaller sizes, making it suitable for both display and body text applications. The font's playful nature makes it ideal for branding projects that require a touch of whimsy and personality, while its organic construction lends itself well to digital applications such as website design and social media graphics. The font's overall aesthetic evokes a sense of playful charm and whimsical delight, reminiscent of vintage children's books and hand-drawn illustrations. It suggests a world of imagination and creativity, where the boundaries of reality are blurred and anything is possible.",
    "technical_characteristics": [
      "Organic construction",
      "Calligraphic flourishes",
      "High x-height",
      "Open counters",
      "Delicate strokes",
      "Fluid curves",
      "Continuous line drawing"
    ],
    "personality_traits": [
      "Playful",
      "Whimsical",
      "Energetic",
      "Organic",
      "Fluid",
      "Spontaneous",
      "Charming"
    ],
    "practical_contexts": [
      "Branding projects",
      "Website design",
      "Social media graphics",
      "Children's books",
      "Hand-drawn illustrations",
      "Display text",
      "Body text"
    ],
    "cultural_intuition": [
      "Vintage children's books",
      "Hand-drawn illustrations",
      "Digital art",
      "Playful energy",
      "Imagination and creativity"
    ],
    "search_keywords": [
      "Calligraphic",
      "Script",
      "Organic",
      "Whimsical",
      "Playful",
      "Fluid",
      "Energetic",
      "Charming",
      "Display font",
      "Body font",
      "Branding",
      "Website design",
      "Social media",
      "Children's book",
      "Illustration",
      "Digital art",
      "Vintage",
      "Hand-drawn"
    ]
  }
}