{
  "filename": "dimbo_36px.png",
  "status": "success",
  "description": {
    "detailed_description": "Dimbo is a sans-serif typeface that blends geometric construction with subtle humanist details, resulting in a font that is both modern and approachable. The letterforms are built upon a grid system, evident in the consistent proportions and clean lines. However, the rounded terminals and slight variations in stroke thickness add a touch of warmth and personality. This balance between geometric precision and humanist nuance creates a font that is both legible and engaging. Dimbo's high x-height and open counters ensure readability even at small sizes, making it suitable for digital interfaces and print applications alike. The font's overall character is confident and friendly, suggesting a brand that is both professional and approachable. Its contemporary aesthetic evokes a sense of innovation and forward-thinking, while its subtle humanist touches create a sense of warmth and connection. Dimbo's versatility makes it suitable for a wide range of applications, from branding and web design to editorial and signage.",
    "technical_characteristics": [
      "Geometric construction",
      "High x-height",
      "Open counters",
      "Rounded terminals",
      "Consistent proportions",
      "Slight variations in stroke thickness",
      "Strong legibility"
    ],
    "personality_traits": [
      "Confidently geometric",
      "Subtly humanist",
      "Approachable and friendly",
      "Modern and innovative",
      "Warm and inviting",
      "Versatile and adaptable",
      "Legible and engaging"
    ],
    "practical_contexts": [
      "Branding and web design",
      "Digital interfaces",
      "Print applications",
      "Editorial design",
      "Signage"
    ],
    "cultural_intuition": [
      "Evokes a sense of innovation and forward-thinking",
      "Suggests a brand that is both professional and approachable",
      "Reflects a contemporary design aesthetic",
      "Connects with a modern audience",
      "Appeals to a wide range of cultural sensibilities"
    ],
    "search_keywords": [
      "Sans-serif",
      "Geometric",
      "Humanist",
      "High x-height",
      "Open counters",
      "Rounded terminals",
      "Legible",
      "Engaging",
      "Modern",
      "Approachable",
      "Versatile",
      "Branding",
      "Web design",
      "Digital",
      "Print",
      "Editorial",
      "Signage",
      "Contemporary",
      "Innovative",
      "Forward-thinking"
    ]
  }
}