{
  "filename": "dinski_casual_condensed_36px.png",
  "status": "success",
  "description": {
    "detailed_description": "Dinski Casual Condensed is a playful sans-serif typeface that blends a hand-drawn aesthetic with a condensed structure. Its rounded letterforms and slightly uneven strokes create a casual, approachable feel, while the condensed proportions lend a sense of energy and dynamism. The font's construction is characterized by a combination of geometric and organic elements, with rounded corners and open counters contributing to its friendly personality. The overall effect is a font that feels both familiar and unique, suitable for a wide range of applications from casual branding to playful headlines. Its condensed nature makes it particularly effective for tight spaces, while its hand-drawn quality adds a touch of personality to digital interfaces and print designs. The font's playful nature evokes a sense of fun and informality, making it ideal for projects that require a lighthearted and approachable tone.",
    "technical_characteristics": [
      "Condensed proportions",
      "Rounded letterforms",
      "Open counters",
      "Uneven strokes",
      "Hand-drawn aesthetic",
      "Geometric and organic construction",
      "Rounded corners"
    ],
    "personality_traits": [
      "Playful",
      "Approachable",
      "Energetic",
      "Dynamic",
      "Friendly",
      "Casual",
      "Unique"
    ],
    "practical_contexts": [
      "Casual branding",
      "Playful headlines",
      "Digital interfaces",
      "Print designs",
      "Tight spaces"
    ],
    "cultural_intuition": [
      "Evokes a sense of fun and informality",
      "Suggests a lighthearted and approachable tone",
      "Reflects contemporary trends in digital design",
      "Appeals to a younger audience",
      "Connects with a sense of playfulness and creativity"
    ],
    "search_keywords": [
      "Condensed sans-serif",
      "Hand-drawn",
      "Playful",
      "Casual",
      "Friendly",
      "Energetic",
      "Dynamic",
      "Rounded letterforms",
      "Open counters",
      "Uneven strokes",
      "Geometric construction",
      "Organic elements",
      "Branding",
      "Headlines",
      "Digital design",
      "Print design",
      "Tight spaces",
      "Informality",
      "Playfulness",
      "Creativity"
    ]
  }
}