{
  "filename": "dirty_calligraphy_36px.png",
  "status": "success",
  "description": {
    "detailed_description": "Dirty Calligraphy is a display typeface that embodies a raw, unrefined aesthetic. Its construction is based on a bold, calligraphic stroke with exaggerated flourishes and sharp, angular terminals. The letterforms are highly stylized, with pronounced ascenders and descenders that create a sense of dramatic height. The overall effect is one of chaotic energy and rebellious spirit, reminiscent of graffiti or punk rock aesthetics. The font's lack of consistent stroke weight and uneven spacing contribute to its raw, hand-drawn feel. While its legibility is limited, especially in smaller sizes, it excels in large-scale applications where its bold character can make a statement. Dirty Calligraphy's rebellious energy and raw aesthetic make it ideal for projects that demand a bold, edgy, and unconventional visual identity. It's perfect for creating eye-catching headlines, branding for underground music or fashion, or adding a touch of rebellious flair to graphic design projects.",
    "technical_characteristics": [
      "Calligraphic stroke",
      "Exaggerated flourishes",
      "Sharp, angular terminals",
      "Highly stylized letterforms",
      "Pronounced ascenders and descenders",
      "Uneven stroke weight",
      "Uneven spacing"
    ],
    "personality_traits": [
      "Rebellious",
      "Raw",
      "Unrefined",
      "Energetic",
      "Chaotic",
      "Bold",
      "Edgy"
    ],
    "practical_contexts": [
      "Large-scale headlines",
      "Branding for underground music or fashion",
      "Graphic design projects requiring a bold visual identity",
      "Posters",
      "T-shirt designs"
    ],
    "cultural_intuition": [
      "Graffiti",
      "Punk rock",
      "Street art",
      "Underground culture",
      "Rebellious spirit"
    ],
    "search_keywords": [
      "Calligraphy",
      "Display typeface",
      "Bold",
      "Edgy",
      "Raw",
      "Unrefined",
      "Energetic",
      "Chaotic",
      "Rebellious",
      "Graffiti",
      "Punk rock",
      "Street art",
      "Underground culture",
      "Headlines",
      "Branding",
      "Graphic design",
      "Posters",
      "T-shirt designs",
      "Large-scale",
      "Display",
      "Unconventional",
      "Stylized",
      "Flourishes",
      "Angular",
      "Ascenders",
      "Descenders",
      "Uneven",
      "Spacing",
      "Limited legibility"
    ]
  }
}