{
  "filename": "dirty_old_town_36px.png",
  "status": "success",
  "description": {
    "detailed_description": "Dirty Old Town is a bold, sans-serif typeface that exudes a rugged, industrial aesthetic. Its geometric construction, with sharp corners and strong vertical strokes, creates a sense of solidity and strength. The letterforms are tightly packed, with minimal spacing between characters, contributing to a dense and impactful visual presence. The font's heavy weight and consistent stroke width lend a sense of authority and confidence, while the slightly rounded terminals soften the edges, preventing it from feeling overly harsh. This balance between geometric precision and subtle humanization makes Dirty Old Town versatile, suitable for headlines, branding, and even large-scale signage. Its industrial heritage evokes a sense of grit and authenticity, making it ideal for projects that require a raw and unpolished feel. The font's bold presence and strong legibility make it suitable for both print and digital applications, particularly in situations where a commanding and memorable visual impact is desired.",
    "technical_characteristics": [
      "Geometric construction",
      "Heavy weight",
      "Consistent stroke width",
      "Tight letter spacing",
      "Sharp corners",
      "Rounded terminals",
      "High x-height"
    ],
    "personality_traits": [
      "Rugged",
      "Industrial",
      "Bold",
      "Confident",
      "Authoritative",
      "Impactful",
      "Authentic"
    ],
    "practical_contexts": [
      "Headlines",
      "Branding",
      "Signage",
      "Large-scale displays",
      "Print and digital applications"
    ],
    "cultural_intuition": [
      "Industrial heritage",
      "Urban grit",
      "Raw authenticity",
      "Modern industrial design",
      "Nostalgic for a bygone era"
    ],
    "search_keywords": [
      "Sans-serif",
      "Bold",
      "Geometric",
      "Industrial",
      "Heavy",
      "Sharp",
      "Rounded",
      "Tight spacing",
      "High x-height",
      "Headlines",
      "Branding",
      "Signage",
      "Large-scale",
      "Print",
      "Digital",
      "Grit",
      "Authenticity",
      "Modern",
      "Nostalgic"
    ]
  }
}