{
  "filename": "discipuli_britannica_36px.png",
  "status": "success",
  "description": {
    "detailed_description": "Discipuli Britannica is a charming script font that captures the essence of handwritten elegance. Its flowing strokes and graceful curves evoke a sense of personal touch, reminiscent of traditional calligraphy. The font's construction is based on a combination of organic and geometric principles, resulting in a balance between fluidity and structure. The letterforms are carefully crafted with varying weights and subtle transitions, creating a sense of depth and dimension. The generous x-height and open counters ensure excellent legibility, even at smaller sizes. The font's overall character is both playful and sophisticated, making it suitable for a wide range of applications, from branding and packaging to invitations and social media graphics. Its contemporary relevance lies in its ability to convey authenticity and warmth, while its cultural associations evoke a sense of nostalgia and classic charm. The font's versatility allows it to be used effectively in both traditional and digital contexts, adding a touch of personality and sophistication to any project.",
    "technical_characteristics": [
      "flowing strokes",
      "graceful curves",
      "varying weights",
      "generous x-height",
      "open counters",
      "subtle transitions",
      "organic and geometric construction"
    ],
    "personality_traits": [
      "charming",
      "elegant",
      "playful",
      "sophisticated",
      "handwritten",
      "authentic",
      "warm"
    ],
    "practical_contexts": [
      "branding",
      "packaging",
      "invitations",
      "social media graphics",
      "lettering",
      "typography"
    ],
    "cultural_intuition": [
      "traditional calligraphy",
      "nostalgia",
      "classic charm",
      "personal touch",
      "handwritten elegance"
    ],
    "search_keywords": [
      "script font",
      "handwritten",
      "calligraphy",
      "elegant",
      "charming",
      "flowing",
      "graceful",
      "versatile",
      "legible",
      "sophisticated",
      "playful",
      "authentic",
      "warm",
      "nostalgia",
      "classic",
      "branding",
      "packaging",
      "invitations",
      "social media",
      "lettering",
      "typography",
      "digital",
      "traditional"
    ]
  }
}