{
  "filename": "distraught_36px.png",
  "status": "success",
  "description": {
    "detailed_description": "Distraught is a bold, sans-serif typeface that embodies a sense of chaotic energy and playful disruption. Its construction is characterized by sharp, angular cuts and jagged edges, creating a visually jarring and unpredictable aesthetic. The letterforms are often fragmented and incomplete, with strokes seemingly torn or ripped away, adding to the overall sense of disruption. This fragmented approach to letterform design creates a sense of movement and dynamism, as if the letters are in a constant state of flux. The font's bold weight and high x-height ensure strong legibility, even in small sizes, making it suitable for headlines, posters, and other applications where visual impact is paramount. However, its unconventional design and aggressive nature may limit its use in more formal or traditional contexts. Distraught's chaotic energy evokes a sense of rebellion and nonconformity, suggesting a disregard for conventional norms and a desire to break free from established structures. It's a font that speaks to the unpredictable nature of contemporary culture, where digital disruption and creative experimentation are the norm. Its bold and disruptive aesthetic makes it ideal for projects that seek to challenge expectations and push boundaries, particularly in the realms of street art, graphic design, and digital media.",
    "technical_characteristics": [
      "jagged edges",
      "fragmented letterforms",
      "angular cuts",
      "bold weight",
      "high x-height"
    ],
    "personality_traits": [
      "chaotic",
      "disruptive",
      "energetic",
      "rebellious",
      "unconventional"
    ],
    "practical_contexts": [
      "headlines",
      "posters",
      "street art",
      "graphic design",
      "digital media"
    ],
    "cultural_intuition": [
      "digital disruption",
      "creative experimentation",
      "nonconformity",
      "rebellion",
      "contemporary culture"
    ],
    "search_keywords": [
      "sans-serif",
      "bold",
      "jagged",
      "fragmented",
      "disruptive",
      "chaotic",
      "energetic",
      "unconventional",
      "rebellious",
      "street art",
      "graphic design",
      "digital media",
      "headlines",
      "posters",
      "high x-height",
      "bold weight",
      "contemporary",
      "culture",
      "nonconformity",
      "experimentation"
    ]
  }
}