{
  "filename": "distortia_36px.png",
  "status": "success",
  "description": {
    "detailed_description": "This font, aptly named \"Distortia\", is a bold statement in the realm of display typefaces. Its construction is entirely based on the manipulation of strokes, each letter appearing as if it were drawn with a thick, textured brush. The strokes are highly irregular, with sharp angles and jagged edges, creating a sense of raw energy and unbridled expression. The x-height is relatively low, contributing to the font's aggressive and somewhat chaotic appearance. Despite the irregularity, the letters maintain a surprising degree of legibility, thanks to the clear distinction between strokes and the overall consistency of the design language. Distortia's personality is undeniably rebellious and edgy, evoking a sense of punk rock aesthetics and underground culture. It's a font that screams for attention, demanding to be noticed and challenging conventional typographic norms. While its highly stylized nature limits its practical applications, Distortia excels in situations where a bold, disruptive visual impact is desired. It's perfect for creating eye-catching headlines, branding for rebellious brands, or adding a touch of anarchy to digital interfaces. The font's cultural resonance lies in its connection to subcultures that embrace nonconformity and raw expression, making it a powerful tool for communicating a sense of rebellion and individuality.",
    "technical_characteristics": [
      "Highly irregular stroke construction",
      "Sharp angles and jagged edges",
      "Textured brush-like appearance",
      "Low x-height",
      "Consistent design language"
    ],
    "personality_traits": [
      "Rebellious",
      "Edgy",
      "Aggressive",
      "Chaotic",
      "Unconventional",
      "Energetic",
      "Disruptive",
      "Attention-grabbing"
    ],
    "practical_contexts": [
      "Headlines",
      "Branding for rebellious brands",
      "Digital interfaces",
      "Posters",
      "Street art"
    ],
    "cultural_intuition": [
      "Punk rock aesthetics",
      "Underground culture",
      "Nonconformity",
      "Raw expression",
      "Rebellion",
      "Individuality"
    ],
    "search_keywords": [
      "Distortia",
      "Display typeface",
      "Brush script",
      "Punk rock",
      "Underground",
      "Rebellious",
      "Edgy",
      "Chaotic",
      "Aggressive",
      "Unconventional",
      "Energetic",
      "Disruptive",
      "Attention-grabbing",
      "Headlines",
      "Branding",
      "Digital interfaces",
      "Posters",
      "Street art",
      "Nonconformity",
      "Raw expression",
      "Individuality"
    ]
  }
}