{
  "filename": "dker_finepoint_36px.png",
  "status": "success",
  "description": {
    "detailed_description": "This font embodies a playful yet legible handwritten style, reminiscent of casual note-taking or personal correspondence. The rounded forms and fluid strokes create a sense of informality and warmth, while the consistent letterforms ensure readability. The slight variations in letter heights and widths add a touch of natural irregularity, further enhancing the handwritten feel. The font's open counters and generous x-height contribute to its legibility, making it suitable for both short and long blocks of text. Its casual charm makes it ideal for projects that require a friendly and approachable tone, such as invitations, social media graphics, or branding for creative businesses. The font's handwritten aesthetic evokes a sense of authenticity and personal connection, suggesting a human touch in a digital world.",
    "technical_characteristics": [
      "Rounded letterforms",
      "Fluid strokes",
      "Variable letter heights",
      "Open counters",
      "Generous x-height"
    ],
    "personality_traits": [
      "Playful",
      "Legible",
      "Casual",
      "Warm",
      "Approachable"
    ],
    "practical_contexts": [
      "Invitations",
      "Social media graphics",
      "Branding for creative businesses",
      "Short text blocks",
      "Casual correspondence"
    ],
    "cultural_intuition": [
      "Evokes a sense of authenticity",
      "Suggests a human touch",
      "Reflects a casual and friendly tone",
      "Connects with a contemporary aesthetic",
      "Appeals to a digital-native audience"
    ],
    "search_keywords": [
      "Handwritten",
      "Script",
      "Casual",
      "Playful",
      "Legible",
      "Rounded",
      "Fluid",
      "Open counters",
      "Generous x-height",
      "Informal",
      "Warm",
      "Friendly",
      "Approachable",
      "Authentic",
      "Personal",
      "Digital",
      "Social media",
      "Branding",
      "Invitations",
      "Creative",
      "Note-taking",
      "Correspondence"
    ]
  }
}