{
  "filename": "doctor_garcia_36px.png",
  "status": "success",
  "description": {
    "detailed_description": "Doctor Garcia is a sans-serif typeface that blends a geometric foundation with subtle humanist details, resulting in a font that feels both modern and approachable. The letterforms are constructed with clean, precise lines and sharp corners, giving the font a strong, confident presence. However, the slightly rounded terminals and open counters add a touch of warmth and approachability, preventing the font from feeling overly rigid or cold. This balance between geometric structure and humanist details creates a unique personality that is both professional and friendly. The font's high x-height and generous spacing ensure excellent legibility, making it suitable for a wide range of applications, from headlines and branding to body text and digital interfaces. Its bold, confident character makes it ideal for conveying a sense of authority and trustworthiness, while its approachable nature ensures that it remains engaging and accessible to a broad audience. Doctor Garcia's design evokes a sense of modern sophistication, suggesting a brand that is both innovative and reliable. Its clean lines and sharp corners hint at a digital-native aesthetic, while its subtle humanist details add a touch of warmth and personality, making it suitable for a variety of contemporary applications.",
    "technical_characteristics": [
      "Geometric construction",
      "Sharp corners",
      "High x-height",
      "Open counters",
      "Slightly rounded terminals",
      "Generous spacing"
    ],
    "personality_traits": [
      "Confidently geometric",
      "Subtly humanist",
      "Approachable",
      "Professional",
      "Friendly",
      "Modern",
      "Sophisticated"
    ],
    "practical_contexts": [
      "Headlines",
      "Branding",
      "Body text",
      "Digital interfaces",
      "Large-scale displays"
    ],
    "cultural_intuition": [
      "Evokes modern sophistication",
      "Suggests digital-native design",
      "Conveys authority and trustworthiness",
      "Feels approachable and engaging",
      "Suitable for a variety of contemporary applications"
    ],
    "search_keywords": [
      "Sans-serif",
      "Geometric",
      "Humanist",
      "Modern",
      "Approachable",
      "Professional",
      "Friendly",
      "High x-height",
      "Open counters",
      "Rounded terminals",
      "Legible",
      "Headlines",
      "Branding",
      "Body text",
      "Digital interfaces",
      "Large-scale displays",
      "Contemporary",
      "Sophisticated",
      "Authority",
      "Trustworthy",
      "Engaging",
      "Accessible"
    ]
  }
}