{
  "filename": "dolato_de_stato_36px.png",
  "status": "success",
  "description": {
    "detailed_description": "Dolato de Stato is a playful yet sophisticated script font that captures the essence of handwritten calligraphy with a modern twist. Its flowing strokes and dynamic letterforms create a sense of energy and movement, while the carefully balanced proportions and consistent weight ensure readability. The font's distinctive feature is its use of textured strokes, reminiscent of brush lettering, which adds a touch of authenticity and personality. This texture, combined with the slightly irregular baseline, gives the font a handcrafted feel, making it ideal for projects that require a personal touch. While the overall impression is one of casual charm, the font's refined details and elegant curves prevent it from appearing too informal. Its versatility allows it to be used for a wide range of applications, from branding and packaging to social media graphics and website headers. Dolato de Stato evokes a sense of warmth and approachability, making it perfect for projects that aim to connect with audiences on an emotional level. Its contemporary relevance lies in its ability to bridge the gap between traditional calligraphy and modern digital design, offering a unique and engaging aesthetic that resonates with today's audiences.",
    "technical_characteristics": [
      "flowing strokes",
      "dynamic letterforms",
      "textured strokes",
      "irregular baseline",
      "consistent weight",
      "balanced proportions",
      "refined details",
      "elegant curves"
    ],
    "personality_traits": [
      "playful",
      "sophisticated",
      "energetic",
      "handcrafted",
      "casual",
      "charming",
      "approachable",
      "versatile",
      "refined"
    ],
    "practical_contexts": [
      "branding",
      "packaging",
      "social media graphics",
      "website headers",
      "invitations",
      "posters",
      "editorial design"
    ],
    "cultural_intuition": [
      "evokes a sense of warmth and approachability",
      "captures the essence of handwritten calligraphy",
      "bridges the gap between traditional calligraphy and modern digital design",
      "resonates with today's audiences",
      "suggests a personal touch"
    ],
    "search_keywords": [
      "script font",
      "handwritten",
      "calligraphy",
      "brush lettering",
      "textured",
      "dynamic",
      "playful",
      "sophisticated",
      "casual",
      "charming",
      "versatile",
      "branding",
      "packaging",
      "social media",
      "website",
      "invitations",
      "posters",
      "editorial design",
      "modern",
      "contemporary",
      "approachable",
      "authentic",
      "handcrafted"
    ]
  }
}