{
  "filename": "dollar_store_stencil_36px.png",
  "status": "success",
  "description": {
    "detailed_description": "Dollar Store Stencil is a bold, geometric sans-serif font that embodies a raw, utilitarian aesthetic. Its construction is based on simple, blocky shapes with sharp corners and open counters, reminiscent of hand-cut stencils. The x-height is relatively high, contributing to its strong legibility, while the consistent stroke weight and lack of serifs create a sense of directness and clarity. The font's design personality is both assertive and approachable, conveying a sense of authenticity and practicality. It draws inspiration from industrial signage and street art, reflecting a DIY ethos and a connection to urban environments. Dollar Store Stencil is well-suited for headlines, branding, and signage where a bold, impactful message is desired. Its straightforward design and high contrast make it effective for large-scale applications, particularly in digital contexts where its bold presence can stand out. The font's cultural associations evoke a sense of DIY creativity, urban grit, and a playful disregard for traditional typographic conventions. It suggests a sense of authenticity and a connection to the everyday, making it a compelling choice for projects that embrace a raw, unpolished aesthetic.",
    "technical_characteristics": [
      "Geometric construction",
      "Sharp corners",
      "Open counters",
      "Consistent stroke weight",
      "High x-height",
      "Lack of serifs",
      "Bold weight"
    ],
    "personality_traits": [
      "Assertive",
      "Approachable",
      "Authentic",
      "Practical",
      "Direct",
      "Clear",
      "Bold"
    ],
    "practical_contexts": [
      "Headlines",
      "Branding",
      "Signage",
      "Large-scale displays",
      "Digital interfaces"
    ],
    "cultural_intuition": [
      "DIY ethos",
      "Urban grit",
      "Street art influence",
      "Playful disregard for convention",
      "Authenticity",
      "Everyday aesthetic"
    ],
    "search_keywords": [
      "Geometric sans-serif",
      "Stencil font",
      "Bold font",
      "High x-height",
      "Open counters",
      "Sharp corners",
      "Industrial signage",
      "Street art",
      "Urban aesthetic",
      "DIY",
      "Authentic",
      "Practical",
      "Headlines",
      "Branding",
      "Signage",
      "Large-scale",
      "Digital"
    ]
  }
}