{
  "filename": "dolores_36px.png",
  "status": "success",
  "description": {
    "detailed_description": "Dolores is a playful and expressive font that draws inspiration from hand-drawn lettering. Its rounded forms and uneven strokes create a sense of casual charm, while the subtle 3D effect adds a touch of whimsy. The font's construction is based on a combination of geometric and organic elements, resulting in a unique and visually appealing style. The letterforms are generally well-proportioned, with a high x-height that ensures good legibility, even at smaller sizes. The font's distinctive features include its exaggerated curves, playful serifs, and the subtle shadow effect that gives it a sense of depth. Dolores is well-suited for use in headlines, logos, and other display applications where its playful personality can shine. Its casual and approachable nature makes it ideal for projects that require a touch of whimsy and personality. The font's cultural associations include a sense of nostalgia for hand-drawn lettering and a connection to contemporary trends in graphic design that embrace playful and expressive typography.",
    "technical_characteristics": [
      "Rounded forms",
      "Uneven strokes",
      "3D effect",
      "High x-height",
      "Exaggerated curves",
      "Playful serifs",
      "Hand-drawn aesthetic"
    ],
    "personality_traits": [
      "Playful",
      "Expressive",
      "Whimsical",
      "Casual",
      "Charming",
      "Approachable",
      "Nostalgic"
    ],
    "practical_contexts": [
      "Headlines",
      "Logos",
      "Display typography",
      "Branding",
      "Children's books",
      "Social media graphics"
    ],
    "cultural_intuition": [
      "Nostalgia for hand-drawn lettering",
      "Contemporary graphic design trends",
      "Playful and expressive typography",
      "Casual and approachable style",
      "Sense of whimsy and personality"
    ],
    "search_keywords": [
      "Dolores",
      "Hand-drawn",
      "Playful",
      "Expressive",
      "Whimsical",
      "Casual",
      "Charming",
      "Rounded",
      "Uneven",
      "3D",
      "High x-height",
      "Serifs",
      "Shadow",
      "Headlines",
      "Logos",
      "Display",
      "Branding",
      "Children's",
      "Social media",
      "Nostalgia",
      "Contemporary",
      "Graphic design"
    ]
  }
}