{
  "filename": "domestic_manners_36px.png",
  "status": "success",
  "description": {
    "detailed_description": "Domestic Manners is a playful script font that captures the essence of casual handwritten notes. Its flowing strokes and irregular letterforms evoke a sense of spontaneity and personal expression. The font's construction is based on a combination of calligraphic principles and a touch of geometric structure, resulting in a balance between organic and controlled forms. The ascenders and descenders are well-defined, contributing to its legibility, while the varying stroke weights and subtle curves add visual interest. The overall effect is a font that feels both familiar and unique, suitable for adding a touch of personality to a variety of projects. Its casual nature makes it ideal for branding, social media graphics, and handwritten-style typography, while its legibility ensures readability even in smaller sizes. The font's playful character evokes a sense of warmth and approachability, suggesting a connection to personal expression and creative freedom. It's a font that feels both modern and timeless, reflecting the current trend towards handwritten aesthetics while retaining a classic charm.",
    "technical_characteristics": [
      "flowing strokes",
      "irregular letterforms",
      "varying stroke weights",
      "well-defined ascenders and descenders",
      "subtle curves",
      "calligraphic influences",
      "geometric structure"
    ],
    "personality_traits": [
      "playful",
      "spontaneous",
      "personal",
      "casual",
      "approachable",
      "warm",
      "unique"
    ],
    "practical_contexts": [
      "branding",
      "social media graphics",
      "handwritten-style typography",
      "casual signage",
      "personal projects"
    ],
    "cultural_intuition": [
      "evokes a sense of personal expression",
      "reflects the trend towards handwritten aesthetics",
      "suggests a connection to creativity",
      "feels both modern and timeless",
      "captures the spirit of casual communication"
    ],
    "search_keywords": [
      "script font",
      "handwritten",
      "playful",
      "casual",
      "personal",
      "flowing",
      "irregular",
      "legible",
      "branding",
      "social media",
      "typography",
      "handwritten style",
      "modern",
      "timeless",
      "approachable",
      "warm",
      "unique",
      "creative",
      "communication"
    ]
  }
}