{
  "filename": "domigorgon_36px.png",
  "status": "success",
  "description": {
    "detailed_description": "Domigorgon is a playful and expressive script font that captures the energy of handwritten text. Its irregular letterforms and fluid strokes create a sense of spontaneity and personality. The font's generous x-height and open counters ensure good legibility, even at smaller sizes. The slightly rounded terminals and playful ascenders and descenders add a touch of whimsy and charm. Domigorgon's casual character makes it ideal for informal projects, such as social media graphics, handwritten notes, and playful branding. Its hand-drawn aesthetic evokes a sense of authenticity and warmth, making it perfect for projects that require a personal touch. The font's versatility allows it to be used in a variety of contexts, from casual invitations to quirky website designs.",
    "technical_characteristics": [
      "Irregular letterforms",
      "Fluid strokes",
      "Generous x-height",
      "Open counters",
      "Slightly rounded terminals",
      "Playful ascenders and descenders"
    ],
    "personality_traits": [
      "Playful",
      "Expressive",
      "Spontaneous",
      "Casual",
      "Whimsical",
      "Charming",
      "Authentic"
    ],
    "practical_contexts": [
      "Social media graphics",
      "Handwritten notes",
      "Playful branding",
      "Informal invitations",
      "Quirky website designs"
    ],
    "cultural_intuition": [
      "Evokes a sense of authenticity and warmth",
      "Captures the energy of handwritten text",
      "Suggests a personal touch",
      "Reflects a casual and playful attitude"
    ],
    "search_keywords": [
      "Script font",
      "Handwritten",
      "Playful",
      "Expressive",
      "Casual",
      "Whimsical",
      "Charming",
      "Authentic",
      "Informal",
      "Social media",
      "Branding",
      "Website design",
      "Hand lettering",
      "Digital art",
      "Graphic design",
      "Typography",
      "Font analysis"
    ]
  }
}