{
  "filename": "donner_36px.png",
  "status": "success",
  "description": {
    "detailed_description": "This font embodies a playful, almost childlike energy, achieved through its highly irregular letterforms and inconsistent stroke weights. Each character feels hand-drawn, with sharp angles and abrupt transitions creating a sense of spontaneity. The lowercase letters, particularly 'a', 'g', and 'y', exhibit a distinct asymmetry, adding to the whimsical feel. While the overall construction is loose, the font maintains a surprising degree of legibility, likely due to its generous x-height and open counters. This makes it suitable for short bursts of text, especially in digital contexts where its unique character can add a touch of personality to headlines or branding elements. The font's playful nature evokes a sense of creativity and unconventionality, reminiscent of early digital art and the DIY aesthetic of the internet's early days. It suggests a playful, approachable tone, ideal for projects that embrace a sense of individuality and unconventionality.",
    "technical_characteristics": [
      "Highly irregular letterforms",
      "Inconsistent stroke weights",
      "Sharp angles and abrupt transitions",
      "Asymmetrical lowercase letters",
      "Generous x-height",
      "Open counters"
    ],
    "personality_traits": [
      "Playful",
      "Whimsical",
      "Spontaneous",
      "Unconventional",
      "Approachable",
      "Creative",
      "Individualistic"
    ],
    "practical_contexts": [
      "Headlines",
      "Branding elements",
      "Short bursts of text",
      "Digital interfaces",
      "Social media graphics"
    ],
    "cultural_intuition": [
      "Early digital art",
      "DIY aesthetic",
      "Internet culture",
      "Unconventional design",
      "Playful expression"
    ],
    "search_keywords": [
      "Hand-drawn",
      "Irregular",
      "Playful",
      "Whimsical",
      "Unconventional",
      "Digital",
      "Headline",
      "Branding",
      "Social media",
      "Early internet",
      "DIY",
      "Creative",
      "Approachable",
      "Individualistic",
      "Asymmetrical",
      "Generous x-height",
      "Open counters",
      "Sharp angles",
      "Abrupt transitions",
      "Inconsistent stroke weights"
    ]
  }
}