{
  "filename": "dornen_36px.png",
  "status": "success",
  "description": {
    "detailed_description": "Dornen is a bold, blackletter-inspired typeface that blends traditional gothic elements with a contemporary edge. Its sharp, angular strokes and jagged serifs create a visually striking and aggressive aesthetic. The font's construction is based on a geometric framework, with consistent proportions and relationships between letterforms. This geometric foundation provides a sense of order and structure, while the jagged details inject a sense of chaos and energy. The high x-height and open counters ensure strong legibility, even at small sizes. The font's bold weight and dramatic serifs make it ideal for headlines, logos, and other display applications. Its aggressive personality and strong visual impact make it suitable for projects that require a sense of power, rebellion, or darkness. Dornen's contemporary relevance lies in its ability to capture the spirit of underground culture and subvert traditional typographic norms. Its cultural associations range from heavy metal music and gothic subculture to contemporary street art and graphic design. While its bold aesthetic might not be suitable for extended body text, Dornen excels in creating a powerful visual statement for branding, posters, and other impactful designs.",
    "technical_characteristics": [
      "Geometric construction",
      "Jagged serifs",
      "High x-height",
      "Open counters",
      "Bold weight",
      "Blackletter inspiration",
      "Angular strokes"
    ],
    "personality_traits": [
      "Aggressive",
      "Powerful",
      "Rebellious",
      "Dark",
      "Visually striking",
      "Energetic",
      "Bold",
      "Contemporary",
      "Subversive"
    ],
    "practical_contexts": [
      "Headlines",
      "Logos",
      "Posters",
      "Branding",
      "Display typography",
      "Street art",
      "Graphic design"
    ],
    "cultural_intuition": [
      "Heavy metal music",
      "Gothic subculture",
      "Underground culture",
      "Street art",
      "Contemporary graphic design"
    ],
    "search_keywords": [
      "Blackletter",
      "Gothic",
      "Bold",
      "Aggressive",
      "Jagged",
      "Geometric",
      "High x-height",
      "Open counters",
      "Display",
      "Headline",
      "Logo",
      "Poster",
      "Branding",
      "Street art",
      "Graphic design",
      "Heavy metal",
      "Underground",
      "Subversive",
      "Contemporary",
      "Dark",
      "Power",
      "Rebellion"
    ]
  }
}