{
  "filename": "dosmilcatorce_36px.png",
  "status": "success",
  "description": {
    "detailed_description": "Dosmilcatorce is a bold, sans-serif typeface that exudes a confident and assertive personality. Its geometric construction, with sharp angles and strong strokes, creates a sense of solidity and power. The font's high x-height and open counters ensure excellent legibility, even at smaller sizes. The slightly rounded terminals, however, add a touch of approachability, preventing the font from feeling overly harsh or cold. This balance between geometric precision and subtle humanism makes Dosmilcatorce versatile for a range of applications, from bold headlines and branding to digital interfaces and editorial design. Its strong presence and clear readability make it ideal for conveying authority and confidence, while its subtle warmth prevents it from feeling overly aggressive or intimidating. The font's overall character evokes a sense of modernism and dynamism, suggesting a forward-thinking and progressive approach. Its bold and confident nature aligns well with contemporary design trends, particularly in the realm of technology and innovation.",
    "technical_characteristics": [
      "Geometric construction",
      "High x-height",
      "Open counters",
      "Sharp angles",
      "Strong strokes",
      "Slightly rounded terminals",
      "Bold weight"
    ],
    "personality_traits": [
      "Confident",
      "Assertive",
      "Solid",
      "Powerful",
      "Legible",
      "Approachable",
      "Modern",
      "Dynamic",
      "Forward-thinking",
      "Progressive"
    ],
    "practical_contexts": [
      "Headlines",
      "Branding",
      "Digital interfaces",
      "Editorial design",
      "Large-scale displays"
    ],
    "cultural_intuition": [
      "Evokes a sense of modernism and dynamism",
      "Suggests a forward-thinking and progressive approach",
      "Aligns well with contemporary design trends",
      "Particularly suited for technology and innovation"
    ],
    "search_keywords": [
      "Geometric sans-serif",
      "Bold typeface",
      "High x-height",
      "Open counters",
      "Sharp angles",
      "Strong strokes",
      "Rounded terminals",
      "Legible",
      "Modern",
      "Dynamic",
      "Confident",
      "Assertive",
      "Headlines",
      "Branding",
      "Digital interfaces",
      "Editorial design",
      "Large-scale displays",
      "Technology",
      "Innovation"
    ]
  }
}