{
  "filename": "doughnutz_36px.png",
  "status": "success",
  "description": {
    "detailed_description": "Doughnutz is a playful script font that blends classic calligraphic flourishes with a contemporary, almost whimsical, touch. Its flowing strokes and delicate curves create a sense of movement and energy, while the carefully balanced proportions and consistent stroke weights ensure legibility even at smaller sizes. The font's distinctive feature is the inclusion of decorative elements, such as swashes and flourishes, which add a touch of personality and charm to the overall design. These flourishes are carefully integrated into the letterforms, enhancing their visual appeal without sacrificing readability. Doughnutz is a versatile font that can be used for a variety of purposes, from branding and packaging to social media graphics and invitations. Its playful nature makes it ideal for projects that require a touch of whimsy and charm, while its legibility ensures that it can be used effectively in both large and small sizes. The font's overall aesthetic evokes a sense of nostalgia and warmth, reminiscent of vintage signage and handwritten notes. This nostalgic quality, combined with its contemporary design, makes Doughnutz a unique and versatile choice for a wide range of projects.",
    "technical_characteristics": [
      "flowing strokes",
      "delicate curves",
      "decorative elements",
      "consistent stroke weights",
      "balanced proportions"
    ],
    "personality_traits": [
      "playful",
      "whimsical",
      "charming",
      "versatile",
      "nostalgic"
    ],
    "practical_contexts": [
      "branding and packaging",
      "social media graphics",
      "invitations",
      "handwritten notes",
      "vintage signage"
    ],
    "cultural_intuition": [
      "evokes a sense of nostalgia",
      "reminiscent of vintage signage",
      "suggests a playful and charming personality",
      "contemporary take on a classic style",
      "ideal for projects that require a touch of whimsy"
    ],
    "search_keywords": [
      "script font",
      "playful",
      "whimsical",
      "decorative elements",
      "flourishes",
      "swashes",
      "versatile",
      "nostalgic",
      "vintage",
      "handwritten",
      "branding",
      "packaging",
      "social media",
      "invitations",
      "graphics",
      "legible",
      "balanced proportions",
      "consistent stroke weights",
      "flowing strokes",
      "delicate curves",
      "charming",
      "contemporary",
      "classic",
      "calligraphic"
    ]
  }
}