{
  "filename": "downcome_36px.png",
  "status": "success",
  "description": {
    "detailed_description": "Downcome is a display typeface that embodies a raw, industrial aesthetic. Its bold, chunky letterforms are built with a distinct geometric foundation, featuring sharp angles and strong, vertical strokes. The overall construction is reminiscent of vintage signage and industrial machinery, with a heavy, almost brutalist feel. This is further emphasized by the rough, distressed texture applied to each character, creating a sense of wear and tear that adds to the font's gritty personality. Despite its aggressive appearance, Downcome maintains a surprising level of legibility, thanks to its generous x-height and open counters. This makes it suitable for headlines and branding elements where a strong visual impact is desired, even at smaller sizes. The font's cultural associations lean towards urban grit, underground culture, and industrial design, evoking a sense of rebellion and authenticity. It's a typeface that speaks to a contemporary audience seeking a bold, edgy aesthetic, particularly in the realms of streetwear, music, and alternative design.",
    "technical_characteristics": [
      "Geometric construction",
      "Bold weight",
      "Sharp angles",
      "Distressed texture",
      "High x-height",
      "Open counters",
      "Heavy stroke weight"
    ],
    "personality_traits": [
      "Gritty",
      "Industrial",
      "Bold",
      "Aggressive",
      "Raw",
      "Authentic",
      "Rebellious"
    ],
    "practical_contexts": [
      "Headlines",
      "Branding",
      "Posters",
      "Streetwear graphics",
      "Music album covers",
      "Digital interfaces"
    ],
    "cultural_intuition": [
      "Urban grit",
      "Underground culture",
      "Industrial design",
      "Rebellion",
      "Authenticity"
    ],
    "search_keywords": [
      "Display typeface",
      "Geometric",
      "Bold",
      "Distressed",
      "Industrial",
      "Urban",
      "Gritty",
      "Underground",
      "Streetwear",
      "Music",
      "Alternative",
      "Headlines",
      "Branding",
      "Posters",
      "Digital",
      "Heavy",
      "Rough",
      "Vintage",
      "Signage",
      "Machinery",
      "Rebellious",
      "Authentic",
      "Raw",
      "Edgy"
    ]
  }
}