{
  "filename": "drama_and_co_36px.png",
  "status": "success",
  "description": {
    "detailed_description": "This font is a playful exploration of theatrical imagery, using stylized faces and masks as its glyphs. The construction is primarily geometric, with bold, blocky shapes and strong contrasts between thick and thin strokes. This creates a sense of drama and immediacy, reminiscent of vintage theatrical posters or woodcut illustrations. The glyphs are often simplified, with exaggerated features and expressive details, adding to the whimsical and slightly cartoonish character. While the font is clearly inspired by traditional theatrical design, it also has a contemporary feel, with a bold, graphic aesthetic that would be well-suited for digital applications. The font's playful nature makes it ideal for projects that require a touch of whimsy and personality, such as children's books, branding for creative industries, or even social media graphics. However, its bold and graphic nature might not be suitable for all applications, particularly those requiring a more formal or sophisticated tone.",
    "technical_characteristics": [
      "Geometric construction",
      "Bold, blocky shapes",
      "Strong contrast between thick and thin strokes",
      "Simplified glyphs",
      "Exaggerated features",
      "Expressive details",
      "Limited character set"
    ],
    "personality_traits": [
      "Playful",
      "Whimsical",
      "Bold",
      "Graphic",
      "Expressive",
      "Dramatic",
      "Slightly cartoonish"
    ],
    "practical_contexts": [
      "Children's books",
      "Branding for creative industries",
      "Social media graphics",
      "Posters and flyers",
      "Headline text"
    ],
    "cultural_intuition": [
      "Vintage theatrical design",
      "Woodcut illustrations",
      "Contemporary graphic design",
      "Playfulness and humor",
      "Creative expression"
    ],
    "search_keywords": [
      "Theatrical",
      "Mask",
      "Face",
      "Geometric",
      "Bold",
      "Graphic",
      "Playful",
      "Whimsical",
      "Expressive",
      "Cartoonish",
      "Vintage",
      "Woodcut",
      "Digital",
      "Branding",
      "Children's",
      "Poster",
      "Flyer",
      "Headline",
      "Social media"
    ]
  }
}