{
  "filename": "drawvetica_mini_36px.png",
  "status": "success",
  "description": {
    "detailed_description": "Drawvetica Mini is a playful sans-serif font that evokes a hand-drawn aesthetic. Its rounded letterforms and slightly irregular stroke widths create a sense of informality and warmth, while the overall structure remains legible and functional. The font's construction is based on a geometric framework, with circular and elliptical shapes dominating the letterforms. This geometric foundation provides a sense of order and balance, while the hand-drawn details add a touch of personality and whimsy. The font's high x-height and open counters ensure readability even at small sizes, making it suitable for both digital and print applications. Drawvetica Mini's playful character makes it ideal for branding, packaging, and editorial design, particularly for projects that require a friendly and approachable tone. Its hand-drawn aesthetic evokes a sense of creativity and authenticity, making it a good choice for projects that aim to connect with a younger audience. The font's versatility allows it to be used in a variety of contexts, from playful headlines to body text, adding a touch of personality to any design.",
    "technical_characteristics": [
      "Rounded letterforms",
      "Geometric construction",
      "Irregular stroke widths",
      "High x-height",
      "Open counters"
    ],
    "personality_traits": [
      "Playful",
      "Informal",
      "Warm",
      "Friendly",
      "Approachable"
    ],
    "practical_contexts": [
      "Branding",
      "Packaging",
      "Editorial design",
      "Digital interfaces",
      "Small-scale print"
    ],
    "cultural_intuition": [
      "Hand-drawn aesthetic",
      "Modern design",
      "Youthful energy",
      "Creative expression",
      "Authenticity"
    ],
    "search_keywords": [
      "Sans-serif",
      "Rounded",
      "Geometric",
      "Hand-drawn",
      "Playful",
      "Informal",
      "Warm",
      "Friendly",
      "Approachable",
      "Legible",
      "High x-height",
      "Open counters",
      "Branding",
      "Packaging",
      "Editorial",
      "Digital",
      "Print",
      "Modern",
      "Youthful",
      "Creative",
      "Authentic"
    ]
  }
}