{
  "filename": "drawman_36px.png",
  "status": "success",
  "description": {
    "detailed_description": "Drawman is a font that captures the essence of hand-drawn lettering, offering a unique blend of casual charm and intentional design. Its construction is based on a slightly irregular, yet controlled, stroke width, creating a sense of natural variation that adds character. The rounded terminals and open counters contribute to its friendly and approachable feel, while the consistent baseline and overall structure ensure legibility. The font's personality is playful yet refined, suggesting a balance between spontaneity and intentionality. It evokes a sense of authenticity and warmth, reminiscent of handwritten notes or personalized sketches. Drawman's versatility makes it suitable for a range of applications, from casual branding and social media graphics to editorial layouts and even handwritten-style signage. Its informal yet polished aesthetic aligns well with contemporary design trends, particularly in areas where authenticity and human connection are valued. The font's subtle imperfections and organic feel create a sense of intimacy and personal touch, making it ideal for projects that aim to convey warmth and approachability.",
    "technical_characteristics": [
      "Irregular stroke width",
      "Rounded terminals",
      "Open counters",
      "Consistent baseline",
      "Slight variation in letterforms"
    ],
    "personality_traits": [
      "Playful yet refined",
      "Casual yet intentional",
      "Friendly and approachable",
      "Authentic and warm",
      "Informal yet polished"
    ],
    "practical_contexts": [
      "Casual branding",
      "Social media graphics",
      "Editorial layouts",
      "Handwritten-style signage",
      "Digital interfaces"
    ],
    "cultural_intuition": [
      "Evokes a sense of authenticity",
      "Suggests a personal touch",
      "Reflects contemporary design trends",
      "Connects with the value of human connection",
      "Captures the spirit of handwritten communication"
    ],
    "search_keywords": [
      "Handwritten",
      "Sketchy",
      "Casual",
      "Playful",
      "Friendly",
      "Informal",
      "Authentic",
      "Warm",
      "Versatile",
      "Branding",
      "Social media",
      "Editorial",
      "Signage",
      "Digital",
      "Contemporary",
      "Approachable",
      "Legible",
      "Rounded terminals",
      "Open counters",
      "Irregular stroke width",
      "Consistent baseline",
      "Variation"
    ]
  }
}