{
  "filename": "drawgio_sans_36px.png",
  "status": "success",
  "description": {
    "detailed_description": "Drawgio Sans embodies a playful, hand-drawn aesthetic, capturing the spontaneity of handwritten text. Its irregular letterforms, with varying stroke weights and organic curves, create a sense of immediacy and personality. The font's generous x-height and open counters ensure legibility, even at smaller sizes, while the slightly rounded terminals soften its overall impression. This combination of informality and readability makes it ideal for casual branding, social media graphics, and digital interfaces where a friendly, approachable tone is desired. The font's hand-drawn nature evokes a sense of authenticity and human connection, reminiscent of personal notes and sketches. It suggests a contemporary, digital-native design sensibility, reflecting the increasing prevalence of handwritten aesthetics in online communication.",
    "technical_characteristics": [
      "Hand-drawn aesthetic",
      "Irregular letterforms",
      "Varying stroke weights",
      "Organic curves",
      "Generous x-height",
      "Open counters",
      "Slightly rounded terminals"
    ],
    "personality_traits": [
      "Playful",
      "Spontaneous",
      "Informal",
      "Friendly",
      "Approachable",
      "Authentic",
      "Human",
      "Casual"
    ],
    "practical_contexts": [
      "Casual branding",
      "Social media graphics",
      "Digital interfaces",
      "Handwritten-style typography",
      "Small-scale text"
    ],
    "cultural_intuition": [
      "Digital-native design",
      "Authenticity and human connection",
      "Contemporary handwritten aesthetic",
      "Casual communication"
    ],
    "search_keywords": [
      "Hand-drawn",
      "Playful",
      "Informal",
      "Casual",
      "Social media",
      "Digital",
      "Branding",
      "Typography",
      "Script",
      "Sans-serif",
      "Rounded terminals",
      "Open counters",
      "Generous x-height",
      "Handwritten aesthetic",
      "Digital-native",
      "Authentic",
      "Approachable",
      "Friendly",
      "Modern",
      "Contemporary"
    ]
  }
}