{
  "filename": "drawfont_36px.png",
  "status": "success",
  "description": {
    "detailed_description": "DrawFont embodies a playful, hand-drawn aesthetic, capturing the immediacy of sketching. Its irregular letterforms, varying stroke weights, and expressive flourishes create a sense of spontaneity and personality. The font's construction is inherently organic, with each letterform feeling unique and slightly imperfect, reflecting the natural variation of handwriting. This informality is balanced by a clear, legible structure, ensuring readability even in its casual nature. DrawFont's versatility shines in digital contexts, particularly for social media graphics, informal branding, and playful interfaces. Its hand-drawn quality evokes a sense of authenticity and connection, making it ideal for projects that prioritize a personal touch. The font's cultural resonance lies in its connection to the DIY spirit and the rise of digital creativity, reflecting a generation that embraces imperfection and self-expression.",
    "technical_characteristics": [
      "Irregular letterforms",
      "Varying stroke weights",
      "Expressive flourishes",
      "Organic construction",
      "Clear, legible structure"
    ],
    "personality_traits": [
      "Playful",
      "Spontaneous",
      "Expressive",
      "Informal",
      "Authentic"
    ],
    "practical_contexts": [
      "Social media graphics",
      "Informal branding",
      "Playful interfaces",
      "Handwritten notes",
      "Digital illustrations"
    ],
    "cultural_intuition": [
      "DIY spirit",
      "Digital creativity",
      "Self-expression",
      "Authenticity",
      "Connection"
    ],
    "search_keywords": [
      "Hand-drawn",
      "Sketchy",
      "Playful",
      "Informal",
      "Expressive",
      "Organic",
      "Legible",
      "Social media",
      "Branding",
      "Digital",
      "DIY",
      "Creative",
      "Authentic",
      "Connection",
      "Casual",
      "Spontaneous",
      "Irregular",
      "Varying stroke weights",
      "Flourishes",
      "Unique",
      "Imperfect",
      "Versatile",
      "Modern",
      "Contemporary"
    ]
  }
}