{
  "filename": "drawer_sketches_36px.png",
  "status": "success",
  "description": {
    "detailed_description": "The font \"Drawer Sketches\" embodies a playful, hand-drawn aesthetic, capturing the immediacy and informality of sketching. Its irregular letterforms, with varying stroke weights and organic curves, evoke the feeling of a quick, expressive mark-making. The font's generous x-height and open counters contribute to its legibility, even in smaller sizes, while the inconsistent baseline and occasional overshoots add to its hand-crafted charm. This font is ideal for projects that require a personal touch, such as handwritten notes, social media graphics, or branding for creative businesses. Its casual yet engaging personality aligns well with contemporary trends in digital design, where authenticity and human connection are valued. The font's inherent imperfection evokes a sense of warmth and approachability, suggesting a friendly and relatable brand identity.",
    "technical_characteristics": [
      "Irregular letterforms",
      "Varying stroke weights",
      "Organic curves",
      "Generous x-height",
      "Open counters",
      "Inconsistent baseline",
      "Overshoots"
    ],
    "personality_traits": [
      "Playful",
      "Hand-drawn",
      "Expressive",
      "Casual",
      "Informal",
      "Friendly",
      "Relatable"
    ],
    "practical_contexts": [
      "Handwritten notes",
      "Social media graphics",
      "Branding for creative businesses",
      "Digital interfaces",
      "Small-scale typography"
    ],
    "cultural_intuition": [
      "Authenticity",
      "Human connection",
      "Digital-native design",
      "Contemporary trends",
      "Warmth and approachability"
    ],
    "search_keywords": [
      "Handwritten",
      "Sketchy",
      "Playful",
      "Casual",
      "Informal",
      "Expressive",
      "Organic",
      "Irregular",
      "Generous x-height",
      "Open counters",
      "Inconsistent baseline",
      "Overshoots",
      "Digital design",
      "Social media",
      "Branding",
      "Creative",
      "Friendly",
      "Relatable",
      "Authenticity",
      "Human connection"
    ]
  }
}