{
  "filename": "drawpen_36px.png",
  "status": "success",
  "description": {
    "detailed_description": "Drawpen is a script typeface that captures the natural flow and subtle variations of handwritten lettering. Its organic forms are characterized by fluid strokes, gentle curves, and a consistent baseline, creating a sense of effortless elegance. The font's x-height is moderate, balancing legibility with a graceful aesthetic. The ascenders and descenders are well-proportioned, adding to the overall rhythm and visual appeal. Drawpen's personality is both approachable and sophisticated, evoking a sense of warmth and authenticity. It draws inspiration from classic calligraphic styles, but with a contemporary twist that feels fresh and inviting. The font's versatility makes it suitable for a wide range of applications, from handwritten notes and personal branding to website headers and social media graphics. Its natural flow and organic character lend themselves well to digital interfaces, adding a touch of personality and warmth to online experiences. Drawpen's cultural resonance lies in its ability to evoke a sense of handcrafted authenticity, a quality that is increasingly valued in a digital world.",
    "technical_characteristics": [
      "Organic forms",
      "Fluid strokes",
      "Gentle curves",
      "Consistent baseline",
      "Moderate x-height",
      "Well-proportioned ascenders and descenders"
    ],
    "personality_traits": [
      "Effortlessly elegant",
      "Approachable",
      "Sophisticated",
      "Warm",
      "Authentic",
      "Fresh",
      "Inviting"
    ],
    "practical_contexts": [
      "Handwritten notes",
      "Personal branding",
      "Website headers",
      "Social media graphics",
      "Digital interfaces"
    ],
    "cultural_intuition": [
      "Handcrafted authenticity",
      "Contemporary twist on classic calligraphy",
      "Digital-native design aesthetic"
    ],
    "search_keywords": [
      "Script typeface",
      "Handwritten lettering",
      "Organic forms",
      "Fluid strokes",
      "Gentle curves",
      "Consistent baseline",
      "Moderate x-height",
      "Well-proportioned ascenders and descenders",
      "Approachable",
      "Sophisticated",
      "Warm",
      "Authentic",
      "Fresh",
      "Inviting",
      "Handwritten notes",
      "Personal branding",
      "Website headers",
      "Social media graphics",
      "Digital interfaces",
      "Handcrafted authenticity",
      "Contemporary calligraphy",
      "Digital-native design"
    ]
  }
}