{
  "filename": "dreamwish_36px.png",
  "status": "success",
  "description": {
    "detailed_description": "Dreamwish is a display typeface that embodies a playful, almost cartoonish energy. Its rounded forms and exaggerated curves give it a distinct hand-drawn quality, reminiscent of vintage comic book lettering. The font's construction is characterized by a combination of organic curves and sharp angles, creating a dynamic and unpredictable visual rhythm. The letterforms are generously proportioned, with a high x-height and open counters that ensure legibility even at larger sizes. The bold strokes and contrasting weights add to the font's playful personality, making it ideal for eye-catching headlines and playful branding. While its whimsical nature might limit its use in formal contexts, Dreamwish excels in creating a sense of fun and lightheartedness, making it perfect for projects that require a touch of whimsy and nostalgia. Its retro aesthetic evokes a sense of childhood wonder and playful creativity, making it suitable for projects targeting a younger audience or those seeking a nostalgic feel.",
    "technical_characteristics": [
      "Rounded letterforms",
      "Exaggerated curves",
      "High x-height",
      "Open counters",
      "Bold strokes",
      "Contrasting weights",
      "Organic curves",
      "Sharp angles"
    ],
    "personality_traits": [
      "Playful",
      "Whimsical",
      "Nostalgic",
      "Hand-drawn",
      "Cartoonish",
      "Dynamic",
      "Unpredictable",
      "Bold",
      "Energetic"
    ],
    "practical_contexts": [
      "Headlines",
      "Branding",
      "Posters",
      "Packaging",
      "Children's books",
      "Digital interfaces"
    ],
    "cultural_intuition": [
      "Vintage comic book lettering",
      "Retro aesthetic",
      "Childhood wonder",
      "Playful creativity",
      "Nostalgia"
    ],
    "search_keywords": [
      "Display typeface",
      "Rounded",
      "Curved",
      "Hand-drawn",
      "Comic book",
      "Vintage",
      "Playful",
      "Whimsical",
      "Nostalgic",
      "Bold",
      "Energetic",
      "Headlines",
      "Branding",
      "Posters",
      "Packaging",
      "Children's books",
      "Digital interfaces",
      "Retro",
      "Cartoon",
      "Fun",
      "Lighthearted"
    ]
  }
}