{
  "filename": "dread_36px.png",
  "status": "success",
  "description": {
    "detailed_description": "The font \"Dread\" is a bold and aggressive display typeface that draws inspiration from the aesthetics of horror and heavy metal. Its defining characteristic is the use of jagged, irregular letterforms with sharp, angular terminals. These features create a sense of raw energy and danger, reminiscent of ripped and torn textures. The font's construction is organic and unpredictable, with each letterform exhibiting unique variations in its outline. This irregularity adds to the font's raw and visceral appeal, making it ideal for conveying a sense of chaos and intensity. The font's high x-height and open counters ensure good legibility, even at smaller sizes, while its bold weight and aggressive character make it suitable for large-scale applications such as posters, album covers, and merchandise. \"Dread\" evokes a sense of rebellion and defiance, drawing on the visual language of punk rock and underground culture. Its raw and unpolished aesthetic speaks to a subculture that embraces the unconventional and the edgy, making it a powerful tool for expressing a sense of rebellion and individuality.",
    "technical_characteristics": [
      "Jagged, irregular letterforms",
      "Sharp, angular terminals",
      "Organic and unpredictable construction",
      "High x-height",
      "Open counters",
      "Bold weight",
      "Large x-height"
    ],
    "personality_traits": [
      "Aggressive",
      "Raw",
      "Visceral",
      "Rebellious",
      "Defiant",
      "Unconventional",
      "Edgy"
    ],
    "practical_contexts": [
      "Posters",
      "Album covers",
      "Merchandise",
      "Headlines",
      "Titles",
      "Logos"
    ],
    "cultural_intuition": [
      "Horror",
      "Heavy metal",
      "Punk rock",
      "Underground culture",
      "Rebellion",
      "Defiance",
      "Individuality"
    ],
    "search_keywords": [
      "Dread",
      "Horror",
      "Heavy metal",
      "Punk rock",
      "Display font",
      "Aggressive",
      "Bold",
      "Jagged",
      "Irregular",
      "Sharp",
      "Angular",
      "Organic",
      "Unpredictable",
      "High x-height",
      "Open counters",
      "Large x-height",
      "Rebellion",
      "Defiance",
      "Underground",
      "Edgy",
      "Visceral",
      "Raw",
      "Poster",
      "Album cover",
      "Merchandise",
      "Headline",
      "Title",
      "Logo"
    ]
  }
}