{
  "filename": "drew_handwriting_36px.png",
  "status": "success",
  "description": {
    "detailed_description": "Drew Handwriting is a script typeface that captures the essence of casual handwritten text. Its flowing strokes and natural variations in letterforms create a sense of immediacy and authenticity. The font's generous x-height and open counters ensure good legibility, even at smaller sizes. The subtle variations in stroke weight and the gentle curves of the letterforms add a touch of warmth and personality. While the overall impression is relaxed and informal, the font's consistent structure and well-defined letterforms maintain a sense of professionalism. Drew Handwriting is well-suited for branding projects that seek a friendly and approachable aesthetic, particularly in digital contexts where its natural flow and organic feel can enhance user engagement. The font's cultural associations evoke a sense of personal expression and authenticity, reminiscent of handwritten notes and personal correspondence. It suggests a connection to the human touch and a desire for genuine communication.",
    "technical_characteristics": [
      "Script typeface",
      "Natural variations in letterforms",
      "Generous x-height",
      "Open counters",
      "Subtle variations in stroke weight",
      "Gentle curves",
      "Consistent structure",
      "Well-defined letterforms"
    ],
    "personality_traits": [
      "Casual",
      "Authentic",
      "Friendly",
      "Approachable",
      "Warm",
      "Informal",
      "Professional",
      "Expressive",
      "Genuine"
    ],
    "practical_contexts": [
      "Branding projects",
      "Digital interfaces",
      "Social media graphics",
      "Handwritten-style typography",
      "Short text blocks"
    ],
    "cultural_intuition": [
      "Personal expression",
      "Authenticity",
      "Handwritten notes",
      "Personal correspondence",
      "Human touch",
      "Genuine communication"
    ],
    "search_keywords": [
      "Script typeface",
      "Handwriting",
      "Casual",
      "Informal",
      "Friendly",
      "Approachable",
      "Legible",
      "Digital",
      "Branding",
      "Social media",
      "Authentic",
      "Expressive",
      "Genuine",
      "Warm",
      "Professional",
      "Natural variations",
      "Open counters",
      "Generous x-height",
      "Subtle stroke variations",
      "Consistent structure",
      "Well-defined letterforms"
    ]
  }
}