{
  "filename": "dt_mi_x_yvs_36px.png",
  "status": "success",
  "description": {
    "detailed_description": "This font is a playful exploration of illustrative typography, where each letter is represented by a unique, cartoonish monster. The design is characterized by a loose, hand-drawn style with exaggerated features and expressive details. The characters are rendered with a mix of simple geometric shapes and organic curves, creating a whimsical and slightly unsettling visual language. The font's overall mood is lighthearted and humorous, with a touch of dark whimsy. It evokes a sense of childhood nostalgia, reminiscent of classic monster movies and cartoons. The font's playful nature makes it ideal for projects that require a fun and engaging visual style, such as children's books, Halloween decorations, or branding for quirky businesses. However, its limited character set and unconventional design might make it less suitable for formal or professional applications.",
    "technical_characteristics": [
      "Hand-drawn style",
      "Cartoonish characters",
      "Exaggerated features",
      "Simple geometric shapes",
      "Organic curves",
      "Limited character set"
    ],
    "personality_traits": [
      "Playful",
      "Whimsical",
      "Humorous",
      "Slightly unsettling",
      "Nostalgic",
      "Quirky",
      "Unconventional"
    ],
    "practical_contexts": [
      "Children's books",
      "Halloween decorations",
      "Branding for quirky businesses",
      "Fun and engaging visual projects",
      "Limited text applications"
    ],
    "cultural_intuition": [
      "Childhood nostalgia",
      "Classic monster movies",
      "Cartoons",
      "Dark whimsy",
      "Pop culture references"
    ],
    "search_keywords": [
      "Hand-drawn",
      "Cartoon",
      "Monster",
      "Illustrative",
      "Playful",
      "Whimsical",
      "Humorous",
      "Nostalgic",
      "Quirky",
      "Unconventional",
      "Limited character set",
      "Halloween",
      "Children's book",
      "Branding",
      "Graphic design",
      "Typography",
      "Font",
      "Typeface"
    ]
  }
}