{
  "filename": "duck_in_shipah_36px.png",
  "status": "success",
  "description": {
    "detailed_description": "This font, with its flowing curves and dynamic angles, embodies a playful yet sophisticated spirit. The calligraphic origins are evident in the fluid strokes and graceful ascenders, but the design is not merely a mimicry of handwriting. It exhibits a deliberate structure, with consistent letterforms and a balanced weight distribution. The generous x-height and open counters ensure excellent legibility, even at smaller sizes. The font's personality is both charming and confident, suggesting a brand that is both approachable and aspirational. Its versatility makes it suitable for a wide range of applications, from elegant branding and packaging to playful social media graphics and website headers. The font's cultural resonance lies in its ability to evoke a sense of vintage charm, reminiscent of classic signage and handwritten notes, while simultaneously feeling fresh and contemporary. It captures the spirit of a brand that is both rooted in tradition and embracing the modern world.",
    "technical_characteristics": [
      "Calligraphic inspiration",
      "Fluid strokes",
      "Dynamic angles",
      "Generous x-height",
      "Open counters",
      "Balanced weight distribution",
      "Consistent letterforms"
    ],
    "personality_traits": [
      "Playful",
      "Sophisticated",
      "Charming",
      "Confident",
      "Approachable",
      "Aspirational",
      "Versatile"
    ],
    "practical_contexts": [
      "Branding and packaging",
      "Social media graphics",
      "Website headers",
      "Display typography",
      "Handwritten-style text"
    ],
    "cultural_intuition": [
      "Vintage charm",
      "Classic signage",
      "Handwritten notes",
      "Modern aesthetic",
      "Contemporary relevance"
    ],
    "search_keywords": [
      "Calligraphic",
      "Script",
      "Cursive",
      "Playful",
      "Sophisticated",
      "Elegant",
      "Handwritten",
      "Vintage",
      "Modern",
      "Display",
      "Branding",
      "Packaging",
      "Social media",
      "Website",
      "Header",
      "Legible",
      "Versatile",
      "Approachable",
      "Aspirational"
    ]
  }
}