{
  "filename": "dudeludel_36px.png",
  "status": "success",
  "description": {
    "detailed_description": "This font is a playful and expressive display typeface with a strong retro vibe. Its rounded, bulbous forms are reminiscent of 1960s and 70s cartoon lettering, evoking a sense of fun and nostalgia. The exaggerated curves and uneven letter widths create a dynamic and energetic feel, while the bold weight and solid black fills ensure high visibility. The font's construction is based on simple, organic shapes, with each letterform feeling like a hand-drawn doodle. This informality adds to its charm and makes it ideal for projects that require a friendly and approachable tone. While the font's playful nature makes it well-suited for children's books, branding for playful products, or eye-catching headlines, its bold weight and strong legibility also make it suitable for larger-scale applications like signage or posters. The font's retro aesthetic evokes a sense of optimism and carefree fun, reminiscent of a simpler time. It's a versatile tool for designers looking to add a touch of whimsy and personality to their projects.",
    "technical_characteristics": [
      "Rounded letterforms",
      "Exaggerated curves",
      "Uneven letter widths",
      "Bold weight",
      "Solid black fills",
      "Organic construction",
      "Hand-drawn aesthetic"
    ],
    "personality_traits": [
      "Playful",
      "Expressive",
      "Retro",
      "Nostalgic",
      "Energetic",
      "Friendly",
      "Approachable"
    ],
    "practical_contexts": [
      "Children's books",
      "Playful branding",
      "Headlines",
      "Signage",
      "Posters"
    ],
    "cultural_intuition": [
      "1960s and 70s cartoon lettering",
      "Sense of fun and nostalgia",
      "Optimism and carefree fun",
      "Simpler time"
    ],
    "search_keywords": [
      "Rounded",
      "Bulbous",
      "Retro",
      "Cartoon",
      "Display",
      "Playful",
      "Expressive",
      "Nostalgic",
      "Energetic",
      "Bold",
      "Hand-drawn",
      "Whimsical",
      "Friendly",
      "Approachable",
      "Children's",
      "Branding",
      "Headlines",
      "Signage",
      "Posters"
    ]
  }
}