{
  "filename": "dusk_36px.png",
  "status": "success",
  "description": {
    "detailed_description": "This font, with its bold, blocky forms and dramatic shadow effect, exudes a powerful and assertive presence. The geometric construction of the letters, with their sharp angles and consistent stroke widths, creates a sense of solidity and strength. The exaggerated x-height and open counters ensure excellent legibility, even at small sizes. The shadow effect, with its subtle gradient, adds depth and dimension, enhancing the font's visual impact. This combination of technical precision and visual dynamism makes it ideal for headlines, logos, and other applications where a strong visual statement is desired. The font's bold character evokes a sense of authority and confidence, reminiscent of vintage signage and industrial design. Its contemporary relevance lies in its ability to convey a sense of power and energy, making it suitable for projects that require a bold and impactful aesthetic. The font's cultural associations range from the gritty realism of industrial design to the futuristic aesthetic of cyberpunk, suggesting a blend of classic and contemporary influences.",
    "technical_characteristics": [
      "Geometric construction",
      "Bold weight",
      "Exaggerated x-height",
      "Open counters",
      "Consistent stroke widths",
      "Sharp angles",
      "Shadow effect with gradient"
    ],
    "personality_traits": [
      "Powerful",
      "Assertive",
      "Solid",
      "Strong",
      "Dynamic",
      "Authoritative",
      "Confident",
      "Gritty",
      "Futuristic"
    ],
    "practical_contexts": [
      "Headlines",
      "Logos",
      "Posters",
      "Signage",
      "Gaming",
      "Science fiction",
      "Industrial design"
    ],
    "cultural_intuition": [
      "Vintage signage",
      "Industrial design",
      "Cyberpunk",
      "Futuristic",
      "Gritty realism",
      "Power and energy"
    ],
    "search_keywords": [
      "Geometric",
      "Bold",
      "Shadow",
      "Exaggerated x-height",
      "Open counters",
      "Sharp angles",
      "Headlines",
      "Logos",
      "Posters",
      "Signage",
      "Gaming",
      "Science fiction",
      "Industrial design",
      "Vintage",
      "Futuristic",
      "Powerful",
      "Assertive",
      "Dynamic",
      "Authoritative",
      "Confident",
      "Gritty",
      "Modern",
      "Contemporary"
    ]
  }
}