{
  "filename": "easy_going_stroke_36px.png",
  "status": "success",
  "description": {
    "detailed_description": "This font embodies a casual, handwritten aesthetic with a touch of playful whimsy. Its irregular letterforms, characterized by fluid strokes and varying thicknesses, evoke the spontaneity of personal handwriting. The ascenders and descenders are generously proportioned, adding to the overall sense of openness and informality. While the font's construction is inherently organic, it maintains a degree of legibility through consistent letterforms and a balanced baseline. This balance makes it suitable for a range of applications, from casual social media posts to more formal branding elements, as long as the context allows for a relaxed and approachable tone. The font's cultural resonance lies in its connection to the contemporary trend of embracing authenticity and personal expression, reflecting a desire for genuine communication over sterile formality.",
    "technical_characteristics": [
      "Irregular letterforms",
      "Fluid strokes",
      "Varying stroke thickness",
      "Generous ascenders and descenders",
      "Balanced baseline",
      "Organic construction",
      "Handwritten aesthetic"
    ],
    "personality_traits": [
      "Casual",
      "Playful",
      "Whimsical",
      "Spontaneous",
      "Open",
      "Informal",
      "Approachable"
    ],
    "practical_contexts": [
      "Social media posts",
      "Branding elements",
      "Handwritten notes",
      "Informal invitations",
      "Digital illustrations"
    ],
    "cultural_intuition": [
      "Authenticity",
      "Personal expression",
      "Genuine communication",
      "Contemporary trend",
      "Relaxed tone"
    ],
    "search_keywords": [
      "Handwritten",
      "Script",
      "Casual",
      "Playful",
      "Whimsical",
      "Informal",
      "Organic",
      "Fluid",
      "Irregular",
      "Open",
      "Approachable",
      "Social media",
      "Branding",
      "Digital",
      "Illustration",
      "Authenticity",
      "Personal expression",
      "Contemporary",
      "Trend"
    ]
  }
}