{
  "filename": "ecriture_36px.png",
  "status": "success",
  "description": {
    "detailed_description": "Ecriture is a playful script font that captures the energy of handwritten text. Its flowing strokes and irregular letterforms evoke a sense of spontaneity and informality. The font's construction is based on a combination of calligraphic principles and a touch of geometric structure, resulting in a unique blend of organic and controlled forms. The ascenders and descenders are relatively short, creating a compact and balanced appearance. The overall character of the font is friendly and approachable, with a hint of whimsy. It's reminiscent of handwritten notes or personal correspondence, suggesting a sense of intimacy and authenticity. Ecriture's versatility makes it suitable for a wide range of applications, from branding and packaging to social media graphics and website design. Its informal yet legible nature makes it ideal for headlines, logos, and short text blocks, adding a touch of personality and charm to any project. The font's cultural resonance lies in its connection to the handwritten word, evoking a sense of nostalgia and personal expression. It's a font that feels both familiar and fresh, capturing the spirit of contemporary digital culture while retaining a timeless appeal.",
    "technical_characteristics": [
      "flowing strokes",
      "irregular letterforms",
      "short ascenders and descenders",
      "compact and balanced appearance",
      "calligraphic influences",
      "geometric structure",
      "consistent stroke weight"
    ],
    "personality_traits": [
      "playful",
      "spontaneous",
      "informal",
      "friendly",
      "approachable",
      "whimsical",
      "authentic",
      "legible",
      "versatile"
    ],
    "practical_contexts": [
      "branding and packaging",
      "social media graphics",
      "website design",
      "headlines",
      "logos",
      "short text blocks"
    ],
    "cultural_intuition": [
      "handwritten notes",
      "personal correspondence",
      "nostalgia",
      "personal expression",
      "contemporary digital culture",
      "timeless appeal"
    ],
    "search_keywords": [
      "script font",
      "handwritten",
      "playful",
      "informal",
      "legible",
      "versatile",
      "branding",
      "packaging",
      "social media",
      "website design",
      "headlines",
      "logos",
      "short text",
      "whimsical",
      "authentic",
      "nostalgia",
      "personal expression",
      "digital culture",
      "timeless"
    ]
  }
}