{
  "filename": "einfach_36px.png",
  "status": "success",
  "description": {
    "detailed_description": "The font \"Einfach\" embodies a playful yet legible handwritten style, capturing the essence of casual communication. Its organic curves and irregular letterforms evoke the spontaneity of penmanship, while maintaining a clear and readable structure. The varying stroke weights and subtle calligraphic flourishes add a touch of personality and warmth, making it feel approachable and friendly. The font's generous x-height and open counters ensure readability even at smaller sizes, making it suitable for both digital and print applications. Its informal character makes it ideal for branding projects that seek a personal touch, while its legibility ensures it can be used effectively for body text and headlines. The font's overall aesthetic evokes a sense of youthful energy and creativity, reminiscent of handwritten notes and personal expressions, making it a versatile choice for projects that aim to convey authenticity and a sense of human connection.",
    "technical_characteristics": [
      "Handwritten style",
      "Organic curves",
      "Irregular letterforms",
      "Varying stroke weights",
      "Calligraphic flourishes",
      "Generous x-height",
      "Open counters"
    ],
    "personality_traits": [
      "Playful",
      "Legible",
      "Approachable",
      "Friendly",
      "Informal",
      "Youthful",
      "Creative",
      "Authentic"
    ],
    "practical_contexts": [
      "Branding projects",
      "Digital interfaces",
      "Social media graphics",
      "Handwritten notes",
      "Personal expressions"
    ],
    "cultural_intuition": [
      "Casual communication",
      "Spontaneity",
      "Personal touch",
      "Youthful energy",
      "Creative expression"
    ],
    "search_keywords": [
      "Handwritten",
      "Script",
      "Casual",
      "Playful",
      "Legible",
      "Informal",
      "Friendly",
      "Youthful",
      "Creative",
      "Branding",
      "Digital",
      "Print",
      "Social media",
      "Notes",
      "Expressions",
      "Authentic"
    ]
  }
}