{
  "filename": "elastic_letters_36px.png",
  "status": "success",
  "description": {
    "detailed_description": "This font, with its bold, geometric construction and pronounced outlines, exudes a strong, almost industrial personality. The letters are built with sharp corners and straight lines, creating a sense of rigidity and precision. The thick outlines, reminiscent of extruded lettering, add a three-dimensional quality, further emphasizing the font's robust nature. The consistent stroke weight and open counters ensure excellent legibility, even at smaller sizes. This makes it suitable for headlines, logos, and other applications where impact and clarity are paramount. The font's bold, almost aggressive character evokes a sense of power and authority, reminiscent of futuristic technology or urban environments. It suggests a sense of control and order, perhaps even a touch of defiance, making it ideal for projects that demand a strong visual presence.",
    "technical_characteristics": [
      "Geometric construction",
      "Thick outlines",
      "Sharp corners",
      "Consistent stroke weight",
      "Open counters"
    ],
    "personality_traits": [
      "Bold",
      "Geometric",
      "Industrial",
      "Powerful",
      "Authoritative"
    ],
    "practical_contexts": [
      "Headlines",
      "Logos",
      "Posters",
      "Digital interfaces",
      "Gaming"
    ],
    "cultural_intuition": [
      "Futuristic technology",
      "Urban environments",
      "Industrial design",
      "Power and control",
      "Defiance"
    ],
    "search_keywords": [
      "Geometric",
      "Bold",
      "Industrial",
      "Extruded",
      "Outline",
      "Sharp corners",
      "Open counters",
      "Headlines",
      "Logos",
      "Posters",
      "Digital",
      "Gaming",
      "Futuristic",
      "Urban",
      "Power",
      "Authority",
      "Control",
      "Defiance"
    ]
  }
}