{
  "filename": "elisana_36px.png",
  "status": "success",
  "description": {
    "detailed_description": "Elisana is a handwritten script font that captures the casual charm of everyday writing. Its flowing strokes and natural variations in letterforms create a sense of authenticity and warmth. The font's construction is based on a combination of calligraphic principles and digital refinement, resulting in a balance of organic fluidity and controlled legibility. The generous x-height and open counters ensure readability even at smaller sizes, while the slightly rounded terminals soften the overall impression. Elisana's personality is both approachable and expressive, suggesting a friendly and informal tone. It evokes a sense of personal connection, reminiscent of handwritten notes or heartfelt messages. The font's versatility makes it suitable for a wide range of applications, from branding and packaging to social media graphics and website design. Its casual yet refined aesthetic lends itself well to projects that require a touch of warmth and personality, particularly in digital contexts where handwritten elements can add a unique touch.",
    "technical_characteristics": [
      "Handwritten style",
      "Flowing strokes",
      "Natural variations",
      "Generous x-height",
      "Open counters",
      "Slightly rounded terminals",
      "Consistent baseline",
      "Moderate weight"
    ],
    "personality_traits": [
      "Approachable",
      "Expressive",
      "Friendly",
      "Informal",
      "Warm",
      "Authentic",
      "Casual",
      "Refined",
      "Personal"
    ],
    "practical_contexts": [
      "Branding and packaging",
      "Social media graphics",
      "Website design",
      "Handwritten notes and messages",
      "Digital signage",
      "Short-form content"
    ],
    "cultural_intuition": [
      "Evokes a sense of personal connection",
      "Suggests a friendly and informal tone",
      "Reflects the casual aesthetic of digital culture",
      "Captures the authenticity of handwritten communication",
      "Connects with the desire for genuine expression"
    ],
    "search_keywords": [
      "Handwritten",
      "Script",
      "Casual",
      "Friendly",
      "Informal",
      "Warm",
      "Authentic",
      "Refined",
      "Personal",
      "Branding",
      "Packaging",
      "Social media",
      "Website design",
      "Digital signage",
      "Short-form content",
      "Legibility",
      "Versatility",
      "Flowing",
      "Organic",
      "Digital",
      "Contemporary",
      "Modern"
    ]
  }
}