{
  "filename": "ellis_36px.png",
  "status": "success",
  "description": {
    "detailed_description": "Ellis is a playful, hand-drawn font that captures the energy of casual writing. Its irregular letterforms and expressive strokes create a sense of spontaneity and authenticity. The font's construction is based on a loose, gestural approach, with varying stroke weights and uneven letter spacing. This informality adds to its charm, making it feel approachable and friendly. While the font's technical execution is intentionally imperfect, it maintains a clear legibility, ensuring readability even in smaller sizes. Ellis is well-suited for informal projects, such as social media graphics, handwritten notes, or playful branding. Its casual vibe evokes a sense of personal connection and authenticity, making it ideal for projects that aim to communicate warmth and approachability. The font's cultural resonance lies in its connection to the DIY aesthetic and the rise of hand-drawn typography in digital culture.",
    "technical_characteristics": [
      "Hand-drawn style",
      "Irregular letterforms",
      "Varying stroke weights",
      "Uneven letter spacing",
      "Expressive strokes",
      "Loose construction",
      "Intentional imperfections"
    ],
    "personality_traits": [
      "Playful",
      "Spontaneous",
      "Authentic",
      "Approachable",
      "Friendly",
      "Casual",
      "Informal"
    ],
    "practical_contexts": [
      "Social media graphics",
      "Handwritten notes",
      "Playful branding",
      "Informal signage",
      "Digital illustrations"
    ],
    "cultural_intuition": [
      "DIY aesthetic",
      "Hand-drawn typography",
      "Digital culture",
      "Personal connection",
      "Authenticity"
    ],
    "search_keywords": [
      "Hand-drawn",
      "Playful",
      "Casual",
      "Informal",
      "Expressive",
      "Spontaneous",
      "Authentic",
      "Social media",
      "Branding",
      "Digital",
      "Typography",
      "Script",
      "Handwriting",
      "Doodle",
      "Sketch"
    ]
  }
}