{
  "filename": "elowen_caps_36px.png",
  "status": "success",
  "description": {
    "detailed_description": "This font embodies a playful yet sophisticated spirit, drawing inspiration from both classic calligraphy and contemporary hand-lettering trends. Its flowing curves and expressive strokes create a sense of movement and energy, while the carefully balanced proportions and consistent weight ensure readability. The font's generous x-height and open counters contribute to its legibility, making it suitable for a range of sizes and applications. The slightly rounded terminals and subtle variations in stroke width add a touch of warmth and personality, preventing the font from feeling overly formal or rigid. This combination of technical precision and expressive character makes it ideal for branding, packaging, and digital interfaces where a touch of personality and visual interest is desired. The font's overall aesthetic evokes a sense of modern optimism and playful energy, suggesting a brand that is both approachable and confident.",
    "technical_characteristics": [
      "flowing curves",
      "expressive strokes",
      "generous x-height",
      "open counters",
      "rounded terminals",
      "consistent weight",
      "subtle variations in stroke width"
    ],
    "personality_traits": [
      "playful",
      "sophisticated",
      "expressive",
      "approachable",
      "confident",
      "energetic",
      "readable"
    ],
    "practical_contexts": [
      "branding",
      "packaging",
      "digital interfaces",
      "social media graphics",
      "short-form text"
    ],
    "cultural_intuition": [
      "evokes a sense of modern optimism",
      "suggests a playful and approachable brand",
      "reflects contemporary hand-lettering trends",
      "captures the energy of digital culture"
    ],
    "search_keywords": [
      "hand-lettered",
      "script",
      "playful",
      "modern",
      "energetic",
      "sophisticated",
      "readable",
      "branding",
      "packaging",
      "digital",
      "social media",
      "optimistic",
      "approachable",
      "confident",
      "flowing",
      "expressive",
      "rounded",
      "consistent",
      "generous",
      "open",
      "variations",
      "stroke width",
      "calligraphy",
      "contemporary"
    ]
  }
}