{
  "filename": "elph_chubba_36px.png",
  "status": "success",
  "description": {
    "detailed_description": "Elph Chubba 36px is a display typeface that embodies a playful, almost cartoonish energy. Its rounded, bulbous letterforms are reminiscent of classic comic book lettering, but with a contemporary twist. The font's generous x-height and open counters ensure strong legibility, even at large sizes, making it ideal for headlines and branding elements. The exaggerated curves and rounded terminals add a sense of whimsy and approachability, while the bold weight and consistent stroke width create a sense of confidence and impact. This combination of playful energy and visual strength makes Elph Chubba 36px suitable for a wide range of applications, from children's books and playful websites to bold branding and eye-catching signage. The font's cultural associations with comic book art and contemporary digital design make it a versatile choice for projects that seek to evoke a sense of fun, energy, and approachability.",
    "technical_characteristics": [
      "Rounded letterforms",
      "Exaggerated curves",
      "Bold weight",
      "Consistent stroke width",
      "Open counters",
      "Generous x-height"
    ],
    "personality_traits": [
      "Playful",
      "Whimsical",
      "Approachable",
      "Bold",
      "Confident",
      "Energetic",
      "Impactful"
    ],
    "practical_contexts": [
      "Headlines",
      "Branding elements",
      "Children's books",
      "Playful websites",
      "Eye-catching signage",
      "Large-scale displays"
    ],
    "cultural_intuition": [
      "Comic book art",
      "Contemporary digital design",
      "Playful and approachable",
      "Fun and energetic",
      "Bold and impactful"
    ],
    "search_keywords": [
      "Rounded",
      "Bold",
      "Display",
      "Comic",
      "Cartoon",
      "Playful",
      "Whimsical",
      "Approachable",
      "Energetic",
      "Impactful",
      "Headlines",
      "Branding",
      "Children's",
      "Website",
      "Signage",
      "Large-scale",
      "Digital",
      "Contemporary",
      "Classic"
    ]
  }
}