{
  "filename": "elvira_dingbats_36px.png",
  "status": "success",
  "description": {
    "detailed_description": "This font, likely inspired by classic gothic and horror movie posters, features a bold, geometric construction with sharp, angular terminals. The letterforms are tightly spaced, creating a sense of intensity and drama. The overall character is confident and assertive, with a touch of playful mischief. The font's strong, black-and-white contrast evokes a sense of vintage glamour and classic horror aesthetics. While its bold nature makes it suitable for headlines and display purposes, its legibility is compromised at smaller sizes, limiting its use in body text. The font's cultural associations are strong, evoking a sense of nostalgia for classic horror films and the campy, over-the-top style of the 1950s and 1960s. It's a font that speaks to a specific audience, those who appreciate the dark and dramatic, and who are drawn to the allure of the macabre.",
    "technical_characteristics": [
      "Geometric construction",
      "Sharp, angular terminals",
      "Tight letter spacing",
      "High contrast",
      "Bold weight"
    ],
    "personality_traits": [
      "Confident",
      "Assertive",
      "Playful",
      "Dramatic",
      "Vintage",
      "Glamorous",
      "Campy"
    ],
    "practical_contexts": [
      "Headlines",
      "Posters",
      "Logos",
      "Display type",
      "Limited use in body text"
    ],
    "cultural_intuition": [
      "Classic horror films",
      "Vintage glamour",
      "1950s and 1960s aesthetics",
      "Campy style",
      "The macabre"
    ],
    "search_keywords": [
      "Geometric",
      "Gothic",
      "Horror",
      "Bold",
      "Sharp",
      "Angular",
      "High contrast",
      "Vintage",
      "Glamour",
      "Campy",
      "Nostalgia",
      "Headlines",
      "Display",
      "Posters",
      "Logos",
      "Limited legibility",
      "Macabre",
      "Dark",
      "Dramatic"
    ]
  }
}