{
  "filename": "emilee_handwriting_36px.png",
  "status": "success",
  "description": {
    "detailed_description": "Emilee Handwriting (36px) is a script font that captures the natural flow and individual character of handwritten text. Its organic forms, with varying stroke weights and subtle calligraphic flourishes, create a sense of authenticity and warmth. The font's generous x-height and open counters ensure good legibility, even at smaller sizes, making it suitable for both display and body text. The slightly angled baseline and dynamic letterforms add a touch of movement and energy, while the overall consistency of the letterforms maintains a sense of order and readability. Emilee Handwriting evokes a sense of personal connection and intimacy, reminiscent of handwritten notes or heartfelt messages. Its casual yet refined aesthetic makes it ideal for branding projects that seek to convey authenticity, creativity, and a touch of personality. The font's versatility allows it to be used across various media, from website headers and social media graphics to printed materials like invitations and packaging.",
    "technical_characteristics": [
      "Organic forms",
      "Varying stroke weights",
      "Subtle calligraphic flourishes",
      "Generous x-height",
      "Open counters",
      "Slightly angled baseline",
      "Dynamic letterforms",
      "Consistent letterforms"
    ],
    "personality_traits": [
      "Authentic",
      "Warm",
      "Casual",
      "Refined",
      "Intimate",
      "Personal",
      "Creative",
      "Energetic",
      "Readable"
    ],
    "practical_contexts": [
      "Branding projects",
      "Website headers",
      "Social media graphics",
      "Invitations",
      "Packaging",
      "Body text"
    ],
    "cultural_intuition": [
      "Handwritten notes",
      "Heartfelt messages",
      "Personal connection",
      "Creative expression",
      "Modern design aesthetic"
    ],
    "search_keywords": [
      "Script font",
      "Handwriting font",
      "Organic forms",
      "Calligraphic flourishes",
      "Authentic",
      "Warm",
      "Casual",
      "Refined",
      "Intimate",
      "Personal",
      "Creative",
      "Energetic",
      "Readable",
      "Branding",
      "Website",
      "Social media",
      "Invitations",
      "Packaging",
      "Body text",
      "Display font",
      "Modern design",
      "Handwritten",
      "Note",
      "Message"
    ]
  }
}