{
  "filename": "emilee_digital_36px.png",
  "status": "success",
  "description": {
    "detailed_description": "Emilee Digital is a playful, handwritten script font that captures the energy of casual, expressive writing. Its loose, organic forms are reminiscent of a quick sketch, with varying stroke weights and deliberate imperfections that add a sense of authenticity. The font's generous x-height and open counters ensure good legibility, even at smaller sizes, while the slightly angled ascenders and descenders create a dynamic rhythm. This combination of informality and readability makes Emilee Digital well-suited for projects that require a friendly, approachable tone, such as social media graphics, personal branding, or handwritten notes. The font's casual charm evokes a sense of warmth and connection, suggesting a personal touch and a relaxed, informal atmosphere. It's a versatile choice for projects that aim to convey a sense of authenticity and human connection, reflecting the growing trend of embracing imperfection and individuality in digital design.",
    "technical_characteristics": [
      "Handwritten style",
      "Varying stroke weights",
      "Open counters",
      "Generous x-height",
      "Angled ascenders and descenders"
    ],
    "personality_traits": [
      "Playful",
      "Expressive",
      "Authentic",
      "Friendly",
      "Approachable"
    ],
    "practical_contexts": [
      "Social media graphics",
      "Personal branding",
      "Handwritten notes",
      "Informal invitations",
      "Short text blocks"
    ],
    "cultural_intuition": [
      "Evokes a sense of warmth and connection",
      "Reflects the trend of embracing imperfection",
      "Suggests a personal touch",
      "Conveys a relaxed, informal atmosphere",
      "Captures the spirit of casual digital communication"
    ],
    "search_keywords": [
      "Handwritten",
      "Script",
      "Playful",
      "Casual",
      "Expressive",
      "Organic",
      "Authentic",
      "Friendly",
      "Approachable",
      "Legible",
      "Social media",
      "Personal branding",
      "Handwritten notes",
      "Informal",
      "Digital",
      "Connection",
      "Imperfection",
      "Individuality"
    ]
  }
}