{
  "filename": "emoo_36px.png",
  "status": "success",
  "description": {
    "detailed_description": "This font, with its playful, hand-drawn aesthetic, embodies a sense of youthful energy and casual fun. The irregular, slightly wobbly outlines create a sense of spontaneity and informality, reminiscent of a child's scribbles or a quick doodle. The rounded forms and open counters contribute to a friendly and approachable feel, while the uneven letterforms add a touch of whimsy. The font's overall character is lighthearted and energetic, suggesting a sense of playfulness and creativity. It's well-suited for projects that require a casual, informal tone, such as children's books, social media graphics, or branding for playful products. While the font's irregular nature might limit its use in large blocks of text, its unique character makes it ideal for headlines, logos, and short bursts of text where visual impact is paramount. The font's playful nature evokes a sense of nostalgia for childhood and the freedom of creative expression, making it a fitting choice for projects that aim to capture a sense of joy and lightheartedness.",
    "technical_characteristics": [
      "Hand-drawn aesthetic",
      "Irregular outlines",
      "Rounded forms",
      "Open counters",
      "Uneven letterforms"
    ],
    "personality_traits": [
      "Playful",
      "Whimsical",
      "Informal",
      "Energetic",
      "Approachable"
    ],
    "practical_contexts": [
      "Children's books",
      "Social media graphics",
      "Playful branding",
      "Headlines",
      "Logos"
    ],
    "cultural_intuition": [
      "Nostalgia for childhood",
      "Freedom of creative expression",
      "Casual and fun",
      "Lighthearted and energetic",
      "Joy and lightheartedness"
    ],
    "search_keywords": [
      "Hand-drawn",
      "Playful",
      "Whimsical",
      "Informal",
      "Energetic",
      "Casual",
      "Fun",
      "Children's",
      "Social media",
      "Branding",
      "Headlines",
      "Logos",
      "Nostalgia",
      "Creative expression",
      "Joy",
      "Lightheartedness"
    ]
  }
}