{
  "filename": "emophonic_36px.png",
  "status": "success",
  "description": {
    "detailed_description": "This font, with its bold, geometric construction, embodies a distinct futuristic aesthetic. Each letterform is composed of sharp, angular strokes, creating a sense of precision and order. The consistent width of the characters, coupled with the absence of serifs, contributes to a clean, uncluttered appearance. The high x-height and open counters ensure strong legibility, even at small sizes. The overall effect is one of starkness and modernity, reminiscent of early digital interfaces and sci-fi imagery. This font's bold, assertive character makes it ideal for headlines, branding, and digital interfaces where a strong visual impact is desired. Its futuristic connotations lend themselves to projects related to technology, innovation, and the future. However, its starkness might limit its use in longer blocks of text, where a more approachable typeface might be preferred.",
    "technical_characteristics": [
      "Geometric construction",
      "Sharp, angular strokes",
      "Consistent letter width",
      "High x-height",
      "Open counters",
      "Absence of serifs",
      "Bold weight"
    ],
    "personality_traits": [
      "Futuristic",
      "Modern",
      "Bold",
      "Assertive",
      "Stark",
      "Clean",
      "Precise"
    ],
    "practical_contexts": [
      "Headlines",
      "Branding",
      "Digital interfaces",
      "Technology-related projects",
      "Science fiction themes"
    ],
    "cultural_intuition": [
      "Early digital interfaces",
      "Sci-fi imagery",
      "Modernity",
      "Innovation",
      "Future"
    ],
    "search_keywords": [
      "Geometric",
      "Sans-serif",
      "Bold",
      "Futuristic",
      "Modern",
      "Digital",
      "Technology",
      "Science fiction",
      "Headline",
      "Branding",
      "Interface",
      "High x-height",
      "Open counters",
      "Sharp strokes",
      "Clean",
      "Stark",
      "Assertive",
      "Concise",
      "Minimalist",
      "Contemporary",
      "Innovative",
      "Progressive"
    ]
  }
}