{
  "filename": "enforce_justice_36px.png",
  "status": "success",
  "description": {
    "detailed_description": "This font embodies a fluid, expressive script style with a contemporary twist. Its flowing strokes and dynamic angles create a sense of movement and energy, reminiscent of handwritten calligraphy. The letterforms are carefully constructed with a balance of organic curves and sharp transitions, resulting in a visually engaging and legible typeface. The generous x-height and open counters ensure readability even at smaller sizes, making it suitable for both display and body text applications. The font's overall character is both playful and sophisticated, suggesting a sense of personality and individuality. Its contemporary relevance lies in its ability to convey a sense of authenticity and human connection, while its cultural associations evoke a sense of creativity and artistic expression. The font's versatility makes it ideal for branding, packaging, social media, and digital interfaces, where it can add a touch of personality and visual interest.",
    "technical_characteristics": [
      "flowing script style",
      "dynamic angles",
      "organic curves",
      "sharp transitions",
      "generous x-height",
      "open counters"
    ],
    "personality_traits": [
      "expressive",
      "energetic",
      "playful",
      "sophisticated",
      "individualistic",
      "authentic",
      "creative"
    ],
    "practical_contexts": [
      "branding",
      "packaging",
      "social media",
      "digital interfaces",
      "display and body text"
    ],
    "cultural_intuition": [
      "handwritten calligraphy",
      "contemporary design",
      "artistic expression",
      "human connection",
      "authenticity"
    ],
    "search_keywords": [
      "script font",
      "handwritten",
      "calligraphy",
      "dynamic",
      "flowing",
      "expressive",
      "legible",
      "versatile",
      "branding",
      "packaging",
      "social media",
      "digital",
      "contemporary",
      "creative",
      "authentic",
      "playful",
      "sophisticated"
    ]
  }
}