{
  "filename": "england_36px.png",
  "status": "success",
  "description": {
    "detailed_description": "This font is a playful and whimsical collection of iconic British imagery, each glyph representing a distinct element of British culture. The glyphs are crafted with a bold, graphic style, featuring strong outlines and simplified forms. This approach creates a sense of immediacy and visual impact, making the font ideal for eye-catching headlines and playful branding. The font's bold, black-and-white aesthetic evokes a sense of classic British design, reminiscent of vintage travel posters and traditional illustrations. The use of recognizable symbols like the Union Jack, Big Ben, and double-decker buses instantly connects the font to British identity, making it perfect for projects that celebrate British culture or heritage. While the font's playful nature makes it suitable for lighthearted applications, its bold forms and strong visual presence also lend themselves to more serious projects, adding a touch of British charm and personality.",
    "technical_characteristics": [
      "bold outlines",
      "simplified forms",
      "graphic style",
      "black-and-white aesthetic",
      "iconic imagery"
    ],
    "personality_traits": [
      "playful",
      "whimsical",
      "bold",
      "graphic",
      "iconic",
      "classic",
      "traditional",
      "charming",
      "eye-catching"
    ],
    "practical_contexts": [
      "headlines",
      "branding",
      "posters",
      "illustrations",
      "packaging"
    ],
    "cultural_intuition": [
      "British culture",
      "British heritage",
      "vintage design",
      "traditional illustrations",
      "playful charm"
    ],
    "search_keywords": [
      "British",
      "London",
      "iconic",
      "graphic",
      "bold",
      "black and white",
      "whimsical",
      "playful",
      "vintage",
      "traditional",
      "culture",
      "heritage",
      "headline",
      "branding",
      "poster",
      "illustration",
      "packaging",
      "symbol",
      "Union Jack",
      "Big Ben",
      "double-decker bus"
    ]
  }
}