{
  "filename": "engravier_initials_36px.png",
  "status": "success",
  "description": {
    "detailed_description": "This font exudes a bold, confident energy, reminiscent of vintage signage and hand-drawn lettering. Its exaggerated slant and dramatic stroke variations create a dynamic, almost kinetic feel. The letterforms are constructed with a clear geometric foundation, evident in the sharp angles and consistent proportions. However, the hand-drawn quality of the strokes, with their subtle variations in thickness and texture, adds a touch of warmth and personality. This balance between geometric precision and organic detail makes the font feel both modern and timeless. Its strong presence and clear legibility make it ideal for headlines, logos, and branding applications where a powerful and memorable visual impact is desired. The font's vintage aesthetic evokes a sense of nostalgia and authenticity, while its bold character suggests a sense of confidence and authority.",
    "technical_characteristics": [
      "exaggerated slant",
      "dramatic stroke variations",
      "geometric construction",
      "sharp angles",
      "consistent proportions",
      "hand-drawn quality",
      "subtle stroke variations",
      "texture"
    ],
    "personality_traits": [
      "bold",
      "confident",
      "dynamic",
      "kinetic",
      "modern",
      "timeless",
      "powerful",
      "memorable",
      "vintage",
      "authentic",
      "authoritative"
    ],
    "practical_contexts": [
      "headlines",
      "logos",
      "branding",
      "signage",
      "display typography"
    ],
    "cultural_intuition": [
      "vintage signage",
      "hand-drawn lettering",
      "nostalgia",
      "authenticity",
      "confidence",
      "authority"
    ],
    "search_keywords": [
      "slant",
      "stroke variations",
      "geometric",
      "hand-drawn",
      "texture",
      "bold",
      "confident",
      "dynamic",
      "vintage",
      "modern",
      "headlines",
      "logos",
      "branding",
      "signage",
      "display",
      "retro",
      "authentic",
      "powerful",
      "memorable",
      "nostalgia",
      "authority"
    ]
  }
}