{
  "filename": "ernst_36px.png",
  "status": "success",
  "description": {
    "detailed_description": "Ernst is a display typeface that embodies a playful yet rugged aesthetic. Its defining characteristic is the irregular, almost haphazard, construction of each letterform, as if they were carved from individual blocks of wood. This creates a distinct visual texture, reminiscent of vintage letterpress printing or hand-crafted signage. The font's bold strokes and sharp corners contribute to its assertive personality, while the uneven edges and slight variations in letter spacing add a touch of whimsy. Despite its unconventional appearance, Ernst maintains a strong legibility, thanks to its generous x-height and open counters. This makes it suitable for headlines, posters, and other applications where a bold statement is desired. The font's rough-hewn character evokes a sense of authenticity and handcrafted quality, suggesting a connection to traditional craftsmanship and a DIY ethos. It's a font that feels both nostalgic and contemporary, capturing the spirit of independent creativity and a playful disregard for convention.",
    "technical_characteristics": [
      "irregular letterforms",
      "bold strokes",
      "sharp corners",
      "uneven edges",
      "generous x-height",
      "open counters",
      "variable letter spacing"
    ],
    "personality_traits": [
      "rugged",
      "playful",
      "assertive",
      "whimsical",
      "authentic",
      "handcrafted",
      "bold",
      "unconventional",
      "nostalgic",
      "contemporary"
    ],
    "practical_contexts": [
      "headlines",
      "posters",
      "logos",
      "packaging",
      "digital signage"
    ],
    "cultural_intuition": [
      "vintage letterpress",
      "hand-crafted signage",
      "DIY ethos",
      "independent creativity",
      "rebellious spirit"
    ],
    "search_keywords": [
      "display typeface",
      "irregular letterforms",
      "bold strokes",
      "sharp corners",
      "uneven edges",
      "generous x-height",
      "open counters",
      "vintage letterpress",
      "handcrafted",
      "DIY",
      "rebellious",
      "playful",
      "rugged",
      "authentic",
      "nostalgic",
      "contemporary",
      "headlines",
      "posters",
      "logos",
      "packaging",
      "digital signage"
    ]
  }
}