{
  "filename": "escapar_36px.png",
  "status": "success",
  "description": {
    "detailed_description": "Escapar is a playful script font that blends a casual, handwritten aesthetic with a touch of vintage charm. Its flowing strokes and rounded forms create a sense of warmth and approachability, while the subtle variations in letterforms add a touch of personality. The font's generous x-height and open counters ensure good legibility, even at smaller sizes, making it suitable for a variety of applications. The overall effect is one of friendly informality, reminiscent of handwritten notes or vintage signage. Escapar's playful nature makes it ideal for branding projects that seek to convey a sense of fun and approachability, while its vintage influences add a touch of nostalgia and authenticity. The font's versatility allows it to be used in a variety of contexts, from social media graphics to packaging designs, adding a touch of personality and charm to any project.",
    "technical_characteristics": [
      "flowing strokes",
      "rounded forms",
      "generous x-height",
      "open counters",
      "subtle variations in letterforms"
    ],
    "personality_traits": [
      "playful",
      "approachable",
      "casual",
      "friendly",
      "informal"
    ],
    "practical_contexts": [
      "social media graphics",
      "packaging designs",
      "handwritten notes",
      "vintage signage",
      "logos and branding"
    ],
    "cultural_intuition": [
      "evokes a sense of nostalgia",
      "reminiscent of handwritten notes",
      "suggests a vintage aesthetic",
      "captures a playful and approachable spirit",
      "reflects a contemporary trend towards handwritten typography"
    ],
    "search_keywords": [
      "script font",
      "handwritten",
      "playful",
      "casual",
      "vintage",
      "rounded forms",
      "generous x-height",
      "open counters",
      "legible",
      "versatile",
      "branding",
      "social media",
      "packaging",
      "logos",
      "nostalgia",
      "approachable",
      "informal",
      "contemporary",
      "handwritten typography"
    ]
  }
}