{
  "filename": "espresso_dolce_36px.png",
  "status": "success",
  "description": {
    "detailed_description": "Espresso Dolce is a sans-serif typeface that embodies a contemporary yet approachable aesthetic. Its geometric construction, evident in the clean lines and consistent stroke widths, provides a sense of order and clarity. The rounded terminals, particularly noticeable in lowercase letters like 'a' and 'c', soften the geometric rigidity, adding a touch of warmth and approachability. This balance between structure and softness creates a font that feels both modern and inviting. The high x-height and open counters ensure excellent legibility, making it suitable for a wide range of applications, from website headers to printed signage. The font's overall character evokes a sense of confidence and professionalism, while its subtle playfulness makes it adaptable to a variety of design styles. Its contemporary relevance is evident in its clean lines and versatility, making it a strong choice for digital interfaces and branding projects. The font's cultural associations lean towards a modern, minimalist aesthetic, suggesting a sense of efficiency and clarity, often found in contemporary design trends.",
    "technical_characteristics": [
      "Geometric construction",
      "Consistent stroke widths",
      "Rounded terminals",
      "High x-height",
      "Open counters"
    ],
    "personality_traits": [
      "Confidently geometric",
      "Approachably rounded",
      "Modern and inviting",
      "Professionally clean",
      "Subtly playful"
    ],
    "practical_contexts": [
      "Website headers",
      "Printed signage",
      "Branding projects",
      "Digital interfaces",
      "Editorial design"
    ],
    "cultural_intuition": [
      "Modern minimalist aesthetic",
      "Contemporary design trends",
      "Efficiency and clarity",
      "Digital-native design",
      "Approachable professionalism"
    ],
    "search_keywords": [
      "Sans-serif",
      "Geometric",
      "Rounded terminals",
      "High x-height",
      "Open counters",
      "Legible",
      "Modern",
      "Contemporary",
      "Minimalist",
      "Professional",
      "Playful",
      "Digital",
      "Branding",
      "Website",
      "Signage",
      "Editorial"
    ]
  }
}