{
  "filename": "etw_36px.png",
  "status": "success",
  "description": {
    "detailed_description": "This font, with its playful, hand-drawn aesthetic, embodies a sense of casual energy and youthful exuberance. The irregular letterforms, characterized by rounded corners and expressive strokes, create a dynamic and informal feel. The uneven baseline and varying letter heights contribute to the hand-drawn quality, suggesting a spontaneous and personal touch. While the font's construction is inherently loose, it maintains a clear legibility, making it suitable for headlines, logos, and short-form text where a friendly and approachable tone is desired. The font's cultural resonance lies in its connection to contemporary digital culture, where handwritten aesthetics are often used to convey authenticity and informality. It evokes the feeling of a personal message or a handwritten note, adding a touch of warmth and personality to digital communication.",
    "technical_characteristics": [
      "Hand-drawn aesthetic",
      "Irregular letterforms",
      "Rounded corners",
      "Expressive strokes",
      "Uneven baseline",
      "Varying letter heights",
      "Open counters"
    ],
    "personality_traits": [
      "Playful",
      "Energetic",
      "Youthful",
      "Casual",
      "Informal",
      "Friendly",
      "Approachable"
    ],
    "practical_contexts": [
      "Headlines",
      "Logos",
      "Short-form text",
      "Social media graphics",
      "Digital signage"
    ],
    "cultural_intuition": [
      "Contemporary digital culture",
      "Handwritten aesthetics",
      "Authenticity",
      "Informality",
      "Personal touch"
    ],
    "search_keywords": [
      "Handwritten",
      "Playful",
      "Casual",
      "Informal",
      "Energetic",
      "Youthful",
      "Rounded",
      "Expressive",
      "Irregular",
      "Dynamic",
      "Friendly",
      "Approachable",
      "Headline",
      "Logo",
      "Social media",
      "Digital",
      "Contemporary",
      "Authentic",
      "Personal"
    ]
  }
}