{
  "filename": "exaggerate_36px.png",
  "status": "success",
  "description": {
    "detailed_description": "This font, aptly named \"Exaggerate\", embodies a playful and energetic spirit through its bold, exaggerated letterforms. The characters are constructed with a distinct hand-drawn quality, featuring rounded corners, uneven strokes, and a dynamic sense of movement. This informality is further emphasized by the inconsistent letter heights and widths, creating a sense of spontaneity and energy. The overall effect is one of youthful exuberance, reminiscent of graffiti or hand-painted signage. While the font's bold nature makes it highly visible and attention-grabbing, its lack of precise alignment and consistent spacing might limit its use in large blocks of text. However, it excels in short bursts, adding a touch of personality to headlines, logos, or playful graphics. The font's cultural associations lean towards street art and urban culture, evoking a sense of rebellious creativity and youthful expression.",
    "technical_characteristics": [
      "Hand-drawn aesthetic",
      "Rounded corners",
      "Uneven stroke weights",
      "Inconsistent letter heights and widths",
      "Dynamic letterforms",
      "Bold weight",
      "Limited character set"
    ],
    "personality_traits": [
      "Playful",
      "Energetic",
      "Spontaneous",
      "Rebellious",
      "Youthful",
      "Bold",
      "Informal"
    ],
    "practical_contexts": [
      "Headlines",
      "Logos",
      "Short bursts of text",
      "Graphics",
      "Social media graphics",
      "Street art-inspired designs"
    ],
    "cultural_intuition": [
      "Street art",
      "Urban culture",
      "Youthful expression",
      "Rebellious creativity",
      "Hand-painted signage"
    ],
    "search_keywords": [
      "Exaggerate",
      "Hand-drawn",
      "Playful",
      "Bold",
      "Informal",
      "Energetic",
      "Street art",
      "Urban",
      "Youthful",
      "Headline",
      "Logo",
      "Graphic",
      "Social media",
      "Display font",
      "Informal font",
      "Bold font",
      "Hand-lettered",
      "Graffiti",
      "Signage"
    ]
  }
}