{
  "filename": "explore_36px.png",
  "status": "success",
  "description": {
    "detailed_description": "This font, with its bold, chunky letterforms and slightly irregular outlines, embodies a playful yet confident energy. The design is reminiscent of hand-drawn lettering, with a distinct lack of perfect symmetry and a sense of spontaneity in the strokes. The generous x-height and open counters ensure strong legibility, even at smaller sizes, while the uneven stroke weights and slightly rounded terminals add a touch of informality. This combination of bold presence and approachable character makes it ideal for headlines, branding elements, and casual digital content. The font's playful nature evokes a sense of youthful energy and creativity, suggesting a connection to street art, graphic novels, and contemporary digital culture. It's a font that feels both familiar and fresh, capable of adding a touch of personality and visual interest to a wide range of projects.",
    "technical_characteristics": [
      "Bold, chunky letterforms",
      "Slightly irregular outlines",
      "Generous x-height",
      "Open counters",
      "Uneven stroke weights",
      "Slightly rounded terminals",
      "Hand-drawn aesthetic"
    ],
    "personality_traits": [
      "Playful",
      "Confident",
      "Energetic",
      "Approachable",
      "Informal",
      "Bold",
      "Creative"
    ],
    "practical_contexts": [
      "Headlines",
      "Branding elements",
      "Casual digital content",
      "Posters",
      "Social media graphics"
    ],
    "cultural_intuition": [
      "Street art",
      "Graphic novels",
      "Contemporary digital culture",
      "Youthful energy",
      "Creativity"
    ],
    "search_keywords": [
      "bold",
      "chunky",
      "hand-drawn",
      "playful",
      "informal",
      "legible",
      "headline",
      "branding",
      "digital",
      "street art",
      "graphic novel",
      "contemporary",
      "youthful",
      "creative",
      "casual",
      "energetic",
      "approachable",
      "irregular",
      "generous x-height",
      "open counters",
      "uneven stroke weights",
      "rounded terminals"
    ]
  }
}