{
  "filename": "exquisite_corpse_36px.png",
  "status": "success",
  "description": {
    "detailed_description": "Exquisite Corpse is a display typeface that embodies a distinct gothic aesthetic, drawing inspiration from both classic horror imagery and contemporary digital culture. Its defining characteristic is the dripping, jagged letterforms, reminiscent of melting wax or dripping blood. This effect is achieved through a combination of sharp angles, exaggerated serifs, and a deliberate lack of uniformity in the drips, creating a sense of organic chaos. The font's bold weight and generous x-height ensure strong legibility, even at smaller sizes, while the irregular drips add a touch of playful unpredictability. This combination of boldness and whimsy makes Exquisite Corpse suitable for a range of applications, from horror-themed posters and album covers to edgy branding and digital interfaces. Its gothic aesthetic evokes a sense of mystery and intrigue, while its playful nature suggests a touch of dark humor. The font's contemporary relevance lies in its ability to capture the attention of a digital audience, while its historical roots in horror imagery ensure a timeless appeal.",
    "technical_characteristics": [
      "Jagged, dripping letterforms",
      "Exaggerated serifs",
      "Sharp angles",
      "Bold weight",
      "Generous x-height",
      "Irregular drips",
      "Lack of uniformity",
      "Organic chaos"
    ],
    "personality_traits": [
      "Gothic",
      "Horror-inspired",
      "Playful",
      "Intriguing",
      "Mysterious",
      "Bold",
      "Unpredictable",
      "Edgy",
      "Whimsical"
    ],
    "practical_contexts": [
      "Horror-themed posters",
      "Album covers",
      "Edgy branding",
      "Digital interfaces",
      "Headlines",
      "Titles",
      "Short text"
    ],
    "cultural_intuition": [
      "Gothic horror",
      "Dark humor",
      "Digital culture",
      "Mystery and intrigue",
      "Contemporary design"
    ],
    "search_keywords": [
      "Gothic",
      "Horror",
      "Display",
      "Bold",
      "Jagged",
      "Dripping",
      "Exaggerated",
      "Serifs",
      "Unpredictable",
      "Playful",
      "Edgy",
      "Whimsical",
      "Mystery",
      "Intrigue",
      "Digital",
      "Contemporary",
      "Poster",
      "Album",
      "Branding",
      "Interface",
      "Headline",
      "Title",
      "Short text"
    ]
  }
}