{
  "filename": "extradition_36px.png",
  "status": "success",
  "description": {
    "detailed_description": "Extradtion is a bold, geometric sans-serif typeface with a strong, three-dimensional presence. Its construction is based on clean, angular lines and sharp corners, creating a sense of solidity and power. The letters are designed with a distinct extrusion effect, adding depth and dimension to the overall design. This extrusion is achieved through a combination of parallel lines and subtle bevels, giving the font a sense of weight and presence. The high x-height and open counters ensure excellent legibility, even at smaller sizes. The overall character of Extradtion is confident and assertive, with a touch of retro-futuristic flair. It evokes a sense of power and authority, reminiscent of classic sci-fi movie posters or futuristic technology. The font's bold and impactful nature makes it ideal for headlines, logos, and branding projects that require a strong visual presence. It can also be used effectively for digital interfaces, particularly in situations where a bold and modern aesthetic is desired. However, its strong personality and large size may not be suitable for extended body text or delicate designs.",
    "technical_characteristics": [
      "Geometric construction",
      "Extrusion effect",
      "Sharp corners",
      "High x-height",
      "Open counters",
      "Bold weight",
      "Large size"
    ],
    "personality_traits": [
      "Confident",
      "Assertive",
      "Powerful",
      "Bold",
      "Modern",
      "Retro-futuristic",
      "Impactful",
      "Authoritative"
    ],
    "practical_contexts": [
      "Headlines",
      "Logos",
      "Branding",
      "Digital interfaces",
      "Large-scale displays"
    ],
    "cultural_intuition": [
      "Sci-fi aesthetics",
      "Futuristic technology",
      "Retro-futurism",
      "Modern design",
      "Power and authority"
    ],
    "search_keywords": [
      "Geometric sans-serif",
      "Extrusion",
      "Bold",
      "High x-height",
      "Open counters",
      "Retro-futuristic",
      "Sci-fi",
      "Modern",
      "Powerful",
      "Authoritative",
      "Headlines",
      "Logos",
      "Branding",
      "Digital interfaces",
      "Large-scale displays"
    ]
  }
}