{
  "filename": "f-stein_36px.png",
  "status": "success",
  "description": {
    "detailed_description": "F-Stein is a display typeface that blends a classic serif structure with a distinctly distressed aesthetic. Its letterforms are based on a traditional serif design, featuring strong vertical strokes, contrasting thick and thin lines, and well-defined serifs. However, the font's unique character comes from its heavily distressed treatment, with jagged edges, uneven lines, and a rough, almost hand-drawn quality. This combination creates a font that is both familiar and unexpected, evoking a sense of vintage charm and rebellious energy. The font's high x-height and open counters ensure good legibility, even at smaller sizes, making it suitable for headlines, logos, and other display applications. Its distressed character adds a touch of grit and authenticity, making it ideal for projects that require a vintage, industrial, or punk-inspired aesthetic. F-Stein's rough edges and uneven lines evoke a sense of imperfection and authenticity, suggesting a handmade quality that resonates with contemporary trends in design. It's a font that embraces the beauty of imperfection, adding a layer of personality and character to any project.",
    "technical_characteristics": [
      "serif construction",
      "distressed treatment",
      "jagged edges",
      "uneven lines",
      "high x-height",
      "open counters"
    ],
    "personality_traits": [
      "vintage charm",
      "rebellious energy",
      "gritty",
      "authentic",
      "hand-drawn",
      "imperfect",
      "bold",
      "unique"
    ],
    "practical_contexts": [
      "headlines",
      "logos",
      "posters",
      "packaging",
      "digital interfaces"
    ],
    "cultural_intuition": [
      "vintage aesthetic",
      "industrial design",
      "punk culture",
      "rebellious spirit",
      "handmade quality"
    ],
    "search_keywords": [
      "serif",
      "distressed",
      "display",
      "vintage",
      "punk",
      "bold",
      "rough",
      "hand-drawn",
      "gritty",
      "authentic",
      "headline",
      "logo",
      "poster",
      "packaging",
      "digital",
      "interface",
      "retro",
      "industrial",
      "rebellious",
      "handmade"
    ]
  }
}