{
  "filename": "faces_36px.png",
  "status": "success",
  "description": {
    "detailed_description": "This font is a playful exploration of the human face, rendered in a bold, expressive style. Each character is a unique caricature, with exaggerated features and a distinct personality. The construction is loose and gestural, with thick, uneven strokes that create a sense of energy and spontaneity. The large, expressive eyes and wide mouths contribute to the overall sense of humor and whimsy. While the font's technical execution is intentionally rough and imperfect, it adds to its charm and authenticity. The font's personality is undeniably fun and engaging, evoking a sense of childlike wonder and a touch of mischief. It's reminiscent of vintage cartoon characters and comic book illustrations, with a contemporary twist that feels both nostalgic and fresh. The font's intended applications are primarily in the realm of playful and informal design, such as children's books, branding for creative businesses, or social media graphics. Its bold and expressive nature makes it ideal for headlines and short bursts of text, where it can add a touch of personality and visual interest. However, its limited legibility at smaller sizes and its unconventional character set might make it less suitable for extended body copy or formal applications.",
    "technical_characteristics": [
      "Hand-drawn style",
      "Exaggerated features",
      "Uneven stroke weights",
      "Large, expressive eyes",
      "Wide mouths",
      "Loose construction",
      "Intentional imperfections"
    ],
    "personality_traits": [
      "Playful",
      "Whimsical",
      "Expressive",
      "Energetic",
      "Spontaneous",
      "Humorous",
      "Charming"
    ],
    "practical_contexts": [
      "Children's books",
      "Branding for creative businesses",
      "Social media graphics",
      "Headlines",
      "Short bursts of text"
    ],
    "cultural_intuition": [
      "Vintage cartoon characters",
      "Comic book illustrations",
      "Nostalgic",
      "Contemporary",
      "Informal"
    ],
    "search_keywords": [
      "Hand-drawn",
      "Cartoon",
      "Comic",
      "Playful",
      "Whimsical",
      "Expressive",
      "Bold",
      "Informal",
      "Children's",
      "Branding",
      "Social media",
      "Headline",
      "Display",
      "Nostalgia",
      "Contemporary"
    ]
  }
}