{
  "filename": "fake_receipt_36px.png",
  "status": "success",
  "description": {
    "detailed_description": "This font, aptly named \"Fake Receipt,\" embodies the stark, utilitarian aesthetic of digital printing. Its construction is purely geometric, with each letterform built from a series of horizontal and vertical lines. This results in a highly legible typeface, particularly at small sizes, as the open counters and consistent stroke widths ensure clarity even when pixelated. The lack of any stylistic flourishes or serifs contributes to its functional, almost sterile character, reminiscent of the minimalist design of early computer interfaces. While the font's simplicity might seem austere, it possesses a certain charm, evoking a sense of nostalgia for the early days of digital technology. Its straightforward nature makes it ideal for applications where clarity and efficiency are paramount, such as digital receipts, product labels, or even minimalist website designs. The font's inherent digital nature also lends itself well to contemporary digital art and graphic design, where its retro aesthetic can be used to create a sense of authenticity or irony.",
    "technical_characteristics": [
      "Geometric construction",
      "Monospaced",
      "Consistent stroke width",
      "Open counters",
      "Minimalist design",
      "Lack of serifs",
      "High x-height"
    ],
    "personality_traits": [
      "Functional",
      "Utilitarian",
      "Legible",
      "Minimalist",
      "Nostalgic",
      "Retro",
      "Straightforward"
    ],
    "practical_contexts": [
      "Digital receipts",
      "Product labels",
      "Minimalist website design",
      "Digital art",
      "Graphic design"
    ],
    "cultural_intuition": [
      "Evokes early computer interfaces",
      "Represents the digital age",
      "Nostalgia for the 1980s and 1990s",
      "Minimalist design aesthetic",
      "Digital art and graphic design"
    ],
    "search_keywords": [
      "Geometric",
      "Monospaced",
      "Sans-serif",
      "Digital",
      "Receipt",
      "Minimalist",
      "Retro",
      "Nostalgic",
      "Legible",
      "Functional",
      "Utilitarian",
      "Website",
      "Label",
      "Art",
      "Graphic design",
      "Pixelated",
      "Early computer",
      "Interface",
      "1980s",
      "1990s"
    ]
  }
}