{
  "filename": "fans_36px.png",
  "status": "success",
  "description": {
    "detailed_description": "This icon set, \"Fan Icons\", is a playful and diverse collection of stylized fan representations. The icons are constructed with a mix of geometric and organic shapes, creating a visual language that is both familiar and whimsical. The use of bold, solid black forms ensures high visibility and impact, while the varied designs offer a sense of personality and character. The icons are well-suited for use in digital interfaces, branding, and illustrative projects, adding a touch of lightheartedness and visual interest. The overall mood is one of playful functionality, evoking a sense of cool air and refreshing breezes. The icons' contemporary style suggests a connection to modern technology and design, while their playful nature hints at a sense of fun and lightheartedness. The set's versatility allows for a wide range of applications, from website design and mobile apps to social media graphics and merchandise.",
    "technical_characteristics": [
      "Geometric and organic shapes",
      "Bold, solid black forms",
      "Varied designs",
      "High contrast",
      "Simple construction"
    ],
    "personality_traits": [
      "Playful",
      "Whimsical",
      "Functional",
      "Modern",
      "Lighthearted"
    ],
    "practical_contexts": [
      "Digital interfaces",
      "Branding",
      "Illustrative projects",
      "Website design",
      "Mobile apps"
    ],
    "cultural_intuition": [
      "Modern technology",
      "Contemporary design",
      "Playful functionality",
      "Refreshing breezes",
      "Lightheartedness"
    ],
    "search_keywords": [
      "fan icons",
      "icons",
      "graphic design",
      "digital design",
      "web design",
      "mobile app design",
      "branding",
      "illustration",
      "geometric shapes",
      "organic shapes",
      "bold",
      "black",
      "high contrast",
      "simple",
      "playful",
      "whimsical",
      "functional",
      "modern",
      "lighthearted",
      "refreshing",
      "breeze",
      "contemporary",
      "versatile"
    ]
  }
}