{
  "filename": "fanzine_36px.png",
  "status": "success",
  "description": {
    "detailed_description": "Fanzine is a display typeface that embodies the spirit of DIY culture and punk aesthetics. Its defining characteristic is the irregular, jagged edges that mimic the look of torn paper, creating a raw and rebellious feel. The letterforms themselves are based on a classic serif design, but the rough edges and uneven spacing inject a sense of chaos and energy. This juxtaposition of traditional and disruptive elements gives Fanzine a unique personality, making it ideal for projects that demand attention and a sense of authenticity. While the font's irregular nature might limit its use in large blocks of text, it excels in headlines, posters, and other graphic elements where its bold character can shine. The font's cultural associations are strong, evoking a sense of underground movements, punk rock, and DIY ethos. It's a font that speaks to a generation that values authenticity and self-expression, making it a powerful tool for communicating a rebellious and independent spirit.",
    "technical_characteristics": [
      "jagged edges",
      "uneven spacing",
      "serif design",
      "bold weight",
      "high contrast"
    ],
    "personality_traits": [
      "rebellious",
      "energetic",
      "authentic",
      "raw",
      "bold"
    ],
    "practical_contexts": [
      "headlines",
      "posters",
      "logos",
      "graphic elements",
      "short text blocks"
    ],
    "cultural_intuition": [
      "punk rock",
      "DIY culture",
      "underground movements",
      "rebellious spirit",
      "authenticity"
    ],
    "search_keywords": [
      "display font",
      "jagged edges",
      "torn paper",
      "serif",
      "bold",
      "punk",
      "DIY",
      "rebellious",
      "underground",
      "authentic",
      "headlines",
      "posters",
      "logos",
      "graphic design",
      "raw",
      "energetic",
      "chaotic",
      "high contrast",
      "uneven spacing",
      "rough",
      "grunge",
      "streetwear",
      "alternative",
      "independent"
    ]
  }
}