{
  "filename": "faraco_hand_36px.png",
  "status": "success",
  "description": {
    "detailed_description": "Faracco Hand is a script font that captures the immediacy and personality of handwritten text. Its irregular letterforms, varying stroke weights, and expressive flourishes evoke the feeling of a quick, personal note. The font's construction is based on a flowing, organic rhythm, with letters connecting and overlapping in a way that feels natural and spontaneous. This informality is further emphasized by the inconsistent baseline and occasional ascenders that extend beyond the standard line height. While the font's overall character is playful and approachable, it also possesses a certain level of sophistication, thanks to the careful attention to detail in the letterforms and the subtle variations in stroke thickness. This balance makes it suitable for a wide range of applications, from casual social media posts to more formal branding elements, as long as the context allows for a touch of personality. The font's cultural resonance lies in its ability to evoke a sense of authenticity and human connection, reminiscent of handwritten letters and personal notes. It taps into the contemporary trend of embracing imperfection and authenticity, suggesting a sense of warmth and approachability.",
    "technical_characteristics": [
      "Irregular letterforms",
      "Varying stroke weights",
      "Expressive flourishes",
      "Inconsistent baseline",
      "Organic rhythm",
      "Connecting and overlapping letters",
      "Subtle variations in stroke thickness"
    ],
    "personality_traits": [
      "Playful",
      "Approachable",
      "Informal",
      "Expressive",
      "Authentic",
      "Warm",
      "Sophisticated"
    ],
    "practical_contexts": [
      "Social media posts",
      "Branding elements",
      "Handwritten notes",
      "Casual invitations",
      "Digital illustrations"
    ],
    "cultural_intuition": [
      "Evokes a sense of authenticity and human connection",
      "Reminiscent of handwritten letters and personal notes",
      "Embraces imperfection and authenticity",
      "Suggests warmth and approachability",
      "Reflects the contemporary trend of embracing handwritten aesthetics"
    ],
    "search_keywords": [
      "Script font",
      "Handwritten",
      "Informal",
      "Playful",
      "Expressive",
      "Authentic",
      "Organic",
      "Irregular",
      "Varying stroke weights",
      "Flourishes",
      "Social media",
      "Branding",
      "Handwritten notes",
      "Digital illustrations",
      "Casual",
      "Approachable",
      "Warm",
      "Sophisticated",
      "Contemporary",
      "Authenticity",
      "Human connection"
    ]
  }
}