{
  "filename": "farbe_36px.png",
  "status": "success",
  "description": {
    "detailed_description": "This font is a bold statement, built on a strong geometric foundation with a distinct 3D effect. The letters are constructed with sharp angles and clean lines, creating a sense of solidity and power. The 3D effect is achieved through a subtle offset, adding depth and dimension to the characters. This technique, while visually striking, can sometimes lead to legibility issues, especially in smaller sizes. The font's overall character is confident and assertive, with a touch of retro flair. It evokes a sense of vintage Americana, reminiscent of classic signage and bold graphic design from the mid-20th century. This makes it particularly well-suited for headlines, logos, and branding projects that require a strong visual impact. However, its bold nature and potential legibility issues might limit its use in body text or smaller-scale applications. The font's cultural resonance lies in its ability to tap into a sense of nostalgia and classic design, while its contemporary relevance stems from its ability to create a bold and impactful visual statement.",
    "technical_characteristics": [
      "Geometric construction",
      "Sharp angles",
      "3D effect",
      "Bold weight",
      "High x-height",
      "Open counters",
      "Offset stroke"
    ],
    "personality_traits": [
      "Confident",
      "Assertive",
      "Bold",
      "Retro",
      "Vintage",
      "Powerful",
      "Impactful"
    ],
    "practical_contexts": [
      "Headlines",
      "Logos",
      "Branding",
      "Posters",
      "Signage",
      "Large-scale displays"
    ],
    "cultural_intuition": [
      "Vintage Americana",
      "Mid-century design",
      "Classic signage",
      "Nostalgia",
      "Bold graphic design"
    ],
    "search_keywords": [
      "Geometric",
      "3D",
      "Bold",
      "Retro",
      "Vintage",
      "American",
      "Signage",
      "Headlines",
      "Logos",
      "Branding",
      "Impactful",
      "Assertive",
      "Powerful",
      "High x-height",
      "Open counters",
      "Offset stroke",
      "Legibility",
      "Large-scale",
      "Display font",
      "Graphic design"
    ]
  }
}