{
  "filename": "fast_food_logos_36px.png",
  "status": "success",
  "description": {
    "detailed_description": "This collection of fast food logos showcases a diverse range of typographic styles, reflecting the varied brand identities and target audiences within the industry.  While some logos lean towards a more traditional, serif-based approach, others embrace a bolder, sans-serif aesthetic.  The use of bold weights and strong letterforms is prevalent, ensuring high visibility and memorability, particularly at small sizes.  Many logos incorporate unique letterforms or stylistic flourishes, such as the distinctive 'M' in McDonald's or the playful 'P' in Pizza Hut, adding visual interest and brand recognition.  The overall tone of the logos ranges from playful and approachable, as seen in the rounded forms of Dunkin' Donuts, to more assertive and confident, as exemplified by the sharp angles of Burger King.  This diverse range of typographic styles effectively communicates the distinct personalities and values of each brand, catering to a wide spectrum of consumer preferences.  The logos are designed for maximum impact in a variety of applications, from billboards and packaging to digital interfaces and social media, ensuring brand consistency across multiple platforms.",
    "technical_characteristics": [
      "bold weights",
      "strong letterforms",
      "sans-serif",
      "serif",
      "unique letterforms",
      "stylistic flourishes",
      "rounded forms",
      "sharp angles"
    ],
    "personality_traits": [
      "bold",
      "memorable",
      "playful",
      "approachable",
      "assertive",
      "confident",
      "traditional",
      "modern",
      "distinctive"
    ],
    "practical_contexts": [
      "billboards",
      "packaging",
      "digital interfaces",
      "social media",
      "small sizes"
    ],
    "cultural_intuition": [
      "American fast food culture",
      "brand recognition",
      "consumer preferences",
      "visual impact",
      "memorability"
    ],
    "search_keywords": [
      "fast food logos",
      "typography",
      "sans-serif",
      "serif",
      "bold",
      "strong letterforms",
      "unique letterforms",
      "stylistic flourishes",
      "rounded forms",
      "sharp angles",
      "playful",
      "approachable",
      "assertive",
      "confident",
      "traditional",
      "modern",
      "brand identity",
      "visual impact",
      "memorability",
      "consumer preferences",
      "American culture"
    ]
  }
}