{
  "filename": "favicon_36px.png",
  "status": "success",
  "description": {
    "detailed_description": "This font, reminiscent of hand-drawn lettering, exhibits a playful yet slightly chaotic character. Its construction relies on a combination of organic curves and angular strokes, creating a dynamic and unpredictable visual rhythm. The unevenness of the letterforms, with their varying thicknesses and slightly jagged edges, adds to the hand-crafted feel. While the overall impression is informal and casual, the font maintains a degree of legibility, particularly in its lowercase forms. The generous x-height and open counters ensure readability, even at smaller sizes. This font's personality is best described as quirky and expressive, suggesting a sense of individuality and a touch of whimsy. It would be well-suited for projects that require a playful and informal tone, such as branding for creative agencies, children's products, or social media graphics. The font's cultural associations lean towards contemporary digital culture, evoking the aesthetic of hand-drawn illustrations and social media graphics. It captures the spirit of DIY creativity and the desire for authenticity in a digital world.",
    "technical_characteristics": [
      "Hand-drawn aesthetic",
      "Uneven stroke weights",
      "Jagged edges",
      "Organic curves",
      "Angular strokes",
      "Generous x-height",
      "Open counters"
    ],
    "personality_traits": [
      "Playful",
      "Quirky",
      "Expressive",
      "Informal",
      "Casual",
      "Whimsical",
      "Individualistic",
      "Hand-crafted"
    ],
    "practical_contexts": [
      "Branding for creative agencies",
      "Children's products",
      "Social media graphics",
      "Informal signage",
      "Short text displays"
    ],
    "cultural_intuition": [
      "Contemporary digital culture",
      "Hand-drawn illustration aesthetic",
      "DIY creativity",
      "Authenticity in a digital world",
      "Social media graphics"
    ],
    "search_keywords": [
      "Hand-drawn",
      "Playful",
      "Informal",
      "Whimsical",
      "Expressive",
      "Casual",
      "Digital",
      "Social media",
      "Branding",
      "Children's",
      "Creative",
      "Graphic design",
      "Typography",
      "Font",
      "Typeface",
      "Lettering",
      "Script",
      "Display",
      "Organic",
      "Angular",
      "Uneven",
      "Jagged",
      "Open counters",
      "Generous x-height"
    ]
  }
}