{
  "filename": "feira_da_fruta_36px.png",
  "status": "success",
  "description": {
    "detailed_description": "Feira da Fruta is a playful display typeface that blends a hand-drawn aesthetic with a touch of vintage charm. Its irregular letterforms, characterized by rounded corners and expressive strokes, create a sense of whimsy and informality. The font's generous x-height and open counters ensure good legibility, even at smaller sizes, while the uneven baseline adds to its handcrafted feel. The overall effect is one of friendly approachability, making it ideal for projects that require a touch of personality and warmth. While its hand-drawn nature might limit its use in large blocks of text, Feira da Fruta excels in headlines, logos, and packaging designs, where its unique character can shine. Its nostalgic charm evokes a sense of childhood innocence and playful creativity, making it perfect for projects that aim to capture a sense of fun and lightheartedness.",
    "technical_characteristics": [
      "Hand-drawn aesthetic",
      "Irregular letterforms",
      "Rounded corners",
      "Expressive strokes",
      "Generous x-height",
      "Open counters",
      "Uneven baseline"
    ],
    "personality_traits": [
      "Playful",
      "Whimsical",
      "Informal",
      "Friendly",
      "Approachable",
      "Nostalgic",
      "Creative"
    ],
    "practical_contexts": [
      "Headlines",
      "Logos",
      "Packaging design",
      "Children's books",
      "Social media graphics"
    ],
    "cultural_intuition": [
      "Evokes a sense of childhood innocence",
      "Captures a playful and lighthearted mood",
      "Suggests a handcrafted and artisanal aesthetic",
      "Reflects a contemporary trend towards hand-drawn typography"
    ],
    "search_keywords": [
      "Hand-drawn",
      "Display typeface",
      "Playful",
      "Whimsical",
      "Informal",
      "Nostalgic",
      "Friendly",
      "Approachable",
      "Creative",
      "Headlines",
      "Logos",
      "Packaging",
      "Children's books",
      "Social media",
      "Vintage",
      "Charming",
      "Irregular",
      "Rounded",
      "Expressive",
      "Generous x-height",
      "Open counters",
      "Uneven baseline"
    ]
  }
}