{
  "filename": "female_underwear_36px.png",
  "status": "success",
  "description": {
    "detailed_description": "This font is a playful and evocative collection of pictograms representing various styles of lingerie and swimwear. Each glyph is a simplified silhouette, capturing the essence of its subject with bold, graphic lines. The consistent use of black and white creates a strong visual impact, while the varied shapes and sizes of the glyphs add visual interest. The font's playful nature is further emphasized by the inclusion of labels for each style, such as \"bikini,\" \"string,\" and \"brazilian.\" This font is ideal for projects that require a lighthearted and visually engaging approach, such as fashion blogs, social media campaigns, or packaging for lingerie or swimwear brands. Its bold and graphic style makes it particularly well-suited for digital applications, where it can be used to create eye-catching headlines, icons, or illustrations. The font's playful nature and suggestive imagery evoke a sense of confidence and empowerment, making it a perfect choice for projects that celebrate the female form.",
    "technical_characteristics": [
      "Simplified silhouettes",
      "Bold, graphic lines",
      "Consistent use of black and white",
      "Varied shapes and sizes",
      "Inclusion of labels"
    ],
    "personality_traits": [
      "Playful",
      "Evocative",
      "Bold",
      "Graphic",
      "Confident"
    ],
    "practical_contexts": [
      "Fashion blogs",
      "Social media campaigns",
      "Packaging for lingerie or swimwear brands",
      "Digital applications",
      "Headlines, icons, or illustrations"
    ],
    "cultural_intuition": [
      "Celebrates the female form",
      "Empowering",
      "Modern and playful",
      "Suggestive and playful",
      "Visually engaging"
    ],
    "search_keywords": [
      "Lingerie",
      "Swimwear",
      "Pictograms",
      "Silhouettes",
      "Graphic",
      "Bold",
      "Playful",
      "Evocative",
      "Fashion",
      "Digital",
      "Icons",
      "Illustrations",
      "Headlines",
      "Packaging",
      "Social media",
      "Branding",
      "Female form",
      "Empowerment",
      "Confidence",
      "Modern",
      "Suggestive"
    ]
  }
}