{
  "filename": "figs_in_the_summer_36px.png",
  "status": "success",
  "description": {
    "detailed_description": "This font, reminiscent of casual handwritten script, exhibits a playful yet legible character. Its organic forms, characterized by rounded terminals and flowing strokes, create a sense of informality and warmth. The varying letter widths and heights contribute to a dynamic and lively appearance, while the consistent stroke weight ensures readability. The font's overall impression is one of friendly approachability, making it suitable for projects that require a personal touch. Its casual nature lends itself well to informal communications, social media graphics, and handwritten-style branding, particularly in digital contexts where its organic forms translate well to screen display. The font's inherent charm evokes a sense of authenticity and human connection, suggesting a personal touch and a relaxed, approachable tone.",
    "technical_characteristics": [
      "Organic forms",
      "Rounded terminals",
      "Varying letter widths and heights",
      "Consistent stroke weight",
      "Flowing strokes"
    ],
    "personality_traits": [
      "Playful",
      "Legible",
      "Informal",
      "Warm",
      "Approachable"
    ],
    "practical_contexts": [
      "Informal communications",
      "Social media graphics",
      "Handwritten-style branding",
      "Digital interfaces",
      "Short text blocks"
    ],
    "cultural_intuition": [
      "Evokes a sense of authenticity",
      "Suggests a personal touch",
      "Conveys a relaxed and approachable tone",
      "Reflects contemporary trends in digital design",
      "Appeals to a wide audience"
    ],
    "search_keywords": [
      "Handwritten",
      "Script",
      "Casual",
      "Playful",
      "Legible",
      "Organic",
      "Rounded",
      "Flowing",
      "Informal",
      "Warm",
      "Approachable",
      "Digital",
      "Social media",
      "Branding",
      "Personal",
      "Authentic",
      "Relaxed",
      "Friendly",
      "Contemporary"
    ]
  }
}