{
  "filename": "fil_sans_36px.png",
  "status": "success",
  "description": {
    "detailed_description": "Fil Sans is a playful sans-serif typeface that blends a hand-drawn aesthetic with a touch of geometric precision. The rounded terminals and slightly irregular letterforms create a sense of whimsy and informality, while the consistent stroke weights and balanced proportions ensure readability. The font's overall character is friendly and approachable, making it suitable for projects that require a touch of personality. The design evokes a sense of childhood nostalgia, reminiscent of handwritten notes and playful illustrations. Its informal nature makes it ideal for branding projects targeting younger audiences, social media graphics, or playful editorial designs. However, its legibility might be compromised at smaller sizes, limiting its use in dense text blocks.",
    "technical_characteristics": [
      "Rounded terminals",
      "Irregular letterforms",
      "Consistent stroke weights",
      "Balanced proportions",
      "Open counters"
    ],
    "personality_traits": [
      "Playful",
      "Whimsical",
      "Informal",
      "Friendly",
      "Approachable"
    ],
    "practical_contexts": [
      "Branding for younger audiences",
      "Social media graphics",
      "Playful editorial designs",
      "Handwritten-style typography",
      "Short text blocks"
    ],
    "cultural_intuition": [
      "Childhood nostalgia",
      "Handwritten notes",
      "Playful illustrations",
      "Informal communication",
      "Modern digital culture"
    ],
    "search_keywords": [
      "Sans-serif",
      "Hand-drawn",
      "Playful",
      "Informal",
      "Friendly",
      "Whimsical",
      "Rounded terminals",
      "Irregular letterforms",
      "Consistent stroke weights",
      "Balanced proportions",
      "Open counters",
      "Branding",
      "Social media",
      "Editorial design",
      "Handwritten",
      "Nostalgia",
      "Digital culture",
      "Modern",
      "Approachable"
    ]
  }
}