{
  "filename": "fireye_gf_36px.png",
  "status": "success",
  "description": {
    "detailed_description": "Fireye GF is a geometric sans-serif typeface that embodies a stark, futuristic aesthetic. Its construction is based on precise angles and straight lines, creating a sense of order and clarity. The letterforms are composed of simple, open shapes with minimal curves, resulting in a clean and uncluttered appearance. The high x-height and generous counters contribute to excellent legibility, even at small sizes. The font's bold weight and consistent stroke width lend it a sense of confidence and authority. Fireye GF evokes a sense of technological advancement and modernism, reminiscent of early computer interfaces and cyberpunk aesthetics. Its sharp edges and angular forms suggest a sense of speed and dynamism, making it suitable for projects that require a strong visual impact. While its geometric nature might seem austere, the font's overall impression is surprisingly approachable, thanks to the subtle curves in certain characters like 'a' and 'g'. This balance makes it versatile for a range of applications, from branding and headlines to user interfaces and digital signage.",
    "technical_characteristics": [
      "Geometric construction",
      "High x-height",
      "Open counters",
      "Consistent stroke width",
      "Sharp terminals",
      "Minimal curves",
      "Bold weight"
    ],
    "personality_traits": [
      "Futuristic",
      "Modern",
      "Clean",
      "Bold",
      "Confident",
      "Authoritative",
      "Dynamic"
    ],
    "practical_contexts": [
      "Headlines and titles",
      "Branding and logos",
      "User interfaces",
      "Digital signage",
      "Technical documentation"
    ],
    "cultural_intuition": [
      "Cyberpunk aesthetics",
      "Early computer interfaces",
      "Technological advancement",
      "Modernism",
      "Futuristic vision"
    ],
    "search_keywords": [
      "Geometric sans-serif",
      "High x-height",
      "Open counters",
      "Bold weight",
      "Sharp terminals",
      "Futuristic",
      "Modern",
      "Clean",
      "Dynamic",
      "Cyberpunk",
      "Tech",
      "Digital",
      "Interface",
      "Branding",
      "Headline",
      "Title",
      "Signage",
      "Documentation"
    ]
  }
}