{
  "filename": "first_time_writing!_36px.png",
  "status": "success",
  "description": {
    "detailed_description": "First Time Writing! is a playful script font that captures the essence of handwritten text. Its irregular letterforms and inconsistent stroke weights evoke the spontaneity of a child's first attempts at writing. The font's ascenders and descenders are exaggerated, adding to its whimsical character. While the overall construction is loose and informal, the letters maintain a clear legibility, making it suitable for short messages and playful designs. The font's inherent charm and nostalgic feel make it ideal for projects that require a touch of personal warmth and authenticity. It evokes a sense of childhood innocence and creativity, reminiscent of handwritten notes and personalized messages. Its informal nature makes it perfect for branding projects that aim to connect with a younger audience or convey a sense of approachability and friendliness.",
    "technical_characteristics": [
      "Irregular letterforms",
      "Inconsistent stroke weights",
      "Exaggerated ascenders and descenders",
      "Loose and informal construction",
      "Clear legibility"
    ],
    "personality_traits": [
      "Playful",
      "Whimsical",
      "Nostalgic",
      "Informal",
      "Authentic"
    ],
    "practical_contexts": [
      "Short messages",
      "Playful designs",
      "Branding projects",
      "Handwritten notes",
      "Personalized messages"
    ],
    "cultural_intuition": [
      "Childhood innocence",
      "Creativity",
      "Personal warmth",
      "Approachability",
      "Friendliness"
    ],
    "search_keywords": [
      "Script font",
      "Handwritten",
      "Playful",
      "Informal",
      "Whimsical",
      "Nostalgic",
      "Childlike",
      "Authentic",
      "Legible",
      "Short messages",
      "Branding",
      "Logo",
      "Hand lettering",
      "Creative",
      "Personal",
      "Friendly",
      "Approachable"
    ]
  }
}