{
  "filename": "foliga_36px.png",
  "status": "success",
  "description": {
    "detailed_description": "This font is a playful and expressive display typeface that uses human faces as its letterforms. Each character is a unique and slightly exaggerated rendition of a face, with varying expressions and details. The construction is primarily based on simple, rounded shapes, creating a friendly and approachable feel. The font's bold strokes and contrasting weights add to its visual impact, making it ideal for headlines and eye-catching titles. While the overall style is whimsical and cartoonish, the font retains a degree of legibility, making it suitable for short bursts of text. The font's playful nature evokes a sense of fun and lightheartedness, reminiscent of vintage cartoons and comic strips. It's a perfect choice for projects that require a touch of humor and personality, adding a unique and memorable element to branding, packaging, or digital interfaces.",
    "technical_characteristics": [
      "Hand-drawn style",
      "Rounded letterforms",
      "Bold strokes",
      "Contrasting weights",
      "Unique character designs"
    ],
    "personality_traits": [
      "Playful",
      "Whimsical",
      "Expressive",
      "Friendly",
      "Approachable"
    ],
    "practical_contexts": [
      "Headlines",
      "Titles",
      "Short bursts of text",
      "Branding elements",
      "Packaging design"
    ],
    "cultural_intuition": [
      "Vintage cartoons",
      "Comic strips",
      "Childish humor",
      "Lightheartedness",
      "Nostalgia"
    ],
    "search_keywords": [
      "Display font",
      "Hand-drawn",
      "Cartoon",
      "Whimsical",
      "Playful",
      "Expressive",
      "Friendly",
      "Bold",
      "Contrasting",
      "Unique",
      "Headlines",
      "Titles",
      "Branding",
      "Packaging",
      "Digital",
      "Vintage",
      "Comic",
      "Nostalgia",
      "Humor",
      "Personality"
    ]
  }
}