{
  "filename": "fontbitch_36px.png",
  "status": "success",
  "description": {
    "detailed_description": "FontBitch is a playful and expressive script font that captures the energy of handwritten text. Its irregular letterforms and fluid strokes create a sense of spontaneity and personality. The font's construction is based on a loose, organic structure, with varying stroke weights and angles that give it a dynamic and energetic feel. The ascenders and descenders are exaggerated, adding to the font's overall expressiveness. While the font's irregular nature might make it challenging for extended reading, it excels in short bursts of text, adding a touch of whimsy and personality to headlines, logos, and social media graphics. The font's casual and approachable style evokes a sense of informality and friendliness, making it suitable for projects that aim to connect with a younger audience or convey a sense of fun and creativity. Its cultural associations lean towards contemporary digital culture, with its hand-drawn aesthetic reminiscent of online messaging and social media trends.",
    "technical_characteristics": [
      "Irregular letterforms",
      "Fluid strokes",
      "Varying stroke weights",
      "Exaggerated ascenders and descenders",
      "Organic construction",
      "Loose letter spacing"
    ],
    "personality_traits": [
      "Playful",
      "Expressive",
      "Spontaneous",
      "Whimsical",
      "Casual",
      "Approachable",
      "Energetic"
    ],
    "practical_contexts": [
      "Headlines",
      "Logos",
      "Social media graphics",
      "Short bursts of text",
      "Informal communication"
    ],
    "cultural_intuition": [
      "Contemporary digital culture",
      "Handwritten aesthetic",
      "Online messaging",
      "Social media trends",
      "Informal communication"
    ],
    "search_keywords": [
      "Script font",
      "Handwritten",
      "Playful",
      "Expressive",
      "Casual",
      "Informal",
      "Whimsical",
      "Energetic",
      "Dynamic",
      "Organic",
      "Irregular",
      "Fluid",
      "Loose",
      "Exaggerated",
      "Headlines",
      "Logos",
      "Social media",
      "Digital",
      "Contemporary",
      "Trendy"
    ]
  }
}