{
  "filename": "font_breakdown_36px.png",
  "status": "success",
  "description": {
    "detailed_description": "This font's bold, geometric forms are built upon a foundation of sharp angles and contrasting strokes. The letterforms are constructed with a distinct sense of irregularity, each character featuring unique, jagged edges and uneven proportions. This deliberate imperfection creates a sense of raw energy and immediacy, reminiscent of hand-drawn lettering or graffiti. The font's high x-height and open counters ensure strong legibility, even at smaller sizes, making it suitable for both display and body text applications. The overall effect is one of rebellious energy and urban grit, evoking a sense of street culture and underground aesthetics. This font would be particularly effective for projects that require a bold, edgy, and visually impactful presence, such as branding for streetwear, music festivals, or rebellious youth-oriented products.",
    "technical_characteristics": [
      "Geometric construction",
      "Sharp angles",
      "Jagged edges",
      "Uneven proportions",
      "High x-height",
      "Open counters",
      "Bold weight",
      "Distinctive letterforms"
    ],
    "personality_traits": [
      "Rebellious",
      "Energetic",
      "Gritty",
      "Urban",
      "Raw",
      "Immediacy",
      "Bold",
      "Edgy",
      "Visually impactful"
    ],
    "practical_contexts": [
      "Streetwear branding",
      "Music festival posters",
      "Youth-oriented products",
      "Headlines and titles",
      "Short blocks of text"
    ],
    "cultural_intuition": [
      "Street culture",
      "Underground aesthetics",
      "Graffiti art",
      "Rebellious youth",
      "Urban environments"
    ],
    "search_keywords": [
      "Geometric",
      "Sharp",
      "Jagged",
      "Uneven",
      "Bold",
      "High x-height",
      "Open counters",
      "Streetwear",
      "Music festival",
      "Youth",
      "Rebellious",
      "Gritty",
      "Urban",
      "Display font",
      "Body font",
      "Edgy",
      "Impactful",
      "Graffiti",
      "Hand-drawn"
    ]
  }
}