{
  "filename": "font_london_eyes_36px.png",
  "status": "success",
  "description": {
    "detailed_description": "Font London Eyes is a bold and playful display typeface that draws inspiration from both geometric and organic forms. Its uppercase letters are constructed from a series of circular and angular shapes, creating a dynamic and eye-catching visual. The lowercase letters, on the other hand, feature sharp, pointed terminals that add a touch of whimsy and energy. The font's high x-height and open counters ensure strong legibility, even at large sizes. The overall effect is a font that is both playful and impactful, making it ideal for headlines, logos, and other attention-grabbing applications. The font's bold and playful nature evokes a sense of fun and energy, making it suitable for projects that require a strong visual presence. Its unique character and bold design make it a standout choice for projects that aim to capture attention and create a memorable impression. The font's bold and playful nature makes it suitable for a wide range of applications, from branding and advertising to editorial design and web design. Its unique character and bold design make it a standout choice for projects that aim to capture attention and create a memorable impression.",
    "technical_characteristics": [
      "Geometric construction",
      "Circular and angular shapes",
      "Sharp, pointed terminals",
      "High x-height",
      "Open counters",
      "Bold weight",
      "Large glyph set"
    ],
    "personality_traits": [
      "Bold and playful",
      "Dynamic and eye-catching",
      "Whimsical and energetic",
      "Fun and impactful",
      "Attention-grabbing",
      "Memorable",
      "Unique"
    ],
    "practical_contexts": [
      "Headlines",
      "Logos",
      "Posters",
      "Branding",
      "Advertising",
      "Editorial design",
      "Web design"
    ],
    "cultural_intuition": [
      "Evokes a sense of fun and energy",
      "Suggests a playful and irreverent attitude",
      "Reflects a contemporary design aesthetic",
      "Appeals to a younger audience",
      "Suitable for projects that aim to stand out"
    ],
    "search_keywords": [
      "Geometric",
      "Organic",
      "Circular",
      "Angular",
      "Sharp",
      "Pointed",
      "Bold",
      "Playful",
      "Dynamic",
      "Eye-catching",
      "Whimsical",
      "Energetic",
      "Fun",
      "Impactful",
      "Attention-grabbing",
      "Memorable",
      "Unique",
      "Headlines",
      "Logos",
      "Posters",
      "Branding",
      "Advertising",
      "Editorial",
      "Web",
      "Contemporary",
      "Display",
      "Typeface",
      "Font"
    ]
  }
}