{
  "filename": "fontocide_36px.png",
  "status": "success",
  "description": {
    "detailed_description": "Fontcide is a bold, aggressive display typeface that draws inspiration from both classic blackletter styles and contemporary grunge aesthetics. Its thick strokes and sharp angles create a sense of power and intensity, while the heavily distressed texture adds a raw, rebellious edge. The font's construction is based on a combination of geometric and organic forms, resulting in a unique visual language that is both striking and unsettling. The letterforms are highly stylized, with exaggerated features like pointed serifs, jagged terminals, and dramatic curves. This combination of sharp edges and organic textures creates a visual tension that is both captivating and unsettling. The font's overall character is one of raw energy and unbridled expression, making it ideal for projects that demand attention and convey a sense of rebellion. While its bold nature makes it suitable for large-scale headlines and branding elements, its distressed texture also lends itself to more informal applications like posters, flyers, and merchandise. The font's cultural associations are rooted in the rebellious spirit of punk rock and the DIY ethos of underground culture. Its raw, unpolished aesthetic evokes a sense of authenticity and defiance, making it a powerful tool for expressing individuality and challenging conventions.",
    "technical_characteristics": [
      "Distressed texture",
      "Geometric construction",
      "Sharp angles",
      "Exaggerated features",
      "Thick strokes",
      "Jagged terminals",
      "Dramatic curves"
    ],
    "personality_traits": [
      "Bold",
      "Aggressive",
      "Rebellious",
      "Raw",
      "Unpolished",
      "Energetic",
      "Expressive"
    ],
    "practical_contexts": [
      "Large-scale headlines",
      "Branding elements",
      "Posters",
      "Flyers",
      "Merchandise"
    ],
    "cultural_intuition": [
      "Punk rock",
      "Underground culture",
      "DIY ethos",
      "Rebellion",
      "Individuality"
    ],
    "search_keywords": [
      "Blackletter",
      "Grunge",
      "Display typeface",
      "Distressed",
      "Bold",
      "Aggressive",
      "Raw",
      "Punk",
      "Underground",
      "Rebellious",
      "Energetic",
      "Expressive",
      "Headlines",
      "Branding",
      "Posters",
      "Flyers",
      "Merchandise",
      "DIY",
      "Authenticity",
      "Defiance",
      "Individuality"
    ]
  }
}