{
  "filename": "fontbardeo_36px.png",
  "status": "success",
  "description": {
    "detailed_description": "FontBardeo embodies a playful, hand-drawn aesthetic, capturing the spontaneity of a quick sketch. Its irregular letterforms, with varying stroke weights and angles, create a sense of immediacy and informality. The font's construction is largely organic, with curves and angles flowing freely, resulting in a visually dynamic and engaging typeface. While lacking the precision of a traditional typeface, FontBardeo's imperfections contribute to its charm, making it feel authentic and personal. Its casual nature makes it ideal for informal projects, such as social media graphics, handwritten notes, or playful branding. The font's whimsical character evokes a sense of youthful energy and creativity, suggesting a connection to contemporary digital culture and the DIY spirit.",
    "technical_characteristics": [
      "Irregular letterforms",
      "Varying stroke weights",
      "Organic construction",
      "Hand-drawn aesthetic",
      "Informal character",
      "Lack of precise alignment",
      "Dynamic and engaging"
    ],
    "personality_traits": [
      "Playful and whimsical",
      "Spontaneous and energetic",
      "Casual and informal",
      "Authentic and personal",
      "Youthful and creative",
      "Immediacy and informality",
      "Visually dynamic and engaging"
    ],
    "practical_contexts": [
      "Social media graphics",
      "Handwritten notes",
      "Playful branding",
      "Informal signage",
      "Digital illustrations"
    ],
    "cultural_intuition": [
      "DIY culture",
      "Contemporary digital culture",
      "Youthful energy and creativity",
      "Authenticity and personality",
      "Informal communication"
    ],
    "search_keywords": [
      "Hand-drawn",
      "Playful",
      "Informal",
      "Whimsical",
      "Organic",
      "Irregular",
      "Spontaneous",
      "Casual",
      "Dynamic",
      "Engaging",
      "Social media",
      "Branding",
      "Digital illustration",
      "Note-taking",
      "Youthful",
      "Creative",
      "Authentic",
      "Personal",
      "DIY",
      "Contemporary",
      "Digital"
    ]
  }
}