{
  "filename": "fonts_vector_semaphore_flag_36px.png",
  "status": "success",
  "description": {
    "detailed_description": "This font is a playful and energetic interpretation of a classic sans-serif design. Its geometric construction is evident in the clean lines and precise angles of the letterforms, but the addition of subtle curves and rounded terminals softens the overall impression. The high x-height and open counters contribute to excellent legibility, making it suitable for both large-scale displays and smaller text sizes. The font's bold and confident character is further enhanced by the use of strong vertical strokes and a consistent weight throughout the alphabet. This combination of geometric precision and playful details creates a font that is both modern and approachable, making it ideal for a wide range of applications, from branding and signage to editorial design and digital interfaces. The font's energetic personality evokes a sense of movement and dynamism, suggesting a brand that is forward-thinking and innovative.",
    "technical_characteristics": [
      "Geometric construction",
      "High x-height",
      "Open counters",
      "Rounded terminals",
      "Consistent weight",
      "Strong vertical strokes",
      "Subtle curves"
    ],
    "personality_traits": [
      "Energetic",
      "Playful",
      "Modern",
      "Approachable",
      "Bold",
      "Confident",
      "Dynamic"
    ],
    "practical_contexts": [
      "Branding and signage",
      "Editorial design",
      "Digital interfaces",
      "Large-scale displays",
      "Small text sizes"
    ],
    "cultural_intuition": [
      "Evokes a sense of movement and dynamism",
      "Suggests a forward-thinking and innovative brand",
      "Reflects contemporary design trends",
      "Appeals to a wide audience",
      "Has a timeless quality"
    ],
    "search_keywords": [
      "Geometric sans-serif",
      "High x-height",
      "Open counters",
      "Rounded terminals",
      "Bold",
      "Energetic",
      "Playful",
      "Modern",
      "Approachable",
      "Dynamic",
      "Branding",
      "Signage",
      "Editorial design",
      "Digital interfaces",
      "Large-scale displays",
      "Small text sizes",
      "Contemporary",
      "Timeless"
    ]
  }
}