{
  "filename": "fonty_36px.png",
  "status": "success",
  "description": {
    "detailed_description": "This font embodies a playful, almost childlike energy, reminiscent of handwritten notes or doodles. Its irregular letterforms, with their rounded edges and fluid strokes, create a sense of spontaneity and informality. The varying heights and widths of the characters add to this whimsical feel, while the overall construction is loose and organic, suggesting a lack of rigid structure. Despite its casual nature, the font remains legible, thanks to its clear strokes and open counters. Its versatility allows for use in playful branding, social media graphics, or even children's books, where its friendly and approachable personality shines. The font's cultural resonance lies in its connection to the DIY aesthetic and the embrace of imperfection, reflecting a contemporary trend towards authenticity and self-expression.",
    "technical_characteristics": [
      "Irregular letterforms",
      "Rounded edges",
      "Fluid strokes",
      "Varying heights and widths",
      "Loose and organic construction",
      "Open counters",
      "Clear strokes"
    ],
    "personality_traits": [
      "Playful",
      "Whimsical",
      "Spontaneous",
      "Informal",
      "Friendly",
      "Approachable",
      "Casual"
    ],
    "practical_contexts": [
      "Playful branding",
      "Social media graphics",
      "Children's books",
      "Handwritten notes",
      "Doodles"
    ],
    "cultural_intuition": [
      "DIY aesthetic",
      "Embrace of imperfection",
      "Authenticity",
      "Self-expression",
      "Contemporary trend"
    ],
    "search_keywords": [
      "Handwritten",
      "Doodled",
      "Playful",
      "Informal",
      "Whimsical",
      "Casual",
      "Friendly",
      "Approachable",
      "Organic",
      "Irregular",
      "Rounded",
      "Fluid",
      "Open counters",
      "Legible",
      "Branding",
      "Social media",
      "Children's books",
      "DIY",
      "Authenticity",
      "Self-expression"
    ]
  }
}