{
  "filename": "forty_script_36px.png",
  "status": "success",
  "description": {
    "detailed_description": "This font, with its bold, gestural strokes and dynamic letterforms, embodies the raw energy and spontaneity of graffiti art. The characters are constructed with a freehand, almost calligraphic approach, resulting in uneven letter heights and varying stroke widths. This irregularity adds to the font's authenticity and sense of immediacy. The sharp angles and jagged edges create a sense of urgency and rebellion, while the overall flow and rhythm of the letters suggest a sense of movement and energy. This font is ideal for capturing a street-inspired aesthetic, adding a touch of rebellious cool to branding, posters, and digital graphics. Its bold, expressive nature makes it particularly effective for headlines and short bursts of text, where its raw energy can be fully appreciated. The font's cultural associations with urban street art and counterculture make it a powerful tool for conveying a sense of authenticity and rebellion, particularly in contexts where youth culture and creative expression are valued.",
    "technical_characteristics": [
      "Freehand construction",
      "Uneven letter heights",
      "Varying stroke widths",
      "Sharp angles and jagged edges",
      "Dynamic letterforms",
      "Bold weight",
      "High contrast"
    ],
    "personality_traits": [
      "Rebellious",
      "Energetic",
      "Spontaneous",
      "Authentic",
      "Expressive",
      "Urban",
      "Street-inspired"
    ],
    "practical_contexts": [
      "Headlines",
      "Posters",
      "Branding",
      "Streetwear",
      "Digital graphics",
      "Social media"
    ],
    "cultural_intuition": [
      "Graffiti art",
      "Urban culture",
      "Counterculture",
      "Youth culture",
      "Creative expression"
    ],
    "search_keywords": [
      "graffiti",
      "street art",
      "urban",
      "bold",
      "dynamic",
      "expressive",
      "handwritten",
      "brush script",
      "rebellious",
      "energetic",
      "spontaneous",
      "authentic",
      "youth",
      "counterculture",
      "headline",
      "poster",
      "branding",
      "streetwear",
      "digital graphics",
      "social media"
    ]
  }
}