{
  "filename": "fragments_of_eter_36px.png",
  "status": "success",
  "description": {
    "detailed_description": "This font, with its flowing lines and delicate curves, embodies a sense of playful elegance. The lowercase letters are particularly charming, with their rounded terminals and graceful ascenders and descenders. The 'g' and 'y' are especially noteworthy, showcasing a whimsical touch with their extended tails. The overall construction is based on a combination of geometric and organic forms, creating a visual balance between structure and fluidity. The font's light weight and open counters contribute to its airy and approachable feel, making it suitable for a variety of applications, from branding and packaging to website design and social media graphics. Its delicate nature suggests a sense of femininity and sophistication, while its playful elements add a touch of whimsy and charm. The font's overall aesthetic evokes a sense of vintage charm, reminiscent of handwritten calligraphy or early 20th-century typography, yet it feels fresh and contemporary, perfectly suited for modern design projects that seek a touch of elegance and personality.",
    "technical_characteristics": [
      "Cursive construction",
      "Rounded terminals",
      "Open counters",
      "Light weight",
      "Variable stroke thickness",
      "Extended ascenders and descenders",
      "Geometric and organic forms"
    ],
    "personality_traits": [
      "Playful elegance",
      "Delicate charm",
      "Whimsical touch",
      "Airy and approachable",
      "Feminine and sophisticated",
      "Vintage charm",
      "Modern and fresh"
    ],
    "practical_contexts": [
      "Branding and packaging",
      "Website design",
      "Social media graphics",
      "Handwritten-style typography",
      "Decorative elements"
    ],
    "cultural_intuition": [
      "Evokes a sense of vintage charm",
      "Reminiscent of handwritten calligraphy",
      "Suggests a touch of femininity and sophistication",
      "Feels fresh and contemporary",
      "Suitable for modern design projects"
    ],
    "search_keywords": [
      "Cursive",
      "Script",
      "Handwritten",
      "Playful",
      "Elegant",
      "Delicate",
      "Feminine",
      "Vintage",
      "Modern",
      "Branding",
      "Packaging",
      "Website",
      "Social media",
      "Typography",
      "Calligraphy",
      "Light weight",
      "Open counters",
      "Rounded terminals",
      "Extended ascenders",
      "Geometric",
      "Organic"
    ]
  }
}