{
  "filename": "fraktur_handschrift_36px.png",
  "status": "success",
  "description": {
    "detailed_description": "This Fraktur typeface embodies a rich history of German calligraphy, yet it's been carefully crafted for contemporary digital use. Its distinctive angled strokes and sharp terminals, characteristic of Fraktur, create a strong visual impact, evoking a sense of tradition and authority. The font's generous x-height and open counters ensure excellent legibility, even at smaller sizes, making it suitable for both display and body text. While its historical roots are firmly planted in medieval manuscripts, the font's clean lines and consistent weight distribution lend it a modern sensibility, making it appropriate for a range of applications, from branding and packaging to editorial design and digital interfaces. The overall effect is one of confident sophistication, with a touch of historical charm, making it a versatile choice for projects seeking a unique and impactful visual identity.",
    "technical_characteristics": [
      "Fraktur style",
      "Angled strokes",
      "Sharp terminals",
      "High x-height",
      "Open counters",
      "Consistent weight distribution",
      "Clean lines"
    ],
    "personality_traits": [
      "Authoritative",
      "Traditional",
      "Sophisticated",
      "Confident",
      "Unique",
      "Impactful",
      "Versatile"
    ],
    "practical_contexts": [
      "Branding and packaging",
      "Editorial design",
      "Digital interfaces",
      "Display typography",
      "Body text"
    ],
    "cultural_intuition": [
      "German heritage",
      "Medieval manuscripts",
      "Historical charm",
      "Modern sensibility",
      "Unique visual identity"
    ],
    "search_keywords": [
      "Fraktur",
      "Blackletter",
      "German",
      "Calligraphy",
      "Traditional",
      "Modern",
      "Display",
      "Body text",
      "Branding",
      "Packaging",
      "Editorial",
      "Digital",
      "Interface",
      "Sophisticated",
      "Unique",
      "Impactful",
      "Versatile",
      "Authority",
      "Legibility",
      "Historical",
      "Contemporary"
    ]
  }
}