{
  "filename": "fraktur_shadowed_36px.png",
  "status": "success",
  "description": {
    "detailed_description": "This font is a bold and dramatic interpretation of blackletter, drawing inspiration from medieval script but with a contemporary edge. Its thick strokes and sharp angles create a strong visual presence, while the exaggerated flourishes and extended tails add a sense of dynamism. The font's construction is based on a geometric framework, with clear proportions and consistent angles, giving it a sense of order and structure. However, the subtle variations in stroke weight and the playful curves in some letters, like the 'a' and 'g', inject a touch of personality and prevent the design from feeling overly rigid. The font's bold character makes it ideal for headlines, logos, and other applications where a strong visual impact is desired. It can also be used effectively for short bursts of text, such as quotes or captions, adding a touch of whimsy and intrigue. However, its intricate details and large size make it less suitable for extended blocks of text, especially at smaller sizes. The font's historical roots in medieval script evoke a sense of tradition and craftsmanship, while its contemporary styling suggests a playful and irreverent attitude. It's a font that can be used to create a sense of mystery and intrigue, or to add a touch of whimsy and personality to a design.",
    "technical_characteristics": [
      "Geometric construction",
      "Thick strokes",
      "Sharp angles",
      "Exaggerated flourishes",
      "Extended tails",
      "Variable stroke weight",
      "Open counters"
    ],
    "personality_traits": [
      "Bold",
      "Dramatic",
      "Dynamic",
      "Playful",
      "Intriguing",
      "Whimsical",
      "Traditional",
      "Contemporary"
    ],
    "practical_contexts": [
      "Headlines",
      "Logos",
      "Short bursts of text",
      "Quotes",
      "Captions",
      "Display typography"
    ],
    "cultural_intuition": [
      "Medieval script",
      "Gothic architecture",
      "Modern design",
      "Playful irreverence",
      "Sense of mystery"
    ],
    "search_keywords": [
      "Blackletter",
      "Gothic",
      "Medieval",
      "Script",
      "Bold",
      "Dramatic",
      "Geometric",
      "Flourishes",
      "Extended tails",
      "Variable stroke weight",
      "Open counters",
      "Headlines",
      "Logos",
      "Display typography",
      "Intriguing",
      "Whimsical",
      "Contemporary",
      "Traditional",
      "Playful",
      "Irreverent",
      "Mystery"
    ]
  }
}