{
  "filename": "frakt_36px.png",
  "status": "success",
  "description": {
    "detailed_description": "This font is a bold and dramatic blackletter, drawing heavily from traditional gothic script forms. Its exaggerated strokes and sharp angles create a sense of power and intensity, while the flowing curves and elongated ascenders add a touch of elegance. The font's high x-height and open counters ensure good legibility, even at smaller sizes. The overall effect is one of both grandeur and menace, making it suitable for projects that require a strong visual impact. The font's historical roots in medieval manuscripts and its association with gothic architecture lend it a sense of timelessness and authority. However, its bold and dramatic nature also makes it well-suited for contemporary applications, such as branding for edgy fashion labels, album covers for heavy metal bands, or titles for fantasy films. The font's strong personality and visual impact make it a powerful tool for conveying a sense of power, mystery, and intrigue.",
    "technical_characteristics": [
      "Blackletter construction",
      "Exaggerated strokes",
      "Sharp angles",
      "Flowing curves",
      "Elongated ascenders",
      "High x-height",
      "Open counters"
    ],
    "personality_traits": [
      "Bold",
      "Dramatic",
      "Powerful",
      "Intense",
      "Elegant",
      "Grand",
      "Menacing"
    ],
    "practical_contexts": [
      "Branding for edgy fashion labels",
      "Album covers for heavy metal bands",
      "Titles for fantasy films",
      "Headlines for gothic-themed publications",
      "Decorative elements for medieval-inspired designs"
    ],
    "cultural_intuition": [
      "Medieval manuscripts",
      "Gothic architecture",
      "Dark fantasy",
      "Heavy metal music",
      "Gothic subculture"
    ],
    "search_keywords": [
      "Blackletter",
      "Gothic",
      "Script",
      "Bold",
      "Dramatic",
      "Powerful",
      "Intense",
      "Elegant",
      "Grand",
      "Menacing",
      "Medieval",
      "Fantasy",
      "Heavy metal",
      "Gothic subculture",
      "Branding",
      "Album cover",
      "Title",
      "Headline",
      "Decorative"
    ]
  }
}