{
  "filename": "freekture_36px.png",
  "status": "success",
  "description": {
    "detailed_description": "FreekType is a display typeface that embodies a raw, energetic aesthetic. Its construction is characterized by bold, irregular strokes with pronounced serifs and a distinct grunge texture. This texture, achieved through deliberate distortion and rough edges, gives the font a sense of immediacy and authenticity. The letterforms themselves are often asymmetrical, with varying widths and heights, contributing to the overall sense of dynamism. While the font's technical execution is intentionally rough, it maintains a clear legibility, particularly in larger sizes. This makes it suitable for headlines, posters, and branding elements where a bold, attention-grabbing presence is desired. The font's personality is undeniably rebellious, evoking a sense of street art and underground culture. It carries a strong visual impact, suggesting a raw, unfiltered energy that resonates with contemporary trends in graphic design. Its cultural associations lean towards youth culture, rebellion, and alternative aesthetics, making it a powerful tool for conveying a sense of authenticity and individuality.",
    "technical_characteristics": [
      "distorted letterforms",
      "irregular stroke weights",
      "pronounced serifs",
      "grunge texture",
      "asymmetrical letterforms",
      "varying widths and heights",
      "open counters"
    ],
    "personality_traits": [
      "rebellious",
      "energetic",
      "raw",
      "unfiltered",
      "authentic",
      "bold",
      "dynamic"
    ],
    "practical_contexts": [
      "headlines",
      "posters",
      "branding elements",
      "street art",
      "graphic design",
      "digital media"
    ],
    "cultural_intuition": [
      "youth culture",
      "underground culture",
      "rebellion",
      "alternative aesthetics",
      "contemporary graphic design"
    ],
    "search_keywords": [
      "display typeface",
      "grunge",
      "distorted",
      "irregular",
      "bold",
      "asymmetrical",
      "raw",
      "energetic",
      "rebellious",
      "street art",
      "underground",
      "youth culture",
      "alternative",
      "headlines",
      "posters",
      "branding",
      "digital media",
      "graphic design"
    ]
  }
}