{
  "filename": "fritz_36px.png",
  "status": "success",
  "description": {
    "detailed_description": "This font, with its distinct slanted construction and geometrically driven forms, embodies a sense of futuristic dynamism. The sharp angles and clean lines create a sense of speed and precision, reminiscent of early computer interfaces and the sleek aesthetics of science fiction. The consistent slant, while adding a dynamic element, also contributes to a sense of controlled movement, suggesting a forward-thinking and progressive approach. The font's high x-height and open counters ensure excellent legibility, making it suitable for both large-scale displays and smaller text blocks. Its bold and confident character makes it ideal for headlines, branding, and digital interfaces where a sense of modernity and technological advancement is desired. The font's futuristic aesthetic evokes a sense of optimism and possibility, suggesting a world of innovation and progress.",
    "technical_characteristics": [
      "Slanted construction",
      "Geometric forms",
      "Sharp angles",
      "Clean lines",
      "High x-height",
      "Open counters"
    ],
    "personality_traits": [
      "Futuristic",
      "Dynamic",
      "Bold",
      "Confident",
      "Modern",
      "Progressive",
      "Sleek"
    ],
    "practical_contexts": [
      "Headlines",
      "Branding",
      "Digital interfaces",
      "Large-scale displays",
      "Small text blocks"
    ],
    "cultural_intuition": [
      "Science fiction aesthetics",
      "Early computer interfaces",
      "Modernity",
      "Technological advancement",
      "Optimism",
      "Progress"
    ],
    "search_keywords": [
      "Slanted",
      "Geometric",
      "Futuristic",
      "Dynamic",
      "Bold",
      "Modern",
      "Digital",
      "Interface",
      "Headline",
      "Branding",
      "Science fiction",
      "Computer",
      "Technology",
      "Progress",
      "Optimism",
      "Legibility",
      "High x-height",
      "Open counters",
      "Sharp angles",
      "Clean lines"
    ]
  }
}