{
  "filename": "froufrou_36px.png",
  "status": "success",
  "description": {
    "detailed_description": "Froufrou is a display typeface that embodies a playful, almost whimsical spirit. Its irregular, hand-drawn letterforms, characterized by uneven strokes and rounded terminals, create a sense of spontaneity and informality. The font's generous x-height and open counters ensure good legibility, even at smaller sizes, while the overall looseness of the design adds a touch of charm. The font's irregular baseline and inconsistent letter spacing contribute to its hand-crafted aesthetic, suggesting a personal touch and a sense of imperfection. This makes it ideal for projects that require a friendly, approachable feel, such as branding for creative agencies, children's books, or social media graphics. Froufrou's unique character evokes a sense of nostalgia, reminiscent of handwritten notes and vintage signage, while its contemporary digital execution makes it feel fresh and relevant. It's a font that invites interaction and engagement, adding a touch of personality to any design.",
    "technical_characteristics": [
      "Hand-drawn letterforms",
      "Irregular stroke weights",
      "Rounded terminals",
      "Generous x-height",
      "Open counters",
      "Inconsistent letter spacing",
      "Irregular baseline"
    ],
    "personality_traits": [
      "Playful",
      "Whimsical",
      "Spontaneous",
      "Informal",
      "Friendly",
      "Approachable",
      "Nostalgic"
    ],
    "practical_contexts": [
      "Branding for creative agencies",
      "Children's books",
      "Social media graphics",
      "Handwritten-style signage",
      "Short text displays"
    ],
    "cultural_intuition": [
      "Evokes a sense of nostalgia",
      "Reminiscent of handwritten notes",
      "Suggests a personal touch",
      "Reflects a contemporary appreciation for hand-crafted aesthetics",
      "Embraces imperfection as a design element"
    ],
    "search_keywords": [
      "Hand-drawn",
      "Display typeface",
      "Playful",
      "Whimsical",
      "Informal",
      "Nostalgic",
      "Friendly",
      "Approachable",
      "Branding",
      "Children's books",
      "Social media",
      "Handwritten",
      "Vintage",
      "Irregular",
      "Rounded terminals",
      "Open counters",
      "Generous x-height",
      "Inconsistent spacing",
      "Imperfection"
    ]
  }
}