{
  "filename": "fs_ellipsis_36px.png",
  "status": "success",
  "description": {
    "detailed_description": "FS Ellipsis is a geometric sans-serif typeface characterized by its clean, angular lines and consistent stroke weights. The font's construction is based on a grid system, resulting in a highly legible and structured appearance. The letterforms are composed of straight lines and sharp corners, with minimal curves or embellishments. This starkness creates a sense of clarity and precision, while the consistent stroke weights ensure a balanced and harmonious visual experience. The font's overall character is both modern and timeless, evoking a sense of efficiency and functionality. Its geometric nature suggests a connection to the digital realm, while its clean lines and sharp corners hint at a sense of order and control. FS Ellipsis is well-suited for a wide range of applications, from branding and signage to editorial design and user interfaces. Its legibility and versatility make it an excellent choice for both print and digital media, particularly in situations where clarity and professionalism are paramount. The font's minimalist aesthetic and geometric construction resonate with contemporary design trends, suggesting a sense of modernity and sophistication. Its clean lines and sharp corners evoke a sense of precision and control, while its consistent stroke weights create a sense of balance and harmony.",
    "technical_characteristics": [
      "Geometric construction",
      "Consistent stroke weights",
      "Sharp corners",
      "Minimal curves",
      "High x-height"
    ],
    "personality_traits": [
      "Clean and precise",
      "Modern and timeless",
      "Efficient and functional",
      "Structured and ordered",
      "Sophisticated and minimalist"
    ],
    "practical_contexts": [
      "Branding and signage",
      "Editorial design",
      "User interfaces",
      "Digital displays",
      "Print media"
    ],
    "cultural_intuition": [
      "Evokes a sense of order and control",
      "Suggests a connection to the digital realm",
      "Reflects contemporary design trends",
      "Communicates clarity and professionalism",
      "Conveys a sense of modernity and sophistication"
    ],
    "search_keywords": [
      "Geometric sans-serif",
      "Clean lines",
      "Sharp corners",
      "Consistent stroke weights",
      "High x-height",
      "Legible",
      "Modern",
      "Timeless",
      "Efficient",
      "Functional",
      "Structured",
      "Ordered",
      "Sophisticated",
      "Minimalist",
      "Branding",
      "Signage",
      "Editorial design",
      "User interfaces",
      "Digital displays",
      "Print media",
      "Contemporary design",
      "Precision",
      "Control",
      "Balance",
      "Harmony"
    ]
  }
}