{
  "filename": "fso_square_bracket_36px.png",
  "status": "success",
  "description": {
    "detailed_description": "This font, with its bold, blocky letterforms and playful, almost cartoonish construction, embodies a sense of fun and energy. The letters are built from simple geometric shapes, primarily squares and rectangles, with rounded corners and slight variations in thickness adding a touch of whimsy. The overall effect is a playful, almost childlike aesthetic, reminiscent of hand-drawn lettering or early video game graphics. The font's bold weight and generous x-height ensure strong legibility, even at smaller sizes, making it suitable for headlines, logos, and playful branding. The font's playful nature and bold presence make it ideal for projects that require a sense of fun and energy, such as children's books, games, or social media graphics. However, its somewhat limited character set and lack of refined details might limit its use in more formal or sophisticated contexts.",
    "technical_characteristics": [
      "Geometric construction",
      "Bold weight",
      "Rounded corners",
      "Variable stroke thickness",
      "Generous x-height",
      "Open counters",
      "Limited character set"
    ],
    "personality_traits": [
      "Playful",
      "Energetic",
      "Whimsical",
      "Bold",
      "Fun",
      "Childlike",
      "Informal"
    ],
    "practical_contexts": [
      "Headlines",
      "Logos",
      "Branding",
      "Children's books",
      "Games",
      "Social media graphics"
    ],
    "cultural_intuition": [
      "Reminiscent of hand-drawn lettering",
      "Evokes early video game graphics",
      "Suggests a sense of fun and playfulness",
      "Appeals to a younger audience"
    ],
    "search_keywords": [
      "Geometric",
      "Bold",
      "Rounded",
      "Playful",
      "Whimsical",
      "Cartoonish",
      "Hand-drawn",
      "Video game",
      "Children's",
      "Fun",
      "Energy",
      "Informal",
      "Branding",
      "Logo",
      "Headline",
      "Graphic",
      "Social media",
      "Game",
      "Book"
    ]
  }
}