{
  "filename": "fso_revenge_of_zany_36px.png",
  "status": "success",
  "description": {
    "detailed_description": "This font's organic, almost liquid forms are built on a foundation of rounded curves and flowing transitions. Each letter is a distinct shape, with exaggerated curves and pronounced terminals that create a sense of movement and energy. The overall design is playful and whimsical, reminiscent of 1960s psychedelic art and groovy lettering styles. While the font's bold forms and generous spacing ensure legibility, its unconventional shapes make it best suited for display purposes, particularly in headlines, logos, and short-form text. The font's playful nature evokes a sense of fun and lightheartedness, making it ideal for projects that aim to capture a sense of retro cool or whimsical charm.",
    "technical_characteristics": [
      "Rounded forms",
      "Exaggerated curves",
      "Pronounced terminals",
      "Generous spacing",
      "Bold weight",
      "Organic construction",
      "Fluid transitions"
    ],
    "personality_traits": [
      "Playful",
      "Whimsical",
      "Energetic",
      "Retro",
      "Groovy",
      "Bold",
      "Unconventional"
    ],
    "practical_contexts": [
      "Headlines",
      "Logos",
      "Short-form text",
      "Display typography",
      "Posters",
      "Packaging"
    ],
    "cultural_intuition": [
      "1960s psychedelic art",
      "Groovy lettering",
      "Retro cool",
      "Whimsical charm",
      "Fun and lightheartedness"
    ],
    "search_keywords": [
      "Rounded",
      "Organic",
      "Playful",
      "Whimsical",
      "Groovy",
      "Retro",
      "Bold",
      "Display",
      "Headlines",
      "Logos",
      "Posters",
      "Packaging",
      "Unconventional",
      "Energetic",
      "Fluid",
      "Curvy",
      "1960s",
      "Psychedelic",
      "Fun",
      "Lighthearted",
      "Charming"
    ]
  }
}