{
  "filename": "fuchsiabuddha_36px.png",
  "status": "success",
  "description": {
    "detailed_description": "FuchsiaBuddha (Sloppy) is a handwritten font that captures the energy and informality of casual script. Its irregular letterforms, varying stroke weights, and playful flourishes evoke the feeling of a quick note scribbled on a napkin. The font's construction is based on a loose, gestural approach, with letters flowing organically from one to the next. This creates a sense of spontaneity and immediacy, reminiscent of personal handwriting. The font's x-height is relatively high, ensuring good legibility even at smaller sizes. The open counters and generous spacing between letters further enhance readability. While the font's overall character is playful and informal, it also possesses a certain charm and warmth. The slightly rounded terminals and gentle curves add a touch of approachability, making it suitable for projects that require a friendly and inviting tone. FuchsiaBuddha (Sloppy) is well-suited for casual branding, social media graphics, and personal projects where a handwritten aesthetic is desired. Its informal nature makes it ideal for conveying a sense of authenticity and personality. The font's cultural resonance lies in its connection to the contemporary trend of embracing imperfection and authenticity. It reflects the growing appreciation for handwritten aesthetics and the desire to express individuality through design.",
    "technical_characteristics": [
      "Handwritten style",
      "Irregular letterforms",
      "Varying stroke weights",
      "Playful flourishes",
      "Loose, gestural construction",
      "High x-height",
      "Open counters",
      "Generous letter spacing",
      "Slightly rounded terminals",
      "Gentle curves"
    ],
    "personality_traits": [
      "Playful",
      "Informal",
      "Spontaneous",
      "Immediacy",
      "Authentic",
      "Friendly",
      "Inviting",
      "Charming",
      "Warm",
      "Handwritten"
    ],
    "practical_contexts": [
      "Casual branding",
      "Social media graphics",
      "Personal projects",
      "Handwritten aesthetics",
      "Informal communications"
    ],
    "cultural_intuition": [
      "Contemporary trend of embracing imperfection",
      "Appreciation for handwritten aesthetics",
      "Expression of individuality",
      "Authenticity in design"
    ],
    "search_keywords": [
      "Handwritten",
      "Script",
      "Informal",
      "Playful",
      "Casual",
      "Authentic",
      "Friendly",
      "Warm",
      "Social media",
      "Branding",
      "Personal projects",
      "Digital",
      "Graphic design",
      "Typography",
      "Font",
      "Typeface",
      "FuchsiaBuddha",
      "Sloppy"
    ]
  }
}