{
  "filename": "fuckin_gwenhwyfar_36px.png",
  "status": "success",
  "description": {
    "detailed_description": "This font, with its bold, chunky letterforms and pronounced serifs, evokes a sense of vintage Americana. The design is reminiscent of classic wood type, with a distinct hand-carved feel. The uneven stroke weights and slightly irregular letterforms add to this handcrafted aesthetic, suggesting a sense of authenticity and rustic charm. The font's overall character is bold and confident, yet approachable and friendly, making it suitable for a range of applications, from branding and packaging to editorial and display use. Its strong visual presence and nostalgic appeal make it ideal for projects that require a touch of vintage flair or a connection to traditional craftsmanship.",
    "technical_characteristics": [
      "pronounced serifs",
      "uneven stroke weights",
      "irregular letterforms",
      "bold, chunky letterforms",
      "distinctive hand-carved feel"
    ],
    "personality_traits": [
      "rustic charm",
      "vintage Americana",
      "bold and confident",
      "approachable and friendly",
      "handcrafted aesthetic"
    ],
    "practical_contexts": [
      "branding and packaging",
      "editorial and display use",
      "posters and signage",
      "logos and icons",
      "web design"
    ],
    "cultural_intuition": [
      "nostalgic appeal",
      "connection to traditional craftsmanship",
      "vintage aesthetic",
      "American heritage",
      "rustic charm"
    ],
    "search_keywords": [
      "wood type",
      "vintage",
      "retro",
      "handcrafted",
      "rustic",
      "bold",
      "chunky",
      "serif",
      "display",
      "editorial",
      "branding",
      "packaging",
      "poster",
      "signage",
      "logo",
      "icon",
      "web design",
      "American",
      "nostalgia",
      "authenticity",
      "craftsmanship"
    ]
  }
}