{
  "filename": "funiko_36px.png",
  "status": "success",
  "description": {
    "detailed_description": "Funiko is a playful script font that captures the essence of handwritten text with a touch of digital polish. Its flowing curves and organic shapes evoke a sense of casual charm, while its consistent stroke weights and well-defined letterforms ensure readability. The font's generous x-height and open counters contribute to its legibility, making it suitable for both display and body text. The slightly rounded terminals and playful swashes add a touch of whimsy, suggesting a friendly and approachable personality. Funiko's versatility makes it ideal for branding, social media graphics, and website design, particularly for projects that require a touch of personality and warmth. Its casual yet refined aesthetic evokes a sense of modern nostalgia, reminiscent of handwritten notes and vintage signage, while its digital-friendly construction ensures seamless integration into contemporary design projects.",
    "technical_characteristics": [
      "flowing curves",
      "organic shapes",
      "consistent stroke weights",
      "generous x-height",
      "open counters",
      "rounded terminals",
      "playful swashes"
    ],
    "personality_traits": [
      "playful",
      "casual",
      "charming",
      "friendly",
      "approachable",
      "whimsical",
      "modern",
      "nostalgic"
    ],
    "practical_contexts": [
      "branding",
      "social media graphics",
      "website design",
      "display text",
      "body text"
    ],
    "cultural_intuition": [
      "handwritten notes",
      "vintage signage",
      "modern nostalgia",
      "digital-native design"
    ],
    "search_keywords": [
      "script font",
      "handwritten",
      "playful",
      "casual",
      "charming",
      "legible",
      "versatile",
      "branding",
      "social media",
      "website design",
      "display text",
      "body text",
      "modern",
      "nostalgic",
      "digital",
      "vintage",
      "rounded terminals",
      "open counters",
      "generous x-height",
      "flowing curves",
      "organic shapes"
    ]
  }
}