{
  "filename": "furro_script_36px.png",
  "status": "success",
  "description": {
    "detailed_description": "Furro Script is a playful and expressive script font that captures the energy of handwritten text. Its flowing strokes and irregular letterforms create a sense of spontaneity and personality. The font's construction is based on a combination of calligraphic principles and digital manipulation, resulting in a unique blend of organic and geometric elements. The ascenders and descenders are exaggerated, adding to the font's dynamic character and making it highly legible even at small sizes. The overall effect is a font that feels both casual and sophisticated, suitable for a wide range of applications from branding and packaging to social media and web design. Furro Script's playful nature evokes a sense of fun and approachability, while its sophisticated details suggest a level of care and attention to detail. The font's contemporary relevance lies in its ability to capture the spirit of digital communication, where handwritten text is often used to convey personality and authenticity. Its cultural associations range from the informality of handwritten notes to the sophistication of modern calligraphy, making it a versatile choice for a variety of projects.",
    "technical_characteristics": [
      "flowing strokes",
      "irregular letterforms",
      "exaggerated ascenders and descenders",
      "open counters",
      "consistent stroke weight"
    ],
    "personality_traits": [
      "playful",
      "expressive",
      "spontaneous",
      "casual",
      "sophisticated"
    ],
    "practical_contexts": [
      "branding and packaging",
      "social media graphics",
      "web design",
      "handwritten notes",
      "digital signatures"
    ],
    "cultural_intuition": [
      "evokes a sense of fun and approachability",
      "suggests a level of care and attention to detail",
      "captures the spirit of digital communication",
      "reflects the trend of handwritten text in digital design",
      "blends the informality of handwritten notes with the sophistication of modern calligraphy"
    ],
    "search_keywords": [
      "script font",
      "handwritten",
      "playful",
      "expressive",
      "casual",
      "sophisticated",
      "legible",
      "dynamic",
      "branding",
      "packaging",
      "social media",
      "web design",
      "digital signature",
      "calligraphy",
      "contemporary",
      "authenticity"
    ]
  }
}