{
  "filename": "fusty_luggs_36px.png",
  "status": "success",
  "description": {
    "detailed_description": "Fusty Luggs is a display typeface that embraces a playful, almost childlike aesthetic. Its rounded forms and exaggerated curves create a sense of whimsy and informality, reminiscent of hand-drawn lettering. The font's construction is characterized by a combination of geometric and organic elements, resulting in a unique visual language. The letterforms are often asymmetrical, with varying stroke weights and irregular curves, adding to the hand-crafted feel. While the overall design is playful, the font maintains a degree of legibility, particularly in larger sizes. This makes it suitable for headlines, logos, and other applications where a bold and expressive visual is desired. The font's cultural associations lean towards a sense of nostalgia and a playful, lighthearted mood, reminiscent of vintage children's books or handmade signage. It evokes a sense of warmth and approachability, making it ideal for projects that aim to convey a friendly and engaging personality.",
    "technical_characteristics": [
      "Rounded forms",
      "Exaggerated curves",
      "Asymmetrical letterforms",
      "Varying stroke weights",
      "Irregular curves",
      "Geometric and organic construction"
    ],
    "personality_traits": [
      "Playful",
      "Whimsical",
      "Informal",
      "Hand-crafted",
      "Bold",
      "Expressive",
      "Nostalgic",
      "Lighthearted",
      "Friendly",
      "Engaging"
    ],
    "practical_contexts": [
      "Headlines",
      "Logos",
      "Posters",
      "Packaging",
      "Children's books",
      "Social media graphics"
    ],
    "cultural_intuition": [
      "Vintage children's books",
      "Handmade signage",
      "Nostalgia",
      "Playfulness",
      "Warmth",
      "Approachability"
    ],
    "search_keywords": [
      "Display typeface",
      "Rounded forms",
      "Exaggerated curves",
      "Asymmetrical letterforms",
      "Varying stroke weights",
      "Irregular curves",
      "Geometric construction",
      "Organic construction",
      "Playful",
      "Whimsical",
      "Informal",
      "Hand-crafted",
      "Bold",
      "Expressive",
      "Nostalgic",
      "Lighthearted",
      "Friendly",
      "Engaging",
      "Headlines",
      "Logos",
      "Posters",
      "Packaging",
      "Children's books",
      "Social media graphics",
      "Vintage",
      "Handmade"
    ]
  }
}