{
  "filename": "fuzzed_36px.png",
  "status": "success",
  "description": {
    "detailed_description": "This font, with its intentionally roughened edges and slightly irregular letterforms, evokes a sense of hand-drawn authenticity. The construction is based on a classic sans-serif structure, but the deliberate imperfections give it a unique character. The x-height is relatively high, ensuring good legibility even at smaller sizes, while the open counters contribute to a sense of airiness. The overall effect is one of casual confidence, suggesting a brand that is both approachable and authentic. This font would be well-suited for headlines, logos, and branding elements where a touch of grit and personality is desired. Its informal yet legible nature makes it ideal for digital applications, particularly in the realm of social media and online content, where it can convey a sense of authenticity and human connection.",
    "technical_characteristics": [
      "roughened edges",
      "irregular letterforms",
      "classic sans-serif structure",
      "high x-height",
      "open counters"
    ],
    "personality_traits": [
      "hand-drawn authenticity",
      "casual confidence",
      "approachable",
      "authentic",
      "informal"
    ],
    "practical_contexts": [
      "headlines",
      "logos",
      "branding elements",
      "digital applications",
      "social media"
    ],
    "cultural_intuition": [
      "DIY aesthetic",
      "indie spirit",
      "authenticity",
      "human connection",
      "digital-native design"
    ],
    "search_keywords": [
      "rough",
      "irregular",
      "sans-serif",
      "hand-drawn",
      "authentic",
      "casual",
      "confident",
      "legible",
      "high x-height",
      "open counters",
      "headlines",
      "logos",
      "branding",
      "digital",
      "social media",
      "indie",
      "DIY",
      "authenticity",
      "human connection"
    ]
  }
}