{
  "filename": "gabardina_36px.png",
  "status": "success",
  "description": {
    "detailed_description": "Gabardina is a sans-serif typeface that embodies a playful yet sophisticated aesthetic. Its geometric construction, evident in the sharp angles and consistent stroke widths, creates a sense of order and clarity. The font's distinctive feature is its unique treatment of terminals, which are often cut off abruptly, adding a touch of whimsy and unexpectedness. This unconventional approach, combined with the overall geometric structure, results in a font that feels both modern and timeless. The high x-height and open counters ensure excellent legibility, making it suitable for a wide range of applications, from headlines and branding to website design and mobile interfaces. Gabardina's playful nature makes it ideal for projects that require a touch of personality and visual interest, while its geometric foundation ensures a sense of professionalism and readability. The font's overall character evokes a sense of playful sophistication, reminiscent of mid-century modern design with a contemporary twist.",
    "technical_characteristics": [
      "Geometric construction",
      "Consistent stroke widths",
      "Sharp angles",
      "Unique terminal treatment",
      "High x-height",
      "Open counters"
    ],
    "personality_traits": [
      "Playful",
      "Sophisticated",
      "Modern",
      "Timeless",
      "Whimsical",
      "Unexpected",
      "Professional",
      "Readable"
    ],
    "practical_contexts": [
      "Headlines",
      "Branding",
      "Website design",
      "Mobile interfaces",
      "Display typography"
    ],
    "cultural_intuition": [
      "Mid-century modern design",
      "Contemporary aesthetic",
      "Playful sophistication",
      "Digital-native design",
      "Visual interest"
    ],
    "search_keywords": [
      "Geometric sans-serif",
      "Sharp angles",
      "Unique terminals",
      "High x-height",
      "Open counters",
      "Playful",
      "Sophisticated",
      "Modern",
      "Timeless",
      "Whimsical",
      "Unexpected",
      "Professional",
      "Readable",
      "Headlines",
      "Branding",
      "Website design",
      "Mobile interfaces",
      "Display typography",
      "Mid-century modern",
      "Contemporary",
      "Digital-native"
    ]
  }
}