{
  "filename": "gabi_sans_irregular_36px.png",
  "status": "success",
  "description": {
    "detailed_description": "Gabi Sans Irregular is a playful sans-serif typeface that blends geometric construction with organic, hand-drawn details. Its bold, chunky forms are reminiscent of vintage signage and playful illustrations, creating a sense of friendly informality. The irregular letterforms, with their rounded corners and slightly uneven strokes, add a touch of whimsy and personality. The font's high x-height and open counters ensure strong legibility, even at smaller sizes, making it suitable for both display and body text. Its bold, confident character makes it ideal for branding, packaging, and digital interfaces that require a touch of personality and approachability. The font's playful nature evokes a sense of nostalgia and fun, reminiscent of childhood memories and carefree days. It's a versatile typeface that can be used to create a wide range of visual styles, from playful and whimsical to bold and confident.",
    "technical_characteristics": [
      "Geometric construction with organic details",
      "Bold, chunky forms",
      "Irregular letterforms",
      "Rounded corners",
      "High x-height",
      "Open counters"
    ],
    "personality_traits": [
      "Playful",
      "Whimsical",
      "Friendly",
      "Informal",
      "Bold",
      "Confident",
      "Approachable",
      "Nostalgic",
      "Fun"
    ],
    "practical_contexts": [
      "Branding",
      "Packaging",
      "Digital interfaces",
      "Display text",
      "Body text"
    ],
    "cultural_intuition": [
      "Evokes vintage signage and playful illustrations",
      "Reminiscent of childhood memories and carefree days",
      "Suggests a sense of fun and approachability",
      "Reflects a contemporary trend towards playful and expressive typography"
    ],
    "search_keywords": [
      "sans-serif",
      "geometric",
      "organic",
      "bold",
      "chunky",
      "irregular",
      "playful",
      "whimsical",
      "friendly",
      "informal",
      "confident",
      "approachable",
      "nostalgic",
      "fun",
      "branding",
      "packaging",
      "digital interfaces",
      "display text",
      "body text",
      "vintage",
      "sign",
      "illustration",
      "hand-drawn",
      "retro",
      "modern",
      "contemporary",
      "expressive"
    ]
  }
}