{
  "filename": "gabrush_36px.png",
  "status": "success",
  "description": {
    "detailed_description": "Gabrush is a playful script font that captures the energy of handwritten lettering. Its irregular, flowing strokes and expressive letterforms evoke a sense of spontaneity and personality. The font's construction is based on a combination of calligraphic principles and digital manipulation, resulting in a unique blend of organic and geometric elements. The varying stroke weights and deliberate inconsistencies in letterforms create a dynamic and engaging visual experience. While the font's overall character is lighthearted and approachable, it also possesses a certain level of sophistication due to its carefully crafted details and balanced proportions. Gabrush is well-suited for a variety of applications, including branding, packaging, social media graphics, and editorial design. Its versatility allows it to be used for both casual and formal projects, adding a touch of personality and charm to any design. The font's cultural resonance lies in its ability to evoke a sense of nostalgia for handwritten communication, while also feeling fresh and contemporary. Its playful nature and expressive qualities make it a perfect choice for projects that aim to connect with audiences on an emotional level.",
    "technical_characteristics": [
      "Irregular stroke weights",
      "Expressive letterforms",
      "Varying ascenders and descenders",
      "Open counters",
      "Calligraphic influences",
      "Digital manipulation",
      "Handwritten aesthetic"
    ],
    "personality_traits": [
      "Playful",
      "Spontaneous",
      "Expressive",
      "Approachable",
      "Sophisticated",
      "Dynamic",
      "Engaging"
    ],
    "practical_contexts": [
      "Branding",
      "Packaging",
      "Social media graphics",
      "Editorial design",
      "Handwritten-style typography"
    ],
    "cultural_intuition": [
      "Nostalgia for handwritten communication",
      "Modern and contemporary feel",
      "Playful and expressive personality",
      "Connection with emotional audiences"
    ],
    "search_keywords": [
      "Script font",
      "Handwritten",
      "Playful",
      "Expressive",
      "Casual",
      "Formal",
      "Branding",
      "Packaging",
      "Social media",
      "Editorial",
      "Nostalgia",
      "Contemporary",
      "Digital",
      "Calligraphy",
      "Geometric",
      "Irregular",
      "Dynamic",
      "Engaging",
      "Approachable",
      "Sophisticated"
    ]
  }
}