{
  "filename": "gaelle_number_8_36px.png",
  "status": "success",
  "description": {
    "detailed_description": "Gaelle Number 8 is a playful script font that captures the essence of handwritten text. Its rounded forms and fluid strokes create a sense of informality and warmth, reminiscent of personal notes or whimsical signage. The font's construction is characterized by a combination of organic curves and subtle geometric influences, resulting in a balanced aesthetic that feels both natural and controlled. The generous x-height and open counters ensure excellent legibility, even at smaller sizes, making it suitable for a variety of applications. While the overall impression is lighthearted and approachable, the font's consistent stroke weight and well-defined letterforms lend a touch of professionalism, making it appropriate for both casual and more formal contexts. The font's cultural resonance lies in its ability to evoke a sense of nostalgia and familiarity, reminiscent of childhood scribbles or handwritten letters. Its contemporary relevance stems from its versatility and adaptability, making it a suitable choice for branding, packaging, social media, and digital interfaces.",
    "technical_characteristics": [
      "Rounded letterforms",
      "Fluid strokes",
      "Generous x-height",
      "Open counters",
      "Consistent stroke weight",
      "Subtle geometric influences",
      "Organic curves"
    ],
    "personality_traits": [
      "Playful",
      "Informal",
      "Warm",
      "Approachable",
      "Whimsical",
      "Nostalgic",
      "Familiar",
      "Versatile",
      "Adaptable"
    ],
    "practical_contexts": [
      "Branding",
      "Packaging",
      "Social media",
      "Digital interfaces",
      "Handwritten notes",
      "Whimsical signage"
    ],
    "cultural_intuition": [
      "Childhood scribbles",
      "Handwritten letters",
      "Nostalgia",
      "Familiarity",
      "Modern informality"
    ],
    "search_keywords": [
      "Script font",
      "Handwritten",
      "Playful",
      "Rounded",
      "Fluid",
      "Informal",
      "Warm",
      "Nostalgic",
      "Whimsical",
      "Legible",
      "Versatile",
      "Adaptable",
      "Branding",
      "Packaging",
      "Social media",
      "Digital",
      "Handwritten notes",
      "Signage",
      "Casual",
      "Formal",
      "Modern",
      "Contemporary"
    ]
  }
}