{
  "filename": "gaelle_fine_36px.png",
  "status": "success",
  "description": {
    "detailed_description": "This font exhibits a distinct hand-drawn aesthetic, characterized by its irregular letterforms and slightly uneven stroke weights. The lowercase letters, particularly 'a', 'g', and 'o', possess a rounded, almost childlike quality, while the uppercase letters maintain a more structured, almost calligraphic feel. This contrast creates a playful yet refined personality, suggesting a balance between spontaneity and control. The font's open counters and generous x-height contribute to its legibility, making it suitable for both display and body text applications. Its informal yet elegant nature makes it ideal for branding projects that seek a touch of whimsy and personality, particularly in the realm of lifestyle, fashion, or creative industries. The font evokes a sense of handcrafted authenticity, reminiscent of vintage signage or handwritten notes, adding a layer of warmth and charm to any design.",
    "technical_characteristics": [
      "Hand-drawn aesthetic",
      "Irregular letterforms",
      "Uneven stroke weights",
      "Rounded lowercase letters",
      "Structured uppercase letters",
      "Open counters",
      "Generous x-height"
    ],
    "personality_traits": [
      "Playful",
      "Refined",
      "Informal",
      "Elegant",
      "Whimsical",
      "Handcrafted",
      "Authentic"
    ],
    "practical_contexts": [
      "Branding projects",
      "Lifestyle and fashion design",
      "Creative industries",
      "Display typography",
      "Body text applications"
    ],
    "cultural_intuition": [
      "Vintage signage",
      "Handwritten notes",
      "Nostalgic charm",
      "Creative expression",
      "Authenticity"
    ],
    "search_keywords": [
      "Hand-drawn",
      "Script",
      "Calligraphy",
      "Informal",
      "Playful",
      "Elegant",
      "Vintage",
      "Nostalgic",
      "Whimsical",
      "Authentic",
      "Branding",
      "Lifestyle",
      "Fashion",
      "Display",
      "Body text",
      "Legible",
      "Open counters",
      "Generous x-height"
    ]
  }
}