{
  "filename": "gaivota_36px.png",
  "status": "success",
  "description": {
    "detailed_description": "This font, with its bold, rounded forms and playful curves, embodies a sense of whimsy and energy. The letterforms are constructed with a combination of geometric and organic elements, resulting in a unique visual language that is both playful and legible. The generous curves and rounded terminals create a sense of movement and fluidity, while the bold weight and strong contrast between thick and thin strokes ensure readability even at small sizes. The font's overall character is friendly and approachable, with a touch of retro charm that evokes a sense of nostalgia for a simpler time. Its playful nature makes it ideal for use in children's books, branding for playful products, or even as a display font for headlines and titles. However, its bold weight and strong personality might not be suitable for large blocks of text or formal documents. The font's cultural resonance lies in its ability to evoke a sense of fun and lightheartedness, reminiscent of vintage cartoons and playful illustrations. It's a font that invites interaction and engagement, making it perfect for projects that aim to capture a sense of joy and optimism.",
    "technical_characteristics": [
      "Bold weight",
      "Rounded terminals",
      "High x-height",
      "Open counters",
      "Strong contrast between thick and thin strokes",
      "Geometric and organic construction",
      "Playful curves"
    ],
    "personality_traits": [
      "Whimsical",
      "Playful",
      "Energetic",
      "Friendly",
      "Approachable",
      "Retro",
      "Nostalgic"
    ],
    "practical_contexts": [
      "Children's books",
      "Playful branding",
      "Headlines and titles",
      "Display font",
      "Short text blocks"
    ],
    "cultural_intuition": [
      "Vintage cartoons",
      "Playful illustrations",
      "Nostalgia for a simpler time",
      "Fun and lightheartedness",
      "Joy and optimism"
    ],
    "search_keywords": [
      "Bold",
      "Rounded",
      "Playful",
      "Whimsical",
      "Energetic",
      "Retro",
      "Nostalgic",
      "Children's",
      "Branding",
      "Display",
      "Headline",
      "Title",
      "Cartoon",
      "Illustration",
      "Fun",
      "Lighthearted",
      "Joy",
      "Optimism",
      "Geometric",
      "Organic",
      "High x-height",
      "Open counters",
      "Contrast",
      "Legible",
      "Readable"
    ]
  }
}