{
  "filename": "galactico_basic_36px.png",
  "status": "success",
  "description": {
    "detailed_description": "This font is a striking example of geometric sans-serif design, built entirely from sharp angles and precise lines. The letterforms are constructed with a strict adherence to a grid system, resulting in a highly structured and disciplined aesthetic. The absence of curves or rounded corners creates a sense of starkness and rigidity, while the consistent stroke weight and uniform letter spacing contribute to a sense of order and control. The font's bold and assertive character is further emphasized by its high x-height and open counters, which ensure strong legibility even at small sizes. This combination of technical precision and visual impact makes it ideal for conveying a sense of authority, power, and modernity. Its starkness and geometric nature evoke a sense of futuristic technology, reminiscent of science fiction films and cyberpunk aesthetics. The font's bold and assertive character makes it suitable for headlines, branding, and other applications where a strong visual statement is desired. However, its lack of warmth and organic elements might limit its use in contexts requiring a more approachable or friendly tone.",
    "technical_characteristics": [
      "Geometric construction",
      "Sharp angles",
      "Consistent stroke weight",
      "High x-height",
      "Open counters",
      "Uniform letter spacing",
      "Absence of curves"
    ],
    "personality_traits": [
      "Bold",
      "Assertive",
      "Modern",
      "Authoritative",
      "Powerful",
      "Stark",
      "Geometric"
    ],
    "practical_contexts": [
      "Headlines",
      "Branding",
      "Posters",
      "Digital interfaces",
      "Science fiction and cyberpunk aesthetics"
    ],
    "cultural_intuition": [
      "Futuristic technology",
      "Cyberpunk aesthetics",
      "Modernity",
      "Authority",
      "Power"
    ],
    "search_keywords": [
      "Geometric sans-serif",
      "Sharp angles",
      "High x-height",
      "Open counters",
      "Bold",
      "Assertive",
      "Modern",
      "Futuristic",
      "Cyberpunk",
      "Science fiction",
      "Headlines",
      "Branding",
      "Posters",
      "Digital interfaces",
      "Authority",
      "Power"
    ]
  }
}