{
  "filename": "gameboi_95_36px.png",
  "status": "success",
  "description": {
    "detailed_description": "Gameboi 95 is a playful and energetic display typeface that draws inspiration from the bold, chunky aesthetics of classic video game graphics. Its rounded forms and exaggerated proportions create a sense of fun and nostalgia, reminiscent of pixelated characters and arcade interfaces. The font's construction is characterized by a combination of geometric and organic elements, with rounded corners and slightly uneven curves adding a touch of hand-drawn charm. The high x-height and open counters ensure strong legibility, even at smaller sizes, making it suitable for headlines, logos, and playful branding applications. The font's bold weight and playful personality make it ideal for capturing attention and conveying a sense of energy and excitement. Its retro aesthetic evokes a sense of nostalgia for a simpler time, while its contemporary design language makes it relevant for modern digital applications. Gameboi 95 is a versatile typeface that can be used to create a wide range of visual effects, from playful and whimsical to bold and impactful.",
    "technical_characteristics": [
      "Rounded forms",
      "Exaggerated proportions",
      "High x-height",
      "Open counters",
      "Geometric and organic construction",
      "Bold weight",
      "Uneven curves"
    ],
    "personality_traits": [
      "Playful",
      "Energetic",
      "Nostalgic",
      "Bold",
      "Whimsical",
      "Retro",
      "Fun"
    ],
    "practical_contexts": [
      "Headlines",
      "Logos",
      "Branding",
      "Posters",
      "Digital interfaces",
      "Game design"
    ],
    "cultural_intuition": [
      "Evokes classic video game graphics",
      "Reminiscent of pixelated characters",
      "Captures the spirit of the 80s and 90s",
      "Suggests a sense of fun and nostalgia",
      "Appeals to a contemporary audience with a retro sensibility"
    ],
    "search_keywords": [
      "Display typeface",
      "Rounded forms",
      "Exaggerated proportions",
      "High x-height",
      "Open counters",
      "Geometric construction",
      "Organic elements",
      "Bold weight",
      "Playful",
      "Energetic",
      "Nostalgic",
      "Retro",
      "Video game graphics",
      "Pixelated characters",
      "Arcade interfaces",
      "Headlines",
      "Logos",
      "Branding",
      "Posters",
      "Digital interfaces",
      "Game design"
    ]
  }
}