{
  "filename": "gb_golden_bones_36px.png",
  "status": "success",
  "description": {
    "detailed_description": "Golden Bones is a display typeface that blends a classic slab serif construction with a distinctly modern edge. Its geometrically-driven letterforms feature strong, vertical strokes and sharp, angular terminals, creating a bold and assertive presence. The generous x-height and open counters ensure excellent legibility, even at large sizes. The font's overall character is both confident and playful, with a hint of retro charm. Its historical influences are evident in the slab serif structure, reminiscent of early 20th-century designs, while its contemporary relevance is reflected in its bold, graphic aesthetic. Golden Bones is well-suited for headlines, branding elements, and digital interfaces where a strong visual impact is desired. Its bold personality and retro-inspired design evoke a sense of vintage Americana, suggesting a blend of tradition and innovation. The font's sharp angles and geometric forms create a sense of energy and dynamism, while its overall structure maintains a sense of balance and stability.",
    "technical_characteristics": [
      "Geometric construction",
      "Slab serif structure",
      "Strong vertical strokes",
      "Sharp, angular terminals",
      "Generous x-height",
      "Open counters",
      "Bold weight"
    ],
    "personality_traits": [
      "Confident",
      "Playful",
      "Bold",
      "Graphic",
      "Retro-inspired",
      "Energetic",
      "Dynamic",
      "Stable"
    ],
    "practical_contexts": [
      "Headlines",
      "Branding elements",
      "Digital interfaces",
      "Large-scale signage",
      "Posters and flyers"
    ],
    "cultural_intuition": [
      "Vintage Americana",
      "Retro futurism",
      "Modern graphic design",
      "Urban street culture",
      "Bold and assertive"
    ],
    "search_keywords": [
      "Slab serif",
      "Geometric",
      "Display typeface",
      "Bold",
      "Retro",
      "Modern",
      "Graphic",
      "Headlines",
      "Branding",
      "Digital",
      "Vintage",
      "Americana",
      "Streetwear",
      "Assertive",
      "Energetic"
    ]
  }
}