{
  "filename": "germana_noia_36px.png",
  "status": "success",
  "description": {
    "detailed_description": "Germania Noia 36px is a bold, geometric sans-serif font with a distinct retro-futuristic aesthetic. Its construction is based on a grid system, resulting in clean, sharp lines and consistent proportions. The letters are built with a series of overlapping rectangles, creating a sense of depth and dimensionality. This technique, combined with the font's heavy weight and bold strokes, gives it a strong presence and a sense of solidity. The overall character of the font is confident and assertive, with a hint of playfulness. It evokes a sense of futuristic optimism, reminiscent of 1980s science fiction and video game design. The font's bold, graphic nature makes it ideal for headlines, logos, and other display applications, particularly in digital contexts. Its retro-futuristic vibe lends itself well to projects that aim to capture a sense of nostalgia or futuristic energy.",
    "technical_characteristics": [
      "Geometric construction",
      "Overlapping rectangles",
      "Heavy weight",
      "Bold strokes",
      "Sharp terminals",
      "Consistent proportions",
      "High x-height"
    ],
    "personality_traits": [
      "Confident",
      "Assertive",
      "Playful",
      "Bold",
      "Graphic",
      "Retro-futuristic",
      "Energetic"
    ],
    "practical_contexts": [
      "Headlines",
      "Logos",
      "Display typography",
      "Digital interfaces",
      "Video game design"
    ],
    "cultural_intuition": [
      "1980s science fiction",
      "Video game design",
      "Futuristic optimism",
      "Nostalgia",
      "Digital culture"
    ],
    "search_keywords": [
      "Geometric sans-serif",
      "Retro-futuristic",
      "Bold",
      "Heavy weight",
      "Sharp terminals",
      "Overlapping rectangles",
      "High x-height",
      "Headlines",
      "Logos",
      "Display typography",
      "Digital interfaces",
      "Video game design",
      "Nostalgia",
      "Futuristic",
      "Energetic",
      "Confident",
      "Assertive",
      "Playful",
      "Graphic"
    ]
  }
}