{
  "filename": "german_beauty_36px.png",
  "status": "success",
  "description": {
    "detailed_description": "German Beauty is a display typeface that embraces a playful, almost cartoonish aesthetic. Its rounded, bulbous forms and exaggerated curves create a sense of whimsy and lightheartedness. The font's construction is characterized by a combination of organic and geometric elements, with rounded terminals and open counters that contribute to its friendly and approachable feel. The bold weight and consistent stroke width ensure strong legibility, even at smaller sizes. While the font's overall character is playful, it also possesses a certain level of sophistication, evident in the subtle variations in letterforms and the overall balance of the design. This balance makes it suitable for a variety of applications, from children's books and branding for playful products to headlines and display text in digital media. The font's cultural associations evoke a sense of nostalgia for classic cartoon characters and a playful, optimistic spirit that resonates with contemporary digital culture.",
    "technical_characteristics": [
      "Rounded terminals",
      "Open counters",
      "Exaggerated curves",
      "Bold weight",
      "Consistent stroke width",
      "Organic and geometric construction",
      "Variable letterforms"
    ],
    "personality_traits": [
      "Playful",
      "Whimsical",
      "Lighthearted",
      "Friendly",
      "Approachable",
      "Bold",
      "Sophisticated"
    ],
    "practical_contexts": [
      "Children's books",
      "Branding for playful products",
      "Headlines",
      "Display text in digital media",
      "Social media graphics"
    ],
    "cultural_intuition": [
      "Nostalgia for classic cartoon characters",
      "Playful, optimistic spirit",
      "Contemporary digital culture",
      "Fun and engaging",
      "Childlike wonder"
    ],
    "search_keywords": [
      "Display typeface",
      "Playful font",
      "Cartoon font",
      "Rounded terminals",
      "Open counters",
      "Bold weight",
      "Whimsical",
      "Lighthearted",
      "Friendly",
      "Approachable",
      "Children's books",
      "Branding",
      "Headlines",
      "Digital media",
      "Social media graphics",
      "Nostalgia",
      "Cartoon characters",
      "Optimistic",
      "Digital culture"
    ]
  }
}