{
  "filename": "get_show_36px.png",
  "status": "success",
  "description": {
    "detailed_description": "Get Show is a script typeface that captures the energy of handwritten lettering, but with a refined digital edge. Its flowing strokes and dynamic angles create a sense of movement and personality, while the consistent weight and clear articulation ensure legibility. The font's organic nature is evident in the subtle variations in stroke thickness and the playful curves of letters like 's' and 'g'. This hand-drawn aesthetic is balanced by a strong underlying structure, evident in the consistent baseline and the well-defined ascenders and descenders. This combination of free-flowing style and structural integrity makes Get Show suitable for a wide range of applications, from casual branding and social media graphics to more formal headlines and titles. Its playful yet sophisticated character evokes a sense of modern optimism and creativity, making it a versatile choice for projects that require a touch of personality and visual interest.",
    "technical_characteristics": [
      "flowing strokes",
      "dynamic angles",
      "consistent weight",
      "clear articulation",
      "subtle variations in stroke thickness",
      "playful curves",
      "strong underlying structure",
      "consistent baseline",
      "well-defined ascenders and descenders"
    ],
    "personality_traits": [
      "energetic",
      "dynamic",
      "playful",
      "handwritten",
      "refined",
      "legible",
      "optimistic",
      "creative",
      "versatile"
    ],
    "practical_contexts": [
      "casual branding",
      "social media graphics",
      "headlines",
      "titles",
      "logos",
      "packaging",
      "web design"
    ],
    "cultural_intuition": [
      "evokes a sense of modern optimism",
      "captures the spirit of contemporary design",
      "suggests a playful and approachable personality",
      "reflects the trend towards handwritten aesthetics"
    ],
    "search_keywords": [
      "script",
      "handwritten",
      "flowing",
      "dynamic",
      "legible",
      "versatile",
      "playful",
      "optimistic",
      "creative",
      "casual",
      "branding",
      "social media",
      "headlines",
      "titles",
      "logos",
      "packaging",
      "web design",
      "modern",
      "contemporary"
    ]
  }
}