{
  "filename": "ginjah_ninjah_36px.png",
  "status": "success",
  "description": {
    "detailed_description": "Sinjah Ninjah is a playful, handwritten script font that captures the energy of casual, expressive writing. Its irregular letterforms and dynamic strokes create a sense of spontaneity and personality. The font's construction is based on a loose, organic structure, with varying letter heights and widths that contribute to its informal character. The generous x-height and open counters ensure good legibility, even at smaller sizes. The font's overall mood is lighthearted and approachable, making it suitable for projects that require a friendly and informal tone. Its versatility extends to both digital and print applications, from social media graphics and website headers to handwritten notes and personalized stationery. The font's cultural associations evoke a sense of youthful energy and creativity, reminiscent of hand-drawn doodles and personal expression. It's a font that feels both familiar and unique, capturing the spirit of contemporary digital culture while retaining a timeless appeal.",
    "technical_characteristics": [
      "Handwritten style",
      "Irregular letterforms",
      "Dynamic strokes",
      "Varying letter heights and widths",
      "Generous x-height",
      "Open counters",
      "Loose, organic structure"
    ],
    "personality_traits": [
      "Playful",
      "Expressive",
      "Spontaneous",
      "Informal",
      "Lighthearted",
      "Approachable",
      "Friendly",
      "Unique"
    ],
    "practical_contexts": [
      "Social media graphics",
      "Website headers",
      "Handwritten notes",
      "Personalized stationery",
      "Logos and branding for creative businesses",
      "Casual invitations and announcements"
    ],
    "cultural_intuition": [
      "Evokes youthful energy and creativity",
      "Reminiscent of hand-drawn doodles",
      "Captures the spirit of contemporary digital culture",
      "Feels both familiar and unique",
      "Suggests a sense of personal expression"
    ],
    "search_keywords": [
      "Handwritten",
      "Script",
      "Playful",
      "Informal",
      "Casual",
      "Expressive",
      "Dynamic",
      "Organic",
      "Generous x-height",
      "Open counters",
      "Legible",
      "Social media",
      "Website",
      "Branding",
      "Creative",
      "Youthful",
      "Contemporary",
      "Digital",
      "Personal",
      "Unique"
    ]
  }
}