{
  "filename": "glass_hand_36px.png",
  "status": "success",
  "description": {
    "detailed_description": "This font embodies a raw, expressive energy, reminiscent of handwritten notes or quick sketches. Its irregular letterforms, with varying stroke weights and angles, create a sense of immediacy and authenticity. The ascenders and descenders are often exaggerated, adding to the dynamic feel. While the overall construction is loose and informal, there's a clear underlying structure, suggesting a deliberate hand behind the apparent spontaneity. This balance between controlled chaos and underlying order makes the font both visually engaging and surprisingly legible, especially at larger sizes. Its casual yet expressive nature makes it ideal for projects that require a personal touch, such as handwritten notes, social media graphics, or informal branding. The font evokes a sense of youthful energy and creative freedom, reminiscent of DIY culture and independent expression.",
    "technical_characteristics": [
      "Irregular letterforms",
      "Varying stroke weights",
      "Exaggerated ascenders and descenders",
      "Loose and informal construction",
      "Underlying structural consistency"
    ],
    "personality_traits": [
      "Expressive",
      "Energetic",
      "Authentic",
      "Casual",
      "Playful"
    ],
    "practical_contexts": [
      "Handwritten notes",
      "Social media graphics",
      "Informal branding",
      "Headlines and titles",
      "Large-scale display"
    ],
    "cultural_intuition": [
      "DIY culture",
      "Independent expression",
      "Youthful energy",
      "Creative freedom",
      "Authenticity"
    ],
    "search_keywords": [
      "Handwritten",
      "Sketchy",
      "Informal",
      "Expressive",
      "Energetic",
      "Casual",
      "Playful",
      "Authentic",
      "DIY",
      "Independent",
      "Youthful",
      "Creative",
      "Social media",
      "Branding",
      "Headlines",
      "Titles",
      "Display"
    ]
  }
}