{
  "filename": "goma_western_36px.png",
  "status": "success",
  "description": {
    "detailed_description": "Goma Western is a display typeface that embodies the rugged charm of classic Western signage. Its bold, geometric construction, with sharp corners and a distinct slab serif style, evokes a sense of strength and authority. The generous x-height and open counters ensure excellent legibility, even at large sizes, making it ideal for headlines and branding elements. The font's overall character is confident and assertive, with a touch of vintage Americana. Its historical influences are evident in the strong, geometric forms reminiscent of early 20th-century signage, while its contemporary relevance lies in its ability to add a touch of nostalgia and authenticity to modern designs. Goma Western is particularly effective for projects that require a bold, attention-grabbing presence, such as posters, logos, and packaging. Its strong visual impact and clear readability make it suitable for a wide range of applications, from vintage-inspired designs to contemporary branding projects. The font's cultural associations evoke a sense of the American West, with its imagery of cowboys, saloons, and wide-open spaces. This association adds a layer of depth and meaning to its use, making it a powerful tool for conveying a sense of adventure, freedom, and rugged individualism.",
    "technical_characteristics": [
      "Geometric construction",
      "Slab serif style",
      "Sharp corners",
      "Generous x-height",
      "Open counters",
      "Bold weight",
      "Consistent stroke width"
    ],
    "personality_traits": [
      "Confident",
      "Assertive",
      "Rugged",
      "Nostalgic",
      "Authentic",
      "Vintage",
      "Bold",
      "Strong",
      "Legible",
      "Attention-grabbing"
    ],
    "practical_contexts": [
      "Headlines",
      "Logos",
      "Branding",
      "Posters",
      "Packaging",
      "Signage",
      "Display typography"
    ],
    "cultural_intuition": [
      "American West",
      "Vintage Americana",
      "Nostalgia",
      "Adventure",
      "Freedom",
      "Rugged individualism"
    ],
    "search_keywords": [
      "Goma Western",
      "Slab serif",
      "Geometric",
      "Display typeface",
      "Bold",
      "Western",
      "Vintage",
      "Nostalgic",
      "American",
      "Signage",
      "Headlines",
      "Branding",
      "Posters",
      "Packaging",
      "Logos",
      "Rugged",
      "Confident",
      "Assertive",
      "Legible",
      "Attention-grabbing",
      "Authentic",
      "Contemporary",
      "Traditional",
      "Display",
      "Type",
      "Font"
    ]
  }
}