{
  "filename": "gorgo_36px.png",
  "status": "success",
  "description": {
    "detailed_description": "Gorgo is a display typeface that embodies a raw, energetic aesthetic. Its construction is characterized by bold, angular strokes with pronounced serifs that often appear jagged or broken. This deliberate imperfection creates a sense of urgency and immediacy, reminiscent of hand-painted signage or distressed textures. The font's x-height is relatively high, contributing to its strong visual presence and ensuring legibility even at smaller sizes. The letterforms are generally wide and open, with generous counters that enhance readability. The overall effect is a font that feels both powerful and slightly chaotic, suggesting a sense of rebellion or unconventionality. While its bold character makes it ideal for headlines, logos, and branding elements that demand attention, its inherent roughness might limit its use in extended text blocks. Gorgo's visual impact evokes a sense of urban grit and rebellious energy, aligning it with contemporary subcultures and counter-cultural movements. It's a font that speaks to a generation that embraces authenticity and raw expression, making it a compelling choice for projects that seek to convey a sense of individuality and defiance.",
    "technical_characteristics": [
      "Angular strokes",
      "Jagged serifs",
      "High x-height",
      "Wide letterforms",
      "Open counters",
      "Distressed texture",
      "Bold weight"
    ],
    "personality_traits": [
      "Energetic",
      "Rebellious",
      "Unconventional",
      "Raw",
      "Powerful",
      "Gritty",
      "Immediate"
    ],
    "practical_contexts": [
      "Headlines",
      "Logos",
      "Branding elements",
      "Posters",
      "Streetwear designs"
    ],
    "cultural_intuition": [
      "Urban grit",
      "Counter-cultural",
      "Rebellious spirit",
      "Authenticity",
      "Raw expression"
    ],
    "search_keywords": [
      "Display typeface",
      "Bold",
      "Angular",
      "Jagged",
      "Distressed",
      "High x-height",
      "Open counters",
      "Energetic",
      "Rebellious",
      "Urban",
      "Counter-cultural",
      "Streetwear",
      "Branding",
      "Logo",
      "Headline"
    ]
  }
}