{
  "filename": "gorski_36px.png",
  "status": "success",
  "description": {
    "detailed_description": "Gorski is a display typeface that embodies the spirit of classic comic book lettering, with a playful yet confident personality. Its bold strokes and exaggerated curves create a dynamic and energetic feel, reminiscent of vintage superhero titles. The font's construction is based on a combination of geometric and organic forms, with rounded terminals and a slight slant adding a touch of whimsy. The high x-height and open counters ensure strong legibility, even at smaller sizes, making it suitable for headlines, logos, and other graphic elements where impact is desired. Gorski's bold character and playful energy make it ideal for projects that require a sense of fun and excitement, while its clear legibility ensures that the message remains clear. The font's cultural associations with comic book art and pop culture add a layer of nostalgia and familiarity, making it a versatile choice for a wide range of applications.",
    "technical_characteristics": [
      "Bold strokes",
      "Exaggerated curves",
      "Rounded terminals",
      "Slight slant",
      "High x-height",
      "Open counters"
    ],
    "personality_traits": [
      "Playful",
      "Energetic",
      "Confident",
      "Whimsical",
      "Dynamic",
      "Bold",
      "Nostalgic"
    ],
    "practical_contexts": [
      "Headlines",
      "Logos",
      "Graphic elements",
      "Posters",
      "Packaging"
    ],
    "cultural_intuition": [
      "Comic book art",
      "Pop culture",
      "Nostalgia",
      "Superhero titles",
      "Vintage design"
    ],
    "search_keywords": [
      "Display typeface",
      "Comic book lettering",
      "Bold",
      "Playful",
      "Energetic",
      "Whimsical",
      "Dynamic",
      "High x-height",
      "Open counters",
      "Legible",
      "Headlines",
      "Logos",
      "Graphic elements",
      "Posters",
      "Packaging",
      "Vintage",
      "Nostalgic",
      "Superhero",
      "Pop culture"
    ]
  }
}