{
  "filename": "gotenborg_fraktur_36px.png",
  "status": "success",
  "description": {
    "detailed_description": "Gothenburg Fraktur is a bold and expressive blackletter typeface that draws inspiration from traditional German Fraktur scripts. Its sharp, angular strokes and intricate flourishes create a sense of historical grandeur and dramatic flair. The font's construction is based on a strong geometric framework, with each letterform meticulously crafted to maintain a consistent visual weight and balance. The high x-height and open counters ensure excellent legibility, even at smaller sizes. The distinctive features of Gothenburg Fraktur include its pronounced serifs, which often extend beyond the letterform's baseline, and its use of ligatures, which add a touch of elegance and sophistication. The font's overall character is both authoritative and whimsical, evoking a sense of tradition and craftsmanship. Its historical influences are evident in its calligraphic origins, while its contemporary relevance lies in its ability to add a touch of personality and intrigue to modern designs. Gothenburg Fraktur is well-suited for projects that require a strong visual impact, such as branding, packaging, and editorial design. Its bold and expressive nature makes it ideal for headlines, titles, and other prominent text elements. However, its intricate details and complex letterforms may limit its use in smaller sizes or for extended blocks of text. Gothenburg Fraktur's cultural associations are rooted in its German heritage, evoking images of medieval manuscripts, gothic architecture, and traditional folklore. Its bold and dramatic character also resonates with contemporary trends in design, where a sense of individuality and expressiveness is highly valued.",
    "technical_characteristics": [
      "Geometric construction",
      "High x-height",
      "Open counters",
      "Pronounced serifs",
      "Intricate flourishes",
      "Ligatures",
      "Bold weight"
    ],
    "personality_traits": [
      "Authoritative",
      "Whimsical",
      "Dramatic",
      "Elegant",
      "Sophisticated",
      "Intriguing",
      "Expressive"
    ],
    "practical_contexts": [
      "Headlines",
      "Titles",
      "Branding",
      "Packaging",
      "Editorial design"
    ],
    "cultural_intuition": [
      "German heritage",
      "Medieval manuscripts",
      "Gothic architecture",
      "Traditional folklore",
      "Contemporary design trends"
    ],
    "search_keywords": [
      "Blackletter",
      "Fraktur",
      "Geometric",
      "High x-height",
      "Open counters",
      "Serifs",
      "Flourishes",
      "Ligatures",
      "Bold",
      "Expressive",
      "Authoritative",
      "Whimsical",
      "Elegant",
      "Sophisticated",
      "Intriguing",
      "Branding",
      "Packaging",
      "Editorial",
      "Headlines",
      "Titles",
      "German",
      "Medieval",
      "Gothic",
      "Folklore",
      "Contemporary"
    ]
  }
}