{
  "filename": "gotique_36px.png",
  "status": "success",
  "description": {
    "detailed_description": "This font, with its bold strokes and intricate flourishes, is a captivating example of blackletter typography. Its origins are deeply rooted in medieval script, evident in the pointed, angular forms and the use of ligatures. The ascenders and descenders are elongated, creating a sense of verticality and grandeur. The letterforms are meticulously crafted, with each stroke carefully balanced and connected, resulting in a visually rich and complex design. The font's personality is both dramatic and elegant, evoking a sense of history and tradition. It carries a strong visual weight, making it ideal for headlines, titles, and branding elements where a bold statement is desired. However, its intricate details and complex structure may limit its readability in smaller sizes or extended text blocks. Despite its historical roots, the font's bold and dramatic nature resonates with contemporary design trends, particularly in the realm of gothic-inspired aesthetics and dark academia. It can add a touch of mystery and intrigue to projects, making it suitable for branding, packaging, and editorial design that seeks to evoke a sense of history, power, or sophistication.",
    "technical_characteristics": [
      "Blackletter style",
      "Intricate flourishes",
      "Elongated ascenders and descenders",
      "Bold strokes",
      "Angular forms",
      "Ligatures",
      "High contrast between thick and thin strokes"
    ],
    "personality_traits": [
      "Dramatic",
      "Elegant",
      "Bold",
      "Intricate",
      "Historical",
      "Traditional",
      "Sophisticated"
    ],
    "practical_contexts": [
      "Headlines",
      "Titles",
      "Branding elements",
      "Logos",
      "Posters",
      "Packaging"
    ],
    "cultural_intuition": [
      "Medieval script",
      "Gothic aesthetics",
      "Dark academia",
      "History and tradition",
      "Mystery and intrigue"
    ],
    "search_keywords": [
      "Blackletter",
      "Gothic",
      "Medieval",
      "Script",
      "Flourishes",
      "Bold",
      "Intricate",
      "Elegant",
      "Dramatic",
      "Sophisticated",
      "Headlines",
      "Titles",
      "Branding",
      "Logos",
      "Posters",
      "Packaging",
      "Dark academia",
      "History",
      "Tradition",
      "Mystery",
      "Intrigue"
    ]
  }
}