{
  "filename": "grabstein_handschrift_36px.png",
  "status": "success",
  "description": {
    "detailed_description": "Grabstein HandSchrift is a playful yet legible script font that captures the essence of handwritten text. Its organic curves and flowing strokes create a sense of movement and informality, while the consistent letterforms and clear counters ensure readability. The font's slightly irregular baseline and varying letter heights add to its hand-drawn charm, evoking a sense of authenticity and personal expression. The inclusion of ligatures and alternate glyphs further enhances its versatility, allowing for creative customization and a more nuanced visual experience. While its casual nature makes it ideal for informal projects like social media graphics, invitations, and branding for creative businesses, its legibility also makes it suitable for short-form content and headlines in digital environments. The font's overall character evokes a sense of warmth, friendliness, and approachability, making it a perfect choice for projects that aim to connect with audiences on a personal level.",
    "technical_characteristics": [
      "Organic curves and flowing strokes",
      "Slightly irregular baseline",
      "Varying letter heights",
      "Consistent letterforms",
      "Clear counters",
      "Ligatures and alternate glyphs"
    ],
    "personality_traits": [
      "Playful and legible",
      "Hand-drawn charm",
      "Authentic and personal",
      "Casual and informal",
      "Warm and approachable"
    ],
    "practical_contexts": [
      "Social media graphics",
      "Invitations",
      "Branding for creative businesses",
      "Short-form content",
      "Headlines in digital environments"
    ],
    "cultural_intuition": [
      "Evokes a sense of authenticity and personal expression",
      "Captures the essence of handwritten text",
      "Reflects a contemporary trend towards informality and personalization",
      "Suggests a connection to creative and artistic communities"
    ],
    "search_keywords": [
      "script font",
      "handwritten",
      "playful",
      "legible",
      "organic",
      "informal",
      "authentic",
      "personal",
      "casual",
      "versatile",
      "customizable",
      "social media",
      "invitations",
      "branding",
      "creative businesses",
      "short-form content",
      "headlines",
      "digital",
      "warm",
      "friendly",
      "approachable"
    ]
  }
}