{
  "filename": "grafitik_riot_36px.png",
  "status": "success",
  "description": {
    "detailed_description": "This font, with its bold, angular strokes and exaggerated letterforms, draws inspiration from the raw energy of graffiti art. The irregular, almost jagged, lines create a sense of movement and dynamism, reminiscent of the spontaneous nature of street art. The letterforms are often compressed and condensed, adding to the feeling of urgency and intensity. While the font's construction is technically loose, it maintains a strong visual coherence, with a consistent use of sharp angles and bold contrasts. This makes it suitable for headlines, logos, and other applications where a powerful and attention-grabbing visual impact is desired. The font's cultural associations with urban culture and rebellious spirit make it a compelling choice for projects that aim to convey a sense of authenticity and street credibility.",
    "technical_characteristics": [
      "Angular strokes",
      "Exaggerated letterforms",
      "Compressed and condensed",
      "Sharp angles",
      "Bold contrasts",
      "Irregular line weights",
      "Jagged edges"
    ],
    "personality_traits": [
      "Bold",
      "Energetic",
      "Dynamic",
      "Rebellious",
      "Urban",
      "Raw",
      "Spontaneous"
    ],
    "practical_contexts": [
      "Headlines",
      "Logos",
      "Posters",
      "Streetwear designs",
      "Music album covers",
      "Digital graphics"
    ],
    "cultural_intuition": [
      "Urban culture",
      "Street art",
      "Rebellious spirit",
      "Authenticity",
      "Street credibility"
    ],
    "search_keywords": [
      "graffiti",
      "street art",
      "urban",
      "bold",
      "angular",
      "dynamic",
      "compressed",
      "condensed",
      "sharp",
      "contrasts",
      "headlines",
      "logos",
      "posters",
      "streetwear",
      "music",
      "digital",
      "graphics",
      "rebellious",
      "authentic",
      "credible"
    ]
  }
}