{
  "filename": "grapple_brk_36px.png",
  "status": "success",
  "description": {
    "detailed_description": "Grapple BRK is a geometric sans-serif typeface built upon a grid system, resulting in a bold and highly legible design. Its construction is characterized by sharp corners, straight lines, and a consistent stroke weight, creating a sense of rigidity and order. The font's x-height is relatively high, contributing to its strong readability, especially in smaller sizes. The open counters and generous spacing between letters further enhance legibility, ensuring clarity even in dense text settings. The overall character of Grapple BRK is assertive and confident, conveying a sense of authority and modernity. Its geometric structure evokes a sense of precision and control, while the bold weight adds a touch of power and impact. The font's historical influences can be traced back to early 20th-century geometric sans-serifs like Futura and Kabel, but it also carries a contemporary edge, reflecting the influence of digital design and minimalist aesthetics. Grapple BRK is well-suited for a variety of applications, including branding, headlines, signage, and digital interfaces. Its bold presence makes it ideal for large-scale displays, while its legibility ensures readability in smaller sizes. However, its geometric nature might limit its use in extended text blocks, where a more humanist typeface might offer greater comfort. The font's cultural associations are rooted in the modern era, suggesting a sense of innovation, technology, and urbanity. Its bold and assertive character aligns with contemporary trends in design, where clarity and impact are highly valued.",
    "technical_characteristics": [
      "Geometric construction",
      "Sharp corners",
      "Consistent stroke weight",
      "High x-height",
      "Open counters",
      "Generous letter spacing"
    ],
    "personality_traits": [
      "Assertive",
      "Confident",
      "Modern",
      "Authoritative",
      "Powerful",
      "Geometric",
      "Rigorous",
      "Clean",
      "Bold"
    ],
    "practical_contexts": [
      "Branding",
      "Headlines",
      "Signage",
      "Digital interfaces",
      "Large-scale displays"
    ],
    "cultural_intuition": [
      "Modernity",
      "Innovation",
      "Technology",
      "Urbanity",
      "Minimalism"
    ],
    "search_keywords": [
      "Geometric sans-serif",
      "Bold typeface",
      "High x-height",
      "Open counters",
      "Legible",
      "Modern design",
      "Digital font",
      "Branding",
      "Headlines",
      "Signage",
      "Minimalist",
      "Assertive",
      "Confident",
      "Authoritative",
      "Powerful",
      "Urban",
      "Contemporary",
      "Geometric",
      "Grid system",
      "Sharp corners",
      "Straight lines",
      "Consistent stroke weight",
      "Open type",
      "Digital display",
      "Large scale",
      "Readability",
      "Clarity"
    ]
  }
}