{
  "filename": "green_days_36px.png",
  "status": "success",
  "description": {
    "detailed_description": "Green Days PX is a display typeface that embodies a playful, almost chaotic energy. Its construction is based on a combination of geometric and organic forms, resulting in a unique visual language. The letters are characterized by sharp angles, jagged edges, and irregular outlines, creating a sense of dynamism and unpredictability. This irregularity is further emphasized by the inconsistent stroke widths, which add to the font's raw and unpolished aesthetic. Despite its unconventional appearance, Green Days PX maintains a strong legibility, thanks to its generous x-height and open counters. The font's bold and assertive character makes it ideal for headlines, posters, and other applications where a strong visual impact is desired. Its playful nature also lends itself well to branding for youth-oriented products or events, evoking a sense of fun and irreverence. The font's cultural associations are rooted in street art and graffiti, reflecting a rebellious and unconventional spirit. It captures the energy of urban environments and the DIY aesthetic of subcultures, making it a powerful tool for expressing individuality and nonconformity.",
    "technical_characteristics": [
      "Geometric and organic construction",
      "Sharp angles and jagged edges",
      "Irregular outlines",
      "Inconsistent stroke widths",
      "Generous x-height",
      "Open counters"
    ],
    "personality_traits": [
      "Playful and chaotic",
      "Dynamic and unpredictable",
      "Raw and unpolished",
      "Bold and assertive",
      "Rebellious and unconventional"
    ],
    "practical_contexts": [
      "Headlines and posters",
      "Branding for youth-oriented products or events",
      "Street art and graffiti",
      "Digital graphics and web design",
      "Limited use in body text due to legibility concerns"
    ],
    "cultural_intuition": [
      "Street art and graffiti",
      "Urban environments",
      "DIY aesthetic",
      "Subcultures",
      "Rebellious and unconventional spirit"
    ],
    "search_keywords": [
      "display typeface",
      "geometric",
      "organic",
      "sharp angles",
      "jagged edges",
      "irregular outlines",
      "inconsistent stroke widths",
      "generous x-height",
      "open counters",
      "bold",
      "assertive",
      "playful",
      "chaotic",
      "street art",
      "graffiti",
      "urban",
      "DIY",
      "subcultures",
      "rebellious",
      "unconventional",
      "headlines",
      "posters",
      "branding",
      "youth-oriented",
      "digital graphics",
      "web design"
    ]
  }
}