{
  "filename": "greifswaler_deutsche_schrift_36px.png",
  "status": "success",
  "description": {
    "detailed_description": "This font, with its flowing italic form and calligraphic flourishes, embodies a classic elegance reminiscent of 19th-century script fonts. The characters are constructed with a graceful, fluid stroke, featuring pronounced ascenders and descenders that create a sense of dynamism and visual interest. The letterforms are carefully balanced, with a moderate x-height and open counters that ensure legibility even at smaller sizes. The subtle variations in stroke weight and the delicate curves add a touch of sophistication, while the overall impression is one of refined charm and timeless appeal. This font is well-suited for applications where a touch of vintage elegance is desired, such as invitations, stationery, or branding for businesses that value tradition and craftsmanship. Its graceful curves and flowing lines evoke a sense of artistry and sophistication, suggesting a brand that is both timeless and refined. The font's cultural resonance lies in its connection to a bygone era of handwritten correspondence and artistic expression, adding a layer of nostalgia and authenticity to its use.",
    "technical_characteristics": [
      "italic form",
      "calligraphic flourishes",
      "pronounced ascenders and descenders",
      "moderate x-height",
      "open counters",
      "subtle variations in stroke weight",
      "delicate curves"
    ],
    "personality_traits": [
      "classic elegance",
      "refined charm",
      "timeless appeal",
      "graceful",
      "sophisticated",
      "artistic",
      "nostalgic"
    ],
    "practical_contexts": [
      "invitations",
      "stationery",
      "branding for businesses that value tradition and craftsmanship",
      "display typography",
      "small-scale text"
    ],
    "cultural_intuition": [
      "19th-century script fonts",
      "handwritten correspondence",
      "artistic expression",
      "vintage elegance",
      "timeless and refined"
    ],
    "search_keywords": [
      "italic",
      "script",
      "calligraphy",
      "elegant",
      "refined",
      "vintage",
      "classic",
      "graceful",
      "flowing",
      "sophisticated",
      "nostalgic",
      "display",
      "handwritten",
      "lettering",
      "art deco",
      "traditional",
      "formal",
      "cursive",
      "flourishes",
      "ascenders",
      "descenders",
      "x-height",
      "counters",
      "stroke weight",
      "curves",
      "legibility",
      "invitations",
      "stationery",
      "branding",
      "typography",
      "design",
      "font"
    ]
  }
}