{
  "filename": "grunge_puddles_36px.png",
  "status": "success",
  "description": {
    "detailed_description": "This font, with its bold, chunky letterforms and textured outlines, embodies a playful and slightly rebellious spirit. Each character is constructed with a distinct, almost cartoonish, quality, featuring rounded corners and exaggerated curves. The heavy weight and generous spacing create a sense of visual impact, while the textured outlines add a layer of grit and informality. This combination of bold design and rough edges evokes a sense of energy and unconventionality, making it ideal for projects that demand attention and a touch of irreverence. While its bold nature might limit its use in large blocks of text, it excels in headlines, logos, and graphic elements, adding a touch of personality and visual interest. The font's overall aesthetic suggests a connection to street art and urban culture, with its bold, graphic style reminiscent of graffiti and hand-painted signage. It's a font that speaks to a younger generation, embracing a sense of individuality and creative expression.",
    "technical_characteristics": [
      "Heavy weight",
      "Rounded corners",
      "Exaggerated curves",
      "Textured outlines",
      "Generous spacing",
      "Bold character shapes"
    ],
    "personality_traits": [
      "Playful",
      "Rebellious",
      "Energetic",
      "Unconventional",
      "Bold",
      "Graphic",
      "Informal"
    ],
    "practical_contexts": [
      "Headlines",
      "Logos",
      "Graphic elements",
      "Short bursts of text",
      "Urban-inspired designs"
    ],
    "cultural_intuition": [
      "Street art",
      "Urban culture",
      "Graffiti",
      "Hand-painted signage",
      "Youthful energy"
    ],
    "search_keywords": [
      "Bold",
      "Chunky",
      "Rounded",
      "Textured",
      "Playful",
      "Rebellious",
      "Graphic",
      "Informal",
      "Street art",
      "Urban",
      "Graffiti",
      "Headlines",
      "Logos",
      "Display font",
      "Hand-painted",
      "Youthful",
      "Energetic",
      "Unconventional",
      "Impactful"
    ]
  }
}