{
  "filename": "gulag_decay_36px.png",
  "status": "success",
  "description": {
    "detailed_description": "This font, with its bold, blocky letterforms and heavily distressed textures, embodies a raw, industrial aesthetic. The geometric construction of the characters, with sharp angles and pronounced serifs, creates a sense of strength and solidity. The uneven, chipped edges and rough textures, reminiscent of worn metal or weathered concrete, add a layer of grit and authenticity. The high x-height and open counters ensure good legibility, even at smaller sizes, making it suitable for headlines and branding elements. The font's aggressive personality, with its hints of rebellion and defiance, makes it ideal for projects that demand a bold statement. It evokes a sense of urban grit, industrial power, and a touch of danger, making it perfect for projects related to heavy metal music, street art, or underground culture. However, its strong visual impact might limit its use in longer text blocks, where its aggressive nature could become overwhelming.",
    "technical_characteristics": [
      "Geometric construction",
      "High x-height",
      "Open counters",
      "Sharp angles",
      "Distressed textures",
      "Bold weight",
      "Pronounced serifs"
    ],
    "personality_traits": [
      "Aggressive",
      "Industrial",
      "Gritty",
      "Raw",
      "Bold",
      "Defiant",
      "Powerful",
      "Rebellious",
      "Authentic"
    ],
    "practical_contexts": [
      "Headlines",
      "Logos",
      "Branding",
      "Posters",
      "Street art",
      "Heavy metal album covers",
      "Urban design"
    ],
    "cultural_intuition": [
      "Urban grit",
      "Industrial power",
      "Underground culture",
      "Rebellion",
      "Defiance",
      "Streetwear",
      "Heavy metal music"
    ],
    "search_keywords": [
      "Geometric",
      "Distressed",
      "Industrial",
      "Bold",
      "Heavy",
      "Gritty",
      "Urban",
      "Street",
      "Raw",
      "Rebellious",
      "Metal",
      "Punk",
      "Rock",
      "Headlines",
      "Logos",
      "Branding",
      "Posters",
      "Street art",
      "Heavy metal album covers",
      "Urban design"
    ]
  }
}