{
  "filename": "gultan_bonte_36px.png",
  "status": "success",
  "description": {
    "detailed_description": "Gultan Bonte is a handwritten script font that captures the energy and informality of casual writing. Its flowing strokes and irregular letterforms create a sense of spontaneity and personality. The font's construction is based on a combination of calligraphic principles and digital manipulation, resulting in a unique blend of organic and geometric elements. The letters are generally rounded and open, with a high x-height that ensures good legibility even at smaller sizes. The font's distinctive features include its playful use of ligatures, its subtle variations in stroke weight, and its overall sense of movement. Gultan Bonte is well-suited for projects that require a touch of personality and authenticity, such as branding, social media graphics, and handwritten notes. Its casual yet legible nature makes it ideal for digital applications, while its organic feel adds a touch of warmth and approachability. The font evokes a sense of creativity and individuality, suggesting a connection to contemporary digital culture and the desire for authentic self-expression.",
    "technical_characteristics": [
      "Handwritten style",
      "Flowing strokes",
      "Irregular letterforms",
      "High x-height",
      "Open counters",
      "Rounded terminals",
      "Variable stroke weight",
      "Ligatures"
    ],
    "personality_traits": [
      "Spontaneous",
      "Playful",
      "Casual",
      "Authentic",
      "Warm",
      "Approachable",
      "Creative",
      "Individualistic"
    ],
    "practical_contexts": [
      "Branding",
      "Social media graphics",
      "Handwritten notes",
      "Digital applications",
      "Short text blocks"
    ],
    "cultural_intuition": [
      "Contemporary digital culture",
      "Authentic self-expression",
      "Casual communication",
      "Creative energy",
      "Informal design"
    ],
    "search_keywords": [
      "Handwritten",
      "Script",
      "Casual",
      "Playful",
      "Organic",
      "Geometric",
      "High x-height",
      "Open counters",
      "Rounded terminals",
      "Variable stroke weight",
      "Ligatures",
      "Branding",
      "Social media",
      "Digital",
      "Contemporary",
      "Authentic",
      "Creative",
      "Informal"
    ]
  }
}