{
  "filename": "gun_metal_36px.png",
  "status": "success",
  "description": {
    "detailed_description": "Gun Metal is a display typeface that embodies a bold, industrial aesthetic. Its geometric construction, with sharp angles and pronounced serifs, creates a strong, masculine presence. The letters are designed with a distinct three-dimensional effect, achieved through a subtle bevel and shadow, adding depth and visual interest. This effect, combined with the font's overall weight and density, evokes a sense of solidity and power. The font's high x-height and open counters ensure good legibility, even at smaller sizes, making it suitable for headlines and branding elements. The overall design evokes a sense of retrofuturism, reminiscent of 1980s sci-fi films and video games, while also feeling contemporary and edgy. Gun Metal's bold character and industrial aesthetic make it ideal for projects that require a strong visual impact, such as game titles, posters, and branding for tech companies.",
    "technical_characteristics": [
      "Geometric construction",
      "Sharp angles",
      "Pronounced serifs",
      "Three-dimensional effect",
      "Bevel and shadow",
      "High x-height",
      "Open counters"
    ],
    "personality_traits": [
      "Bold",
      "Industrial",
      "Masculine",
      "Powerful",
      "Solid",
      "Retrofuturistic",
      "Edgy"
    ],
    "practical_contexts": [
      "Headlines",
      "Branding",
      "Game titles",
      "Posters",
      "Tech company branding"
    ],
    "cultural_intuition": [
      "1980s sci-fi",
      "Video game aesthetics",
      "Industrial design",
      "Modern technology",
      "Urban culture"
    ],
    "search_keywords": [
      "Geometric",
      "Display",
      "Bold",
      "Industrial",
      "Masculine",
      "Three-dimensional",
      "Bevel",
      "Shadow",
      "High x-height",
      "Open counters",
      "Retrofuturistic",
      "Edgy",
      "Headlines",
      "Branding",
      "Game titles",
      "Posters",
      "Tech",
      "Urban",
      "Sci-fi",
      "Video game"
    ]
  }
}