{
  "filename": "gyrose_36px.png",
  "status": "success",
  "description": {
    "detailed_description": "This font, with its bold, angular forms and sharp, geometric construction, evokes a sense of strength and power. The letterforms are built from a series of interlocking, almost architectural, shapes, creating a sense of solidity and stability. The high x-height and open counters ensure strong legibility, even at small sizes, making it suitable for both display and body text. The font's bold, assertive character is further emphasized by the use of sharp terminals and a consistent, almost mechanical, stroke weight. This combination of technical precision and visual impact makes it ideal for projects that demand attention and authority, such as branding for technology companies, gaming titles, or even bold headlines in editorial design. The font's angularity and geometric construction also suggest a connection to the digital world, making it a strong choice for contemporary design projects. However, its bold, almost aggressive character might not be suitable for all applications, particularly those requiring a more delicate or refined aesthetic.",
    "technical_characteristics": [
      "Geometric construction",
      "High x-height",
      "Open counters",
      "Sharp terminals",
      "Consistent stroke weight",
      "Angular forms",
      "Interlocking shapes"
    ],
    "personality_traits": [
      "Bold",
      "Assertive",
      "Powerful",
      "Strong",
      "Stable",
      "Geometric",
      "Modern",
      "Digital",
      "Authoritative"
    ],
    "practical_contexts": [
      "Branding for technology companies",
      "Gaming titles",
      "Headlines in editorial design",
      "Display text",
      "Body text"
    ],
    "cultural_intuition": [
      "Evokes a sense of strength and power",
      "Suggests a connection to the digital world",
      "Reflects a contemporary design aesthetic",
      "Can be seen as aggressive or intimidating"
    ],
    "search_keywords": [
      "Geometric",
      "Angular",
      "Bold",
      "High x-height",
      "Open counters",
      "Sharp terminals",
      "Strong",
      "Powerful",
      "Stable",
      "Modern",
      "Digital",
      "Technology",
      "Gaming",
      "Branding",
      "Display",
      "Headline",
      "Editorial",
      "Assertive",
      "Aggressive",
      "Intimidating"
    ]
  }
}