{
  "filename": "halloween_spider_36px.png",
  "status": "success",
  "description": {
    "detailed_description": "This font, aptly named \"Halloween Spider\", is a playful and whimsical display typeface that uses a spiderweb motif to create a distinct and memorable visual identity. Each letterform is outlined with a delicate spiderweb pattern, adding a layer of texture and visual interest. The web design is consistently applied across the alphabet, creating a cohesive and recognizable style. The letterforms themselves are bold and chunky, with exaggerated proportions and sharp angles, contributing to the font's playful and slightly menacing character. The overall effect is a font that is both eye-catching and fun, making it ideal for Halloween-themed projects, children's books, or any design that requires a touch of spooky charm. While the font's bold and playful nature makes it suitable for large-scale display applications, its intricate web details might become less legible at smaller sizes. The font's cultural associations are firmly rooted in Halloween and the imagery of spiders, evoking a sense of playful spookiness and a touch of gothic whimsy.",
    "technical_characteristics": [
      "Spiderweb outline",
      "Bold, chunky letterforms",
      "Exaggerated proportions",
      "Sharp angles",
      "Consistent web design across alphabet"
    ],
    "personality_traits": [
      "Playful",
      "Whimsical",
      "Spooky",
      "Bold",
      "Eye-catching"
    ],
    "practical_contexts": [
      "Halloween-themed designs",
      "Children's books",
      "Display typography",
      "Posters",
      "Headlines"
    ],
    "cultural_intuition": [
      "Halloween",
      "Spiders",
      "Gothic whimsy",
      "Playful spookiness",
      "Childlike wonder"
    ],
    "search_keywords": [
      "Halloween",
      "Spider",
      "Display",
      "Whimsical",
      "Playful",
      "Spooky",
      "Bold",
      "Chunky",
      "Web",
      "Outline",
      "Gothic",
      "Children's",
      "Book",
      "Poster",
      "Headline",
      "Texture",
      "Pattern",
      "Graphic",
      "Design",
      "Font",
      "Typeface"
    ]
  }
}