{
  "filename": "halter_36px.png",
  "status": "success",
  "description": {
    "detailed_description": "Halter is a display typeface that embodies a playful yet robust character. Its defining feature is the distinctive 'haltered' construction, where each letterform is outlined with a series of small, evenly spaced dots. This creates a unique visual texture that evokes both retro-futuristic and pixelated aesthetics. The geometric construction of the letters, with their sharp corners and consistent stroke widths, contributes to a sense of solidity and confidence. However, the playful dot-based outline softens the overall impression, adding a touch of whimsy and approachability. The font's high x-height and open counters ensure strong legibility, even at smaller sizes, making it suitable for headlines, logos, and other display applications. Its bold, graphic nature lends itself well to digital interfaces, particularly those with a retro or pixelated aesthetic. Halter's unique visual language evokes a sense of playful experimentation, reminiscent of early computer graphics and the playful spirit of the 1980s. It suggests a sense of digital-native design, while also hinting at a nostalgic connection to the early days of computing.",
    "technical_characteristics": [
      "dot-based outline",
      "geometric construction",
      "consistent stroke widths",
      "sharp corners",
      "high x-height",
      "open counters",
      "bold weight"
    ],
    "personality_traits": [
      "playful",
      "robust",
      "retro-futuristic",
      "pixelated",
      "confident",
      "whimsical",
      "approachable",
      "graphic",
      "digital-native"
    ],
    "practical_contexts": [
      "headlines",
      "logos",
      "display typography",
      "digital interfaces",
      "retro-inspired designs",
      "pixel art"
    ],
    "cultural_intuition": [
      "early computer graphics",
      "1980s nostalgia",
      "digital-native design",
      "playful experimentation",
      "retro-futurism"
    ],
    "search_keywords": [
      "Halter",
      "display typeface",
      "dot-based outline",
      "geometric construction",
      "sharp corners",
      "high x-height",
      "open counters",
      "bold weight",
      "playful",
      "retro-futuristic",
      "pixelated",
      "digital-native",
      "retro",
      "nostalgia",
      "headlines",
      "logos",
      "digital interfaces",
      "pixel art"
    ]
  }
}