{
  "filename": "hammer_36px.png",
  "status": "success",
  "description": {
    "detailed_description": "This font embodies a raw, energetic spirit, reminiscent of hand-drawn lettering. Its irregular strokes and uneven letterforms create a sense of immediacy and authenticity. The bold, confident strokes suggest a strong personality, while the playful variations in letterforms add a touch of whimsy. The font's overall character is bold and expressive, with a distinct sense of personality. It's reminiscent of street art and graffiti, evoking a sense of urban energy and rebellious spirit. The font's technical construction is loose and organic, with a focus on expressive strokes rather than precise geometry. The letterforms are often asymmetrical, with varying stroke widths and angles. This lack of strictness contributes to the font's raw and energetic feel. Despite its informality, the font remains legible, thanks to its clear shapes and strong contrast. Its bold weight and open counters ensure readability even at small sizes. This font is ideal for projects that require a bold, expressive voice, such as branding for streetwear, music, or youth-oriented products. It can also be used effectively for headlines, posters, and other display applications where its energetic personality can shine. However, its informal nature might not be suitable for formal or corporate contexts. The font's cultural associations are rooted in street art and graffiti, evoking a sense of rebellion, creativity, and urban culture. It also carries a sense of playfulness and irreverence, reflecting a contemporary attitude towards design.",
    "technical_characteristics": [
      "Irregular stroke widths",
      "Uneven letterforms",
      "Asymmetrical shapes",
      "Bold weight",
      "Open counters",
      "Varying angles",
      "Expressive strokes",
      "Organic construction"
    ],
    "personality_traits": [
      "Energetic",
      "Expressive",
      "Bold",
      "Playful",
      "Whimsical",
      "Rebellious",
      "Authentic",
      "Immediate",
      "Informal"
    ],
    "practical_contexts": [
      "Streetwear branding",
      "Music branding",
      "Youth-oriented products",
      "Headlines",
      "Posters",
      "Display applications"
    ],
    "cultural_intuition": [
      "Street art",
      "Graffiti",
      "Urban culture",
      "Rebellion",
      "Creativity",
      "Playfulness",
      "Irreverence"
    ],
    "search_keywords": [
      "Hand-drawn",
      "Graffiti",
      "Street art",
      "Bold",
      "Expressive",
      "Energetic",
      "Informal",
      "Whimsical",
      "Playful",
      "Rebellious",
      "Urban",
      "Display",
      "Headline",
      "Branding",
      "Streetwear",
      "Music",
      "Youth",
      "Poster",
      "Typography",
      "Font",
      "Typeface"
    ]
  }
}