{
  "filename": "hammock_36px.png",
  "status": "success",
  "description": {
    "detailed_description": "Hammock is a display typeface that embraces a playful, hand-drawn aesthetic. Its irregular letterforms, characterized by rounded corners and uneven strokes, evoke a sense of casual charm. The font's construction is organic, with each letter seemingly sketched with a loose, expressive hand. This informality is further emphasized by the inclusion of subtle texture, adding a tactile quality to the digital form. While the overall design is whimsical, Hammock maintains a strong legibility, thanks to its generous x-height and open counters. This makes it suitable for headlines, branding elements, and even short-form text in digital environments. The font's playful nature evokes a sense of fun and approachability, making it ideal for projects that require a lighthearted and engaging tone. Its hand-drawn quality suggests a sense of authenticity and personality, aligning well with brands that value creativity and individuality.",
    "technical_characteristics": [
      "Hand-drawn aesthetic",
      "Irregular letterforms",
      "Rounded corners",
      "Uneven strokes",
      "Subtle texture",
      "Generous x-height",
      "Open counters"
    ],
    "personality_traits": [
      "Playful",
      "Whimsical",
      "Casual",
      "Charming",
      "Expressive",
      "Authentic",
      "Individualistic"
    ],
    "practical_contexts": [
      "Headlines",
      "Branding elements",
      "Short-form text",
      "Digital interfaces",
      "Social media graphics"
    ],
    "cultural_intuition": [
      "Evokes a sense of fun and approachability",
      "Suggests creativity and individuality",
      "Reflects a contemporary trend towards hand-crafted aesthetics",
      "Connects with a desire for authenticity and personality"
    ],
    "search_keywords": [
      "Hand-drawn",
      "Display typeface",
      "Playful",
      "Casual",
      "Whimsical",
      "Charming",
      "Expressive",
      "Authentic",
      "Individualistic",
      "Headlines",
      "Branding",
      "Digital",
      "Social media",
      "Graphic design",
      "Texture",
      "Rounded corners",
      "Uneven strokes",
      "Generous x-height",
      "Open counters"
    ]
  }
}