{
  "filename": "hand_me_down_36px.png",
  "status": "success",
  "description": {
    "detailed_description": "Hand Me Down is a playful and expressive font that captures the energy of handwritten text. Its irregular letterforms, with their varying stroke widths and organic curves, evoke the immediacy and personality of a quick sketch. The font's generous x-height and open counters ensure good legibility, even at smaller sizes, while the uneven baseline adds a touch of whimsy. This combination of legibility and personality makes it suitable for a range of applications, from casual branding and social media graphics to children's books and playful packaging. The font's hand-drawn aesthetic evokes a sense of authenticity and warmth, suggesting a personal touch and a connection to the human element. It's a font that feels both familiar and fresh, capturing the spirit of contemporary digital culture while retaining a timeless charm.",
    "technical_characteristics": [
      "Irregular letterforms",
      "Varying stroke widths",
      "Organic curves",
      "Generous x-height",
      "Open counters",
      "Uneven baseline",
      "Hand-drawn aesthetic"
    ],
    "personality_traits": [
      "Playful",
      "Expressive",
      "Whimsical",
      "Authentic",
      "Warm",
      "Casual",
      "Personal"
    ],
    "practical_contexts": [
      "Casual branding",
      "Social media graphics",
      "Children's books",
      "Playful packaging",
      "Handwritten-style typography"
    ],
    "cultural_intuition": [
      "Evokes a sense of authenticity and warmth",
      "Captures the spirit of contemporary digital culture",
      "Suggests a personal touch",
      "Feels both familiar and fresh",
      "Retains a timeless charm"
    ],
    "search_keywords": [
      "Handwritten",
      "Playful",
      "Expressive",
      "Casual",
      "Whimsical",
      "Organic",
      "Irregular",
      "Generous x-height",
      "Open counters",
      "Uneven baseline",
      "Branding",
      "Social media",
      "Children's books",
      "Packaging",
      "Digital culture",
      "Authentic",
      "Warm",
      "Personal",
      "Timeless"
    ]
  }
}