{
  "filename": "handwritten_nat29_36px.png",
  "status": "success",
  "description": {
    "detailed_description": "Handwritten Nat29 embodies a casual, approachable aesthetic, drawing inspiration from everyday handwriting. Its irregular letterforms, varying stroke weights, and playful ascenders and descenders create a sense of spontaneity and warmth. The font's generous x-height and open counters ensure legibility even at smaller sizes, making it suitable for both digital and print applications. While the overall impression is informal, the font's consistent baseline and well-defined letterforms maintain a level of professionalism, making it appropriate for branding, social media, and even short-form editorial content. The font's playful nature evokes a sense of personal connection, suggesting a friendly and approachable brand personality. Its handwritten origins resonate with the contemporary trend of authenticity and human connection, making it a versatile choice for projects seeking a touch of warmth and personality.",
    "technical_characteristics": [
      "Irregular letterforms",
      "Varying stroke weights",
      "Playful ascenders and descenders",
      "Generous x-height",
      "Open counters",
      "Consistent baseline",
      "Well-defined letterforms"
    ],
    "personality_traits": [
      "Casual",
      "Approachable",
      "Spontaneous",
      "Warm",
      "Friendly",
      "Playful",
      "Authentic"
    ],
    "practical_contexts": [
      "Branding",
      "Social media",
      "Short-form editorial",
      "Digital interfaces",
      "Print materials"
    ],
    "cultural_intuition": [
      "Evokes a sense of personal connection",
      "Reflects the trend of authenticity",
      "Suggests a friendly and approachable brand personality",
      "Resembles everyday handwriting",
      "Captures the spirit of casual communication"
    ],
    "search_keywords": [
      "Handwritten",
      "Casual",
      "Informal",
      "Playful",
      "Approachable",
      "Warm",
      "Friendly",
      "Authentic",
      "Legible",
      "Versatile",
      "Branding",
      "Social media",
      "Editorial",
      "Digital",
      "Print",
      "Typefaces",
      "Fonts",
      "Script",
      "Hand lettering"
    ]
  }
}