{
  "filename": "handy_andy_36px.png",
  "status": "success",
  "description": {
    "detailed_description": "Handy Andy is a playful sans-serif typeface that combines a rounded, friendly aesthetic with a touch of vintage charm. The letterforms are constructed with a mix of geometric and organic elements, resulting in a unique visual balance. The rounded terminals and open counters contribute to a sense of approachability, while the slightly condensed proportions and subtle variations in stroke weight add a touch of personality. The overall effect is a font that feels both familiar and distinctive, suitable for a wide range of applications, from children's books and branding to website design and social media graphics. Its nostalgic feel evokes a sense of warmth and playfulness, reminiscent of hand-drawn lettering from a bygone era. However, its clean lines and modern construction ensure that it remains relevant in contemporary design contexts.",
    "technical_characteristics": [
      "rounded terminals",
      "open counters",
      "slightly condensed proportions",
      "variable stroke weight",
      "geometric and organic construction"
    ],
    "personality_traits": [
      "playful",
      "approachable",
      "friendly",
      "nostalgic",
      "distinctive"
    ],
    "practical_contexts": [
      "children's books",
      "branding",
      "website design",
      "social media graphics",
      "display typography"
    ],
    "cultural_intuition": [
      "evokes a sense of warmth and playfulness",
      "reminiscent of hand-drawn lettering",
      "suggests a vintage aesthetic",
      "feels both familiar and distinctive",
      "remains relevant in contemporary design contexts"
    ],
    "search_keywords": [
      "sans-serif",
      "rounded",
      "playful",
      "friendly",
      "vintage",
      "nostalgic",
      "hand-drawn",
      "children's",
      "branding",
      "website",
      "social media",
      "display",
      "legible",
      "approachable",
      "distinctive",
      "geometric",
      "organic",
      "condensed",
      "variable stroke weight",
      "open counters",
      "rounded terminals"
    ]
  }
}