{
  "filename": "handy_mode_36px.png",
  "status": "success",
  "description": {
    "detailed_description": "This font, with its bold, rounded forms and playful curves, embodies a sense of approachable friendliness. The generous x-height and open counters ensure excellent legibility, even at smaller sizes, making it ideal for headlines and display applications. The slightly uneven stroke weights and rounded terminals add a touch of hand-drawn charm, suggesting a casual, informal tone. While the overall construction is geometric, the subtle variations in letterforms and the playful use of negative space create a sense of warmth and personality. This font evokes a sense of nostalgia, reminiscent of vintage signage and playful illustrations, yet it feels fresh and contemporary, suitable for branding, social media graphics, and even children's books. Its playful nature and strong legibility make it a versatile choice for projects that require a friendly and engaging visual identity.",
    "technical_characteristics": [
      "Rounded terminals",
      "Geometric construction",
      "Generous x-height",
      "Open counters",
      "Uneven stroke weights",
      "Playful use of negative space"
    ],
    "personality_traits": [
      "Approachable",
      "Friendly",
      "Playful",
      "Casual",
      "Informal",
      "Nostalgic",
      "Warm",
      "Engaging"
    ],
    "practical_contexts": [
      "Headlines",
      "Display typography",
      "Branding",
      "Social media graphics",
      "Children's books",
      "Signage"
    ],
    "cultural_intuition": [
      "Vintage signage",
      "Playful illustrations",
      "Modern nostalgia",
      "Digital-native design",
      "Casual communication"
    ],
    "search_keywords": [
      "Rounded",
      "Geometric",
      "Playful",
      "Friendly",
      "Casual",
      "Nostalgic",
      "Display",
      "Headline",
      "Branding",
      "Social media",
      "Children's",
      "Vintage",
      "Modern",
      "Legible",
      "Bold",
      "Informal",
      "Hand-drawn",
      "Graphic",
      "Sign",
      "Illustration"
    ]
  }
}