{
  "filename": "hand_power_36px.png",
  "status": "success",
  "description": {
    "detailed_description": "Hand Power is a playful yet legible sans-serif typeface that evokes a sense of handwritten informality. Its rounded letterforms and slightly irregular stroke widths create a casual, approachable feel, reminiscent of a friendly handwritten note. The font's generous x-height and open counters ensure readability even at smaller sizes, making it suitable for both digital and print applications. While the overall design is relaxed, the consistent letterforms and well-defined terminals maintain a sense of professionalism, making it appropriate for a range of projects from branding and packaging to social media and web design. The font's playful nature suggests a sense of approachability and warmth, while its legibility and versatility make it a reliable choice for conveying a friendly and engaging message.",
    "technical_characteristics": [
      "Rounded letterforms",
      "Slightly irregular stroke widths",
      "Generous x-height",
      "Open counters",
      "Well-defined terminals",
      "Consistent letterforms"
    ],
    "personality_traits": [
      "Playful",
      "Approachable",
      "Casual",
      "Friendly",
      "Legible",
      "Versatile",
      "Warm"
    ],
    "practical_contexts": [
      "Branding and packaging",
      "Social media graphics",
      "Web design",
      "Print publications",
      "Handwritten-style signage"
    ],
    "cultural_intuition": [
      "Evokes a sense of handwritten informality",
      "Suggests a friendly and engaging message",
      "Reflects a contemporary trend towards casual and approachable design",
      "Appeals to a wide audience seeking a relatable and approachable aesthetic"
    ],
    "search_keywords": [
      "Sans-serif",
      "Rounded",
      "Playful",
      "Handwritten",
      "Informal",
      "Legible",
      "Approachable",
      "Friendly",
      "Versatile",
      "Branding",
      "Packaging",
      "Social media",
      "Web design",
      "Print",
      "Casual",
      "Modern",
      "Contemporary",
      "Digital",
      "Hand-drawn",
      "Script",
      "Informal",
      "Friendly",
      "Warm",
      "Approachable",
      "Relatable"
    ]
  }
}