{
  "filename": "hand_of_henry_36px.png",
  "status": "success",
  "description": {
    "detailed_description": "Hand of Henry is a playful script font that captures the energy of handwritten lettering. Its rounded forms and fluid strokes create a sense of movement and informality, reminiscent of a casual note or a personal message. The font's irregular baseline and varying letter widths contribute to its hand-drawn aesthetic, while the consistent stroke weight and clear articulation ensure legibility. This combination of spontaneity and readability makes it suitable for a range of applications, from casual branding and social media graphics to playful headlines and handwritten-style quotes. The font's informal character evokes a sense of warmth and approachability, suggesting a friendly and approachable personality. Its contemporary relevance lies in its ability to capture the authenticity and immediacy of digital communication, while its cultural associations connect it to the DIY aesthetic and the rise of personalized expression.",
    "technical_characteristics": [
      "Rounded forms",
      "Fluid strokes",
      "Irregular baseline",
      "Varying letter widths",
      "Consistent stroke weight",
      "Clear articulation"
    ],
    "personality_traits": [
      "Playful",
      "Informal",
      "Handwritten",
      "Friendly",
      "Approachable",
      "Authentic",
      "Immediate"
    ],
    "practical_contexts": [
      "Casual branding",
      "Social media graphics",
      "Playful headlines",
      "Handwritten-style quotes",
      "Digital communication"
    ],
    "cultural_intuition": [
      "DIY aesthetic",
      "Personalized expression",
      "Authenticity",
      "Immediacy",
      "Digital communication"
    ],
    "search_keywords": [
      "Script font",
      "Handwritten",
      "Playful",
      "Informal",
      "Rounded forms",
      "Fluid strokes",
      "Irregular baseline",
      "Varying letter widths",
      "Consistent stroke weight",
      "Clear articulation",
      "Casual branding",
      "Social media graphics",
      "Playful headlines",
      "Handwritten-style quotes",
      "Digital communication",
      "DIY aesthetic",
      "Personalized expression",
      "Authenticity",
      "Immediacy"
    ]
  }
}