{
  "filename": "happy_time_36px.png",
  "status": "success",
  "description": {
    "detailed_description": "Happy Time is a playful yet legible script font that blends classic calligraphic influences with a contemporary digital sensibility. Its flowing strokes and graceful curves evoke a sense of handwritten elegance, while the consistent weight and well-defined terminals ensure readability even at smaller sizes. The font's generous x-height and open counters contribute to its legibility, making it suitable for both display and body text applications. The overall character is friendly and approachable, suggesting a sense of warmth and optimism. Its contemporary relevance lies in its versatility, making it suitable for a wide range of projects, from branding and packaging to website design and social media graphics. The font's cultural associations evoke a sense of nostalgia for handwritten notes and personal expression, while also reflecting the modern trend towards authenticity and human connection.",
    "technical_characteristics": [
      "flowing strokes",
      "graceful curves",
      "consistent weight",
      "well-defined terminals",
      "generous x-height",
      "open counters"
    ],
    "personality_traits": [
      "playful",
      "legible",
      "elegant",
      "friendly",
      "approachable",
      "optimistic",
      "versatile"
    ],
    "practical_contexts": [
      "branding and packaging",
      "website design",
      "social media graphics",
      "display text",
      "body text"
    ],
    "cultural_intuition": [
      "nostalgia for handwritten notes",
      "personal expression",
      "authenticity",
      "human connection",
      "modern trend towards handwritten aesthetics"
    ],
    "search_keywords": [
      "script font",
      "calligraphic",
      "playful",
      "legible",
      "versatile",
      "display font",
      "body font",
      "branding",
      "packaging",
      "website design",
      "social media",
      "handwritten",
      "elegant",
      "optimistic",
      "nostalgia",
      "authenticity",
      "human connection",
      "contemporary",
      "digital"
    ]
  }
}