{
  "filename": "happy_hell_36px.png",
  "status": "success",
  "description": {
    "detailed_description": "Happy Hell is a bold, playful sans-serif font that combines a geometric construction with rounded terminals and a high x-height. This creates a unique visual tension, balancing a sense of structure with a playful, approachable feel. The font's bold weight and generous letterforms make it highly legible, even at small sizes, while the rounded corners and slightly condensed proportions add a touch of whimsy. This combination of technical precision and playful design makes Happy Hell suitable for a wide range of applications, from headlines and branding to digital interfaces and playful illustrations. Its bold character evokes a sense of fun and energy, making it ideal for projects that require a strong visual presence and a touch of personality. The font's contemporary aesthetic and playful nature suggest a connection to digital culture and a desire for visual impact.",
    "technical_characteristics": [
      "Geometric construction",
      "Rounded terminals",
      "High x-height",
      "Bold weight",
      "Condensed proportions"
    ],
    "personality_traits": [
      "Playful",
      "Bold",
      "Approachable",
      "Energetic",
      "Whimsical"
    ],
    "practical_contexts": [
      "Headlines",
      "Branding",
      "Digital interfaces",
      "Illustrations",
      "Playful designs"
    ],
    "cultural_intuition": [
      "Digital-native design",
      "Modern aesthetic",
      "Playful personality",
      "Visual impact",
      "Contemporary energy"
    ],
    "search_keywords": [
      "Sans-serif",
      "Bold",
      "Geometric",
      "Rounded",
      "Playful",
      "High x-height",
      "Condensed",
      "Legible",
      "Whimsical",
      "Digital",
      "Modern",
      "Contemporary",
      "Headlines",
      "Branding",
      "Interfaces",
      "Illustrations",
      "Fun",
      "Energy",
      "Impact"
    ]
  }
}