{
  "filename": "happy_hero_36px.png",
  "status": "success",
  "description": {
    "detailed_description": "This font embodies a playful, almost cartoonish energy, achieved through exaggerated letterforms and a dynamic, almost bouncy baseline. The rounded, bulbous shapes of the letters, particularly noticeable in the lowercase 'a', 'c', and 'o', create a sense of whimsy and informality. The bold strokes and generous curves contribute to a friendly, approachable feel, while the slight slant adds a touch of movement and energy. The font's overall construction is organic and free-flowing, with a distinct lack of geometric precision, further emphasizing its playful nature. This font is well-suited for headlines, logos, and playful branding, where its energetic personality can inject a dose of fun and personality. It's particularly effective in digital contexts, where its bold forms and dynamic nature translate well to screen displays. The font's playful energy evokes a sense of childhood nostalgia, reminiscent of comic books and cartoons, while also feeling contemporary and relevant in its use of bold, expressive forms.",
    "technical_characteristics": [
      "Rounded letterforms",
      "Exaggerated proportions",
      "Dynamic baseline",
      "Bold strokes",
      "Organic construction"
    ],
    "personality_traits": [
      "Playful",
      "Whimsical",
      "Energetic",
      "Friendly",
      "Approachable"
    ],
    "practical_contexts": [
      "Headlines",
      "Logos",
      "Playful branding",
      "Digital interfaces",
      "Children's media"
    ],
    "cultural_intuition": [
      "Childhood nostalgia",
      "Comic book aesthetic",
      "Cartoonish energy",
      "Modern digital design",
      "Informal and approachable"
    ],
    "search_keywords": [
      "Rounded",
      "Bold",
      "Playful",
      "Cartoon",
      "Whimsical",
      "Dynamic",
      "Energetic",
      "Informal",
      "Headlines",
      "Logos",
      "Branding",
      "Digital",
      "Children's",
      "Nostalgia",
      "Comic",
      "Contemporary"
    ]
  }
}