{
  "filename": "happy_hand_36px.png",
  "status": "success",
  "description": {
    "detailed_description": "Happy Hand is a playful script font that captures the essence of casual handwriting. Its irregular letterforms, varying stroke weights, and expressive flourishes create a sense of spontaneity and warmth. The font's organic nature is evident in the uneven baseline and the subtle variations in letter spacing, adding to its hand-drawn charm. While the overall impression is lighthearted, the font's legibility remains strong due to its clear letterforms and generous counter spaces. Happy Hand is well-suited for informal applications, such as social media graphics, handwritten notes, and playful branding. Its whimsical character evokes a sense of personal connection and authenticity, making it ideal for projects that aim to convey warmth and approachability.",
    "technical_characteristics": [
      "Irregular letterforms",
      "Varying stroke weights",
      "Expressive flourishes",
      "Uneven baseline",
      "Generous counter spaces"
    ],
    "personality_traits": [
      "Playful",
      "Spontaneous",
      "Warm",
      "Whimsical",
      "Authentic"
    ],
    "practical_contexts": [
      "Social media graphics",
      "Handwritten notes",
      "Playful branding",
      "Informal signage",
      "Short text blocks"
    ],
    "cultural_intuition": [
      "Evokes a sense of personal connection",
      "Suggests a casual and friendly tone",
      "Reflects the informality of digital communication",
      "Captures the spirit of handwritten expression",
      "Appeals to a contemporary audience seeking authenticity"
    ],
    "search_keywords": [
      "Script font",
      "Handwritten",
      "Playful",
      "Casual",
      "Warm",
      "Whimsical",
      "Informal",
      "Social media",
      "Branding",
      "Hand-drawn",
      "Authentic",
      "Legible",
      "Expressive",
      "Irregular",
      "Varying stroke weights",
      "Flourishes",
      "Uneven baseline",
      "Generous counter spaces",
      "Digital",
      "Contemporary"
    ]
  }
}