{
  "filename": "hard_talk_36px.png",
  "status": "success",
  "description": {
    "detailed_description": "This font is a playful and expressive collection of hand-drawn pictograms, each one a unique and instantly recognizable symbol. The glyphs are characterized by their bold, black outlines and simplified, almost cartoonish forms. The lack of serifs and the use of rounded corners contribute to a sense of informality and approachability. The font's overall character is one of lightheartedness and humor, with a touch of irreverence. It evokes a sense of childhood nostalgia, reminiscent of doodles and scribbles found in notebooks and on classroom walls. The font's simplicity and directness make it ideal for informal communication, particularly in digital contexts. It could be used effectively for social media graphics, website elements, or even playful branding for products aimed at a younger audience. The font's cultural resonance lies in its connection to the DIY aesthetic and the spirit of creative expression that often accompanies it. It suggests a sense of individuality and a willingness to embrace imperfection, making it a fitting choice for projects that celebrate authenticity and originality.",
    "technical_characteristics": [
      "hand-drawn style",
      "bold black outlines",
      "simplified forms",
      "rounded corners",
      "lack of serifs",
      "consistent stroke weight",
      "informal proportions"
    ],
    "personality_traits": [
      "playful",
      "expressive",
      "informal",
      "approachable",
      "lighthearted",
      "humorous",
      "irreverent",
      "nostalgic",
      "authentic",
      "original"
    ],
    "practical_contexts": [
      "social media graphics",
      "website elements",
      "informal branding",
      "digital illustrations",
      "children's products"
    ],
    "cultural_intuition": [
      "DIY aesthetic",
      "creative expression",
      "childhood nostalgia",
      "individuality",
      "authenticity"
    ],
    "search_keywords": [
      "hand-drawn",
      "pictograms",
      "symbols",
      "bold",
      "black outlines",
      "simplified",
      "rounded corners",
      "informal",
      "playful",
      "expressive",
      "nostalgic",
      "digital",
      "social media",
      "website",
      "branding",
      "children's",
      "DIY",
      "creative",
      "authentic"
    ]
  }
}