{
  "filename": "hasty_grass_vl_36px.png",
  "status": "success",
  "description": {
    "detailed_description": "This font, with its playful, handwritten aesthetic, embodies a casual and approachable personality. The letterforms are characterized by a combination of rounded and angular strokes, creating a dynamic and energetic feel. The ascenders and descenders are exaggerated, adding to the overall sense of movement and informality. The font's irregular baseline and inconsistent letter spacing contribute to its hand-drawn charm, making it feel authentic and personal. While the font's technical execution is intentionally imperfect, it maintains a high level of legibility, ensuring readability even in smaller sizes. This makes it suitable for a wide range of applications, from social media graphics and website headers to handwritten notes and personal branding. The font's casual and friendly nature evokes a sense of warmth and approachability, making it ideal for projects that aim to connect with audiences on a personal level. Its contemporary relevance lies in its ability to capture the spirit of digital communication, where authenticity and personality are highly valued.",
    "technical_characteristics": [
      "Handwritten aesthetic",
      "Rounded and angular strokes",
      "Exaggerated ascenders and descenders",
      "Irregular baseline",
      "Inconsistent letter spacing",
      "Intentional imperfections",
      "High legibility"
    ],
    "personality_traits": [
      "Playful",
      "Approachable",
      "Casual",
      "Energetic",
      "Authentic",
      "Personal",
      "Friendly"
    ],
    "practical_contexts": [
      "Social media graphics",
      "Website headers",
      "Handwritten notes",
      "Personal branding",
      "Informal communications"
    ],
    "cultural_intuition": [
      "Captures the spirit of digital communication",
      "Evokes a sense of warmth and approachability",
      "Reflects the value of authenticity and personality"
    ],
    "search_keywords": [
      "Handwritten",
      "Script",
      "Casual",
      "Playful",
      "Informal",
      "Social media",
      "Website",
      "Branding",
      "Personal",
      "Approachable",
      "Friendly",
      "Authentic",
      "Energetic",
      "Dynamic",
      "Legible",
      "Readable",
      "Digital",
      "Contemporary"
    ]
  }
}