{
  "filename": "haunted_36px.png",
  "status": "success",
  "description": {
    "detailed_description": "This font, with its bold, blackletter-inspired forms, exudes a strong sense of gothic drama. The letters are tightly packed within square frames, creating a sense of confinement and intensity. The sharp, angular strokes and pointed terminals contribute to the font's aggressive and imposing character. The overall design evokes a sense of medieval mystery and intrigue, with a touch of modern edge. The font's bold weight and high contrast make it highly legible, even at small sizes, making it suitable for headlines, logos, and other display applications. However, its strong personality might not be appropriate for large blocks of text, as it could overwhelm the reader. The font's gothic aesthetic suggests a connection to dark fantasy, horror, and occult themes, making it ideal for projects that seek to evoke a sense of mystery, danger, or rebellion.",
    "technical_characteristics": [
      "Blackletter-inspired forms",
      "Square frames",
      "Sharp, angular strokes",
      "Pointed terminals",
      "High contrast",
      "Bold weight"
    ],
    "personality_traits": [
      "Intense",
      "Aggressive",
      "Imposing",
      "Mysterious",
      "Intriguing",
      "Gothic",
      "Dramatic"
    ],
    "practical_contexts": [
      "Headlines",
      "Logos",
      "Display typography",
      "Posters",
      "Packaging"
    ],
    "cultural_intuition": [
      "Medieval mystery",
      "Dark fantasy",
      "Horror",
      "Occult",
      "Rebellion"
    ],
    "search_keywords": [
      "Blackletter",
      "Gothic",
      "Bold",
      "Square",
      "Sharp",
      "Angular",
      "Pointed",
      "High contrast",
      "Intense",
      "Dramatic",
      "Mysterious",
      "Intriguing",
      "Headlines",
      "Logos",
      "Display",
      "Fantasy",
      "Horror",
      "Occult",
      "Rebellion"
    ]
  }
}