{
  "filename": "havlova_austral_36px.png",
  "status": "success",
  "description": {
    "detailed_description": "Hardlove Austral is a flowing script typeface that captures the elegance of traditional calligraphy while maintaining a contemporary feel. Its fluid strokes and graceful curves are reminiscent of handwritten script, but the carefully balanced proportions and consistent letterforms ensure legibility even at smaller sizes. The font's distinctive features include its generous x-height, which provides ample space for the flowing strokes, and its subtle variations in stroke weight, adding a touch of dynamism to the overall design. The overall effect is one of effortless sophistication, making it suitable for a wide range of applications, from elegant invitations and branding to website headers and social media graphics. The font's inherent charm and versatility make it a perfect choice for projects that require a touch of personality and a sense of handwritten authenticity.",
    "technical_characteristics": [
      "flowing script",
      "generous x-height",
      "consistent letterforms",
      "subtle stroke weight variations",
      "graceful curves",
      "fluid strokes",
      "balanced proportions"
    ],
    "personality_traits": [
      "effortlessly sophisticated",
      "elegant",
      "graceful",
      "dynamic",
      "versatile",
      "charming",
      "handwritten authenticity"
    ],
    "practical_contexts": [
      "elegant invitations",
      "branding",
      "website headers",
      "social media graphics",
      "display typography"
    ],
    "cultural_intuition": [
      "evokes a sense of handwritten authenticity",
      "suggests a touch of personality",
      "captures the elegance of traditional calligraphy",
      "maintains a contemporary feel",
      "ideal for projects that require a touch of sophistication"
    ],
    "search_keywords": [
      "script typeface",
      "flowing script",
      "handwritten",
      "calligraphy",
      "elegant",
      "graceful",
      "sophisticated",
      "versatile",
      "display typography",
      "branding",
      "invitations",
      "website headers",
      "social media",
      "contemporary",
      "traditional",
      "authenticity",
      "personality",
      "legibility",
      "x-height",
      "stroke weight",
      "proportions",
      "curves",
      "fluid",
      "balanced"
    ]
  }
}