{
  "filename": "headline_text_36px.png",
  "status": "success",
  "description": {
    "detailed_description": "This font is a bold and dramatic blackletter, drawing inspiration from medieval manuscripts while retaining a contemporary edge. Its sharp, angular strokes and pronounced serifs create a strong visual impact, reminiscent of gothic architecture and calligraphy. The tall ascenders and descenders add to its grandeur, while the open counters ensure legibility even at smaller sizes. The font's overall character is both authoritative and elegant, suggesting a sense of history and tradition. Its bold presence makes it ideal for headlines, titles, and branding elements where a strong visual statement is desired. However, its intricate details and complex letterforms may limit its use in extended body text, especially at smaller sizes. The font's cultural associations range from medieval chivalry and gothic literature to modern counterculture and punk aesthetics, making it a versatile choice for projects that seek to evoke a sense of power, mystery, or rebellion.",
    "technical_characteristics": [
      "Blackletter style",
      "Sharp, angular strokes",
      "Pronounced serifs",
      "Tall ascenders and descenders",
      "Open counters",
      "High contrast between thick and thin strokes",
      "Intricate letterforms"
    ],
    "personality_traits": [
      "Authoritative",
      "Dramatic",
      "Elegant",
      "Bold",
      "Intricate",
      "Powerful",
      "Mysterious"
    ],
    "practical_contexts": [
      "Headlines",
      "Titles",
      "Branding elements",
      "Logos",
      "Posters",
      "Short text blocks"
    ],
    "cultural_intuition": [
      "Medieval manuscripts",
      "Gothic architecture",
      "Chivalry",
      "Gothic literature",
      "Counterculture",
      "Punk aesthetics"
    ],
    "search_keywords": [
      "Blackletter",
      "Gothic",
      "Medieval",
      "Script",
      "Bold",
      "Dramatic",
      "Elegant",
      "Intricate",
      "Authoritative",
      "Powerful",
      "Mysterious",
      "Headline",
      "Title",
      "Branding",
      "Logo",
      "Poster",
      "Counterculture",
      "Punk",
      "History",
      "Tradition"
    ]
  }
}