{
  "filename": "heavy_bevel_36px.png",
  "status": "success",
  "description": {
    "detailed_description": "This font, aptly named \"Heavy Bevel\", is a bold statement in typography. Its defining characteristic is the pronounced bevel effect applied to each letterform, creating a three-dimensional illusion. This is achieved through a series of parallel lines outlining the letter, with the inner lines offset to create a sense of depth. The construction is geometric, with sharp corners and consistent line weights, lending a sense of rigidity and structure. The high x-height and open counters ensure strong legibility, even at smaller sizes. The overall character is assertive and commanding, evoking a sense of power and authority. It draws inspiration from the bold, geometric styles of the early 20th century, particularly Art Deco, but with a distinctly digital edge. This font is well-suited for headlines, logos, and other applications where a strong visual impact is desired. Its bold presence and retro-futuristic aesthetic make it ideal for projects that aim to convey a sense of innovation, technology, or even a touch of retro-cool. However, its heavy weight and intricate details may limit its use in extended text blocks, especially at smaller sizes.",
    "technical_characteristics": [
      "Bevel effect",
      "Geometric construction",
      "Sharp corners",
      "Consistent line weights",
      "High x-height",
      "Open counters"
    ],
    "personality_traits": [
      "Assertive",
      "Commanding",
      "Bold",
      "Geometric",
      "Structured",
      "Retro-futuristic",
      "Digital",
      "Powerful",
      "Authoritative"
    ],
    "practical_contexts": [
      "Headlines",
      "Logos",
      "Branding",
      "Posters",
      "Digital interfaces",
      "Short text blocks"
    ],
    "cultural_intuition": [
      "Art Deco influence",
      "Digital aesthetic",
      "Retro-futuristic",
      "Innovation",
      "Technology",
      "Power",
      "Authority"
    ],
    "search_keywords": [
      "Bevel",
      "Geometric",
      "Bold",
      "Heavy",
      "Retro",
      "Futuristic",
      "Digital",
      "Art Deco",
      "Headline",
      "Logo",
      "Branding",
      "Poster",
      "Interface",
      "Strong",
      "Assertive",
      "Commanding",
      "Power",
      "Authority",
      "Legibility",
      "High x-height",
      "Open counters",
      "Sharp corners",
      "Consistent line weights"
    ]
  }
}