{
  "filename": "hein_writing_36px.png",
  "status": "success",
  "description": {
    "detailed_description": "Hein Writing is a playful script font that captures the energy of handwritten text. Its rounded forms and irregular strokes create a sense of casual informality, reminiscent of a quick note scribbled on paper. The font's generous x-height and open counters ensure good legibility, even at smaller sizes, making it suitable for both display and body text. The slightly uneven baseline adds to its hand-drawn charm, while the consistent weight and smooth curves contribute to its overall readability. Hein Writing's personality is both friendly and approachable, suggesting a sense of warmth and authenticity. It evokes a nostalgic feeling of handwritten communication, reminiscent of personal letters and childhood doodles. This makes it ideal for projects that require a touch of personality and a connection to human expression. Its versatility allows it to be used in a wide range of applications, from branding and packaging to social media graphics and website design. However, its informal nature might not be suitable for formal documents or corporate communications.",
    "technical_characteristics": [
      "Rounded forms",
      "Irregular strokes",
      "Generous x-height",
      "Open counters",
      "Uneven baseline",
      "Consistent weight",
      "Smooth curves"
    ],
    "personality_traits": [
      "Playful",
      "Casual",
      "Informal",
      "Friendly",
      "Approachable",
      "Warm",
      "Authentic"
    ],
    "practical_contexts": [
      "Branding and packaging",
      "Social media graphics",
      "Website design",
      "Display text",
      "Body text"
    ],
    "cultural_intuition": [
      "Nostalgic feeling of handwritten communication",
      "Reminiscent of personal letters and childhood doodles",
      "Suggests a sense of warmth and authenticity",
      "Connects to human expression"
    ],
    "search_keywords": [
      "Script font",
      "Handwritten",
      "Playful",
      "Casual",
      "Informal",
      "Rounded forms",
      "Irregular strokes",
      "Generous x-height",
      "Open counters",
      "Uneven baseline",
      "Consistent weight",
      "Smooth curves",
      "Friendly",
      "Approachable",
      "Warm",
      "Authentic",
      "Nostalgic",
      "Branding",
      "Packaging",
      "Social media",
      "Website design",
      "Display text",
      "Body text"
    ]
  }
}