{
  "filename": "hello_vintage_36px.png",
  "status": "success",
  "description": {
    "detailed_description": "Hello Vintage is a script typeface that captures the essence of classic handwritten lettering with a contemporary twist. Its flowing strokes and dynamic curves evoke a sense of casual elegance, reminiscent of vintage signage and handwritten notes. The font's construction is characterized by a combination of organic and geometric elements, creating a balance between natural fluidity and controlled structure. The letterforms are designed with a slight slant, adding a touch of movement and dynamism to the overall composition. The generous x-height and open counters ensure excellent legibility, even at smaller sizes, making it suitable for a wide range of applications. The font's playful personality and nostalgic charm make it ideal for branding projects, packaging designs, and social media graphics that aim to convey a sense of warmth, authenticity, and approachability. Its versatility allows it to be used effectively in both digital and print media, adding a touch of personality and visual interest to any project.",
    "technical_characteristics": [
      "flowing strokes",
      "dynamic curves",
      "slight slant",
      "generous x-height",
      "open counters",
      "organic and geometric construction",
      "casual elegance"
    ],
    "personality_traits": [
      "playful",
      "nostalgic",
      "approachable",
      "warm",
      "authentic",
      "dynamic",
      "elegant"
    ],
    "practical_contexts": [
      "branding projects",
      "packaging designs",
      "social media graphics",
      "handwritten notes",
      "vintage signage"
    ],
    "cultural_intuition": [
      "evokes a sense of nostalgia",
      "reminiscent of vintage signage",
      "suggests a casual and approachable tone",
      "captures the spirit of handwritten communication",
      "reflects a contemporary appreciation for classic design"
    ],
    "search_keywords": [
      "script typeface",
      "handwritten lettering",
      "vintage",
      "nostalgic",
      "playful",
      "elegant",
      "approachable",
      "dynamic",
      "flowing strokes",
      "generous x-height",
      "open counters",
      "branding",
      "packaging",
      "social media",
      "digital",
      "print",
      "casual",
      "authentic",
      "contemporary",
      "classic"
    ]
  }
}