{
  "filename": "hello_cleo_petra_36px.png",
  "status": "success",
  "description": {
    "detailed_description": "This font is a captivating visual representation of ancient Egyptian hieroglyphs, offering a unique blend of historical authenticity and artistic interpretation. Each glyph is meticulously crafted, capturing the essence of its original form while maintaining a contemporary aesthetic. The font's bold, graphic nature is evident in the strong, angular lines and the use of negative space, creating a sense of power and mystery. The glyphs are composed of a variety of elements, including human figures, animals, objects, and abstract symbols, each with its own distinct meaning and visual impact. The font's intricate details, such as the subtle curves of the human figures and the delicate lines of the hieroglyphic symbols, add a layer of complexity and sophistication. The font's overall character is both ancient and modern, evoking a sense of timelessness and cultural significance. It is a powerful tool for conveying a sense of history, mystery, and the enduring power of ancient civilizations. Its bold, graphic nature makes it suitable for a variety of applications, from branding and packaging to editorial design and digital interfaces. The font's unique character and historical significance make it a compelling choice for projects that seek to evoke a sense of mystery, power, and cultural heritage.",
    "technical_characteristics": [
      "Pictographic glyphs",
      "Geometric construction",
      "Strong, angular lines",
      "Bold, graphic style",
      "Intricate details",
      "Negative space usage",
      "Consistent stroke weight"
    ],
    "personality_traits": [
      "Ancient and modern",
      "Powerful and mysterious",
      "Intricate and sophisticated",
      "Bold and graphic",
      "Timeless and culturally significant"
    ],
    "practical_contexts": [
      "Branding and packaging",
      "Editorial design",
      "Digital interfaces",
      "Historical and cultural projects",
      "Art and illustration"
    ],
    "cultural_intuition": [
      "Ancient Egyptian civilization",
      "Mystery and power",
      "Cultural heritage",
      "Timelessness",
      "Historical significance"
    ],
    "search_keywords": [
      "hieroglyphs",
      "ancient egypt",
      "pictographic",
      "graphic",
      "bold",
      "intricate",
      "historical",
      "cultural",
      "timeless",
      "powerful",
      "mystery",
      "branding",
      "packaging",
      "editorial",
      "digital",
      "art",
      "illustration",
      "font",
      "typeface",
      "design",
      "visual",
      "aesthetic",
      "contemporary",
      "authenticity",
      "negative space",
      "stroke weight",
      "glyphs",
      "symbols",
      "figures",
      "objects",
      "abstract",
      "meaning",
      "impact",
      "sophistication",
      "character",
      "heritage"
    ]
  }
}