{
  "filename": "helter_skater_36px.png",
  "status": "success",
  "description": {
    "detailed_description": "Helter Skelter is a display typeface that embodies a playful, almost childlike energy. Its construction is based on simple, rounded forms with a distinct hand-drawn quality. The letters are generously proportioned, with a high x-height and open counters that contribute to its friendly and approachable feel. The defining characteristic of the font is its textured outline, reminiscent of a rough sketch or a hand-drawn doodle. This texture adds a sense of whimsy and informality, making it ideal for projects that require a lighthearted and engaging tone. While the font's overall structure is relatively simple, the irregular outlines and slight variations in letterforms create a sense of personality and charm. The font's playful nature makes it well-suited for projects targeting younger audiences, such as children's books, branding for playful products, or social media graphics. However, its hand-drawn aesthetic also lends itself to more mature applications, particularly when used in a limited way for emphasis or to add a touch of personality to a design. The font's cultural resonance lies in its connection to the DIY aesthetic and the resurgence of hand-drawn typography. It evokes a sense of creativity and individuality, reflecting the contemporary trend of embracing imperfection and authenticity.",
    "technical_characteristics": [
      "Hand-drawn aesthetic",
      "Rounded letterforms",
      "High x-height",
      "Open counters",
      "Textured outline"
    ],
    "personality_traits": [
      "Playful",
      "Whimsical",
      "Informal",
      "Approachable",
      "Charming"
    ],
    "practical_contexts": [
      "Children's books",
      "Branding for playful products",
      "Social media graphics",
      "Headlines and titles",
      "Limited use for emphasis"
    ],
    "cultural_intuition": [
      "DIY aesthetic",
      "Hand-drawn typography",
      "Creativity and individuality",
      "Authenticity",
      "Contemporary design trends"
    ],
    "search_keywords": [
      "Display typeface",
      "Hand-drawn",
      "Rounded",
      "Playful",
      "Whimsical",
      "Informal",
      "Children's",
      "Branding",
      "Social media",
      "Headlines",
      "Titles",
      "Emphasis",
      "DIY",
      "Authenticity",
      "Contemporary"
    ]
  }
}