{
  "filename": "herr_36px.png",
  "status": "success",
  "description": {
    "detailed_description": "This font is a playful and expressive take on the classic serif typeface. Each letterform is constructed as a stylized human face, with the serifs forming the nose and chin, the bowl of the letter forming the head, and the stem forming the neck. The exaggerated features and slightly distorted proportions create a sense of whimsy and personality, while the overall structure remains legible and functional. The font's bold strokes and contrasting weights add to its visual impact, making it suitable for headlines and display applications. The font's playful nature evokes a sense of fun and lightheartedness, making it ideal for projects that require a touch of personality and charm. It could be used for children's books, branding for creative businesses, or even as a decorative element in web design.",
    "technical_characteristics": [
      "Stylized human face letterforms",
      "Exaggerated features",
      "Distorted proportions",
      "Bold strokes",
      "Contrasting weights"
    ],
    "personality_traits": [
      "Playful",
      "Expressive",
      "Whimsical",
      "Charming",
      "Bold"
    ],
    "practical_contexts": [
      "Headlines",
      "Display applications",
      "Children's books",
      "Branding for creative businesses",
      "Decorative element in web design"
    ],
    "cultural_intuition": [
      "Evokes a sense of fun and lightheartedness",
      "Suggests a playful and creative spirit",
      "Reflects a contemporary appreciation for unique and expressive typography"
    ],
    "search_keywords": [
      "serif",
      "human face",
      "playful",
      "expressive",
      "whimsical",
      "bold",
      "contrasting weights",
      "headlines",
      "display",
      "children's books",
      "branding",
      "web design",
      "decorative",
      "unique",
      "expressive typography"
    ]
  }
}