{
  "filename": "hi_baby_36px.png",
  "status": "success",
  "description": {
    "detailed_description": "Hi Baby is a script typeface that embodies a playful and charming aesthetic. Its flowing strokes and delicate curves evoke a sense of handwritten elegance, reminiscent of traditional calligraphy. The font's generous x-height and open counters ensure good legibility, even at smaller sizes, making it suitable for a range of applications. The subtle variations in stroke weight and the graceful ascenders and descenders add a touch of personality and visual interest. Hi Baby's overall character is lighthearted and approachable, making it ideal for projects that require a touch of whimsy and charm. Its versatility allows it to be used for everything from wedding invitations and greeting cards to social media graphics and branding elements. The font's cultural associations lean towards a sense of nostalgia and romanticism, evoking a sense of warmth and familiarity. Its contemporary relevance lies in its ability to add a touch of handcrafted authenticity to digital designs, offering a counterpoint to the often sterile and impersonal nature of digital typography.",
    "technical_characteristics": [
      "flowing strokes",
      "delicate curves",
      "generous x-height",
      "open counters",
      "subtle stroke weight variations",
      "graceful ascenders and descenders"
    ],
    "personality_traits": [
      "playful",
      "charming",
      "elegant",
      "lighthearted",
      "approachable",
      "whimsical"
    ],
    "practical_contexts": [
      "wedding invitations",
      "greeting cards",
      "social media graphics",
      "branding elements",
      "handwritten-style text"
    ],
    "cultural_intuition": [
      "nostalgia",
      "romanticism",
      "warmth",
      "familiarity",
      "handcrafted authenticity"
    ],
    "search_keywords": [
      "script",
      "handwritten",
      "calligraphy",
      "playful",
      "charming",
      "elegant",
      "whimsical",
      "wedding",
      "greeting card",
      "social media",
      "branding",
      "nostalgia",
      "romanticism",
      "handcrafted",
      "authenticity",
      "versatile",
      "legible",
      "open counters",
      "generous x-height",
      "flowing strokes",
      "delicate curves",
      "subtle stroke weight variations",
      "graceful ascenders and descenders"
    ]
  }
}