{
  "filename": "hiatus_36px.png",
  "status": "success",
  "description": {
    "detailed_description": "Hiatus is a bold, expressive script font that captures the energy of hand-lettering while maintaining a level of legibility suitable for digital use. Its construction is characterized by fluid, gestural strokes with varying thicknesses, creating a dynamic and energetic feel. The letterforms are generally rounded, with a slight calligraphic slant, adding a touch of elegance to the overall impression. The font's generous x-height and open counters ensure readability even at smaller sizes, making it suitable for both display and body text applications. Hiatus's personality is both playful and confident, suggesting a sense of creativity and individuality. It evokes a sense of spontaneity and authenticity, reminiscent of handwritten notes or personalized signage. The font's contemporary relevance lies in its ability to convey a sense of authenticity and personality, aligning with current trends in digital design. Its versatility allows it to be used in a wide range of applications, from branding and packaging to social media graphics and website design. Hiatus's cultural associations are rooted in the resurgence of hand-lettering and the appreciation for authentic, handcrafted aesthetics. It embodies a sense of individuality and creativity, resonating with a generation that values self-expression and unique visual identities.",
    "technical_characteristics": [
      "Fluid, gestural strokes",
      "Varying stroke thicknesses",
      "Rounded letterforms",
      "Slight calligraphic slant",
      "Generous x-height",
      "Open counters"
    ],
    "personality_traits": [
      "Bold and expressive",
      "Playful and confident",
      "Spontaneous and authentic",
      "Energetic and dynamic",
      "Creative and individualistic"
    ],
    "practical_contexts": [
      "Branding and packaging",
      "Social media graphics",
      "Website design",
      "Display headlines",
      "Body text in digital applications"
    ],
    "cultural_intuition": [
      "Resurgence of hand-lettering",
      "Appreciation for handcrafted aesthetics",
      "Sense of individuality and creativity",
      "Contemporary digital design trends",
      "Authenticity and self-expression"
    ],
    "search_keywords": [
      "script font",
      "hand-lettering",
      "bold",
      "expressive",
      "dynamic",
      "playful",
      "confident",
      "authentic",
      "legible",
      "versatile",
      "branding",
      "packaging",
      "social media",
      "website design",
      "display",
      "body text",
      "digital",
      "contemporary",
      "handwritten",
      "creative",
      "individualistic",
      "unique",
      "self-expression"
    ]
  }
}