{
  "filename": "high_orbit_36px.png",
  "status": "success",
  "description": {
    "detailed_description": "This font is a bold statement in geometric sans-serif design, drawing inspiration from both classic and contemporary styles. Its construction is based on sharp angles and precise lines, creating a strong, almost architectural presence. The letterforms are highly condensed, with a low x-height and minimal spacing, contributing to a sense of density and power. The bold weight and sharp terminals further enhance this impression, while the consistent stroke width throughout the alphabet ensures a clean and legible appearance. This font's personality is assertive and confident, with a touch of aggression that makes it ideal for projects that demand attention and impact. It evokes a sense of strength and authority, reminiscent of heavy metal album covers or cyberpunk aesthetics. While its bold nature might limit its use in large blocks of text, it excels in headlines, logos, and branding elements where its striking presence can make a powerful statement. Its contemporary relevance lies in its ability to capture the energy and boldness of digital culture, while its historical roots can be traced back to the geometric sans-serif designs of the early 20th century.",
    "technical_characteristics": [
      "Geometric construction",
      "Condensed letterforms",
      "Low x-height",
      "Sharp terminals",
      "Consistent stroke width",
      "Bold weight",
      "Minimal spacing"
    ],
    "personality_traits": [
      "Assertive",
      "Confident",
      "Aggressive",
      "Powerful",
      "Authoritative",
      "Striking",
      "Bold"
    ],
    "practical_contexts": [
      "Headlines",
      "Logos",
      "Branding elements",
      "Posters",
      "Gaming interfaces"
    ],
    "cultural_intuition": [
      "Heavy metal aesthetics",
      "Cyberpunk design",
      "Digital culture",
      "Modernity",
      "Strength and authority"
    ],
    "search_keywords": [
      "Geometric sans-serif",
      "Condensed",
      "Bold",
      "Sharp",
      "Aggressive",
      "Powerful",
      "Heavy metal",
      "Cyberpunk",
      "Digital",
      "Modern",
      "Headlines",
      "Logos",
      "Branding",
      "Posters",
      "Gaming"
    ]
  }
}