{
  "filename": "history_brush_36px.png",
  "status": "success",
  "description": {
    "detailed_description": "History Brush is a display typeface that captures the energy of hand-drawn lettering with a distinct digital edge. Its construction is based on a combination of organic strokes and geometric shapes, creating a unique visual tension. The font's irregular letterforms, with their varying widths and heights, evoke a sense of spontaneity and individuality. The bold strokes and sharp terminals add a touch of aggression, while the subtle variations in weight and texture create a sense of depth and dimension. This combination of hand-drawn authenticity and digital precision makes History Brush suitable for projects that require a bold and expressive visual identity. Its playful nature makes it ideal for headlines, logos, and branding elements, particularly in the realm of street art, music, and youth culture. The font's inherent energy and dynamism can also be used to create a sense of movement and excitement in digital interfaces and graphic designs.",
    "technical_characteristics": [
      "Irregular letterforms",
      "Varying widths and heights",
      "Bold strokes",
      "Sharp terminals",
      "Subtle variations in weight and texture",
      "Geometric shapes",
      "Organic strokes"
    ],
    "personality_traits": [
      "Energetic",
      "Spontaneous",
      "Individualistic",
      "Bold",
      "Expressive",
      "Playful",
      "Dynamic"
    ],
    "practical_contexts": [
      "Headlines",
      "Logos",
      "Branding elements",
      "Street art",
      "Music",
      "Youth culture",
      "Digital interfaces",
      "Graphic designs"
    ],
    "cultural_intuition": [
      "Street art aesthetic",
      "Urban culture",
      "Digital graffiti",
      "Hand-drawn authenticity",
      "Modern youth culture"
    ],
    "search_keywords": [
      "Display typeface",
      "Hand-drawn",
      "Geometric",
      "Organic",
      "Irregular",
      "Bold",
      "Sharp",
      "Energetic",
      "Spontaneous",
      "Playful",
      "Dynamic",
      "Street art",
      "Urban",
      "Digital graffiti",
      "Youth culture",
      "Headlines",
      "Logos",
      "Branding",
      "Digital interfaces",
      "Graphic design"
    ]
  }
}