{
  "filename": "holitter_halfimp_36px.png",
  "status": "success",
  "description": {
    "detailed_description": "Holitter Halfimp is a sans-serif typeface that blends a geometric foundation with subtle humanist details. Its construction is primarily geometric, with clean lines and consistent stroke weights, giving it a modern and streamlined aesthetic. However, the rounded terminals and slightly flared serifs on lowercase letters introduce a touch of warmth and approachability, preventing the font from feeling overly cold or rigid. The high x-height and open counters contribute to excellent legibility, making it suitable for both large-scale displays and smaller text sizes. The overall character of the font is confident and contemporary, yet approachable and inviting. It evokes a sense of clarity and precision, suggesting a brand that is both innovative and reliable. Its versatility makes it suitable for a wide range of applications, from branding and web design to editorial and signage. The font's clean lines and modern aesthetic make it particularly well-suited for digital interfaces, while its subtle humanist details ensure that it remains engaging and readable even at smaller sizes.",
    "technical_characteristics": [
      "Geometric construction",
      "Consistent stroke weights",
      "High x-height",
      "Open counters",
      "Rounded terminals",
      "Slightly flared serifs on lowercase letters"
    ],
    "personality_traits": [
      "Confidently geometric",
      "Approachable and inviting",
      "Modern and streamlined",
      "Clear and precise",
      "Versatile and adaptable"
    ],
    "practical_contexts": [
      "Branding and web design",
      "Editorial and signage",
      "Digital interfaces",
      "Large-scale displays",
      "Small text sizes"
    ],
    "cultural_intuition": [
      "Evokes a sense of clarity and precision",
      "Suggests a brand that is both innovative and reliable",
      "Reflects contemporary design trends",
      "Appeals to a modern audience"
    ],
    "search_keywords": [
      "sans-serif",
      "geometric",
      "humanist",
      "modern",
      "streamlined",
      "legible",
      "versatile",
      "digital",
      "branding",
      "web design",
      "editorial",
      "signage",
      "contemporary",
      "approachable",
      "clear",
      "precise",
      "innovative",
      "reliable"
    ]
  }
}