{
  "filename": "holiday_earlier_36px.png",
  "status": "success",
  "description": {
    "detailed_description": "This font is a playful and expressive display typeface that draws inspiration from hand-drawn lettering styles. Its rounded forms and exaggerated curves create a sense of energy and movement, while the bold weight and consistent stroke width ensure strong legibility even at large sizes. The font's construction is characterized by a combination of organic curves and geometric shapes, resulting in a unique visual language that is both playful and sophisticated. The letterforms are designed with a focus on visual impact, with each character possessing a distinct personality. The overall effect is a font that is both fun and functional, suitable for a wide range of applications, from headlines and logos to posters and packaging. Its playful nature makes it ideal for projects that require a touch of whimsy and personality, while its bold weight and clear legibility ensure that it can be used effectively in a variety of contexts. The font's cultural associations are rooted in the history of hand-drawn lettering, evoking a sense of nostalgia and authenticity. It also resonates with contemporary trends in graphic design, where playful and expressive typography is increasingly popular.",
    "technical_characteristics": [
      "Rounded letterforms",
      "Exaggerated curves",
      "Bold weight",
      "Consistent stroke width",
      "Organic and geometric construction"
    ],
    "personality_traits": [
      "Playful",
      "Expressive",
      "Energetic",
      "Whimsical",
      "Bold"
    ],
    "practical_contexts": [
      "Headlines",
      "Logos",
      "Posters",
      "Packaging",
      "Digital displays"
    ],
    "cultural_intuition": [
      "Hand-drawn lettering",
      "Nostalgia",
      "Authenticity",
      "Contemporary graphic design trends",
      "Playful typography"
    ],
    "search_keywords": [
      "Display font",
      "Hand-drawn",
      "Rounded",
      "Bold",
      "Playful",
      "Expressive",
      "Energetic",
      "Whimsical",
      "Nostalgia",
      "Authenticity",
      "Contemporary",
      "Headlines",
      "Logos",
      "Posters",
      "Packaging",
      "Digital displays"
    ]
  }
}