{
  "filename": "hollywood_hills_36px.png",
  "status": "success",
  "description": {
    "detailed_description": "Hollywood Hills is a bold sans-serif typeface that embodies a confident and playful spirit. Its geometric construction, with sharp angles and strong strokes, creates a sense of solidity and power. The generous x-height and open counters ensure excellent legibility, even at large sizes. The slightly rounded terminals, particularly noticeable in the lowercase 'a' and 'g', add a touch of approachability, preventing the font from feeling overly aggressive. This balance between geometric precision and subtle humanism makes it versatile for a range of applications, from bold headlines to playful branding. The font's strong presence and confident character evoke a sense of vintage Americana, reminiscent of classic Hollywood signage and retro movie posters. Its bold, graphic nature makes it ideal for digital displays, particularly in large sizes, where its impact is maximized. However, its strong personality might not be suitable for all contexts, as it can feel overwhelming in smaller sizes or for extended text blocks.",
    "technical_characteristics": [
      "Geometric construction",
      "Bold weight",
      "Sharp angles",
      "Strong strokes",
      "Generous x-height",
      "Open counters",
      "Slightly rounded terminals"
    ],
    "personality_traits": [
      "Confident",
      "Playful",
      "Bold",
      "Graphic",
      "Vintage",
      "Retro",
      "Approachable"
    ],
    "practical_contexts": [
      "Headlines",
      "Branding",
      "Posters",
      "Digital displays",
      "Large-scale signage"
    ],
    "cultural_intuition": [
      "Vintage Americana",
      "Classic Hollywood",
      "Retro movie posters",
      "Modern digital design",
      "Bold statement"
    ],
    "search_keywords": [
      "Sans-serif",
      "Geometric",
      "Bold",
      "High x-height",
      "Open counters",
      "Rounded terminals",
      "Vintage",
      "Retro",
      "Hollywood",
      "Signage",
      "Branding",
      "Headlines",
      "Digital display",
      "Large size",
      "Graphic",
      "Confident",
      "Playful",
      "Approachable",
      "Powerful",
      "Legible"
    ]
  }
}