{
  "filename": "hooked_up_101_36px.png",
  "status": "success",
  "description": {
    "detailed_description": "This font, with its bold, angular strokes and dramatic slant, embodies a distinct retro-futuristic aesthetic. The geometric construction, evident in the sharp corners and consistent widths, creates a sense of precision and power. The exaggerated x-height and open counters ensure strong legibility, even at smaller sizes. The font's personality is both confident and playful, with a hint of rebelliousness. It evokes the energy and optimism of 1980s sci-fi films and video games, while also feeling surprisingly contemporary in its digital-native design. This font is ideal for headlines, logos, and branding projects that require a bold statement and a touch of retro charm. Its strong visual impact and clear legibility make it suitable for both print and digital applications, particularly in the realm of gaming, technology, and entertainment.",
    "technical_characteristics": [
      "Geometric construction",
      "Bold, angular strokes",
      "Exaggerated x-height",
      "Open counters",
      "Dramatic slant",
      "Consistent stroke widths",
      "Sharp corners"
    ],
    "personality_traits": [
      "Confident",
      "Playful",
      "Rebellious",
      "Energetic",
      "Optimistic",
      "Retro-futuristic",
      "Digital-native"
    ],
    "practical_contexts": [
      "Headlines",
      "Logos",
      "Branding",
      "Gaming",
      "Technology",
      "Entertainment",
      "Digital interfaces"
    ],
    "cultural_intuition": [
      "1980s sci-fi",
      "Video games",
      "Retro-futurism",
      "Digital culture",
      "Modern design"
    ],
    "search_keywords": [
      "Geometric",
      "Angular",
      "Bold",
      "Slant",
      "Retro",
      "Futuristic",
      "Sci-fi",
      "Video game",
      "Headline",
      "Logo",
      "Branding",
      "Digital",
      "Gaming",
      "Technology",
      "Entertainment",
      "Modern",
      "Contemporary",
      "Playful",
      "Confident",
      "Rebellious",
      "Legible",
      "High x-height",
      "Open counters",
      "Strong",
      "Impactful"
    ]
  }
}