{
  "filename": "horrorfind_+_horrormaster_36px.png",
  "status": "success",
  "description": {
    "detailed_description": "This font, with its sharp angles and dramatic strokes, embodies a bold, almost aggressive aesthetic. The letterforms are constructed with a strong geometric foundation, featuring sharp, pointed terminals and a consistent, almost rigid, stroke width. This creates a sense of power and intensity, reminiscent of medieval weaponry or gothic architecture. The high x-height and open counters ensure good legibility, even at smaller sizes, making it suitable for headlines and branding elements where impact is paramount. However, the font's aggressive nature might limit its use in longer blocks of text, potentially creating a jarring reading experience. Its cultural associations lean towards the dark and mysterious, evoking themes of power, rebellion, and the supernatural. This makes it ideal for projects related to horror, fantasy, or heavy metal music, where its bold personality can effectively convey a sense of danger and intrigue.",
    "technical_characteristics": [
      "Geometric construction",
      "Sharp, pointed terminals",
      "Consistent stroke width",
      "High x-height",
      "Open counters"
    ],
    "personality_traits": [
      "Bold",
      "Aggressive",
      "Powerful",
      "Intense",
      "Dark",
      "Mysterious"
    ],
    "practical_contexts": [
      "Headlines",
      "Logos",
      "Branding elements",
      "Posters",
      "T-shirt designs"
    ],
    "cultural_intuition": [
      "Medieval weaponry",
      "Gothic architecture",
      "Horror",
      "Fantasy",
      "Heavy metal music"
    ],
    "search_keywords": [
      "Geometric",
      "Sharp",
      "Bold",
      "Aggressive",
      "Intense",
      "High x-height",
      "Open counters",
      "Gothic",
      "Medieval",
      "Horror",
      "Fantasy",
      "Heavy metal",
      "Power",
      "Rebellion",
      "Supernatural",
      "Headlines",
      "Logos",
      "Branding",
      "Posters",
      "T-shirt"
    ]
  }
}