{
  "filename": "hot_restaurant_36px.png",
  "status": "success",
  "description": {
    "detailed_description": "This font embodies a classic cursive script style, characterized by flowing strokes and graceful curves. The letterforms are constructed with a clear understanding of traditional penmanship, evident in the consistent weight distribution and subtle variations in stroke thickness. The overall impression is one of elegance and sophistication, with a touch of playful informality. The generous x-height and open counters ensure good legibility, even at smaller sizes, making it suitable for both display and body text applications. The font's inherent charm and timeless appeal make it ideal for branding, packaging, and editorial design, particularly for projects that require a touch of vintage flair or a sense of warmth and personality. Its cursive nature evokes a sense of handwritten communication, adding a personal touch to any design.",
    "technical_characteristics": [
      "Cursive script style",
      "Consistent weight distribution",
      "Graceful curves",
      "Generous x-height",
      "Open counters",
      "Subtle variations in stroke thickness"
    ],
    "personality_traits": [
      "Elegant",
      "Sophisticated",
      "Playful",
      "Warm",
      "Personal",
      "Timeless",
      "Charming"
    ],
    "practical_contexts": [
      "Branding",
      "Packaging",
      "Editorial design",
      "Display typography",
      "Body text"
    ],
    "cultural_intuition": [
      "Evokes a sense of handwritten communication",
      "Suggests vintage charm",
      "Captures a sense of warmth and personality"
    ],
    "search_keywords": [
      "Cursive",
      "Script",
      "Elegant",
      "Sophisticated",
      "Playful",
      "Vintage",
      "Handwritten",
      "Branding",
      "Packaging",
      "Editorial",
      "Display",
      "Body text",
      "Legible",
      "Charming",
      "Warm",
      "Timeless",
      "Classic",
      "Traditional",
      "Penmanship"
    ]
  }
}