{
  "filename": "huckle_buff_36px.png",
  "status": "success",
  "description": {
    "detailed_description": "Huckle Buff is a display typeface that embodies a raw, unrefined aesthetic. Its defining characteristic is the heavily distressed, almost chaotic, treatment of each letterform. This is achieved through a combination of jagged edges, uneven strokes, and a deliberate lack of smoothness. The font's construction is far from traditional, relying on a series of sharp angles and irregular curves that create a sense of urgency and unpredictability. Despite its rough appearance, Huckle Buff maintains a surprising level of legibility, thanks to its relatively open counters and consistent letterforms. The font's personality is undeniably bold and rebellious, evoking a sense of grit and defiance. It draws inspiration from the aesthetics of punk rock and street art, with its jagged edges and rough textures reminiscent of graffiti and DIY culture. While its primary application is as a display typeface for headlines and titles, Huckle Buff can also be used effectively in smaller sizes for branding elements or short bursts of text. Its unique character makes it ideal for projects that require a strong visual impact and a sense of rebellious energy. The font's cultural resonance lies in its connection to subcultures that embrace individuality and nonconformity, making it a powerful tool for expressing a sense of rebellion and authenticity.",
    "technical_characteristics": [
      "Distressed letterforms",
      "Jagged edges",
      "Uneven strokes",
      "Sharp angles",
      "Irregular curves",
      "Open counters",
      "Consistent letterforms"
    ],
    "personality_traits": [
      "Bold",
      "Rebellious",
      "Gritty",
      "Defiant",
      "Unrefined",
      "Energetic",
      "Raw"
    ],
    "practical_contexts": [
      "Headlines",
      "Titles",
      "Branding elements",
      "Short bursts of text",
      "Display typography"
    ],
    "cultural_intuition": [
      "Punk rock",
      "Street art",
      "Graffiti",
      "DIY culture",
      "Rebellion",
      "Individuality",
      "Nonconformity"
    ],
    "search_keywords": [
      "Distressed",
      "Jagged",
      "Uneven",
      "Sharp",
      "Irregular",
      "Open counters",
      "Bold",
      "Rebellious",
      "Gritty",
      "Defiant",
      "Unrefined",
      "Energetic",
      "Raw",
      "Punk",
      "Street art",
      "Graffiti",
      "DIY",
      "Headlines",
      "Titles",
      "Branding",
      "Display",
      "Typography"
    ]
  }
}