{
  "filename": "human_brown_eye_36px.png",
  "status": "success",
  "description": {
    "detailed_description": "Human Brown Eye is a playful and expressive display font that draws inspiration from hand-drawn lettering styles. Its irregular letterforms, with their varying stroke weights and organic curves, create a sense of spontaneity and personality. The font's generous x-height and open counters ensure good legibility, even at larger sizes, making it suitable for headlines and branding elements. The overall effect is one of warmth and approachability, reminiscent of handwritten notes or vintage signage. While its casual nature might not be ideal for extended body text, Human Brown Eye excels in capturing attention and conveying a friendly, approachable tone. Its unique character makes it a perfect choice for projects that require a touch of whimsy and personality, particularly in the realm of branding, social media graphics, and creative projects.",
    "technical_characteristics": [
      "Irregular letterforms",
      "Varying stroke weights",
      "Organic curves",
      "Generous x-height",
      "Open counters",
      "Hand-drawn aesthetic"
    ],
    "personality_traits": [
      "Playful",
      "Expressive",
      "Spontaneous",
      "Warm",
      "Approachable",
      "Whimsical",
      "Casual"
    ],
    "practical_contexts": [
      "Headlines",
      "Branding elements",
      "Social media graphics",
      "Creative projects",
      "Short text blocks"
    ],
    "cultural_intuition": [
      "Handwritten notes",
      "Vintage signage",
      "Informal communication",
      "Creative expression",
      "Modern design trends"
    ],
    "search_keywords": [
      "Display font",
      "Hand-drawn",
      "Playful",
      "Expressive",
      "Casual",
      "Whimsical",
      "Warm",
      "Approachable",
      "Headlines",
      "Branding",
      "Social media",
      "Creative projects",
      "Vintage",
      "Hand lettering",
      "Irregular",
      "Organic",
      "Generous x-height",
      "Open counters",
      "Legibility",
      "Modern",
      "Trendy"
    ]
  }
}