{
  "filename": "hvd_peace_36px.png",
  "status": "success",
  "description": {
    "detailed_description": "HVD Peace is a bold, sans-serif typeface that embodies a raw, industrial aesthetic. Its construction is based on a stencil-like design, with sharp, angular strokes and a distinct lack of serifs. The letterforms are designed with a strong emphasis on legibility, featuring open counters and a generous x-height. The overall character of the font is assertive and confident, conveying a sense of strength and directness. Its historical influences are evident in its resemblance to vintage signage and industrial lettering, evoking a sense of nostalgia for a bygone era. However, its contemporary relevance is undeniable, as it aligns with current trends in graphic design that embrace bold, impactful typography. The font's cultural associations are multifaceted, ranging from its connection to urban street art and graffiti to its potential use in branding for edgy, rebellious brands. In practical contexts, HVD Peace excels in large-scale applications, such as headlines, posters, and signage. Its bold weight and clear legibility make it ideal for grabbing attention and conveying a strong message. However, its lack of fine details and limited character set may limit its use in smaller sizes or for extended text. The font's emotional response is one of power and authority, while its cultural resonance evokes a sense of urban grit and rebellion. Its abstract associations range from the industrial revolution to the DIY aesthetic of contemporary street art.",
    "technical_characteristics": [
      "Stencil-like construction",
      "Sharp, angular strokes",
      "Open counters",
      "Generous x-height",
      "Bold weight",
      "Limited character set"
    ],
    "personality_traits": [
      "Assertive",
      "Confident",
      "Direct",
      "Industrial",
      "Nostalgic",
      "Rebellious",
      "Urban"
    ],
    "practical_contexts": [
      "Headlines",
      "Posters",
      "Signage",
      "Large-scale branding",
      "Urban design"
    ],
    "cultural_intuition": [
      "Urban street art",
      "Graffiti",
      "Industrial revolution",
      "DIY aesthetic",
      "Rebellious spirit"
    ],
    "search_keywords": [
      "Stencil",
      "Sans-serif",
      "Bold",
      "Industrial",
      "Urban",
      "Street art",
      "Graffiti",
      "Nostalgic",
      "Rebellious",
      "Headlines",
      "Posters",
      "Signage",
      "Large-scale",
      "Branding",
      "Legibility",
      "Open counters",
      "Generous x-height",
      "Limited character set"
    ]
  }
}