{
  "filename": "hypertension_36px.png",
  "status": "success",
  "description": {
    "detailed_description": "Hypertension (36px) is a handwritten font that captures the energy and immediacy of a quick scribble. Its irregular letterforms, with their uneven strokes and exaggerated angles, evoke a sense of spontaneity and raw emotion. The font's construction is based on a loose, gestural approach, with each letter seemingly formed in a single, fluid movement. This results in a highly expressive typeface that feels both personal and dynamic. The font's uneven baseline and inconsistent letter spacing further contribute to its organic, hand-drawn aesthetic. While the font's legibility is somewhat compromised by its extreme irregularity, it excels in conveying a sense of urgency and authenticity. Its casual, almost chaotic nature makes it ideal for projects that require a raw, unpolished feel, such as informal branding, social media graphics, or handwritten notes. The font's cultural resonance lies in its connection to the immediacy of digital communication and the rise of personal expression in online spaces.",
    "technical_characteristics": [
      "Handwritten style",
      "Irregular letterforms",
      "Uneven strokes",
      "Exaggerated angles",
      "Loose baseline",
      "Inconsistent letter spacing"
    ],
    "personality_traits": [
      "Spontaneous",
      "Energetic",
      "Raw",
      "Expressive",
      "Unpolished",
      "Authentic",
      "Casual",
      "Chaotic"
    ],
    "practical_contexts": [
      "Informal branding",
      "Social media graphics",
      "Handwritten notes",
      "Short text snippets",
      "Digital interfaces"
    ],
    "cultural_intuition": [
      "Digital communication",
      "Personal expression",
      "Authenticity",
      "Immediacy",
      "Raw emotion"
    ],
    "search_keywords": [
      "Handwritten",
      "Script",
      "Informal",
      "Casual",
      "Energetic",
      "Expressive",
      "Unpolished",
      "Authentic",
      "Social media",
      "Branding",
      "Digital",
      "Graphic design",
      "Typography",
      "Font",
      "Typeface",
      "Hand-drawn",
      "Scribble",
      "Grunge",
      "Rough",
      "Raw",
      "Spontaneous",
      "Chaotic",
      "Irregular",
      "Uneven",
      "Inconsistent",
      "Loose",
      "Gestural",
      "Dynamic",
      "Organic",
      "Immediacy",
      "Personal",
      "Expression",
      "Communication"
    ]
  }
}