{
  "filename": "i_am_seventeen_36px.png",
  "status": "success",
  "description": {
    "detailed_description": "This font, with its playful, handwritten aesthetic, evokes a sense of casual informality and personal expression. The letterforms are characterized by a combination of rounded and angular strokes, creating a dynamic and energetic feel. The ascenders and descenders are exaggerated, adding to the overall sense of movement and whimsy. The font's irregular baseline and inconsistent letter spacing further contribute to its hand-drawn quality, making it feel authentic and spontaneous. While the font's casual nature makes it suitable for informal projects, its legibility and versatility allow it to be used in a variety of contexts, from social media graphics to handwritten notes. The font's playful personality and hand-drawn aesthetic evoke a sense of nostalgia and childhood innocence, making it ideal for projects that aim to convey a sense of warmth and approachability.",
    "technical_characteristics": [
      "Handwritten style",
      "Rounded and angular strokes",
      "Exaggerated ascenders and descenders",
      "Irregular baseline",
      "Inconsistent letter spacing"
    ],
    "personality_traits": [
      "Playful",
      "Casual",
      "Energetic",
      "Whimsical",
      "Spontaneous"
    ],
    "practical_contexts": [
      "Social media graphics",
      "Handwritten notes",
      "Informal branding",
      "Children's books",
      "Personal projects"
    ],
    "cultural_intuition": [
      "Nostalgia",
      "Childhood innocence",
      "Personal expression",
      "Authenticity",
      "Spontaneity"
    ],
    "search_keywords": [
      "Handwritten",
      "Playful",
      "Casual",
      "Informal",
      "Whimsical",
      "Energetic",
      "Spontaneous",
      "Nostalgia",
      "Childhood",
      "Personal",
      "Social media",
      "Branding",
      "Children's books",
      "Notes",
      "Graphics",
      "Digital",
      "Font",
      "Typeface",
      "Script",
      "Hand-drawn"
    ]
  }
}