{
  "filename": "i_love_pugs_36px.png",
  "status": "success",
  "description": {
    "detailed_description": "This font, with its playful, handwritten aesthetic, embodies a casual and approachable personality. The letterforms are characterized by a distinct lack of uniformity, with each character exhibiting unique, almost whimsical, variations in stroke thickness and letterform construction. This irregularity, while potentially challenging for consistent legibility in large blocks of text, adds a charming, hand-drawn quality that feels authentic and personal. The font's overall structure leans towards a slightly condensed design, with a generous x-height that contributes to its readability, even in smaller sizes. The rounded terminals and open counters further enhance legibility, while also contributing to the font's friendly and inviting character. This font's casual nature makes it ideal for informal applications, such as social media graphics, personal branding, or playful website elements. It evokes a sense of warmth and approachability, reminiscent of handwritten notes or personalized messages, suggesting a connection to the individual rather than a corporate or formal identity.",
    "technical_characteristics": [
      "Handwritten aesthetic",
      "Variable stroke thickness",
      "Rounded terminals",
      "Open counters",
      "Condensed design",
      "Generous x-height"
    ],
    "personality_traits": [
      "Playful",
      "Approachable",
      "Casual",
      "Authentic",
      "Personal",
      "Friendly",
      "Inviting"
    ],
    "practical_contexts": [
      "Social media graphics",
      "Personal branding",
      "Website elements",
      "Informal signage",
      "Handwritten-style typography"
    ],
    "cultural_intuition": [
      "Evokes a sense of warmth and approachability",
      "Suggests a connection to the individual",
      "Reminiscent of handwritten notes or personalized messages",
      "Reflects a contemporary trend towards authenticity and personalization"
    ],
    "search_keywords": [
      "Handwritten",
      "Playful",
      "Casual",
      "Informal",
      "Social media",
      "Personal branding",
      "Website",
      "Graphic design",
      "Typography",
      "Font",
      "Script",
      "Hand-drawn",
      "Authentic",
      "Approachable",
      "Friendly",
      "Inviting",
      "Rounded terminals",
      "Open counters",
      "Condensed",
      "Generous x-height"
    ]
  }
}