{
  "filename": "i_lost_it_in_the_street_36px.png",
  "status": "success",
  "description": {
    "detailed_description": "\u201cLost It In The Street\u201d is a display typeface that embodies the raw energy of urban street art. Its construction relies heavily on geometric shapes, particularly triangles and angled lines, creating a bold and angular aesthetic. The letterforms are intentionally uneven, with varying stroke weights and inconsistent spacing, reflecting the spontaneity of hand-painted graffiti. This irregularity adds a sense of movement and dynamism, while the overall structure remains legible and recognizable. The font's personality is both rebellious and playful, suggesting a sense of youthful energy and a disregard for traditional typographic rules. It evokes a sense of urban grit and authenticity, reminiscent of street art found in underground spaces and forgotten corners. While its bold and unconventional style makes it unsuitable for large blocks of text, it excels in headlines, logos, and graphic elements where its unique character can shine. Its cultural resonance lies in its connection to street art and urban culture, capturing the spirit of rebellion and self-expression that defines these movements. The font's contemporary relevance stems from its ability to convey a sense of authenticity and individuality, aligning with the growing trend of embracing imperfection and raw aesthetics.",
    "technical_characteristics": [
      "Geometric construction",
      "Angular letterforms",
      "Uneven stroke weights",
      "Inconsistent spacing",
      "Open counters",
      "High x-height",
      "Limited character set"
    ],
    "personality_traits": [
      "Rebellious",
      "Playful",
      "Energetic",
      "Unconventional",
      "Authentic",
      "Gritty",
      "Urban",
      "Spontaneous"
    ],
    "practical_contexts": [
      "Headlines",
      "Logos",
      "Graphic elements",
      "Street art",
      "Urban design",
      "Digital art",
      "Social media graphics"
    ],
    "cultural_intuition": [
      "Street art",
      "Urban culture",
      "Rebellion",
      "Self-expression",
      "Youthful energy",
      "Authenticity",
      "Underground art"
    ],
    "search_keywords": [
      "Geometric",
      "Angular",
      "Display",
      "Street art",
      "Urban",
      "Rebellious",
      "Playful",
      "Energetic",
      "Unconventional",
      "Authentic",
      "Gritty",
      "Headline",
      "Logo",
      "Graphic",
      "Digital art",
      "Social media",
      "Hand-painted",
      "Graffiti",
      "Contemporary",
      "Modern",
      "Raw",
      "Imperfect",
      "Bold",
      "Dynamic",
      "Movement",
      "Legible",
      "Recognizable",
      "Limited character set",
      "Display typeface"
    ]
  }
}