{
  "filename": "ice_age_36px.png",
  "status": "success",
  "description": {
    "detailed_description": "This font, with its bold, blocky forms and playful rounded corners, evokes a sense of playful energy and retro charm. The construction is geometric, with each letterform built from simple, easily recognizable shapes. The thick strokes and generous x-height contribute to a strong visual presence, making it highly legible even at smaller sizes. The rounded terminals and slight curves in the letterforms add a touch of approachability, softening the otherwise rigid geometric structure. This combination of bold geometry and playful curves creates a unique personality that is both confident and approachable. The font's retro aesthetic is reminiscent of 1980s video game graphics and early computer interfaces, making it ideal for projects that seek to capture a nostalgic feel. Its bold and playful nature makes it suitable for headlines, logos, and branding elements, particularly in the gaming, entertainment, and technology industries. The font's strong visual presence and playful personality make it a great choice for attracting attention and conveying a sense of fun and energy.",
    "technical_characteristics": [
      "Geometric construction",
      "Bold, blocky forms",
      "Rounded corners",
      "Thick strokes",
      "Generous x-height",
      "Open counters",
      "Rounded terminals"
    ],
    "personality_traits": [
      "Playful",
      "Energetic",
      "Retro",
      "Bold",
      "Confident",
      "Approachable",
      "Nostalgic"
    ],
    "practical_contexts": [
      "Headlines",
      "Logos",
      "Branding elements",
      "Gaming",
      "Entertainment",
      "Technology"
    ],
    "cultural_intuition": [
      "1980s video game graphics",
      "Early computer interfaces",
      "Nostalgia for a simpler time",
      "Playful energy",
      "Modern retro aesthetic"
    ],
    "search_keywords": [
      "Geometric",
      "Blocky",
      "Rounded",
      "Bold",
      "Playful",
      "Retro",
      "Nostalgic",
      "Video game",
      "Computer",
      "Headlines",
      "Logos",
      "Branding",
      "Gaming",
      "Entertainment",
      "Technology"
    ]
  }
}