{
  "filename": "ilse_36px.png",
  "status": "success",
  "description": {
    "detailed_description": "This font is a bold statement of hand-drawn energy, capturing the raw immediacy of brushstrokes. Each letterform is a unique, expressive gesture, with varying stroke weights and organic curves. The irregular baseline and inconsistent letter spacing contribute to the font's dynamic, almost chaotic feel. While the overall impression is playful and informal, the font's bold strokes and confident forms suggest a sense of strength and individuality. This makes it ideal for eye-catching headlines, branding for creative ventures, or adding a touch of personality to digital interfaces. The font's raw energy evokes a sense of rebellion and nonconformity, reminiscent of street art and DIY culture, while its bold strokes and confident forms suggest a sense of strength and individuality.",
    "technical_characteristics": [
      "hand-drawn style",
      "irregular baseline",
      "varying stroke weights",
      "organic curves",
      "inconsistent letter spacing",
      "bold strokes",
      "confident forms"
    ],
    "personality_traits": [
      "energetic",
      "expressive",
      "playful",
      "informal",
      "rebellious",
      "individualistic",
      "bold",
      "confident",
      "raw",
      "dynamic"
    ],
    "practical_contexts": [
      "headlines",
      "branding for creative ventures",
      "digital interfaces",
      "posters",
      "social media graphics"
    ],
    "cultural_intuition": [
      "street art",
      "DIY culture",
      "rebellion",
      "nonconformity",
      "creative expression",
      "individuality"
    ],
    "search_keywords": [
      "hand-drawn",
      "brush script",
      "informal",
      "bold",
      "energetic",
      "expressive",
      "playful",
      "rebellious",
      "street art",
      "DIY",
      "headline",
      "branding",
      "digital",
      "interface",
      "poster",
      "social media"
    ]
  }
}