{
  "filename": "imperial_one_36px.png",
  "status": "success",
  "description": {
    "detailed_description": "Imperial One is a bold, geometric sans-serif typeface that exudes a strong, confident presence. Its construction is based on precise geometric shapes, resulting in a clean, uncluttered aesthetic. The letterforms are characterized by their sharp corners, wide open counters, and consistent stroke weights, creating a sense of clarity and power. The high x-height and generous spacing contribute to excellent legibility, even at smaller sizes. This font's bold personality is further enhanced by its strong verticality and the absence of any decorative elements, conveying a sense of authority and directness. Its historical roots can be traced back to the modernist movement, with its emphasis on functionality and clarity. However, Imperial One's contemporary relevance lies in its ability to communicate a sense of strength and confidence, making it ideal for branding, headlines, and digital interfaces. Its bold, assertive nature makes it particularly well-suited for applications that require a strong visual impact, such as corporate logos, product packaging, and website headers. While its geometric construction and bold weight make it suitable for large-scale applications, it can also be used effectively at smaller sizes, particularly in digital environments where its high x-height and open counters ensure readability. The font's bold, assertive nature evokes a sense of power and authority, making it suitable for projects that require a strong visual statement. Its geometric construction and clean lines suggest a sense of order and control, while its bold weight conveys a sense of confidence and strength.",
    "technical_characteristics": [
      "Geometric construction",
      "Sharp corners",
      "Wide open counters",
      "Consistent stroke weights",
      "High x-height",
      "Generous spacing",
      "Strong verticality"
    ],
    "personality_traits": [
      "Bold",
      "Confident",
      "Authoritative",
      "Direct",
      "Powerful",
      "Clean",
      "Modern"
    ],
    "practical_contexts": [
      "Branding",
      "Headlines",
      "Digital interfaces",
      "Corporate logos",
      "Product packaging",
      "Website headers"
    ],
    "cultural_intuition": [
      "Modernist influence",
      "Contemporary confidence",
      "Digital-native aesthetic",
      "Strong visual impact",
      "Sense of authority"
    ],
    "search_keywords": [
      "Geometric sans-serif",
      "Bold typeface",
      "Sharp corners",
      "Open counters",
      "High x-height",
      "Legibility",
      "Branding",
      "Headlines",
      "Digital interfaces",
      "Corporate logos",
      "Product packaging",
      "Website headers",
      "Modernist",
      "Contemporary",
      "Powerful",
      "Authoritative",
      "Confident",
      "Clean",
      "Direct"
    ]
  }
}