{
  "filename": "imperator_36px.png",
  "status": "success",
  "description": {
    "detailed_description": "Imperator is a serif typeface that blends classic elegance with a contemporary edge. Its construction is rooted in traditional serif design principles, featuring a strong vertical axis, balanced proportions, and a consistent stroke weight. The letterforms are carefully crafted with subtle curves and transitions, creating a sense of refinement and sophistication. However, the font's personality is not solely defined by its traditional roots. The high x-height and open counters contribute to a modern feel, ensuring legibility even at smaller sizes. The slightly rounded terminals and subtle bracketed serifs add a touch of warmth and approachability, preventing the font from feeling overly formal or austere. This balance between classic structure and contemporary details makes Imperator versatile for a range of applications, from high-end branding and editorial design to digital interfaces and web typography. Its elegant yet approachable character evokes a sense of timeless sophistication, making it suitable for projects that require a touch of class and refinement.",
    "technical_characteristics": [
      "High x-height",
      "Balanced proportions",
      "Consistent stroke weight",
      "Subtle curves and transitions",
      "Slightly rounded terminals",
      "Bracketed serifs",
      "Strong vertical axis"
    ],
    "personality_traits": [
      "Classically elegant",
      "Sophisticated",
      "Approachable",
      "Refined",
      "Timeless",
      "Versatile",
      "Modern yet traditional"
    ],
    "practical_contexts": [
      "High-end branding",
      "Editorial design",
      "Digital interfaces",
      "Web typography",
      "Corporate communications"
    ],
    "cultural_intuition": [
      "Evokes a sense of timeless sophistication",
      "Suggests a balance between tradition and modernity",
      "Reflects a contemporary appreciation for classic design",
      "Connects to a sense of refinement and quality",
      "Appeals to a discerning audience"
    ],
    "search_keywords": [
      "Serif typeface",
      "Classic design",
      "Modern feel",
      "High x-height",
      "Open counters",
      "Rounded terminals",
      "Bracketed serifs",
      "Elegant",
      "Sophisticated",
      "Approachable",
      "Versatile",
      "Branding",
      "Editorial",
      "Digital",
      "Web",
      "Corporate",
      "Timeless",
      "Refined",
      "Quality"
    ]
  }
}