{
  "filename": "independant_36px.png",
  "status": "success",
  "description": {
    "detailed_description": "Independant is a bold, geometric sans-serif typeface that draws inspiration from both classic and contemporary design. Its construction is based on simple, clean shapes, with each letterform meticulously crafted for maximum impact. The font features a high x-height and open counters, ensuring strong legibility even at small sizes. The bold weight and sharp terminals give it a confident and assertive personality, while the slightly rounded corners add a touch of approachability. This balance between geometric precision and subtle humanism makes Independant versatile for a range of applications, from bold headlines and branding to digital interfaces and signage. Its strong visual presence and clear readability make it ideal for conveying a message of power, confidence, and modernity. The font's bold, geometric aesthetic evokes a sense of retrofuturism, reminiscent of 1960s and 1970s graphic design, while its clean lines and sharp edges feel distinctly contemporary. Independant is a powerful tool for designers seeking to create impactful visuals that resonate with a modern audience.",
    "technical_characteristics": [
      "Geometric construction",
      "High x-height",
      "Open counters",
      "Bold weight",
      "Sharp terminals",
      "Slightly rounded corners"
    ],
    "personality_traits": [
      "Confidently geometric",
      "Assertive",
      "Approachable",
      "Modern",
      "Powerful",
      "Legible",
      "Impactful"
    ],
    "practical_contexts": [
      "Headlines",
      "Branding",
      "Digital interfaces",
      "Signage",
      "Large-scale displays"
    ],
    "cultural_intuition": [
      "Retrofuturism",
      "Modernity",
      "Confidence",
      "Power",
      "Clarity"
    ],
    "search_keywords": [
      "Geometric sans-serif",
      "Bold typeface",
      "High x-height",
      "Open counters",
      "Sharp terminals",
      "Rounded corners",
      "Legible",
      "Impactful",
      "Modern",
      "Retrofuturism",
      "Headlines",
      "Branding",
      "Digital interfaces",
      "Signage",
      "Large-scale displays",
      "Power",
      "Confidence",
      "Clarity"
    ]
  }
}