{
  "filename": "infekt_36px.png",
  "status": "success",
  "description": {
    "detailed_description": "Infekt is a display typeface that embodies a playful yet slightly menacing energy. Its construction is based on a combination of geometric and organic forms, resulting in a unique visual language. The letters are built with a distinct, almost pixelated outline, giving them a digital-inspired feel. This outline is further emphasized by the addition of small, jagged edges, adding a sense of roughness and imperfection. The overall effect is a font that feels both modern and slightly chaotic, with a hint of retro-futuristic charm. The high x-height and open counters ensure good legibility, even at smaller sizes, making it suitable for headlines and branding elements. However, the font's bold and unconventional nature might limit its use in large blocks of text. Infekt's personality is best described as edgy, playful, and slightly rebellious, making it a perfect choice for projects that require a bold and attention-grabbing visual identity. It evokes a sense of digital culture, perhaps referencing early computer graphics or the aesthetics of cyberpunk. Its rough edges and playful forms suggest a sense of energy and dynamism, making it ideal for projects that want to convey a sense of excitement and innovation.",
    "technical_characteristics": [
      "Geometric and organic construction",
      "Pixelated outline",
      "Jagged edges",
      "High x-height",
      "Open counters",
      "Bold weight",
      "Unconventional letterforms"
    ],
    "personality_traits": [
      "Edgy",
      "Playful",
      "Rebellious",
      "Energetic",
      "Dynamic",
      "Modern",
      "Slightly chaotic",
      "Retro-futuristic"
    ],
    "practical_contexts": [
      "Headlines",
      "Branding elements",
      "Logos",
      "Posters",
      "Digital interfaces",
      "Short bursts of text"
    ],
    "cultural_intuition": [
      "Digital culture",
      "Early computer graphics",
      "Cyberpunk aesthetics",
      "Modern design",
      "Rebellious spirit"
    ],
    "search_keywords": [
      "Display typeface",
      "Geometric",
      "Organic",
      "Pixelated",
      "Jagged",
      "High x-height",
      "Open counters",
      "Bold",
      "Unconventional",
      "Edgy",
      "Playful",
      "Rebellious",
      "Energetic",
      "Dynamic",
      "Modern",
      "Retro-futuristic",
      "Digital culture",
      "Cyberpunk",
      "Headlines",
      "Branding",
      "Logos",
      "Posters",
      "Digital interfaces"
    ]
  }
}