{
  "filename": "infinite_justice_36px.png",
  "status": "success",
  "description": {
    "detailed_description": "\u201cInfinite Justice\u201d is a bold, geometric sans-serif typeface with a strong, assertive presence. Its construction is based on clean, angular lines and sharp corners, creating a sense of precision and power. The letterforms are tightly spaced, with a high x-height and open counters that ensure excellent legibility even at small sizes. The font's distinctive features include its bold weight, its sharp terminals, and its unique lowercase \u201ca\u201d with its distinctive open counter. The overall character of the font is confident and authoritative, with a hint of aggression. It evokes a sense of strength and determination, making it suitable for headlines, branding, and other applications where a strong visual impact is desired. The font's contemporary relevance lies in its ability to convey a sense of modernity and innovation, while its cultural associations are rooted in the bold, graphic styles of the 1980s and 1990s.  The font's bold weight and sharp angles make it well-suited for large-scale applications such as signage, posters, and web headers. However, its strong personality may not be appropriate for all contexts, and it should be used with care in smaller sizes or for body text.  \u201cInfinite Justice\u201d evokes a sense of power and authority, suggesting a sense of justice and righteousness. It also carries a hint of rebellion and defiance, making it suitable for projects that challenge the status quo.",
    "technical_characteristics": [
      "Geometric construction",
      "Bold weight",
      "High x-height",
      "Open counters",
      "Sharp terminals",
      "Tight letter spacing"
    ],
    "personality_traits": [
      "Confident",
      "Authoritative",
      "Assertive",
      "Modern",
      "Bold",
      "Powerful",
      "Graphic"
    ],
    "practical_contexts": [
      "Headlines",
      "Branding",
      "Signage",
      "Posters",
      "Web headers"
    ],
    "cultural_intuition": [
      "Evokes 1980s and 1990s graphic design",
      "Suggests a sense of justice and righteousness",
      "Carries a hint of rebellion and defiance",
      "Conveys a sense of modernity and innovation"
    ],
    "search_keywords": [
      "Geometric sans-serif",
      "Bold typeface",
      "High x-height",
      "Open counters",
      "Sharp terminals",
      "Tight letter spacing",
      "Confident",
      "Authoritative",
      "Modern",
      "Powerful",
      "Graphic",
      "Headlines",
      "Branding",
      "Signage",
      "Posters",
      "Web headers",
      "1980s",
      "1990s",
      "Justice",
      "Rebellion",
      "Innovation"
    ]
  }
}