{
  "filename": "ink_stand_36px.png",
  "status": "success",
  "description": {
    "detailed_description": "Ink Stand is a display typeface that captures the immediacy and expressiveness of hand-drawn lettering. Its irregular, gestural forms are reminiscent of brush pen calligraphy, with thick strokes and thin hairlines creating a dynamic contrast. The font's organic nature is further emphasized by the inconsistent letter widths and the playful variations in letterforms, such as the rounded 'a' and the elongated 'f'. While the overall impression is one of casual informality, the font's bold strokes and confident letterforms convey a sense of energy and personality. Ink Stand is well-suited for headlines, logos, and short bursts of text where a strong visual impact is desired. Its hand-drawn aesthetic evokes a sense of authenticity and creativity, making it ideal for projects that require a personal touch. The font's bold, expressive nature also lends itself to applications in the realm of street art, graffiti, and contemporary design, where its raw energy and unpolished charm can be embraced.",
    "technical_characteristics": [
      "Irregular letterforms",
      "Thick strokes and thin hairlines",
      "Inconsistent letter widths",
      "Gestural forms",
      "Dynamic contrast"
    ],
    "personality_traits": [
      "Energetic",
      "Expressive",
      "Casual",
      "Informal",
      "Authentic"
    ],
    "practical_contexts": [
      "Headlines",
      "Logos",
      "Short bursts of text",
      "Street art",
      "Graffiti"
    ],
    "cultural_intuition": [
      "Hand-drawn aesthetic",
      "Contemporary design",
      "Street culture",
      "Urban energy",
      "Creative expression"
    ],
    "search_keywords": [
      "display typeface",
      "hand-drawn",
      "brush pen",
      "calligraphy",
      "irregular",
      "gestural",
      "thick strokes",
      "thin hairlines",
      "inconsistent letter widths",
      "dynamic contrast",
      "bold",
      "expressive",
      "casual",
      "informal",
      "authentic",
      "headlines",
      "logos",
      "short bursts of text",
      "street art",
      "graffiti",
      "contemporary design",
      "urban energy",
      "creative expression"
    ]
  }
}