{
  "filename": "insektofobiya_36px.png",
  "status": "success",
  "description": {
    "detailed_description": "Insektofobuja is a display typeface that embodies a unique blend of organic and geometric forms. Each letter is meticulously crafted as a stylized insect, with intricate details and delicate lines. The font's construction is based on a combination of natural shapes and geometric principles, resulting in a visually striking and unexpected aesthetic. The high x-height and open counters ensure legibility, while the intricate details and organic forms create a sense of whimsy and intrigue. The font's personality is both playful and sophisticated, evoking a sense of wonder and curiosity. It's ideal for projects that require a touch of the unconventional, such as branding for nature-inspired products, children's books, or whimsical illustrations. The font's cultural associations range from the natural world to the realm of fantasy and imagination, making it a versatile choice for a variety of creative applications.",
    "technical_characteristics": [
      "Organic letterforms",
      "Geometric construction",
      "Intricate details",
      "High x-height",
      "Open counters",
      "Delicate lines",
      "Stylized insect forms"
    ],
    "personality_traits": [
      "Whimsical",
      "Playful",
      "Intriguing",
      "Sophisticated",
      "Unconventional",
      "Nature-inspired",
      "Imaginative"
    ],
    "practical_contexts": [
      "Branding for nature-inspired products",
      "Children's books",
      "Whimsical illustrations",
      "Display headlines",
      "Decorative elements"
    ],
    "cultural_intuition": [
      "Natural world",
      "Fantasy and imagination",
      "Wonder and curiosity",
      "Unconventional design",
      "Modern art"
    ],
    "search_keywords": [
      "Insektofobuja",
      "Display typeface",
      "Organic",
      "Geometric",
      "Insect",
      "Intricate",
      "Delicate",
      "High x-height",
      "Open counters",
      "Whimsical",
      "Playful",
      "Sophisticated",
      "Unconventional",
      "Nature-inspired",
      "Imaginative",
      "Branding",
      "Children's books",
      "Illustrations",
      "Headlines",
      "Decorative",
      "Fantasy",
      "Modern art"
    ]
  }
}