{
  "filename": "inverse_36px.png",
  "status": "success",
  "description": {
    "detailed_description": "This font's geometric construction is immediately apparent, with its sharp angles and precise lines. The lowercase letters are particularly striking, featuring a consistent, almost robotic, structure. The 'a' and 'g' are particularly interesting, with their open counters and angular forms. The overall effect is one of starkness and precision, reminiscent of early digital interfaces or minimalist graphic design. However, the font's high x-height and open counters ensure strong legibility, making it suitable for both display and body text. The font's bold, confident character makes it ideal for headlines, branding, and digital interfaces where a strong visual impact is desired. It evokes a sense of modernity and technological advancement, suggesting a future-oriented aesthetic. The font's clean lines and sharp angles also lend themselves well to digital applications, where pixel-perfect rendering is crucial.",
    "technical_characteristics": [
      "Geometric construction",
      "Sharp angles",
      "Precise lines",
      "High x-height",
      "Open counters",
      "Consistent lowercase structure",
      "Angular forms"
    ],
    "personality_traits": [
      "Stark",
      "Precise",
      "Bold",
      "Confident",
      "Modern",
      "Technological",
      "Future-oriented"
    ],
    "practical_contexts": [
      "Headlines",
      "Branding",
      "Digital interfaces",
      "Display text",
      "Body text"
    ],
    "cultural_intuition": [
      "Early digital interfaces",
      "Minimalist graphic design",
      "Technological advancement",
      "Modernity",
      "Future-oriented aesthetic"
    ],
    "search_keywords": [
      "Geometric",
      "Sans-serif",
      "Sharp",
      "Angular",
      "Bold",
      "Modern",
      "Digital",
      "Minimalist",
      "High x-height",
      "Open counters",
      "Legible",
      "Display",
      "Body text",
      "Branding",
      "Interface",
      "Technology",
      "Future",
      "Clean",
      "Precise",
      "Stark",
      "Concise",
      "Futuristic",
      "Tech",
      "Modernist"
    ]
  }
}