{
  "filename": "isis_dings_36px.png",
  "status": "success",
  "description": {
    "detailed_description": "This font is a bold and playful display typeface that draws inspiration from both ancient Egyptian hieroglyphs and modern digital design. Its geometric construction, with sharp angles and strong vertical strokes, creates a sense of power and authority, reminiscent of the imposing structures of ancient Egypt. However, the font's playful use of negative space and its inclusion of whimsical glyphs, such as a UFO and a stick figure, adds a contemporary twist, making it feel both timeless and relevant. The font's high x-height and open counters ensure strong legibility, even at large sizes, making it ideal for headlines, logos, and other display applications. Its bold character and playful nature make it suitable for projects that require a strong visual impact and a touch of whimsy.",
    "technical_characteristics": [
      "Geometric construction",
      "Sharp angles",
      "Strong vertical strokes",
      "High x-height",
      "Open counters",
      "Playful use of negative space",
      "Whimsical glyphs"
    ],
    "personality_traits": [
      "Bold",
      "Playful",
      "Authoritative",
      "Whimsical",
      "Modern",
      "Timeless",
      "Energetic"
    ],
    "practical_contexts": [
      "Headlines",
      "Logos",
      "Posters",
      "Digital interfaces",
      "Large-scale signage"
    ],
    "cultural_intuition": [
      "Ancient Egyptian hieroglyphs",
      "Modern digital design",
      "Pop culture",
      "Science fiction",
      "Playful experimentation"
    ],
    "search_keywords": [
      "Geometric",
      "Display",
      "Bold",
      "Playful",
      "Hieroglyphs",
      "Digital",
      "Modern",
      "Whimsical",
      "Headlines",
      "Logos",
      "Posters",
      "Signage",
      "Science fiction",
      "Pop culture",
      "Graphic design",
      "Typography",
      "Font",
      "Typeface"
    ]
  }
}