{
  "filename": "isl_villain_36px.png",
  "status": "success",
  "description": {
    "detailed_description": "This font, with its angular, jagged forms, is a bold statement of raw energy and unpredictable character. Each letter is constructed from a series of sharp, pointed strokes, creating a sense of dynamism and movement. The lack of traditional curves and rounded terminals adds to the font's aggressive aesthetic, while the uneven spacing between letters further emphasizes its chaotic nature. This font is not for the faint of heart, but for those seeking a visual language that is both edgy and captivating. Its bold, almost aggressive personality makes it ideal for projects that demand attention and convey a sense of power or rebellion. However, its lack of legibility at smaller sizes limits its practical applications, making it best suited for large-scale displays or graphic elements where impact is paramount. The font's raw, unrefined aesthetic evokes a sense of urban grit and underground culture, suggesting a connection to street art, graffiti, and alternative music scenes.",
    "technical_characteristics": [
      "angular construction",
      "jagged strokes",
      "pointed terminals",
      "uneven spacing",
      "high contrast",
      "variable stroke width",
      "asymmetrical forms"
    ],
    "personality_traits": [
      "bold",
      "aggressive",
      "dynamic",
      "chaotic",
      "unpredictable",
      "edgy",
      "rebellious"
    ],
    "practical_contexts": [
      "large-scale displays",
      "graphic elements",
      "posters",
      "logos",
      "headlines",
      "street art",
      "graffiti"
    ],
    "cultural_intuition": [
      "urban grit",
      "underground culture",
      "street art",
      "graffiti",
      "alternative music",
      "rebellion",
      "power"
    ],
    "search_keywords": [
      "angular",
      "jagged",
      "pointed",
      "sharp",
      "dynamic",
      "chaotic",
      "uneven",
      "high contrast",
      "bold",
      "aggressive",
      "rebellious",
      "street art",
      "graffiti",
      "underground",
      "alternative",
      "power",
      "impact",
      "display",
      "graphic",
      "poster",
      "logo",
      "headline"
    ]
  }
}