{
  "filename": "itsukushima_katana_36px.png",
  "status": "success",
  "description": {
    "detailed_description": "This font's bold, geometric construction evokes a sense of futuristic energy, reminiscent of 1980s sci-fi aesthetics. The sharp angles and strong strokes create a sense of power and authority, while the slightly rounded terminals add a touch of approachability. The font's high x-height and open counters ensure strong legibility, even at small sizes, making it suitable for both display and body text applications. The overall effect is a font that is both modern and timeless, capable of conveying a sense of innovation and excitement. Its bold, confident character makes it ideal for branding, headlines, and digital interfaces, particularly those with a futuristic or technological theme. The font's strong visual impact and clear legibility make it a powerful tool for conveying information and creating a memorable brand identity.",
    "technical_characteristics": [
      "Geometric construction",
      "Sharp angles",
      "Strong strokes",
      "High x-height",
      "Open counters",
      "Slightly rounded terminals",
      "Bold weight"
    ],
    "personality_traits": [
      "Futuristic",
      "Energetic",
      "Powerful",
      "Authoritative",
      "Approachable",
      "Modern",
      "Timeless"
    ],
    "practical_contexts": [
      "Branding",
      "Headlines",
      "Digital interfaces",
      "Science fiction",
      "Technology",
      "Display text",
      "Body text"
    ],
    "cultural_intuition": [
      "1980s sci-fi aesthetics",
      "Futuristic design",
      "Technological innovation",
      "Modernity",
      "Confidence"
    ],
    "search_keywords": [
      "Geometric",
      "Futuristic",
      "Bold",
      "Sharp",
      "Strong",
      "High x-height",
      "Open counters",
      "Rounded terminals",
      "Display",
      "Body text",
      "Branding",
      "Headlines",
      "Digital",
      "Science fiction",
      "Technology",
      "Modern",
      "Timeless",
      "Confidence",
      "Energy",
      "Power",
      "Authority",
      "Approachable",
      "Legibility"
    ]
  }
}