{
  "filename": "j.d._handcrafted_36px.png",
  "status": "success",
  "description": {
    "detailed_description": "J.D. Handcrafted is a display typeface that captures the essence of casual handwritten script. Its irregular letterforms, varying stroke weights, and playful flourishes evoke the spontaneity of a personal note. The font's construction is organic, with each letterform feeling like a unique stroke, rather than a precisely engineered shape. This informality is further emphasized by the inconsistent baseline and ascender heights, adding to the hand-drawn aesthetic. While the font's overall character is playful and approachable, it also possesses a certain ruggedness, with sharp angles and bold strokes that suggest a confident and assertive personality. This duality makes it suitable for a range of applications, from casual branding and social media graphics to more formal headings and titles, where its unique character can add a touch of personality. The font's cultural resonance lies in its connection to the DIY aesthetic and the rise of digital hand lettering, reflecting a contemporary desire for authenticity and personal expression.",
    "technical_characteristics": [
      "Irregular letterforms",
      "Varying stroke weights",
      "Playful flourishes",
      "Inconsistent baseline and ascender heights",
      "Organic construction",
      "Sharp angles",
      "Bold strokes"
    ],
    "personality_traits": [
      "Playful",
      "Approachable",
      "Rugged",
      "Confident",
      "Assertive",
      "Spontaneous",
      "Authentic"
    ],
    "practical_contexts": [
      "Casual branding",
      "Social media graphics",
      "Headings and titles",
      "Display typography",
      "Digital hand lettering"
    ],
    "cultural_intuition": [
      "DIY aesthetic",
      "Digital hand lettering",
      "Authenticity",
      "Personal expression",
      "Contemporary design trends"
    ],
    "search_keywords": [
      "Handwritten",
      "Script",
      "Display",
      "Casual",
      "Playful",
      "Organic",
      "Irregular",
      "Bold",
      "Rugged",
      "Confident",
      "Authentic",
      "DIY",
      "Digital",
      "Hand lettering",
      "Branding",
      "Social media",
      "Headings",
      "Titles"
    ]
  }
}