{
  "filename": "jaap_36px.png",
  "status": "success",
  "description": {
    "detailed_description": "Jaap is a handwritten script font that captures the energy and informality of casual writing. Its flowing strokes and expressive letterforms create a sense of immediacy and personality. The font's construction is based on a combination of organic curves and sharp angles, giving it a dynamic and unpredictable feel. The ascenders and descenders are well-balanced, ensuring legibility even at smaller sizes. The overall character of Jaap is playful and approachable, with a hint of whimsy. It evokes a sense of personal connection and authenticity, making it suitable for projects that require a friendly and engaging tone. The font's versatility allows it to be used for a wide range of applications, from branding and packaging to social media graphics and handwritten notes. Its informal nature makes it particularly well-suited for digital platforms, where it can add a touch of personality to websites, apps, and social media content. However, its expressive nature may not be appropriate for all contexts, particularly those requiring a more formal or professional tone.",
    "technical_characteristics": [
      "Handwritten style",
      "Organic curves",
      "Sharp angles",
      "Expressive letterforms",
      "Well-balanced ascenders and descenders"
    ],
    "personality_traits": [
      "Playful",
      "Approachable",
      "Whimsical",
      "Authentic",
      "Informal"
    ],
    "practical_contexts": [
      "Branding and packaging",
      "Social media graphics",
      "Handwritten notes",
      "Websites and apps",
      "Digital content"
    ],
    "cultural_intuition": [
      "Evokes a sense of personal connection",
      "Suggests a casual and friendly tone",
      "Reflects the informality of digital communication",
      "Captures the spirit of contemporary design",
      "Appeals to a younger audience"
    ],
    "search_keywords": [
      "Handwritten",
      "Script",
      "Informal",
      "Playful",
      "Whimsical",
      "Authentic",
      "Branding",
      "Packaging",
      "Social media",
      "Digital",
      "Website",
      "App",
      "Content",
      "Casual",
      "Friendly",
      "Engaging",
      "Expressive",
      "Organic",
      "Dynamic",
      "Unpredictable",
      "Legible",
      "Versatile"
    ]
  }
}