{
  "filename": "james_stroker_36px.png",
  "status": "success",
  "description": {
    "detailed_description": "James Stroker is a bold, expressive script font that captures the energy of hand-lettering while maintaining a degree of legibility. Its flowing strokes and dynamic curves create a sense of movement and personality, reminiscent of vintage signage and handwritten notes. The font's construction is based on a combination of calligraphic principles and digital refinement, resulting in a balance between organic fluidity and controlled precision. The generous x-height and open counters ensure readability even at smaller sizes, making it suitable for headlines, logos, and short-form text. The font's playful nature and vintage aesthetic evoke a sense of nostalgia and authenticity, making it ideal for projects that require a touch of personality and charm. Its versatility allows it to be used across a range of applications, from branding and packaging to social media graphics and web design.",
    "technical_characteristics": [
      "flowing strokes",
      "dynamic curves",
      "generous x-height",
      "open counters",
      "calligraphic construction",
      "digital refinement",
      "bold weight"
    ],
    "personality_traits": [
      "expressive",
      "playful",
      "energetic",
      "vintage-inspired",
      "handwritten",
      "authentic",
      "charming"
    ],
    "practical_contexts": [
      "headlines",
      "logos",
      "short-form text",
      "branding",
      "packaging",
      "social media graphics",
      "web design"
    ],
    "cultural_intuition": [
      "evokes nostalgia",
      "suggests authenticity",
      "reminiscent of vintage signage",
      "captures the spirit of hand-lettering",
      "ideal for projects with a personal touch"
    ],
    "search_keywords": [
      "script font",
      "handwritten",
      "bold",
      "expressive",
      "vintage",
      "playful",
      "charming",
      "legible",
      "headlines",
      "logos",
      "branding",
      "packaging",
      "social media",
      "web design",
      "nostalgia",
      "authenticity",
      "calligraphic",
      "digital",
      "flowing",
      "dynamic",
      "curves",
      "x-height",
      "counters",
      "open",
      "generous"
    ]
  }
}