{
  "filename": "japonesa_36px.png",
  "status": "success",
  "description": {
    "detailed_description": "This font, with its bold, angular strokes and playful, almost cartoonish letterforms, embodies a distinct sense of energy and informality. The construction is primarily geometric, with sharp angles and pronounced curves, creating a dynamic and visually striking appearance. The letterforms are often asymmetrical, with exaggerated proportions and unique, almost whimsical, details. This playful approach to letterform design is further emphasized by the inclusion of decorative elements like the extended tails on the 'f' and 'g' and the stylized 't' crossbar. While the font's overall character is bold and energetic, it also possesses a certain charm and approachability, thanks to the slightly rounded terminals and the overall sense of whimsy. This combination of boldness and playfulness makes it suitable for a variety of applications, from eye-catching headlines and branding to playful illustrations and digital interfaces. The font's cultural resonance lies in its connection to contemporary street art and graphic design trends, evoking a sense of urban energy and youthful rebellion. It's a font that speaks to a generation that embraces individuality and creative expression, making it a powerful tool for communicating a message of fun, energy, and individuality.",
    "technical_characteristics": [
      "Geometric construction",
      "Sharp angles",
      "Exaggerated proportions",
      "Asymmetrical letterforms",
      "Bold strokes",
      "Rounded terminals",
      "Decorative elements"
    ],
    "personality_traits": [
      "Energetic",
      "Playful",
      "Bold",
      "Whimsical",
      "Informal",
      "Approachable",
      "Dynamic"
    ],
    "practical_contexts": [
      "Headlines",
      "Branding",
      "Illustrations",
      "Digital interfaces",
      "Street art"
    ],
    "cultural_intuition": [
      "Contemporary street art",
      "Urban energy",
      "Youthful rebellion",
      "Individuality",
      "Creative expression"
    ],
    "search_keywords": [
      "Geometric",
      "Angular",
      "Bold",
      "Playful",
      "Informal",
      "Whimsical",
      "Street art",
      "Urban",
      "Youthful",
      "Energetic",
      "Dynamic",
      "Headlines",
      "Branding",
      "Illustrations",
      "Digital",
      "Contemporary",
      "Graphic design",
      "Rebellion",
      "Individuality",
      "Expression",
      "Font",
      "Typeface"
    ]
  }
}