{
  "filename": "jason_sharpie_36px.png",
  "status": "success",
  "description": {
    "detailed_description": "Jason Sharpie is a display typeface that captures the immediacy and informality of handwritten text. Its irregular letterforms, with their varying stroke widths and expressive curves, evoke the feeling of a quick sketch or a personal note. The font's construction is decidedly organic, with each letterform appearing as if drawn with a single, confident stroke. This creates a sense of spontaneity and authenticity, reminiscent of the casual, expressive nature of handwriting. The font's generous x-height and open counters ensure good legibility, even at smaller sizes, making it suitable for headlines, logos, and short-form text. However, its irregular nature might make it less suitable for extended body copy, where consistent letterforms are crucial for readability. Jason Sharpie's playful and approachable character makes it ideal for projects that require a touch of personality and authenticity, such as branding for creative agencies, social media graphics, or informal publications. Its cultural resonance lies in its connection to the DIY aesthetic and the rise of handwritten typography, reflecting a contemporary desire for authenticity and personal expression.",
    "technical_characteristics": [
      "Irregular letterforms",
      "Varying stroke widths",
      "Expressive curves",
      "Organic construction",
      "Generous x-height",
      "Open counters"
    ],
    "personality_traits": [
      "Spontaneous",
      "Authentic",
      "Playful",
      "Approachable",
      "Expressive"
    ],
    "practical_contexts": [
      "Headlines",
      "Logos",
      "Short-form text",
      "Social media graphics",
      "Informal publications"
    ],
    "cultural_intuition": [
      "DIY aesthetic",
      "Handwritten typography",
      "Authenticity",
      "Personal expression",
      "Contemporary design"
    ],
    "search_keywords": [
      "handwritten",
      "display",
      "sketchy",
      "informal",
      "casual",
      "organic",
      "expressive",
      "authentic",
      "playful",
      "approachable",
      "headline",
      "logo",
      "social media",
      "branding",
      "creative",
      "DIY",
      "contemporary",
      "typeface",
      "font"
    ]
  }
}