{
  "filename": "jb_hell_36px.png",
  "status": "success",
  "description": {
    "detailed_description": "This font embodies a raw, energetic spirit, mimicking the immediacy of handwritten text. Its construction relies on bold, gestural strokes, often with uneven thickness and pronounced angles. The letters are highly individualistic, with each character exhibiting unique variations in form and weight. This irregularity contributes to the font's lively, almost chaotic energy, reminiscent of a quick scribble or a spontaneous note. While the overall impression is informal and playful, the font maintains a degree of legibility, particularly in its lowercase forms. The bold strokes and open counters ensure readability, even at smaller sizes. This makes it suitable for headlines, logos, or short bursts of text where a sense of immediacy and personality is desired. The font's cultural resonance lies in its connection to street art and graffiti, evoking a sense of urban grit and rebellious creativity. It captures the spirit of DIY culture and the raw energy of self-expression, making it a powerful tool for conveying authenticity and individuality.",
    "technical_characteristics": [
      "gestural strokes",
      "uneven stroke thickness",
      "pronounced angles",
      "open counters",
      "individualistic letterforms",
      "irregularity in form and weight"
    ],
    "personality_traits": [
      "energetic",
      "spontaneous",
      "informal",
      "playful",
      "rebellious",
      "authentic",
      "individualistic"
    ],
    "practical_contexts": [
      "headlines",
      "logos",
      "short bursts of text",
      "street art",
      "graffiti",
      "digital graphics"
    ],
    "cultural_intuition": [
      "street art",
      "graffiti",
      "DIY culture",
      "urban grit",
      "rebellious creativity"
    ],
    "search_keywords": [
      "handwritten",
      "gestural",
      "bold",
      "irregular",
      "energetic",
      "playful",
      "informal",
      "street art",
      "graffiti",
      "urban",
      "rebellious",
      "authentic",
      "individualistic",
      "headline",
      "logo",
      "digital graphics",
      "display font",
      "casual",
      "rough",
      "sketchy",
      "hand-drawn"
    ]
  }
}