{
  "filename": "jd_vega_36px.png",
  "status": "success",
  "description": {
    "detailed_description": "This font, with its bold, angular strokes and playful, almost childlike character, embodies a distinct sense of energy and informality. The letterforms are constructed with a clear geometric foundation, evident in the sharp corners and consistent widths, yet they are infused with a hand-drawn quality that adds a touch of whimsy. The high x-height and open counters ensure strong legibility, even at smaller sizes, while the exaggerated ascenders and descenders contribute to a dynamic and expressive feel. The font's overall character is playful and approachable, suggesting a sense of fun and creativity. It evokes a sense of nostalgia for hand-drawn lettering, reminiscent of childhood scribbles or graffiti art. This font would be well-suited for projects that require a bold and energetic visual identity, such as branding for a creative agency, a playful app, or a street-style fashion brand. Its informal and approachable nature makes it ideal for headlines, logos, and short bursts of text, adding a touch of personality and visual interest.",
    "technical_characteristics": [
      "Geometric construction",
      "Bold, angular strokes",
      "High x-height",
      "Open counters",
      "Exaggerated ascenders and descenders",
      "Hand-drawn quality",
      "Consistent letter widths"
    ],
    "personality_traits": [
      "Playful",
      "Energetic",
      "Informal",
      "Approachable",
      "Whimsical",
      "Bold",
      "Expressive"
    ],
    "practical_contexts": [
      "Headlines",
      "Logos",
      "Short bursts of text",
      "Branding for creative agencies",
      "Playful apps",
      "Street-style fashion brands"
    ],
    "cultural_intuition": [
      "Nostalgia for hand-drawn lettering",
      "Reminiscent of childhood scribbles or graffiti art",
      "Contemporary street culture",
      "Digital-native design",
      "Informal and playful communication"
    ],
    "search_keywords": [
      "Geometric sans-serif",
      "Bold",
      "Angular",
      "Playful",
      "Hand-drawn",
      "Informal",
      "Energetic",
      "High x-height",
      "Open counters",
      "Streetwear",
      "Digital",
      "Branding",
      "Logo",
      "Headline",
      "Creative",
      "Whimsical",
      "Nostalgic",
      "Graffiti",
      "Childlike"
    ]
  }
}