{
  "filename": "jefferson_36px.png",
  "status": "success",
  "description": {
    "detailed_description": "Font Jefferson embodies a classic calligraphic style with a contemporary twist. Its flowing strokes and elegant flourishes evoke the grace of traditional penmanship, yet its clean lines and consistent weight suggest a modern sensibility. The font's construction is based on a combination of organic curves and carefully controlled angles, creating a balance between fluidity and structure. The high x-height and open counters ensure excellent legibility, even at small sizes, making it suitable for both print and digital applications. The font's personality is both sophisticated and approachable, conveying a sense of warmth and authenticity. Its historical influences are evident in the graceful curves and delicate details, while its contemporary relevance is reflected in its clean execution and versatility. Jefferson's cultural associations range from the timeless elegance of handwritten correspondence to the modern aesthetic of minimalist design. Its versatility makes it ideal for a wide range of projects, from branding and packaging to website design and social media graphics. The font's ability to convey both sophistication and approachability makes it a powerful tool for creating a memorable and engaging visual identity.",
    "technical_characteristics": [
      "Calligraphic style",
      "High x-height",
      "Open counters",
      "Consistent weight",
      "Fluid strokes",
      "Controlled angles",
      "Elegant flourishes"
    ],
    "personality_traits": [
      "Sophisticated",
      "Approachable",
      "Warm",
      "Authentic",
      "Elegant",
      "Modern",
      "Versatile"
    ],
    "practical_contexts": [
      "Branding and packaging",
      "Website design",
      "Social media graphics",
      "Print publications",
      "Digital signage"
    ],
    "cultural_intuition": [
      "Timeless elegance of handwritten correspondence",
      "Modern aesthetic of minimalist design",
      "Sense of history and tradition",
      "Contemporary relevance and versatility",
      "Evokes a sense of warmth and authenticity"
    ],
    "search_keywords": [
      "Calligraphic",
      "Script",
      "Elegant",
      "Modern",
      "Versatile",
      "High x-height",
      "Open counters",
      "Consistent weight",
      "Branding",
      "Packaging",
      "Website design",
      "Social media",
      "Print",
      "Digital",
      "Sophisticated",
      "Approachable",
      "Warm",
      "Authentic",
      "Handwritten",
      "Minimalist"
    ]
  }
}