{
  "filename": "jellycious_36px.png",
  "status": "success",
  "description": {
    "detailed_description": "Jellycious is a playful script font that blends a classic calligraphic aesthetic with a contemporary, almost whimsical feel. Its flowing strokes and rounded forms evoke a sense of handwritten charm, while the consistent weight and subtle variations in letterforms create a sense of balance and readability. The font's generous x-height and open counters ensure legibility even at smaller sizes, making it suitable for both display and body text applications. The overall effect is one of warmth and approachability, suggesting a friendly and inviting tone. Jellycious's playful nature makes it ideal for branding projects that emphasize creativity and fun, while its readability ensures it can be used effectively for website copy, social media graphics, and even packaging design. The font's cultural resonance lies in its ability to evoke a sense of nostalgia for handwritten notes and personalized messages, while its contemporary feel makes it relevant for modern digital applications.",
    "technical_characteristics": [
      "flowing strokes",
      "rounded forms",
      "consistent weight",
      "generous x-height",
      "open counters",
      "subtle variations in letterforms"
    ],
    "personality_traits": [
      "playful",
      "whimsical",
      "handwritten",
      "approachable",
      "friendly",
      "inviting",
      "charming",
      "readable"
    ],
    "practical_contexts": [
      "branding projects",
      "website copy",
      "social media graphics",
      "packaging design",
      "display text",
      "body text"
    ],
    "cultural_intuition": [
      "evokes nostalgia for handwritten notes",
      "suggests a personalized touch",
      "contemporary feel",
      "relevant for modern digital applications"
    ],
    "search_keywords": [
      "script font",
      "playful",
      "whimsical",
      "handwritten",
      "calligraphic",
      "rounded forms",
      "flowing strokes",
      "generous x-height",
      "open counters",
      "readable",
      "display text",
      "body text",
      "branding",
      "website",
      "social media",
      "packaging",
      "nostalgia",
      "contemporary",
      "digital"
    ]
  }
}