{
  "filename": "jjweb2_36px.png",
  "status": "success",
  "description": {
    "detailed_description": "JJWeb2 is a hand-drawn typeface that captures the immediacy and informality of handwritten text. Its irregular letterforms, with their varying stroke weights and playful curves, evoke a sense of spontaneity and personal expression. The font's construction is decidedly organic, with each letterform feeling unique and slightly imperfect, adding to its charm. The generous x-height and open counters ensure good legibility, even at smaller sizes, making it suitable for both display and body text applications. While the overall impression is casual and friendly, the font's bold strokes and confident letterforms also convey a sense of strength and personality. JJWeb2's cultural resonance lies in its connection to the DIY aesthetic and the rise of digital hand lettering, reflecting a contemporary desire for authenticity and individuality. Its playful nature makes it ideal for projects that require a touch of whimsy and personality, such as branding for creative businesses, social media graphics, or informal publications.",
    "technical_characteristics": [
      "Hand-drawn style",
      "Irregular letterforms",
      "Varying stroke weights",
      "Open counters",
      "Generous x-height",
      "Organic construction",
      "Playful curves"
    ],
    "personality_traits": [
      "Spontaneous",
      "Informal",
      "Friendly",
      "Whimsical",
      "Bold",
      "Confident",
      "Personal"
    ],
    "practical_contexts": [
      "Display typography",
      "Branding for creative businesses",
      "Social media graphics",
      "Informal publications",
      "Body text at larger sizes"
    ],
    "cultural_intuition": [
      "DIY aesthetic",
      "Digital hand lettering",
      "Contemporary authenticity",
      "Individuality",
      "Playful expression"
    ],
    "search_keywords": [
      "hand-drawn",
      "script",
      "casual",
      "informal",
      "playful",
      "whimsical",
      "bold",
      "friendly",
      "legible",
      "display",
      "body text",
      "branding",
      "social media",
      "digital",
      "authentic",
      "individuality",
      "DIY",
      "hand lettering"
    ]
  }
}