{
  "filename": "jlee_36px.png",
  "status": "success",
  "description": {
    "detailed_description": "Jlee is a playful, hand-drawn font that evokes a sense of childlike wonder and casual charm. Its rounded forms and irregular strokes create a sense of spontaneity and warmth, reminiscent of handwritten notes or playful illustrations. The font's generous x-height and open counters ensure strong legibility, even at smaller sizes, making it suitable for both display and body text applications. The unevenness of the letterforms adds a touch of whimsy, while the overall consistency in weight and stroke thickness maintains a sense of balance and readability. Jlee's informal character makes it ideal for projects that require a friendly and approachable tone, such as children's books, branding for playful products, or social media graphics. Its hand-drawn aesthetic evokes a sense of authenticity and personal touch, adding a layer of warmth and personality to any design.",
    "technical_characteristics": [
      "Hand-drawn aesthetic",
      "Rounded letterforms",
      "Irregular strokes",
      "Generous x-height",
      "Open counters",
      "Consistent weight",
      "Uneven letterforms"
    ],
    "personality_traits": [
      "Playful",
      "Whimsical",
      "Friendly",
      "Approachable",
      "Casual",
      "Warm",
      "Authentic"
    ],
    "practical_contexts": [
      "Children's books",
      "Branding for playful products",
      "Social media graphics",
      "Display text",
      "Body text"
    ],
    "cultural_intuition": [
      "Evokes a sense of childlike wonder",
      "Suggests a personal touch",
      "Reflects a casual and informal tone",
      "Connects to a sense of authenticity"
    ],
    "search_keywords": [
      "Hand-drawn",
      "Playful",
      "Rounded",
      "Informal",
      "Whimsical",
      "Friendly",
      "Casual",
      "Legible",
      "Display font",
      "Body font",
      "Children's book",
      "Branding",
      "Social media",
      "Authentic",
      "Warm",
      "Charming"
    ]
  }
}