{
  "filename": "jobby_36px.png",
  "status": "success",
  "description": {
    "detailed_description": "This font embodies a raw, energetic spirit, reminiscent of hand-painted lettering. Its thick, uneven strokes and jagged terminals create a sense of immediacy and spontaneity. The letters are constructed with a distinct lack of uniformity, with each character exhibiting unique variations in stroke weight and angle. This irregularity adds to the font's dynamic character, suggesting a sense of movement and energy. The overall impression is one of bold, expressive communication, suitable for capturing attention and conveying a sense of authenticity. While the font's rough edges might not be ideal for extended reading, its bold presence makes it perfect for headlines, logos, and other graphic elements where impact is paramount. It evokes a sense of street art and urban culture, suggesting a rebellious and unconventional spirit.",
    "technical_characteristics": [
      "Uneven stroke weight",
      "Jagged terminals",
      "Variable letterforms",
      "High contrast",
      "Bold weight"
    ],
    "personality_traits": [
      "Energetic",
      "Spontaneous",
      "Expressive",
      "Unconventional",
      "Rebellious"
    ],
    "practical_contexts": [
      "Headlines",
      "Logos",
      "Posters",
      "Graphic elements",
      "Short text"
    ],
    "cultural_intuition": [
      "Street art",
      "Urban culture",
      "Rebellious spirit",
      "Authenticity",
      "Hand-painted aesthetic"
    ],
    "search_keywords": [
      "Hand-painted",
      "Brush script",
      "Urban",
      "Street art",
      "Energetic",
      "Bold",
      "Expressive",
      "Unconventional",
      "Headline",
      "Logo",
      "Graphic",
      "Display",
      "Rough",
      "Jagged",
      "Spontaneous",
      "Authentic",
      "Rebellious",
      "High contrast",
      "Uneven stroke weight",
      "Variable letterforms"
    ]
  }
}