{
  "filename": "jocky_starline_36px.png",
  "status": "success",
  "description": {
    "detailed_description": "Jockey Starline is a script typeface that embodies a classic, yet playful, spirit. Its flowing curves and generous letterforms evoke a sense of handwritten elegance, reminiscent of vintage signage and advertising. The font's construction is characterized by a combination of organic curves and carefully controlled angles, creating a balance between fluidity and structure. The generous x-height and open counters ensure excellent legibility, even at smaller sizes, while the subtle variations in stroke weight add visual interest and depth. The overall effect is one of confident charm, suggesting a sense of nostalgia and approachability. Jockey Starline's versatility makes it suitable for a wide range of applications, from branding and packaging to editorial design and social media graphics. Its playful nature lends itself well to headlines, logos, and other display uses, while its legibility makes it suitable for body text in smaller sizes. The font's cultural resonance lies in its connection to the golden age of American advertising, evoking a sense of optimism and Americana. Its contemporary relevance stems from its ability to add a touch of personality and warmth to digital designs, while still maintaining a sense of professionalism.",
    "technical_characteristics": [
      "flowing curves",
      "generous letterforms",
      "controlled angles",
      "generous x-height",
      "open counters",
      "subtle stroke weight variations"
    ],
    "personality_traits": [
      "playful",
      "elegant",
      "approachable",
      "confident",
      "nostalgic",
      "charming",
      "versatile"
    ],
    "practical_contexts": [
      "branding",
      "packaging",
      "editorial design",
      "social media graphics",
      "headlines",
      "logos",
      "display uses",
      "body text"
    ],
    "cultural_intuition": [
      "vintage signage",
      "American advertising",
      "optimism",
      "Americana",
      "nostalgia"
    ],
    "search_keywords": [
      "script typeface",
      "flowing curves",
      "generous letterforms",
      "controlled angles",
      "x-height",
      "open counters",
      "stroke weight variations",
      "playful",
      "elegant",
      "approachable",
      "confident",
      "nostalgic",
      "charming",
      "versatile",
      "branding",
      "packaging",
      "editorial design",
      "social media graphics",
      "headlines",
      "logos",
      "display uses",
      "body text",
      "vintage signage",
      "American advertising",
      "optimism",
      "Americana",
      "nostalgia"
    ]
  }
}