{
  "filename": "jolt_of_caffeine_36px.png",
  "status": "success",
  "description": {
    "detailed_description": "Jolt Of Caffeine is a display typeface that embodies a playful, energetic spirit. Its rounded, cartoonish forms are built with a distinct hand-drawn aesthetic, featuring uneven strokes and a slightly wobbly baseline. The font's exaggerated letterforms, particularly the tall ascenders and descenders, create a sense of dynamic movement and visual interest. This playful character is further emphasized by the inclusion of a variety of stylistic alternates, allowing for customization and a more personalized touch. While the font's informal nature makes it unsuitable for extended body text, it excels in headlines, logos, and other graphic elements where its bold personality can shine. Its hand-drawn quality evokes a sense of authenticity and warmth, making it ideal for projects that require a friendly and approachable tone. The font's bold, playful nature suggests a connection to contemporary digital culture, particularly in the realm of social media and online branding.",
    "technical_characteristics": [
      "Hand-drawn aesthetic",
      "Rounded, cartoonish forms",
      "Uneven strokes",
      "Exaggerated letterforms",
      "Tall ascenders and descenders",
      "Wobbly baseline",
      "Stylistic alternates"
    ],
    "personality_traits": [
      "Playful",
      "Energetic",
      "Informal",
      "Bold",
      "Friendly",
      "Approachable",
      "Authentic",
      "Warm",
      "Dynamic",
      "Customizable"
    ],
    "practical_contexts": [
      "Headlines",
      "Logos",
      "Graphic elements",
      "Social media graphics",
      "Online branding",
      "Short bursts of text"
    ],
    "cultural_intuition": [
      "Contemporary digital culture",
      "Social media",
      "Online branding",
      "Hand-drawn aesthetic",
      "Playful and energetic spirit"
    ],
    "search_keywords": [
      "display typeface",
      "hand-drawn",
      "rounded",
      "cartoonish",
      "playful",
      "energetic",
      "bold",
      "informal",
      "friendly",
      "approachable",
      "authentic",
      "warm",
      "dynamic",
      "customizable",
      "headlines",
      "logos",
      "graphic elements",
      "social media",
      "online branding",
      "digital culture",
      "contemporary",
      "casual",
      "fun",
      "whimsical",
      "quirky",
      "unique",
      "eye-catching",
      "memorable"
    ]
  }
}