{
  "filename": "jonas_36px.png",
  "status": "success",
  "description": {
    "detailed_description": "Jonas is a display typeface that blends a playful, hand-drawn aesthetic with a surprisingly legible structure. Its rounded, slightly irregular letterforms evoke a sense of casual energy, reminiscent of marker-drawn lettering. However, the font's consistent stroke weights and well-defined counters ensure readability even at smaller sizes. The generous x-height and open apertures contribute to its legibility, while the slightly angled terminals add a dynamic touch. Jonas's personality is both approachable and energetic, suggesting a sense of fun and informality. It's a font that feels both modern and nostalgic, referencing the hand-drawn aesthetic of vintage signage while maintaining a contemporary feel. Its versatility makes it suitable for a range of applications, from playful branding and social media graphics to eye-catching headlines and packaging designs. Jonas's hand-drawn quality evokes a sense of authenticity and human connection, making it ideal for projects that seek to convey a friendly and approachable tone.",
    "technical_characteristics": [
      "Rounded letterforms",
      "Irregular stroke variations",
      "Consistent stroke weights",
      "Generous x-height",
      "Open counters",
      "Angled terminals",
      "Hand-drawn aesthetic"
    ],
    "personality_traits": [
      "Playful",
      "Energetic",
      "Approachable",
      "Informal",
      "Modern",
      "Nostalgic",
      "Authentic",
      "Friendly"
    ],
    "practical_contexts": [
      "Branding",
      "Social media graphics",
      "Headlines",
      "Packaging design",
      "Display typography"
    ],
    "cultural_intuition": [
      "Vintage signage",
      "Hand-drawn lettering",
      "Modern design",
      "Casual communication",
      "Authenticity"
    ],
    "search_keywords": [
      "Display typeface",
      "Hand-drawn",
      "Rounded",
      "Irregular",
      "Legible",
      "Playful",
      "Energetic",
      "Approachable",
      "Informal",
      "Modern",
      "Nostalgic",
      "Branding",
      "Social media",
      "Headlines",
      "Packaging",
      "Vintage",
      "Authentic",
      "Casual",
      "Friendly"
    ]
  }
}