{
  "filename": "jr!_hand_36px.png",
  "status": "success",
  "description": {
    "detailed_description": "JR! Hand is a playful yet legible script font that captures the energy of handwritten text. Its flowing strokes and organic curves create a sense of movement and informality, while the consistent weight and clear letterforms ensure readability. The font's slightly angled baseline and varied ascenders and descenders add visual interest and a touch of dynamism. The overall impression is one of casual confidence, making it suitable for projects that require a friendly and approachable tone. While the font's handwritten aesthetic evokes a sense of authenticity and personal expression, its carefully crafted letterforms and consistent spacing ensure that it remains professional and polished. JR! Hand is particularly well-suited for branding, social media graphics, and digital content where a touch of personality and a sense of connection are desired.",
    "technical_characteristics": [
      "Organic curves",
      "Flowing strokes",
      "Varied ascenders and descenders",
      "Consistent weight",
      "Slightly angled baseline"
    ],
    "personality_traits": [
      "Playful",
      "Legible",
      "Casual",
      "Confident",
      "Approachable"
    ],
    "practical_contexts": [
      "Branding",
      "Social media graphics",
      "Digital content",
      "Handwritten-style typography",
      "Informal communications"
    ],
    "cultural_intuition": [
      "Evokes a sense of authenticity",
      "Suggests personal expression",
      "Reflects a contemporary, informal aesthetic",
      "Connects with a digital-native audience",
      "Captures the spirit of handwritten communication"
    ],
    "search_keywords": [
      "Script font",
      "Handwritten",
      "Playful",
      "Legible",
      "Casual",
      "Informal",
      "Branding",
      "Social media",
      "Digital content",
      "Organic",
      "Flowing",
      "Varied",
      "Consistent",
      "Angled",
      "Authentic",
      "Personal",
      "Contemporary",
      "Informal aesthetic",
      "Digital-native",
      "Handwritten communication"
    ]
  }
}