{
  "filename": "justy_three_36px.png",
  "status": "success",
  "description": {
    "detailed_description": "Justy Three embodies a playful yet legible handwritten aesthetic. Its rounded letterforms and consistent stroke weight create a sense of casual familiarity, while the slight variations in letterforms add a touch of personality. The font's generous x-height and open counters ensure readability even at smaller sizes, making it suitable for both display and body text. The overall impression is one of warmth and approachability, reminiscent of personal notes or handwritten signage. This makes it ideal for projects that seek a friendly and informal tone, such as branding for small businesses, social media graphics, or invitations. The font's casual charm evokes a sense of authenticity and connection, aligning with contemporary trends towards human-centered design.",
    "technical_characteristics": [
      "Rounded letterforms",
      "Consistent stroke weight",
      "Generous x-height",
      "Open counters",
      "Slight variations in letterforms"
    ],
    "personality_traits": [
      "Playful",
      "Legible",
      "Casual",
      "Friendly",
      "Approachable"
    ],
    "practical_contexts": [
      "Display text",
      "Body text",
      "Social media graphics",
      "Branding for small businesses",
      "Invitations"
    ],
    "cultural_intuition": [
      "Handwritten aesthetic",
      "Personal notes",
      "Informal communication",
      "Authenticity",
      "Connection"
    ],
    "search_keywords": [
      "Handwritten",
      "Script",
      "Casual",
      "Playful",
      "Legible",
      "Rounded",
      "Open counters",
      "Display",
      "Body text",
      "Social media",
      "Branding",
      "Small business",
      "Invitations",
      "Friendly",
      "Informal",
      "Authentic",
      "Connection"
    ]
  }
}