{
  "filename": "jw_script_36px.png",
  "status": "success",
  "description": {
    "detailed_description": "JW Script is a playful and expressive script font that captures the energy of handwritten lettering. Its flowing strokes and organic curves create a sense of movement and personality. The font's construction is based on a combination of calligraphic principles and digital refinement, resulting in a balance of natural charm and typographic precision. The ascenders and descenders are well-proportioned, ensuring legibility even at smaller sizes. The font's distinctive features include its slightly angled baseline, which adds a dynamic feel, and the subtle variations in stroke weight, which contribute to its handwritten aesthetic. While the font's overall character is lighthearted and informal, it also possesses a certain elegance due to the careful attention to detail in its design. JW Script is well-suited for a variety of applications, including branding, packaging, social media graphics, and handwritten-style typography. Its versatility allows it to be used for both casual and more formal projects, adding a touch of personality and warmth to any design. The font's cultural resonance lies in its connection to the tradition of handwritten calligraphy, evoking a sense of authenticity and personal expression. It also reflects the contemporary trend of embracing handwritten aesthetics in digital design, making it a relevant choice for projects that seek to convey a sense of warmth and human connection.",
    "technical_characteristics": [
      "flowing strokes",
      "organic curves",
      "angled baseline",
      "varied stroke weight",
      "well-proportioned ascenders and descenders",
      "calligraphic construction",
      "digital refinement"
    ],
    "personality_traits": [
      "playful",
      "expressive",
      "lighthearted",
      "informal",
      "elegant",
      "authentic",
      "personal",
      "warm",
      "dynamic"
    ],
    "practical_contexts": [
      "branding",
      "packaging",
      "social media graphics",
      "handwritten-style typography",
      "casual projects",
      "formal projects"
    ],
    "cultural_intuition": [
      "handwritten calligraphy",
      "authenticity",
      "personal expression",
      "contemporary handwritten aesthetics",
      "digital design",
      "human connection"
    ],
    "search_keywords": [
      "script font",
      "handwritten",
      "playful",
      "expressive",
      "organic",
      "flowing",
      "calligraphic",
      "digital",
      "refined",
      "legible",
      "versatile",
      "branding",
      "packaging",
      "social media",
      "typography",
      "casual",
      "formal",
      "authenticity",
      "personal",
      "warm",
      "dynamic",
      "contemporary",
      "handwritten aesthetics",
      "digital design",
      "human connection"
    ]
  }
}