{
  "filename": "kaisor_36px.png",
  "status": "success",
  "description": {
    "detailed_description": "This font exhibits a clean, geometric construction with a strong emphasis on verticality. The letterforms are composed of straight lines and sharp angles, creating a sense of precision and order. The x-height is relatively high, contributing to excellent legibility, especially in smaller sizes. The overall proportions are balanced, with a consistent weight distribution across the glyphs. The terminals are sharp and well-defined, adding to the font's crisp and modern aesthetic. The font's design personality is characterized by its confident and assertive nature. It evokes a sense of professionalism and authority, making it suitable for corporate branding and technical documentation. The font's historical influences are evident in its geometric construction, reminiscent of early 20th-century sans-serif designs. However, its contemporary relevance is undeniable, as it aligns with the current trend towards clean and minimalist aesthetics. The font's practical contexts include website design, mobile applications, and print materials where clarity and readability are paramount. Its sharp angles and strong verticality make it particularly effective for headlines and titles, while its high x-height ensures legibility in body text. The font's cultural intuition suggests a connection to modern technology and innovation. Its clean lines and geometric forms evoke a sense of efficiency and precision, aligning with the values often associated with the digital age.",
    "technical_characteristics": [
      "Geometric construction",
      "High x-height",
      "Sharp terminals",
      "Consistent weight distribution",
      "Strong verticality",
      "Open counters",
      "Balanced proportions"
    ],
    "personality_traits": [
      "Confident",
      "Assertive",
      "Professional",
      "Modern",
      "Clean",
      "Minimalist",
      "Efficient"
    ],
    "practical_contexts": [
      "Website design",
      "Mobile applications",
      "Print materials",
      "Headlines and titles",
      "Body text"
    ],
    "cultural_intuition": [
      "Modern technology",
      "Innovation",
      "Efficiency",
      "Precision",
      "Digital age"
    ],
    "search_keywords": [
      "Geometric sans-serif",
      "High x-height",
      "Sharp terminals",
      "Modern font",
      "Clean design",
      "Minimalist typography",
      "Professional font",
      "Website design",
      "Mobile app design",
      "Print typography",
      "Headlines",
      "Body text",
      "Digital age",
      "Innovation",
      "Technology"
    ]
  }
}