{
  "filename": "kamandungan_36px.png",
  "status": "success",
  "description": {
    "detailed_description": "Kamandungan is a display typeface that blends classic calligraphic flourishes with a playful, almost cartoonish energy. Its rounded forms and exaggerated curves give it a whimsical charm, while the bold strokes and contrasting weights create a sense of dynamism. The font's construction is based on a combination of geometric and organic principles, with the letterforms exhibiting a mix of precise curves and free-flowing strokes. This interplay between structure and spontaneity contributes to its unique personality. Kamandungan's generous x-height and open counters ensure good legibility, even at smaller sizes, making it suitable for headlines, logos, and other display applications. Its playful nature makes it ideal for projects that require a touch of whimsy or a sense of fun, while its bold presence ensures it can hold its own in a variety of contexts. The font's overall aesthetic evokes a sense of nostalgia, reminiscent of vintage signage and hand-drawn lettering, while its contemporary execution gives it a fresh and playful feel.",
    "technical_characteristics": [
      "rounded forms",
      "exaggerated curves",
      "bold strokes",
      "contrasting weights",
      "generous x-height",
      "open counters",
      "geometric and organic construction"
    ],
    "personality_traits": [
      "whimsical",
      "playful",
      "dynamic",
      "bold",
      "nostalgic",
      "vintage",
      "contemporary"
    ],
    "practical_contexts": [
      "headlines",
      "logos",
      "display typography",
      "packaging design",
      "children's books"
    ],
    "cultural_intuition": [
      "evokes a sense of nostalgia",
      "reminiscent of vintage signage",
      "suggests a playful and fun personality",
      "contemporary take on a classic style"
    ],
    "search_keywords": [
      "display typeface",
      "calligraphic",
      "rounded forms",
      "exaggerated curves",
      "bold strokes",
      "contrasting weights",
      "generous x-height",
      "open counters",
      "whimsical",
      "playful",
      "dynamic",
      "nostalgic",
      "vintage",
      "contemporary",
      "headlines",
      "logos",
      "display typography",
      "packaging design",
      "children's books"
    ]
  }
}