{
  "filename": "kampung_zombie_36px.png",
  "status": "success",
  "description": {
    "detailed_description": "Kampung Zombie is a display typeface that blends a playful, almost cartoonish aesthetic with a hint of gothic influence. The letters are constructed with a mix of rounded and angular forms, creating a dynamic and slightly unsettling visual rhythm. The rounded terminals and open counters contribute to a sense of approachability, while the jagged edges and subtle distortions add a touch of darkness. This combination of playful and eerie elements gives the font a unique personality, making it suitable for projects that require a touch of whimsy and a hint of the macabre. The font's bold strokes and generous x-height ensure good legibility, even at smaller sizes, making it suitable for headlines, logos, and other graphic elements. However, its distinctive character might not be ideal for large blocks of text, as the irregular forms could lead to fatigue. Kampung Zombie evokes a sense of playful rebellion, reminiscent of punk rock aesthetics and underground comics. It suggests a world where the ordinary is infused with a touch of the fantastical, making it perfect for projects that embrace the unexpected and the slightly unsettling.",
    "technical_characteristics": [
      "Rounded terminals",
      "Angular forms",
      "Open counters",
      "Jagged edges",
      "Distorted letterforms",
      "Bold strokes",
      "Generous x-height"
    ],
    "personality_traits": [
      "Playful",
      "Whimsical",
      "Eerie",
      "Unsettling",
      "Rebellious",
      "Bold",
      "Distinctive"
    ],
    "practical_contexts": [
      "Headlines",
      "Logos",
      "Graphic elements",
      "Posters",
      "T-shirt designs",
      "Social media graphics"
    ],
    "cultural_intuition": [
      "Punk rock aesthetics",
      "Underground comics",
      "Fantastical elements",
      "Playful rebellion",
      "Modern gothic"
    ],
    "search_keywords": [
      "Display typeface",
      "Rounded terminals",
      "Angular forms",
      "Open counters",
      "Jagged edges",
      "Distorted letterforms",
      "Bold strokes",
      "Generous x-height",
      "Playful",
      "Whimsical",
      "Eerie",
      "Unsettling",
      "Rebellious",
      "Gothic",
      "Punk rock",
      "Underground comics",
      "Fantastical",
      "Headlines",
      "Logos",
      "Graphic elements",
      "Posters",
      "T-shirt designs",
      "Social media graphics"
    ]
  }
}