{
  "filename": "kanada_36px.png",
  "status": "success",
  "description": {
    "detailed_description": "Kanada is a sans-serif typeface that embodies a playful yet legible aesthetic. Its rounded letterforms and slightly irregular curves create a sense of warmth and approachability, while its consistent stroke weights and open counters ensure readability even at small sizes. The font's overall character is friendly and inviting, reminiscent of handwritten notes or playful signage. This makes it suitable for a wide range of applications, from branding and packaging to website design and social media graphics. Its informal yet polished feel makes it particularly effective for projects that aim to convey a sense of approachability and authenticity. The font's cultural resonance lies in its connection to contemporary design trends that favor a more human-centric and expressive approach to typography. Its playful nature evokes a sense of optimism and creativity, aligning with the values of modern digital culture.",
    "technical_characteristics": [
      "Rounded letterforms",
      "Slightly irregular curves",
      "Consistent stroke weights",
      "Open counters",
      "High x-height"
    ],
    "personality_traits": [
      "Playful",
      "Approachable",
      "Friendly",
      "Inviting",
      "Legible"
    ],
    "practical_contexts": [
      "Branding and packaging",
      "Website design",
      "Social media graphics",
      "Display typography",
      "Editorial design"
    ],
    "cultural_intuition": [
      "Contemporary design trends",
      "Human-centric typography",
      "Expressive design",
      "Optimism and creativity",
      "Digital culture"
    ],
    "search_keywords": [
      "Sans-serif",
      "Rounded",
      "Playful",
      "Legible",
      "Friendly",
      "Handwritten",
      "Informal",
      "Modern",
      "Digital",
      "Branding",
      "Packaging",
      "Website",
      "Social media",
      "Display",
      "Editorial"
    ]
  }
}