{
  "filename": "karaoglan_36px.png",
  "status": "success",
  "description": {
    "detailed_description": "Karaoglan is a display typeface that captures the energy of hand-drawn lettering with a playful, almost cartoonish quality. Its irregular, gestural strokes and exaggerated proportions create a sense of movement and dynamism. The font's construction is based on a combination of geometric and organic elements, with rounded terminals and open counters that contribute to its friendly and approachable character. The unevenness of the letterforms adds a touch of whimsy, while the overall structure remains legible and balanced. Karaoglan's bold, expressive nature makes it ideal for headlines, logos, and other applications where a strong visual impact is desired. Its playful personality and casual aesthetic suggest a connection to contemporary digital culture, particularly in the realm of social media and online branding. The font's versatility allows it to be used in a variety of contexts, from playful children's books to edgy streetwear designs, adding a touch of personality and visual interest to any project.",
    "technical_characteristics": [
      "Irregular, gestural strokes",
      "Exaggerated proportions",
      "Rounded terminals",
      "Open counters",
      "Uneven letterforms",
      "Geometric and organic construction",
      "Bold weight"
    ],
    "personality_traits": [
      "Playful",
      "Whimsical",
      "Dynamic",
      "Expressive",
      "Friendly",
      "Approachable",
      "Casual"
    ],
    "practical_contexts": [
      "Headlines",
      "Logos",
      "Social media graphics",
      "Streetwear designs",
      "Children's books"
    ],
    "cultural_intuition": [
      "Contemporary digital culture",
      "Social media branding",
      "Street art aesthetic",
      "Playful and irreverent",
      "Casual and approachable"
    ],
    "search_keywords": [
      "display typeface",
      "hand-drawn",
      "gestural",
      "irregular",
      "exaggerated",
      "rounded terminals",
      "open counters",
      "bold",
      "playful",
      "whimsical",
      "dynamic",
      "casual",
      "approachable",
      "headlines",
      "logos",
      "social media",
      "streetwear",
      "children's books",
      "digital culture",
      "street art"
    ]
  }
}