{
  "filename": "karen_stencil_36px.png",
  "status": "success",
  "description": {
    "detailed_description": "Karen Stencil (G6px) is a bold, geometric sans-serif typeface that draws inspiration from classic stencil lettering. Its construction is defined by sharp, angular forms with a distinct lack of serifs, creating a strong, graphic presence. The letterforms are designed with a consistent width, resulting in a highly legible and balanced appearance. The font's bold weight and open counters contribute to its high readability, even at smaller sizes. The overall character of Karen Stencil (G6px) is assertive and confident, with a touch of retro charm. Its geometric construction evokes a sense of order and precision, while the slightly rounded terminals soften the edges, adding a touch of approachability. This balance makes it suitable for a wide range of applications, from bold headlines and branding to digital interfaces and signage. The font's strong visual impact and clear legibility make it ideal for conveying a message of authority and confidence, while its retro aesthetic adds a touch of nostalgia and personality. ",
    "technical_characteristics": [
      "geometric construction",
      "sans-serif",
      "bold weight",
      "consistent width",
      "open counters",
      "sharp terminals",
      "rounded terminals"
    ],
    "personality_traits": [
      "assertive",
      "confident",
      "graphic",
      "retro",
      "legible",
      "approachable",
      "bold"
    ],
    "practical_contexts": [
      "bold headlines",
      "branding",
      "digital interfaces",
      "signage",
      "posters"
    ],
    "cultural_intuition": [
      "evokes mid-century design",
      "suggests urban street art",
      "reminiscent of vintage signage",
      "conveys a sense of authority",
      "adds a touch of nostalgia"
    ],
    "search_keywords": [
      "stencil",
      "sans-serif",
      "geometric",
      "bold",
      "graphic",
      "retro",
      "legible",
      "confident",
      "urban",
      "vintage",
      "signage",
      "headlines",
      "branding",
      "digital",
      "interface",
      "poster",
      "authority",
      "nostalgia"
    ]
  }
}