{
  "filename": "kasuki_hand_36px.png",
  "status": "success",
  "description": {
    "detailed_description": "Kasuki Hand is a playful, handwritten font that captures the energy of casual scribbles. Its irregular letterforms and uneven stroke weights create a sense of spontaneity and immediacy. The rounded terminals and open counters contribute to its friendly and approachable character. While the font's construction is inherently informal, it maintains a degree of legibility through its consistent baseline and clear letter shapes. This makes it suitable for a range of applications, from casual social media posts to playful branding elements. The font's hand-drawn aesthetic evokes a sense of personal connection and authenticity, making it ideal for projects that aim to communicate warmth and approachability. Its informal nature also suggests a sense of youthful energy and creativity, making it a good choice for projects targeting younger audiences.",
    "technical_characteristics": [
      "Handwritten style",
      "Irregular letterforms",
      "Uneven stroke weights",
      "Rounded terminals",
      "Open counters",
      "Consistent baseline",
      "Clear letter shapes"
    ],
    "personality_traits": [
      "Playful",
      "Spontaneous",
      "Informal",
      "Friendly",
      "Approachable",
      "Authentic",
      "Youthful"
    ],
    "practical_contexts": [
      "Social media posts",
      "Branding elements",
      "Casual signage",
      "Handwritten notes",
      "Digital illustrations"
    ],
    "cultural_intuition": [
      "Evokes a sense of personal connection",
      "Suggests authenticity and warmth",
      "Reflects a youthful and creative spirit",
      "Connects to the trend of hand-drawn aesthetics"
    ],
    "search_keywords": [
      "Handwritten",
      "Playful",
      "Informal",
      "Casual",
      "Rounded",
      "Open counters",
      "Legible",
      "Social media",
      "Branding",
      "Youthful",
      "Creative",
      "Authentic",
      "Hand-drawn",
      "Script",
      "Display"
    ]
  }
}