{
  "filename": "katas_36px.png",
  "status": "success",
  "description": {
    "detailed_description": "Katas is a sans-serif typeface that blends geometric construction with subtle humanist details, resulting in a font that is both modern and approachable. The letterforms are built upon a grid system, evident in the consistent proportions and clean lines. However, the slightly rounded terminals and open counters add a touch of warmth and personality, preventing the font from feeling overly rigid or cold. This balance between geometric precision and humanist nuance makes Katas versatile for a range of applications, from corporate branding to digital interfaces. Its high x-height and open counters ensure strong legibility, even at smaller sizes, making it suitable for both print and screen. The overall character of Katas is confident and contemporary, suggesting a sense of innovation and forward-thinking. Its clean lines and modern aesthetic evoke a sense of efficiency and clarity, while the subtle humanist touches add a touch of approachability and warmth. Katas is a font that feels both timeless and relevant, capable of conveying a sense of professionalism without sacrificing personality.",
    "technical_characteristics": [
      "Geometric construction",
      "High x-height",
      "Open counters",
      "Slightly rounded terminals",
      "Consistent proportions",
      "Clean lines",
      "Strong legibility"
    ],
    "personality_traits": [
      "Confidently geometric",
      "Subtly humanist",
      "Modern and approachable",
      "Versatile and adaptable",
      "Clear and efficient",
      "Warm and inviting",
      "Timeless and relevant"
    ],
    "practical_contexts": [
      "Corporate branding",
      "Digital interfaces",
      "Web design",
      "Mobile applications",
      "Print materials"
    ],
    "cultural_intuition": [
      "Evokes a sense of innovation and forward-thinking",
      "Suggests a modern and digital aesthetic",
      "Conveys a sense of professionalism and clarity",
      "Feels both timeless and relevant",
      "Appeals to a wide range of audiences"
    ],
    "search_keywords": [
      "Sans-serif",
      "Geometric",
      "Humanist",
      "Modern",
      "Approachable",
      "Versatile",
      "Legible",
      "Corporate",
      "Digital",
      "Web",
      "Mobile",
      "Print",
      "Branding",
      "Interface",
      "Design",
      "Innovation",
      "Clarity",
      "Professional",
      "Timeless",
      "Relevant"
    ]
  }
}