{
  "filename": "kaylafiz_36px.png",
  "status": "success",
  "description": {
    "detailed_description": "Kaylafiz is a playful sans-serif font that blends a rounded, approachable aesthetic with a touch of retro charm. Its generous curves and open counters create a sense of warmth and accessibility, while the slightly condensed letterforms and bold weight add a touch of confidence. The font's construction is based on a combination of geometric and humanist principles, resulting in a balance between clarity and personality. The rounded terminals and slightly flared serifs on the lowercase letters contribute to its friendly character, while the consistent stroke weight and well-defined letterforms ensure good legibility. Kaylafiz is well-suited for a variety of applications, from branding and signage to editorial design and digital interfaces. Its playful nature makes it ideal for projects that require a touch of whimsy and personality, while its strong legibility ensures that it can be used effectively in a variety of sizes and contexts. The font's retro aesthetic evokes a sense of nostalgia and optimism, reminiscent of mid-century design trends. Its playful character and approachable style make it a versatile choice for projects that aim to connect with a wide audience.",
    "technical_characteristics": [
      "rounded letterforms",
      "open counters",
      "condensed letterforms",
      "bold weight",
      "consistent stroke weight",
      "geometric construction",
      "humanist details",
      "rounded terminals",
      "flared serifs"
    ],
    "personality_traits": [
      "playful",
      "approachable",
      "friendly",
      "confident",
      "optimistic",
      "retro",
      "whimsical",
      "accessible",
      "versatile"
    ],
    "practical_contexts": [
      "branding",
      "signage",
      "editorial design",
      "digital interfaces",
      "display typography",
      "large-scale applications"
    ],
    "cultural_intuition": [
      "mid-century design",
      "nostalgia",
      "optimism",
      "playfulness",
      "approachability"
    ],
    "search_keywords": [
      "sans-serif",
      "rounded",
      "playful",
      "retro",
      "bold",
      "condensed",
      "open counters",
      "geometric",
      "humanist",
      "legible",
      "versatile",
      "branding",
      "signage",
      "editorial",
      "digital",
      "display",
      "large-scale",
      "mid-century",
      "nostalgia",
      "optimism",
      "whimsical",
      "approachable",
      "friendly",
      "confident",
      "accessible"
    ]
  }
}