{
  "filename": "kehdrai_36px.png",
  "status": "success",
  "description": {
    "detailed_description": "This font is a bold and angular display typeface that draws inspiration from both ancient runes and modern geometric design. Its sharp, diagonal strokes and pronounced serifs create a strong visual impact, while the consistent width of the characters and the open counters ensure good legibility even at large sizes. The font's overall character is confident and assertive, with a hint of mystery and intrigue. It evokes a sense of power and authority, making it suitable for branding, headlines, and other applications where a strong visual statement is desired. The font's bold and angular design also lends itself well to digital applications, particularly in web design and mobile interfaces. Its sharp edges and contrasting strokes create a visually striking presence on screen, while its clear legibility ensures readability even at smaller sizes. The font's cultural associations are complex, drawing on both ancient traditions and contemporary design trends. Its rune-like forms evoke a sense of history and mythology, while its geometric construction and bold presence suggest a modern and forward-thinking aesthetic. This combination of historical and contemporary elements makes it a versatile typeface that can be used to create a wide range of visual effects.",
    "technical_characteristics": [
      "Geometric construction",
      "Angular strokes",
      "Pronounced serifs",
      "Consistent character width",
      "Open counters",
      "Bold weight",
      "High contrast"
    ],
    "personality_traits": [
      "Confident",
      "Assertive",
      "Intriguing",
      "Powerful",
      "Authoritative",
      "Modern",
      "Forward-thinking"
    ],
    "practical_contexts": [
      "Branding",
      "Headlines",
      "Posters",
      "Web design",
      "Mobile interfaces",
      "Large-scale displays"
    ],
    "cultural_intuition": [
      "Ancient runes",
      "Mythology",
      "Modern geometric design",
      "Power and authority",
      "Digital culture"
    ],
    "search_keywords": [
      "Geometric",
      "Angular",
      "Display",
      "Bold",
      "Serif",
      "Rune",
      "Ancient",
      "Modern",
      "Powerful",
      "Authoritative",
      "Intriguing",
      "Branding",
      "Headlines",
      "Web design",
      "Mobile",
      "Digital",
      "Large-scale",
      "Display typeface",
      "High contrast",
      "Open counters",
      "Consistent width"
    ]
  }
}