{
  "filename": "kells_sd_36px.png",
  "status": "success",
  "description": {
    "detailed_description": "Kells SD is a blackletter typeface that blends traditional calligraphic forms with a contemporary digital sensibility. Its construction is rooted in the classic gothic script, evident in the pointed arches, extended ascenders, and intricate flourishes. However, the font's digital origins are apparent in its clean, crisp lines and consistent stroke weights, creating a balance between historical authenticity and modern readability. The high x-height and open counters ensure legibility even at smaller sizes, making it suitable for both display and body text applications. The font's overall character is both elegant and playful, evoking a sense of history and tradition while remaining approachable and engaging. Its cultural associations range from medieval manuscripts and illuminated texts to contemporary graphic design trends, suggesting a timeless appeal that transcends specific eras. Kells SD is a versatile typeface that can be used for a wide range of projects, from branding and packaging to editorial design and web interfaces, adding a touch of sophistication and personality to any design.",
    "technical_characteristics": [
      "Blackletter construction",
      "High x-height",
      "Open counters",
      "Consistent stroke weights",
      "Intricate flourishes",
      "Pointed arches",
      "Extended ascenders"
    ],
    "personality_traits": [
      "Elegant",
      "Playful",
      "Sophisticated",
      "Approachable",
      "Engaging",
      "Timeless",
      "Versatile"
    ],
    "practical_contexts": [
      "Display typography",
      "Body text",
      "Branding",
      "Packaging",
      "Editorial design",
      "Web interfaces"
    ],
    "cultural_intuition": [
      "Medieval manuscripts",
      "Illuminated texts",
      "Contemporary graphic design",
      "Historical authenticity",
      "Modern readability"
    ],
    "search_keywords": [
      "Blackletter",
      "Gothic",
      "Calligraphic",
      "Script",
      "Display",
      "Body text",
      "Branding",
      "Packaging",
      "Editorial",
      "Web",
      "Elegant",
      "Playful",
      "Sophisticated",
      "Approachable",
      "Engaging",
      "Timeless",
      "Versatile",
      "Medieval",
      "Illuminated",
      "Contemporary",
      "Digital",
      "Traditional",
      "Modern"
    ]
  }
}