{
  "filename": "kestoy_selfie_36px.png",
  "status": "success",
  "description": {
    "detailed_description": "This font, with its bold strokes and playful curves, embodies a sense of energetic informality. The rounded terminals and generous x-height contribute to a friendly, approachable feel, while the slight slant and uneven letterforms add a touch of whimsy. The overall construction is organic, with a clear emphasis on visual impact over strict geometric precision. This makes it ideal for headlines, branding elements, and casual digital content where a sense of personality and visual interest are paramount. The font's playful nature evokes a sense of youthful energy and creative expression, reminiscent of hand-drawn lettering styles popular in the 1990s and early 2000s. It's a font that feels both nostalgic and contemporary, capable of adding a touch of personality to a wide range of projects.",
    "technical_characteristics": [
      "rounded terminals",
      "generous x-height",
      "slanted baseline",
      "uneven letterforms",
      "bold strokes",
      "organic construction",
      "playful curves"
    ],
    "personality_traits": [
      "energetic",
      "informal",
      "friendly",
      "approachable",
      "whimsical",
      "youthful",
      "creative",
      "nostalgic",
      "contemporary"
    ],
    "practical_contexts": [
      "headlines",
      "branding elements",
      "casual digital content",
      "social media graphics",
      "posters and flyers"
    ],
    "cultural_intuition": [
      "evokes a sense of youthful energy",
      "reminiscent of 1990s and early 2000s design",
      "feels both nostalgic and contemporary",
      "suggests a playful and creative spirit",
      "captures a sense of digital-native informality"
    ],
    "search_keywords": [
      "rounded terminals",
      "generous x-height",
      "slanted baseline",
      "uneven letterforms",
      "bold strokes",
      "organic construction",
      "playful curves",
      "informal",
      "whimsical",
      "youthful",
      "creative",
      "nostalgic",
      "contemporary",
      "headlines",
      "branding",
      "digital content",
      "social media",
      "posters",
      "flyers"
    ]
  }
}