{
  "filename": "kid_nightmare_36px.png",
  "status": "success",
  "description": {
    "detailed_description": "Kid Nightmare is a display typeface that leans heavily into a playful, almost cartoonish aesthetic. Its defining characteristic is the exaggerated dripping effect, achieved through a combination of thick, uneven strokes and a distinct outline. This creates a sense of movement and energy, as if the letters are melting or dripping down a surface. The font's construction is primarily geometric, with sharp angles and a consistent baseline, but the dripping effect adds a touch of organic irregularity. This balance between geometric structure and organic distortion contributes to the font's playful and slightly unsettling character. While the dripping effect is visually striking, it can also make the font challenging to read in extended text. Its primary application is as a display typeface for headlines, logos, or short bursts of text where its unique visual impact can be fully appreciated. The font's playful and slightly unsettling nature evokes a sense of childhood nostalgia, perhaps recalling the fantastical creatures and worlds of children's books or cartoons. It also carries a hint of the macabre, suggesting a playful but slightly sinister undercurrent. This duality makes it suitable for projects that aim to capture a sense of whimsy and intrigue, perhaps for Halloween-themed designs, children's products, or even edgy branding that seeks to stand out.",
    "technical_characteristics": [
      "Exaggerated dripping effect",
      "Thick, uneven strokes",
      "Distinct outline",
      "Geometric construction",
      "Sharp angles",
      "Consistent baseline",
      "Organic distortion"
    ],
    "personality_traits": [
      "Playful",
      "Whimsical",
      "Energetic",
      "Slightly unsettling",
      "Cartoonish",
      "Nostalgic",
      "Sinister"
    ],
    "practical_contexts": [
      "Headlines",
      "Logos",
      "Short bursts of text",
      "Display typography",
      "Children's products",
      "Halloween-themed designs",
      "Edgy branding"
    ],
    "cultural_intuition": [
      "Childhood nostalgia",
      "Fantastical creatures",
      "Children's books",
      "Cartoons",
      "Macabre",
      "Playful but sinister"
    ],
    "search_keywords": [
      "Kid Nightmare",
      "Display typeface",
      "Dripping effect",
      "Geometric construction",
      "Organic distortion",
      "Playful",
      "Whimsical",
      "Cartoonish",
      "Nostalgic",
      "Sinister",
      "Halloween",
      "Children's products",
      "Edgy branding",
      "Headline font",
      "Logo font"
    ]
  }
}