{
  "filename": "kidings_free_36px.png",
  "status": "success",
  "description": {
    "detailed_description": "This font is a collection of pictograms, each representing a distinct object or activity. The style is decidedly utilitarian, prioritizing clarity and recognition over aesthetic embellishment. The glyphs are constructed with simple, geometric shapes, often employing bold outlines and minimal detail. This approach ensures high legibility, even at small sizes, making them ideal for signage, icons, and other applications where quick comprehension is paramount. The overall character is straightforward and functional, conveying a sense of directness and efficiency. While lacking in decorative flourishes, the font possesses a certain charm in its unpretentious simplicity, reminiscent of vintage industrial graphics or early digital interfaces. Its straightforward nature makes it suitable for a wide range of applications, from safety signage and technical manuals to mobile apps and website interfaces. The font's cultural resonance lies in its association with practicality and functionality, evoking a sense of order and clarity often found in industrial settings or technical environments.",
    "technical_characteristics": [
      "Geometric construction",
      "Bold outlines",
      "Minimal detail",
      "Simple shapes",
      "High contrast",
      "Consistent stroke weight",
      "Limited glyph variation"
    ],
    "personality_traits": [
      "Straightforward",
      "Functional",
      "Direct",
      "Efficient",
      "Unpretentious",
      "Clear",
      "Practical"
    ],
    "practical_contexts": [
      "Signage",
      "Icons",
      "Technical manuals",
      "Mobile apps",
      "Website interfaces",
      "Safety instructions"
    ],
    "cultural_intuition": [
      "Industrial design",
      "Vintage graphics",
      "Early digital interfaces",
      "Practicality",
      "Functionality",
      "Order",
      "Clarity"
    ],
    "search_keywords": [
      "Pictogram",
      "Icon",
      "Geometric",
      "Bold",
      "Simple",
      "Utilitarian",
      "Clear",
      "Functional",
      "Straightforward",
      "Industrial",
      "Vintage",
      "Digital",
      "Signage",
      "Safety",
      "Technical",
      "Mobile",
      "Website",
      "App",
      "Interface"
    ]
  }
}