{
  "filename": "kids_zone_36px.png",
  "status": "success",
  "description": {
    "detailed_description": "This font, with its playful curves and rounded terminals, evokes a sense of childlike wonder and carefree energy. The lowercase letters, particularly the 'a' and 'g', are particularly expressive, with their rounded forms and exaggerated curves. The overall construction is relaxed and informal, with a slight slant that adds a touch of dynamism. The font's generous x-height and open counters ensure good legibility, even at smaller sizes, making it suitable for children's books, playful branding, or casual digital interfaces. The font's overall character suggests a sense of fun and lightheartedness, reminiscent of hand-drawn lettering or vintage cartoon typography. It's a font that invites interaction and engagement, making it ideal for projects that aim to capture a sense of youthful energy and playful spirit.",
    "technical_characteristics": [
      "Rounded terminals",
      "Playful curves",
      "Generous x-height",
      "Open counters",
      "Slight slant",
      "Informal construction",
      "Expressive lowercase"
    ],
    "personality_traits": [
      "Playful",
      "Carefree",
      "Energetic",
      "Informal",
      "Dynamic",
      "Expressive",
      "Lighthearted"
    ],
    "practical_contexts": [
      "Children's books",
      "Playful branding",
      "Casual digital interfaces",
      "Hand-drawn lettering",
      "Vintage cartoon typography"
    ],
    "cultural_intuition": [
      "Childlike wonder",
      "Carefree energy",
      "Fun and lightheartedness",
      "Vintage cartoon aesthetic",
      "Hand-drawn lettering style"
    ],
    "search_keywords": [
      "Rounded",
      "Playful",
      "Informal",
      "Childlike",
      "Energetic",
      "Hand-drawn",
      "Cartoon",
      "Vintage",
      "Casual",
      "Digital",
      "Branding",
      "Children's",
      "Book",
      "Interface",
      "Legible",
      "Expressive",
      "Lighthearted",
      "Fun",
      "Dynamic",
      "Curvy",
      "Slant",
      "Open counters",
      "Generous x-height"
    ]
  }
}