{
  "filename": "kingthings_willow_36px.png",
  "status": "success",
  "description": {
    "detailed_description": "Kingthings Willow is a display typeface that blends classic calligraphic flourishes with a playful, whimsical spirit. Its rounded, bulbous letterforms, reminiscent of early printing styles, are softened by delicate, hand-drawn embellishments. These flourishes, often incorporating swirls and stars, add a touch of whimsy and charm, while maintaining a sense of balance and legibility. The font's generous x-height and open counters ensure readability even at smaller sizes, making it suitable for headlines, logos, and decorative elements. The overall effect is one of playful elegance, evoking a sense of vintage charm and handcrafted artistry. While its decorative nature makes it ideal for adding a touch of personality to invitations, packaging, and children's books, its strong legibility also allows for use in short, impactful headlines or branding elements.",
    "technical_characteristics": [
      "rounded letterforms",
      "calligraphic flourishes",
      "generous x-height",
      "open counters",
      "decorative embellishments",
      "hand-drawn style",
      "variable stroke weights"
    ],
    "personality_traits": [
      "playful",
      "whimsical",
      "charming",
      "elegant",
      "vintage",
      "handcrafted",
      "decorative"
    ],
    "practical_contexts": [
      "headlines",
      "logos",
      "invitations",
      "packaging",
      "children's books",
      "decorative elements",
      "branding"
    ],
    "cultural_intuition": [
      "evokes a sense of vintage charm",
      "suggests handcrafted artistry",
      "reminiscent of early printing styles",
      "captures a playful, whimsical spirit",
      "ideal for adding a touch of personality"
    ],
    "search_keywords": [
      "display font",
      "calligraphic",
      "flourishes",
      "rounded letterforms",
      "whimsical",
      "vintage",
      "decorative",
      "hand-drawn",
      "playful",
      "elegant",
      "legible",
      "headlines",
      "logos",
      "invitations",
      "packaging",
      "children's books",
      "branding",
      "charm",
      "art",
      "craft"
    ]
  }
}