{
  "filename": "king_arthur_36px.png",
  "status": "success",
  "description": {
    "detailed_description": "King Arthur PX is a blackletter typeface that blends traditional gothic forms with a touch of playful whimsy. Its construction is rooted in classic blackletter anatomy, featuring sharp, angular strokes and intricate flourishes. The ascenders and descenders are elongated, creating a sense of verticality and grandeur. However, the font's personality is softened by the inclusion of rounded terminals and subtle curves in the letterforms, particularly in the lowercase. This combination of sharp and rounded elements creates a visual tension that adds a touch of whimsy to the otherwise formal design. The font's overall character is both elegant and approachable, making it suitable for a range of applications, from formal invitations and book covers to whimsical branding and digital interfaces. Its historical influences are evident in the classic blackletter structure, while its contemporary relevance is found in its ability to add a touch of personality and charm to modern designs. The font's cultural associations evoke a sense of medieval chivalry and romance, while its playful elements suggest a modern sensibility. King Arthur PX is a versatile typeface that can be used to create a range of visual effects, from traditional and elegant to whimsical and playful.",
    "technical_characteristics": [
      "Blackletter construction",
      "Sharp, angular strokes",
      "Intricate flourishes",
      "Elongated ascenders and descenders",
      "Rounded terminals",
      "Subtle curves in lowercase",
      "High x-height"
    ],
    "personality_traits": [
      "Elegant",
      "Approachable",
      "Whimsical",
      "Playful",
      "Formal",
      "Grand",
      "Charming"
    ],
    "practical_contexts": [
      "Formal invitations",
      "Book covers",
      "Branding",
      "Digital interfaces",
      "Headlines",
      "Titles",
      "Decorative elements"
    ],
    "cultural_intuition": [
      "Medieval chivalry",
      "Romance",
      "Modern sensibility",
      "Playfulness",
      "Elegance"
    ],
    "search_keywords": [
      "Blackletter",
      "Gothic",
      "Medieval",
      "Formal",
      "Elegant",
      "Whimsical",
      "Playful",
      "Charming",
      "Rounded terminals",
      "Intricate flourishes",
      "High x-height",
      "Branding",
      "Digital",
      "Typography",
      "Font",
      "Typeface",
      "Design",
      "Art",
      "Culture",
      "History"
    ]
  }
}