{
  "filename": "komikula_36px.png",
  "status": "success",
  "description": {
    "detailed_description": "Komikula is a playful script font that captures the energy of hand-drawn lettering. Its organic curves and uneven strokes create a sense of spontaneity and warmth, reminiscent of casual handwritten notes. The font's generous x-height and open counters ensure good legibility, even at smaller sizes, making it suitable for both display and body text. The slightly irregular baseline adds to its informal character, while the consistent stroke weight provides a sense of balance. Komikula's personality is both friendly and approachable, suggesting a sense of humor and lightheartedness. It evokes a sense of nostalgia for handwritten communication, while also feeling fresh and contemporary. Its versatility makes it ideal for branding, packaging, social media graphics, and even children's books, where its playful nature can engage young readers.",
    "technical_characteristics": [
      "Organic curves",
      "Uneven strokes",
      "Generous x-height",
      "Open counters",
      "Slightly irregular baseline",
      "Consistent stroke weight"
    ],
    "personality_traits": [
      "Playful",
      "Spontaneous",
      "Warm",
      "Friendly",
      "Approachable",
      "Informal",
      "Nostalgic",
      "Contemporary"
    ],
    "practical_contexts": [
      "Branding",
      "Packaging",
      "Social media graphics",
      "Children's books",
      "Display text",
      "Body text"
    ],
    "cultural_intuition": [
      "Handwritten communication",
      "Nostalgia for analog",
      "Modern digital culture",
      "Casual and friendly",
      "Lighthearted and playful"
    ],
    "search_keywords": [
      "Script font",
      "Handwritten",
      "Playful",
      "Organic",
      "Casual",
      "Friendly",
      "Approachable",
      "Nostalgic",
      "Contemporary",
      "Display",
      "Body text",
      "Branding",
      "Packaging",
      "Social media",
      "Children's books",
      "Legibility",
      "Versatility"
    ]
  }
}