{
  "filename": "koshas_36px.png",
  "status": "success",
  "description": {
    "detailed_description": "Koshas is a display typeface that combines a bold, geometric construction with a playful, almost cartoonish execution. The letters are built from a series of stacked, slightly offset rectangles, creating a distinct three-dimensional effect. This construction gives the font a strong, confident presence, while the exaggerated proportions and rounded terminals add a touch of whimsy. The overall effect is a font that is both eye-catching and approachable, making it suitable for headlines, logos, and other applications where a strong visual impact is desired. The font's playful nature is further enhanced by the inclusion of a variety of stylistic alternates, allowing for a degree of customization and personality. While the font's bold construction and playful nature make it well-suited for digital applications, its retro aesthetic also lends itself to print projects with a vintage feel. The font's bold, geometric construction evokes a sense of power and authority, while the playful execution adds a touch of whimsy and approachability. This combination makes Koshas a versatile font that can be used to create a wide range of visual effects.",
    "technical_characteristics": [
      "geometric construction",
      "stacked rectangles",
      "exaggerated proportions",
      "rounded terminals",
      "three-dimensional effect",
      "stylistic alternates"
    ],
    "personality_traits": [
      "bold",
      "confident",
      "playful",
      "whimsical",
      "approachable",
      "retro",
      "vintage",
      "eye-catching"
    ],
    "practical_contexts": [
      "headlines",
      "logos",
      "posters",
      "digital interfaces",
      "print projects"
    ],
    "cultural_intuition": [
      "evokes a sense of power and authority",
      "suggests a playful and approachable personality",
      "has a retro aesthetic",
      "lends itself to vintage-inspired designs",
      "is well-suited for digital applications"
    ],
    "search_keywords": [
      "geometric",
      "display",
      "bold",
      "playful",
      "retro",
      "vintage",
      "three-dimensional",
      "exaggerated",
      "rounded",
      "stacked",
      "headlines",
      "logos",
      "posters",
      "digital",
      "print",
      "whimsical",
      "approachable",
      "eye-catching",
      "customizable",
      "power",
      "authority"
    ]
  }
}