{
  "filename": "kotak_36px.png",
  "status": "success",
  "description": {
    "detailed_description": "This font, with its distinct isometric construction, presents a playful and engaging visual experience. Each letterform is built from simple geometric shapes, creating a sense of solidity and structure. The consistent use of angled planes and sharp corners adds a dynamic energy to the design, while the subtle variations in letterform proportions contribute to a sense of visual interest. The font's bold and confident character is further emphasized by the use of thick strokes and a generous x-height, ensuring strong legibility even at smaller sizes. This playful yet structured design makes it ideal for headlines, logos, and other applications where a bold and eye-catching visual is desired. The font's inherent three-dimensionality evokes a sense of playful energy and a connection to the digital world, making it particularly well-suited for projects that aim to capture a sense of fun and innovation.",
    "technical_characteristics": [
      "isometric construction",
      "geometric shapes",
      "angled planes",
      "sharp corners",
      "thick strokes",
      "generous x-height",
      "consistent proportions"
    ],
    "personality_traits": [
      "playful",
      "dynamic",
      "bold",
      "confident",
      "structured",
      "eye-catching",
      "three-dimensional"
    ],
    "practical_contexts": [
      "headlines",
      "logos",
      "posters",
      "digital interfaces",
      "game design"
    ],
    "cultural_intuition": [
      "evokes a sense of playful energy",
      "suggests a connection to the digital world",
      "reminiscent of early video game graphics",
      "captures a sense of fun and innovation",
      "reflects a contemporary design aesthetic"
    ],
    "search_keywords": [
      "isometric",
      "geometric",
      "3d",
      "bold",
      "playful",
      "dynamic",
      "eye-catching",
      "headline",
      "logo",
      "digital",
      "game",
      "fun",
      "innovation",
      "contemporary",
      "retro",
      "video game",
      "futuristic",
      "graphic",
      "design"
    ]
  }
}