{
  "filename": "kremlin_czar_36px.png",
  "status": "success",
  "description": {
    "detailed_description": "This font, with its bold, geometric construction and intricate details, evokes a sense of power and authority. The sharp angles and heavy strokes create a strong visual presence, reminiscent of medieval heraldry or gothic architecture. The intricate flourishes and serifs, however, add a touch of elegance and sophistication, preventing the design from feeling overly aggressive. The font's high x-height and open counters ensure excellent legibility, even at small sizes, making it suitable for both display and body text applications. Its bold character and historical references make it ideal for projects that require a sense of tradition, strength, or grandeur, such as branding for luxury goods, historical documentaries, or even fantasy-themed video games.",
    "technical_characteristics": [
      "Geometric construction",
      "Heavy strokes",
      "Sharp angles",
      "Intricate flourishes",
      "High x-height",
      "Open counters",
      "Serif details"
    ],
    "personality_traits": [
      "Authoritative",
      "Powerful",
      "Elegant",
      "Sophisticated",
      "Traditional",
      "Grand",
      "Bold"
    ],
    "practical_contexts": [
      "Display typography",
      "Branding for luxury goods",
      "Historical documentaries",
      "Fantasy-themed video games",
      "Headlines and titles"
    ],
    "cultural_intuition": [
      "Medieval heraldry",
      "Gothic architecture",
      "Historical grandeur",
      "Power and authority",
      "Luxury and sophistication"
    ],
    "search_keywords": [
      "Geometric",
      "Bold",
      "Serif",
      "Gothic",
      "Medieval",
      "Heraldry",
      "Luxury",
      "Display",
      "Headline",
      "Title",
      "Traditional",
      "Authoritative",
      "Powerful",
      "Elegant",
      "Sophisticated",
      "Grand",
      "Intricate",
      "Flourishes",
      "High x-height",
      "Open counters",
      "Legibility",
      "Heavy strokes",
      "Sharp angles"
    ]
  }
}