{
  "filename": "kremlin_kiev_36px.png",
  "status": "success",
  "description": {
    "detailed_description": "This font, with its bold, blocky forms and distinct serifs, draws inspiration from the classic Western typeface aesthetic. The geometric construction is evident in the sharp angles and consistent proportions, creating a strong, confident presence. The serifs, while geometric in nature, are slightly rounded, adding a touch of approachability and preventing the font from feeling overly rigid. The high x-height and open counters ensure excellent legibility, even at smaller sizes, making it suitable for both display and body text applications. The font's bold character evokes a sense of ruggedness and authenticity, reminiscent of vintage signage and classic Western typography. Its contemporary relevance lies in its ability to add a touch of nostalgia and Americana to modern designs, while its bold presence makes it ideal for headlines, branding, and packaging that demand attention. The font's technical limitations include its limited character set and lack of stylistic alternates, which may restrict its versatility in certain design contexts.",
    "technical_characteristics": [
      "Geometric construction",
      "Bold weight",
      "High x-height",
      "Open counters",
      "Rounded serifs",
      "Consistent proportions",
      "Sharp angles"
    ],
    "personality_traits": [
      "Rugged",
      "Authentic",
      "Confident",
      "Nostalgic",
      "Bold",
      "Approachable",
      "Classic"
    ],
    "practical_contexts": [
      "Headlines",
      "Branding",
      "Packaging",
      "Posters",
      "Signage",
      "Display text"
    ],
    "cultural_intuition": [
      "Western Americana",
      "Vintage signage",
      "Classic typography",
      "Nostalgia",
      "Authenticity"
    ],
    "search_keywords": [
      "Western",
      "Geometric",
      "Bold",
      "Serif",
      "Display",
      "High x-height",
      "Open counters",
      "Rugged",
      "Authentic",
      "Nostalgic",
      "Vintage",
      "Signage",
      "Branding",
      "Packaging",
      "Headlines",
      "Posters",
      "Classic",
      "Americana"
    ]
  }
}