{
  "filename": "kremlin_orthodox_church_36px.png",
  "status": "success",
  "description": {
    "detailed_description": "This font, with its sharp angles and geometric construction, evokes a sense of medieval craftsmanship. The letterforms are built upon a grid system, resulting in a consistent and balanced appearance. The strong vertical strokes and tight letter spacing create a sense of formality and authority, while the pointed terminals add a touch of elegance. The font's bold weight and high x-height ensure excellent legibility, even at small sizes. Its distinctive character makes it suitable for headlines, logos, and branding projects that require a strong visual presence. The font's historical references to medieval calligraphy and its contemporary relevance to modern design trends make it a versatile choice for a wide range of applications.",
    "technical_characteristics": [
      "Geometric construction",
      "High x-height",
      "Strong vertical strokes",
      "Tight letter spacing",
      "Pointed terminals",
      "Bold weight"
    ],
    "personality_traits": [
      "Authoritative",
      "Formal",
      "Elegant",
      "Distinctive",
      "Craftsman-like",
      "Bold",
      "Legible"
    ],
    "practical_contexts": [
      "Headlines",
      "Logos",
      "Branding",
      "Posters",
      "Editorial design"
    ],
    "cultural_intuition": [
      "Medieval calligraphy",
      "Modern design trends",
      "Historical craftsmanship",
      "Contemporary sophistication",
      "Visual authority"
    ],
    "search_keywords": [
      "Geometric",
      "Medieval",
      "Blackletter",
      "Formal",
      "Bold",
      "High x-height",
      "Pointed terminals",
      "Legible",
      "Headlines",
      "Logos",
      "Branding",
      "Posters",
      "Editorial design",
      "Craftsmanship",
      "Authority",
      "Sophistication",
      "Historical",
      "Contemporary"
    ]
  }
}