{
  "filename": "krooked_36px.png",
  "status": "success",
  "description": {
    "detailed_description": "This font, with its bold, blocky letterforms and distressed edges, embodies a raw, rebellious energy. Each character appears as if torn from a larger sheet, with jagged edges and uneven spacing, creating a sense of immediacy and urgency. The font's construction is decidedly non-traditional, eschewing smooth curves and precise angles for a rough, hand-cut aesthetic. This deliberate imperfection adds to its gritty charm, evoking a sense of DIY punk rock or street art. The font's high x-height and open counters ensure legibility, even in small sizes, making it suitable for headlines, posters, and other applications where impact is paramount. Its bold, in-your-face personality makes it ideal for conveying a message of rebellion, nonconformity, or underground culture. While its rough edges might not be suitable for long-form text, it excels in grabbing attention and conveying a strong, edgy message.",
    "technical_characteristics": [
      "Distressed edges",
      "Uneven spacing",
      "Blocky letterforms",
      "High x-height",
      "Open counters"
    ],
    "personality_traits": [
      "Rebellious",
      "Gritty",
      "Energetic",
      "DIY",
      "Unconventional"
    ],
    "practical_contexts": [
      "Headlines",
      "Posters",
      "Logos",
      "Street art",
      "Punk rock graphics"
    ],
    "cultural_intuition": [
      "Punk rock",
      "Street art",
      "Underground culture",
      "Rebellion",
      "Nonconformity"
    ],
    "search_keywords": [
      "Distressed",
      "Blocky",
      "Rough",
      "Edgy",
      "Punk",
      "Street art",
      "Rebellious",
      "Bold",
      "High x-height",
      "Open counters",
      "Headline",
      "Poster",
      "Logo",
      "Graphic design",
      "Typography",
      "Font",
      "Typeface"
    ]
  }
}