{
  "filename": "kunal_36px.png",
  "status": "success",
  "description": {
    "detailed_description": "Kunal is a playful, handwritten font that captures the energy of casual scribbles. Its irregular letterforms and inconsistent stroke weights create a sense of spontaneity and authenticity. The rounded terminals and open counters contribute to its friendly and approachable character. While the font's informality makes it ideal for informal projects, its legibility remains strong, making it suitable for headlines, logos, and even short-form body text. The font's hand-drawn aesthetic evokes a sense of personal expression and warmth, making it perfect for projects that aim to connect with audiences on an emotional level. Its versatility allows it to be used across various media, from social media graphics to printed materials, adding a touch of personality and charm to any design.",
    "technical_characteristics": [
      "Handwritten style",
      "Irregular letterforms",
      "Inconsistent stroke weights",
      "Rounded terminals",
      "Open counters"
    ],
    "personality_traits": [
      "Playful",
      "Spontaneous",
      "Authentic",
      "Friendly",
      "Approachable"
    ],
    "practical_contexts": [
      "Headlines",
      "Logos",
      "Short-form body text",
      "Social media graphics",
      "Printed materials"
    ],
    "cultural_intuition": [
      "Evokes a sense of personal expression",
      "Conveys warmth and authenticity",
      "Reflects the informality of digital communication",
      "Suggests a playful and approachable brand personality"
    ],
    "search_keywords": [
      "handwritten",
      "script",
      "casual",
      "playful",
      "informal",
      "friendly",
      "approachable",
      "legible",
      "versatile",
      "headlines",
      "logos",
      "social media",
      "printed materials",
      "digital",
      "authentic",
      "spontaneous",
      "personal",
      "warm",
      "optimistic"
    ]
  }
}