{
  "filename": "kylie_36px.png",
  "status": "success",
  "description": {
    "detailed_description": "Kylie is a flowing script typeface that embodies a delicate balance between classic elegance and contemporary approachability. Its graceful curves and fluid strokes evoke a sense of handwritten charm, reminiscent of traditional calligraphy. The font's generous x-height and open counters ensure excellent legibility, even at smaller sizes, making it suitable for both digital and print applications. The subtle variations in stroke weight and the gentle flourishes add a touch of personality without sacrificing readability. Kylie's overall character is one of refined sophistication, suggesting a sense of timeless beauty and understated elegance. Its versatility allows it to be used for a wide range of projects, from wedding invitations and branding materials to website headers and social media graphics. The font's inherent charm and its ability to convey a sense of warmth and authenticity make it a compelling choice for projects that seek to evoke a sense of personal connection and emotional resonance.",
    "technical_characteristics": [
      "flowing script",
      "generous x-height",
      "open counters",
      "subtle stroke weight variations",
      "graceful curves",
      "fluid strokes",
      "gentle flourishes"
    ],
    "personality_traits": [
      "elegant",
      "approachable",
      "refined",
      "sophisticated",
      "timeless",
      "versatile",
      "charming",
      "authentic"
    ],
    "practical_contexts": [
      "wedding invitations",
      "branding materials",
      "website headers",
      "social media graphics",
      "print design",
      "digital design"
    ],
    "cultural_intuition": [
      "evokes a sense of handwritten charm",
      "suggests a timeless beauty",
      "conveys a sense of warmth and authenticity",
      "reminiscent of traditional calligraphy",
      "appeals to a contemporary aesthetic"
    ],
    "search_keywords": [
      "script",
      "flowing",
      "elegant",
      "approachable",
      "refined",
      "sophisticated",
      "timeless",
      "versatile",
      "charming",
      "authentic",
      "wedding",
      "branding",
      "website",
      "social media",
      "print",
      "digital",
      "calligraphy",
      "handwritten",
      "graceful",
      "fluid",
      "generous x-height",
      "open counters",
      "subtle stroke variations",
      "flourishes"
    ]
  }
}