{
  "filename": "laclede_cat_36px.png",
  "status": "success",
  "description": {
    "detailed_description": "Lacledes CAJ is a calligraphic script font that blends classic elegance with a touch of playful energy. Its flowing strokes and graceful curves evoke a sense of handwritten charm, while the bold weight and confident letterforms lend a sense of authority. The font's construction is based on traditional calligraphic principles, with smooth transitions between strokes and a consistent rhythm throughout the alphabet. The generous x-height and open counters ensure excellent legibility, even at smaller sizes. The font's distinctive features include the exaggerated swashes on the lowercase 'f' and 'g', which add a touch of whimsy and personality. The overall effect is a font that is both sophisticated and approachable, making it suitable for a wide range of applications, from formal invitations to casual branding. Lacledes CAJ's cultural resonance lies in its ability to evoke a sense of nostalgia for handwritten correspondence, while its contemporary relevance is evident in its versatility and adaptability to digital media. The font's playful nature makes it ideal for projects that require a touch of personality and charm, while its classic elegance ensures that it will remain timeless.",
    "technical_characteristics": [
      "Calligraphic construction",
      "Flowing strokes",
      "Graceful curves",
      "Bold weight",
      "Generous x-height",
      "Open counters",
      "Exaggerated swashes"
    ],
    "personality_traits": [
      "Playful",
      "Elegant",
      "Sophisticated",
      "Approachable",
      "Confident",
      "Handwritten",
      "Charming"
    ],
    "practical_contexts": [
      "Formal invitations",
      "Branding",
      "Logos",
      "Headlines",
      "Social media graphics"
    ],
    "cultural_intuition": [
      "Nostalgia for handwritten correspondence",
      "Contemporary charm",
      "Playful energy",
      "Classic elegance"
    ],
    "search_keywords": [
      "Calligraphic",
      "Script",
      "Elegant",
      "Playful",
      "Bold",
      "Handwritten",
      "Formal",
      "Branding",
      "Logos",
      "Headlines",
      "Social media",
      "Nostalgia",
      "Contemporary",
      "Versatile",
      "Adaptable"
    ]
  }
}