{
  "filename": "lactose_intolerant_36px.png",
  "status": "success",
  "description": {
    "detailed_description": "Lactose Intolerant is a hand-drawn typeface that embodies a playful, almost childlike energy. Its irregular letterforms, with their uneven strokes and expressive curves, create a sense of spontaneity and immediacy. The font's construction is decidedly organic, with each letter seemingly drawn with a single, flowing line. This lack of strict geometric precision contributes to its casual, almost scribbled aesthetic. While the font's overall character is lighthearted and informal, it also possesses a certain charm and warmth, making it suitable for projects that require a touch of personality. The font's legibility is surprisingly good, thanks to its generous x-height and open counters, making it suitable for short text blocks and headlines. However, its irregular nature might make it less suitable for extended reading. Lactose Intolerant's playful nature evokes a sense of youthful energy and creativity, reminiscent of hand-drawn doodles and personal notes. It's a font that feels both nostalgic and contemporary, suggesting a connection to the DIY aesthetic of digital culture.",
    "technical_characteristics": [
      "Hand-drawn construction",
      "Irregular letterforms",
      "Uneven strokes",
      "Expressive curves",
      "Generous x-height",
      "Open counters"
    ],
    "personality_traits": [
      "Playful",
      "Spontaneous",
      "Informal",
      "Charming",
      "Warm",
      "Youthful",
      "Creative",
      "Nostalgic",
      "Contemporary"
    ],
    "practical_contexts": [
      "Headlines",
      "Short text blocks",
      "Logos",
      "Social media graphics",
      "Packaging design"
    ],
    "cultural_intuition": [
      "DIY aesthetic",
      "Digital culture",
      "Hand-drawn style",
      "Nostalgia for childhood",
      "Creative expression"
    ],
    "search_keywords": [
      "Hand-drawn",
      "Script",
      "Informal",
      "Playful",
      "Casual",
      "Youthful",
      "Creative",
      "Nostalgic",
      "Digital",
      "Social media",
      "Logo",
      "Headline",
      "Packaging",
      "Doodle",
      "Scribble",
      "Expressive",
      "Organic",
      "Irregular",
      "Uneven",
      "Generous x-height",
      "Open counters"
    ]
  }
}