{
  "filename": "lamebrain_brk_36px.png",
  "status": "success",
  "description": {
    "detailed_description": "Lamebrain BRK is a playful and expressive display typeface that draws inspiration from hand-drawn lettering styles. Its rounded forms and irregular strokes create a sense of casual energy, while the overall structure remains legible and balanced. The font's distinctive features include exaggerated curves, uneven letter widths, and a slight slant, which contribute to its informal and friendly character. While the construction is not strictly geometric, the letters maintain a consistent weight and flow, ensuring readability even at larger sizes. This makes Lamebrain BRK suitable for headlines, logos, and other applications where a bold and approachable visual style is desired. The font's playful nature evokes a sense of youthful exuberance and creativity, making it ideal for projects targeting a younger audience or conveying a sense of fun and spontaneity. Its hand-drawn aesthetic also suggests a personal touch, adding a layer of authenticity and warmth to any design.",
    "technical_characteristics": [
      "Rounded forms",
      "Irregular strokes",
      "Exaggerated curves",
      "Uneven letter widths",
      "Slight slant",
      "Consistent weight",
      "Open counters"
    ],
    "personality_traits": [
      "Playful",
      "Expressive",
      "Informal",
      "Friendly",
      "Energetic",
      "Casual",
      "Approachable"
    ],
    "practical_contexts": [
      "Headlines",
      "Logos",
      "Posters",
      "Social media graphics",
      "Packaging"
    ],
    "cultural_intuition": [
      "Hand-drawn aesthetic",
      "Youthful exuberance",
      "Creative energy",
      "Personal touch",
      "Informal communication"
    ],
    "search_keywords": [
      "Display typeface",
      "Hand-drawn",
      "Rounded",
      "Playful",
      "Expressive",
      "Informal",
      "Casual",
      "Energetic",
      "Friendly",
      "Approachable",
      "Headlines",
      "Logos",
      "Posters",
      "Social media",
      "Packaging",
      "Youthful",
      "Creative",
      "Personal",
      "Authentic",
      "Warm"
    ]
  }
}