{
  "filename": "lasmini_yahut_36px.png",
  "status": "success",
  "description": {
    "detailed_description": "Lusmini Yahaut is a flowing script typeface that captures the elegance of traditional calligraphy while maintaining a contemporary feel. Its fluid strokes and graceful curves are reminiscent of handwritten script, but the carefully balanced proportions and consistent letterforms ensure legibility even at smaller sizes. The font's distinctive features include its high x-height, which contributes to its readability, and the subtle variations in stroke weight that add visual interest. The overall effect is one of sophistication and charm, making it suitable for a wide range of applications, from wedding invitations and branding to website headers and social media graphics. The font's cultural associations are rooted in the tradition of handwritten script, evoking a sense of personal touch and authenticity. However, its modern design and versatility make it equally relevant in contemporary digital contexts, where it can add a touch of elegance and personality to any project.",
    "technical_characteristics": [
      "High x-height",
      "Fluid strokes",
      "Graceful curves",
      "Consistent letterforms",
      "Subtle variations in stroke weight",
      "Balanced proportions"
    ],
    "personality_traits": [
      "Elegant",
      "Sophisticated",
      "Charming",
      "Fluid",
      "Graceful",
      "Handwritten",
      "Contemporary"
    ],
    "practical_contexts": [
      "Wedding invitations",
      "Branding",
      "Website headers",
      "Social media graphics",
      "Display typography"
    ],
    "cultural_intuition": [
      "Traditional calligraphy",
      "Personal touch",
      "Authenticity",
      "Modern design",
      "Digital relevance"
    ],
    "search_keywords": [
      "Script",
      "Calligraphy",
      "Handwritten",
      "Elegant",
      "Sophisticated",
      "Charming",
      "Fluid",
      "Graceful",
      "High x-height",
      "Consistent letterforms",
      "Subtle variations",
      "Balanced proportions",
      "Wedding invitations",
      "Branding",
      "Website headers",
      "Social media graphics",
      "Display typography",
      "Modern",
      "Contemporary",
      "Digital",
      "Authentic",
      "Personal touch"
    ]
  }
}