{
  "filename": "launch_attack_36px.png",
  "status": "success",
  "description": {
    "detailed_description": "Launch Attack is a bold, expressive script font that captures the energy of classic hand-lettering with a contemporary edge. Its flowing strokes and generous curves create a sense of movement and dynamism, while the consistent weight and well-defined terminals ensure legibility even at smaller sizes. The font's italic angle is pronounced, adding to its dynamic character and suggesting a sense of speed and momentum. This combination of traditional calligraphic inspiration and modern digital refinement makes Launch Attack suitable for a wide range of applications, from eye-catching headlines and logos to playful branding and social media graphics. Its bold personality and energetic vibe evoke a sense of excitement and adventure, making it ideal for projects that aim to capture attention and convey a sense of fun and dynamism.",
    "technical_characteristics": [
      "flowing strokes",
      "generous curves",
      "consistent weight",
      "well-defined terminals",
      "pronounced italic angle",
      "dynamic character",
      "high x-height",
      "open counters"
    ],
    "personality_traits": [
      "bold",
      "expressive",
      "dynamic",
      "energetic",
      "playful",
      "approachable",
      "confident",
      "modern",
      "refined"
    ],
    "practical_contexts": [
      "headlines",
      "logos",
      "branding",
      "social media graphics",
      "packaging design",
      "posters",
      "digital displays"
    ],
    "cultural_intuition": [
      "evokes a sense of excitement and adventure",
      "suggests a playful and fun personality",
      "captures the energy of classic hand-lettering",
      "reflects a contemporary design aesthetic",
      "ideal for projects that aim to capture attention"
    ],
    "search_keywords": [
      "script font",
      "bold",
      "expressive",
      "dynamic",
      "energetic",
      "playful",
      "hand-lettering",
      "modern",
      "refined",
      "headlines",
      "logos",
      "branding",
      "social media",
      "packaging",
      "posters",
      "digital displays",
      "excitement",
      "adventure",
      "fun",
      "contemporary",
      "classic",
      "calligraphic",
      "flowing",
      "curves",
      "weight",
      "terminals",
      "italic",
      "legibility"
    ]
  }
}