{
  "filename": "le_jasper_36px.png",
  "status": "success",
  "description": {
    "detailed_description": "Le Jasper embodies a playful yet refined handwritten aesthetic. Its flowing strokes and organic curves evoke a sense of casual elegance, reminiscent of a personal note penned with a fine-tipped pen. The font's construction is characterized by a consistent weight and subtle variations in stroke thickness, creating a sense of natural rhythm and movement. The generous x-height and open counters ensure excellent legibility, even at smaller sizes, making it suitable for both display and body text applications. The font's overall character is both approachable and sophisticated, suggesting a balance between informality and professionalism. Its contemporary relevance lies in its ability to convey authenticity and personality, while its cultural associations hint at a sense of warmth and approachability, reminiscent of handwritten correspondence and personal expression. Le Jasper's versatility makes it ideal for branding, packaging, editorial design, and digital interfaces, where it can add a touch of personality and charm without sacrificing readability.",
    "technical_characteristics": [
      "Handwritten aesthetic",
      "Flowing strokes",
      "Organic curves",
      "Consistent weight",
      "Subtle stroke variations",
      "Generous x-height",
      "Open counters"
    ],
    "personality_traits": [
      "Playful yet refined",
      "Casual elegance",
      "Approachable and sophisticated",
      "Authentic and personable",
      "Warm and approachable"
    ],
    "practical_contexts": [
      "Branding",
      "Packaging",
      "Editorial design",
      "Digital interfaces",
      "Body text"
    ],
    "cultural_intuition": [
      "Handwritten correspondence",
      "Personal expression",
      "Modern informality",
      "Casual sophistication",
      "Digital-native design"
    ],
    "search_keywords": [
      "Handwritten",
      "Script",
      "Casual",
      "Elegant",
      "Playful",
      "Refined",
      "Approachable",
      "Sophisticated",
      "Legible",
      "Versatile",
      "Branding",
      "Packaging",
      "Editorial",
      "Digital",
      "Body text",
      "Display",
      "Modern",
      "Contemporary",
      "Authentic",
      "Personality",
      "Warm",
      "Approachable",
      "Informal",
      "Professional"
    ]
  }
}