{
  "filename": "le_ratna_36px.png",
  "status": "success",
  "description": {
    "detailed_description": "Le Ratna is a playful script font that captures the essence of handwritten lettering. Its flowing curves and organic shapes create a sense of movement and energy, reminiscent of casual note-taking or personal correspondence. The font's irregular baseline and varying letter heights contribute to its informal character, while the rounded terminals and open counters enhance readability. Le Ratna's versatility allows it to be used for a wide range of applications, from playful branding and social media graphics to handwritten-style quotes and invitations. Its informal yet legible nature makes it particularly well-suited for digital platforms, where it can add a touch of personality and authenticity to online content. The font's overall aesthetic evokes a sense of warmth and approachability, suggesting a friendly and inviting tone. Its cultural associations range from vintage stationery and handwritten notes to contemporary social media trends, reflecting its ability to bridge the gap between traditional and digital aesthetics.",
    "technical_characteristics": [
      "Handwritten style",
      "Irregular baseline",
      "Varying letter heights",
      "Rounded terminals",
      "Open counters",
      "Flowing curves",
      "Organic shapes"
    ],
    "personality_traits": [
      "Playful",
      "Informal",
      "Energetic",
      "Friendly",
      "Inviting",
      "Authentic",
      "Legible"
    ],
    "practical_contexts": [
      "Social media graphics",
      "Branding for creative businesses",
      "Handwritten-style quotes",
      "Invitations and greeting cards",
      "Digital content"
    ],
    "cultural_intuition": [
      "Vintage stationery",
      "Handwritten notes",
      "Contemporary social media trends",
      "Casual communication",
      "Personal expression"
    ],
    "search_keywords": [
      "Script font",
      "Handwritten",
      "Playful",
      "Informal",
      "Organic",
      "Rounded terminals",
      "Open counters",
      "Legible",
      "Social media",
      "Branding",
      "Invitations",
      "Digital content",
      "Vintage",
      "Contemporary",
      "Casual",
      "Personal",
      "Authentic"
    ]
  }
}