{
  "filename": "lemon_cookie_bold_36px.png",
  "status": "success",
  "description": {
    "detailed_description": "Lemon Cookie Bold is a playful yet legible sans-serif typeface that blends a classic geometric construction with subtle humanist details. Its bold weight and generous x-height contribute to a strong visual presence, while the rounded terminals and slightly condensed proportions create a friendly and approachable feel. The font's construction is evident in the clean, crisp lines and consistent stroke weights, while the subtle curves and variations in letterforms add a touch of personality. This balance between geometric precision and humanist warmth makes Lemon Cookie Bold suitable for a wide range of applications, from branding and editorial design to digital interfaces and signage. Its bold weight and clear legibility make it effective for headlines and titles, while its playful character adds a touch of personality to body text and smaller elements. The font's contemporary relevance is evident in its versatility and adaptability to various design styles, while its cultural associations evoke a sense of optimism and approachability, reminiscent of the playful spirit of the 1950s and 1960s.",
    "technical_characteristics": [
      "Geometric construction",
      "Bold weight",
      "High x-height",
      "Rounded terminals",
      "Condensed proportions",
      "Consistent stroke weights",
      "Subtle curves and variations in letterforms"
    ],
    "personality_traits": [
      "Playful",
      "Legible",
      "Friendly",
      "Approachable",
      "Bold",
      "Contemporary",
      "Versatile"
    ],
    "practical_contexts": [
      "Headlines and titles",
      "Branding and editorial design",
      "Digital interfaces",
      "Signage",
      "Body text and smaller elements"
    ],
    "cultural_intuition": [
      "Evokes a sense of optimism and approachability",
      "Reminiscent of the playful spirit of the 1950s and 1960s",
      "Contemporary relevance",
      "Versatility and adaptability to various design styles"
    ],
    "search_keywords": [
      "Sans-serif",
      "Geometric",
      "Humanist",
      "Bold",
      "Playful",
      "Legible",
      "Friendly",
      "Approachable",
      "Contemporary",
      "Versatile",
      "Headlines",
      "Titles",
      "Branding",
      "Editorial",
      "Digital",
      "Signage",
      "Body text",
      "Small elements",
      "Optimism",
      "Approachability",
      "Mid-century",
      "Modern",
      "Retro",
      "Classic",
      "Digital-native"
    ]
  }
}