{
  "filename": "lemonjuice_36px.png",
  "status": "success",
  "description": {
    "detailed_description": "Lemonjuice is a playful, handwritten font that captures the energy of casual scribbling. Its irregular letterforms and inconsistent stroke weights create a sense of spontaneity and immediacy. The font's organic nature is evident in the rounded terminals and flowing curves, which contrast with the sharp angles and abrupt transitions found in some letters. This combination of fluidity and structure gives Lemonjuice a unique personality, making it suitable for projects that require a touch of whimsy and personality. While the font's informal character makes it ideal for headlines, logos, and short text blocks, its legibility can be compromised in large blocks of text, especially at smaller sizes. The font's overall aesthetic evokes a sense of youthful energy and creativity, reminiscent of handwritten notes and personal expressions. Its casual charm and playful nature make it a perfect choice for projects that aim to convey a sense of authenticity and approachability.",
    "technical_characteristics": [
      "Handwritten style",
      "Irregular letterforms",
      "Inconsistent stroke weights",
      "Rounded terminals",
      "Flowing curves",
      "Sharp angles",
      "Abrupt transitions"
    ],
    "personality_traits": [
      "Playful",
      "Spontaneous",
      "Whimsical",
      "Casual",
      "Informal",
      "Energetic",
      "Creative"
    ],
    "practical_contexts": [
      "Headlines",
      "Logos",
      "Short text blocks",
      "Social media graphics",
      "Handwritten notes"
    ],
    "cultural_intuition": [
      "Youthful energy",
      "Creativity",
      "Authenticity",
      "Approachability",
      "Personal expression"
    ],
    "search_keywords": [
      "Handwritten",
      "Script",
      "Playful",
      "Casual",
      "Informal",
      "Whimsical",
      "Energetic",
      "Creative",
      "Logo",
      "Headline",
      "Social media",
      "Note",
      "Sketch",
      "Doodle",
      "Organic",
      "Irregular",
      "Inconsistent",
      "Rounded",
      "Flowing",
      "Sharp",
      "Abrupt",
      "Youthful",
      "Authentic",
      "Approachable"
    ]
  }
}