{
  "filename": "lerotica_36px.png",
  "status": "success",
  "description": {
    "detailed_description": "Lerotica is a sans-serif typeface that embodies a clean, modern aesthetic with a touch of playful quirkiness. Its geometric construction is evident in the sharp angles and consistent stroke widths, creating a sense of order and precision. However, the font's personality is softened by subtle humanist details, such as the slightly rounded terminals and the gentle curves in lowercase letters like 'a' and 'c'. This balance between geometric structure and humanist warmth gives Lerotica a unique character, making it both visually appealing and approachable. The font's high x-height and open counters ensure excellent legibility, even at small sizes, making it suitable for a wide range of applications, from website headers to mobile interfaces. Its clean lines and contemporary feel make it a strong choice for projects that require a modern and sophisticated look, while its playful elements add a touch of personality and intrigue. Lerotica's cultural resonance lies in its connection to the digital age, evoking a sense of innovation and technological advancement. Its clean lines and geometric structure are reminiscent of the minimalist design trends that have emerged in recent years, while its playful elements hint at the creative and experimental spirit of the digital world.",
    "technical_characteristics": [
      "Geometric construction",
      "Consistent stroke widths",
      "Sharp angles",
      "High x-height",
      "Open counters",
      "Slightly rounded terminals",
      "Humanist details in lowercase letters"
    ],
    "personality_traits": [
      "Clean and modern",
      "Playful and quirky",
      "Visually appealing",
      "Approachable",
      "Sophisticated",
      "Innovative",
      "Experimental"
    ],
    "practical_contexts": [
      "Website headers",
      "Mobile interfaces",
      "Branding materials",
      "Editorial design",
      "Digital signage"
    ],
    "cultural_intuition": [
      "Digital age aesthetic",
      "Minimalist design trends",
      "Creative and experimental spirit",
      "Technological advancement",
      "Modern and sophisticated"
    ],
    "search_keywords": [
      "sans-serif",
      "geometric",
      "modern",
      "clean",
      "playful",
      "legible",
      "high x-height",
      "open counters",
      "rounded terminals",
      "humanist",
      "digital",
      "website",
      "mobile",
      "branding",
      "editorial",
      "signage",
      "minimalism",
      "innovation",
      "technology",
      "sophisticated",
      "quirky",
      "approachable"
    ]
  }
}