{
  "filename": "les_jours_heureux_36px.png",
  "status": "success",
  "description": {
    "detailed_description": "Les Jours Heureux is a charming script typeface that blends classic calligraphic influences with a contemporary, playful spirit. Its flowing strokes and graceful curves evoke a sense of handwritten elegance, while the slightly irregular letterforms and playful flourishes add a touch of whimsy. The font's generous x-height and open counters ensure excellent legibility, even at smaller sizes, making it suitable for a range of applications from branding and packaging to social media graphics and website headers. The font's overall character is both sophisticated and approachable, suggesting a sense of warmth and personality that resonates with modern audiences. Its cultural associations range from vintage charm to contemporary digital aesthetics, making it a versatile choice for projects that require a touch of both tradition and innovation.",
    "technical_characteristics": [
      "flowing strokes",
      "graceful curves",
      "slightly irregular letterforms",
      "playful flourishes",
      "generous x-height",
      "open counters"
    ],
    "personality_traits": [
      "charming",
      "playful",
      "whimsical",
      "sophisticated",
      "approachable"
    ],
    "practical_contexts": [
      "branding",
      "packaging",
      "social media graphics",
      "website headers",
      "invitations"
    ],
    "cultural_intuition": [
      "vintage charm",
      "contemporary digital aesthetics",
      "handwritten elegance",
      "playful personality",
      "warmth and approachability"
    ],
    "search_keywords": [
      "script font",
      "calligraphic",
      "playful",
      "whimsical",
      "elegant",
      "legible",
      "versatile",
      "branding",
      "packaging",
      "social media",
      "website",
      "vintage",
      "contemporary",
      "digital",
      "handwritten",
      "approachable",
      "warmth",
      "personality",
      "charming",
      "flourishes",
      "curves",
      "irregular",
      "generous x-height",
      "open counters"
    ]
  }
}