{
  "filename": "les_dunes_36px.png",
  "status": "success",
  "description": {
    "detailed_description": "This font, with its distinctive double-line construction, presents a playful yet legible style. Each letterform is defined by two parallel outlines, creating a sense of depth and dimension. The rounded corners and gentle curves contribute to a friendly and approachable feel, while the consistent stroke weight ensures clarity even at smaller sizes. The font's overall character is lighthearted and whimsical, reminiscent of hand-drawn lettering or playful signage. Its versatility allows for use in a range of applications, from children's books and branding to website headers and social media graphics. The double-line construction adds a touch of retro charm, evoking a sense of nostalgia for vintage typography and hand-drawn designs. This font's playful nature and visual appeal make it a strong choice for projects seeking a friendly and engaging aesthetic.",
    "technical_characteristics": [
      "Double-line construction",
      "Rounded corners",
      "Consistent stroke weight",
      "Open counters",
      "Moderate x-height"
    ],
    "personality_traits": [
      "Playful",
      "Whimsical",
      "Friendly",
      "Approachable",
      "Legible"
    ],
    "practical_contexts": [
      "Children's books",
      "Branding",
      "Website headers",
      "Social media graphics",
      "Display typography"
    ],
    "cultural_intuition": [
      "Nostalgia for vintage typography",
      "Hand-drawn aesthetic",
      "Playful and engaging",
      "Modern retro style",
      "Casual and approachable"
    ],
    "search_keywords": [
      "Double-line",
      "Rounded",
      "Playful",
      "Whimsical",
      "Legible",
      "Friendly",
      "Approachable",
      "Vintage",
      "Retro",
      "Hand-drawn",
      "Display",
      "Branding",
      "Children's",
      "Website",
      "Social media"
    ]
  }
}