{
  "filename": "lettre_etoile_36px.png",
  "status": "success",
  "description": {
    "detailed_description": "This font, with its rounded forms and bold outlines, embodies a playful and approachable aesthetic. The generous curves and open counters contribute to a sense of openness and friendliness, while the consistent stroke weight and lack of serifs create a clean and modern feel. The overall construction is simple and geometric, with each letterform built from basic shapes, yet the slight variations in curve and angle add a touch of personality. This combination of playful design and technical clarity makes it suitable for a wide range of applications, from children's books and branding to digital interfaces and playful signage. The font's cheerful and optimistic character evokes a sense of fun and lightheartedness, making it ideal for projects that aim to engage and delight audiences.",
    "technical_characteristics": [
      "rounded letterforms",
      "bold outlines",
      "consistent stroke weight",
      "open counters",
      "geometric construction",
      "lack of serifs"
    ],
    "personality_traits": [
      "playful",
      "approachable",
      "friendly",
      "optimistic",
      "cheerful",
      "modern",
      "clean",
      "simple"
    ],
    "practical_contexts": [
      "children's books",
      "branding",
      "digital interfaces",
      "playful signage",
      "display typography"
    ],
    "cultural_intuition": [
      "evokes a sense of fun and lightheartedness",
      "suggests a playful and approachable personality",
      "reminiscent of early computer graphics and playful 1980s design",
      "appeals to a wide range of audiences"
    ],
    "search_keywords": [
      "rounded",
      "bold",
      "outline",
      "sans-serif",
      "geometric",
      "playful",
      "friendly",
      "optimistic",
      "cheerful",
      "modern",
      "clean",
      "simple",
      "children's",
      "branding",
      "digital",
      "interface",
      "display",
      "typography",
      "retro",
      "80s",
      "fun",
      "lighthearted"
    ]
  }
}