{
  "filename": "lexographer_36px.png",
  "status": "success",
  "description": {
    "detailed_description": "This font's character is defined by its playful, almost childlike, hand-drawn aesthetic. Each letterform is encased in a rough, irregular frame, suggesting a blocky, almost primitive construction. The uneven lines and slightly wobbly strokes add to the sense of handmade charm, while the generous x-height and open counters ensure good legibility, even at smaller sizes. The font's overall mood is lighthearted and approachable, with a hint of whimsy. It evokes a sense of nostalgia for handmade crafts and vintage children's books, while also feeling fresh and contemporary. Its versatility makes it suitable for a wide range of applications, from playful branding and packaging to website headers and social media graphics. The font's hand-drawn quality adds a personal touch to any project, making it ideal for conveying warmth, authenticity, and a sense of creative energy.",
    "technical_characteristics": [
      "hand-drawn style",
      "irregular frames",
      "uneven lines",
      "wobbly strokes",
      "generous x-height",
      "open counters"
    ],
    "personality_traits": [
      "playful",
      "whimsical",
      "approachable",
      "lighthearted",
      "handmade",
      "nostalgic",
      "fresh",
      "contemporary"
    ],
    "practical_contexts": [
      "branding",
      "packaging",
      "website headers",
      "social media graphics",
      "children's books",
      "hand-drawn illustrations"
    ],
    "cultural_intuition": [
      "evokes a sense of nostalgia for handmade crafts",
      "suggests a vintage children's book aesthetic",
      "feels fresh and contemporary",
      "conveys warmth and authenticity"
    ],
    "search_keywords": [
      "hand-drawn",
      "playful",
      "whimsical",
      "nostalgic",
      "vintage",
      "children's",
      "blocky",
      "irregular",
      "handmade",
      "approachable",
      "lighthearted",
      "fresh",
      "contemporary",
      "branding",
      "packaging",
      "website",
      "social media",
      "graphics",
      "illustrations"
    ]
  }
}