{
  "filename": "lifes_too_fast_36px.png",
  "status": "success",
  "description": {
    "detailed_description": "This font, with its playful, hand-drawn aesthetic, embodies a sense of youthful energy and casual creativity. The letters are characterized by their irregular, almost wobbly outlines, with varying stroke weights and a distinct lack of uniformity. This deliberate inconsistency creates a sense of spontaneity and immediacy, reminiscent of a child's scribbles or a quick sketch. The font's overall character is friendly and approachable, with a hint of whimsy. It's not meant to be perfectly legible, but rather to convey a sense of personality and informality. The font's design is heavily influenced by the free-flowing nature of handwriting, with a distinct lack of geometric precision. This makes it particularly well-suited for informal applications, such as social media graphics, children's books, or playful branding. The font's cultural resonance lies in its connection to the DIY aesthetic and the embrace of imperfection, which are prevalent in contemporary digital culture. It evokes a sense of authenticity and personal expression, aligning with the values of individuality and self-expression that are increasingly important in today's world.",
    "technical_characteristics": [
      "Irregular stroke weights",
      "Varying letterforms",
      "Hand-drawn aesthetic",
      "Lack of geometric precision",
      "Informal letter construction"
    ],
    "personality_traits": [
      "Playful",
      "Whimsical",
      "Spontaneous",
      "Informal",
      "Approachable"
    ],
    "practical_contexts": [
      "Social media graphics",
      "Children's books",
      "Playful branding",
      "Informal signage",
      "Casual digital content"
    ],
    "cultural_intuition": [
      "DIY aesthetic",
      "Embrace of imperfection",
      "Authenticity",
      "Personal expression",
      "Youthful energy"
    ],
    "search_keywords": [
      "Hand-drawn",
      "Playful",
      "Informal",
      "Whimsical",
      "Casual",
      "Scribble",
      "Sketch",
      "Youthful",
      "Creative",
      "Spontaneous",
      "DIY",
      "Authentic",
      "Social media",
      "Children's book",
      "Branding",
      "Digital content",
      "Graphic design",
      "Typography",
      "Font"
    ]
  }
}