{
  "filename": "like_cockatoos_36px.png",
  "status": "success",
  "description": {
    "detailed_description": "This script font, reminiscent of elegant handwriting, features flowing strokes and graceful curves. The ascenders and descenders are elongated, creating a sense of verticality and rhythm. The letterforms are carefully balanced, with a slight slant that adds a touch of informality. The overall impression is one of sophistication and charm, with a hint of whimsy. The font's delicate construction and subtle flourishes make it well-suited for invitations, stationery, and other projects where a touch of elegance is desired. Its cursive nature lends itself to handwritten-style branding, adding a personal touch to digital communications. The font's playful yet refined character evokes a sense of nostalgia, reminiscent of vintage postcards and handwritten letters, while its contemporary execution makes it feel fresh and relevant.",
    "technical_characteristics": [
      "cursive script",
      "flowing strokes",
      "elongated ascenders and descenders",
      "balanced letterforms",
      "slight slant",
      "delicate construction",
      "subtle flourishes"
    ],
    "personality_traits": [
      "elegant",
      "graceful",
      "sophisticated",
      "charming",
      "whimsical",
      "playful",
      "refined"
    ],
    "practical_contexts": [
      "invitations",
      "stationery",
      "handwritten-style branding",
      "digital communications",
      "logos and branding"
    ],
    "cultural_intuition": [
      "nostalgia",
      "vintage charm",
      "handwritten authenticity",
      "personal touch",
      "contemporary elegance"
    ],
    "search_keywords": [
      "script font",
      "cursive",
      "handwriting",
      "elegant",
      "graceful",
      "sophisticated",
      "charming",
      "whimsical",
      "playful",
      "refined",
      "invitations",
      "stationery",
      "branding",
      "logos",
      "digital",
      "nostalgia",
      "vintage",
      "handwritten",
      "authenticity",
      "personal touch",
      "contemporary"
    ]
  }
}