{
  "filename": "like_snow_36px.png",
  "status": "success",
  "description": {
    "detailed_description": "This font, reminiscent of hand-drawn lettering, embodies a playful and approachable personality. Its rounded forms and irregular strokes create a sense of informality and warmth, while the bold weight and consistent stroke width ensure legibility. The generous x-height and open counters contribute to its readability, even at smaller sizes. The font's organic nature, with its slight variations in letterforms, adds a touch of whimsy and personality. It evokes a sense of childhood nostalgia, reminiscent of handwritten notes and playful doodles. This font is well-suited for projects that require a friendly and engaging tone, such as children's books, social media graphics, or branding for playful products. Its informal character makes it ideal for conveying a sense of approachability and authenticity.",
    "technical_characteristics": [
      "Rounded forms",
      "Irregular strokes",
      "Bold weight",
      "Consistent stroke width",
      "Generous x-height",
      "Open counters",
      "Organic variations"
    ],
    "personality_traits": [
      "Playful",
      "Approachable",
      "Informal",
      "Warm",
      "Whimsical",
      "Nostalgic",
      "Engaging"
    ],
    "practical_contexts": [
      "Children's books",
      "Social media graphics",
      "Playful branding",
      "Handwritten-style typography",
      "Informal signage"
    ],
    "cultural_intuition": [
      "Childhood nostalgia",
      "Handwritten communication",
      "Playful expression",
      "Modern informality",
      "Digital-native design"
    ],
    "search_keywords": [
      "Handwritten",
      "Playful",
      "Rounded",
      "Bold",
      "Informal",
      "Nostalgic",
      "Whimsical",
      "Children's",
      "Social media",
      "Branding",
      "Digital",
      "Friendly",
      "Engaging",
      "Approachable",
      "Authentic"
    ]
  }
}