{
  "filename": "lindberg_hand_and_symbols_36px.png",
  "status": "success",
  "description": {
    "detailed_description": "Lindberg Hand and Symbols is a playful, hand-drawn typeface that captures the energy of casual writing. Its irregular letterforms and expressive strokes evoke a sense of spontaneity and authenticity. The font's construction is based on a loose, gestural approach, with varying stroke weights and uneven letter spacing. This creates a dynamic and visually engaging rhythm, reminiscent of handwritten notes or personal sketches. The font's personality is both approachable and energetic, suggesting a sense of informality and creativity. It's well-suited for projects that require a friendly and engaging tone, such as social media graphics, branding for creative businesses, or playful editorial designs. The font's cultural resonance lies in its connection to the DIY aesthetic and the rise of digital hand-lettering trends. It embodies a sense of individuality and authenticity, reflecting the contemporary desire for personal expression in a digital world.",
    "technical_characteristics": [
      "Hand-drawn aesthetic",
      "Irregular letterforms",
      "Varying stroke weights",
      "Uneven letter spacing",
      "Expressive strokes",
      "Loose, gestural construction"
    ],
    "personality_traits": [
      "Playful",
      "Spontaneous",
      "Authentic",
      "Approachable",
      "Energetic",
      "Informal",
      "Creative"
    ],
    "practical_contexts": [
      "Social media graphics",
      "Branding for creative businesses",
      "Playful editorial designs",
      "Handwritten notes and sketches",
      "Digital illustrations"
    ],
    "cultural_intuition": [
      "DIY aesthetic",
      "Digital hand-lettering trends",
      "Individuality and authenticity",
      "Personal expression in a digital world",
      "Casual and informal communication"
    ],
    "search_keywords": [
      "Hand-drawn",
      "Playful",
      "Informal",
      "Expressive",
      "Casual",
      "Sketchy",
      "Authentic",
      "Creative",
      "Social media",
      "Branding",
      "Editorial",
      "Digital lettering",
      "DIY",
      "Handwritten",
      "Spontaneous",
      "Energetic",
      "Approachable",
      "Irregular",
      "Varying stroke weights",
      "Uneven spacing",
      "Loose construction",
      "Digital illustration",
      "Graphic design",
      "Typography",
      "Font",
      "Typeface"
    ]
  }
}