{
  "filename": "lionel_of_paris_36px.png",
  "status": "success",
  "description": {
    "detailed_description": "Lionel of Paris is a playful script font that blends a casual, handwritten aesthetic with a touch of sophistication. Its flowing strokes and rounded forms create a sense of warmth and approachability, while the consistent letterforms and well-defined terminals ensure legibility. The font's organic nature is evident in the subtle variations in stroke weight and the gentle curves of the letterforms, giving it a handcrafted feel. This combination of informality and precision makes it suitable for a wide range of applications, from branding and packaging to social media graphics and handwritten notes. The font's playful nature evokes a sense of fun and creativity, making it ideal for projects that require a touch of personality. Its contemporary relevance lies in its ability to capture the spirit of handwritten communication in a digital age, while its cultural associations hint at a sense of Parisian charm and effortless style.",
    "technical_characteristics": [
      "Handwritten style",
      "Rounded forms",
      "Consistent letterforms",
      "Subtle variations in stroke weight",
      "Well-defined terminals"
    ],
    "personality_traits": [
      "Playful",
      "Approachable",
      "Warm",
      "Handcrafted",
      "Sophisticated"
    ],
    "practical_contexts": [
      "Branding and packaging",
      "Social media graphics",
      "Handwritten notes",
      "Website headers",
      "Invitations and cards"
    ],
    "cultural_intuition": [
      "Parisian charm",
      "Effortless style",
      "Handwritten communication",
      "Digital age",
      "Creative expression"
    ],
    "search_keywords": [
      "Script font",
      "Handwritten",
      "Playful",
      "Rounded",
      "Casual",
      "Sophisticated",
      "Legible",
      "Warm",
      "Approachable",
      "Handcrafted",
      "Branding",
      "Packaging",
      "Social media",
      "Website",
      "Invitations",
      "Cards",
      "Parisian",
      "Effortless",
      "Contemporary",
      "Creative"
    ]
  }
}