{
  "filename": "littlejoodles_36px.png",
  "status": "success",
  "description": {
    "detailed_description": "Littlejoodles is a playful, hand-drawn font that captures the energy of childhood scribbles. Its irregular letterforms, with their rounded edges and expressive strokes, evoke a sense of spontaneity and warmth. The font's generous x-height and open counters ensure good legibility, even at smaller sizes, making it suitable for both display and body text. The inconsistent stroke weights and slight variations in letterforms add to its charming, handmade aesthetic. While the font's overall character is lighthearted and informal, it also possesses a certain robustness, suggesting a sense of resilience and optimism. This makes it ideal for projects that require a touch of whimsy and personality, such as children's books, branding for creative businesses, or social media graphics. The font's cultural resonance lies in its connection to the universal language of childhood, evoking memories of doodling and expressing oneself freely. It taps into a sense of nostalgia and innocence, while also feeling fresh and contemporary.",
    "technical_characteristics": [
      "Hand-drawn aesthetic",
      "Irregular letterforms",
      "Rounded edges",
      "Expressive strokes",
      "Generous x-height",
      "Open counters",
      "Inconsistent stroke weights",
      "Slight variations in letterforms"
    ],
    "personality_traits": [
      "Playful",
      "Spontaneous",
      "Warm",
      "Lighthearted",
      "Informal",
      "Robust",
      "Resilient",
      "Optimistic",
      "Whimsical",
      "Charming",
      "Handmade"
    ],
    "practical_contexts": [
      "Children's books",
      "Branding for creative businesses",
      "Social media graphics",
      "Display text",
      "Body text"
    ],
    "cultural_intuition": [
      "Childhood scribbles",
      "Nostalgia",
      "Innocence",
      "Free expression",
      "Universal language"
    ],
    "search_keywords": [
      "Hand-drawn",
      "Playful",
      "Informal",
      "Whimsical",
      "Charming",
      "Children's",
      "Creative",
      "Social media",
      "Display",
      "Body text",
      "Nostalgia",
      "Childhood",
      "Doodle",
      "Scribble",
      "Optimistic",
      "Warm",
      "Friendly",
      "Expressive",
      "Spontaneous",
      "Irregular",
      "Rounded",
      "Open counters",
      "Generous x-height",
      "Inconsistent stroke weights",
      "Variations"
    ]
  }
}