{
  "filename": "little_rickey_nf_36px.png",
  "status": "success",
  "description": {
    "detailed_description": "Little Richey NF is a script typeface that embodies a playful yet sophisticated charm. Its flowing strokes and elegant curves evoke a sense of handwritten elegance, reminiscent of classic calligraphy. The font's construction is characterized by a dynamic interplay of thick and thin strokes, creating a sense of rhythm and movement. The ascenders and descenders are gracefully extended, adding to the overall sense of fluidity. The lowercase letters are particularly charming, with their delicate curves and subtle flourishes. The font's overall character is both whimsical and refined, making it suitable for a wide range of applications, from branding and packaging to invitations and website design. Its playful nature makes it ideal for projects that require a touch of personality, while its sophisticated elegance ensures that it remains appropriate for more formal occasions. The font's versatility is further enhanced by its inclusion of a comprehensive character set, including numerals, punctuation marks, and a variety of ligatures. This allows for a wide range of creative possibilities, making it a valuable tool for designers seeking to add a touch of handwritten charm to their projects.",
    "technical_characteristics": [
      "flowing strokes",
      "elegant curves",
      "dynamic thick and thin strokes",
      "graceful ascenders and descenders",
      "delicate lowercase curves",
      "subtle flourishes",
      "comprehensive character set",
      "ligatures"
    ],
    "personality_traits": [
      "playful",
      "sophisticated",
      "elegant",
      "whimsical",
      "refined",
      "versatile",
      "charming",
      "handwritten",
      "fluid"
    ],
    "practical_contexts": [
      "branding",
      "packaging",
      "invitations",
      "website design",
      "logos",
      "letterheads",
      "social media graphics",
      "editorial design"
    ],
    "cultural_intuition": [
      "evokes a sense of handwritten elegance",
      "reminiscent of classic calligraphy",
      "suggests a playful and sophisticated personality",
      "captures a sense of charm and whimsy",
      "ideal for projects that require a touch of personality"
    ],
    "search_keywords": [
      "script typeface",
      "handwritten",
      "elegant",
      "playful",
      "sophisticated",
      "flowing strokes",
      "curves",
      "flourishes",
      "versatile",
      "branding",
      "packaging",
      "invitations",
      "website design",
      "logos",
      "letterheads",
      "social media graphics",
      "editorial design",
      "calligraphy",
      "charm",
      "whimsy",
      "personality",
      "refined",
      "classic",
      "modern",
      "digital",
      "traditional",
      "comprehensive character set",
      "ligatures"
    ]
  }
}