{
  "filename": "little_people_36px.png",
  "status": "success",
  "description": {
    "detailed_description": "This font is a playful and whimsical interpretation of a traditional woodcut style. The glyphs are constructed with a combination of simple geometric shapes and hand-drawn details, creating a charmingly rustic aesthetic. The characters are slightly irregular, with varying stroke widths and a slightly uneven baseline, adding to the hand-crafted feel. The font's overall character is lighthearted and nostalgic, evoking a sense of childhood wonder and folk art. It's well-suited for projects that require a touch of whimsy and a connection to traditional craftsmanship, such as children's books, packaging for artisanal products, or website designs with a vintage feel. While the font's irregular nature might limit its use in large blocks of text, its unique charm makes it ideal for headlines, logos, and decorative elements. The font's cultural associations are strong, referencing a time when hand-drawn illustrations were the primary form of visual communication, and its playful nature evokes a sense of innocence and joy.",
    "technical_characteristics": [
      "Hand-drawn style",
      "Geometric construction",
      "Varying stroke widths",
      "Slightly uneven baseline",
      "Simple, open forms",
      "Limited character set",
      "Limited ligatures"
    ],
    "personality_traits": [
      "Whimsical",
      "Nostalgic",
      "Playful",
      "Rustic",
      "Charming",
      "Hand-crafted",
      "Lighthearted"
    ],
    "practical_contexts": [
      "Children's books",
      "Packaging for artisanal products",
      "Website designs with a vintage feel",
      "Headlines",
      "Logos",
      "Decorative elements"
    ],
    "cultural_intuition": [
      "Folk art",
      "Traditional craftsmanship",
      "Childhood wonder",
      "Vintage aesthetic",
      "Hand-drawn illustrations"
    ],
    "search_keywords": [
      "Woodcut",
      "Hand-drawn",
      "Whimsical",
      "Nostalgic",
      "Playful",
      "Rustic",
      "Charming",
      "Vintage",
      "Folk art",
      "Children's book",
      "Packaging",
      "Logo",
      "Headline",
      "Decorative",
      "Limited character set",
      "Geometric",
      "Uneven baseline",
      "Open forms"
    ]
  }
}