{
  "filename": "lizzard_36px.png",
  "status": "success",
  "description": {
    "detailed_description": "This font, with its intricate, lizard-shaped letterforms, is a playful and whimsical take on blackletter. The organic, flowing lines and exaggerated flourishes create a sense of movement and energy, reminiscent of medieval manuscripts. Each letter is a unique, stylized creature, with the tails and limbs of the lizards forming the letter shapes. The font's high x-height and open counters ensure good legibility, even at smaller sizes. While the overall aesthetic is playful, the font's bold strokes and sharp angles give it a sense of strength and authority. This combination of whimsy and power makes it suitable for a variety of applications, from children's books and fantasy-themed projects to branding for businesses that want to convey a sense of creativity and individuality. The font's cultural associations are rooted in medieval art and folklore, but its playful and contemporary execution gives it a modern feel, making it a unique and versatile choice for designers looking to add a touch of whimsy and personality to their projects.",
    "technical_characteristics": [
      "lizard-shaped letterforms",
      "organic, flowing lines",
      "exaggerated flourishes",
      "high x-height",
      "open counters",
      "bold strokes",
      "sharp angles"
    ],
    "personality_traits": [
      "playful",
      "whimsical",
      "energetic",
      "creative",
      "individualistic",
      "bold",
      "authoritative"
    ],
    "practical_contexts": [
      "children's books",
      "fantasy-themed projects",
      "branding for creative businesses",
      "logos",
      "posters",
      "web design"
    ],
    "cultural_intuition": [
      "medieval manuscripts",
      "folklore",
      "fantasy",
      "whimsy",
      "creativity",
      "individuality"
    ],
    "search_keywords": [
      "blackletter",
      "lizard",
      "whimsical",
      "playful",
      "fantasy",
      "medieval",
      "organic",
      "flowing",
      "bold",
      "creative",
      "individualistic",
      "high x-height",
      "open counters",
      "legibility",
      "children's book",
      "branding",
      "logo",
      "poster",
      "web design"
    ]
  }
}