{
  "filename": "loin_36px.png",
  "status": "success",
  "description": {
    "detailed_description": "This font is a bold and dramatic display typeface that draws inspiration from medieval blackletter styles, but with a contemporary twist. Its construction is based on a series of overlapping strokes, creating a layered and textured effect. The sharp angles and pointed terminals are characteristic of blackletter, but the font's overall proportions are more condensed and modern, giving it a sense of energy and dynamism. The high x-height and open counters ensure good legibility, even at smaller sizes. The font's personality is both powerful and playful, with a hint of rebelliousness. It evokes a sense of history and tradition, but also a sense of modern innovation. Its bold and striking appearance makes it ideal for headlines, logos, and other graphic elements that require a strong visual impact. It's particularly well-suited for projects that aim to convey a sense of power, authority, or even a touch of danger.",
    "technical_characteristics": [
      "overlapping strokes",
      "sharp angles",
      "pointed terminals",
      "condensed proportions",
      "high x-height",
      "open counters"
    ],
    "personality_traits": [
      "bold",
      "dramatic",
      "powerful",
      "playful",
      "rebellious",
      "historic",
      "innovative",
      "striking"
    ],
    "practical_contexts": [
      "headlines",
      "logos",
      "graphic elements",
      "posters",
      "packaging"
    ],
    "cultural_intuition": [
      "medieval blackletter",
      "contemporary design",
      "rebellious spirit",
      "urban culture",
      "street art"
    ],
    "search_keywords": [
      "blackletter",
      "display font",
      "bold",
      "dramatic",
      "medieval",
      "contemporary",
      "layered",
      "textured",
      "sharp",
      "pointed",
      "condensed",
      "high x-height",
      "open counters",
      "legible",
      "powerful",
      "playful",
      "rebellious",
      "historic",
      "innovative",
      "striking",
      "headlines",
      "logos",
      "graphic elements",
      "posters",
      "packaging",
      "urban",
      "street art"
    ]
  }
}