{
  "filename": "loosey_sans_36px.png",
  "status": "success",
  "description": {
    "detailed_description": "Loosey Sans is a playful sans-serif typeface that blends a geometric foundation with rounded details, creating a friendly and approachable personality. The font's construction is based on simple, geometric shapes, evident in the consistent width of strokes and the clean, uncluttered forms. However, the rounded terminals and slightly curved letterforms, particularly in lowercase letters like 'a' and 'g', introduce a sense of warmth and approachability. This balance between geometric precision and rounded softness gives Loosey Sans a unique character, making it suitable for a wide range of applications. The font's high x-height and open counters ensure strong legibility, even at smaller sizes, making it ideal for digital interfaces and web design. Its playful nature makes it suitable for branding, editorial design, and even children's books, while its clean and modern aesthetic ensures it remains relevant in contemporary design contexts. Loosey Sans evokes a sense of optimism and approachability, suggesting a brand that is both playful and professional.",
    "technical_characteristics": [
      "Geometric construction",
      "Rounded terminals",
      "High x-height",
      "Open counters",
      "Consistent stroke width",
      "Slightly curved letterforms",
      "Moderate weight"
    ],
    "personality_traits": [
      "Playful",
      "Approachable",
      "Friendly",
      "Modern",
      "Clean",
      "Optimistic",
      "Professional"
    ],
    "practical_contexts": [
      "Digital interfaces",
      "Web design",
      "Branding",
      "Editorial design",
      "Children's books"
    ],
    "cultural_intuition": [
      "Evokes a sense of optimism and approachability",
      "Suggests a brand that is both playful and professional",
      "Reflects contemporary design trends",
      "Fits well with a modern and digital aesthetic"
    ],
    "search_keywords": [
      "Sans-serif",
      "Geometric",
      "Rounded",
      "Playful",
      "Friendly",
      "Approachable",
      "Modern",
      "Clean",
      "High x-height",
      "Open counters",
      "Legible",
      "Digital",
      "Web",
      "Branding",
      "Editorial",
      "Children's",
      "Optimistic",
      "Professional"
    ]
  }
}