{
  "filename": "lovelyk_36px.png",
  "status": "success",
  "description": {
    "detailed_description": "LoveyK is a playful script font that captures the essence of handwritten text with a touch of whimsy. Its flowing strokes and irregular letterforms create a sense of spontaneity and personality. The font's construction is based on a combination of calligraphic principles and digital manipulation, resulting in a unique blend of organic and geometric elements. The varying stroke weights and subtle curves add visual interest and depth, while the overall structure remains legible and easy to read. LoveyK's character is both charming and approachable, making it suitable for a wide range of applications, from personal branding and social media graphics to children's books and playful packaging. Its informal yet polished aesthetic evokes a sense of warmth and authenticity, suggesting a connection to human expression and creativity. The font's versatility allows it to be used in both large and small sizes, adding a touch of personality to any project.",
    "technical_characteristics": [
      "flowing strokes",
      "irregular letterforms",
      "varying stroke weights",
      "subtle curves",
      "open counters"
    ],
    "personality_traits": [
      "playful",
      "spontaneous",
      "charming",
      "approachable",
      "informal"
    ],
    "practical_contexts": [
      "personal branding",
      "social media graphics",
      "children's books",
      "packaging",
      "handwritten-style typography"
    ],
    "cultural_intuition": [
      "evokes a sense of warmth and authenticity",
      "suggests a connection to human expression",
      "captures the spirit of handwritten communication",
      "reflects a contemporary trend towards personalized design",
      "appeals to a wide audience seeking a friendly and approachable aesthetic"
    ],
    "search_keywords": [
      "script font",
      "handwritten",
      "playful",
      "whimsical",
      "flowing",
      "irregular",
      "organic",
      "geometric",
      "legible",
      "versatile",
      "personal branding",
      "social media",
      "children's books",
      "packaging",
      "handwritten style",
      "warm",
      "authentic",
      "personalized",
      "friendly",
      "approachable"
    ]
  }
}