{
  "filename": "lucky_charms_36px.png",
  "status": "success",
  "description": {
    "detailed_description": "\u201cLucky Charms\u201d is a playful display font that embodies a sense of whimsy and casual charm. Its hand-drawn aesthetic, characterized by uneven strokes and exaggerated letterforms, evokes a sense of spontaneity and personality. The font's construction is loose and organic, with varying stroke weights and a distinct lack of uniformity. This irregularity adds to its charm, creating a sense of authenticity and hand-crafted quality. The font's overall character is friendly and approachable, with a slight hint of mischief. It's reminiscent of handwritten notes or personalized signage, suggesting a sense of informality and personal expression. While its technical limitations might restrict its use in large blocks of text, \u201cLucky Charms\u201d excels in headlines, logos, and short bursts of text where its playful personality can shine. Its cultural associations lean towards a youthful and energetic vibe, reminiscent of childhood memories and playful branding. The font's contemporary relevance lies in its ability to inject a dose of personality and authenticity into digital design, particularly in social media graphics, branding, and playful marketing materials.",
    "technical_characteristics": [
      "Hand-drawn aesthetic",
      "Uneven stroke weights",
      "Exaggerated letterforms",
      "Varying letter heights",
      "Organic construction",
      "Informal letter spacing"
    ],
    "personality_traits": [
      "Playful",
      "Whimsical",
      "Casual",
      "Friendly",
      "Approachable",
      "Energetic",
      "Mischievous"
    ],
    "practical_contexts": [
      "Headlines",
      "Logos",
      "Short bursts of text",
      "Social media graphics",
      "Playful branding"
    ],
    "cultural_intuition": [
      "Childhood memories",
      "Playful branding",
      "Informal communication",
      "Personal expression",
      "Youthful energy"
    ],
    "search_keywords": [
      "Hand-drawn",
      "Display font",
      "Playful",
      "Whimsical",
      "Casual",
      "Informal",
      "Energetic",
      "Youthful",
      "Logo design",
      "Social media",
      "Branding",
      "Headlines",
      "Short text",
      "Display typography",
      "Handwritten",
      "Organic",
      "Uneven",
      "Exaggerated",
      "Charming",
      "Mischievous",
      "Authentic",
      "Spontaneous"
    ]
  }
}