{
  "filename": "luhyouone_36px.png",
  "status": "success",
  "description": {
    "detailed_description": "Luhyouone is a playful script font that captures the energy of handwritten text. Its irregular letterforms, with their varying stroke weights and expressive flourishes, evoke a sense of spontaneity and personality. The font's construction is based on a loose, gestural approach, with letters often appearing as if they were drawn in a single, continuous stroke. This creates a sense of immediacy and authenticity, as if the letters were written directly onto the page. The font's overall character is friendly and approachable, with a touch of whimsy. It's reminiscent of handwritten notes or personal messages, suggesting a casual and informal tone. Luhyouone's versatility makes it suitable for a range of applications, from branding and packaging to social media graphics and website design. Its informal nature makes it ideal for projects that require a touch of personality and authenticity, while its legibility ensures that it can be used effectively in both large and small sizes. The font's cultural associations are rooted in the tradition of handwritten communication, evoking a sense of personal connection and authenticity. It also taps into the contemporary trend of embracing imperfection and individuality, reflecting a desire for genuine and relatable design.",
    "technical_characteristics": [
      "Irregular letterforms",
      "Varying stroke weights",
      "Expressive flourishes",
      "Loose, gestural construction",
      "Single-stroke appearance",
      "Informal baseline",
      "Open counters"
    ],
    "personality_traits": [
      "Playful",
      "Spontaneous",
      "Expressive",
      "Friendly",
      "Approachable",
      "Whimsical",
      "Authentic",
      "Casual",
      "Informal"
    ],
    "practical_contexts": [
      "Branding and packaging",
      "Social media graphics",
      "Website design",
      "Handwritten notes and messages",
      "Informal signage"
    ],
    "cultural_intuition": [
      "Handwritten communication",
      "Personal connection",
      "Authenticity",
      "Imperfection and individuality",
      "Relatable design"
    ],
    "search_keywords": [
      "Script font",
      "Handwritten",
      "Playful",
      "Informal",
      "Casual",
      "Expressive",
      "Authentic",
      "Whimsical",
      "Branding",
      "Packaging",
      "Social media",
      "Website design",
      "Handwritten notes",
      "Personal messages",
      "Irregular letterforms",
      "Varying stroke weights",
      "Flourishes",
      "Loose construction",
      "Open counters",
      "Legibility",
      "Versatility"
    ]
  }
}