{
  "filename": "lumpin_36px.png",
  "status": "success",
  "description": {
    "detailed_description": "Lumpin is a playful and whimsical script font that draws inspiration from both traditional calligraphy and contemporary digital aesthetics. Its rounded forms and flowing strokes create a sense of movement and energy, while the exaggerated curves and playful flourishes add a touch of whimsy. The font's construction is based on a combination of organic and geometric principles, resulting in a unique blend of fluidity and structure. The letterforms are carefully crafted with a focus on legibility, ensuring that the font can be read easily even at small sizes. Lumpin's personality is both charming and energetic, making it ideal for projects that require a touch of fun and personality. Its versatility allows it to be used for a wide range of applications, from branding and packaging to social media graphics and website design. The font's cultural associations evoke a sense of nostalgia and playfulness, reminiscent of vintage children's books and hand-drawn illustrations. Its contemporary relevance lies in its ability to add a touch of personality and charm to digital designs, making it a perfect choice for projects that seek to stand out from the crowd.",
    "technical_characteristics": [
      "Rounded forms",
      "Flowing strokes",
      "Exaggerated curves",
      "Playful flourishes",
      "Organic and geometric construction",
      "High x-height",
      "Open counters"
    ],
    "personality_traits": [
      "Playful",
      "Whimsical",
      "Charming",
      "Energetic",
      "Nostalgic",
      "Hand-drawn",
      "Vintage"
    ],
    "practical_contexts": [
      "Branding and packaging",
      "Social media graphics",
      "Website design",
      "Children's books",
      "Hand-drawn illustrations"
    ],
    "cultural_intuition": [
      "Vintage children's books",
      "Hand-drawn illustrations",
      "Nostalgia",
      "Playfulness",
      "Digital-native design"
    ],
    "search_keywords": [
      "Script font",
      "Playful font",
      "Whimsical font",
      "Rounded forms",
      "Flowing strokes",
      "Exaggerated curves",
      "Playful flourishes",
      "Hand-drawn",
      "Vintage",
      "Nostalgic",
      "Branding",
      "Packaging",
      "Social media",
      "Website design",
      "Children's books",
      "Illustrations",
      "Digital design"
    ]
  }
}