{
  "filename": "macbeth_36px.png",
  "status": "success",
  "description": {
    "detailed_description": "Macbeth is a display typeface that blends a playful, almost cartoonish aesthetic with a touch of vintage charm. Its rounded forms and exaggerated curves give it a whimsical feel, reminiscent of hand-drawn lettering. The font's construction is characterized by a combination of organic and geometric elements, with letters like 'a' and 'o' exhibiting a rounded, almost bubbly quality, while others like 'k' and 'm' maintain a more angular structure. This interplay of styles creates a visual dynamism that keeps the eye engaged. The font's bold weight and generous x-height contribute to its strong legibility, making it suitable for headlines and titles, especially in digital contexts where it can add a touch of personality to web design or mobile interfaces. Macbeth's playful nature and vintage vibes evoke a sense of nostalgia and whimsy, suggesting a connection to classic children's literature or retro-inspired design trends. Its bold presence and playful character make it a suitable choice for projects that require a touch of fun and personality, while its vintage aesthetic adds a layer of depth and charm.",
    "technical_characteristics": [
      "Rounded forms",
      "Exaggerated curves",
      "Organic and geometric construction",
      "Bold weight",
      "Generous x-height"
    ],
    "personality_traits": [
      "Playful",
      "Whimsical",
      "Vintage",
      "Bold",
      "Dynamic"
    ],
    "practical_contexts": [
      "Headlines",
      "Titles",
      "Web design",
      "Mobile interfaces",
      "Display typography"
    ],
    "cultural_intuition": [
      "Nostalgia",
      "Whimsy",
      "Classic children's literature",
      "Retro-inspired design",
      "Digital-native aesthetic"
    ],
    "search_keywords": [
      "Display typeface",
      "Rounded forms",
      "Exaggerated curves",
      "Organic construction",
      "Geometric construction",
      "Bold weight",
      "Generous x-height",
      "Playful",
      "Whimsical",
      "Vintage",
      "Nostalgia",
      "Retro",
      "Headlines",
      "Titles",
      "Web design",
      "Mobile interfaces",
      "Digital typography",
      "Cartoonish",
      "Hand-drawn lettering"
    ]
  }
}