{
  "filename": "machine_36px.png",
  "status": "success",
  "description": {
    "detailed_description": "This font exhibits a strong geometric construction, with sharp angles and a consistent, almost robotic, uniformity across its letterforms. The lowercase letters are particularly striking, with their bold, blocky forms and minimal curves. The overall effect is one of starkness and precision, reminiscent of early digital typography or perhaps even the visual language of a futuristic cityscape. The font's high x-height and open counters contribute to its excellent legibility, making it suitable for both large-scale display and smaller text sizes. However, its bold, angular nature might make it less appropriate for extended reading, especially in smaller sizes. The font's starkness and geometric precision evoke a sense of order and control, suggesting a futuristic or technological context. It could be used effectively for branding, headlines, or interface elements that require a strong visual impact and a sense of authority.",
    "technical_characteristics": [
      "Geometric construction",
      "Sharp angles",
      "Uniformity of letterforms",
      "High x-height",
      "Open counters",
      "Bold weight",
      "Minimal curves"
    ],
    "personality_traits": [
      "Stark",
      "Precise",
      "Bold",
      "Geometric",
      "Authoritative",
      "Futuristic",
      "Technological"
    ],
    "practical_contexts": [
      "Headlines",
      "Branding",
      "Interface elements",
      "Display typography",
      "Short text blocks"
    ],
    "cultural_intuition": [
      "Futuristic cityscape",
      "Early digital typography",
      "Technological advancement",
      "Order and control",
      "Modernity"
    ],
    "search_keywords": [
      "Geometric",
      "Sans-serif",
      "Bold",
      "High x-height",
      "Open counters",
      "Sharp angles",
      "Futuristic",
      "Technological",
      "Modern",
      "Display",
      "Headline",
      "Branding",
      "Interface",
      "Digital",
      "Stark",
      "Precise",
      "Authoritative",
      "Order",
      "Control"
    ]
  }
}