{
  "filename": "made_in_china_36px.png",
  "status": "success",
  "description": {
    "detailed_description": "This font's geometric construction is immediately apparent, with sharp angles and a consistent grid-based structure. The letterforms are bold and blocky, featuring a high x-height and open counters that contribute to strong legibility. The terminals are often squared off, adding to the font's assertive and industrial feel. While the overall design is geometric, subtle curves in characters like 'C' and 'S' introduce a touch of humanity, preventing the font from feeling overly rigid. This balance between geometric precision and subtle organic elements creates a unique character, suggesting both strength and approachability. The font's bold weight and clear forms make it ideal for headlines, logos, and branding applications where a strong visual impact is desired. Its geometric nature also lends itself well to digital interfaces and user experience design, particularly in contexts where clarity and visual hierarchy are paramount. The font's bold, angular forms evoke a sense of power and authority, reminiscent of industrial design and futuristic aesthetics. It suggests a sense of progress and innovation, potentially referencing the rapid technological advancements of the 21st century.",
    "technical_characteristics": [
      "Geometric construction",
      "High x-height",
      "Open counters",
      "Bold weight",
      "Squared terminals",
      "Subtle curves",
      "Consistent grid structure"
    ],
    "personality_traits": [
      "Assertive",
      "Industrial",
      "Bold",
      "Strong",
      "Approachable",
      "Modern",
      "Futuristic"
    ],
    "practical_contexts": [
      "Headlines",
      "Logos",
      "Branding",
      "Digital interfaces",
      "User experience design"
    ],
    "cultural_intuition": [
      "Industrial design",
      "Futuristic aesthetics",
      "Technological advancement",
      "Modernity",
      "Progress"
    ],
    "search_keywords": [
      "Geometric",
      "Sans-serif",
      "Bold",
      "High x-height",
      "Open counters",
      "Squared terminals",
      "Industrial",
      "Modern",
      "Futuristic",
      "Headlines",
      "Logos",
      "Branding",
      "Digital",
      "Interface",
      "User experience",
      "UX",
      "UI",
      "Power",
      "Authority",
      "Progress",
      "Innovation"
    ]
  }
}